DiseaseID	gene_symbol	hgnc_id	gene_url	DiseaseName	disease_url	mode_of_inheritance	dosage_haploinsufficiency_assertion	dosage_triplosensitivity_assertion	dosage_report	dosage_group	gene_disease_validity_assertion_classifications	gene_disease_validity_assertion_reports	gene_disease_validity_gceps	actionability_assertion_classifications	actionability_assertion_reports	actionability_groups
MONDO:0000030	CHRNA2	HGNC:1956	https://search.clinicalgenome.org/kb/genes/HGNC:1956	sleep-related hypermotor epilepsy	https://search.clinicalgenome.org/kb/conditions/MONDO:0000030	Autosomal dominant inheritance					limited evidence (12/25/2020)	https://search.clinicalgenome.org/kb/gene-validity/CGGV:assertion_0f832b8a-af5a-494e-bfdb-70cc619addf1-2020-12-25T015652.186Z	Epilepsy			
MONDO:0000152	SLC25A19	HGNC:14409	https://search.clinicalgenome.org/kb/genes/HGNC:14409	thiamine-responsive dysfunction syndrome	https://search.clinicalgenome.org/kb/conditions/MONDO:0000152		30 - Gene Associated with Autosomal Recessive Phenotype (08/22/2016)	0 - No Evidence for Haploinsufficiency (08/22/2016)	https://search.clinicalgenome.org/kb/gene-dosage/HGNC:14409	Dosage Working Group						
MONDO:0000188	SLC2A1	HGNC:11005	https://search.clinicalgenome.org/kb/genes/HGNC:11005	GLUT1 deficiency syndrome	https://search.clinicalgenome.org/kb/conditions/MONDO:0000188	Autosomal dominant inheritance	3 - Sufficient Evidence for Haploinsufficiency (03/24/2016)	0 - No Evidence for Haploinsufficiency (03/24/2016)	https://search.clinicalgenome.org/kb/gene-dosage/HGNC:11005	Dosage Working Group	definitive evidence (04/18/2019)	https://search.clinicalgenome.org/kb/gene-validity/CGGV:assertion_a20a0bc0-49d5-41fc-9507-cec19a43bd81-2019-04-18T123454.696Z	Intellectual Disability and Autism			
MONDO:0000208	TRMT10A	HGNC:28403	https://search.clinicalgenome.org/kb/genes/HGNC:28403	microcephaly, short stature, and impaired glucose metabolism 1	https://search.clinicalgenome.org/kb/conditions/MONDO:0000208		30 - Gene Associated with Autosomal Recessive Phenotype (08/22/2016)	0 - No Evidence for Haploinsufficiency (08/22/2016)	https://search.clinicalgenome.org/kb/gene-dosage/HGNC:28403	Dosage Working Group						
MONDO:0000448	SDHA	HGNC:10680	https://search.clinicalgenome.org/kb/genes/HGNC:10680	paraganglioma	https://search.clinicalgenome.org/kb/conditions/MONDO:0000448									Moderate Actionability (10/31/2017)	https://search.clinicalgenome.org/kb/gene-validity/https://actionability.clinicalgenome.org/ac/Adult/ui/stg2SummaryRpt?doc=AC150	Adult Actionability Working Group
MONDO:0000453	CACNA1C	HGNC:1390	https://search.clinicalgenome.org/kb/genes/HGNC:1390	short QT syndrome	https://search.clinicalgenome.org/kb/conditions/MONDO:0000453	Autosomal dominant inheritance	1 - Little Evidence for Haploinsufficiency (03/24/2016)	0 - No Evidence for Haploinsufficiency (03/24/2016)	https://search.clinicalgenome.org/kb/gene-dosage/HGNC:1390	Dosage Working Group	disputing (08/03/2020)	https://search.clinicalgenome.org/kb/gene-validity/CGGV:assertion_51dae85e-8745-48c1-8fb9-cabc2501d3fb-2020-08-03T160000.000Z	Short QT Syndrome			
MONDO:0000507	VCP	HGNC:12666	https://search.clinicalgenome.org/kb/genes/HGNC:12666	inclusion body myopathy with Paget disease of bone and frontotemporal dementia	https://search.clinicalgenome.org/kb/conditions/MONDO:0000507	Autosomal dominant inheritance					definitive evidence (12/23/2021)	https://search.clinicalgenome.org/kb/gene-validity/CGGV:assertion_6ea2bc4d-3b58-4b59-a5bc-9d8a96c452cb-2021-12-23T223510.433Z	Amyotrophic Lateral Sclerosis Spectrum Disorders			
MONDO:0000508	ACTB	HGNC:132	https://search.clinicalgenome.org/kb/genes/HGNC:132	syndromic intellectual disability	https://search.clinicalgenome.org/kb/conditions/MONDO:0000508		0 - No Evidence for Haploinsufficiency (02/08/2022)	0 - No Evidence for Haploinsufficiency (02/08/2022)	https://search.clinicalgenome.org/kb/gene-dosage/HGNC:132	Dosage Working Group						
MONDO:0000509	PRSS12	HGNC:9477	https://search.clinicalgenome.org/kb/genes/HGNC:9477	non-syndromic intellectual disability	https://search.clinicalgenome.org/kb/conditions/MONDO:0000509	Autosomal recessive inheritance					limited evidence (08/04/2021)	https://search.clinicalgenome.org/kb/gene-validity/CGGV:assertion_d98f99d6-b1df-4cad-a53b-c94cfb532167-2021-08-04T160000.000Z	Intellectual Disability and Autism			
MONDO:0000572	RAG1	HGNC:9831	https://search.clinicalgenome.org/kb/genes/HGNC:9831	recombinase activating gene 1 deficiency	https://search.clinicalgenome.org/kb/conditions/MONDO:0000572	Autosomal recessive inheritance	30 - Gene Associated with Autosomal Recessive Phenotype (08/22/2016)		https://search.clinicalgenome.org/kb/gene-dosage/HGNC:9831	Dosage Working Group	definitive evidence (06/17/2021)	https://search.clinicalgenome.org/kb/gene-validity/CGGV:assertion_f08ada81-650b-4764-99e4-f3156f67cbc9-2021-06-17T160000.000Z	SCID-CID			
MONDO:0000573	RAG2	HGNC:9832	https://search.clinicalgenome.org/kb/genes/HGNC:9832	recombinase activating gene 2 deficiency	https://search.clinicalgenome.org/kb/conditions/MONDO:0000573	Autosomal recessive inheritance	30 - Gene Associated with Autosomal Recessive Phenotype (08/22/2016)		https://search.clinicalgenome.org/kb/gene-dosage/HGNC:9832	Dosage Working Group	definitive evidence (08/19/2021)	https://search.clinicalgenome.org/kb/gene-validity/CGGV:assertion_4e9918ba-b94a-4526-bd99-09abef894225-2021-08-19T140520.555Z	SCID-CID			
MONDO:0000591	ACTN2	HGNC:164	https://search.clinicalgenome.org/kb/genes/HGNC:164	intrinsic cardiomyopathy	https://search.clinicalgenome.org/kb/conditions/MONDO:0000591	Autosomal dominant inheritance					moderate evidence (08/06/2018)	https://search.clinicalgenome.org/kb/gene-validity/CGGV:assertion_6710e329-d391-4355-85a5-02d03f8791a3-2018-08-06T130831.379Z	Hypertrophic Cardiomyopathy			
MONDO:0000700	SCN1A	HGNC:10585	https://search.clinicalgenome.org/kb/genes/HGNC:10585	familial hemiplegic migraine	https://search.clinicalgenome.org/kb/conditions/MONDO:0000700	Autosomal dominant inheritance	3 - Sufficient Evidence for Haploinsufficiency (07/06/2012)	0 - No Evidence for Haploinsufficiency (07/06/2012)	https://search.clinicalgenome.org/kb/gene-dosage/HGNC:10585	Dosage Working Group	moderate evidence (09/14/2021)	https://search.clinicalgenome.org/kb/gene-validity/CGGV:assertion_c8c1e158-983d-4547-a739-7781961e5bb8-2021-09-14T163408.306Z	Epilepsy			
MONDO:0000820	CCM2	HGNC:21708	https://search.clinicalgenome.org/kb/genes/HGNC:21708	cerebral cavernous malformation	https://search.clinicalgenome.org/kb/conditions/MONDO:0000820									Assertion Pending (04/04/2017)	https://search.clinicalgenome.org/kb/gene-validity/https://actionability.clinicalgenome.org/ac/Adult/ui/stg2SummaryRpt?doc=AC116	Adult Actionability Working Group
MONDO:0000904	TUBB2B	HGNC:30829	https://search.clinicalgenome.org/kb/genes/HGNC:30829	complex cortical dysplasia with other brain malformations	https://search.clinicalgenome.org/kb/conditions/MONDO:0000904	Autosomal dominant inheritance					definitive evidence (04/26/2020)	https://search.clinicalgenome.org/kb/gene-validity/CGGV:assertion_81ced164-4ef1-4256-a727-84e79930efcc-2020-04-26T040000.000Z	Brain Malformations			
MONDO:0000909	CLCNKA	HGNC:2026	https://search.clinicalgenome.org/kb/genes/HGNC:2026	Bartter disease type 4B	https://search.clinicalgenome.org/kb/conditions/MONDO:0000909		30 - Gene Associated with Autosomal Recessive Phenotype (05/17/2012)	0 - No Evidence for Haploinsufficiency (05/17/2012)	https://search.clinicalgenome.org/kb/gene-dosage/HGNC:2026	Dosage Working Group						
MONDO:0000914	NOTCH3	HGNC:7883	https://search.clinicalgenome.org/kb/genes/HGNC:7883	cerebral arteriopathy, autosomal dominant, with subcortical infarcts and leukoencephalopathy, type 1	https://search.clinicalgenome.org/kb/conditions/MONDO:0000914									Assertion Pending (07/28/2016)	https://search.clinicalgenome.org/kb/gene-validity/https://actionability.clinicalgenome.org/ac/Adult/ui/stg2SummaryRpt?doc=AC099	Adult Actionability Working Group
MONDO:0001071	ANK3	HGNC:494	https://search.clinicalgenome.org/kb/genes/HGNC:494	intellectual disability	https://search.clinicalgenome.org/kb/conditions/MONDO:0001071	Autosomal recessive inheritance					moderate evidence (10/07/2020)	https://search.clinicalgenome.org/kb/gene-validity/CGGV:assertion_668a89e3-477d-434c-8ab4-0bc9ec3504de-2020-10-07T160000.000Z	Intellectual Disability and Autism			
MONDO:0001149	AKT3	HGNC:393	https://search.clinicalgenome.org/kb/genes/HGNC:393	microcephaly	https://search.clinicalgenome.org/kb/conditions/MONDO:0001149	Autosomal dominant inheritance	1 - Little Evidence for Haploinsufficiency (04/15/2016)	0 - No Evidence for Haploinsufficiency (04/15/2016)	https://search.clinicalgenome.org/kb/gene-dosage/HGNC:393	Dosage Working Group	limited evidence (10/26/2021)	https://search.clinicalgenome.org/kb/gene-validity/CGGV:assertion_6e3b524c-5d27-43d6-a0db-4f8f7cf1f872-2021-10-26T150030.155Z	Brain Malformations			
MONDO:0001197	ABCC4	HGNC:55	https://search.clinicalgenome.org/kb/genes/HGNC:55	qualitative platelet defect	https://search.clinicalgenome.org/kb/conditions/MONDO:0001197	Autosomal recessive inheritance					moderate evidence (08/25/2021)	https://search.clinicalgenome.org/kb/gene-validity/CGGV:assertion_2828abac-5b4a-4dad-a703-10c0daf35dbd-2021-08-25T170551.779Z	Hemostasis Thrombosis			
MONDO:0001475	ELANE	HGNC:3309	https://search.clinicalgenome.org/kb/genes/HGNC:3309	neutropenia	https://search.clinicalgenome.org/kb/conditions/MONDO:0001475	Autosomal dominant inheritance					definitive evidence (05/14/2020)	https://search.clinicalgenome.org/kb/gene-validity/CGGV:assertion_259c43d2-b114-43bd-9e4e-a7beeb644323-2020-05-14T000924.456Z	Hereditary Cancer			
MONDO:0001586	IDUA	HGNC:5391	https://search.clinicalgenome.org/kb/genes/HGNC:5391	mucopolysaccharidosis type 1	https://search.clinicalgenome.org/kb/conditions/MONDO:0001586	Autosomal recessive inheritance	30 - Gene Associated with Autosomal Recessive Phenotype (08/22/2016)		https://search.clinicalgenome.org/kb/gene-dosage/HGNC:5391	Dosage Working Group	definitive evidence (05/27/2020)	https://search.clinicalgenome.org/kb/gene-validity/CGGV:assertion_042f8964-a8e1-4880-b873-73460088e8bf-2020-05-27T160000.000Z	General Gene Curation	Moderate Actionability (08/08/2018)	https://search.clinicalgenome.org/kb/gene-validity/https://actionability.clinicalgenome.org/ac/Pediatric/ui/stg2SummaryRpt?doc=AC006	Pediatric Actionability Working Group
MONDO:0001734	TSC1	HGNC:12362	https://search.clinicalgenome.org/kb/genes/HGNC:12362	tuberous sclerosis	https://search.clinicalgenome.org/kb/conditions/MONDO:0001734	Autosomal dominant inheritance	3 - Sufficient Evidence for Haploinsufficiency (10/13/2020)	0 - No Evidence for Haploinsufficiency (10/13/2020)	https://search.clinicalgenome.org/kb/gene-dosage/HGNC:12362	Dosage Working Group	definitive evidence (01/23/2019)	https://search.clinicalgenome.org/kb/gene-validity/CGGV:assertion_61b07bb0-1385-4344-8b6c-571f6a271000-2019-01-23T170000.000Z	General Gene Curation	Assertion Pending (07/21/2015)	https://search.clinicalgenome.org/kb/gene-validity/https://actionability.clinicalgenome.org/ac/Adult/ui/stg2SummaryRpt?doc=AC026	Adult Actionability Working Group
MONDO:0001761	G6PD	HGNC:4057	https://search.clinicalgenome.org/kb/genes/HGNC:4057	favism	https://search.clinicalgenome.org/kb/conditions/MONDO:0001761									Moderate Actionability (08/18/2021) | Moderate Actionability (08/18/2021)	https://search.clinicalgenome.org/kb/gene-validity/https://actionability.clinicalgenome.org/ac/Adult/ui/stg2SummaryRpt?doc=AC1043 | https://search.clinicalgenome.org/kb/gene-validity/https://actionability.clinicalgenome.org/ac/Pediatric/ui/stg2SummaryRpt?doc=AC1043	Adult Actionability Working Group | Pediatric Actionability Working Group
MONDO:0001999	BMPR2	HGNC:1078	https://search.clinicalgenome.org/kb/genes/HGNC:1078	primary pulmonary hypertension	https://search.clinicalgenome.org/kb/conditions/MONDO:0001999		3 - Sufficient Evidence for Haploinsufficiency (08/26/2020)	0 - No Evidence for Haploinsufficiency (08/26/2020)	https://search.clinicalgenome.org/kb/gene-dosage/HGNC:1078	Dosage Working Group				Moderate Actionability (09/11/2017)	https://search.clinicalgenome.org/kb/gene-validity/https://actionability.clinicalgenome.org/ac/Adult/ui/stg2SummaryRpt?doc=AC146	Adult Actionability Working Group
MONDO:0002244	F7	HGNC:3544	https://search.clinicalgenome.org/kb/genes/HGNC:3544	factor VII deficiency	https://search.clinicalgenome.org/kb/conditions/MONDO:0002244	Autosomal recessive inheritance	30 - Gene Associated with Autosomal Recessive Phenotype (08/22/2016)		https://search.clinicalgenome.org/kb/gene-dosage/HGNC:3544	Dosage Working Group	definitive evidence (07/24/2019)	https://search.clinicalgenome.org/kb/gene-validity/CGGV:assertion_43fb4e99-e97a-4d9c-af11-79c2b09ecd2e-2019-07-24T160000.000Z	Hemostasis Thrombosis	Strong Actionability (05/29/2021) | Strong Actionability (05/29/2021)	https://search.clinicalgenome.org/kb/gene-validity/https://actionability.clinicalgenome.org/ac/Adult/ui/stg2SummaryRpt?doc=AC1038 | https://search.clinicalgenome.org/kb/gene-validity/https://actionability.clinicalgenome.org/ac/Pediatric/ui/stg2SummaryRpt?doc=AC1038	Adult Actionability Working Group | Pediatric Actionability Working Group
MONDO:0002413	SLC37A4	HGNC:4061	https://search.clinicalgenome.org/kb/genes/HGNC:4061	glycogen storage disease I	https://search.clinicalgenome.org/kb/conditions/MONDO:0002413		30 - Gene Associated with Autosomal Recessive Phenotype (08/22/2016)	0 - No Evidence for Haploinsufficiency (08/22/2016)	https://search.clinicalgenome.org/kb/gene-dosage/HGNC:4061	Dosage Working Group						
MONDO:0002441	KCNQ1	HGNC:6294	https://search.clinicalgenome.org/kb/genes/HGNC:6294	Jervell and Lange-Nielsen syndrome	https://search.clinicalgenome.org/kb/conditions/MONDO:0002441	Autosomal recessive inheritance	3 - Sufficient Evidence for Haploinsufficiency (10/13/2020)	0 - No Evidence for Haploinsufficiency (10/13/2020)	https://search.clinicalgenome.org/kb/gene-dosage/HGNC:6294	Dosage Working Group	definitive evidence (12/19/2017)	https://search.clinicalgenome.org/kb/gene-validity/CGGV:assertion_2cb5cd32-6663-48bc-b8b0-3b9ca34e2cb7-2017-12-19T050000.000Z	Hearing Loss			
MONDO:0002442	AKAP9	HGNC:379	https://search.clinicalgenome.org/kb/genes/HGNC:379	long QT syndrome	https://search.clinicalgenome.org/kb/conditions/MONDO:0002442	Autosomal dominant inheritance					disputing (12/15/2020)	https://search.clinicalgenome.org/kb/gene-validity/CGGV:assertion_786eac72-8014-4fdf-b279-10a5faaa09b8-2020-12-15T002607.349Z	Long QT Syndrome			
MONDO:0002457	TCOF1	HGNC:11654	https://search.clinicalgenome.org/kb/genes/HGNC:11654	Treacher-Collins syndrome	https://search.clinicalgenome.org/kb/conditions/MONDO:0002457	Autosomal dominant inheritance	3 - Sufficient Evidence for Haploinsufficiency (04/28/2021)	0 - No Evidence for Haploinsufficiency (04/28/2021)	https://search.clinicalgenome.org/kb/gene-dosage/HGNC:11654	Dosage Working Group	definitive evidence (09/17/2019)	https://search.clinicalgenome.org/kb/gene-validity/CGGV:assertion_3f91c5fe-8e58-4c98-9878-e428e2e41dd7-2019-09-17T160000.000Z	Hearing Loss			
MONDO:0003582	BRCA1	HGNC:1100	https://search.clinicalgenome.org/kb/genes/HGNC:1100	hereditary breast ovarian cancer syndrome	https://search.clinicalgenome.org/kb/conditions/MONDO:0003582		3 - Sufficient Evidence for Haploinsufficiency (09/23/2021)	0 - No Evidence for Haploinsufficiency (09/23/2021)	https://search.clinicalgenome.org/kb/gene-dosage/HGNC:1100	Dosage Working Group				Has Insufficient Evidence for Actionability Based on Early Rule-out (09/15/2021) | Definitive Actionability (01/28/2014)	https://search.clinicalgenome.org/kb/gene-validity/https://actionability.clinicalgenome.org/ac/Pediatric/ui/stg2SummaryRpt?doc=AC133 | https://search.clinicalgenome.org/kb/gene-validity/https://actionability.clinicalgenome.org/ac/Adult/ui/stg2SummaryRpt?doc=AC133	Pediatric Actionability Working Group | Adult Actionability Working Group
MONDO:0003789	MET	HGNC:7029	https://search.clinicalgenome.org/kb/genes/HGNC:7029	hereditary papillary renal cell carcinoma	https://search.clinicalgenome.org/kb/conditions/MONDO:0003789		0 - No Evidence for Haploinsufficiency (09/06/2012)	0 - No Evidence for Haploinsufficiency (09/06/2012)	https://search.clinicalgenome.org/kb/gene-dosage/HGNC:7029	Dosage Working Group				Assertion Pending (10/17/2016) | Has Insufficient Evidence for Actionability Based on Early Rule-out (06/02/2021)	https://search.clinicalgenome.org/kb/gene-validity/https://actionability.clinicalgenome.org/ac/Adult/ui/stg2SummaryRpt?doc=AC091 | https://search.clinicalgenome.org/kb/gene-validity/https://actionability.clinicalgenome.org/ac/Pediatric/ui/stg2SummaryRpt?doc=AC091	Adult Actionability Working Group | Pediatric Actionability Working Group
MONDO:0004691	DNAJB11	HGNC:14889	https://search.clinicalgenome.org/kb/genes/HGNC:14889	autosomal dominant polycystic kidney disease	https://search.clinicalgenome.org/kb/conditions/MONDO:0004691									Moderate Actionability (11/05/2018)	https://search.clinicalgenome.org/kb/gene-validity/https://actionability.clinicalgenome.org/ac/Adult/ui/stg2SummaryRpt?doc=AC037	Adult Actionability Working Group
MONDO:0004976	DAO	HGNC:2671	https://search.clinicalgenome.org/kb/genes/HGNC:2671	amyotrophic lateral sclerosis	https://search.clinicalgenome.org/kb/conditions/MONDO:0004976	Autosomal dominant inheritance					refuting evidence (04/12/2022)	https://search.clinicalgenome.org/kb/gene-validity/CGGV:assertion_35ac00ac-3279-4c7e-89b6-8a75e3cae414-2022-04-12T103808.867Z	Amyotrophic Lateral Sclerosis Spectrum Disorders			
MONDO:0005021	ABCC9	HGNC:60	https://search.clinicalgenome.org/kb/genes/HGNC:60	dilated cardiomyopathy	https://search.clinicalgenome.org/kb/conditions/MONDO:0005021	Autosomal dominant inheritance					limited evidence (11/13/2020)	https://search.clinicalgenome.org/kb/gene-validity/CGGV:assertion_8be22ebc-f0f5-4de5-9c2a-382ebd02c533-2020-11-13T170000.000Z	Dilated Cardiomyopathy			
MONDO:0005027	CACNA1H	HGNC:1395	https://search.clinicalgenome.org/kb/genes/HGNC:1395	epilepsy	https://search.clinicalgenome.org/kb/conditions/MONDO:0005027	Autosomal dominant inheritance					disputing (07/30/2018)	https://search.clinicalgenome.org/kb/gene-validity/CGGV:assertion_c3208279-a38d-4b38-b4f9-3af2610c4936-2018-07-30T040000.000Z	Epilepsy			
MONDO:0005045	ACTA1	HGNC:129	https://search.clinicalgenome.org/kb/genes/HGNC:129	hypertrophic cardiomyopathy	https://search.clinicalgenome.org/kb/conditions/MONDO:0005045	Autosomal dominant inheritance					no known disease relationship (05/01/2020)	https://search.clinicalgenome.org/kb/gene-validity/CGGV:assertion_f2459efe-385d-4056-b7e3-3a4a0c0d5edd-2020-05-01T124447.908Z	Hypertrophic Cardiomyopathy			
MONDO:0005090	SETD1A	HGNC:29010	https://search.clinicalgenome.org/kb/genes/HGNC:29010	schizophrenia	https://search.clinicalgenome.org/kb/conditions/MONDO:0005090		3 - Sufficient Evidence for Haploinsufficiency (02/28/2018)	0 - No Evidence for Haploinsufficiency (02/28/2018)	https://search.clinicalgenome.org/kb/gene-dosage/HGNC:29010	Dosage Working Group						
MONDO:0005180	GBA	HGNC:4177	https://search.clinicalgenome.org/kb/genes/HGNC:4177	Parkinson disease	https://search.clinicalgenome.org/kb/conditions/MONDO:0005180		30 - Gene Associated with Autosomal Recessive Phenotype (08/22/2016)	0 - No Evidence for Haploinsufficiency (08/22/2016)	https://search.clinicalgenome.org/kb/gene-dosage/HGNC:4177	Dosage Working Group				Has Insufficient Evidence for Actionability Based on Early Rule-out (06/21/2021) | Has Insufficient Evidence for Actionability Based on Early Rule-out (06/21/2021)	https://search.clinicalgenome.org/kb/gene-validity/https://actionability.clinicalgenome.org/ac/Adult/ui/stg2SummaryRpt?doc=AC1027 | https://search.clinicalgenome.org/kb/gene-validity/https://actionability.clinicalgenome.org/ac/Pediatric/ui/stg2SummaryRpt?doc=AC1027	Adult Actionability Working Group | Pediatric Actionability Working Group
MONDO:0005212	DICER1	HGNC:17098	https://search.clinicalgenome.org/kb/genes/HGNC:17098	rhabdomyosarcoma	https://search.clinicalgenome.org/kb/conditions/MONDO:0005212		3 - Sufficient Evidence for Haploinsufficiency (02/09/2022)	0 - No Evidence for Haploinsufficiency (02/09/2022)	https://search.clinicalgenome.org/kb/gene-dosage/HGNC:17098	Dosage Working Group				Assertion Pending (05/29/2019) | Moderate Actionability (05/29/2019)	https://search.clinicalgenome.org/kb/gene-validity/https://actionability.clinicalgenome.org/ac/Adult/ui/stg2SummaryRpt?doc=AC002 | https://search.clinicalgenome.org/kb/gene-validity/https://actionability.clinicalgenome.org/ac/Pediatric/ui/stg2SummaryRpt?doc=AC002	Adult Actionability Working Group | Pediatric Actionability Working Group
MONDO:0005233	EGFR	HGNC:3236	https://search.clinicalgenome.org/kb/genes/HGNC:3236	non-small cell lung carcinoma	https://search.clinicalgenome.org/kb/conditions/MONDO:0005233	Autosomal dominant inheritance					definitive evidence (07/30/2020)	https://search.clinicalgenome.org/kb/gene-validity/CGGV:assertion_49342c73-96d7-45ba-9c90-d2d5e5710636-2020-07-30T202207.418Z	Hereditary Cancer			
MONDO:0005258	CDC42BPB	HGNC:1738	https://search.clinicalgenome.org/kb/genes/HGNC:1738	autism spectrum disorder	https://search.clinicalgenome.org/kb/conditions/MONDO:0005258		1 - Little Evidence for Haploinsufficiency (10/24/2018)	0 - No Evidence for Haploinsufficiency (10/24/2018)	https://search.clinicalgenome.org/kb/gene-dosage/HGNC:1738	Dosage Working Group						
MONDO:0005308	CEP164	HGNC:29182	https://search.clinicalgenome.org/kb/genes/HGNC:29182	ciliopathy	https://search.clinicalgenome.org/kb/conditions/MONDO:0005308	Autosomal recessive inheritance	30 - Gene Associated with Autosomal Recessive Phenotype (08/22/2016)	0 - No Evidence for Haploinsufficiency (08/22/2016)	https://search.clinicalgenome.org/kb/gene-dosage/HGNC:29182	Dosage Working Group	definitive evidence (10/27/2021)	https://search.clinicalgenome.org/kb/gene-validity/CGGV:assertion_961b81f6-7ad1-49e2-b675-c035b4d8d35d-2021-10-27T160000.000Z	Kidney Cystic and Ciliopathy Disorders			
MONDO:0005395	GNAO1	HGNC:4389	https://search.clinicalgenome.org/kb/genes/HGNC:4389	movement disorder	https://search.clinicalgenome.org/kb/conditions/MONDO:0005395	Autosomal dominant inheritance					definitive evidence (02/19/2019)	https://search.clinicalgenome.org/kb/gene-validity/CGGV:assertion_418a5a18-3d0e-4cef-84b4-74c5accc0df1-2019-02-19T170000.000Z	Epilepsy			
MONDO:0005501	ATP6AP1	HGNC:868	https://search.clinicalgenome.org/kb/genes/HGNC:868	congenital disorder of glycosylation type II	https://search.clinicalgenome.org/kb/conditions/MONDO:0005501	X-linked inheritance					limited evidence (09/17/2021)	https://search.clinicalgenome.org/kb/gene-validity/CGGV:assertion_c6bfce2b-c20c-40f9-b2f5-d81f76a328f7-2021-09-17T122311.885Z	General Inborn Errors of Metabolism			
MONDO:0005503	ASH1L	HGNC:19088	https://search.clinicalgenome.org/kb/genes/HGNC:19088	developmental disorder of mental health	https://search.clinicalgenome.org/kb/conditions/MONDO:0005503		3 - Sufficient Evidence for Haploinsufficiency (12/27/2017)	0 - No Evidence for Haploinsufficiency (12/27/2017)	https://search.clinicalgenome.org/kb/gene-dosage/HGNC:19088	Dosage Working Group						
MONDO:0005711	ZFPM2	HGNC:16700	https://search.clinicalgenome.org/kb/genes/HGNC:16700	congenital diaphragmatic hernia	https://search.clinicalgenome.org/kb/conditions/MONDO:0005711		1 - Little Evidence for Haploinsufficiency (09/20/2021)	0 - No Evidence for Haploinsufficiency (09/20/2021)	https://search.clinicalgenome.org/kb/gene-dosage/HGNC:16700	Dosage Working Group						
MONDO:0005775	G6PD	HGNC:4057	https://search.clinicalgenome.org/kb/genes/HGNC:4057	G6PD deficiency	https://search.clinicalgenome.org/kb/conditions/MONDO:0005775									Moderate Actionability (08/18/2021) | Moderate Actionability (08/18/2021)	https://search.clinicalgenome.org/kb/gene-validity/https://actionability.clinicalgenome.org/ac/Adult/ui/stg2SummaryRpt?doc=AC1043 | https://search.clinicalgenome.org/kb/gene-validity/https://actionability.clinicalgenome.org/ac/Pediatric/ui/stg2SummaryRpt?doc=AC1043	Adult Actionability Working Group | Pediatric Actionability Working Group
MONDO:0005835	EPCAM	HGNC:11529	https://search.clinicalgenome.org/kb/genes/HGNC:11529	Lynch syndrome	https://search.clinicalgenome.org/kb/conditions/MONDO:0005835		30 - Gene Associated with Autosomal Recessive Phenotype (10/08/2019)	0 - No Evidence for Haploinsufficiency (10/08/2019)	https://search.clinicalgenome.org/kb/gene-dosage/HGNC:11529	Dosage Working Group				Has Insufficient Evidence for Actionability Based on Early Rule-out (09/15/2021) | Definitive Actionability (02/11/2015)	https://search.clinicalgenome.org/kb/gene-validity/https://actionability.clinicalgenome.org/ac/Pediatric/ui/stg2SummaryRpt?doc=AC069 | https://search.clinicalgenome.org/kb/gene-validity/https://actionability.clinicalgenome.org/ac/Adult/ui/stg2SummaryRpt?doc=AC069	Pediatric Actionability Working Group | Adult Actionability Working Group
MONDO:0007029	EYA1	HGNC:3519	https://search.clinicalgenome.org/kb/genes/HGNC:3519	branchio-oto-renal syndrome	https://search.clinicalgenome.org/kb/conditions/MONDO:0007029	Autosomal dominant inheritance	3 - Sufficient Evidence for Haploinsufficiency (08/26/2020)	0 - No Evidence for Haploinsufficiency (08/26/2020)	https://search.clinicalgenome.org/kb/gene-dosage/HGNC:3519	Dosage Working Group	definitive evidence (08/30/2018)	https://search.clinicalgenome.org/kb/gene-validity/CGGV:assertion_dca41ef6-ee63-4b1f-93d3-8b114dafcc58-2018-08-30T144802.507Z	Hearing Loss			
MONDO:0007037	FGFR3	HGNC:3690	https://search.clinicalgenome.org/kb/genes/HGNC:3690	achondroplasia	https://search.clinicalgenome.org/kb/conditions/MONDO:0007037	Autosomal dominant inheritance	0 - No Evidence for Haploinsufficiency (11/09/2011)	0 - No Evidence for Haploinsufficiency (11/09/2011)	https://search.clinicalgenome.org/kb/gene-dosage/HGNC:3690	Dosage Working Group	definitive evidence (12/01/2016)	https://search.clinicalgenome.org/kb/gene-validity/CGGCIEX:assertion_3221	General Gene Curation	Has Insufficient Evidence for Actionability Based on Early Rule-out (01/30/2020) | Has Insufficient Evidence for Actionability Based on Early Rule-out (01/30/2020)	https://search.clinicalgenome.org/kb/gene-validity/https://actionability.clinicalgenome.org/ac/Adult/ui/stg2SummaryRpt?doc=AC1005 | https://search.clinicalgenome.org/kb/gene-validity/https://actionability.clinicalgenome.org/ac/Pediatric/ui/stg2SummaryRpt?doc=AC1005	Adult Actionability Working Group | Pediatric Actionability Working Group
MONDO:0007039	NF2	HGNC:7773	https://search.clinicalgenome.org/kb/genes/HGNC:7773	neurofibromatosis type 2	https://search.clinicalgenome.org/kb/conditions/MONDO:0007039	Autosomal dominant inheritance	3 - Sufficient Evidence for Haploinsufficiency (09/08/2020)	0 - No Evidence for Haploinsufficiency (09/08/2020)	https://search.clinicalgenome.org/kb/gene-dosage/HGNC:7773	Dosage Working Group	definitive evidence (02/27/2019)	https://search.clinicalgenome.org/kb/gene-validity/CGGV:assertion_a185a859-a499-4c4a-bebe-996b16fb3cf3-2019-02-27T170000.000Z	General Gene Curation	Strong Actionability (03/31/2021) | Strong Actionability (03/31/2021)	https://search.clinicalgenome.org/kb/gene-validity/https://actionability.clinicalgenome.org/ac/Adult/ui/stg2SummaryRpt?doc=AC021 | https://search.clinicalgenome.org/kb/gene-validity/https://actionability.clinicalgenome.org/ac/Pediatric/ui/stg2SummaryRpt?doc=AC021	Adult Actionability Working Group | Pediatric Actionability Working Group
MONDO:0007041	FGFR2	HGNC:3689	https://search.clinicalgenome.org/kb/genes/HGNC:3689	apert syndrome	https://search.clinicalgenome.org/kb/conditions/MONDO:0007041	Autosomal dominant inheritance					definitive evidence (12/14/2021)	https://search.clinicalgenome.org/kb/gene-validity/CGGV:assertion_2aa63602-d820-4fee-893b-b807e7b62f28-2021-12-14T221137.192Z	Craniofacial Malformations			
MONDO:0007042	TWIST1	HGNC:12428	https://search.clinicalgenome.org/kb/genes/HGNC:12428	Saethre-Chotzen syndrome	https://search.clinicalgenome.org/kb/conditions/MONDO:0007042	Autosomal dominant inheritance	3 - Sufficient Evidence for Haploinsufficiency (12/16/2020)	0 - No Evidence for Haploinsufficiency (12/16/2020)	https://search.clinicalgenome.org/kb/gene-dosage/HGNC:12428	Dosage Working Group	definitive evidence (01/28/2021)	https://search.clinicalgenome.org/kb/gene-validity/CGGV:assertion_1730a1bb-49c2-4c11-8c45-e8747d8fb91d-2021-01-28T180000.000Z	Craniofacial Malformations			
MONDO:0007043	FGFR2	HGNC:3689	https://search.clinicalgenome.org/kb/genes/HGNC:3689	Pfeiffer syndrome	https://search.clinicalgenome.org/kb/conditions/MONDO:0007043	Autosomal dominant inheritance					definitive evidence (03/21/2022)	https://search.clinicalgenome.org/kb/gene-validity/CGGV:assertion_eccfe56b-15d7-4ba9-abf2-163dfd3dab3c-2022-03-21T210958.425Z	Craniofacial Malformations			
MONDO:0007064	ADA	HGNC:186	https://search.clinicalgenome.org/kb/genes/HGNC:186	severe combined immunodeficiency, autosomal recessive, T cell-negative, B cell-negative, NK cell-negative, due to adenosine deaminase deficiency	https://search.clinicalgenome.org/kb/conditions/MONDO:0007064	Autosomal recessive inheritance					definitive evidence (11/19/2020)	https://search.clinicalgenome.org/kb/gene-validity/CGGV:assertion_664ba77c-3db6-47da-941e-316ac819432a-2020-11-19T170000.000Z	SCID-CID			
MONDO:0007068	ADSL	HGNC:291	https://search.clinicalgenome.org/kb/genes/HGNC:291	adenylosuccinate lyase deficiency	https://search.clinicalgenome.org/kb/conditions/MONDO:0007068	Autosomal recessive inheritance	30 - Gene Associated with Autosomal Recessive Phenotype (11/06/2015)	0 - No Evidence for Haploinsufficiency (11/06/2015)	https://search.clinicalgenome.org/kb/gene-dosage/HGNC:291	Dosage Working Group	definitive evidence (09/07/2020)	https://search.clinicalgenome.org/kb/gene-validity/CGGV:assertion_d282f565-84e4-4a47-9acc-77ee31bbe9f6-2020-09-07T160000.000Z	Intellectual Disability and Autism			
MONDO:0007100	TTR	HGNC:12405	https://search.clinicalgenome.org/kb/genes/HGNC:12405	familial amyloid neuropathy	https://search.clinicalgenome.org/kb/conditions/MONDO:0007100									Strong Actionability (12/23/2019) | Has Insufficient Evidence for Actionability Based on Early Rule-out (10/24/2019)	https://search.clinicalgenome.org/kb/gene-validity/https://actionability.clinicalgenome.org/ac/Adult/ui/stg2SummaryRpt?doc=AC145 | https://search.clinicalgenome.org/kb/gene-validity/https://actionability.clinicalgenome.org/ac/Pediatric/ui/stg2SummaryRpt?doc=AC145	Adult Actionability Working Group | Pediatric Actionability Working Group
MONDO:0007103	SOD1	HGNC:11179	https://search.clinicalgenome.org/kb/genes/HGNC:11179	amyotrophic lateral sclerosis type 1	https://search.clinicalgenome.org/kb/conditions/MONDO:0007103	Autosomal dominant inheritance					definitive evidence (07/13/2021)	https://search.clinicalgenome.org/kb/gene-validity/CGGV:assertion_97d17778-d21e-441f-b4b7-49eccaa8cbab-2021-07-13T192226.690Z	Amyotrophic Lateral Sclerosis Spectrum Disorders			
MONDO:0007105	C9orf72	HGNC:28337	https://search.clinicalgenome.org/kb/genes/HGNC:28337	frontotemporal dementia and/or amyotrophic lateral sclerosis 1	https://search.clinicalgenome.org/kb/conditions/MONDO:0007105	Autosomal dominant inheritance					definitive evidence (09/21/2021)	https://search.clinicalgenome.org/kb/gene-validity/CGGV:assertion_afd5a267-72c8-4a04-8404-4c819efe61c5-2021-09-21T030209.665Z	Amyotrophic Lateral Sclerosis Spectrum Disorders			
MONDO:0007110	RPS19	HGNC:10402	https://search.clinicalgenome.org/kb/genes/HGNC:10402	Diamond-Blackfan anemia 1	https://search.clinicalgenome.org/kb/conditions/MONDO:0007110		3 - Sufficient Evidence for Haploinsufficiency (03/24/2021)	0 - No Evidence for Haploinsufficiency (03/24/2021)	https://search.clinicalgenome.org/kb/gene-dosage/HGNC:10402	Dosage Working Group						
MONDO:0007113	UBE3A	HGNC:12496	https://search.clinicalgenome.org/kb/genes/HGNC:12496	Angelman syndrome	https://search.clinicalgenome.org/kb/conditions/MONDO:0007113	Autosomal dominant inheritance	3 - Sufficient Evidence for Haploinsufficiency (08/23/2012)	0 - No Evidence for Haploinsufficiency (08/23/2012)	https://search.clinicalgenome.org/kb/gene-dosage/HGNC:12496	Dosage Working Group	definitive evidence (05/02/2018)	https://search.clinicalgenome.org/kb/gene-validity/CGGV:assertion_df25de82-ea9a-4d86-8b42-6587a39650e3-2018-05-02T132344.716Z	Rett and Angelman-like Disorders			
MONDO:0007129	MSX1	HGNC:7391	https://search.clinicalgenome.org/kb/genes/HGNC:7391	tooth agenesis, selective, 1	https://search.clinicalgenome.org/kb/conditions/MONDO:0007129		3 - Sufficient Evidence for Haploinsufficiency (01/12/2021)	0 - No Evidence for Haploinsufficiency (01/12/2021)	https://search.clinicalgenome.org/kb/gene-dosage/HGNC:7391	Dosage Working Group						
MONDO:0007134	SOX9	HGNC:11204	https://search.clinicalgenome.org/kb/genes/HGNC:11204	Cooks syndrome	https://search.clinicalgenome.org/kb/conditions/MONDO:0007134	Autosomal dominant inheritance					limited evidence (09/16/2020)	https://search.clinicalgenome.org/kb/gene-validity/CGGV:assertion_a1fdeca1-a725-4ccb-a7f6-e77c2d6158aa-2020-09-16T170000.000Z	Skeletal Disorders			
MONDO:0007160	COL2A1	HGNC:2200	https://search.clinicalgenome.org/kb/genes/HGNC:2200	Stickler syndrome type 1	https://search.clinicalgenome.org/kb/conditions/MONDO:0007160		3 - Sufficient Evidence for Haploinsufficiency (07/29/2020)	0 - No Evidence for Haploinsufficiency (07/29/2020)	https://search.clinicalgenome.org/kb/gene-dosage/HGNC:2200	Dosage Working Group						
MONDO:0007163	CACNA1A	HGNC:1388	https://search.clinicalgenome.org/kb/genes/HGNC:1388	episodic ataxia type 2	https://search.clinicalgenome.org/kb/conditions/MONDO:0007163		3 - Sufficient Evidence for Haploinsufficiency (05/21/2017)	0 - No Evidence for Haploinsufficiency (05/21/2017)	https://search.clinicalgenome.org/kb/gene-dosage/HGNC:1388	Dosage Working Group						
MONDO:0007187	PTCH1	HGNC:9585	https://search.clinicalgenome.org/kb/genes/HGNC:9585	nevoid basal cell carcinoma syndrome	https://search.clinicalgenome.org/kb/conditions/MONDO:0007187	Autosomal dominant inheritance	3 - Sufficient Evidence for Haploinsufficiency (07/01/2020)	0 - No Evidence for Haploinsufficiency (07/01/2020)	https://search.clinicalgenome.org/kb/gene-dosage/HGNC:9585	Dosage Working Group	definitive evidence (06/04/2018)	https://search.clinicalgenome.org/kb/gene-validity/CGGV:assertion_2a3f55f5-e39b-4571-a41f-e46ddb8e298d-2018-06-04T195607.312Z	Hereditary Cancer	Assertion Pending (09/28/2016)	https://search.clinicalgenome.org/kb/gene-validity/https://actionability.clinicalgenome.org/ac/Adult/ui/stg2SummaryRpt?doc=AC087	Adult Actionability Working Group
MONDO:0007201	FOXL2	HGNC:1092	https://search.clinicalgenome.org/kb/genes/HGNC:1092	blepharophimosis, ptosis, and epicanthus inversus syndrome	https://search.clinicalgenome.org/kb/conditions/MONDO:0007201		3 - Sufficient Evidence for Haploinsufficiency (02/09/2021)	0 - No Evidence for Haploinsufficiency (02/09/2021)	https://search.clinicalgenome.org/kb/gene-dosage/HGNC:1092	Dosage Working Group						
MONDO:0007205	MTAP	HGNC:7413	https://search.clinicalgenome.org/kb/genes/HGNC:7413	diaphyseal medullary stenosis-bone malignancy syndrome	https://search.clinicalgenome.org/kb/conditions/MONDO:0007205	Autosomal dominant inheritance	1 - Little Evidence for Haploinsufficiency (10/30/2013)	0 - No Evidence for Haploinsufficiency (10/30/2013)	https://search.clinicalgenome.org/kb/gene-dosage/HGNC:7413	Dosage Working Group	moderate evidence (06/15/2021)	https://search.clinicalgenome.org/kb/gene-validity/CGGV:assertion_3c2243ec-a10f-4aab-aaf9-99153d805455-2021-06-15T232951.915Z	Hereditary Cancer			
MONDO:0007221	GDF5	HGNC:4220	https://search.clinicalgenome.org/kb/genes/HGNC:4220	brachydactyly type C	https://search.clinicalgenome.org/kb/conditions/MONDO:0007221		3 - Sufficient Evidence for Haploinsufficiency (02/24/2021)	0 - No Evidence for Haploinsufficiency (02/24/2021)	https://search.clinicalgenome.org/kb/gene-dosage/HGNC:4220	Dosage Working Group						
MONDO:0007236	EYA1	HGNC:3519	https://search.clinicalgenome.org/kb/genes/HGNC:3519	branchiootorenal syndrome 1	https://search.clinicalgenome.org/kb/conditions/MONDO:0007236		3 - Sufficient Evidence for Haploinsufficiency (08/26/2020)	0 - No Evidence for Haploinsufficiency (08/26/2020)	https://search.clinicalgenome.org/kb/gene-dosage/HGNC:3519	Dosage Working Group						
MONDO:0007251	SOX9	HGNC:11204	https://search.clinicalgenome.org/kb/genes/HGNC:11204	campomelic dysplasia	https://search.clinicalgenome.org/kb/conditions/MONDO:0007251	Autosomal dominant inheritance					definitive evidence (06/01/2020)	https://search.clinicalgenome.org/kb/gene-validity/CGGV:assertion_ca6e2118-28d5-4a6f-8333-ee30994d41cd-2020-06-01T170000.000Z	Skeletal Disorders			
MONDO:0007266	TNNT2	HGNC:11949	https://search.clinicalgenome.org/kb/genes/HGNC:11949	hypertrophic cardiomyopathy 2	https://search.clinicalgenome.org/kb/conditions/MONDO:0007266		0 - No Evidence for Haploinsufficiency (11/16/2015)	0 - No Evidence for Haploinsufficiency (11/16/2015)	https://search.clinicalgenome.org/kb/gene-dosage/HGNC:11949	Dosage Working Group				Assertion Pending (08/14/2017)	https://search.clinicalgenome.org/kb/gene-validity/https://actionability.clinicalgenome.org/ac/Adult/ui/stg2SummaryRpt?doc=AC056	Adult Actionability Working Group
MONDO:0007267	TPM1	HGNC:12010	https://search.clinicalgenome.org/kb/genes/HGNC:12010	hypertrophic cardiomyopathy 3	https://search.clinicalgenome.org/kb/conditions/MONDO:0007267		0 - No Evidence for Haploinsufficiency (11/09/2015)	0 - No Evidence for Haploinsufficiency (11/09/2015)	https://search.clinicalgenome.org/kb/gene-dosage/HGNC:12010	Dosage Working Group				Assertion Pending (08/14/2017)	https://search.clinicalgenome.org/kb/gene-validity/https://actionability.clinicalgenome.org/ac/Adult/ui/stg2SummaryRpt?doc=AC056	Adult Actionability Working Group
MONDO:0007268	MYBPC3	HGNC:7551	https://search.clinicalgenome.org/kb/genes/HGNC:7551	hypertrophic cardiomyopathy 4	https://search.clinicalgenome.org/kb/conditions/MONDO:0007268		3 - Sufficient Evidence for Haploinsufficiency (11/12/2015)	0 - No Evidence for Haploinsufficiency (11/12/2015)	https://search.clinicalgenome.org/kb/gene-dosage/HGNC:7551	Dosage Working Group				Assertion Pending (08/14/2017)	https://search.clinicalgenome.org/kb/gene-validity/https://actionability.clinicalgenome.org/ac/Adult/ui/stg2SummaryRpt?doc=AC056	Adult Actionability Working Group
MONDO:0007269	LMNA	HGNC:6636	https://search.clinicalgenome.org/kb/genes/HGNC:6636	dilated cardiomyopathy 1A	https://search.clinicalgenome.org/kb/conditions/MONDO:0007269		2 - Emerging Evidence for Haploinsufficiency (01/18/2016)	0 - No Evidence for Haploinsufficiency (01/18/2016)	https://search.clinicalgenome.org/kb/gene-dosage/HGNC:6636	Dosage Working Group				Assertion Pending (08/14/2017)	https://search.clinicalgenome.org/kb/gene-validity/https://actionability.clinicalgenome.org/ac/Adult/ui/stg2SummaryRpt?doc=AC138	Adult Actionability Working Group
MONDO:0007270	TNNI3	HGNC:11947	https://search.clinicalgenome.org/kb/genes/HGNC:11947	cardiomyopathy, familial restrictive, 1	https://search.clinicalgenome.org/kb/conditions/MONDO:0007270		1 - Little Evidence for Haploinsufficiency (11/20/2015)	0 - No Evidence for Haploinsufficiency (11/20/2015)	https://search.clinicalgenome.org/kb/gene-dosage/HGNC:11947	Dosage Working Group						
MONDO:0007273	SDHB	HGNC:10681	https://search.clinicalgenome.org/kb/genes/HGNC:10681	paragangliomas 4	https://search.clinicalgenome.org/kb/conditions/MONDO:0007273		3 - Sufficient Evidence for Haploinsufficiency (07/22/2020)	0 - No Evidence for Haploinsufficiency (07/22/2020)	https://search.clinicalgenome.org/kb/gene-dosage/HGNC:10681	Dosage Working Group				Strong Actionability (10/31/2017)	https://search.clinicalgenome.org/kb/gene-validity/https://actionability.clinicalgenome.org/ac/Adult/ui/stg2SummaryRpt?doc=AC150	Adult Actionability Working Group
MONDO:0007293	ITGB2	HGNC:6155	https://search.clinicalgenome.org/kb/genes/HGNC:6155	leukocyte adhesion deficiency 1	https://search.clinicalgenome.org/kb/conditions/MONDO:0007293		30 - Gene Associated with Autosomal Recessive Phenotype (08/22/2016)		https://search.clinicalgenome.org/kb/gene-dosage/HGNC:6155	Dosage Working Group						
MONDO:0007298	ITPR1	HGNC:6180	https://search.clinicalgenome.org/kb/genes/HGNC:6180	spinocerebellar ataxia type 29	https://search.clinicalgenome.org/kb/conditions/MONDO:0007298	Autosomal dominant inheritance					definitive evidence (11/03/2021)	https://search.clinicalgenome.org/kb/gene-validity/CGGV:assertion_8b938bea-6fcb-46e1-9435-99303d59740e-2021-11-03T160000.000Z	Intellectual Disability and Autism			
MONDO:0007299	NSD1	HGNC:14234	https://search.clinicalgenome.org/kb/genes/HGNC:14234	Sotos syndrome 1	https://search.clinicalgenome.org/kb/conditions/MONDO:0007299		3 - Sufficient Evidence for Haploinsufficiency (07/27/2020)	0 - No Evidence for Haploinsufficiency (07/27/2020)	https://search.clinicalgenome.org/kb/gene-dosage/HGNC:14234	Dosage Working Group						
MONDO:0007307	MPZ	HGNC:7225	https://search.clinicalgenome.org/kb/genes/HGNC:7225	Charcot-Marie-Tooth disease type 1B	https://search.clinicalgenome.org/kb/conditions/MONDO:0007307									Assertion Pending (12/20/2017)	https://search.clinicalgenome.org/kb/gene-validity/https://actionability.clinicalgenome.org/ac/Adult/ui/stg2SummaryRpt?doc=AC129	Adult Actionability Working Group
MONDO:0007308	KIF1B	HGNC:16636	https://search.clinicalgenome.org/kb/genes/HGNC:16636	Charcot-Marie-Tooth disease type 2A1	https://search.clinicalgenome.org/kb/conditions/MONDO:0007308	Autosomal dominant inheritance					no known disease relationship (10/05/2020)	https://search.clinicalgenome.org/kb/gene-validity/CGGV:assertion_ae6ffeae-9609-47bf-89a9-4863cf6ef05c-2020-10-05T161930.420Z	Charcot-Marie-Tooth			
MONDO:0007309	PMP22	HGNC:9118	https://search.clinicalgenome.org/kb/genes/HGNC:9118	Charcot-Marie-Tooth disease type 1A	https://search.clinicalgenome.org/kb/conditions/MONDO:0007309		3 - Sufficient Evidence for Haploinsufficiency (07/12/2012)	0 - No Evidence for Haploinsufficiency (07/12/2012)	https://search.clinicalgenome.org/kb/gene-dosage/HGNC:9118	Dosage Working Group				Assertion Pending (12/20/2017)	https://search.clinicalgenome.org/kb/gene-validity/https://actionability.clinicalgenome.org/ac/Adult/ui/stg2SummaryRpt?doc=AC129	Adult Actionability Working Group
MONDO:0007311	PMP22	HGNC:9118	https://search.clinicalgenome.org/kb/genes/HGNC:9118	Charcot-Marie-Tooth disease type 1E	https://search.clinicalgenome.org/kb/conditions/MONDO:0007311		3 - Sufficient Evidence for Haploinsufficiency (07/12/2012)	0 - No Evidence for Haploinsufficiency (07/12/2012)	https://search.clinicalgenome.org/kb/gene-dosage/HGNC:9118	Dosage Working Group				Assertion Pending (12/20/2017)	https://search.clinicalgenome.org/kb/gene-validity/https://actionability.clinicalgenome.org/ac/Adult/ui/stg2SummaryRpt?doc=AC129	Adult Actionability Working Group
MONDO:0007333	IRF6	HGNC:6121	https://search.clinicalgenome.org/kb/genes/HGNC:6121	van der Woude syndrome 1	https://search.clinicalgenome.org/kb/conditions/MONDO:0007333		3 - Sufficient Evidence for Haploinsufficiency (07/06/2012)	0 - No Evidence for Haploinsufficiency (07/06/2012)	https://search.clinicalgenome.org/kb/gene-dosage/HGNC:6121	Dosage Working Group						
MONDO:0007336	SATB2	HGNC:21637	https://search.clinicalgenome.org/kb/genes/HGNC:21637	isolated cleft palate	https://search.clinicalgenome.org/kb/conditions/MONDO:0007336		3 - Sufficient Evidence for Haploinsufficiency (07/15/2020)	0 - No Evidence for Haploinsufficiency (07/15/2020)	https://search.clinicalgenome.org/kb/gene-dosage/HGNC:21637	Dosage Working Group						
MONDO:0007352	PAX2	HGNC:8616	https://search.clinicalgenome.org/kb/genes/HGNC:8616	renal coloboma syndrome	https://search.clinicalgenome.org/kb/conditions/MONDO:0007352		3 - Sufficient Evidence for Haploinsufficiency (02/26/2020)	0 - No Evidence for Haploinsufficiency (02/26/2020)	https://search.clinicalgenome.org/kb/gene-dosage/HGNC:8616	Dosage Working Group						
MONDO:0007355	YAP1	HGNC:16262	https://search.clinicalgenome.org/kb/genes/HGNC:16262	uveal coloboma-cleft lip and palate-intellectual disability	https://search.clinicalgenome.org/kb/conditions/MONDO:0007355		1 - Little Evidence for Haploinsufficiency (11/13/2014)	0 - No Evidence for Haploinsufficiency (11/13/2014)	https://search.clinicalgenome.org/kb/gene-dosage/HGNC:16262	Dosage Working Group						
MONDO:0007356	MSH2	HGNC:7325	https://search.clinicalgenome.org/kb/genes/HGNC:7325	Lynch syndrome 1	https://search.clinicalgenome.org/kb/conditions/MONDO:0007356		3 - Sufficient Evidence for Haploinsufficiency (10/13/2021)	0 - No Evidence for Haploinsufficiency (10/13/2021)	https://search.clinicalgenome.org/kb/gene-dosage/HGNC:7325	Dosage Working Group				Has Insufficient Evidence for Actionability Based on Early Rule-out (09/15/2021) | Definitive Actionability (02/11/2015)	https://search.clinicalgenome.org/kb/gene-validity/https://actionability.clinicalgenome.org/ac/Pediatric/ui/stg2SummaryRpt?doc=AC069 | https://search.clinicalgenome.org/kb/gene-validity/https://actionability.clinicalgenome.org/ac/Adult/ui/stg2SummaryRpt?doc=AC069	Pediatric Actionability Working Group | Adult Actionability Working Group
MONDO:0007365	KCNQ2	HGNC:6296	https://search.clinicalgenome.org/kb/genes/HGNC:6296	seizures, benign familial neonatal, 1	https://search.clinicalgenome.org/kb/conditions/MONDO:0007365		3 - Sufficient Evidence for Haploinsufficiency (07/18/2013)	0 - No Evidence for Haploinsufficiency (07/18/2013)	https://search.clinicalgenome.org/kb/gene-dosage/HGNC:6296	Dosage Working Group						
MONDO:0007387	NIPBL	HGNC:28862	https://search.clinicalgenome.org/kb/genes/HGNC:28862	Cornelia de Lange syndrome 1	https://search.clinicalgenome.org/kb/conditions/MONDO:0007387		3 - Sufficient Evidence for Haploinsufficiency (08/26/2020)	1 - Little Evidence for Haploinsufficiency (08/26/2020)	https://search.clinicalgenome.org/kb/gene-dosage/HGNC:28862	Dosage Working Group						
MONDO:0007399	TWIST1	HGNC:12428	https://search.clinicalgenome.org/kb/genes/HGNC:12428	TWIST1-related craniosynostosis	https://search.clinicalgenome.org/kb/conditions/MONDO:0007399	Autosomal dominant inheritance	3 - Sufficient Evidence for Haploinsufficiency (12/16/2020)	0 - No Evidence for Haploinsufficiency (12/16/2020)	https://search.clinicalgenome.org/kb/gene-dosage/HGNC:12428	Dosage Working Group	moderate evidence (06/10/2021)	https://search.clinicalgenome.org/kb/gene-validity/CGGV:assertion_bda425f8-b760-4484-9336-b3e572d402ab-2021-06-10T160000.000Z	Craniofacial Malformations			
MONDO:0007405	FGFR2	HGNC:3689	https://search.clinicalgenome.org/kb/genes/HGNC:3689	Crouzon syndrome	https://search.clinicalgenome.org/kb/conditions/MONDO:0007405	Autosomal dominant inheritance					definitive evidence (12/23/2021)	https://search.clinicalgenome.org/kb/gene-validity/CGGV:assertion_c2cfa70a-750f-4357-98b9-f5c30ca4dc26-2021-12-23T165345.170Z	Craniofacial Malformations			
MONDO:0007412	FGFR2	HGNC:3689	https://search.clinicalgenome.org/kb/genes/HGNC:3689	Beare-Stevenson cutis gyrata syndrome	https://search.clinicalgenome.org/kb/conditions/MONDO:0007412	Autosomal dominant inheritance					definitive evidence (03/31/2022)	https://search.clinicalgenome.org/kb/gene-validity/CGGV:assertion_7805e806-44ee-4339-a078-d62c204bff00-2022-03-31T163711.748Z	Craniofacial Malformations			
MONDO:0007432	NOTCH3	HGNC:7883	https://search.clinicalgenome.org/kb/genes/HGNC:7883	cerebral arteriopathy with subcortical infarcts and leukoencephalopathy	https://search.clinicalgenome.org/kb/conditions/MONDO:0007432									Assertion Pending (07/28/2016)	https://search.clinicalgenome.org/kb/gene-validity/https://actionability.clinicalgenome.org/ac/Adult/ui/stg2SummaryRpt?doc=AC099	Adult Actionability Working Group
MONDO:0007436	SMOC2	HGNC:20323	https://search.clinicalgenome.org/kb/genes/HGNC:20323	dentin dysplasia type I	https://search.clinicalgenome.org/kb/conditions/MONDO:0007436		30 - Gene Associated with Autosomal Recessive Phenotype (08/22/2016)	0 - No Evidence for Haploinsufficiency (08/22/2016)	https://search.clinicalgenome.org/kb/gene-dosage/HGNC:20323	Dosage Working Group						
MONDO:0007471	EFEMP1	HGNC:3218	https://search.clinicalgenome.org/kb/genes/HGNC:3218	Doyne honeycomb retinal dystrophy	https://search.clinicalgenome.org/kb/conditions/MONDO:0007471	Autosomal dominant inheritance					definitive evidence (08/05/2021)	https://search.clinicalgenome.org/kb/gene-validity/CGGV:assertion_2859008e-eeb1-4af4-8a6e-1bf5372bb3ab-2021-08-05T160000.000Z	Retina			
MONDO:0007481	SHOX	HGNC:10853	https://search.clinicalgenome.org/kb/genes/HGNC:10853	Leri-Weill dyschondrosteosis	https://search.clinicalgenome.org/kb/conditions/MONDO:0007481		3 - Sufficient Evidence for Haploinsufficiency (10/15/2015)	0 - No Evidence for Haploinsufficiency (10/15/2015)	https://search.clinicalgenome.org/kb/gene-dosage/HGNC:10853	Dosage Working Group						
MONDO:0007495	GCH1	HGNC:4193	https://search.clinicalgenome.org/kb/genes/HGNC:4193	dystonia 5	https://search.clinicalgenome.org/kb/conditions/MONDO:0007495		3 - Sufficient Evidence for Haploinsufficiency (05/12/2016)	0 - No Evidence for Haploinsufficiency (05/12/2016)	https://search.clinicalgenome.org/kb/gene-dosage/HGNC:4193	Dosage Working Group				Assertion Pending (04/04/2017)	https://search.clinicalgenome.org/kb/gene-validity/https://actionability.clinicalgenome.org/ac/Adult/ui/stg2SummaryRpt?doc=AC128	Adult Actionability Working Group
MONDO:0007510	GJB6	HGNC:4288	https://search.clinicalgenome.org/kb/genes/HGNC:4288	Clouston syndrome	https://search.clinicalgenome.org/kb/conditions/MONDO:0007510	Autosomal dominant inheritance	0 - No Evidence for Haploinsufficiency (01/30/2014)	0 - No Evidence for Haploinsufficiency (01/30/2014)	https://search.clinicalgenome.org/kb/gene-dosage/HGNC:4288	Dosage Working Group	definitive evidence (04/17/2018)	https://search.clinicalgenome.org/kb/gene-validity/CGGV:assertion_ff18d307-80a8-44b8-8b1a-e26e8a7d912a-2018-04-17T160000.000Z	Hearing Loss			
MONDO:0007522	COL5A1	HGNC:2209	https://search.clinicalgenome.org/kb/genes/HGNC:2209	Ehlers-Danlos syndrome, classic type	https://search.clinicalgenome.org/kb/conditions/MONDO:0007522	Autosomal dominant inheritance	3 - Sufficient Evidence for Haploinsufficiency (12/14/2017)	0 - No Evidence for Haploinsufficiency (12/14/2017)	https://search.clinicalgenome.org/kb/gene-dosage/HGNC:2209	Dosage Working Group	definitive evidence (03/24/2021)	https://search.clinicalgenome.org/kb/gene-validity/CGGV:assertion_3133eacb-2ef9-4463-8031-11d10f0e91b9-2021-03-24T151331.225Z	General Gene Curation	Assertion Pending (10/11/2016)	https://search.clinicalgenome.org/kb/gene-validity/https://actionability.clinicalgenome.org/ac/Adult/ui/stg2SummaryRpt?doc=AC089	Adult Actionability Working Group
MONDO:0007524	COL3A1	HGNC:2201	https://search.clinicalgenome.org/kb/genes/HGNC:2201	autosomal dominant Ehlers-Danlos syndrome, vascular type	https://search.clinicalgenome.org/kb/conditions/MONDO:0007524		3 - Sufficient Evidence for Haploinsufficiency (01/12/2017)	0 - No Evidence for Haploinsufficiency (01/12/2017)	https://search.clinicalgenome.org/kb/gene-dosage/HGNC:2201	Dosage Working Group				Moderate Actionability (09/02/2020) | Moderate Actionability (09/02/2020)	https://search.clinicalgenome.org/kb/gene-validity/https://actionability.clinicalgenome.org/ac/Adult/ui/stg2SummaryRpt?doc=AC132 | https://search.clinicalgenome.org/kb/gene-validity/https://actionability.clinicalgenome.org/ac/Pediatric/ui/stg2SummaryRpt?doc=AC132	Adult Actionability Working Group | Pediatric Actionability Working Group
MONDO:0007534	CDKN1C	HGNC:1786	https://search.clinicalgenome.org/kb/genes/HGNC:1786	Beckwith-Wiedemann syndrome	https://search.clinicalgenome.org/kb/conditions/MONDO:0007534		3 - Sufficient Evidence for Haploinsufficiency (09/25/2020)	0 - No Evidence for Haploinsufficiency (09/25/2020)	https://search.clinicalgenome.org/kb/gene-dosage/HGNC:1786	Dosage Working Group						
MONDO:0007540	MEN1	HGNC:7010	https://search.clinicalgenome.org/kb/genes/HGNC:7010	multiple endocrine neoplasia type 1	https://search.clinicalgenome.org/kb/conditions/MONDO:0007540	Autosomal dominant inheritance	3 - Sufficient Evidence for Haploinsufficiency (01/12/2022)	0 - No Evidence for Haploinsufficiency (01/12/2022)	https://search.clinicalgenome.org/kb/gene-dosage/HGNC:7010	Dosage Working Group	definitive evidence (05/13/2020)	https://search.clinicalgenome.org/kb/gene-validity/CGGV:assertion_a40ef20e-115c-4667-b4a2-6c7c8fb07a49-2020-05-13T170000.000Z	Hereditary Cancer	Strong Actionability (01/15/2019) | Strong Actionability (01/15/2019)	https://search.clinicalgenome.org/kb/gene-validity/https://actionability.clinicalgenome.org/ac/Adult/ui/stg2SummaryRpt?doc=AC077 | https://search.clinicalgenome.org/kb/gene-validity/https://actionability.clinicalgenome.org/ac/Pediatric/ui/stg2SummaryRpt?doc=AC077	Adult Actionability Working Group | Pediatric Actionability Working Group
MONDO:0007566	TGFBR1	HGNC:11772	https://search.clinicalgenome.org/kb/genes/HGNC:11772	multiple self-healing squamous epithelioma	https://search.clinicalgenome.org/kb/conditions/MONDO:0007566	Autosomal dominant inheritance	2 - Emerging Evidence for Haploinsufficiency (04/25/2012)	0 - No Evidence for Haploinsufficiency (04/25/2012)	https://search.clinicalgenome.org/kb/gene-dosage/HGNC:11772	Dosage Working Group	definitive evidence (12/20/2019)	https://search.clinicalgenome.org/kb/gene-validity/CGGV:assertion_570947a0-3e45-419c-bc22-0fdc60ca6009-2019-12-20T212550.834Z	Hereditary Cancer			
MONDO:0007585	EXT1	HGNC:3512	https://search.clinicalgenome.org/kb/genes/HGNC:3512	exostoses, multiple, type 1	https://search.clinicalgenome.org/kb/conditions/MONDO:0007585	Autosomal dominant inheritance	3 - Sufficient Evidence for Haploinsufficiency (06/17/2020)	0 - No Evidence for Haploinsufficiency (06/17/2020)	https://search.clinicalgenome.org/kb/gene-dosage/HGNC:3512	Dosage Working Group	definitive evidence (06/04/2018)	https://search.clinicalgenome.org/kb/gene-validity/CGGV:assertion_0ced1387-c0a8-4f03-bd70-1595cb7683fd-2018-06-04T192029.946Z	Hereditary Cancer			
MONDO:0007586	EXT2	HGNC:3513	https://search.clinicalgenome.org/kb/genes/HGNC:3513	exostoses, multiple, type 2	https://search.clinicalgenome.org/kb/conditions/MONDO:0007586	Autosomal dominant inheritance	3 - Sufficient Evidence for Haploinsufficiency (06/23/2020)	0 - No Evidence for Haploinsufficiency (06/23/2020)	https://search.clinicalgenome.org/kb/gene-dosage/HGNC:3513	Dosage Working Group	definitive evidence (12/21/2018)	https://search.clinicalgenome.org/kb/gene-validity/CGGV:assertion_9e6829ce-3e0b-44c5-a214-756f33b1e948-2018-12-21T153126.680Z	Hereditary Cancer			
MONDO:0007589	FZD4	HGNC:4042	https://search.clinicalgenome.org/kb/genes/HGNC:4042	exudative vitreoretinopathy 1	https://search.clinicalgenome.org/kb/conditions/MONDO:0007589		3 - Sufficient Evidence for Haploinsufficiency (07/06/2012)	0 - No Evidence for Haploinsufficiency (07/06/2012)	https://search.clinicalgenome.org/kb/gene-dosage/HGNC:4042	Dosage Working Group						
MONDO:0007601	MEFV	HGNC:6998	https://search.clinicalgenome.org/kb/genes/HGNC:6998	familial Mediterranean fever, autosomal dominant	https://search.clinicalgenome.org/kb/conditions/MONDO:0007601		0 - No Evidence for Haploinsufficiency (08/16/2018)	0 - No Evidence for Haploinsufficiency (08/16/2018)	https://search.clinicalgenome.org/kb/gene-dosage/HGNC:6998	Dosage Working Group				Assertion Pending (05/23/2016)	https://search.clinicalgenome.org/kb/gene-validity/https://actionability.clinicalgenome.org/ac/Adult/ui/stg2SummaryRpt?doc=AC102	Adult Actionability Working Group
MONDO:0007607	FLCN	HGNC:27310	https://search.clinicalgenome.org/kb/genes/HGNC:27310	Birt-Hogg-Dube syndrome	https://search.clinicalgenome.org/kb/conditions/MONDO:0007607	Autosomal dominant inheritance	3 - Sufficient Evidence for Haploinsufficiency (11/10/2016)	0 - No Evidence for Haploinsufficiency (11/10/2016)	https://search.clinicalgenome.org/kb/gene-dosage/HGNC:27310	Dosage Working Group	definitive evidence (06/04/2018)	https://search.clinicalgenome.org/kb/gene-validity/CGGV:assertion_c96620e8-f9c9-41a0-a979-31fb9928abb6-2018-06-04T191544.022Z	Hereditary Cancer	Assertion Pending (03/30/2016)	https://search.clinicalgenome.org/kb/gene-validity/https://actionability.clinicalgenome.org/ac/Adult/ui/stg2SummaryRpt?doc=AC041	Adult Actionability Working Group
MONDO:0007614	KIF21A	HGNC:19349	https://search.clinicalgenome.org/kb/genes/HGNC:19349	congenital fibrosis of extraocular muscles	https://search.clinicalgenome.org/kb/conditions/MONDO:0007614	Autosomal dominant inheritance					definitive evidence (10/26/2021)	https://search.clinicalgenome.org/kb/gene-validity/CGGV:assertion_cc32bbc2-de76-42d0-8a6b-b3c3393ddd30-2021-10-26T144854.679Z	Brain Malformations			
MONDO:0007617	ARID1B	HGNC:18040	https://search.clinicalgenome.org/kb/genes/HGNC:18040	Coffin-Siris syndrome 1	https://search.clinicalgenome.org/kb/conditions/MONDO:0007617		3 - Sufficient Evidence for Haploinsufficiency (05/26/2021)	0 - No Evidence for Haploinsufficiency (05/26/2021)	https://search.clinicalgenome.org/kb/gene-dosage/HGNC:18040	Dosage Working Group						
MONDO:0007640	TIMP3	HGNC:11822	https://search.clinicalgenome.org/kb/genes/HGNC:11822	Sorsby fundus dystrophy	https://search.clinicalgenome.org/kb/conditions/MONDO:0007640	Autosomal dominant inheritance					definitive evidence (07/02/2021)	https://search.clinicalgenome.org/kb/gene-validity/CGGV:assertion_8594a02c-c0f3-4542-b6d3-f089ba94417e-2021-07-02T174320.328Z	Retina			
MONDO:0007648	CDH1	HGNC:1748	https://search.clinicalgenome.org/kb/genes/HGNC:1748	hereditary diffuse gastric adenocarcinoma	https://search.clinicalgenome.org/kb/conditions/MONDO:0007648	Autosomal dominant inheritance	3 - Sufficient Evidence for Haploinsufficiency (04/10/2020)	0 - No Evidence for Haploinsufficiency (04/10/2020)	https://search.clinicalgenome.org/kb/gene-dosage/HGNC:1748	Dosage Working Group	definitive evidence (10/11/2018)	https://search.clinicalgenome.org/kb/gene-validity/CGGV:assertion_14223ff7-e6b0-4c60-bee6-df55301d2017-2018-10-11T185226.994Z	Hereditary Cancer	Limited Actionability (06/04/2019) | Assertion Pending (06/04/2019)	https://search.clinicalgenome.org/kb/gene-validity/https://actionability.clinicalgenome.org/ac/Pediatric/ui/stg2SummaryRpt?doc=AC103 | https://search.clinicalgenome.org/kb/gene-validity/https://actionability.clinicalgenome.org/ac/Adult/ui/stg2SummaryRpt?doc=AC103	Pediatric Actionability Working Group | Adult Actionability Working Group
MONDO:0007661	IMMP2L	HGNC:14598	https://search.clinicalgenome.org/kb/genes/HGNC:14598	Tourette syndrome	https://search.clinicalgenome.org/kb/conditions/MONDO:0007661		40 - Dosage Sensitivity Unlikely (04/12/2022)	0 - No Evidence for Haploinsufficiency (04/12/2022)	https://search.clinicalgenome.org/kb/gene-dosage/HGNC:14598	Dosage Working Group						
MONDO:0007669	HNF1B	HGNC:11630	https://search.clinicalgenome.org/kb/genes/HGNC:11630	renal cysts and diabetes syndrome	https://search.clinicalgenome.org/kb/conditions/MONDO:0007669	Autosomal dominant inheritance	3 - Sufficient Evidence for Haploinsufficiency (12/21/2020)	0 - No Evidence for Haploinsufficiency (12/21/2020)	https://search.clinicalgenome.org/kb/gene-dosage/HGNC:11630	Dosage Working Group	definitive evidence (01/19/2021)	https://search.clinicalgenome.org/kb/gene-validity/CGGV:assertion_4174ea0a-6901-4070-ad93-d92614fd55c0-2021-01-19T170000.000Z	Monogenic Diabetes			
MONDO:0007672	GLMN	HGNC:14373	https://search.clinicalgenome.org/kb/genes/HGNC:14373	glomuvenous malformation	https://search.clinicalgenome.org/kb/conditions/MONDO:0007672		3 - Sufficient Evidence for Haploinsufficiency (07/18/2013)	0 - No Evidence for Haploinsufficiency (07/18/2013)	https://search.clinicalgenome.org/kb/gene-dosage/HGNC:14373	Dosage Working Group						
MONDO:0007681	DICER1	HGNC:17098	https://search.clinicalgenome.org/kb/genes/HGNC:17098	goiter, multinodular 1, with or without Sertoli-Leydig cell tumors	https://search.clinicalgenome.org/kb/conditions/MONDO:0007681		3 - Sufficient Evidence for Haploinsufficiency (02/09/2022)	0 - No Evidence for Haploinsufficiency (02/09/2022)	https://search.clinicalgenome.org/kb/gene-dosage/HGNC:17098	Dosage Working Group				Assertion Pending (05/29/2019) | Moderate Actionability (05/29/2019)	https://search.clinicalgenome.org/kb/gene-validity/https://actionability.clinicalgenome.org/ac/Adult/ui/stg2SummaryRpt?doc=AC002 | https://search.clinicalgenome.org/kb/gene-validity/https://actionability.clinicalgenome.org/ac/Pediatric/ui/stg2SummaryRpt?doc=AC002	Adult Actionability Working Group | Pediatric Actionability Working Group
MONDO:0007686	NBEAL2	HGNC:31928	https://search.clinicalgenome.org/kb/genes/HGNC:31928	gray platelet syndrome	https://search.clinicalgenome.org/kb/conditions/MONDO:0007686	Autosomal recessive inheritance					definitive evidence (06/26/2019)	https://search.clinicalgenome.org/kb/gene-validity/CGGV:assertion_ae8bd4d6-8810-423b-83e0-98667f06426d-2019-06-26T160000.000Z	Hemostasis Thrombosis			
MONDO:0007688	SMAD4	HGNC:6770	https://search.clinicalgenome.org/kb/genes/HGNC:6770	Myhre syndrome	https://search.clinicalgenome.org/kb/conditions/MONDO:0007688	Autosomal dominant inheritance	3 - Sufficient Evidence for Haploinsufficiency (12/16/2020)	0 - No Evidence for Haploinsufficiency (12/16/2020)	https://search.clinicalgenome.org/kb/gene-dosage/HGNC:6770	Dosage Working Group	definitive evidence (12/30/2021)	https://search.clinicalgenome.org/kb/gene-validity/CGGV:assertion_a5a082cc-c214-4bfa-8cb8-caead239d129-2021-12-30T170000.000Z	Intellectual Disability and Autism			
MONDO:0007700	HPD	HGNC:5147	https://search.clinicalgenome.org/kb/genes/HGNC:5147	hawkinsinuria	https://search.clinicalgenome.org/kb/conditions/MONDO:0007700	Autosomal dominant inheritance					limited evidence (06/26/2020)	https://search.clinicalgenome.org/kb/gene-validity/CGGV:assertion_6819b0ea-9f21-4f91-ae92-133d97fcf87b-2020-06-26T171501.409Z	Aminoacidopathy			
MONDO:0007723	RET	HGNC:9967	https://search.clinicalgenome.org/kb/genes/HGNC:9967	Hirschsprung disease, susceptibility to, 1	https://search.clinicalgenome.org/kb/conditions/MONDO:0007723		3 - Sufficient Evidence for Haploinsufficiency (08/26/2020)	0 - No Evidence for Haploinsufficiency (08/26/2020)	https://search.clinicalgenome.org/kb/gene-dosage/HGNC:9967	Dosage Working Group						
MONDO:0007732	TBX5	HGNC:11604	https://search.clinicalgenome.org/kb/genes/HGNC:11604	Holt-Oram syndrome	https://search.clinicalgenome.org/kb/conditions/MONDO:0007732	Autosomal dominant inheritance	3 - Sufficient Evidence for Haploinsufficiency (07/29/2020)	0 - No Evidence for Haploinsufficiency (07/29/2020)	https://search.clinicalgenome.org/kb/gene-dosage/HGNC:11604	Dosage Working Group	definitive evidence (07/27/2021)	https://search.clinicalgenome.org/kb/gene-validity/CGGV:assertion_24e6c85a-33cf-4248-be1f-6431c7c6b1e5-2021-07-27T145706.838Z	Syndromic Disorders			
MONDO:0007733	SHH	HGNC:10848	https://search.clinicalgenome.org/kb/genes/HGNC:10848	holoprosencephaly 3	https://search.clinicalgenome.org/kb/conditions/MONDO:0007733		3 - Sufficient Evidence for Haploinsufficiency (06/24/2020)	0 - No Evidence for Haploinsufficiency (06/24/2020)	https://search.clinicalgenome.org/kb/gene-dosage/HGNC:10848	Dosage Working Group						
MONDO:0007734	TGIF1	HGNC:11776	https://search.clinicalgenome.org/kb/genes/HGNC:11776	holoprosencephaly 4	https://search.clinicalgenome.org/kb/conditions/MONDO:0007734		3 - Sufficient Evidence for Haploinsufficiency (05/10/2012)	0 - No Evidence for Haploinsufficiency (05/10/2012)	https://search.clinicalgenome.org/kb/gene-dosage/HGNC:11776	Dosage Working Group						
MONDO:0007739	HTT	HGNC:4851	https://search.clinicalgenome.org/kb/genes/HGNC:4851	Huntington disease	https://search.clinicalgenome.org/kb/conditions/MONDO:0007739	Autosomal dominant inheritance					definitive evidence (11/08/2021)	https://search.clinicalgenome.org/kb/gene-validity/CGGV:assertion_617c18ee-9476-4bc0-b403-20bc55150c7c-2021-11-08T193955.489Z	General Gene Curation			
MONDO:0007740	VCAN	HGNC:2464	https://search.clinicalgenome.org/kb/genes/HGNC:2464	Wagner disease	https://search.clinicalgenome.org/kb/conditions/MONDO:0007740	Autosomal dominant inheritance					definitive evidence (07/26/2021)	https://search.clinicalgenome.org/kb/gene-validity/CGGV:assertion_d1ea2623-463f-40f1-befb-5dfde7abc784-2021-07-26T183919.943Z	Retina			
MONDO:0007747	CA12	HGNC:1371	https://search.clinicalgenome.org/kb/genes/HGNC:1371	isolated hyperchlorhidrosis	https://search.clinicalgenome.org/kb/conditions/MONDO:0007747		30 - Gene Associated with Autosomal Recessive Phenotype (08/22/2016)		https://search.clinicalgenome.org/kb/gene-dosage/HGNC:1371	Dosage Working Group						
MONDO:0007750	LDLR	HGNC:6547	https://search.clinicalgenome.org/kb/genes/HGNC:6547	hypercholesterolemia, familial, 1	https://search.clinicalgenome.org/kb/conditions/MONDO:0007750	Semidominant inheritance	3 - Sufficient Evidence for Haploinsufficiency (10/27/2021)	0 - No Evidence for Haploinsufficiency (10/27/2021)	https://search.clinicalgenome.org/kb/gene-dosage/HGNC:6547	Dosage Working Group	definitive evidence (02/24/2021)	https://search.clinicalgenome.org/kb/gene-validity/CGGV:assertion_81788cfe-7520-4821-b80b-3ee0b2018909-2021-02-24T170000.000Z	General Gene Curation	Definitive Actionability (08/03/2020) | Strong Actionability (08/03/2020) | Strong Actionability (08/03/2020) | Strong Actionability (08/03/2020)	https://search.clinicalgenome.org/kb/gene-validity/https://actionability.clinicalgenome.org/ac/Adult/ui/stg2SummaryRpt?doc=AC057 | https://search.clinicalgenome.org/kb/gene-validity/https://actionability.clinicalgenome.org/ac/Pediatric/ui/stg2SummaryRpt?doc=AC057 | https://search.clinicalgenome.org/kb/gene-validity/https://actionability.clinicalgenome.org/ac/Adult/ui/stg2SummaryRpt?doc=AC065 | https://search.clinicalgenome.org/kb/gene-validity/https://actionability.clinicalgenome.org/ac/Pediatric/ui/stg2SummaryRpt?doc=AC065	Adult Actionability Working Group | Pediatric Actionability Working Group | Adult Actionability Working Group | Pediatric Actionability Working Group
MONDO:0007751	APOB	HGNC:603	https://search.clinicalgenome.org/kb/genes/HGNC:603	hypercholesterolemia, autosomal dominant, type B	https://search.clinicalgenome.org/kb/conditions/MONDO:0007751	Autosomal dominant inheritance	3 - Sufficient Evidence for Haploinsufficiency (04/09/2020)	0 - No Evidence for Haploinsufficiency (04/09/2020)	https://search.clinicalgenome.org/kb/gene-dosage/HGNC:603	Dosage Working Group	definitive evidence (11/14/2018)	https://search.clinicalgenome.org/kb/gene-validity/CGGV:assertion_1c26b83b-409e-47c7-9c53-6ca79472d6fc-2018-11-14T180000.000Z	General Gene Curation	Definitive Actionability (08/03/2020) | Strong Actionability (08/03/2020) | Strong Actionability (08/03/2020) | Strong Actionability (08/03/2020)	https://search.clinicalgenome.org/kb/gene-validity/https://actionability.clinicalgenome.org/ac/Adult/ui/stg2SummaryRpt?doc=AC057 | https://search.clinicalgenome.org/kb/gene-validity/https://actionability.clinicalgenome.org/ac/Pediatric/ui/stg2SummaryRpt?doc=AC057 | https://search.clinicalgenome.org/kb/gene-validity/https://actionability.clinicalgenome.org/ac/Adult/ui/stg2SummaryRpt?doc=AC065 | https://search.clinicalgenome.org/kb/gene-validity/https://actionability.clinicalgenome.org/ac/Pediatric/ui/stg2SummaryRpt?doc=AC065	Adult Actionability Working Group | Pediatric Actionability Working Group | Adult Actionability Working Group | Pediatric Actionability Working Group
MONDO:0007768	CDC73	HGNC:16783	https://search.clinicalgenome.org/kb/genes/HGNC:16783	hyperparathyroidism 2 with jaw tumors	https://search.clinicalgenome.org/kb/conditions/MONDO:0007768	Autosomal dominant inheritance	3 - Sufficient Evidence for Haploinsufficiency (04/13/2022)	0 - No Evidence for Haploinsufficiency (04/13/2022)	https://search.clinicalgenome.org/kb/gene-dosage/HGNC:16783	Dosage Working Group	definitive evidence (10/12/2018)	https://search.clinicalgenome.org/kb/gene-validity/CGGV:assertion_a5bd498b-dc86-4f2d-a51b-48baf7017a02-2018-10-12T210249.200Z	Hereditary Cancer	Assertion Pending (12/29/2016)	https://search.clinicalgenome.org/kb/gene-validity/https://actionability.clinicalgenome.org/ac/Adult/ui/stg2SummaryRpt?doc=AC119	Adult Actionability Working Group
MONDO:0007783	RYR1	HGNC:10483	https://search.clinicalgenome.org/kb/genes/HGNC:10483	malignant hyperthermia, susceptibility to, 1	https://search.clinicalgenome.org/kb/conditions/MONDO:0007783	Autosomal dominant inheritance	0 - No Evidence for Haploinsufficiency (11/12/2015)	0 - No Evidence for Haploinsufficiency (11/12/2015)	https://search.clinicalgenome.org/kb/gene-dosage/HGNC:10483	Dosage Working Group	definitive evidence (11/25/2020)	https://search.clinicalgenome.org/kb/gene-validity/CGGV:assertion_bcd5e6ba-ef77-434c-9ec6-47f72f597bfe-2020-11-25T170000.000Z	General Gene Curation	Strong Actionability (01/12/2021) | Strong Actionability (01/12/2021)	https://search.clinicalgenome.org/kb/gene-validity/https://actionability.clinicalgenome.org/ac/Adult/ui/stg2SummaryRpt?doc=AC076 | https://search.clinicalgenome.org/kb/gene-validity/https://actionability.clinicalgenome.org/ac/Pediatric/ui/stg2SummaryRpt?doc=AC076	Adult Actionability Working Group | Pediatric Actionability Working Group
MONDO:0007797	GATA3	HGNC:4172	https://search.clinicalgenome.org/kb/genes/HGNC:4172	hypoparathyroidism-deafness-renal disease syndrome	https://search.clinicalgenome.org/kb/conditions/MONDO:0007797	Autosomal dominant inheritance	3 - Sufficient Evidence for Haploinsufficiency (06/24/2020)	0 - No Evidence for Haploinsufficiency (06/24/2020)	https://search.clinicalgenome.org/kb/gene-dosage/HGNC:4172	Dosage Working Group	definitive evidence (06/18/2019)	https://search.clinicalgenome.org/kb/gene-validity/CGGV:assertion_afb6e0d5-81a5-439a-a498-9edc8505a367-2019-06-18T160000.000Z	Hearing Loss			
MONDO:0007798	ALPL	HGNC:438	https://search.clinicalgenome.org/kb/genes/HGNC:438	obsolete adult hypophosphatasia	https://search.clinicalgenome.org/kb/conditions/MONDO:0007798	Autosomal dominant inheritance					definitive evidence (05/19/2021)	https://search.clinicalgenome.org/kb/gene-validity/CGGV:assertion_03912003-38e1-45cc-a005-099e00dd3eec-2021-05-19T070000.000Z	Skeletal Disorders			
MONDO:0007818	STAT3	HGNC:11364	https://search.clinicalgenome.org/kb/genes/HGNC:11364	Hyper-IgE recurrent infection syndrome 1	https://search.clinicalgenome.org/kb/conditions/MONDO:0007818	Autosomal dominant inheritance					definitive evidence (12/24/2021)	https://search.clinicalgenome.org/kb/gene-validity/CGGV:assertion_beb3aa5b-240e-45d7-969a-9de3e5564457-2021-12-24T160548.234Z	SCID-CID			
MONDO:0007841	TBX4	HGNC:11603	https://search.clinicalgenome.org/kb/genes/HGNC:11603	coxopodopatellar syndrome	https://search.clinicalgenome.org/kb/conditions/MONDO:0007841		3 - Sufficient Evidence for Haploinsufficiency (12/11/2019)	0 - No Evidence for Haploinsufficiency (12/11/2019)	https://search.clinicalgenome.org/kb/gene-dosage/HGNC:11603	Dosage Working Group						
MONDO:0007843	KMT2D	HGNC:7133	https://search.clinicalgenome.org/kb/genes/HGNC:7133	Kabuki syndrome 1	https://search.clinicalgenome.org/kb/conditions/MONDO:0007843	Autosomal dominant inheritance	3 - Sufficient Evidence for Haploinsufficiency (01/23/2020)	0 - No Evidence for Haploinsufficiency (01/23/2020)	https://search.clinicalgenome.org/kb/gene-dosage/HGNC:7133	Dosage Working Group	definitive evidence (10/21/2021)	https://search.clinicalgenome.org/kb/gene-validity/CGGV:assertion_15029985-0c1a-4835-95fe-eb05dedaf85c-2021-10-21T145501.022Z	SCID-CID			
MONDO:0007844	FGFR1	HGNC:3688	https://search.clinicalgenome.org/kb/genes/HGNC:3688	hypogonadotropic hypogonadism 2 with or without anosmia	https://search.clinicalgenome.org/kb/conditions/MONDO:0007844		3 - Sufficient Evidence for Haploinsufficiency (04/05/2021)	0 - No Evidence for Haploinsufficiency (04/05/2021)	https://search.clinicalgenome.org/kb/gene-dosage/HGNC:3688	Dosage Working Group						
MONDO:0007846	ANKRD11	HGNC:21316	https://search.clinicalgenome.org/kb/genes/HGNC:21316	KBG syndrome	https://search.clinicalgenome.org/kb/conditions/MONDO:0007846	Autosomal dominant inheritance	3 - Sufficient Evidence for Haploinsufficiency (06/20/2013)	0 - No Evidence for Haploinsufficiency (06/20/2013)	https://search.clinicalgenome.org/kb/gene-dosage/HGNC:21316	Dosage Working Group	definitive evidence (11/26/2019)	https://search.clinicalgenome.org/kb/gene-validity/CGGV:assertion_cf3e887e-8da4-45ea-bec8-9565f8246bc9-2019-11-26T170000.000Z	Intellectual Disability and Autism			
MONDO:0007856	RHBDF2	HGNC:20788	https://search.clinicalgenome.org/kb/genes/HGNC:20788	palmoplantar keratoderma-esophageal carcinoma syndrome	https://search.clinicalgenome.org/kb/conditions/MONDO:0007856	Autosomal dominant inheritance					definitive evidence (07/30/2020)	https://search.clinicalgenome.org/kb/gene-validity/CGGV:assertion_b7e72765-1a53-44fb-bfee-9e5923507bbe-2020-07-30T212232.808Z	Hereditary Cancer			
MONDO:0007858	AAGAB	HGNC:25662	https://search.clinicalgenome.org/kb/genes/HGNC:25662	palmoplantar keratoderma, punctate type 1A	https://search.clinicalgenome.org/kb/conditions/MONDO:0007858		3 - Sufficient Evidence for Haploinsufficiency (02/28/2013)	0 - No Evidence for Haploinsufficiency (02/28/2013)	https://search.clinicalgenome.org/kb/gene-dosage/HGNC:25662	Dosage Working Group						
MONDO:0007872	FGF10	HGNC:3666	https://search.clinicalgenome.org/kb/genes/HGNC:3666	LADD syndrome	https://search.clinicalgenome.org/kb/conditions/MONDO:0007872		3 - Sufficient Evidence for Haploinsufficiency (02/23/2022)	0 - No Evidence for Haploinsufficiency (02/23/2022)	https://search.clinicalgenome.org/kb/gene-dosage/HGNC:3666	Dosage Working Group						
MONDO:0007888	FH	HGNC:3700	https://search.clinicalgenome.org/kb/genes/HGNC:3700	hereditary leiomyomatosis and renal cell cancer	https://search.clinicalgenome.org/kb/conditions/MONDO:0007888	Autosomal dominant inheritance	3 - Sufficient Evidence for Haploinsufficiency (07/06/2020)	0 - No Evidence for Haploinsufficiency (07/06/2020)	https://search.clinicalgenome.org/kb/gene-dosage/HGNC:3700	Dosage Working Group	definitive evidence (05/14/2020)	https://search.clinicalgenome.org/kb/gene-validity/CGGV:assertion_59e42ccd-2b0b-441c-8529-6eb1e9dde330-2020-05-14T002334.007Z	Hereditary Cancer	Assertion Pending (09/15/2015)	https://search.clinicalgenome.org/kb/gene-validity/https://actionability.clinicalgenome.org/ac/Adult/ui/stg2SummaryRpt?doc=AC061	Adult Actionability Working Group
MONDO:0007893	BRAF	HGNC:1097	https://search.clinicalgenome.org/kb/genes/HGNC:1097	Noonan syndrome with multiple lentigines	https://search.clinicalgenome.org/kb/conditions/MONDO:0007893	Autosomal dominant inheritance	1 - Little Evidence for Haploinsufficiency (08/04/2014)	0 - No Evidence for Haploinsufficiency (08/04/2014)	https://search.clinicalgenome.org/kb/gene-dosage/HGNC:1097	Dosage Working Group	limited evidence (07/24/2018)	https://search.clinicalgenome.org/kb/gene-validity/CGGV:assertion_888875a8-5654-486b-8e64-e1382ccc6650-2018-07-24T160000.000Z	RASopathy			
MONDO:0007895	COL2A1	HGNC:2200	https://search.clinicalgenome.org/kb/genes/HGNC:2200	platyspondylic dysplasia, Torrance type	https://search.clinicalgenome.org/kb/conditions/MONDO:0007895	Autosomal dominant inheritance	3 - Sufficient Evidence for Haploinsufficiency (07/29/2020)	0 - No Evidence for Haploinsufficiency (07/29/2020)	https://search.clinicalgenome.org/kb/gene-dosage/HGNC:2200	Dosage Working Group	definitive evidence (02/01/2021)	https://search.clinicalgenome.org/kb/gene-validity/CGGV:assertion_a4c42c43-7b6a-4456-aeb1-7a00302a468b-2021-02-01T180000.000Z	Skeletal Disorders			
MONDO:0007903	TP53	HGNC:11998	https://search.clinicalgenome.org/kb/genes/HGNC:11998	Li-Fraumeni syndrome 1	https://search.clinicalgenome.org/kb/conditions/MONDO:0007903	Autosomal dominant inheritance	3 - Sufficient Evidence for Haploinsufficiency (11/10/2021)	0 - No Evidence for Haploinsufficiency (11/10/2021)	https://search.clinicalgenome.org/kb/gene-dosage/HGNC:11998	Dosage Working Group	definitive evidence (05/14/2020)	https://search.clinicalgenome.org/kb/gene-validity/CGGV:assertion_78494aba-bb52-4b33-bf1d-ebbb5374df4b-2020-05-14T005523.974Z	Hereditary Cancer	Strong Actionability (03/26/2021) | Strong Actionability (03/26/2021)	https://search.clinicalgenome.org/kb/gene-validity/https://actionability.clinicalgenome.org/ac/Adult/ui/stg2SummaryRpt?doc=AC068 | https://search.clinicalgenome.org/kb/gene-validity/https://actionability.clinicalgenome.org/ac/Pediatric/ui/stg2SummaryRpt?doc=AC068	Adult Actionability Working Group | Pediatric Actionability Working Group
MONDO:0007918	KIF11	HGNC:6388	https://search.clinicalgenome.org/kb/genes/HGNC:6388	microcephaly with or without chorioretinopathy, lymphedema, or intellectual disability	https://search.clinicalgenome.org/kb/conditions/MONDO:0007918	Autosomal dominant inheritance	3 - Sufficient Evidence for Haploinsufficiency (08/01/2013)	0 - No Evidence for Haploinsufficiency (08/01/2013)	https://search.clinicalgenome.org/kb/gene-dosage/HGNC:6388	Dosage Working Group	definitive evidence (07/01/2021)	https://search.clinicalgenome.org/kb/gene-validity/CGGV:assertion_aabff7c5-06ad-4602-a6f7-fef1bca0d1df-2021-07-01T160000.000Z	Retina			
MONDO:0007922	FOXC2	HGNC:3801	https://search.clinicalgenome.org/kb/genes/HGNC:3801	lymphedema-distichiasis syndrome	https://search.clinicalgenome.org/kb/conditions/MONDO:0007922		3 - Sufficient Evidence for Haploinsufficiency (11/26/2013)	0 - No Evidence for Haploinsufficiency (11/26/2013)	https://search.clinicalgenome.org/kb/gene-dosage/HGNC:3801	Dosage Working Group						
MONDO:0007943	SF3B4	HGNC:10771	https://search.clinicalgenome.org/kb/genes/HGNC:10771	Nager acrofacial dysostosis	https://search.clinicalgenome.org/kb/conditions/MONDO:0007943		3 - Sufficient Evidence for Haploinsufficiency (07/17/2014)	0 - No Evidence for Haploinsufficiency (07/17/2014)	https://search.clinicalgenome.org/kb/gene-dosage/HGNC:10771	Dosage Working Group						
MONDO:0007944	TCOF1	HGNC:11654	https://search.clinicalgenome.org/kb/genes/HGNC:11654	Treacher-Collins syndrome 1	https://search.clinicalgenome.org/kb/conditions/MONDO:0007944		3 - Sufficient Evidence for Haploinsufficiency (04/28/2021)	0 - No Evidence for Haploinsufficiency (04/28/2021)	https://search.clinicalgenome.org/kb/gene-dosage/HGNC:11654	Dosage Working Group						
MONDO:0007947	FBN1	HGNC:3603	https://search.clinicalgenome.org/kb/genes/HGNC:3603	Marfan syndrome	https://search.clinicalgenome.org/kb/conditions/MONDO:0007947	Autosomal dominant inheritance	3 - Sufficient Evidence for Haploinsufficiency (12/04/2019)	0 - No Evidence for Haploinsufficiency (12/04/2019)	https://search.clinicalgenome.org/kb/gene-dosage/HGNC:3603	Dosage Working Group	definitive evidence (03/04/2019)	https://search.clinicalgenome.org/kb/gene-validity/CGGV:assertion_d3fc0bea-4d6e-449e-885c-b204e6a0b2bf-2019-03-04T170000.000Z	General Gene Curation	Definitive Actionability (03/01/2019) | Definitive Actionability (03/01/2019)	https://search.clinicalgenome.org/kb/gene-validity/https://actionability.clinicalgenome.org/ac/Adult/ui/stg2SummaryRpt?doc=AC100 | https://search.clinicalgenome.org/kb/gene-validity/https://actionability.clinicalgenome.org/ac/Pediatric/ui/stg2SummaryRpt?doc=AC100	Adult Actionability Working Group | Pediatric Actionability Working Group
MONDO:0007958	RET	HGNC:9967	https://search.clinicalgenome.org/kb/genes/HGNC:9967	familial medullary thyroid carcinoma	https://search.clinicalgenome.org/kb/conditions/MONDO:0007958		3 - Sufficient Evidence for Haploinsufficiency (08/26/2020)	0 - No Evidence for Haploinsufficiency (08/26/2020)	https://search.clinicalgenome.org/kb/gene-dosage/HGNC:9967	Dosage Working Group				Strong Actionability (03/06/2019) | Strong Actionability (03/06/2019)	https://search.clinicalgenome.org/kb/gene-validity/https://actionability.clinicalgenome.org/ac/Adult/ui/stg2SummaryRpt?doc=AC080 | https://search.clinicalgenome.org/kb/gene-validity/https://actionability.clinicalgenome.org/ac/Pediatric/ui/stg2SummaryRpt?doc=AC080	Adult Actionability Working Group | Pediatric Actionability Working Group
MONDO:0007959	SUFU	HGNC:16466	https://search.clinicalgenome.org/kb/genes/HGNC:16466	medulloblastoma	https://search.clinicalgenome.org/kb/conditions/MONDO:0007959	Autosomal dominant inheritance					definitive evidence (10/11/2018)	https://search.clinicalgenome.org/kb/gene-validity/CGGV:assertion_1408d8b1-015c-48b3-a28e-d99b5545fce8-2018-10-11T184215.077Z	Hereditary Cancer			
MONDO:0007964	CDKN2A	HGNC:1787	https://search.clinicalgenome.org/kb/genes/HGNC:1787	melanoma, cutaneous malignant, susceptibility to, 2	https://search.clinicalgenome.org/kb/conditions/MONDO:0007964		3 - Sufficient Evidence for Haploinsufficiency (03/18/2022)	0 - No Evidence for Haploinsufficiency (03/18/2022)	https://search.clinicalgenome.org/kb/gene-dosage/HGNC:1787	Dosage Working Group						
MONDO:0007974	MBD5	HGNC:20444	https://search.clinicalgenome.org/kb/genes/HGNC:20444	intellectual disability, autosomal dominant 1	https://search.clinicalgenome.org/kb/conditions/MONDO:0007974		3 - Sufficient Evidence for Haploinsufficiency (08/11/2016)	1 - Little Evidence for Haploinsufficiency (08/11/2016)	https://search.clinicalgenome.org/kb/gene-dosage/HGNC:20444	Dosage Working Group						
MONDO:0007979	PTPN11	HGNC:9644	https://search.clinicalgenome.org/kb/genes/HGNC:9644	metachondromatosis	https://search.clinicalgenome.org/kb/conditions/MONDO:0007979		3 - Sufficient Evidence for Haploinsufficiency (09/08/2020)	0 - No Evidence for Haploinsufficiency (09/08/2020)	https://search.clinicalgenome.org/kb/gene-dosage/HGNC:9644	Dosage Working Group						
MONDO:0007986	TRPV4	HGNC:18083	https://search.clinicalgenome.org/kb/genes/HGNC:18083	metatropic dysplasia	https://search.clinicalgenome.org/kb/conditions/MONDO:0007986	Autosomal dominant inheritance					definitive evidence (12/08/2020)	https://search.clinicalgenome.org/kb/gene-validity/CGGV:assertion_70f8ac2b-5570-4672-b0ee-2f3a342ccd44-2020-12-08T170000.000Z	Skeletal Disorders			
MONDO:0007987	COL2A1	HGNC:2200	https://search.clinicalgenome.org/kb/genes/HGNC:2200	Kniest dysplasia	https://search.clinicalgenome.org/kb/conditions/MONDO:0007987	Autosomal dominant inheritance	3 - Sufficient Evidence for Haploinsufficiency (07/29/2020)	0 - No Evidence for Haploinsufficiency (07/29/2020)	https://search.clinicalgenome.org/kb/gene-dosage/HGNC:2200	Dosage Working Group	definitive evidence (12/15/2021)	https://search.clinicalgenome.org/kb/gene-validity/CGGV:assertion_25a49ec9-69ab-4e51-a13a-fe1eaa50ae56-2021-12-15T183542.376Z	Skeletal Disorders			
MONDO:0007999	SIX3	HGNC:10889	https://search.clinicalgenome.org/kb/genes/HGNC:10889	holoprosencephaly 2	https://search.clinicalgenome.org/kb/conditions/MONDO:0007999		3 - Sufficient Evidence for Haploinsufficiency (09/23/2020)	0 - No Evidence for Haploinsufficiency (09/23/2020)	https://search.clinicalgenome.org/kb/gene-dosage/HGNC:10889	Dosage Working Group						
MONDO:0008020	PTEN	HGNC:9588	https://search.clinicalgenome.org/kb/genes/HGNC:9588	multiple exostoses with spastic tetraparesis	https://search.clinicalgenome.org/kb/conditions/MONDO:0008020		3 - Sufficient Evidence for Haploinsufficiency (06/24/2020)	0 - No Evidence for Haploinsufficiency (06/24/2020)	https://search.clinicalgenome.org/kb/gene-dosage/HGNC:9588	Dosage Working Group				Strong Actionability (03/11/2019) | Moderate Actionability (09/09/2019)	https://search.clinicalgenome.org/kb/gene-validity/https://actionability.clinicalgenome.org/ac/Adult/ui/stg2SummaryRpt?doc=AC025 | https://search.clinicalgenome.org/kb/gene-validity/https://actionability.clinicalgenome.org/ac/Pediatric/ui/stg2SummaryRpt?doc=AC025	Adult Actionability Working Group | Pediatric Actionability Working Group
MONDO:0008024	SLC5A7	HGNC:14025	https://search.clinicalgenome.org/kb/genes/HGNC:14025	neuronopathy, distal hereditary motor, type 7A	https://search.clinicalgenome.org/kb/conditions/MONDO:0008024	Autosomal dominant inheritance					moderate evidence (11/20/2021)	https://search.clinicalgenome.org/kb/gene-validity/CGGV:assertion_c6e46608-98f5-4e4d-9bcf-22e42997af6e-2021-11-20T022003.630Z	Charcot-Marie-Tooth			
MONDO:0008044	SGCE	HGNC:10808	https://search.clinicalgenome.org/kb/genes/HGNC:10808	myoclonic dystonia 11	https://search.clinicalgenome.org/kb/conditions/MONDO:0008044		3 - Sufficient Evidence for Haploinsufficiency (11/11/2021)	0 - No Evidence for Haploinsufficiency (11/11/2021)	https://search.clinicalgenome.org/kb/gene-dosage/HGNC:10808	Dosage Working Group						
MONDO:0008048	DNM2	HGNC:2974	https://search.clinicalgenome.org/kb/genes/HGNC:2974	autosomal dominant centronuclear myopathy	https://search.clinicalgenome.org/kb/conditions/MONDO:0008048	Autosomal dominant inheritance					definitive evidence (12/20/2019)	https://search.clinicalgenome.org/kb/gene-validity/CGGV:assertion_e4156721-f6b9-482c-b610-97753f3f722d-2019-12-20T170000.000Z	Congenital Myopathies			
MONDO:0008050	MYH7	HGNC:7577	https://search.clinicalgenome.org/kb/genes/HGNC:7577	MYH7-related skeletal myopathy	https://search.clinicalgenome.org/kb/conditions/MONDO:0008050	Autosomal dominant inheritance	0 - No Evidence for Haploinsufficiency (11/16/2015)	0 - No Evidence for Haploinsufficiency (11/16/2015)	https://search.clinicalgenome.org/kb/gene-dosage/HGNC:7577	Dosage Working Group	definitive evidence (05/13/2021)	https://search.clinicalgenome.org/kb/gene-validity/CGGV:assertion_8974721a-f333-4fb7-b8b7-043233d3d100-2021-05-13T160000.000Z	Congenital Myopathies			
MONDO:0008051	ORAI1	HGNC:25896	https://search.clinicalgenome.org/kb/genes/HGNC:25896	tubular aggregate myopathy	https://search.clinicalgenome.org/kb/conditions/MONDO:0008051	Autosomal dominant inheritance					definitive evidence (07/13/2020)	https://search.clinicalgenome.org/kb/gene-validity/CGGV:assertion_bb8d614e-e8ff-4f16-bba3-6fc35ea56e8a-2020-07-13T164919.164Z	Congenital Myopathies			
MONDO:0008057	PRKAR1A	HGNC:9388	https://search.clinicalgenome.org/kb/genes/HGNC:9388	Carney complex, type 1	https://search.clinicalgenome.org/kb/conditions/MONDO:0008057	Autosomal dominant inheritance					definitive evidence (12/21/2018)	https://search.clinicalgenome.org/kb/gene-validity/CGGV:assertion_fc16b2a9-c8dc-4a04-a029-2f6af049404d-2018-12-21T154044.801Z	Hereditary Cancer	Moderate Actionability (08/06/2019) | Strong Actionability (08/06/2019)	https://search.clinicalgenome.org/kb/gene-validity/https://actionability.clinicalgenome.org/ac/Adult/ui/stg2SummaryRpt?doc=AC1004 | https://search.clinicalgenome.org/kb/gene-validity/https://actionability.clinicalgenome.org/ac/Pediatric/ui/stg2SummaryRpt?doc=AC1004	Adult Actionability Working Group | Pediatric Actionability Working Group
MONDO:0008061	LMX1B	HGNC:6654	https://search.clinicalgenome.org/kb/genes/HGNC:6654	nail-patella syndrome	https://search.clinicalgenome.org/kb/conditions/MONDO:0008061	Autosomal dominant inheritance	3 - Sufficient Evidence for Haploinsufficiency (11/10/2020)	0 - No Evidence for Haploinsufficiency (11/10/2020)	https://search.clinicalgenome.org/kb/gene-dosage/HGNC:6654	Dosage Working Group	definitive evidence (07/27/2021)	https://search.clinicalgenome.org/kb/gene-validity/CGGV:assertion_c89e1a52-3ef8-4a61-bf56-1e43cf88fc6e-2021-07-27T144211.405Z	Syndromic Disorders			
MONDO:0008082	RET	HGNC:9967	https://search.clinicalgenome.org/kb/genes/HGNC:9967	multiple endocrine neoplasia type 2B	https://search.clinicalgenome.org/kb/conditions/MONDO:0008082	Autosomal dominant inheritance	3 - Sufficient Evidence for Haploinsufficiency (08/26/2020)	0 - No Evidence for Haploinsufficiency (08/26/2020)	https://search.clinicalgenome.org/kb/gene-dosage/HGNC:9967	Dosage Working Group	definitive evidence (05/14/2020)	https://search.clinicalgenome.org/kb/gene-validity/CGGV:assertion_5e4425f0-0900-43c3-aac4-5b37554be386-2020-05-14T010345.543Z	Hereditary Cancer	Strong Actionability (03/06/2019) | Has Insufficient Evidence for Actionability Based on Early Rule-out (03/06/2019)	https://search.clinicalgenome.org/kb/gene-validity/https://actionability.clinicalgenome.org/ac/Pediatric/ui/stg2SummaryRpt?doc=AC081 | https://search.clinicalgenome.org/kb/gene-validity/https://actionability.clinicalgenome.org/ac/Adult/ui/stg2SummaryRpt?doc=AC081	Pediatric Actionability Working Group | Adult Actionability Working Group
MONDO:0008087	PMP22	HGNC:9118	https://search.clinicalgenome.org/kb/genes/HGNC:9118	hereditary neuropathy with liability to pressure palsies	https://search.clinicalgenome.org/kb/conditions/MONDO:0008087		3 - Sufficient Evidence for Haploinsufficiency (07/12/2012)	0 - No Evidence for Haploinsufficiency (07/12/2012)	https://search.clinicalgenome.org/kb/gene-dosage/HGNC:9118	Dosage Working Group				Limited Actionability (04/26/2018) | Has Insufficient Evidence for Actionability Based on Early Rule-out (07/15/2020)	https://search.clinicalgenome.org/kb/gene-validity/https://actionability.clinicalgenome.org/ac/Adult/ui/stg2SummaryRpt?doc=AC063 | https://search.clinicalgenome.org/kb/gene-validity/https://actionability.clinicalgenome.org/ac/Pediatric/ui/stg2SummaryRpt?doc=AC063	Adult Actionability Working Group | Pediatric Actionability Working Group
MONDO:0008104	PTPN11	HGNC:9644	https://search.clinicalgenome.org/kb/genes/HGNC:9644	Noonan syndrome 1	https://search.clinicalgenome.org/kb/conditions/MONDO:0008104		3 - Sufficient Evidence for Haploinsufficiency (09/08/2020)	0 - No Evidence for Haploinsufficiency (09/08/2020)	https://search.clinicalgenome.org/kb/gene-dosage/HGNC:9644	Dosage Working Group				Assertion Pending (07/01/2019) | Assertion Pending (07/01/2019)	https://search.clinicalgenome.org/kb/gene-validity/https://actionability.clinicalgenome.org/ac/Adult/ui/stg2SummaryRpt?doc=AC1003 | https://search.clinicalgenome.org/kb/gene-validity/https://actionability.clinicalgenome.org/ac/Pediatric/ui/stg2SummaryRpt?doc=AC1003	Adult Actionability Working Group | Pediatric Actionability Working Group
MONDO:0008115	MYCN	HGNC:7559	https://search.clinicalgenome.org/kb/genes/HGNC:7559	Feingold syndrome type 1	https://search.clinicalgenome.org/kb/conditions/MONDO:0008115		3 - Sufficient Evidence for Haploinsufficiency (07/12/2017)	0 - No Evidence for Haploinsufficiency (07/12/2017)	https://search.clinicalgenome.org/kb/gene-dosage/HGNC:7559	Dosage Working Group						
MONDO:0008146	COL1A1	HGNC:2197	https://search.clinicalgenome.org/kb/genes/HGNC:2197	osteogenesis imperfecta type 1	https://search.clinicalgenome.org/kb/conditions/MONDO:0008146	Autosomal dominant inheritance	3 - Sufficient Evidence for Haploinsufficiency (08/23/2012)	0 - No Evidence for Haploinsufficiency (08/23/2012)	https://search.clinicalgenome.org/kb/gene-dosage/HGNC:2197	Dosage Working Group	definitive evidence (03/16/2021)	https://search.clinicalgenome.org/kb/gene-validity/CGGV:assertion_74914fec-a5c4-437c-8c83-66c9f1df3e6e-2021-03-16T235154.009Z	Skeletal Disorders			
MONDO:0008147	COL1A1	HGNC:2197	https://search.clinicalgenome.org/kb/genes/HGNC:2197	osteogenesis imperfecta type 2	https://search.clinicalgenome.org/kb/conditions/MONDO:0008147	Autosomal dominant inheritance	3 - Sufficient Evidence for Haploinsufficiency (08/23/2012)	0 - No Evidence for Haploinsufficiency (08/23/2012)	https://search.clinicalgenome.org/kb/gene-dosage/HGNC:2197	Dosage Working Group	definitive evidence (03/22/2021)	https://search.clinicalgenome.org/kb/gene-validity/CGGV:assertion_0b093295-1c7c-4526-90eb-d6a9fff1cc75-2021-03-22T211103.977Z	Skeletal Disorders			
MONDO:0008150	FGFR1	HGNC:3688	https://search.clinicalgenome.org/kb/genes/HGNC:3688	osteoglophonic dwarfism	https://search.clinicalgenome.org/kb/conditions/MONDO:0008150	Autosomal dominant inheritance	3 - Sufficient Evidence for Haploinsufficiency (04/05/2021)	0 - No Evidence for Haploinsufficiency (04/05/2021)	https://search.clinicalgenome.org/kb/gene-dosage/HGNC:3688	Dosage Working Group	limited evidence (03/22/2021)	https://search.clinicalgenome.org/kb/gene-validity/CGGV:assertion_d958e743-2ca0-4bb9-a198-364dd58005c3-2021-03-22T203501.315Z	Craniofacial Malformations			
MONDO:0008157	LEMD3	HGNC:28887	https://search.clinicalgenome.org/kb/genes/HGNC:28887	Buschke-Ollendorff syndrome	https://search.clinicalgenome.org/kb/conditions/MONDO:0008157		3 - Sufficient Evidence for Haploinsufficiency (10/19/2020)	0 - No Evidence for Haploinsufficiency (10/19/2020)	https://search.clinicalgenome.org/kb/gene-dosage/HGNC:28887	Dosage Working Group						
MONDO:0008185	PRSS1	HGNC:9475	https://search.clinicalgenome.org/kb/genes/HGNC:9475	hereditary chronic pancreatitis	https://search.clinicalgenome.org/kb/conditions/MONDO:0008185	Autosomal dominant inheritance	0 - No Evidence for Haploinsufficiency (10/29/2012)	0 - No Evidence for Haploinsufficiency (10/29/2012)	https://search.clinicalgenome.org/kb/gene-dosage/HGNC:9475	Dosage Working Group	definitive evidence (07/30/2020)	https://search.clinicalgenome.org/kb/gene-validity/CGGV:assertion_d271c52b-b0bb-4e9b-a745-ea03dc716fa0-2020-07-30T205014.833Z	Hereditary Cancer			
MONDO:0008192	SDHD	HGNC:10683	https://search.clinicalgenome.org/kb/genes/HGNC:10683	paragangliomas 1	https://search.clinicalgenome.org/kb/conditions/MONDO:0008192		3 - Sufficient Evidence for Haploinsufficiency (08/11/2021)	0 - No Evidence for Haploinsufficiency (08/11/2021)	https://search.clinicalgenome.org/kb/gene-dosage/HGNC:10683	Dosage Working Group				Strong Actionability (10/31/2017)	https://search.clinicalgenome.org/kb/gene-validity/https://actionability.clinicalgenome.org/ac/Adult/ui/stg2SummaryRpt?doc=AC150	Adult Actionability Working Group
MONDO:0008199	GBA	HGNC:4177	https://search.clinicalgenome.org/kb/genes/HGNC:4177	late-onset Parkinson disease	https://search.clinicalgenome.org/kb/conditions/MONDO:0008199		30 - Gene Associated with Autosomal Recessive Phenotype (08/22/2016)	0 - No Evidence for Haploinsufficiency (08/22/2016)	https://search.clinicalgenome.org/kb/gene-dosage/HGNC:4177	Dosage Working Group				Has Insufficient Evidence for Actionability Based on Early Rule-out (06/21/2021) | Has Insufficient Evidence for Actionability Based on Early Rule-out (06/21/2021)	https://search.clinicalgenome.org/kb/gene-validity/https://actionability.clinicalgenome.org/ac/Adult/ui/stg2SummaryRpt?doc=AC1027 | https://search.clinicalgenome.org/kb/gene-validity/https://actionability.clinicalgenome.org/ac/Pediatric/ui/stg2SummaryRpt?doc=AC1027	Adult Actionability Working Group | Pediatric Actionability Working Group
MONDO:0008200	SNCA	HGNC:11138	https://search.clinicalgenome.org/kb/genes/HGNC:11138	autosomal dominant Parkinson disease 1	https://search.clinicalgenome.org/kb/conditions/MONDO:0008200									Has Insufficient Evidence for Actionability Based on Early Rule-out (06/21/2021) | Has Insufficient Evidence for Actionability Based on Early Rule-out (06/21/2021)	https://search.clinicalgenome.org/kb/gene-validity/https://actionability.clinicalgenome.org/ac/Adult/ui/stg2SummaryRpt?doc=AC1027 | https://search.clinicalgenome.org/kb/gene-validity/https://actionability.clinicalgenome.org/ac/Pediatric/ui/stg2SummaryRpt?doc=AC1027	Adult Actionability Working Group | Pediatric Actionability Working Group
MONDO:0008209	TFAP2B	HGNC:11743	https://search.clinicalgenome.org/kb/genes/HGNC:11743	Char syndrome	https://search.clinicalgenome.org/kb/conditions/MONDO:0008209		3 - Sufficient Evidence for Haploinsufficiency (08/13/2015)	0 - No Evidence for Haploinsufficiency (08/13/2015)	https://search.clinicalgenome.org/kb/gene-dosage/HGNC:11743	Dosage Working Group						
MONDO:0008215	LMNB1	HGNC:6637	https://search.clinicalgenome.org/kb/genes/HGNC:6637	adult-onset autosomal dominant demyelinating leukodystrophy	https://search.clinicalgenome.org/kb/conditions/MONDO:0008215		0 - No Evidence for Haploinsufficiency (07/06/2012)	3 - Sufficient Evidence for Haploinsufficiency (07/06/2012)	https://search.clinicalgenome.org/kb/gene-dosage/HGNC:6637	Dosage Working Group						
MONDO:0008221	PEPD	HGNC:8840	https://search.clinicalgenome.org/kb/genes/HGNC:8840	prolidase deficiency	https://search.clinicalgenome.org/kb/conditions/MONDO:0008221		30 - Gene Associated with Autosomal Recessive Phenotype (08/22/2016)		https://search.clinicalgenome.org/kb/gene-dosage/HGNC:8840	Dosage Working Group						
MONDO:0008233	MAX	HGNC:6913	https://search.clinicalgenome.org/kb/genes/HGNC:6913	pheochromocytoma	https://search.clinicalgenome.org/kb/conditions/MONDO:0008233		3 - Sufficient Evidence for Haploinsufficiency (07/20/2021)	0 - No Evidence for Haploinsufficiency (07/20/2021)	https://search.clinicalgenome.org/kb/gene-dosage/HGNC:6913	Dosage Working Group				Strong Actionability (10/31/2017)	https://search.clinicalgenome.org/kb/gene-validity/https://actionability.clinicalgenome.org/ac/Adult/ui/stg2SummaryRpt?doc=AC150	Adult Actionability Working Group
MONDO:0008234	RET	HGNC:9967	https://search.clinicalgenome.org/kb/genes/HGNC:9967	multiple endocrine neoplasia type 2A	https://search.clinicalgenome.org/kb/conditions/MONDO:0008234	Autosomal dominant inheritance	3 - Sufficient Evidence for Haploinsufficiency (08/26/2020)	0 - No Evidence for Haploinsufficiency (08/26/2020)	https://search.clinicalgenome.org/kb/gene-dosage/HGNC:9967	Dosage Working Group	definitive evidence (05/14/2020)	https://search.clinicalgenome.org/kb/gene-validity/CGGV:assertion_c5f3c875-2438-4bfe-b785-b86d7d3e6507-2020-05-14T005952.060Z	Hereditary Cancer	Strong Actionability (03/06/2019) | Strong Actionability (03/06/2019)	https://search.clinicalgenome.org/kb/gene-validity/https://actionability.clinicalgenome.org/ac/Adult/ui/stg2SummaryRpt?doc=AC080 | https://search.clinicalgenome.org/kb/gene-validity/https://actionability.clinicalgenome.org/ac/Pediatric/ui/stg2SummaryRpt?doc=AC080	Adult Actionability Working Group | Pediatric Actionability Working Group
MONDO:0008263	PKD1	HGNC:9008	https://search.clinicalgenome.org/kb/genes/HGNC:9008	polycystic kidney disease 1	https://search.clinicalgenome.org/kb/conditions/MONDO:0008263		3 - Sufficient Evidence for Haploinsufficiency (06/10/2020)	0 - No Evidence for Haploinsufficiency (06/10/2020)	https://search.clinicalgenome.org/kb/gene-dosage/HGNC:9008	Dosage Working Group				Moderate Actionability (11/05/2018)	https://search.clinicalgenome.org/kb/gene-validity/https://actionability.clinicalgenome.org/ac/Adult/ui/stg2SummaryRpt?doc=AC037	Adult Actionability Working Group
MONDO:0008265	PRKCSH	HGNC:9411	https://search.clinicalgenome.org/kb/genes/HGNC:9411	polycystic liver disease 1	https://search.clinicalgenome.org/kb/conditions/MONDO:0008265	Autosomal dominant inheritance					definitive evidence (07/08/2020)	https://search.clinicalgenome.org/kb/gene-validity/CGGV:assertion_83607ef3-6ec2-4d63-991a-4aeb3f7c2a25-2020-07-08T040000.000Z	Kidney Cystic and Ciliopathy Disorders			
MONDO:0008276	BMPR1A	HGNC:1076	https://search.clinicalgenome.org/kb/genes/HGNC:1076	generalized juvenile polyposis/juvenile polyposis coli	https://search.clinicalgenome.org/kb/conditions/MONDO:0008276	Autosomal dominant inheritance	3 - Sufficient Evidence for Haploinsufficiency (06/24/2020)	0 - No Evidence for Haploinsufficiency (06/24/2020)	https://search.clinicalgenome.org/kb/gene-dosage/HGNC:1076	Dosage Working Group	definitive evidence (06/12/2017)	https://search.clinicalgenome.org/kb/gene-validity/CGGCIEX:assertion_10029	Colon Cancer	Assertion Pending (12/18/2015)	https://search.clinicalgenome.org/kb/gene-validity/https://actionability.clinicalgenome.org/ac/Adult/ui/stg2SummaryRpt?doc=AC066	Adult Actionability Working Group
MONDO:0008278	SMAD4	HGNC:6770	https://search.clinicalgenome.org/kb/genes/HGNC:6770	juvenile polyposis/hereditary hemorrhagic telangiectasia syndrome	https://search.clinicalgenome.org/kb/conditions/MONDO:0008278	Autosomal dominant inheritance	3 - Sufficient Evidence for Haploinsufficiency (12/16/2020)	0 - No Evidence for Haploinsufficiency (12/16/2020)	https://search.clinicalgenome.org/kb/gene-dosage/HGNC:6770	Dosage Working Group	definitive evidence (12/16/2020)	https://search.clinicalgenome.org/kb/gene-validity/CGGV:assertion_b9b79d0f-4259-49d7-882d-4ca23bb7e8cf-2020-12-16T170000.000Z	Hemostasis Thrombosis	Assertion Pending (12/07/2015) | Assertion Pending (12/18/2015)	https://search.clinicalgenome.org/kb/gene-validity/https://actionability.clinicalgenome.org/ac/Adult/ui/stg2SummaryRpt?doc=AC107 | https://search.clinicalgenome.org/kb/gene-validity/https://actionability.clinicalgenome.org/ac/Adult/ui/stg2SummaryRpt?doc=AC066	Adult Actionability Working Group | Adult Actionability Working Group
MONDO:0008280	STK11	HGNC:11389	https://search.clinicalgenome.org/kb/genes/HGNC:11389	Peutz-Jeghers syndrome	https://search.clinicalgenome.org/kb/conditions/MONDO:0008280	Autosomal dominant inheritance	3 - Sufficient Evidence for Haploinsufficiency (11/10/2021)	0 - No Evidence for Haploinsufficiency (11/10/2021)	https://search.clinicalgenome.org/kb/gene-dosage/HGNC:11389	Dosage Working Group	definitive evidence (02/22/2017)	https://search.clinicalgenome.org/kb/gene-validity/CGGCIEX:assertion_9992	Colon Cancer	Strong Actionability (01/02/2020) | Moderate Actionability (01/02/2020)	https://search.clinicalgenome.org/kb/gene-validity/https://actionability.clinicalgenome.org/ac/Adult/ui/stg2SummaryRpt?doc=AC115 | https://search.clinicalgenome.org/kb/gene-validity/https://actionability.clinicalgenome.org/ac/Pediatric/ui/stg2SummaryRpt?doc=AC115	Adult Actionability Working Group | Pediatric Actionability Working Group
MONDO:0008287	GLI3	HGNC:4319	https://search.clinicalgenome.org/kb/genes/HGNC:4319	Greig cephalopolysyndactyly syndrome	https://search.clinicalgenome.org/kb/conditions/MONDO:0008287		3 - Sufficient Evidence for Haploinsufficiency (01/12/2021)	0 - No Evidence for Haploinsufficiency (01/12/2021)	https://search.clinicalgenome.org/kb/gene-dosage/HGNC:4319	Dosage Working Group						
MONDO:0008294	HMBS	HGNC:4982	https://search.clinicalgenome.org/kb/genes/HGNC:4982	acute intermittent porphyria	https://search.clinicalgenome.org/kb/conditions/MONDO:0008294		3 - Sufficient Evidence for Haploinsufficiency (01/08/2020)	0 - No Evidence for Haploinsufficiency (01/08/2020)	https://search.clinicalgenome.org/kb/gene-dosage/HGNC:4982	Dosage Working Group				Assertion Pending (09/14/2016)	https://search.clinicalgenome.org/kb/gene-validity/https://actionability.clinicalgenome.org/ac/Adult/ui/stg2SummaryRpt?doc=AC095	Adult Actionability Working Group
MONDO:0008305	MNX1	HGNC:4979	https://search.clinicalgenome.org/kb/genes/HGNC:4979	Currarino triad	https://search.clinicalgenome.org/kb/conditions/MONDO:0008305		3 - Sufficient Evidence for Haploinsufficiency (10/04/2012)	0 - No Evidence for Haploinsufficiency (10/04/2012)	https://search.clinicalgenome.org/kb/gene-dosage/HGNC:4979	Dosage Working Group						
MONDO:0008316	PROC	HGNC:9451	https://search.clinicalgenome.org/kb/genes/HGNC:9451	thrombophilia due to protein C deficiency, autosomal dominant	https://search.clinicalgenome.org/kb/conditions/MONDO:0008316									Assertion Pending (05/09/2017)	https://search.clinicalgenome.org/kb/gene-validity/https://actionability.clinicalgenome.org/ac/Adult/ui/stg2SummaryRpt?doc=AC135	Adult Actionability Working Group
MONDO:0008322	COMP	HGNC:2227	https://search.clinicalgenome.org/kb/genes/HGNC:2227	pseudoachondroplasia	https://search.clinicalgenome.org/kb/conditions/MONDO:0008322	Autosomal dominant inheritance					definitive evidence (02/07/2020)	https://search.clinicalgenome.org/kb/gene-validity/CGGV:assertion_630905e9-0f42-452b-81fa-7fad4eae08f9-2020-02-07T180000.000Z	Skeletal Disorders			
MONDO:0008323	SCNN1G	HGNC:10602	https://search.clinicalgenome.org/kb/genes/HGNC:10602	Liddle syndrome	https://search.clinicalgenome.org/kb/conditions/MONDO:0008323	Autosomal dominant inheritance					definitive evidence (06/17/2021)	https://search.clinicalgenome.org/kb/gene-validity/CGGV:assertion_60ce148e-eb8b-49c4-adec-ae98071f9cc2-2021-06-17T023000.000Z	Tubulopathy			
MONDO:0008329	NR3C2	HGNC:7979	https://search.clinicalgenome.org/kb/genes/HGNC:7979	autosomal dominant pseudohypoaldosteronism type 1	https://search.clinicalgenome.org/kb/conditions/MONDO:0008329	Autosomal dominant inheritance	3 - Sufficient Evidence for Haploinsufficiency (04/06/2020)	0 - No Evidence for Haploinsufficiency (04/06/2020)	https://search.clinicalgenome.org/kb/gene-dosage/HGNC:7979	Dosage Working Group	definitive evidence (07/15/2021)	https://search.clinicalgenome.org/kb/gene-validity/CGGV:assertion_8c78e824-d77d-4635-a181-6139b8e9c028-2021-07-15T023000.000Z	Tubulopathy			
MONDO:0008332	GP1BA	HGNC:4439	https://search.clinicalgenome.org/kb/genes/HGNC:4439	pseudo-von Willebrand disease	https://search.clinicalgenome.org/kb/conditions/MONDO:0008332	Autosomal dominant inheritance					definitive evidence (05/27/2020)	https://search.clinicalgenome.org/kb/gene-validity/CGGV:assertion_8fef91aa-8c41-4044-b601-da24c2bab351-2020-05-27T160000.000Z	Hemostasis Thrombosis			
MONDO:0008339	PSD3	HGNC:19093	https://search.clinicalgenome.org/kb/genes/HGNC:19093	antecubital pterygium syndrome	https://search.clinicalgenome.org/kb/conditions/MONDO:0008339	Autosomal dominant inheritance	0 - No Evidence for Haploinsufficiency (12/07/2016)	0 - No Evidence for Haploinsufficiency (12/07/2016)	https://search.clinicalgenome.org/kb/gene-dosage/HGNC:19093	Dosage Working Group	limited evidence (11/24/2016)	https://search.clinicalgenome.org/kb/gene-validity/CGGCIEX:assertion_4845	General Gene Curation			
MONDO:0008347	BMPR2	HGNC:1078	https://search.clinicalgenome.org/kb/genes/HGNC:1078	idiopathic and/or familial pulmonary arterial hypertension	https://search.clinicalgenome.org/kb/conditions/MONDO:0008347		3 - Sufficient Evidence for Haploinsufficiency (08/26/2020)	0 - No Evidence for Haploinsufficiency (08/26/2020)	https://search.clinicalgenome.org/kb/gene-dosage/HGNC:1078	Dosage Working Group				Moderate Actionability (09/11/2017)	https://search.clinicalgenome.org/kb/gene-validity/https://actionability.clinicalgenome.org/ac/Adult/ui/stg2SummaryRpt?doc=AC146	Adult Actionability Working Group
MONDO:0008380	RB1	HGNC:9884	https://search.clinicalgenome.org/kb/genes/HGNC:9884	retinoblastoma	https://search.clinicalgenome.org/kb/conditions/MONDO:0008380	Autosomal dominant inheritance	3 - Sufficient Evidence for Haploinsufficiency (03/09/2021)	0 - No Evidence for Haploinsufficiency (03/09/2021)	https://search.clinicalgenome.org/kb/gene-dosage/HGNC:9884	Dosage Working Group	definitive evidence (07/30/2020)	https://search.clinicalgenome.org/kb/gene-validity/CGGV:assertion_f8c79621-7ace-4c0c-874e-a315a2e6c872-2020-07-30T213929.219Z	Hereditary Cancer	Has Insufficient Evidence for Actionability Based on Early Rule-out (04/30/2018) | Strong Actionability (04/30/2018)	https://search.clinicalgenome.org/kb/gene-validity/https://actionability.clinicalgenome.org/ac/Adult/ui/stg2SummaryRpt?doc=AC001 | https://search.clinicalgenome.org/kb/gene-validity/https://actionability.clinicalgenome.org/ac/Pediatric/ui/stg2SummaryRpt?doc=AC001	Adult Actionability Working Group | Pediatric Actionability Working Group
MONDO:0008386	PITX2	HGNC:9005	https://search.clinicalgenome.org/kb/genes/HGNC:9005	Axenfeld-Rieger syndrome type 1	https://search.clinicalgenome.org/kb/conditions/MONDO:0008386		3 - Sufficient Evidence for Haploinsufficiency (07/06/2012)	0 - No Evidence for Haploinsufficiency (07/06/2012)	https://search.clinicalgenome.org/kb/gene-dosage/HGNC:9005	Dosage Working Group						
MONDO:0008389	WNT5A	HGNC:12784	https://search.clinicalgenome.org/kb/genes/HGNC:12784	autosomal dominant Robinow syndrome	https://search.clinicalgenome.org/kb/conditions/MONDO:0008389	Autosomal dominant inheritance					moderate evidence (02/03/2021)	https://search.clinicalgenome.org/kb/gene-validity/CGGV:assertion_0fb2940f-f0e0-442c-beb8-72fc959d5a43-2021-02-03T142016.299Z	Syndromic Disorders			
MONDO:0008393	CREBBP	HGNC:2348	https://search.clinicalgenome.org/kb/genes/HGNC:2348	Rubinstein-Taybi syndrome due to CREBBP mutations	https://search.clinicalgenome.org/kb/conditions/MONDO:0008393	Autosomal dominant inheritance	3 - Sufficient Evidence for Haploinsufficiency (10/23/2019)	0 - No Evidence for Haploinsufficiency (10/23/2019)	https://search.clinicalgenome.org/kb/gene-dosage/HGNC:2348	Dosage Working Group	definitive evidence (02/21/2018)	https://search.clinicalgenome.org/kb/gene-validity/CGGCIEX:assertion_9554	Intellectual Disability and Autism			
MONDO:0008411	TBX3	HGNC:11602	https://search.clinicalgenome.org/kb/genes/HGNC:11602	ulnar-mammary syndrome	https://search.clinicalgenome.org/kb/conditions/MONDO:0008411		3 - Sufficient Evidence for Haploinsufficiency (09/23/2020)	0 - No Evidence for Haploinsufficiency (09/23/2020)	https://search.clinicalgenome.org/kb/gene-dosage/HGNC:11602	Dosage Working Group						
MONDO:0008426	SKI	HGNC:10896	https://search.clinicalgenome.org/kb/genes/HGNC:10896	Shprintzen-Goldberg syndrome	https://search.clinicalgenome.org/kb/conditions/MONDO:0008426	Autosomal dominant inheritance	0 - No Evidence for Haploinsufficiency (01/06/2012)	0 - No Evidence for Haploinsufficiency (01/06/2012)	https://search.clinicalgenome.org/kb/gene-dosage/HGNC:10896	Dosage Working Group	definitive evidence (10/29/2020)	https://search.clinicalgenome.org/kb/gene-validity/CGGV:assertion_019ffb7a-be5f-482d-9adf-e28d5aadaede-2020-10-29T160000.000Z	Craniofacial Malformations			
MONDO:0008434	RAI1	HGNC:9834	https://search.clinicalgenome.org/kb/genes/HGNC:9834	Smith-Magenis syndrome	https://search.clinicalgenome.org/kb/conditions/MONDO:0008434	Autosomal dominant inheritance	3 - Sufficient Evidence for Haploinsufficiency (10/13/2020)	0 - No Evidence for Haploinsufficiency (10/13/2020)	https://search.clinicalgenome.org/kb/gene-dosage/HGNC:9834	Dosage Working Group	definitive evidence (09/27/2018)	https://search.clinicalgenome.org/kb/gene-validity/CGGV:assertion_1e576e58-debf-49c6-a86d-c599806180ff-2018-09-27T130055.105Z	Intellectual Disability and Autism			
MONDO:0008438	SPAST	HGNC:11233	https://search.clinicalgenome.org/kb/genes/HGNC:11233	hereditary spastic paraplegia 4	https://search.clinicalgenome.org/kb/conditions/MONDO:0008438		3 - Sufficient Evidence for Haploinsufficiency (09/25/2019)	0 - No Evidence for Haploinsufficiency (09/25/2019)	https://search.clinicalgenome.org/kb/gene-dosage/HGNC:11233	Dosage Working Group						
MONDO:0008471	COL2A1	HGNC:2200	https://search.clinicalgenome.org/kb/genes/HGNC:2200	spondyloepiphyseal dysplasia congenita	https://search.clinicalgenome.org/kb/conditions/MONDO:0008471	Autosomal dominant inheritance	3 - Sufficient Evidence for Haploinsufficiency (07/29/2020)	0 - No Evidence for Haploinsufficiency (07/29/2020)	https://search.clinicalgenome.org/kb/gene-dosage/HGNC:2200	Dosage Working Group	definitive evidence (06/07/2021)	https://search.clinicalgenome.org/kb/gene-validity/CGGV:assertion_0f217fba-a78c-4f9f-ad2a-301f0d53f046-2021-06-07T170000.000Z	Skeletal Disorders			
MONDO:0008473	TRPV4	HGNC:18083	https://search.clinicalgenome.org/kb/genes/HGNC:18083	spondyloepimetaphyseal dysplasia, Maroteaux type	https://search.clinicalgenome.org/kb/conditions/MONDO:0008473	Autosomal dominant inheritance					moderate evidence (05/19/2021)	https://search.clinicalgenome.org/kb/gene-validity/CGGV:assertion_17fcb720-754a-429a-b1f8-90db6d423a89-2021-05-19T160000.000Z	Skeletal Disorders			
MONDO:0008477	TRPV4	HGNC:18083	https://search.clinicalgenome.org/kb/genes/HGNC:18083	spondylometaphyseal dysplasia, Kozlowski type	https://search.clinicalgenome.org/kb/conditions/MONDO:0008477	Autosomal dominant inheritance					definitive evidence (06/07/2021)	https://search.clinicalgenome.org/kb/gene-validity/CGGV:assertion_d93031fa-8ea5-465a-a903-6e7ae36a5faa-2021-06-07T160000.000Z	Skeletal Disorders			
MONDO:0008504	ELN	HGNC:3327	https://search.clinicalgenome.org/kb/genes/HGNC:3327	supravalvular aortic stenosis	https://search.clinicalgenome.org/kb/conditions/MONDO:0008504		3 - Sufficient Evidence for Haploinsufficiency (07/10/2012)	0 - No Evidence for Haploinsufficiency (07/10/2012)	https://search.clinicalgenome.org/kb/gene-dosage/HGNC:3327	Dosage Working Group						
MONDO:0008513	HOXD13	HGNC:5136	https://search.clinicalgenome.org/kb/genes/HGNC:5136	synpolydactyly type 1	https://search.clinicalgenome.org/kb/conditions/MONDO:0008513		3 - Sufficient Evidence for Haploinsufficiency (09/23/2020)	0 - No Evidence for Haploinsufficiency (09/23/2020)	https://search.clinicalgenome.org/kb/gene-dosage/HGNC:5136	Dosage Working Group						
MONDO:0008519	NOG	HGNC:7866	https://search.clinicalgenome.org/kb/genes/HGNC:7866	multiple synostoses syndrome 1	https://search.clinicalgenome.org/kb/conditions/MONDO:0008519		3 - Sufficient Evidence for Haploinsufficiency (01/12/2021)	0 - No Evidence for Haploinsufficiency (01/12/2021)	https://search.clinicalgenome.org/kb/gene-dosage/HGNC:7866	Dosage Working Group						
MONDO:0008523	NOD2	HGNC:5331	https://search.clinicalgenome.org/kb/genes/HGNC:5331	Blau syndrome	https://search.clinicalgenome.org/kb/conditions/MONDO:0008523	Autosomal dominant inheritance					definitive evidence (10/07/2020)	https://search.clinicalgenome.org/kb/gene-validity/CGGV:assertion_1fd650d7-6a84-4b33-b86e-d34cab5b7d57-2020-10-07T171807.983Z	Syndromic Disorders			
MONDO:0008535	ENG	HGNC:3349	https://search.clinicalgenome.org/kb/genes/HGNC:3349	telangiectasia, hereditary hemorrhagic, type 1	https://search.clinicalgenome.org/kb/conditions/MONDO:0008535		3 - Sufficient Evidence for Haploinsufficiency (12/08/2016)	0 - No Evidence for Haploinsufficiency (12/08/2016)	https://search.clinicalgenome.org/kb/gene-dosage/HGNC:3349	Dosage Working Group				Assertion Pending (12/07/2015)	https://search.clinicalgenome.org/kb/gene-validity/https://actionability.clinicalgenome.org/ac/Adult/ui/stg2SummaryRpt?doc=AC107	Adult Actionability Working Group
MONDO:0008546	FGFR3	HGNC:3690	https://search.clinicalgenome.org/kb/genes/HGNC:3690	thanatophoric dysplasia type 1	https://search.clinicalgenome.org/kb/conditions/MONDO:0008546	Autosomal dominant inheritance	0 - No Evidence for Haploinsufficiency (11/09/2011)	0 - No Evidence for Haploinsufficiency (11/09/2011)	https://search.clinicalgenome.org/kb/gene-dosage/HGNC:3690	Dosage Working Group	definitive evidence (12/23/2021)	https://search.clinicalgenome.org/kb/gene-validity/CGGV:assertion_db0459d9-c5cc-455d-a6b2-e6ea81511336-2021-12-23T221850.458Z	Skeletal Disorders			
MONDO:0008547	FGFR3	HGNC:3690	https://search.clinicalgenome.org/kb/genes/HGNC:3690	thanatophoric dysplasia type 2	https://search.clinicalgenome.org/kb/conditions/MONDO:0008547	Autosomal dominant inheritance	0 - No Evidence for Haploinsufficiency (11/09/2011)	0 - No Evidence for Haploinsufficiency (11/09/2011)	https://search.clinicalgenome.org/kb/gene-dosage/HGNC:3690	Dosage Working Group	definitive evidence (01/31/2022)	https://search.clinicalgenome.org/kb/gene-validity/CGGV:assertion_1d5f870f-048e-4741-b5e0-2fcf70ed1b88-2022-01-31T170913.018Z	Skeletal Disorders			
MONDO:0008552	ITGA2B	HGNC:6138	https://search.clinicalgenome.org/kb/genes/HGNC:6138	platelet-type bleeding disorder 16	https://search.clinicalgenome.org/kb/conditions/MONDO:0008552	Autosomal dominant inheritance					moderate evidence (06/23/2021)	https://search.clinicalgenome.org/kb/gene-validity/CGGV:assertion_380c4fb9-aa51-4d34-9349-7938667612b7-2021-06-23T160000.000Z	Hemostasis Thrombosis			
MONDO:0008553	GFI1B	HGNC:4238	https://search.clinicalgenome.org/kb/genes/HGNC:4238	platelet-type bleeding disorder 17	https://search.clinicalgenome.org/kb/conditions/MONDO:0008553	Autosomal dominant inheritance					definitive evidence (11/27/2019)	https://search.clinicalgenome.org/kb/gene-validity/CGGV:assertion_62841ea9-5bd8-4250-ab41-31d7cf82d2e3-2019-11-27T170000.000Z	Hemostasis Thrombosis			
MONDO:0008554	THPO	HGNC:11795	https://search.clinicalgenome.org/kb/genes/HGNC:11795	thrombocythemia 1	https://search.clinicalgenome.org/kb/conditions/MONDO:0008554	Autosomal dominant inheritance					moderate evidence (03/23/2022)	https://search.clinicalgenome.org/kb/gene-validity/CGGV:assertion_e99d3899-efbe-4cb9-9170-748ea92892ce-2022-03-23T160000.000Z	Hemostasis Thrombosis			
MONDO:0008555	ANKRD26	HGNC:29186	https://search.clinicalgenome.org/kb/genes/HGNC:29186	thrombocytopenia 2	https://search.clinicalgenome.org/kb/conditions/MONDO:0008555	Autosomal dominant inheritance	0 - No Evidence for Haploinsufficiency (04/14/2021)	0 - No Evidence for Haploinsufficiency (04/14/2021)	https://search.clinicalgenome.org/kb/gene-dosage/HGNC:29186	Dosage Working Group	definitive evidence (09/25/2019)	https://search.clinicalgenome.org/kb/gene-validity/CGGV:assertion_e86bee2b-8353-48c2-8ea3-a6b2b26cdb2f-2019-09-25T160000.000Z	Hemostasis Thrombosis			
MONDO:0008559	F2	HGNC:3535	https://search.clinicalgenome.org/kb/genes/HGNC:3535	thrombophilia due to thrombin defect	https://search.clinicalgenome.org/kb/conditions/MONDO:0008559	Autosomal dominant inheritance					definitive evidence (06/24/2020)	https://search.clinicalgenome.org/kb/gene-validity/CGGV:assertion_6389b3a3-ef86-4588-9be8-eb79dcb8d3cd-2020-06-24T160000.000Z	Hemostasis Thrombosis			
MONDO:0008560	F5	HGNC:3542	https://search.clinicalgenome.org/kb/genes/HGNC:3542	thrombophilia due to activated protein C resistance	https://search.clinicalgenome.org/kb/conditions/MONDO:0008560	Autosomal dominant inheritance	30 - Gene Associated with Autosomal Recessive Phenotype (01/11/2018)	0 - No Evidence for Haploinsufficiency (01/11/2018)	https://search.clinicalgenome.org/kb/gene-dosage/HGNC:3542	Dosage Working Group	definitive evidence (09/30/2019)	https://search.clinicalgenome.org/kb/gene-validity/CGGV:assertion_ab28e09c-08ff-4149-a536-3cdb9cc4099f-2019-09-30T160000.000Z	Hemostasis Thrombosis	Assertion Pending (11/02/2015) | Assertion Pending (04/04/2016)	https://search.clinicalgenome.org/kb/gene-validity/https://actionability.clinicalgenome.org/ac/Adult/ui/stg2SummaryRpt?doc=AC106 | https://search.clinicalgenome.org/kb/gene-validity/https://actionability.clinicalgenome.org/ac/Adult/ui/stg2SummaryRpt?doc=AC105	Adult Actionability Working Group | Adult Actionability Working Group
MONDO:0008596	TRPS1	HGNC:12340	https://search.clinicalgenome.org/kb/genes/HGNC:12340	trichorhinophalangeal syndrome type I	https://search.clinicalgenome.org/kb/conditions/MONDO:0008596		3 - Sufficient Evidence for Haploinsufficiency (07/08/2020)	0 - No Evidence for Haploinsufficiency (07/08/2020)	https://search.clinicalgenome.org/kb/gene-dosage/HGNC:12340	Dosage Working Group						
MONDO:0008612	TSC1	HGNC:12362	https://search.clinicalgenome.org/kb/genes/HGNC:12362	tuberous sclerosis 1	https://search.clinicalgenome.org/kb/conditions/MONDO:0008612		3 - Sufficient Evidence for Haploinsufficiency (10/13/2020)	0 - No Evidence for Haploinsufficiency (10/13/2020)	https://search.clinicalgenome.org/kb/gene-dosage/HGNC:12362	Dosage Working Group				Assertion Pending (07/21/2015)	https://search.clinicalgenome.org/kb/gene-validity/https://actionability.clinicalgenome.org/ac/Adult/ui/stg2SummaryRpt?doc=AC026	Adult Actionability Working Group
MONDO:0008644	TBX1	HGNC:11592	https://search.clinicalgenome.org/kb/genes/HGNC:11592	velocardiofacial syndrome	https://search.clinicalgenome.org/kb/conditions/MONDO:0008644		2 - Emerging Evidence for Haploinsufficiency (04/12/2022)	0 - No Evidence for Haploinsufficiency (04/12/2022)	https://search.clinicalgenome.org/kb/gene-dosage/HGNC:11592	Dosage Working Group						
MONDO:0008647	MYH7	HGNC:7577	https://search.clinicalgenome.org/kb/genes/HGNC:7577	hypertrophic cardiomyopathy 1	https://search.clinicalgenome.org/kb/conditions/MONDO:0008647		0 - No Evidence for Haploinsufficiency (11/16/2015)	0 - No Evidence for Haploinsufficiency (11/16/2015)	https://search.clinicalgenome.org/kb/gene-dosage/HGNC:7577	Dosage Working Group				Assertion Pending (08/14/2017)	https://search.clinicalgenome.org/kb/gene-validity/https://actionability.clinicalgenome.org/ac/Adult/ui/stg2SummaryRpt?doc=AC056	Adult Actionability Working Group
MONDO:0008660	FGF23	HGNC:3680	https://search.clinicalgenome.org/kb/genes/HGNC:3680	autosomal dominant hypophosphatemic rickets	https://search.clinicalgenome.org/kb/conditions/MONDO:0008660									Has Insufficient Evidence for Actionability Based on Early Rule-out (11/18/2021) | Limited Actionability (07/11/2018)	https://search.clinicalgenome.org/kb/gene-validity/https://actionability.clinicalgenome.org/ac/Adult/ui/stg2SummaryRpt?doc=AC010 | https://search.clinicalgenome.org/kb/gene-validity/https://actionability.clinicalgenome.org/ac/Pediatric/ui/stg2SummaryRpt?doc=AC010	Adult Actionability Working Group | Pediatric Actionability Working Group
MONDO:0008667	VHL	HGNC:12687	https://search.clinicalgenome.org/kb/genes/HGNC:12687	von Hippel-Lindau disease	https://search.clinicalgenome.org/kb/conditions/MONDO:0008667	Autosomal dominant inheritance	3 - Sufficient Evidence for Haploinsufficiency (06/28/2017)	0 - No Evidence for Haploinsufficiency (06/28/2017)	https://search.clinicalgenome.org/kb/gene-dosage/HGNC:12687	Dosage Working Group	definitive evidence (05/14/2020)	https://search.clinicalgenome.org/kb/gene-validity/CGGV:assertion_30c04ced-b74d-465a-8d7d-eb822109b7f1-2020-05-14T004116.004Z	Hereditary Cancer	Strong Actionability (01/04/2022) | Moderate Actionability (01/04/2022)	https://search.clinicalgenome.org/kb/gene-validity/https://actionability.clinicalgenome.org/ac/Adult/ui/stg2SummaryRpt?doc=AC027 | https://search.clinicalgenome.org/kb/gene-validity/https://actionability.clinicalgenome.org/ac/Pediatric/ui/stg2SummaryRpt?doc=AC027	Adult Actionability Working Group | Pediatric Actionability Working Group
MONDO:0008668	VWF	HGNC:12726	https://search.clinicalgenome.org/kb/genes/HGNC:12726	von Willebrand disease 1	https://search.clinicalgenome.org/kb/conditions/MONDO:0008668									Assertion Pending (07/10/2017)	https://search.clinicalgenome.org/kb/gene-validity/https://actionability.clinicalgenome.org/ac/Adult/ui/stg2SummaryRpt?doc=AC144	Adult Actionability Working Group
MONDO:0008670	PAX3	HGNC:8617	https://search.clinicalgenome.org/kb/genes/HGNC:8617	Waardenburg syndrome type 1	https://search.clinicalgenome.org/kb/conditions/MONDO:0008670		3 - Sufficient Evidence for Haploinsufficiency (05/27/2020)	0 - No Evidence for Haploinsufficiency (05/27/2020)	https://search.clinicalgenome.org/kb/gene-dosage/HGNC:8617	Dosage Working Group						
MONDO:0008671	MITF	HGNC:7105	https://search.clinicalgenome.org/kb/genes/HGNC:7105	Waardenburg syndrome type 2A	https://search.clinicalgenome.org/kb/conditions/MONDO:0008671		3 - Sufficient Evidence for Haploinsufficiency (04/13/2021)	0 - No Evidence for Haploinsufficiency (04/13/2021)	https://search.clinicalgenome.org/kb/gene-dosage/HGNC:7105	Dosage Working Group						
MONDO:0008679	WT1	HGNC:12796	https://search.clinicalgenome.org/kb/genes/HGNC:12796	Wilms tumor 1	https://search.clinicalgenome.org/kb/conditions/MONDO:0008679	Autosomal dominant inheritance	3 - Sufficient Evidence for Haploinsufficiency (01/25/2022)	0 - No Evidence for Haploinsufficiency (01/25/2022)	https://search.clinicalgenome.org/kb/gene-dosage/HGNC:12796	Dosage Working Group	definitive evidence (07/30/2020)	https://search.clinicalgenome.org/kb/gene-validity/CGGV:assertion_65010002-ff97-4dc0-a89f-6c77abf0982a-2020-07-30T205501.047Z	Hereditary Cancer	Moderate Actionability (05/17/2018)	https://search.clinicalgenome.org/kb/gene-validity/https://actionability.clinicalgenome.org/ac/Pediatric/ui/stg2SummaryRpt?doc=AC003	Pediatric Actionability Working Group
MONDO:0008682	WT1	HGNC:12796	https://search.clinicalgenome.org/kb/genes/HGNC:12796	Denys-Drash syndrome	https://search.clinicalgenome.org/kb/conditions/MONDO:0008682	Autosomal dominant inheritance	3 - Sufficient Evidence for Haploinsufficiency (01/25/2022)	0 - No Evidence for Haploinsufficiency (01/25/2022)	https://search.clinicalgenome.org/kb/gene-dosage/HGNC:12796	Dosage Working Group	definitive evidence (07/27/2021)	https://search.clinicalgenome.org/kb/gene-validity/CGGV:assertion_cccc7a42-a49c-4a8d-8b9e-f16b81e9ee07-2021-07-27T210557.993Z	Hereditary Cancer			
MONDO:0008684	LETM1	HGNC:6556	https://search.clinicalgenome.org/kb/genes/HGNC:6556	Wolf-Hirschhorn syndrome	https://search.clinicalgenome.org/kb/conditions/MONDO:0008684		0 - No Evidence for Haploinsufficiency (02/03/2012)	0 - No Evidence for Haploinsufficiency (02/03/2012)	https://search.clinicalgenome.org/kb/gene-dosage/HGNC:6556	Dosage Working Group						
MONDO:0008692	MTTP	HGNC:7467	https://search.clinicalgenome.org/kb/genes/HGNC:7467	abetalipoproteinemia	https://search.clinicalgenome.org/kb/conditions/MONDO:0008692		30 - Gene Associated with Autosomal Recessive Phenotype (08/22/2016)	0 - No Evidence for Haploinsufficiency (08/22/2016)	https://search.clinicalgenome.org/kb/gene-dosage/HGNC:7467	Dosage Working Group						
MONDO:0008695	VPS13A	HGNC:1908	https://search.clinicalgenome.org/kb/genes/HGNC:1908	chorea-acanthocytosis	https://search.clinicalgenome.org/kb/conditions/MONDO:0008695		30 - Gene Associated with Autosomal Recessive Phenotype (08/22/2016)		https://search.clinicalgenome.org/kb/gene-dosage/HGNC:1908	Dosage Working Group						
MONDO:0008700	LMBR1	HGNC:13243	https://search.clinicalgenome.org/kb/genes/HGNC:13243	acheiropody	https://search.clinicalgenome.org/kb/conditions/MONDO:0008700		30 - Gene Associated with Autosomal Recessive Phenotype (10/18/2012)	0 - No Evidence for Haploinsufficiency (10/18/2012)	https://search.clinicalgenome.org/kb/gene-dosage/HGNC:13243	Dosage Working Group						
MONDO:0008702	COL2A1	HGNC:2200	https://search.clinicalgenome.org/kb/genes/HGNC:2200	achondrogenesis type II	https://search.clinicalgenome.org/kb/conditions/MONDO:0008702	Autosomal dominant inheritance	3 - Sufficient Evidence for Haploinsufficiency (07/29/2020)	0 - No Evidence for Haploinsufficiency (07/29/2020)	https://search.clinicalgenome.org/kb/gene-dosage/HGNC:2200	Dosage Working Group	definitive evidence (10/05/2020)	https://search.clinicalgenome.org/kb/gene-validity/CGGV:assertion_14640c06-c66e-4dc7-86ea-9b0850e51474-2020-10-05T170000.000Z	Skeletal Disorders			
MONDO:0008708	KIF7	HGNC:30497	https://search.clinicalgenome.org/kb/genes/HGNC:30497	acrocallosal syndrome	https://search.clinicalgenome.org/kb/conditions/MONDO:0008708		30 - Gene Associated with Autosomal Recessive Phenotype (08/22/2016)	0 - No Evidence for Haploinsufficiency (08/22/2016)	https://search.clinicalgenome.org/kb/gene-dosage/HGNC:30497	Dosage Working Group						
MONDO:0008710	RAB23	HGNC:14263	https://search.clinicalgenome.org/kb/genes/HGNC:14263	RAB23-related Carpenter syndrome	https://search.clinicalgenome.org/kb/conditions/MONDO:0008710	Autosomal recessive inheritance					definitive evidence (04/22/2021)	https://search.clinicalgenome.org/kb/gene-validity/CGGV:assertion_46756b21-4bb5-4384-a42c-cf10c76e98c8-2021-04-22T160000.000Z	Craniofacial Malformations			
MONDO:0008713	SLC39A4	HGNC:17129	https://search.clinicalgenome.org/kb/genes/HGNC:17129	acrodermatitis enteropathica	https://search.clinicalgenome.org/kb/conditions/MONDO:0008713									Strong Actionability (07/09/2018)	https://search.clinicalgenome.org/kb/gene-validity/https://actionability.clinicalgenome.org/ac/Pediatric/ui/stg2SummaryRpt?doc=AC005	Pediatric Actionability Working Group
MONDO:0008721	ACADM	HGNC:89	https://search.clinicalgenome.org/kb/genes/HGNC:89	medium chain acyl-CoA dehydrogenase deficiency	https://search.clinicalgenome.org/kb/conditions/MONDO:0008721	Autosomal recessive inheritance	30 - Gene Associated with Autosomal Recessive Phenotype (08/22/2016)	0 - No Evidence for Haploinsufficiency (08/22/2016)	https://search.clinicalgenome.org/kb/gene-dosage/HGNC:89	Dosage Working Group	definitive evidence (01/23/2018)	https://search.clinicalgenome.org/kb/gene-validity/CGGV:assertion_fb987774-0e5b-4466-924f-6f19fccc6599-2018-01-23T170000.000Z	Fatty Acid Oxidation Disorders	Strong Actionability (08/03/2020)	https://search.clinicalgenome.org/kb/gene-validity/https://actionability.clinicalgenome.org/ac/Pediatric/ui/stg2SummaryRpt?doc=AC1016	Pediatric Actionability Working Group
MONDO:0008722	ACADS	HGNC:90	https://search.clinicalgenome.org/kb/genes/HGNC:90	short chain acyl-CoA dehydrogenase deficiency	https://search.clinicalgenome.org/kb/conditions/MONDO:0008722	Autosomal recessive inheritance					definitive evidence (01/23/2018)	https://search.clinicalgenome.org/kb/gene-validity/CGGV:assertion_c6bc94e9-cdf2-4efb-b654-004541efc344-2018-01-23T170000.000Z	Fatty Acid Oxidation Disorders			
MONDO:0008723	ACADVL	HGNC:92	https://search.clinicalgenome.org/kb/genes/HGNC:92	very long chain acyl-CoA dehydrogenase deficiency	https://search.clinicalgenome.org/kb/conditions/MONDO:0008723	Autosomal recessive inheritance	30 - Gene Associated with Autosomal Recessive Phenotype (08/22/2016)	0 - No Evidence for Haploinsufficiency (08/22/2016)	https://search.clinicalgenome.org/kb/gene-dosage/HGNC:92	Dosage Working Group	definitive evidence (02/20/2018)	https://search.clinicalgenome.org/kb/gene-validity/CGGV:assertion_130ca053-9f40-4fd5-b89c-b9b374694fda-2018-02-20T170000.000Z	Fatty Acid Oxidation Disorders	Assertion Pending (03/08/2017)	https://search.clinicalgenome.org/kb/gene-validity/https://actionability.clinicalgenome.org/ac/Adult/ui/stg2SummaryRpt?doc=AC126	Adult Actionability Working Group
MONDO:0008726	POR	HGNC:9208	https://search.clinicalgenome.org/kb/genes/HGNC:9208	Antley-Bixler syndrome with genital anomalies and disordered steroidogenesis	https://search.clinicalgenome.org/kb/conditions/MONDO:0008726	Autosomal recessive inheritance	30 - Gene Associated with Autosomal Recessive Phenotype (08/22/2016)		https://search.clinicalgenome.org/kb/gene-dosage/HGNC:9208	Dosage Working Group	definitive evidence (03/23/2022)	https://search.clinicalgenome.org/kb/gene-validity/CGGV:assertion_6275d46a-f005-45f8-b3ec-e9722f8dd39e-2022-03-23T193729.312Z	Craniofacial Malformations			
MONDO:0008728	CYP21A2	HGNC:2600	https://search.clinicalgenome.org/kb/genes/HGNC:2600	classic congenital adrenal hyperplasia due to 21-hydroxylase deficiency	https://search.clinicalgenome.org/kb/conditions/MONDO:0008728		30 - Gene Associated with Autosomal Recessive Phenotype (07/06/2012)	0 - No Evidence for Haploinsufficiency (07/06/2012)	https://search.clinicalgenome.org/kb/gene-dosage/HGNC:2600	Dosage Working Group						
MONDO:0008746	OCA2	HGNC:8101	https://search.clinicalgenome.org/kb/genes/HGNC:8101	oculocutaneous albinism type 2	https://search.clinicalgenome.org/kb/conditions/MONDO:0008746	Autosomal recessive inheritance	30 - Gene Associated with Autosomal Recessive Phenotype (04/28/2012)	0 - No Evidence for Haploinsufficiency (04/28/2012)	https://search.clinicalgenome.org/kb/gene-dosage/HGNC:8101	Dosage Working Group	definitive evidence (08/25/2021)	https://search.clinicalgenome.org/kb/gene-validity/CGGV:assertion_7433c1e2-a3a6-4351-88e0-cb3edcf39910-2021-08-25T160000.000Z	General Gene Curation			
MONDO:0008747	TYRP1	HGNC:12450	https://search.clinicalgenome.org/kb/genes/HGNC:12450	oculocutaneous albinism type 3	https://search.clinicalgenome.org/kb/conditions/MONDO:0008747		30 - Gene Associated with Autosomal Recessive Phenotype (08/22/2016)		https://search.clinicalgenome.org/kb/gene-dosage/HGNC:12450	Dosage Working Group						
MONDO:0008748	HPS1	HGNC:5163	https://search.clinicalgenome.org/kb/genes/HGNC:5163	Hermansky-Pudlak syndrome 1	https://search.clinicalgenome.org/kb/conditions/MONDO:0008748	Autosomal recessive inheritance	30 - Gene Associated with Autosomal Recessive Phenotype (08/22/2016)		https://search.clinicalgenome.org/kb/gene-dosage/HGNC:5163	Dosage Working Group	definitive evidence (07/22/2019)	https://search.clinicalgenome.org/kb/gene-validity/CGGV:assertion_f6d44a89-527f-4864-a1e1-dcd0a17000ca-2019-07-22T142842.174Z	Hemostasis Thrombosis			
MONDO:0008753	HGD	HGNC:4892	https://search.clinicalgenome.org/kb/genes/HGNC:4892	alkaptonuria	https://search.clinicalgenome.org/kb/conditions/MONDO:0008753	Autosomal recessive inheritance					definitive evidence (06/29/2020)	https://search.clinicalgenome.org/kb/gene-validity/CGGV:assertion_5186836d-d9c6-4829-a0c9-59548460d6f2-2020-06-29T174125.541Z	Aminoacidopathy	Moderate Actionability (10/03/2018)	https://search.clinicalgenome.org/kb/gene-validity/https://actionability.clinicalgenome.org/ac/Adult/ui/stg2SummaryRpt?doc=AC156	Adult Actionability Working Group
MONDO:0008760	ACAT1	HGNC:93	https://search.clinicalgenome.org/kb/genes/HGNC:93	beta-ketothiolase deficiency	https://search.clinicalgenome.org/kb/conditions/MONDO:0008760	Autosomal recessive inheritance					definitive evidence (05/22/2018)	https://search.clinicalgenome.org/kb/gene-validity/CGGV:assertion_99bcab0a-de59-479d-8fe6-8b76cbce90ee-2018-05-22T160000.000Z	Fatty Acid Oxidation Disorders			
MONDO:0008762	COL4A3	HGNC:2204	https://search.clinicalgenome.org/kb/genes/HGNC:2204	autosomal recessive Alport syndrome	https://search.clinicalgenome.org/kb/conditions/MONDO:0008762		30 - Gene Associated with Autosomal Recessive Phenotype (05/22/2013)	0 - No Evidence for Haploinsufficiency (05/22/2013)	https://search.clinicalgenome.org/kb/gene-dosage/HGNC:2204	Dosage Working Group						
MONDO:0008763	ALMS1	HGNC:428	https://search.clinicalgenome.org/kb/genes/HGNC:428	Alstrom syndrome	https://search.clinicalgenome.org/kb/conditions/MONDO:0008763	Autosomal recessive inheritance	30 - Gene Associated with Autosomal Recessive Phenotype (08/22/2016)	0 - No Evidence for Haploinsufficiency (08/22/2016)	https://search.clinicalgenome.org/kb/gene-dosage/HGNC:428	Dosage Working Group	definitive evidence (02/10/2017)	https://search.clinicalgenome.org/kb/gene-validity/CGGCIEX:assertion_6238	Hearing Loss			
MONDO:0008765	RPE65	HGNC:10294	https://search.clinicalgenome.org/kb/genes/HGNC:10294	Leber congenital amaurosis 2	https://search.clinicalgenome.org/kb/conditions/MONDO:0008765									Strong Actionability (02/25/2019) | Moderate Actionability (02/25/2019)	https://search.clinicalgenome.org/kb/gene-validity/https://actionability.clinicalgenome.org/ac/Adult/ui/stg2SummaryRpt?doc=AC012 | https://search.clinicalgenome.org/kb/gene-validity/https://actionability.clinicalgenome.org/ac/Pediatric/ui/stg2SummaryRpt?doc=AC012	Adult Actionability Working Group | Pediatric Actionability Working Group
MONDO:0008767	CLN3	HGNC:2074	https://search.clinicalgenome.org/kb/genes/HGNC:2074	neuronal ceroid lipofuscinosis 3	https://search.clinicalgenome.org/kb/conditions/MONDO:0008767		30 - Gene Associated with Autosomal Recessive Phenotype (08/22/2016)		https://search.clinicalgenome.org/kb/gene-dosage/HGNC:2074	Dosage Working Group						
MONDO:0008774	DHTKD1	HGNC:23537	https://search.clinicalgenome.org/kb/genes/HGNC:23537	2-aminoadipic 2-oxoadipic aciduria	https://search.clinicalgenome.org/kb/conditions/MONDO:0008774	Autosomal recessive inheritance					definitive evidence (11/03/2020)	https://search.clinicalgenome.org/kb/gene-validity/CGGV:assertion_d6dd5de3-9819-432d-996c-12a66dff277f-2020-11-03T193815.515Z	Aminoacidopathy			
MONDO:0008777	TACSTD2	HGNC:11530	https://search.clinicalgenome.org/kb/genes/HGNC:11530	gelatinous drop-like corneal dystrophy	https://search.clinicalgenome.org/kb/conditions/MONDO:0008777		30 - Gene Associated with Autosomal Recessive Phenotype (08/22/2016)	0 - No Evidence for Haploinsufficiency (08/22/2016)	https://search.clinicalgenome.org/kb/gene-dosage/HGNC:11530	Dosage Working Group						
MONDO:0008788	TMPRSS6	HGNC:16517	https://search.clinicalgenome.org/kb/genes/HGNC:16517	IRIDA syndrome	https://search.clinicalgenome.org/kb/conditions/MONDO:0008788		30 - Gene Associated with Autosomal Recessive Phenotype (08/22/2016)	0 - No Evidence for Haploinsufficiency (08/22/2016)	https://search.clinicalgenome.org/kb/gene-dosage/HGNC:16517	Dosage Working Group						
MONDO:0008795	ITPR1	HGNC:6180	https://search.clinicalgenome.org/kb/genes/HGNC:6180	aniridia-cerebellar ataxia-intellectual disability syndrome	https://search.clinicalgenome.org/kb/conditions/MONDO:0008795	Autosomal dominant inheritance					definitive evidence (11/03/2021)	https://search.clinicalgenome.org/kb/gene-validity/CGGV:assertion_a848b265-8aa3-41ee-83cc-9287afe0f9d0-2021-11-03T160000.000Z	Intellectual Disability and Autism			
MONDO:0008798	RSPO4	HGNC:16175	https://search.clinicalgenome.org/kb/genes/HGNC:16175	nonsyndromic congenital nail disorder 4	https://search.clinicalgenome.org/kb/conditions/MONDO:0008798		30 - Gene Associated with Autosomal Recessive Phenotype (08/22/2016)		https://search.clinicalgenome.org/kb/gene-dosage/HGNC:16175	Dosage Working Group						
MONDO:0008799	SOX2	HGNC:11195	https://search.clinicalgenome.org/kb/genes/HGNC:11195	anophthalmia/microphthalmia-esophageal atresia syndrome	https://search.clinicalgenome.org/kb/conditions/MONDO:0008799		3 - Sufficient Evidence for Haploinsufficiency (07/06/2012)	0 - No Evidence for Haploinsufficiency (07/06/2012)	https://search.clinicalgenome.org/kb/gene-dosage/HGNC:11195	Dosage Working Group						
MONDO:0008800	SMOC1	HGNC:20318	https://search.clinicalgenome.org/kb/genes/HGNC:20318	microphthalmia with limb anomalies	https://search.clinicalgenome.org/kb/conditions/MONDO:0008800		30 - Gene Associated with Autosomal Recessive Phenotype (08/22/2016)	0 - No Evidence for Haploinsufficiency (08/22/2016)	https://search.clinicalgenome.org/kb/gene-dosage/HGNC:20318	Dosage Working Group						
MONDO:0008810	APOC2	HGNC:609	https://search.clinicalgenome.org/kb/genes/HGNC:609	familial apolipoprotein C-II deficiency	https://search.clinicalgenome.org/kb/conditions/MONDO:0008810		30 - Gene Associated with Autosomal Recessive Phenotype (08/22/2016)		https://search.clinicalgenome.org/kb/gene-dosage/HGNC:609	Dosage Working Group						
MONDO:0008814	ARG1	HGNC:663	https://search.clinicalgenome.org/kb/genes/HGNC:663	hyperargininemia	https://search.clinicalgenome.org/kb/conditions/MONDO:0008814	Autosomal recessive inheritance	30 - Gene Associated with Autosomal Recessive Phenotype (08/22/2016)	0 - No Evidence for Haploinsufficiency (08/22/2016)	https://search.clinicalgenome.org/kb/gene-dosage/HGNC:663	Dosage Working Group	definitive evidence (06/29/2020)	https://search.clinicalgenome.org/kb/gene-validity/CGGV:assertion_0157f793-9232-4700-bbf0-dfb16270f688-2020-06-29T174101.533Z	Aminoacidopathy			
MONDO:0008815	ASL	HGNC:746	https://search.clinicalgenome.org/kb/genes/HGNC:746	argininosuccinic aciduria	https://search.clinicalgenome.org/kb/conditions/MONDO:0008815	Autosomal recessive inheritance	30 - Gene Associated with Autosomal Recessive Phenotype (08/22/2016)		https://search.clinicalgenome.org/kb/gene-dosage/HGNC:746	Dosage Working Group	definitive evidence (09/15/2018)	https://search.clinicalgenome.org/kb/gene-validity/CGGV:assertion_c16021b9-f6db-4e41-90f3-4786d63a1fa3-2018-09-15T160000.000Z	Aminoacidopathy	Has Insufficient Evidence for Actionability Based on Early Rule-out (05/04/2021) | Moderate Actionability (05/04/2021)	https://search.clinicalgenome.org/kb/gene-validity/https://actionability.clinicalgenome.org/ac/Adult/ui/stg2SummaryRpt?doc=AC1028 | https://search.clinicalgenome.org/kb/gene-validity/https://actionability.clinicalgenome.org/ac/Pediatric/ui/stg2SummaryRpt?doc=AC1028	Adult Actionability Working Group | Pediatric Actionability Working Group
MONDO:0008818	SLC2A10	HGNC:13444	https://search.clinicalgenome.org/kb/genes/HGNC:13444	arterial tortuosity syndrome	https://search.clinicalgenome.org/kb/conditions/MONDO:0008818		30 - Gene Associated with Autosomal Recessive Phenotype (02/01/2018)	0 - No Evidence for Haploinsufficiency (02/01/2018)	https://search.clinicalgenome.org/kb/gene-dosage/HGNC:13444	Dosage Working Group				Moderate Actionability (10/18/2017)	https://search.clinicalgenome.org/kb/gene-validity/https://actionability.clinicalgenome.org/ac/Adult/ui/stg2SummaryRpt?doc=AC147	Adult Actionability Working Group
MONDO:0008822	VPS33B	HGNC:12712	https://search.clinicalgenome.org/kb/genes/HGNC:12712	arthrogryposis, renal dysfunction, and cholestasis 1	https://search.clinicalgenome.org/kb/conditions/MONDO:0008822	Autosomal recessive inheritance					definitive evidence (03/24/2021)	https://search.clinicalgenome.org/kb/gene-validity/CGGV:assertion_d38d685c-9aee-4660-9228-4119a4fd583d-2021-03-24T160534.056Z	Hemostasis Thrombosis			
MONDO:0008827	CCN6	HGNC:12771	https://search.clinicalgenome.org/kb/genes/HGNC:12771	progressive pseudorheumatoid arthropathy of childhood	https://search.clinicalgenome.org/kb/conditions/MONDO:0008827		30 - Gene Associated with Autosomal Recessive Phenotype (08/22/2016)		https://search.clinicalgenome.org/kb/gene-dosage/HGNC:12771	Dosage Working Group						
MONDO:0008828	PRG4	HGNC:9364	https://search.clinicalgenome.org/kb/genes/HGNC:9364	camptodactyly-arthropathy-coxa vara-pericarditis syndrome	https://search.clinicalgenome.org/kb/conditions/MONDO:0008828	Autosomal recessive inheritance	30 - Gene Associated with Autosomal Recessive Phenotype (08/22/2016)	0 - No Evidence for Haploinsufficiency (08/22/2016)	https://search.clinicalgenome.org/kb/gene-dosage/HGNC:9364	Dosage Working Group	definitive evidence (07/30/2021)	https://search.clinicalgenome.org/kb/gene-validity/CGGV:assertion_3b4be938-664c-421e-922b-dc6ac83e5dec-2021-07-30T130737.801Z	Syndromic Disorders			
MONDO:0008830	AGA	HGNC:318	https://search.clinicalgenome.org/kb/genes/HGNC:318	aspartylglucosaminuria	https://search.clinicalgenome.org/kb/conditions/MONDO:0008830		30 - Gene Associated with Autosomal Recessive Phenotype (08/22/2016)		https://search.clinicalgenome.org/kb/gene-dosage/HGNC:318	Dosage Working Group						
MONDO:0008840	ATM	HGNC:795	https://search.clinicalgenome.org/kb/genes/HGNC:795	ataxia telangiectasia	https://search.clinicalgenome.org/kb/conditions/MONDO:0008840	Autosomal recessive inheritance	3 - Sufficient Evidence for Haploinsufficiency (04/08/2020)	0 - No Evidence for Haploinsufficiency (04/08/2020)	https://search.clinicalgenome.org/kb/gene-dosage/HGNC:795	Dosage Working Group	definitive evidence (07/27/2021)	https://search.clinicalgenome.org/kb/gene-validity/CGGV:assertion_02a69e27-77dc-41bd-83d2-dda9c224ee43-2021-07-27T205239.729Z	Hereditary Cancer			
MONDO:0008852	PHOX2B	HGNC:9143	https://search.clinicalgenome.org/kb/genes/HGNC:9143	congenital central hypoventilation syndrome	https://search.clinicalgenome.org/kb/conditions/MONDO:0008852	Autosomal dominant inheritance					definitive evidence (06/15/2021)	https://search.clinicalgenome.org/kb/gene-validity/CGGV:assertion_5ed68efa-cafc-4e28-ab56-ab9b65666c15-2021-06-15T151832.283Z	Hereditary Cancer			
MONDO:0008861	MCCC1	HGNC:6936	https://search.clinicalgenome.org/kb/genes/HGNC:6936	3-methylcrotonyl-CoA carboxylase 1 deficiency	https://search.clinicalgenome.org/kb/conditions/MONDO:0008861		30 - Gene Associated with Autosomal Recessive Phenotype (08/22/2016)	0 - No Evidence for Haploinsufficiency (08/22/2016)	https://search.clinicalgenome.org/kb/gene-dosage/HGNC:6936	Dosage Working Group						
MONDO:0008863	ABCG5	HGNC:13886	https://search.clinicalgenome.org/kb/genes/HGNC:13886	sitosterolemia	https://search.clinicalgenome.org/kb/conditions/MONDO:0008863	Autosomal recessive inheritance	30 - Gene Associated with Autosomal Recessive Phenotype (08/22/2016)		https://search.clinicalgenome.org/kb/gene-dosage/HGNC:13886	Dosage Working Group	definitive evidence (07/10/2020)	https://search.clinicalgenome.org/kb/gene-validity/CGGV:assertion_c52c7403-8975-4a3f-8796-a966e977f708-2020-07-10T160000.000Z	Hemostasis Thrombosis			
MONDO:0008865	CYP4V2	HGNC:23198	https://search.clinicalgenome.org/kb/genes/HGNC:23198	Bietti crystalline corneoretinal dystrophy	https://search.clinicalgenome.org/kb/conditions/MONDO:0008865	Autosomal recessive inheritance	30 - Gene Associated with Autosomal Recessive Phenotype (08/22/2016)		https://search.clinicalgenome.org/kb/gene-dosage/HGNC:23198	Dosage Working Group	definitive evidence (04/01/2021)	https://search.clinicalgenome.org/kb/gene-validity/CGGV:assertion_da577a4b-5c65-43fa-9a03-b275eaacb6eb-2021-04-01T160000.000Z	Retina			
MONDO:0008876	BLM	HGNC:1058	https://search.clinicalgenome.org/kb/genes/HGNC:1058	Bloom syndrome	https://search.clinicalgenome.org/kb/conditions/MONDO:0008876	Autosomal recessive inheritance	30 - Gene Associated with Autosomal Recessive Phenotype (02/09/2022)	0 - No Evidence for Haploinsufficiency (02/09/2022)	https://search.clinicalgenome.org/kb/gene-dosage/HGNC:1058	Dosage Working Group	definitive evidence (10/09/2018)	https://search.clinicalgenome.org/kb/gene-validity/CGGV:assertion_e0a20b67-5a62-462c-894b-76b60a66e979-2018-10-09T170000.000Z	Hereditary Cancer			
MONDO:0008907	PMM2	HGNC:9115	https://search.clinicalgenome.org/kb/genes/HGNC:9115	PMM2-CDG	https://search.clinicalgenome.org/kb/conditions/MONDO:0008907		30 - Gene Associated with Autosomal Recessive Phenotype (08/22/2016)	0 - No Evidence for Haploinsufficiency (08/22/2016)	https://search.clinicalgenome.org/kb/gene-dosage/HGNC:9115	Dosage Working Group						
MONDO:0008910	CPN1	HGNC:2312	https://search.clinicalgenome.org/kb/genes/HGNC:2312	carboxypeptidase N deficiency	https://search.clinicalgenome.org/kb/conditions/MONDO:0008910		30 - Gene Associated with Autosomal Recessive Phenotype (08/22/2016)	0 - No Evidence for Haploinsufficiency (08/22/2016)	https://search.clinicalgenome.org/kb/gene-dosage/HGNC:2312	Dosage Working Group						
MONDO:0008918	SLC25A20	HGNC:1421	https://search.clinicalgenome.org/kb/genes/HGNC:1421	carnitine-acylcarnitine translocase deficiency	https://search.clinicalgenome.org/kb/conditions/MONDO:0008918	Autosomal recessive inheritance					definitive evidence (05/22/2018)	https://search.clinicalgenome.org/kb/gene-validity/CGGV:assertion_95c9aece-49b5-496f-9547-f6d03dd69b4f-2018-05-22T160000.000Z	Fatty Acid Oxidation Disorders			
MONDO:0008919	SLC22A5	HGNC:10969	https://search.clinicalgenome.org/kb/genes/HGNC:10969	systemic primary carnitine deficiency disease	https://search.clinicalgenome.org/kb/conditions/MONDO:0008919	Autosomal recessive inheritance					definitive evidence (04/24/2018)	https://search.clinicalgenome.org/kb/gene-validity/CGGV:assertion_2beee8a9-193c-41ca-92c4-484c8e034b02-2018-04-24T160000.000Z	Fatty Acid Oxidation Disorders			
MONDO:0008922	AGK	HGNC:21869	https://search.clinicalgenome.org/kb/genes/HGNC:21869	Sengers syndrome	https://search.clinicalgenome.org/kb/conditions/MONDO:0008922		30 - Gene Associated with Autosomal Recessive Phenotype (11/20/2014)	0 - No Evidence for Haploinsufficiency (11/20/2014)	https://search.clinicalgenome.org/kb/gene-dosage/HGNC:21869	Dosage Working Group						
MONDO:0008944	INPP5E	HGNC:21474	https://search.clinicalgenome.org/kb/genes/HGNC:21474	Joubert syndrome 1	https://search.clinicalgenome.org/kb/conditions/MONDO:0008944	Autosomal recessive inheritance	30 - Gene Associated with Autosomal Recessive Phenotype (08/22/2016)	0 - No Evidence for Haploinsufficiency (08/22/2016)	https://search.clinicalgenome.org/kb/gene-dosage/HGNC:21474	Dosage Working Group	definitive evidence (09/08/2021)	https://search.clinicalgenome.org/kb/gene-validity/CGGV:assertion_a5fb970a-8747-4c3e-8465-d8cb007c1428-2021-09-08T160000.000Z	Kidney Cystic and Ciliopathy Disorders			
MONDO:0008948	CYP27A1	HGNC:2605	https://search.clinicalgenome.org/kb/genes/HGNC:2605	cerebrotendinous xanthomatosis	https://search.clinicalgenome.org/kb/conditions/MONDO:0008948		30 - Gene Associated with Autosomal Recessive Phenotype (08/22/2016)		https://search.clinicalgenome.org/kb/gene-dosage/HGNC:2605	Dosage Working Group						
MONDO:0008952	TMCO1	HGNC:18188	https://search.clinicalgenome.org/kb/genes/HGNC:18188	cerebrofaciothoracic dysplasia	https://search.clinicalgenome.org/kb/conditions/MONDO:0008952		30 - Gene Associated with Autosomal Recessive Phenotype (08/22/2016)		https://search.clinicalgenome.org/kb/gene-dosage/HGNC:18188	Dosage Working Group						
MONDO:0008962	MYO5A	HGNC:7602	https://search.clinicalgenome.org/kb/genes/HGNC:7602	Griscelli syndrome type 1	https://search.clinicalgenome.org/kb/conditions/MONDO:0008962	Autosomal recessive inheritance	30 - Gene Associated with Autosomal Recessive Phenotype (08/22/2016)	0 - No Evidence for Haploinsufficiency (08/22/2016)	https://search.clinicalgenome.org/kb/gene-dosage/HGNC:7602	Dosage Working Group	definitive evidence (07/27/2021)	https://search.clinicalgenome.org/kb/gene-validity/CGGV:assertion_792cf7b2-5ca7-4d85-95a5-a43eaa52b180-2021-07-27T144901.941Z	Syndromic Disorders			
MONDO:0008963	LYST	HGNC:1968	https://search.clinicalgenome.org/kb/genes/HGNC:1968	Chediak-Higashi syndrome	https://search.clinicalgenome.org/kb/conditions/MONDO:0008963	Autosomal recessive inheritance	30 - Gene Associated with Autosomal Recessive Phenotype (08/22/2016)	0 - No Evidence for Haploinsufficiency (08/22/2016)	https://search.clinicalgenome.org/kb/gene-dosage/HGNC:1968	Dosage Working Group	definitive evidence (05/27/2020)	https://search.clinicalgenome.org/kb/gene-validity/CGGV:assertion_5d752f7c-43d2-4ba9-910f-f286f5443012-2020-05-27T160000.000Z	Hemostasis Thrombosis			
MONDO:0008965	CHD7	HGNC:20626	https://search.clinicalgenome.org/kb/genes/HGNC:20626	CHARGE syndrome	https://search.clinicalgenome.org/kb/conditions/MONDO:0008965	Autosomal dominant inheritance	3 - Sufficient Evidence for Haploinsufficiency (07/06/2012)	0 - No Evidence for Haploinsufficiency (07/06/2012)	https://search.clinicalgenome.org/kb/gene-dosage/HGNC:20626	Dosage Working Group	definitive evidence (08/23/2018)	https://search.clinicalgenome.org/kb/gene-validity/CGGV:assertion_26ae5799-567b-431b-b981-3bc2f8635802-2018-08-23T160000.000Z	Hearing Loss			
MONDO:0008974	LBR	HGNC:6518	https://search.clinicalgenome.org/kb/genes/HGNC:6518	Greenberg dysplasia	https://search.clinicalgenome.org/kb/conditions/MONDO:0008974		30 - Gene Associated with Autosomal Recessive Phenotype (02/23/2015)	0 - No Evidence for Haploinsufficiency (02/23/2015)	https://search.clinicalgenome.org/kb/gene-dosage/HGNC:6518	Dosage Working Group						
MONDO:0008975	COL11A2	HGNC:2187	https://search.clinicalgenome.org/kb/genes/HGNC:2187	otospondylomegaepiphyseal dysplasia	https://search.clinicalgenome.org/kb/conditions/MONDO:0008975	Autosomal dominant inheritance | Autosomal recessive inheritance					definitive evidence (12/20/2018) | definitive evidence (12/20/2018)	https://search.clinicalgenome.org/kb/gene-validity/CGGV:assertion_177bddd8-0566-4f80-a9f1-679ca96a7c60-2018-12-20T170000.000Z | https://search.clinicalgenome.org/kb/gene-validity/CGGV:assertion_27b13a91-0a04-4393-bf1c-4f8418154c9b-2018-12-20T170000.000Z	Hearing Loss | Hearing Loss			
MONDO:0008988	ASS1	HGNC:758	https://search.clinicalgenome.org/kb/genes/HGNC:758	citrullinemia type I	https://search.clinicalgenome.org/kb/conditions/MONDO:0008988	Autosomal recessive inheritance					definitive evidence (12/27/2018)	https://search.clinicalgenome.org/kb/gene-validity/CGGV:assertion_5dc5ef32-81ca-478e-be42-436da3416e4d-2018-12-27T170000.000Z	Aminoacidopathy	Strong Actionability (10/26/2020)	https://search.clinicalgenome.org/kb/gene-validity/https://actionability.clinicalgenome.org/ac/Pediatric/ui/stg2SummaryRpt?doc=AC1017	Pediatric Actionability Working Group
MONDO:0008999	VPS13B	HGNC:2183	https://search.clinicalgenome.org/kb/genes/HGNC:2183	Cohen syndrome	https://search.clinicalgenome.org/kb/conditions/MONDO:0008999	Autosomal recessive inheritance	30 - Gene Associated with Autosomal Recessive Phenotype (06/26/2013)	0 - No Evidence for Haploinsufficiency (06/26/2013)	https://search.clinicalgenome.org/kb/gene-dosage/HGNC:2183	Dosage Working Group	definitive evidence (11/13/2018)	https://search.clinicalgenome.org/kb/gene-validity/CGGV:assertion_ccfc68bc-9f00-4565-b2c7-70ad9f8e2002-2018-11-13T153457.342Z	Intellectual Disability and Autism			
MONDO:0009007	CNNM4	HGNC:105	https://search.clinicalgenome.org/kb/genes/HGNC:105	Jalili syndrome	https://search.clinicalgenome.org/kb/conditions/MONDO:0009007	Autosomal recessive inheritance	30 - Gene Associated with Autosomal Recessive Phenotype (08/22/2016)		https://search.clinicalgenome.org/kb/gene-dosage/HGNC:105	Dosage Working Group	definitive evidence (08/06/2021)	https://search.clinicalgenome.org/kb/gene-validity/CGGV:assertion_e3cedd07-df9e-4838-8a6b-b24b2802f223-2021-08-06T154836.361Z	Retina			
MONDO:0009009	PLG	HGNC:9071	https://search.clinicalgenome.org/kb/genes/HGNC:9071	hypoplasminogenemia	https://search.clinicalgenome.org/kb/conditions/MONDO:0009009	Autosomal recessive inheritance					definitive evidence (10/23/2019)	https://search.clinicalgenome.org/kb/gene-validity/CGGV:assertion_2c9320e7-9f02-4b54-beba-0ca781a442eb-2019-10-23T160000.000Z	Hemostasis Thrombosis			
MONDO:0009014	KERA	HGNC:6309	https://search.clinicalgenome.org/kb/genes/HGNC:6309	cornea plana 2	https://search.clinicalgenome.org/kb/conditions/MONDO:0009014		30 - Gene Associated with Autosomal Recessive Phenotype (08/22/2016)		https://search.clinicalgenome.org/kb/gene-dosage/HGNC:6309	Dosage Working Group						
MONDO:0009020	CHST6	HGNC:6938	https://search.clinicalgenome.org/kb/genes/HGNC:6938	macular corneal dystrophy	https://search.clinicalgenome.org/kb/conditions/MONDO:0009020		30 - Gene Associated with Autosomal Recessive Phenotype (08/22/2016)	0 - No Evidence for Haploinsufficiency (08/22/2016)	https://search.clinicalgenome.org/kb/gene-dosage/HGNC:6938	Dosage Working Group						
MONDO:0009026	BRAF	HGNC:1097	https://search.clinicalgenome.org/kb/genes/HGNC:1097	Costello syndrome	https://search.clinicalgenome.org/kb/conditions/MONDO:0009026	Autosomal dominant inheritance	1 - Little Evidence for Haploinsufficiency (08/04/2014)	0 - No Evidence for Haploinsufficiency (08/04/2014)	https://search.clinicalgenome.org/kb/gene-dosage/HGNC:1097	Dosage Working Group	disputing (07/24/2018)	https://search.clinicalgenome.org/kb/gene-validity/CGGV:assertion_f229eceb-8f5e-4ecb-a484-7863b8dc7d19-2018-07-24T160000.000Z	RASopathy			
MONDO:0009058	CTH	HGNC:2501	https://search.clinicalgenome.org/kb/genes/HGNC:2501	cystathioninuria	https://search.clinicalgenome.org/kb/conditions/MONDO:0009058	Autosomal recessive inheritance	30 - Gene Associated with Autosomal Recessive Phenotype (08/22/2016)	0 - No Evidence for Haploinsufficiency (08/22/2016)	https://search.clinicalgenome.org/kb/gene-dosage/HGNC:2501	Dosage Working Group	definitive evidence (06/14/2019)	https://search.clinicalgenome.org/kb/gene-validity/CGGV:assertion_2f5047f7-80ba-4b8f-8009-59d7130e63be-2019-06-14T160000.000Z	Aminoacidopathy			
MONDO:0009061	CFTR	HGNC:1884	https://search.clinicalgenome.org/kb/genes/HGNC:1884	cystic fibrosis	https://search.clinicalgenome.org/kb/conditions/MONDO:0009061		30 - Gene Associated with Autosomal Recessive Phenotype (08/22/2016)		https://search.clinicalgenome.org/kb/gene-dosage/HGNC:1884	Dosage Working Group						
MONDO:0009064	CTNS	HGNC:2518	https://search.clinicalgenome.org/kb/genes/HGNC:2518	ocular cystinosis	https://search.clinicalgenome.org/kb/conditions/MONDO:0009064		30 - Gene Associated with Autosomal Recessive Phenotype (08/22/2012)	0 - No Evidence for Haploinsufficiency (08/22/2012)	https://search.clinicalgenome.org/kb/gene-dosage/HGNC:2518	Dosage Working Group				Moderate Actionability (11/27/2018)	https://search.clinicalgenome.org/kb/gene-validity/https://actionability.clinicalgenome.org/ac/Pediatric/ui/stg2SummaryRpt?doc=AC007	Pediatric Actionability Working Group
MONDO:0009066	CTNS	HGNC:2518	https://search.clinicalgenome.org/kb/genes/HGNC:2518	juvenile nephropathic cystinosis	https://search.clinicalgenome.org/kb/conditions/MONDO:0009066		30 - Gene Associated with Autosomal Recessive Phenotype (08/22/2012)	0 - No Evidence for Haploinsufficiency (08/22/2012)	https://search.clinicalgenome.org/kb/gene-dosage/HGNC:2518	Dosage Working Group				Moderate Actionability (11/27/2018)	https://search.clinicalgenome.org/kb/gene-validity/https://actionability.clinicalgenome.org/ac/Pediatric/ui/stg2SummaryRpt?doc=AC007	Pediatric Actionability Working Group
MONDO:0009067	SLC3A1	HGNC:11025	https://search.clinicalgenome.org/kb/genes/HGNC:11025	cystinuria	https://search.clinicalgenome.org/kb/conditions/MONDO:0009067	Autosomal recessive inheritance	30 - Gene Associated with Autosomal Recessive Phenotype (03/21/2012)	0 - No Evidence for Haploinsufficiency (03/21/2012)	https://search.clinicalgenome.org/kb/gene-dosage/HGNC:11025	Dosage Working Group	definitive evidence (06/29/2020)	https://search.clinicalgenome.org/kb/gene-validity/CGGV:assertion_fbde8280-d4bc-47e8-8f3d-aed8bb05e22e-2020-06-29T174347.853Z	Aminoacidopathy			
MONDO:0009068	COX14	HGNC:28216	https://search.clinicalgenome.org/kb/genes/HGNC:28216	cytochrome-c oxidase deficiency disease	https://search.clinicalgenome.org/kb/conditions/MONDO:0009068		30 - Gene Associated with Autosomal Recessive Phenotype (08/22/2016)	0 - No Evidence for Haploinsufficiency (08/22/2016)	https://search.clinicalgenome.org/kb/gene-dosage/HGNC:28216	Dosage Working Group						
MONDO:0009069	LRPPRC	HGNC:15714	https://search.clinicalgenome.org/kb/genes/HGNC:15714	congenital lactic acidosis, Saguenay-Lac-Saint-Jean type	https://search.clinicalgenome.org/kb/conditions/MONDO:0009069		30 - Gene Associated with Autosomal Recessive Phenotype (03/20/2017)	0 - No Evidence for Haploinsufficiency (03/20/2017)	https://search.clinicalgenome.org/kb/gene-dosage/HGNC:15714	Dosage Working Group						
MONDO:0009076	GJB2	HGNC:4284	https://search.clinicalgenome.org/kb/genes/HGNC:4284	autosomal recessive nonsyndromic hearing loss 1A	https://search.clinicalgenome.org/kb/conditions/MONDO:0009076		40 - Dosage Sensitivity Unlikely (05/10/2012)	0 - No Evidence for Haploinsufficiency (05/10/2012)	https://search.clinicalgenome.org/kb/gene-dosage/HGNC:4284	Dosage Working Group				Strong Actionability (10/29/2020)	https://search.clinicalgenome.org/kb/gene-validity/https://actionability.clinicalgenome.org/ac/Pediatric/ui/stg2SummaryRpt?doc=AC1018	Pediatric Actionability Working Group
MONDO:0009079	TBC1D24	HGNC:29203	https://search.clinicalgenome.org/kb/genes/HGNC:29203	DOORS syndrome	https://search.clinicalgenome.org/kb/conditions/MONDO:0009079	Autosomal recessive inheritance					definitive evidence (03/11/2020)	https://search.clinicalgenome.org/kb/gene-validity/CGGV:assertion_0fcb9839-6798-4195-8959-08d45bc63339-2020-03-11T132031.642Z	Hearing Loss			
MONDO:0009080	DLX5	HGNC:2918	https://search.clinicalgenome.org/kb/genes/HGNC:2918	split hand-foot malformation 1 with sensorineural hearing loss	https://search.clinicalgenome.org/kb/conditions/MONDO:0009080		0 - No Evidence for Haploinsufficiency (05/14/2012)	0 - No Evidence for Haploinsufficiency (05/14/2012)	https://search.clinicalgenome.org/kb/gene-dosage/HGNC:2918	Dosage Working Group						
MONDO:0009082	SLITRK6	HGNC:23503	https://search.clinicalgenome.org/kb/genes/HGNC:23503	high myopia-sensorineural deafness syndrome	https://search.clinicalgenome.org/kb/conditions/MONDO:0009082	Autosomal recessive inheritance					definitive evidence (04/21/2020)	https://search.clinicalgenome.org/kb/gene-validity/CGGV:assertion_e9b9e41c-1b12-4159-9729-8de648e747b0-2020-04-21T211522.429Z	Hearing Loss			
MONDO:0009091	LHX3	HGNC:6595	https://search.clinicalgenome.org/kb/genes/HGNC:6595	non-acquired combined pituitary hormone deficiency with spine abnormalities	https://search.clinicalgenome.org/kb/conditions/MONDO:0009091		30 - Gene Associated with Autosomal Recessive Phenotype (08/22/2016)		https://search.clinicalgenome.org/kb/gene-dosage/HGNC:6595	Dosage Working Group						
MONDO:0009104	LRP2	HGNC:6694	https://search.clinicalgenome.org/kb/genes/HGNC:6694	Donnai-Barrow syndrome	https://search.clinicalgenome.org/kb/conditions/MONDO:0009104		30 - Gene Associated with Autosomal Recessive Phenotype (04/24/2019)	0 - No Evidence for Haploinsufficiency (04/24/2019)	https://search.clinicalgenome.org/kb/gene-dosage/HGNC:6694	Dosage Working Group						
MONDO:0009107	SLC26A2	HGNC:10994	https://search.clinicalgenome.org/kb/genes/HGNC:10994	diastrophic dysplasia	https://search.clinicalgenome.org/kb/conditions/MONDO:0009107	Autosomal recessive inheritance					definitive evidence (06/01/2020)	https://search.clinicalgenome.org/kb/gene-validity/CGGV:assertion_311c9799-169e-4409-98bd-74b6d414904c-2020-06-01T160000.000Z	Skeletal Disorders			
MONDO:0009109	SLC7A7	HGNC:11065	https://search.clinicalgenome.org/kb/genes/HGNC:11065	lysinuric protein intolerance	https://search.clinicalgenome.org/kb/conditions/MONDO:0009109	Autosomal recessive inheritance	30 - Gene Associated with Autosomal Recessive Phenotype (08/22/2016)		https://search.clinicalgenome.org/kb/gene-dosage/HGNC:11065	Dosage Working Group	definitive evidence (11/08/2019)	https://search.clinicalgenome.org/kb/gene-validity/CGGV:assertion_207778e3-aff9-427d-ae87-f68fd938af88-2019-11-08T170000.000Z	Aminoacidopathy			
MONDO:0009110	SLC1A1	HGNC:10939	https://search.clinicalgenome.org/kb/genes/HGNC:10939	dicarboxylic aminoaciduria	https://search.clinicalgenome.org/kb/conditions/MONDO:0009110	Autosomal recessive inheritance					limited evidence (10/11/2019)	https://search.clinicalgenome.org/kb/gene-validity/CGGV:assertion_fd6cc720-f37b-4abf-a887-8701ac805343-2019-10-11T160000.000Z	Aminoacidopathy			
MONDO:0009111	DPYS	HGNC:3013	https://search.clinicalgenome.org/kb/genes/HGNC:3013	dihydropyrimidinuria	https://search.clinicalgenome.org/kb/conditions/MONDO:0009111		30 - Gene Associated with Autosomal Recessive Phenotype (08/22/2016)		https://search.clinicalgenome.org/kb/gene-dosage/HGNC:3013	Dosage Working Group						
MONDO:0009112	GNPAT	HGNC:4416	https://search.clinicalgenome.org/kb/genes/HGNC:4416	rhizomelic chondrodysplasia punctata type 2	https://search.clinicalgenome.org/kb/conditions/MONDO:0009112		30 - Gene Associated with Autosomal Recessive Phenotype (08/22/2016)		https://search.clinicalgenome.org/kb/gene-dosage/HGNC:4416	Dosage Working Group						
MONDO:0009114	SI	HGNC:10856	https://search.clinicalgenome.org/kb/genes/HGNC:10856	congenital sucrase-isomaltase deficiency	https://search.clinicalgenome.org/kb/conditions/MONDO:0009114		30 - Gene Associated with Autosomal Recessive Phenotype (08/22/2016)		https://search.clinicalgenome.org/kb/gene-dosage/HGNC:10856	Dosage Working Group						
MONDO:0009115	LCT	HGNC:6530	https://search.clinicalgenome.org/kb/genes/HGNC:6530	congenital lactase deficiency	https://search.clinicalgenome.org/kb/conditions/MONDO:0009115		30 - Gene Associated with Autosomal Recessive Phenotype (08/22/2016)	0 - No Evidence for Haploinsufficiency (08/22/2016)	https://search.clinicalgenome.org/kb/gene-dosage/HGNC:6530	Dosage Working Group						
MONDO:0009123	DBH	HGNC:2689	https://search.clinicalgenome.org/kb/genes/HGNC:2689	dopamine beta-hydroxylase deficiency	https://search.clinicalgenome.org/kb/conditions/MONDO:0009123		30 - Gene Associated with Autosomal Recessive Phenotype (08/22/2016)	0 - No Evidence for Haploinsufficiency (08/22/2016)	https://search.clinicalgenome.org/kb/gene-dosage/HGNC:2689	Dosage Working Group						
MONDO:0009134	SEC23B	HGNC:10702	https://search.clinicalgenome.org/kb/genes/HGNC:10702	congenital dyserythropoietic anemia type 2	https://search.clinicalgenome.org/kb/conditions/MONDO:0009134		30 - Gene Associated with Autosomal Recessive Phenotype (08/22/2016)	0 - No Evidence for Haploinsufficiency (08/22/2016)	https://search.clinicalgenome.org/kb/gene-dosage/HGNC:10702	Dosage Working Group						
MONDO:0009135	CDAN1	HGNC:1713	https://search.clinicalgenome.org/kb/genes/HGNC:1713	anemia, congenital dyserythropoietic, type 1a	https://search.clinicalgenome.org/kb/conditions/MONDO:0009135		30 - Gene Associated with Autosomal Recessive Phenotype (08/22/2016)	0 - No Evidence for Haploinsufficiency (08/22/2016)	https://search.clinicalgenome.org/kb/gene-dosage/HGNC:1713	Dosage Working Group						
MONDO:0009155	CDH3	HGNC:1762	https://search.clinicalgenome.org/kb/genes/HGNC:1762	EEM syndrome	https://search.clinicalgenome.org/kb/conditions/MONDO:0009155	Autosomal recessive inheritance					definitive evidence (08/05/2021)	https://search.clinicalgenome.org/kb/gene-validity/CGGV:assertion_5791d618-93bf-4517-9c60-48e6490319a6-2021-08-05T160000.000Z	Retina			
MONDO:0009161	ADAMTS2	HGNC:218	https://search.clinicalgenome.org/kb/genes/HGNC:218	Ehlers-Danlos syndrome, dermatosparaxis type	https://search.clinicalgenome.org/kb/conditions/MONDO:0009161		30 - Gene Associated with Autosomal Recessive Phenotype (08/22/2016)	0 - No Evidence for Haploinsufficiency (08/22/2016)	https://search.clinicalgenome.org/kb/gene-dosage/HGNC:218	Dosage Working Group						
MONDO:0009162	EVC2	HGNC:19747	https://search.clinicalgenome.org/kb/genes/HGNC:19747	Ellis-van Creveld syndrome	https://search.clinicalgenome.org/kb/conditions/MONDO:0009162		30 - Gene Associated with Autosomal Recessive Phenotype (07/18/2013)	0 - No Evidence for Haploinsufficiency (07/18/2013)	https://search.clinicalgenome.org/kb/gene-dosage/HGNC:19747	Dosage Working Group						
MONDO:0009168	FLVCR2	HGNC:20105	https://search.clinicalgenome.org/kb/genes/HGNC:20105	Fowler syndrome	https://search.clinicalgenome.org/kb/conditions/MONDO:0009168		30 - Gene Associated with Autosomal Recessive Phenotype (08/22/2016)	0 - No Evidence for Haploinsufficiency (08/22/2016)	https://search.clinicalgenome.org/kb/gene-dosage/HGNC:20105	Dosage Working Group						
MONDO:0009176	TMC6	HGNC:18021	https://search.clinicalgenome.org/kb/genes/HGNC:18021	epidermodysplasia verruciformis	https://search.clinicalgenome.org/kb/conditions/MONDO:0009176		30 - Gene Associated with Autosomal Recessive Phenotype (08/22/2016)	0 - No Evidence for Haploinsufficiency (08/22/2016)	https://search.clinicalgenome.org/kb/gene-dosage/HGNC:18021	Dosage Working Group						
MONDO:0009185	ROGDI	HGNC:29478	https://search.clinicalgenome.org/kb/genes/HGNC:29478	amelocerebrohypohidrotic syndrome	https://search.clinicalgenome.org/kb/conditions/MONDO:0009185		30 - Gene Associated with Autosomal Recessive Phenotype (02/12/2015)	0 - No Evidence for Haploinsufficiency (02/12/2015)	https://search.clinicalgenome.org/kb/gene-dosage/HGNC:29478	Dosage Working Group						
MONDO:0009192	EIF2AK3	HGNC:3255	https://search.clinicalgenome.org/kb/genes/HGNC:3255	Wolcott-Rallison syndrome	https://search.clinicalgenome.org/kb/conditions/MONDO:0009192		30 - Gene Associated with Autosomal Recessive Phenotype (08/22/2016)		https://search.clinicalgenome.org/kb/gene-dosage/HGNC:3255	Dosage Working Group						
MONDO:0009203	TWIST2	HGNC:20670	https://search.clinicalgenome.org/kb/genes/HGNC:20670	focal facial dermal dysplasia type III	https://search.clinicalgenome.org/kb/conditions/MONDO:0009203		30 - Gene Associated with Autosomal Recessive Phenotype (08/22/2016)	0 - No Evidence for Haploinsufficiency (08/22/2016)	https://search.clinicalgenome.org/kb/gene-dosage/HGNC:20670	Dosage Working Group						
MONDO:0009206	LMAN1	HGNC:6631	https://search.clinicalgenome.org/kb/genes/HGNC:6631	factor V and factor VIII, combined deficiency of, type 1	https://search.clinicalgenome.org/kb/conditions/MONDO:0009206	Autosomal recessive inheritance	30 - Gene Associated with Autosomal Recessive Phenotype (08/22/2016)		https://search.clinicalgenome.org/kb/gene-dosage/HGNC:6631	Dosage Working Group	definitive evidence (11/27/2019)	https://search.clinicalgenome.org/kb/gene-validity/CGGV:assertion_31792b8d-aca4-4832-b7f7-1993611777d7-2019-11-27T170000.000Z	Hemostasis Thrombosis			
MONDO:0009210	F5	HGNC:3542	https://search.clinicalgenome.org/kb/genes/HGNC:3542	congenital factor V deficiency	https://search.clinicalgenome.org/kb/conditions/MONDO:0009210	Autosomal recessive inheritance	30 - Gene Associated with Autosomal Recessive Phenotype (01/11/2018)	0 - No Evidence for Haploinsufficiency (01/11/2018)	https://search.clinicalgenome.org/kb/gene-dosage/HGNC:3542	Dosage Working Group	definitive evidence (03/25/2020)	https://search.clinicalgenome.org/kb/gene-validity/CGGV:assertion_beaa3af3-7d91-4d53-b081-de0e660c16c6-2020-03-25T160000.000Z	Hemostasis Thrombosis	Assertion Pending (11/10/2017)	https://search.clinicalgenome.org/kb/gene-validity/https://actionability.clinicalgenome.org/ac/Adult/ui/stg2SummaryRpt?doc=AC149	Adult Actionability Working Group
MONDO:0009211	F7	HGNC:3544	https://search.clinicalgenome.org/kb/genes/HGNC:3544	congenital factor VII deficiency	https://search.clinicalgenome.org/kb/conditions/MONDO:0009211		30 - Gene Associated with Autosomal Recessive Phenotype (08/22/2016)		https://search.clinicalgenome.org/kb/gene-dosage/HGNC:3544	Dosage Working Group				Strong Actionability (05/29/2021) | Strong Actionability (05/29/2021)	https://search.clinicalgenome.org/kb/gene-validity/https://actionability.clinicalgenome.org/ac/Adult/ui/stg2SummaryRpt?doc=AC1038 | https://search.clinicalgenome.org/kb/gene-validity/https://actionability.clinicalgenome.org/ac/Pediatric/ui/stg2SummaryRpt?doc=AC1038	Adult Actionability Working Group | Pediatric Actionability Working Group
MONDO:0009212	F10	HGNC:3528	https://search.clinicalgenome.org/kb/genes/HGNC:3528	congenital factor X deficiency	https://search.clinicalgenome.org/kb/conditions/MONDO:0009212	Autosomal recessive inheritance	30 - Gene Associated with Autosomal Recessive Phenotype (08/22/2016)		https://search.clinicalgenome.org/kb/gene-dosage/HGNC:3528	Dosage Working Group	definitive evidence (11/27/2019)	https://search.clinicalgenome.org/kb/gene-validity/CGGV:assertion_4adcc848-b354-4975-801f-4b55bbca64ad-2019-11-27T170000.000Z	Hemostasis Thrombosis			
MONDO:0009213	FANCC	HGNC:3584	https://search.clinicalgenome.org/kb/genes/HGNC:3584	Fanconi anemia complementation group C	https://search.clinicalgenome.org/kb/conditions/MONDO:0009213	Autosomal recessive inheritance	30 - Gene Associated with Autosomal Recessive Phenotype (08/22/2016)	0 - No Evidence for Haploinsufficiency (08/22/2016)	https://search.clinicalgenome.org/kb/gene-dosage/HGNC:3584	Dosage Working Group	definitive evidence (12/21/2018)	https://search.clinicalgenome.org/kb/gene-validity/CGGV:assertion_cf4881c3-15b3-4e10-bd24-2da80433863b-2018-12-21T152145.877Z	Hereditary Cancer	Moderate Actionability (10/28/2019) | Moderate Actionability (10/28/2019)	https://search.clinicalgenome.org/kb/gene-validity/https://actionability.clinicalgenome.org/ac/Adult/ui/stg2SummaryRpt?doc=AC1008 | https://search.clinicalgenome.org/kb/gene-validity/https://actionability.clinicalgenome.org/ac/Pediatric/ui/stg2SummaryRpt?doc=AC1008	Adult Actionability Working Group | Pediatric Actionability Working Group
MONDO:0009214	FANCD2	HGNC:3585	https://search.clinicalgenome.org/kb/genes/HGNC:3585	Fanconi anemia complementation group D2	https://search.clinicalgenome.org/kb/conditions/MONDO:0009214	Autosomal recessive inheritance	30 - Gene Associated with Autosomal Recessive Phenotype (08/22/2016)		https://search.clinicalgenome.org/kb/gene-dosage/HGNC:3585	Dosage Working Group	definitive evidence (06/15/2021)	https://search.clinicalgenome.org/kb/gene-validity/CGGV:assertion_5f0c260f-52d2-4225-9044-608f066ccfb2-2021-06-15T231506.767Z	Hereditary Cancer			
MONDO:0009215	BRCA2	HGNC:1101	https://search.clinicalgenome.org/kb/genes/HGNC:1101	Fanconi anemia complementation group A	https://search.clinicalgenome.org/kb/conditions/MONDO:0009215		3 - Sufficient Evidence for Haploinsufficiency (07/14/2021)	0 - No Evidence for Haploinsufficiency (07/14/2021)	https://search.clinicalgenome.org/kb/gene-dosage/HGNC:1101	Dosage Working Group				Moderate Actionability (10/28/2019) | Moderate Actionability (10/28/2019)	https://search.clinicalgenome.org/kb/gene-validity/https://actionability.clinicalgenome.org/ac/Adult/ui/stg2SummaryRpt?doc=AC1008 | https://search.clinicalgenome.org/kb/gene-validity/https://actionability.clinicalgenome.org/ac/Pediatric/ui/stg2SummaryRpt?doc=AC1008	Adult Actionability Working Group | Pediatric Actionability Working Group
MONDO:0009218	ASAH1	HGNC:735	https://search.clinicalgenome.org/kb/genes/HGNC:735	Farber lipogranulomatosis	https://search.clinicalgenome.org/kb/conditions/MONDO:0009218		30 - Gene Associated with Autosomal Recessive Phenotype (09/12/2017)	0 - No Evidence for Haploinsufficiency (09/12/2017)	https://search.clinicalgenome.org/kb/gene-dosage/HGNC:735	Dosage Working Group						
MONDO:0009229	ANTXR2	HGNC:21732	https://search.clinicalgenome.org/kb/genes/HGNC:21732	hyaline fibromatosis syndrome	https://search.clinicalgenome.org/kb/conditions/MONDO:0009229		30 - Gene Associated with Autosomal Recessive Phenotype (08/22/2016)	0 - No Evidence for Haploinsufficiency (08/22/2016)	https://search.clinicalgenome.org/kb/gene-dosage/HGNC:21732	Dosage Working Group						
MONDO:0009234	KNG1	HGNC:6383	https://search.clinicalgenome.org/kb/genes/HGNC:6383	congenital high-molecular-weight kininogen deficiency	https://search.clinicalgenome.org/kb/conditions/MONDO:0009234	Autosomal recessive inheritance					definitive evidence (06/23/2021)	https://search.clinicalgenome.org/kb/gene-validity/CGGV:assertion_6dbf4bc1-b04f-4f1d-8c11-2b7998370293-2021-06-23T160000.000Z	Hemostasis Thrombosis			
MONDO:0009239	FSHB	HGNC:3964	https://search.clinicalgenome.org/kb/genes/HGNC:3964	hypogonadotropic hypogonadism 24 without anosmia	https://search.clinicalgenome.org/kb/conditions/MONDO:0009239		30 - Gene Associated with Autosomal Recessive Phenotype (08/22/2016)		https://search.clinicalgenome.org/kb/gene-dosage/HGNC:3964	Dosage Working Group						
MONDO:0009240	FTCD	HGNC:3974	https://search.clinicalgenome.org/kb/genes/HGNC:3974	formiminoglutamic aciduria	https://search.clinicalgenome.org/kb/conditions/MONDO:0009240		30 - Gene Associated with Autosomal Recessive Phenotype (08/22/2016)	0 - No Evidence for Haploinsufficiency (08/22/2016)	https://search.clinicalgenome.org/kb/gene-dosage/HGNC:3974	Dosage Working Group						
MONDO:0009249	ALDOB	HGNC:417	https://search.clinicalgenome.org/kb/genes/HGNC:417	hereditary fructose intolerance	https://search.clinicalgenome.org/kb/conditions/MONDO:0009249									Strong Actionability (11/01/2018)	https://search.clinicalgenome.org/kb/gene-validity/https://actionability.clinicalgenome.org/ac/Pediatric/ui/stg2SummaryRpt?doc=AC008	Pediatric Actionability Working Group
MONDO:0009251	FBP1	HGNC:3606	https://search.clinicalgenome.org/kb/genes/HGNC:3606	fructose-1,6-bisphosphatase deficiency	https://search.clinicalgenome.org/kb/conditions/MONDO:0009251		30 - Gene Associated with Autosomal Recessive Phenotype (08/22/2016)	0 - No Evidence for Haploinsufficiency (08/22/2016)	https://search.clinicalgenome.org/kb/gene-dosage/HGNC:3606	Dosage Working Group						
MONDO:0009255	GALK1	HGNC:4118	https://search.clinicalgenome.org/kb/genes/HGNC:4118	galactokinase deficiency	https://search.clinicalgenome.org/kb/conditions/MONDO:0009255	Autosomal recessive inheritance	30 - Gene Associated with Autosomal Recessive Phenotype (08/22/2016)	0 - No Evidence for Haploinsufficiency (08/22/2016)	https://search.clinicalgenome.org/kb/gene-dosage/HGNC:4118	Dosage Working Group	definitive evidence (09/30/2021)	https://search.clinicalgenome.org/kb/gene-validity/CGGV:assertion_ecd4568c-966e-4ac3-b3d2-b4ac119a7d80-2021-09-30T161317.166Z	General Inborn Errors of Metabolism			
MONDO:0009258	GALT	HGNC:4135	https://search.clinicalgenome.org/kb/genes/HGNC:4135	classic galactosemia	https://search.clinicalgenome.org/kb/conditions/MONDO:0009258		30 - Gene Associated with Autosomal Recessive Phenotype (08/22/2016)		https://search.clinicalgenome.org/kb/gene-dosage/HGNC:4135	Dosage Working Group						
MONDO:0009265	GBA	HGNC:4177	https://search.clinicalgenome.org/kb/genes/HGNC:4177	Gaucher disease type I	https://search.clinicalgenome.org/kb/conditions/MONDO:0009265		30 - Gene Associated with Autosomal Recessive Phenotype (08/22/2016)	0 - No Evidence for Haploinsufficiency (08/22/2016)	https://search.clinicalgenome.org/kb/gene-dosage/HGNC:4177	Dosage Working Group				Assertion Pending (04/04/2016)	https://search.clinicalgenome.org/kb/gene-validity/https://actionability.clinicalgenome.org/ac/Adult/ui/stg2SummaryRpt?doc=AC104	Adult Actionability Working Group
MONDO:0009266	GBA	HGNC:4177	https://search.clinicalgenome.org/kb/genes/HGNC:4177	Gaucher disease type II	https://search.clinicalgenome.org/kb/conditions/MONDO:0009266		30 - Gene Associated with Autosomal Recessive Phenotype (08/22/2016)	0 - No Evidence for Haploinsufficiency (08/22/2016)	https://search.clinicalgenome.org/kb/gene-dosage/HGNC:4177	Dosage Working Group				Assertion Pending (04/04/2016)	https://search.clinicalgenome.org/kb/gene-validity/https://actionability.clinicalgenome.org/ac/Adult/ui/stg2SummaryRpt?doc=AC104	Adult Actionability Working Group
MONDO:0009267	GBA	HGNC:4177	https://search.clinicalgenome.org/kb/genes/HGNC:4177	Gaucher disease type III	https://search.clinicalgenome.org/kb/conditions/MONDO:0009267		30 - Gene Associated with Autosomal Recessive Phenotype (08/22/2016)	0 - No Evidence for Haploinsufficiency (08/22/2016)	https://search.clinicalgenome.org/kb/gene-dosage/HGNC:4177	Dosage Working Group				Assertion Pending (04/04/2016)	https://search.clinicalgenome.org/kb/gene-validity/https://actionability.clinicalgenome.org/ac/Adult/ui/stg2SummaryRpt?doc=AC104	Adult Actionability Working Group
MONDO:0009268	GBA	HGNC:4177	https://search.clinicalgenome.org/kb/genes/HGNC:4177	Gaucher disease-ophthalmoplegia-cardiovascular calcification syndrome	https://search.clinicalgenome.org/kb/conditions/MONDO:0009268		30 - Gene Associated with Autosomal Recessive Phenotype (08/22/2016)	0 - No Evidence for Haploinsufficiency (08/22/2016)	https://search.clinicalgenome.org/kb/gene-dosage/HGNC:4177	Dosage Working Group				Assertion Pending (04/04/2016)	https://search.clinicalgenome.org/kb/gene-validity/https://actionability.clinicalgenome.org/ac/Adult/ui/stg2SummaryRpt?doc=AC104	Adult Actionability Working Group
MONDO:0009269	ADAMTSL2	HGNC:14631	https://search.clinicalgenome.org/kb/genes/HGNC:14631	geleophysic dysplasia 1	https://search.clinicalgenome.org/kb/conditions/MONDO:0009269		30 - Gene Associated with Autosomal Recessive Phenotype (08/22/2016)	0 - No Evidence for Haploinsufficiency (08/22/2016)	https://search.clinicalgenome.org/kb/gene-dosage/HGNC:14631	Dosage Working Group						
MONDO:0009271	GORAB	HGNC:25676	https://search.clinicalgenome.org/kb/genes/HGNC:25676	geroderma osteodysplastica	https://search.clinicalgenome.org/kb/conditions/MONDO:0009271		30 - Gene Associated with Autosomal Recessive Phenotype (08/22/2016)	0 - No Evidence for Haploinsufficiency (08/22/2016)	https://search.clinicalgenome.org/kb/gene-dosage/HGNC:25676	Dosage Working Group						
MONDO:0009274	TBXAS1	HGNC:11609	https://search.clinicalgenome.org/kb/genes/HGNC:11609	ghosal hematodiaphyseal dysplasia	https://search.clinicalgenome.org/kb/conditions/MONDO:0009274	Autosomal recessive inheritance					moderate evidence (10/28/2020)	https://search.clinicalgenome.org/kb/gene-validity/CGGV:assertion_612c46e2-8b4f-4bff-9d8b-28769d8854e2-2020-10-28T160000.000Z	Hemostasis Thrombosis			
MONDO:0009276	GP1BA	HGNC:4439	https://search.clinicalgenome.org/kb/genes/HGNC:4439	Bernard-Soulier syndrome	https://search.clinicalgenome.org/kb/conditions/MONDO:0009276	Autosomal recessive inheritance					definitive evidence (05/27/2020)	https://search.clinicalgenome.org/kb/gene-validity/CGGV:assertion_7e3aa94f-1e87-4806-bc47-2f8c40e3d1bc-2020-05-27T160000.000Z	Hemostasis Thrombosis			
MONDO:0009278	HADH	HGNC:4799	https://search.clinicalgenome.org/kb/genes/HGNC:4799	obsolete hyperinsulinism due to short chain 3-hydroxylacyl-CoA dehydrogenase deficiency	https://search.clinicalgenome.org/kb/conditions/MONDO:0009278	Autosomal recessive inheritance					definitive evidence (06/26/2018)	https://search.clinicalgenome.org/kb/gene-validity/CGGV:assertion_c2f238b9-4eb5-426c-a27a-ecb7b468d9e4-2018-06-26T160000.000Z	Fatty Acid Oxidation Disorders			
MONDO:0009281	GCDH	HGNC:4189	https://search.clinicalgenome.org/kb/genes/HGNC:4189	glutaryl-CoA dehydrogenase deficiency	https://search.clinicalgenome.org/kb/conditions/MONDO:0009281	Autosomal recessive inheritance	30 - Gene Associated with Autosomal Recessive Phenotype (08/22/2016)		https://search.clinicalgenome.org/kb/gene-dosage/HGNC:4189	Dosage Working Group	definitive evidence (11/08/2019)	https://search.clinicalgenome.org/kb/gene-validity/CGGV:assertion_33a2c95e-a057-4b93-b97e-27b6597516e5-2019-11-08T170000.000Z	Aminoacidopathy	Assertion Pending (09/19/2017)	https://search.clinicalgenome.org/kb/gene-validity/https://actionability.clinicalgenome.org/ac/Adult/ui/stg2SummaryRpt?doc=AC142	Adult Actionability Working Group
MONDO:0009282	ETFA	HGNC:3481	https://search.clinicalgenome.org/kb/genes/HGNC:3481	multiple acyl-CoA dehydrogenase deficiency	https://search.clinicalgenome.org/kb/conditions/MONDO:0009282	Autosomal recessive inheritance					definitive evidence (05/22/2018)	https://search.clinicalgenome.org/kb/gene-validity/CGGV:assertion_3d6848e7-6e9e-4545-9f97-69480face058-2018-05-22T160000.000Z	Fatty Acid Oxidation Disorders			
MONDO:0009283	SUGCT	HGNC:16001	https://search.clinicalgenome.org/kb/genes/HGNC:16001	glutaric acidemia type 3	https://search.clinicalgenome.org/kb/conditions/MONDO:0009283	Autosomal recessive inheritance					moderate evidence (09/25/2020)	https://search.clinicalgenome.org/kb/gene-validity/CGGV:assertion_10622f19-d307-4fa8-b3ff-a799922e7fea-2020-09-25T170244.514Z	Aminoacidopathy			
MONDO:0009290	GAA	HGNC:4065	https://search.clinicalgenome.org/kb/genes/HGNC:4065	glycogen storage disease II	https://search.clinicalgenome.org/kb/conditions/MONDO:0009290	Autosomal recessive inheritance	30 - Gene Associated with Autosomal Recessive Phenotype (08/22/2016)		https://search.clinicalgenome.org/kb/gene-dosage/HGNC:4065	Dosage Working Group	definitive evidence (01/23/2019)	https://search.clinicalgenome.org/kb/gene-validity/CGGV:assertion_0554320e-6a8f-4c39-be7f-99959a8341ee-2019-01-23T170000.000Z	General Gene Curation	Assertion Pending (11/30/2016)	https://search.clinicalgenome.org/kb/gene-validity/https://actionability.clinicalgenome.org/ac/Adult/ui/stg2SummaryRpt?doc=AC090	Adult Actionability Working Group
MONDO:0009292	GBE1	HGNC:4180	https://search.clinicalgenome.org/kb/genes/HGNC:4180	glycogen storage disease due to glycogen branching enzyme deficiency	https://search.clinicalgenome.org/kb/conditions/MONDO:0009292		30 - Gene Associated with Autosomal Recessive Phenotype (08/22/2016)	0 - No Evidence for Haploinsufficiency (08/22/2016)	https://search.clinicalgenome.org/kb/gene-dosage/HGNC:4180	Dosage Working Group						
MONDO:0009293	PYGM	HGNC:9726	https://search.clinicalgenome.org/kb/genes/HGNC:9726	glycogen storage disease V	https://search.clinicalgenome.org/kb/conditions/MONDO:0009293									Assertion Pending (03/06/2017)	https://search.clinicalgenome.org/kb/gene-validity/https://actionability.clinicalgenome.org/ac/Adult/ui/stg2SummaryRpt?doc=AC121	Adult Actionability Working Group
MONDO:0009300	HSD17B4	HGNC:5213	https://search.clinicalgenome.org/kb/genes/HGNC:5213	Perrault syndrome 1	https://search.clinicalgenome.org/kb/conditions/MONDO:0009300		30 - Gene Associated with Autosomal Recessive Phenotype (03/06/2018)	0 - No Evidence for Haploinsufficiency (03/06/2018)	https://search.clinicalgenome.org/kb/gene-dosage/HGNC:5213	Dosage Working Group						
MONDO:0009309	NCF1	HGNC:7660	https://search.clinicalgenome.org/kb/genes/HGNC:7660	granulomatous disease, chronic, autosomal recessive, cytochrome b-positive, type 1	https://search.clinicalgenome.org/kb/conditions/MONDO:0009309		30 - Gene Associated with Autosomal Recessive Phenotype (10/10/2012)	0 - No Evidence for Haploinsufficiency (10/10/2012)	https://search.clinicalgenome.org/kb/gene-dosage/HGNC:7660	Dosage Working Group						
MONDO:0009310	NCF2	HGNC:7661	https://search.clinicalgenome.org/kb/genes/HGNC:7661	granulomatous disease, chronic, autosomal recessive, cytochrome b-positive, type 2	https://search.clinicalgenome.org/kb/conditions/MONDO:0009310		30 - Gene Associated with Autosomal Recessive Phenotype (08/22/2016)	0 - No Evidence for Haploinsufficiency (08/22/2016)	https://search.clinicalgenome.org/kb/gene-dosage/HGNC:7661	Dosage Working Group						
MONDO:0009315	F12	HGNC:3530	https://search.clinicalgenome.org/kb/genes/HGNC:3530	congenital factor XII deficiency	https://search.clinicalgenome.org/kb/conditions/MONDO:0009315	Autosomal recessive inheritance					definitive evidence (01/22/2020)	https://search.clinicalgenome.org/kb/gene-validity/CGGV:assertion_50bbe8d0-4feb-43c7-8573-9d7f85c82e54-2020-01-22T170000.000Z	Hemostasis Thrombosis			
MONDO:0009324	SLC6A19	HGNC:27960	https://search.clinicalgenome.org/kb/genes/HGNC:27960	Hartnup disease	https://search.clinicalgenome.org/kb/conditions/MONDO:0009324	Autosomal recessive inheritance					definitive evidence (05/07/2020)	https://search.clinicalgenome.org/kb/gene-validity/CGGV:assertion_44c34762-450b-4abd-8fe4-3f17ff700630-2020-05-07T160000.000Z	Aminoacidopathy			
MONDO:0009337	CCBE1	HGNC:29426	https://search.clinicalgenome.org/kb/genes/HGNC:29426	Hennekam lymphangiectasia-lymphedema syndrome 1	https://search.clinicalgenome.org/kb/conditions/MONDO:0009337		30 - Gene Associated with Autosomal Recessive Phenotype (08/22/2016)		https://search.clinicalgenome.org/kb/gene-dosage/HGNC:29426	Dosage Working Group						
MONDO:0009341	ZEB2	HGNC:14881	https://search.clinicalgenome.org/kb/genes/HGNC:14881	Mowat-Wilson syndrome	https://search.clinicalgenome.org/kb/conditions/MONDO:0009341	Autosomal dominant inheritance	3 - Sufficient Evidence for Haploinsufficiency (06/24/2020)	0 - No Evidence for Haploinsufficiency (06/24/2020)	https://search.clinicalgenome.org/kb/gene-dosage/HGNC:14881	Dosage Working Group	definitive evidence (05/24/2018)	https://search.clinicalgenome.org/kb/gene-validity/CGGV:assertion_cb06ff0d-1cc6-494c-9ce5-f7cb26f34620-2018-05-24T123443.951Z	Intellectual Disability and Autism			
MONDO:0009345	HAL	HGNC:4806	https://search.clinicalgenome.org/kb/genes/HGNC:4806	histidinemia	https://search.clinicalgenome.org/kb/conditions/MONDO:0009345	Autosomal recessive inheritance					limited evidence (09/25/2020)	https://search.clinicalgenome.org/kb/gene-validity/CGGV:assertion_c5764eb8-2aad-419e-be57-99f8c6859ebb-2020-09-25T165635.220Z	Aminoacidopathy			
MONDO:0009352	CBS	HGNC:1550	https://search.clinicalgenome.org/kb/genes/HGNC:1550	classic homocystinuria	https://search.clinicalgenome.org/kb/conditions/MONDO:0009352	Autosomal recessive inheritance	30 - Gene Associated with Autosomal Recessive Phenotype (08/22/2016)	0 - No Evidence for Haploinsufficiency (08/22/2016)	https://search.clinicalgenome.org/kb/gene-dosage/HGNC:1550	Dosage Working Group	definitive evidence (04/12/2019)	https://search.clinicalgenome.org/kb/gene-validity/CGGV:assertion_a9086d29-767b-4ab8-9274-1249b5480834-2019-04-12T160000.000Z	Aminoacidopathy	Assertion Pending (04/20/2016)	https://search.clinicalgenome.org/kb/gene-validity/https://actionability.clinicalgenome.org/ac/Adult/ui/stg2SummaryRpt?doc=AC097	Adult Actionability Working Group
MONDO:0009353	MTHFR	HGNC:7436	https://search.clinicalgenome.org/kb/genes/HGNC:7436	homocystinuria due to methylene tetrahydrofolate reductase deficiency	https://search.clinicalgenome.org/kb/conditions/MONDO:0009353	Autosomal recessive inheritance	30 - Gene Associated with Autosomal Recessive Phenotype (08/22/2016)		https://search.clinicalgenome.org/kb/gene-dosage/HGNC:7436	Dosage Working Group	definitive evidence (06/18/2019)	https://search.clinicalgenome.org/kb/gene-validity/CGGV:assertion_cbfc5297-ed0d-4d7c-bca6-747114ed2b17-2019-06-18T160000.000Z	Aminoacidopathy			
MONDO:0009354	MTRR	HGNC:7473	https://search.clinicalgenome.org/kb/genes/HGNC:7473	methylcobalamin deficiency type cblE	https://search.clinicalgenome.org/kb/conditions/MONDO:0009354	Autosomal recessive inheritance	30 - Gene Associated with Autosomal Recessive Phenotype (08/22/2016)	0 - No Evidence for Haploinsufficiency (08/22/2016)	https://search.clinicalgenome.org/kb/gene-dosage/HGNC:7473	Dosage Working Group	definitive evidence (07/02/2021)	https://search.clinicalgenome.org/kb/gene-validity/CGGV:assertion_905575cf-cb80-4038-b82b-1de3ae1c469d-2021-07-02T160000.000Z	Aminoacidopathy			
MONDO:0009365	HYLS1	HGNC:26558	https://search.clinicalgenome.org/kb/genes/HGNC:26558	hydrolethalus syndrome 1	https://search.clinicalgenome.org/kb/conditions/MONDO:0009365		30 - Gene Associated with Autosomal Recessive Phenotype (08/22/2016)		https://search.clinicalgenome.org/kb/gene-dosage/HGNC:26558	Dosage Working Group						
MONDO:0009368	HPSE2	HGNC:18374	https://search.clinicalgenome.org/kb/genes/HGNC:18374	urofacial syndrome type 1	https://search.clinicalgenome.org/kb/conditions/MONDO:0009368		30 - Gene Associated with Autosomal Recessive Phenotype (03/12/2015)	0 - No Evidence for Haploinsufficiency (03/12/2015)	https://search.clinicalgenome.org/kb/gene-dosage/HGNC:18374	Dosage Working Group						
MONDO:0009374	PRODH2	HGNC:17325	https://search.clinicalgenome.org/kb/genes/HGNC:17325	hydroxyprolinemia	https://search.clinicalgenome.org/kb/conditions/MONDO:0009374	Autosomal recessive inheritance					limited evidence (09/13/2019)	https://search.clinicalgenome.org/kb/gene-validity/CGGV:assertion_d9101c67-2635-4595-b9a8-8e749bba58d1-2019-09-13T173000.499Z	Aminoacidopathy			
MONDO:0009376	CPS1	HGNC:2323	https://search.clinicalgenome.org/kb/genes/HGNC:2323	carbamoyl phosphate synthetase I deficiency disease	https://search.clinicalgenome.org/kb/conditions/MONDO:0009376	Autosomal recessive inheritance	30 - Gene Associated with Autosomal Recessive Phenotype (08/22/2016)		https://search.clinicalgenome.org/kb/gene-dosage/HGNC:2323	Dosage Working Group	definitive evidence (10/12/2018)	https://search.clinicalgenome.org/kb/gene-validity/CGGV:assertion_dbc4dbbe-8827-4d68-a396-8368f3801e78-2018-10-12T160000.000Z	Aminoacidopathy			
MONDO:0009377	NAGS	HGNC:17996	https://search.clinicalgenome.org/kb/genes/HGNC:17996	hyperammonemia due to N-acetylglutamate synthase deficiency	https://search.clinicalgenome.org/kb/conditions/MONDO:0009377	Autosomal recessive inheritance					definitive evidence (07/26/2019)	https://search.clinicalgenome.org/kb/gene-validity/CGGV:assertion_33dcead1-e3d9-4427-98fd-05a655c8c213-2019-07-26T160000.000Z	Aminoacidopathy			
MONDO:0009388	AASS	HGNC:17366	https://search.clinicalgenome.org/kb/genes/HGNC:17366	hyperlysinemia	https://search.clinicalgenome.org/kb/conditions/MONDO:0009388	Autosomal recessive inheritance	30 - Gene Associated with Autosomal Recessive Phenotype (08/22/2016)		https://search.clinicalgenome.org/kb/gene-dosage/HGNC:17366	Dosage Working Group	moderate evidence (06/29/2020)	https://search.clinicalgenome.org/kb/gene-validity/CGGV:assertion_92e04f9e-f03e-4295-baac-e9fb6b48a258-2020-06-29T174543.477Z	Aminoacidopathy			
MONDO:0009393	SLC25A15	HGNC:10985	https://search.clinicalgenome.org/kb/genes/HGNC:10985	ornithine translocase deficiency	https://search.clinicalgenome.org/kb/conditions/MONDO:0009393	Autosomal recessive inheritance					definitive evidence (12/04/2019)	https://search.clinicalgenome.org/kb/gene-validity/CGGV:assertion_e5cb32c9-d506-484f-b023-1c4f17ef0d93-2019-12-04T170000.000Z	Aminoacidopathy			
MONDO:0009394	TNFRSF11B	HGNC:11909	https://search.clinicalgenome.org/kb/genes/HGNC:11909	juvenile Paget disease	https://search.clinicalgenome.org/kb/conditions/MONDO:0009394		30 - Gene Associated with Autosomal Recessive Phenotype (08/22/2016)		https://search.clinicalgenome.org/kb/gene-dosage/HGNC:11909	Dosage Working Group						
MONDO:0009400	PRODH	HGNC:9453	https://search.clinicalgenome.org/kb/genes/HGNC:9453	hyperprolinemia type 1	https://search.clinicalgenome.org/kb/conditions/MONDO:0009400	Autosomal recessive inheritance					definitive evidence (04/27/2021)	https://search.clinicalgenome.org/kb/gene-validity/CGGV:assertion_5f28c677-a9b4-4bb3-9aed-14af97ad9896-2021-04-27T160000.000Z	Aminoacidopathy			
MONDO:0009401	ALDH4A1	HGNC:406	https://search.clinicalgenome.org/kb/genes/HGNC:406	hyperprolinemia type 2	https://search.clinicalgenome.org/kb/conditions/MONDO:0009401	Autosomal recessive inheritance	30 - Gene Associated with Autosomal Recessive Phenotype (04/09/2015)	0 - No Evidence for Haploinsufficiency (04/09/2015)	https://search.clinicalgenome.org/kb/gene-dosage/HGNC:406	Dosage Working Group	definitive evidence (10/23/2020)	https://search.clinicalgenome.org/kb/gene-validity/CGGV:assertion_5edc3f72-31e0-47f8-bcec-e3e5b81c97ae-2020-10-23T171643.432Z	Aminoacidopathy			
MONDO:0009413	TNFRSF13B	HGNC:18153	https://search.clinicalgenome.org/kb/genes/HGNC:18153	immunodeficiency, common variable, 2	https://search.clinicalgenome.org/kb/conditions/MONDO:0009413	Autosomal recessive inheritance					definitive evidence (01/20/2021)	https://search.clinicalgenome.org/kb/gene-validity/CGGV:assertion_3049236b-8132-4dfa-8cda-2a328962a0a4-2021-01-20T170000.000Z	Antibody Deficiencies GCEP			
MONDO:0009414	GYS2	HGNC:4707	https://search.clinicalgenome.org/kb/genes/HGNC:4707	glycogen storage disorder due to hepatic glycogen synthase deficiency	https://search.clinicalgenome.org/kb/conditions/MONDO:0009414		30 - Gene Associated with Autosomal Recessive Phenotype (08/22/2016)	0 - No Evidence for Haploinsufficiency (08/22/2016)	https://search.clinicalgenome.org/kb/gene-dosage/HGNC:4707	Dosage Working Group						
MONDO:0009419	DCAF17	HGNC:25784	https://search.clinicalgenome.org/kb/genes/HGNC:25784	Woodhouse-Sakati syndrome	https://search.clinicalgenome.org/kb/conditions/MONDO:0009419	Autosomal recessive inheritance					definitive evidence (07/27/2021)	https://search.clinicalgenome.org/kb/gene-validity/CGGV:assertion_6a1d7719-4261-494d-87aa-745518580673-2021-07-27T153526.827Z	Syndromic Disorders			
MONDO:0009424	KCNJ1	HGNC:6255	https://search.clinicalgenome.org/kb/genes/HGNC:6255	Bartter disease type 2	https://search.clinicalgenome.org/kb/conditions/MONDO:0009424		30 - Gene Associated with Autosomal Recessive Phenotype (03/22/2012)	0 - No Evidence for Haploinsufficiency (03/22/2012)	https://search.clinicalgenome.org/kb/gene-dosage/HGNC:6255	Dosage Working Group						
MONDO:0009426	TBCE	HGNC:11582	https://search.clinicalgenome.org/kb/genes/HGNC:11582	hypoparathyroidism-retardation-dysmorphism syndrome	https://search.clinicalgenome.org/kb/conditions/MONDO:0009426		30 - Gene Associated with Autosomal Recessive Phenotype (05/17/2012)	0 - No Evidence for Haploinsufficiency (05/17/2012)	https://search.clinicalgenome.org/kb/gene-dosage/HGNC:11582	Dosage Working Group						
MONDO:0009427	ALPL	HGNC:438	https://search.clinicalgenome.org/kb/genes/HGNC:438	obsolete infantile hypophosphatasia	https://search.clinicalgenome.org/kb/conditions/MONDO:0009427	Autosomal recessive inheritance					definitive evidence (06/02/2021)	https://search.clinicalgenome.org/kb/gene-validity/CGGV:assertion_64fd43a0-1c7d-4f34-906c-570d800492bc-2021-06-02T205406.157Z	Skeletal Disorders	Assertion Pending (07/05/2018)	https://search.clinicalgenome.org/kb/gene-validity/https://actionability.clinicalgenome.org/ac/Pediatric/ui/stg2SummaryRpt?doc=AC004	Pediatric Actionability Working Group
MONDO:0009428	ALPL	HGNC:438	https://search.clinicalgenome.org/kb/genes/HGNC:438	obsolete childhood hypophosphatasia	https://search.clinicalgenome.org/kb/conditions/MONDO:0009428	Autosomal recessive inheritance | Autosomal dominant inheritance					definitive evidence (01/21/2019) | definitive evidence (03/03/2021)	https://search.clinicalgenome.org/kb/gene-validity/CGGV:assertion_354366d0-a7f6-472d-a7b2-4b16f6e328ac-2019-01-21T200000.000Z | https://search.clinicalgenome.org/kb/gene-validity/CGGV:assertion_52e23281-c9c5-42fe-a089-2652c3b849f8-2021-03-03T080000.000Z	Skeletal Disorders | Skeletal Disorders	Assertion Pending (07/05/2018)	https://search.clinicalgenome.org/kb/gene-validity/https://actionability.clinicalgenome.org/ac/Pediatric/ui/stg2SummaryRpt?doc=AC004	Pediatric Actionability Working Group
MONDO:0009430	DMP1	HGNC:2932	https://search.clinicalgenome.org/kb/genes/HGNC:2932	hypophosphatemic rickets, autosomal recessive, 1	https://search.clinicalgenome.org/kb/conditions/MONDO:0009430		30 - Gene Associated with Autosomal Recessive Phenotype (08/22/2016)		https://search.clinicalgenome.org/kb/gene-dosage/HGNC:2932	Dosage Working Group						
MONDO:0009437	FOXE1	HGNC:3806	https://search.clinicalgenome.org/kb/genes/HGNC:3806	Bamforth-Lazarus syndrome	https://search.clinicalgenome.org/kb/conditions/MONDO:0009437		30 - Gene Associated with Autosomal Recessive Phenotype (08/22/2016)		https://search.clinicalgenome.org/kb/gene-dosage/HGNC:3806	Dosage Working Group						
MONDO:0009441	TGM1	HGNC:11777	https://search.clinicalgenome.org/kb/genes/HGNC:11777	autosomal recessive congenital ichthyosis 1	https://search.clinicalgenome.org/kb/conditions/MONDO:0009441		30 - Gene Associated with Autosomal Recessive Phenotype (08/22/2016)		https://search.clinicalgenome.org/kb/gene-dosage/HGNC:11777	Dosage Working Group						
MONDO:0009448	SLC36A2	HGNC:18762	https://search.clinicalgenome.org/kb/genes/HGNC:18762	iminoglycinuria	https://search.clinicalgenome.org/kb/conditions/MONDO:0009448	Autosomal recessive inheritance					limited evidence (03/13/2020)	https://search.clinicalgenome.org/kb/gene-validity/CGGV:assertion_38341e13-b026-4a61-a049-5f7ef9df1805-2020-03-13T160000.000Z	Aminoacidopathy			
MONDO:0009458	SMARCAL1	HGNC:11102	https://search.clinicalgenome.org/kb/genes/HGNC:11102	Schimke immuno-osseous dysplasia	https://search.clinicalgenome.org/kb/conditions/MONDO:0009458	Autosomal recessive inheritance					definitive evidence (07/30/2021)	https://search.clinicalgenome.org/kb/gene-validity/CGGV:assertion_58700233-acb6-4ea8-911b-b3f474906aaa-2021-07-30T130548.284Z	Syndromic Disorders			
MONDO:0009465	TTC7A	HGNC:19750	https://search.clinicalgenome.org/kb/genes/HGNC:19750	multiple intestinal atresia	https://search.clinicalgenome.org/kb/conditions/MONDO:0009465	Autosomal recessive inheritance	30 - Gene Associated with Autosomal Recessive Phenotype (08/22/2016)	0 - No Evidence for Haploinsufficiency (08/22/2016)	https://search.clinicalgenome.org/kb/gene-dosage/HGNC:19750	Dosage Working Group	definitive evidence (10/21/2021)	https://search.clinicalgenome.org/kb/gene-validity/CGGV:assertion_80cadac5-067c-49e7-a021-ee4eec83984a-2021-10-21T184517.744Z	SCID-CID			
MONDO:0009475	IVD	HGNC:6186	https://search.clinicalgenome.org/kb/genes/HGNC:6186	isovaleric acidemia	https://search.clinicalgenome.org/kb/conditions/MONDO:0009475	Autosomal recessive inheritance					definitive evidence (05/10/2019)	https://search.clinicalgenome.org/kb/gene-validity/CGGV:assertion_05f5d468-2f46-44f3-ba67-c4e708d2954f-2019-05-10T160000.000Z	Aminoacidopathy	Has Insufficient Evidence for Actionability Based on Early Rule-out (06/20/2017) | Has Insufficient Evidence for Actionability Based on Early Rule-out (12/16/2019)	https://search.clinicalgenome.org/kb/gene-validity/https://actionability.clinicalgenome.org/ac/Adult/ui/stg2SummaryRpt?doc=AC1013 | https://search.clinicalgenome.org/kb/gene-validity/https://actionability.clinicalgenome.org/ac/Pediatric/ui/stg2SummaryRpt?doc=AC1013	Adult Actionability Working Group | Pediatric Actionability Working Group
MONDO:0009478	DOCK8	HGNC:19191	https://search.clinicalgenome.org/kb/genes/HGNC:19191	combined immunodeficiency due to DOCK8 deficiency	https://search.clinicalgenome.org/kb/conditions/MONDO:0009478	Autosomal recessive inheritance	30 - Gene Associated with Autosomal Recessive Phenotype (08/22/2016)		https://search.clinicalgenome.org/kb/gene-dosage/HGNC:19191	Dosage Working Group	definitive evidence (04/09/2021)	https://search.clinicalgenome.org/kb/gene-validity/CGGV:assertion_07811d37-10c8-44dd-88b2-a2b574e59ac4-2021-04-09T142917.716Z	SCID-CID			
MONDO:0009479	UBR1	HGNC:16808	https://search.clinicalgenome.org/kb/genes/HGNC:16808	Johanson-Blizzard syndrome	https://search.clinicalgenome.org/kb/conditions/MONDO:0009479		30 - Gene Associated with Autosomal Recessive Phenotype (08/22/2016)		https://search.clinicalgenome.org/kb/gene-dosage/HGNC:16808	Dosage Working Group						
MONDO:0009484	DNAI1	HGNC:2954	https://search.clinicalgenome.org/kb/genes/HGNC:2954	primary ciliary dyskinesia 1	https://search.clinicalgenome.org/kb/conditions/MONDO:0009484		30 - Gene Associated with Autosomal Recessive Phenotype (08/22/2016)	0 - No Evidence for Haploinsufficiency (08/22/2016)	https://search.clinicalgenome.org/kb/gene-dosage/HGNC:2954	Dosage Working Group						
MONDO:0009485	UBE3B	HGNC:13478	https://search.clinicalgenome.org/kb/genes/HGNC:13478	oculocerebrofacial syndrome, Kaufman type	https://search.clinicalgenome.org/kb/conditions/MONDO:0009485	Autosomal recessive inheritance	30 - Gene Associated with Autosomal Recessive Phenotype (08/22/2016)	0 - No Evidence for Haploinsufficiency (08/22/2016)	https://search.clinicalgenome.org/kb/gene-dosage/HGNC:13478	Dosage Working Group	definitive evidence (07/30/2021)	https://search.clinicalgenome.org/kb/gene-validity/CGGV:assertion_5604d13c-a46a-4a83-87ec-e4e94bbed3f0-2021-07-30T130354.346Z	Syndromic Disorders			
MONDO:0009492	OXCT1	HGNC:8527	https://search.clinicalgenome.org/kb/genes/HGNC:8527	succinyl-CoA:3-ketoacid CoA transferase deficiency	https://search.clinicalgenome.org/kb/conditions/MONDO:0009492		30 - Gene Associated with Autosomal Recessive Phenotype (08/22/2016)		https://search.clinicalgenome.org/kb/gene-dosage/HGNC:8527	Dosage Working Group						
MONDO:0009495	MGP	HGNC:7060	https://search.clinicalgenome.org/kb/genes/HGNC:7060	Keutel syndrome	https://search.clinicalgenome.org/kb/conditions/MONDO:0009495		30 - Gene Associated with Autosomal Recessive Phenotype (02/08/2021)	0 - No Evidence for Haploinsufficiency (02/08/2021)	https://search.clinicalgenome.org/kb/gene-dosage/HGNC:7060	Dosage Working Group						
MONDO:0009499	GALC	HGNC:4115	https://search.clinicalgenome.org/kb/genes/HGNC:4115	Krabbe disease	https://search.clinicalgenome.org/kb/conditions/MONDO:0009499		30 - Gene Associated with Autosomal Recessive Phenotype (08/22/2016)		https://search.clinicalgenome.org/kb/gene-dosage/HGNC:4115	Dosage Working Group						
MONDO:0009503	PDHX	HGNC:21350	https://search.clinicalgenome.org/kb/genes/HGNC:21350	pyruvate dehydrogenase E3-binding protein deficiency	https://search.clinicalgenome.org/kb/conditions/MONDO:0009503		30 - Gene Associated with Autosomal Recessive Phenotype (08/22/2016)		https://search.clinicalgenome.org/kb/gene-dosage/HGNC:21350	Dosage Working Group						
MONDO:0009504	SUCLG1	HGNC:11449	https://search.clinicalgenome.org/kb/genes/HGNC:11449	mitochondrial DNA depletion syndrome 9	https://search.clinicalgenome.org/kb/conditions/MONDO:0009504		30 - Gene Associated with Autosomal Recessive Phenotype (08/22/2016)	0 - No Evidence for Haploinsufficiency (08/22/2016)	https://search.clinicalgenome.org/kb/gene-dosage/HGNC:11449	Dosage Working Group						
MONDO:0009509	GRIN2A	HGNC:4585	https://search.clinicalgenome.org/kb/genes/HGNC:4585	Landau-Kleffner syndrome	https://search.clinicalgenome.org/kb/conditions/MONDO:0009509		1 - Little Evidence for Haploinsufficiency (06/19/2013)	0 - No Evidence for Haploinsufficiency (06/19/2013)	https://search.clinicalgenome.org/kb/gene-dosage/HGNC:4585	Dosage Working Group						
MONDO:0009520	HMGCL	HGNC:5005	https://search.clinicalgenome.org/kb/genes/HGNC:5005	3-hydroxy-3-methylglutaric aciduria	https://search.clinicalgenome.org/kb/conditions/MONDO:0009520	Autosomal recessive inheritance					definitive evidence (06/26/2018)	https://search.clinicalgenome.org/kb/gene-validity/CGGV:assertion_f4d084e5-a740-4bfd-a850-d6db900d4a4e-2018-06-26T160000.000Z	Fatty Acid Oxidation Disorders			
MONDO:0009525	FBXW4	HGNC:10847	https://search.clinicalgenome.org/kb/genes/HGNC:10847	split hand-foot malformation 3	https://search.clinicalgenome.org/kb/conditions/MONDO:0009525		0 - No Evidence for Haploinsufficiency (10/08/2014)	0 - No Evidence for Haploinsufficiency (10/08/2014)	https://search.clinicalgenome.org/kb/gene-dosage/HGNC:10847	Dosage Working Group						
MONDO:0009529	DLD	HGNC:2898	https://search.clinicalgenome.org/kb/genes/HGNC:2898	pyruvate dehydrogenase E3 deficiency	https://search.clinicalgenome.org/kb/conditions/MONDO:0009529	Autosomal recessive inheritance					definitive evidence (03/08/2019)	https://search.clinicalgenome.org/kb/gene-validity/CGGV:assertion_a9dfbbc2-cede-491e-9db0-fc5719fbc729-2019-03-08T170000.000Z	Aminoacidopathy			
MONDO:0009552	SLURP1	HGNC:18746	https://search.clinicalgenome.org/kb/genes/HGNC:18746	mal de Meleda	https://search.clinicalgenome.org/kb/conditions/MONDO:0009552		30 - Gene Associated with Autosomal Recessive Phenotype (06/08/2017)	0 - No Evidence for Haploinsufficiency (06/08/2017)	https://search.clinicalgenome.org/kb/gene-dosage/HGNC:18746	Dosage Working Group						
MONDO:0009556	MLYCD	HGNC:7150	https://search.clinicalgenome.org/kb/genes/HGNC:7150	malonic aciduria	https://search.clinicalgenome.org/kb/conditions/MONDO:0009556	Autosomal recessive inheritance	30 - Gene Associated with Autosomal Recessive Phenotype (08/22/2016)	0 - No Evidence for Haploinsufficiency (08/22/2016)	https://search.clinicalgenome.org/kb/gene-dosage/HGNC:7150	Dosage Working Group	definitive evidence (06/26/2018)	https://search.clinicalgenome.org/kb/gene-validity/CGGV:assertion_70af8ffa-430b-4c69-bfa9-d6ba2f7b4f32-2018-06-26T160000.000Z	Fatty Acid Oxidation Disorders			
MONDO:0009561	MAN2B1	HGNC:6826	https://search.clinicalgenome.org/kb/genes/HGNC:6826	alpha-mannosidosis	https://search.clinicalgenome.org/kb/conditions/MONDO:0009561		30 - Gene Associated with Autosomal Recessive Phenotype (08/22/2016)	0 - No Evidence for Haploinsufficiency (08/22/2016)	https://search.clinicalgenome.org/kb/gene-dosage/HGNC:6826	Dosage Working Group						
MONDO:0009563	BCKDHA	HGNC:986	https://search.clinicalgenome.org/kb/genes/HGNC:986	maple syrup urine disease	https://search.clinicalgenome.org/kb/conditions/MONDO:0009563									Has Insufficient Evidence for Actionability Based on Early Rule-out (06/28/2021) | Strong Actionability (06/28/2021)	https://search.clinicalgenome.org/kb/gene-validity/https://actionability.clinicalgenome.org/ac/Adult/ui/stg2SummaryRpt?doc=AC1041 | https://search.clinicalgenome.org/kb/gene-validity/https://actionability.clinicalgenome.org/ac/Pediatric/ui/stg2SummaryRpt?doc=AC1041	Adult Actionability Working Group | Pediatric Actionability Working Group
MONDO:0009567	SIL1	HGNC:24624	https://search.clinicalgenome.org/kb/genes/HGNC:24624	Marinesco-Sjogren syndrome	https://search.clinicalgenome.org/kb/conditions/MONDO:0009567		30 - Gene Associated with Autosomal Recessive Phenotype (08/23/2021)		https://search.clinicalgenome.org/kb/gene-dosage/HGNC:24624	Dosage Working Group						
MONDO:0009568	SPG21	HGNC:20373	https://search.clinicalgenome.org/kb/genes/HGNC:20373	mast syndrome	https://search.clinicalgenome.org/kb/conditions/MONDO:0009568		30 - Gene Associated with Autosomal Recessive Phenotype (08/22/2016)		https://search.clinicalgenome.org/kb/gene-dosage/HGNC:20373	Dosage Working Group						
MONDO:0009572	MEFV	HGNC:6998	https://search.clinicalgenome.org/kb/genes/HGNC:6998	autosomal recessive familial Mediterranean fever	https://search.clinicalgenome.org/kb/conditions/MONDO:0009572		0 - No Evidence for Haploinsufficiency (08/16/2018)	0 - No Evidence for Haploinsufficiency (08/16/2018)	https://search.clinicalgenome.org/kb/gene-dosage/HGNC:6998	Dosage Working Group				Assertion Pending (05/23/2016)	https://search.clinicalgenome.org/kb/gene-validity/https://actionability.clinicalgenome.org/ac/Adult/ui/stg2SummaryRpt?doc=AC101	Adult Actionability Working Group
MONDO:0009591	ARSA	HGNC:713	https://search.clinicalgenome.org/kb/genes/HGNC:713	metachromatic leukodystrophy, juvenile form	https://search.clinicalgenome.org/kb/conditions/MONDO:0009591		30 - Gene Associated with Autosomal Recessive Phenotype (09/05/2012)	0 - No Evidence for Haploinsufficiency (09/05/2012)	https://search.clinicalgenome.org/kb/gene-dosage/HGNC:713	Dosage Working Group						
MONDO:0009593	GPX4	HGNC:4556	https://search.clinicalgenome.org/kb/genes/HGNC:4556	spondylometaphyseal dysplasia, Sedaghatian type	https://search.clinicalgenome.org/kb/conditions/MONDO:0009593		30 - Gene Associated with Autosomal Recessive Phenotype (08/22/2016)	0 - No Evidence for Haploinsufficiency (08/22/2016)	https://search.clinicalgenome.org/kb/gene-dosage/HGNC:4556	Dosage Working Group						
MONDO:0009595	RMRP	HGNC:10031	https://search.clinicalgenome.org/kb/genes/HGNC:10031	cartilage-hair hypoplasia	https://search.clinicalgenome.org/kb/conditions/MONDO:0009595	Autosomal recessive inheritance	30 - Gene Associated with Autosomal Recessive Phenotype (08/22/2016)		https://search.clinicalgenome.org/kb/gene-dosage/HGNC:10031	Dosage Working Group	definitive evidence (07/27/2021)	https://search.clinicalgenome.org/kb/gene-validity/CGGV:assertion_c7328b31-364b-4a7c-aaed-731b582cb716-2021-07-27T155213.681Z	SCID-CID			
MONDO:0009603	HIBCH	HGNC:4908	https://search.clinicalgenome.org/kb/genes/HGNC:4908	3-hydroxyisobutyryl-CoA hydrolase deficiency	https://search.clinicalgenome.org/kb/conditions/MONDO:0009603	Autosomal recessive inheritance					definitive evidence (11/07/2019)	https://search.clinicalgenome.org/kb/gene-validity/CGGV:assertion_26621ace-7c6b-4a1c-8286-02c4cb8a1544-2019-11-07T222437.403Z	Aminoacidopathy			
MONDO:0009605	CYB5A	HGNC:2570	https://search.clinicalgenome.org/kb/genes/HGNC:2570	methemoglobinemia type 4	https://search.clinicalgenome.org/kb/conditions/MONDO:0009605		30 - Gene Associated with Autosomal Recessive Phenotype (08/22/2016)	0 - No Evidence for Haploinsufficiency (08/22/2016)	https://search.clinicalgenome.org/kb/gene-dosage/HGNC:2570	Dosage Working Group						
MONDO:0009607	MAT1A	HGNC:6903	https://search.clinicalgenome.org/kb/genes/HGNC:6903	methionine adenosyltransferase deficiency	https://search.clinicalgenome.org/kb/conditions/MONDO:0009607	Autosomal recessive inheritance					definitive evidence (09/13/2019)	https://search.clinicalgenome.org/kb/gene-validity/CGGV:assertion_35cff382-98fe-4103-8edc-101f0c565a9e-2019-09-13T160000.000Z	Aminoacidopathy			
MONDO:0009609	MTR	HGNC:7468	https://search.clinicalgenome.org/kb/genes/HGNC:7468	methylcobalamin deficiency type cblG	https://search.clinicalgenome.org/kb/conditions/MONDO:0009609	Autosomal recessive inheritance	30 - Gene Associated with Autosomal Recessive Phenotype (08/22/2016)	0 - No Evidence for Haploinsufficiency (08/22/2016)	https://search.clinicalgenome.org/kb/gene-dosage/HGNC:7468	Dosage Working Group	definitive evidence (07/02/2021)	https://search.clinicalgenome.org/kb/gene-validity/CGGV:assertion_1572b7da-1736-4a44-9420-d9734d53f950-2021-07-02T160000.000Z	Aminoacidopathy			
MONDO:0009610	AUH	HGNC:890	https://search.clinicalgenome.org/kb/genes/HGNC:890	3-methylglutaconic aciduria type 1	https://search.clinicalgenome.org/kb/conditions/MONDO:0009610	Autosomal recessive inheritance					definitive evidence (06/29/2020)	https://search.clinicalgenome.org/kb/gene-validity/CGGV:assertion_681f6747-37ce-498e-8bb1-eddd55a90e2c-2020-06-29T174231.569Z	Aminoacidopathy			
MONDO:0009612	MMUT	HGNC:7526	https://search.clinicalgenome.org/kb/genes/HGNC:7526	methylmalonic aciduria due to methylmalonyl-CoA mutase deficiency	https://search.clinicalgenome.org/kb/conditions/MONDO:0009612	Autosomal recessive inheritance	30 - Gene Associated with Autosomal Recessive Phenotype (08/25/2016)	0 - No Evidence for Haploinsufficiency (08/25/2016)	https://search.clinicalgenome.org/kb/gene-dosage/HGNC:7526	Dosage Working Group	definitive evidence (05/09/2019)	https://search.clinicalgenome.org/kb/gene-validity/CGGV:assertion_3c5301da-0dad-417a-8257-5b1c6155e8fa-2019-05-09T160000.000Z	Aminoacidopathy	Has Insufficient Evidence for Actionability Based on Early Rule-out (05/13/2014) | Assertion Pending (06/26/2019)	https://search.clinicalgenome.org/kb/gene-validity/https://actionability.clinicalgenome.org/ac/Adult/ui/stg2SummaryRpt?doc=AC122 | https://search.clinicalgenome.org/kb/gene-validity/https://actionability.clinicalgenome.org/ac/Pediatric/ui/stg2SummaryRpt?doc=AC122	Adult Actionability Working Group | Pediatric Actionability Working Group
MONDO:0009613	MMAA	HGNC:18871	https://search.clinicalgenome.org/kb/genes/HGNC:18871	vitamin B12-responsive methylmalonic acidemia type cblA	https://search.clinicalgenome.org/kb/conditions/MONDO:0009613	Autosomal recessive inheritance	30 - Gene Associated with Autosomal Recessive Phenotype (08/22/2016)	0 - No Evidence for Haploinsufficiency (08/22/2016)	https://search.clinicalgenome.org/kb/gene-dosage/HGNC:18871	Dosage Working Group	definitive evidence (02/12/2021)	https://search.clinicalgenome.org/kb/gene-validity/CGGV:assertion_5b81bb9e-5f71-47bf-b187-5eef83d91d57-2021-02-12T142402.133Z	Aminoacidopathy	Has Insufficient Evidence for Actionability Based on Early Rule-out (05/13/2014) | Assertion Pending (06/26/2019)	https://search.clinicalgenome.org/kb/gene-validity/https://actionability.clinicalgenome.org/ac/Adult/ui/stg2SummaryRpt?doc=AC122 | https://search.clinicalgenome.org/kb/gene-validity/https://actionability.clinicalgenome.org/ac/Pediatric/ui/stg2SummaryRpt?doc=AC122	Adult Actionability Working Group | Pediatric Actionability Working Group
MONDO:0009614	MMAB	HGNC:19331	https://search.clinicalgenome.org/kb/genes/HGNC:19331	vitamin B12-responsive methylmalonic acidemia type cblB	https://search.clinicalgenome.org/kb/conditions/MONDO:0009614		30 - Gene Associated with Autosomal Recessive Phenotype (06/30/2017)	0 - No Evidence for Haploinsufficiency (06/30/2017)	https://search.clinicalgenome.org/kb/gene-dosage/HGNC:19331	Dosage Working Group				Has Insufficient Evidence for Actionability Based on Early Rule-out (05/13/2014) | Assertion Pending (06/26/2019)	https://search.clinicalgenome.org/kb/gene-validity/https://actionability.clinicalgenome.org/ac/Adult/ui/stg2SummaryRpt?doc=AC122 | https://search.clinicalgenome.org/kb/gene-validity/https://actionability.clinicalgenome.org/ac/Pediatric/ui/stg2SummaryRpt?doc=AC122	Adult Actionability Working Group | Pediatric Actionability Working Group
MONDO:0009615	MCEE	HGNC:16732	https://search.clinicalgenome.org/kb/genes/HGNC:16732	methylmalonic acidemia due to methylmalonyl-CoA epimerase deficiency	https://search.clinicalgenome.org/kb/conditions/MONDO:0009615	Autosomal recessive inheritance	30 - Gene Associated with Autosomal Recessive Phenotype (03/25/2015)	0 - No Evidence for Haploinsufficiency (03/25/2015)	https://search.clinicalgenome.org/kb/gene-dosage/HGNC:16732	Dosage Working Group	definitive evidence (07/09/2020)	https://search.clinicalgenome.org/kb/gene-validity/CGGV:assertion_b8546531-fe3d-48fd-8103-f5f84fd04514-2020-07-09T160000.000Z	Aminoacidopathy	Has Insufficient Evidence for Actionability Based on Early Rule-out (05/13/2014) | Assertion Pending (06/26/2019)	https://search.clinicalgenome.org/kb/gene-validity/https://actionability.clinicalgenome.org/ac/Adult/ui/stg2SummaryRpt?doc=AC122 | https://search.clinicalgenome.org/kb/gene-validity/https://actionability.clinicalgenome.org/ac/Pediatric/ui/stg2SummaryRpt?doc=AC122	Adult Actionability Working Group | Pediatric Actionability Working Group
MONDO:0009617	MCPH1	HGNC:6954	https://search.clinicalgenome.org/kb/genes/HGNC:6954	microcephaly 1, primary, autosomal recessive	https://search.clinicalgenome.org/kb/conditions/MONDO:0009617		30 - Gene Associated with Autosomal Recessive Phenotype (08/22/2016)		https://search.clinicalgenome.org/kb/gene-dosage/HGNC:6954	Dosage Working Group						
MONDO:0009623	NBN	HGNC:7652	https://search.clinicalgenome.org/kb/genes/HGNC:7652	Nijmegen breakage syndrome	https://search.clinicalgenome.org/kb/conditions/MONDO:0009623	Autosomal recessive inheritance	3 - Sufficient Evidence for Haploinsufficiency (08/21/2020)	0 - No Evidence for Haploinsufficiency (08/21/2020)	https://search.clinicalgenome.org/kb/gene-dosage/HGNC:7652	Dosage Working Group	definitive evidence (08/14/2019)	https://search.clinicalgenome.org/kb/gene-validity/CGGV:assertion_de6fa1fe-a86e-4f0d-8da8-7690debe9aec-2019-08-14T193132.776Z	Hereditary Cancer			
MONDO:0009624	TUBGCP6	HGNC:18127	https://search.clinicalgenome.org/kb/genes/HGNC:18127	microcephaly and chorioretinopathy 1	https://search.clinicalgenome.org/kb/conditions/MONDO:0009624		30 - Gene Associated with Autosomal Recessive Phenotype (08/22/2016)	0 - No Evidence for Haploinsufficiency (08/22/2016)	https://search.clinicalgenome.org/kb/gene-dosage/HGNC:18127	Dosage Working Group						
MONDO:0009629	CANT1	HGNC:19721	https://search.clinicalgenome.org/kb/genes/HGNC:19721	Desbuquois dysplasia 1	https://search.clinicalgenome.org/kb/conditions/MONDO:0009629		30 - Gene Associated with Autosomal Recessive Phenotype (08/22/2016)		https://search.clinicalgenome.org/kb/gene-dosage/HGNC:19721	Dosage Working Group						
MONDO:0009635	MYO5B	HGNC:7603	https://search.clinicalgenome.org/kb/genes/HGNC:7603	microvillus inclusion disease	https://search.clinicalgenome.org/kb/conditions/MONDO:0009635		30 - Gene Associated with Autosomal Recessive Phenotype (04/09/2015)	0 - No Evidence for Haploinsufficiency (04/09/2015)	https://search.clinicalgenome.org/kb/gene-dosage/HGNC:7603	Dosage Working Group						
MONDO:0009636	DGUOK	HGNC:2858	https://search.clinicalgenome.org/kb/genes/HGNC:2858	mitochondrial DNA depletion syndrome 3	https://search.clinicalgenome.org/kb/conditions/MONDO:0009636		30 - Gene Associated with Autosomal Recessive Phenotype (08/22/2016)		https://search.clinicalgenome.org/kb/gene-dosage/HGNC:2858	Dosage Working Group						
MONDO:0009644	MOCS2	HGNC:7193	https://search.clinicalgenome.org/kb/genes/HGNC:7193	sulfite oxidase deficiency due to molybdenum cofactor deficiency type B	https://search.clinicalgenome.org/kb/conditions/MONDO:0009644		30 - Gene Associated with Autosomal Recessive Phenotype (08/22/2016)	0 - No Evidence for Haploinsufficiency (08/22/2016)	https://search.clinicalgenome.org/kb/gene-dosage/HGNC:7193	Dosage Working Group						
MONDO:0009655	SGSH	HGNC:10818	https://search.clinicalgenome.org/kb/genes/HGNC:10818	Sanfilippo syndrome type A	https://search.clinicalgenome.org/kb/conditions/MONDO:0009655		30 - Gene Associated with Autosomal Recessive Phenotype (02/12/2015)	0 - No Evidence for Haploinsufficiency (02/12/2015)	https://search.clinicalgenome.org/kb/gene-dosage/HGNC:10818	Dosage Working Group						
MONDO:0009657	HGSNAT	HGNC:26527	https://search.clinicalgenome.org/kb/genes/HGNC:26527	Sanfilippo syndrome type C	https://search.clinicalgenome.org/kb/conditions/MONDO:0009657		30 - Gene Associated with Autosomal Recessive Phenotype (08/22/2016)		https://search.clinicalgenome.org/kb/gene-dosage/HGNC:26527	Dosage Working Group						
MONDO:0009658	GNS	HGNC:4422	https://search.clinicalgenome.org/kb/genes/HGNC:4422	Sanfilippo syndrome type D	https://search.clinicalgenome.org/kb/conditions/MONDO:0009658		30 - Gene Associated with Autosomal Recessive Phenotype (08/22/2016)		https://search.clinicalgenome.org/kb/gene-dosage/HGNC:4422	Dosage Working Group						
MONDO:0009659	GALNS	HGNC:4122	https://search.clinicalgenome.org/kb/genes/HGNC:4122	mucopolysaccharidosis type 4A	https://search.clinicalgenome.org/kb/conditions/MONDO:0009659		30 - Gene Associated with Autosomal Recessive Phenotype (08/22/2016)	0 - No Evidence for Haploinsufficiency (08/22/2016)	https://search.clinicalgenome.org/kb/gene-dosage/HGNC:4122	Dosage Working Group				Has Insufficient Evidence for Actionability Based on Early Rule-out (11/25/2019) | Moderate Actionability (05/20/2020)	https://search.clinicalgenome.org/kb/gene-validity/https://actionability.clinicalgenome.org/ac/Adult/ui/stg2SummaryRpt?doc=AC1010 | https://search.clinicalgenome.org/kb/gene-validity/https://actionability.clinicalgenome.org/ac/Pediatric/ui/stg2SummaryRpt?doc=AC1010	Adult Actionability Working Group | Pediatric Actionability Working Group
MONDO:0009662	GUSB	HGNC:4696	https://search.clinicalgenome.org/kb/genes/HGNC:4696	mucopolysaccharidosis type 7	https://search.clinicalgenome.org/kb/conditions/MONDO:0009662		30 - Gene Associated with Autosomal Recessive Phenotype (10/12/2015)	0 - No Evidence for Haploinsufficiency (10/12/2015)	https://search.clinicalgenome.org/kb/gene-dosage/HGNC:4696	Dosage Working Group						
MONDO:0009664	TRIM37	HGNC:7523	https://search.clinicalgenome.org/kb/genes/HGNC:7523	mulibrey nanism	https://search.clinicalgenome.org/kb/conditions/MONDO:0009664	Autosomal recessive inheritance	30 - Gene Associated with Autosomal Recessive Phenotype (08/22/2016)	0 - No Evidence for Haploinsufficiency (08/22/2016)	https://search.clinicalgenome.org/kb/gene-dosage/HGNC:7523	Dosage Working Group	definitive evidence (05/01/2020)	https://search.clinicalgenome.org/kb/gene-validity/CGGV:assertion_0faa569d-4e0c-4809-a1b2-a93d460751e8-2020-05-01T160000.000Z	Peroxisomal Disorders			
MONDO:0009665	BTD	HGNC:1122	https://search.clinicalgenome.org/kb/genes/HGNC:1122	biotinidase deficiency	https://search.clinicalgenome.org/kb/conditions/MONDO:0009665	Autosomal recessive inheritance	30 - Gene Associated with Autosomal Recessive Phenotype (05/21/2015)	0 - No Evidence for Haploinsufficiency (05/21/2015)	https://search.clinicalgenome.org/kb/gene-dosage/HGNC:1122	Dosage Working Group	definitive evidence (02/10/2020)	https://search.clinicalgenome.org/kb/gene-validity/CGGV:assertion_847f7f2b-575f-4a90-bf02-179d464e4841-2020-02-10T180000.000Z	Hearing Loss	Assertion Pending (04/04/2016)	https://search.clinicalgenome.org/kb/gene-validity/https://actionability.clinicalgenome.org/ac/Adult/ui/stg2SummaryRpt?doc=AC098	Adult Actionability Working Group
MONDO:0009666	HLCS	HGNC:4976	https://search.clinicalgenome.org/kb/genes/HGNC:4976	holocarboxylase synthetase deficiency	https://search.clinicalgenome.org/kb/conditions/MONDO:0009666	Autosomal recessive inheritance	30 - Gene Associated with Autosomal Recessive Phenotype (08/22/2016)	0 - No Evidence for Haploinsufficiency (08/22/2016)	https://search.clinicalgenome.org/kb/gene-dosage/HGNC:4976	Dosage Working Group	definitive evidence (02/26/2021)	https://search.clinicalgenome.org/kb/gene-validity/CGGV:assertion_ad306285-9588-48e3-a6fa-183db3f01fe9-2021-02-26T171131.548Z	Aminoacidopathy			
MONDO:0009675	CAPN3	HGNC:1480	https://search.clinicalgenome.org/kb/genes/HGNC:1480	autosomal recessive limb-girdle muscular dystrophy type 2A	https://search.clinicalgenome.org/kb/conditions/MONDO:0009675		30 - Gene Associated with Autosomal Recessive Phenotype (08/22/2016)	0 - No Evidence for Haploinsufficiency (08/22/2016)	https://search.clinicalgenome.org/kb/gene-dosage/HGNC:1480	Dosage Working Group						
MONDO:0009677	SGCG	HGNC:10809	https://search.clinicalgenome.org/kb/genes/HGNC:10809	autosomal recessive limb-girdle muscular dystrophy type 2C	https://search.clinicalgenome.org/kb/conditions/MONDO:0009677		30 - Gene Associated with Autosomal Recessive Phenotype (08/22/2016)	0 - No Evidence for Haploinsufficiency (08/22/2016)	https://search.clinicalgenome.org/kb/gene-dosage/HGNC:10809	Dosage Working Group						
MONDO:0009683	TRIM32	HGNC:16380	https://search.clinicalgenome.org/kb/genes/HGNC:16380	autosomal recessive limb-girdle muscular dystrophy type 2H	https://search.clinicalgenome.org/kb/conditions/MONDO:0009683		30 - Gene Associated with Autosomal Recessive Phenotype (08/22/2016)	0 - No Evidence for Haploinsufficiency (08/22/2016)	https://search.clinicalgenome.org/kb/gene-dosage/HGNC:16380	Dosage Working Group						
MONDO:0009689	CHAT	HGNC:1912	https://search.clinicalgenome.org/kb/genes/HGNC:1912	congenital myasthenic syndrome 6	https://search.clinicalgenome.org/kb/conditions/MONDO:0009689		30 - Gene Associated with Autosomal Recessive Phenotype (08/22/2016)		https://search.clinicalgenome.org/kb/gene-dosage/HGNC:1912	Dosage Working Group						
MONDO:0009690	DOK7	HGNC:26594	https://search.clinicalgenome.org/kb/genes/HGNC:26594	congenital myasthenic syndrome 10	https://search.clinicalgenome.org/kb/conditions/MONDO:0009690		30 - Gene Associated with Autosomal Recessive Phenotype (08/22/2016)		https://search.clinicalgenome.org/kb/gene-dosage/HGNC:26594	Dosage Working Group						
MONDO:0009697	EPM2A	HGNC:3413	https://search.clinicalgenome.org/kb/genes/HGNC:3413	Lafora disease	https://search.clinicalgenome.org/kb/conditions/MONDO:0009697	Autosomal recessive inheritance	30 - Gene Associated with Autosomal Recessive Phenotype (08/22/2016)	0 - No Evidence for Haploinsufficiency (08/22/2016)	https://search.clinicalgenome.org/kb/gene-dosage/HGNC:3413	Dosage Working Group	definitive evidence (05/23/2020)	https://search.clinicalgenome.org/kb/gene-validity/CGGV:assertion_f970ced6-0164-41ed-9e1f-1fb9f892bca6-2020-05-23T190000.000Z	Epilepsy			
MONDO:0009698	CSTB	HGNC:2482	https://search.clinicalgenome.org/kb/genes/HGNC:2482	Unverricht-Lundborg syndrome	https://search.clinicalgenome.org/kb/conditions/MONDO:0009698	Autosomal recessive inheritance	30 - Gene Associated with Autosomal Recessive Phenotype (08/22/2016)	0 - No Evidence for Haploinsufficiency (08/22/2016)	https://search.clinicalgenome.org/kb/gene-dosage/HGNC:2482	Dosage Working Group	definitive evidence (06/16/2020)	https://search.clinicalgenome.org/kb/gene-validity/CGGV:assertion_2926506c-5b75-4340-b821-e3ac846b6621-2020-06-16T160000.000Z	Epilepsy			
MONDO:0009700	MYMK	HGNC:33778	https://search.clinicalgenome.org/kb/genes/HGNC:33778	Carey-Fineman-Ziter syndrome	https://search.clinicalgenome.org/kb/conditions/MONDO:0009700	Autosomal recessive inheritance					definitive evidence (04/08/2022)	https://search.clinicalgenome.org/kb/gene-validity/CGGV:assertion_570cb879-d299-41b0-87ba-406bf9567266-2022-04-08T040057.342Z	Syndromic Disorders			
MONDO:0009703	FLAD1	HGNC:24671	https://search.clinicalgenome.org/kb/genes/HGNC:24671	myopathy with abnormal lipid metabolism	https://search.clinicalgenome.org/kb/conditions/MONDO:0009703	Autosomal recessive inheritance					definitive evidence (12/16/2020)	https://search.clinicalgenome.org/kb/gene-validity/CGGV:assertion_769764bf-09c5-4a7d-8501-5fcf154fcdda-2020-12-16T181902.981Z	Fatty Acid Oxidation Disorders			
MONDO:0009704	CPT2	HGNC:2330	https://search.clinicalgenome.org/kb/genes/HGNC:2330	carnitine palmitoyl transferase II deficiency, myopathic form	https://search.clinicalgenome.org/kb/conditions/MONDO:0009704									Moderate Actionability (12/26/2020) | Moderate Actionability (12/26/2020)	https://search.clinicalgenome.org/kb/gene-validity/https://actionability.clinicalgenome.org/ac/Adult/ui/stg2SummaryRpt?doc=AC1022 | https://search.clinicalgenome.org/kb/gene-validity/https://actionability.clinicalgenome.org/ac/Pediatric/ui/stg2SummaryRpt?doc=AC1022	Adult Actionability Working Group | Pediatric Actionability Working Group
MONDO:0009705	CPT1A	HGNC:2328	https://search.clinicalgenome.org/kb/genes/HGNC:2328	carnitine palmitoyl transferase 1A deficiency	https://search.clinicalgenome.org/kb/conditions/MONDO:0009705	Autosomal recessive inheritance	30 - Gene Associated with Autosomal Recessive Phenotype (08/22/2016)	0 - No Evidence for Haploinsufficiency (08/22/2016)	https://search.clinicalgenome.org/kb/gene-dosage/HGNC:2328	Dosage Working Group	definitive evidence (01/23/2018)	https://search.clinicalgenome.org/kb/gene-validity/CGGV:assertion_dcea255c-11e4-46fd-b0f7-2de68311a75c-2018-01-23T170000.000Z	Fatty Acid Oxidation Disorders			
MONDO:0009709	BIN1	HGNC:1052	https://search.clinicalgenome.org/kb/genes/HGNC:1052	myopathy, centronuclear, 2	https://search.clinicalgenome.org/kb/conditions/MONDO:0009709		30 - Gene Associated with Autosomal Recessive Phenotype (08/22/2016)		https://search.clinicalgenome.org/kb/gene-dosage/HGNC:1052	Dosage Working Group						
MONDO:0009717	HSPG2	HGNC:5273	https://search.clinicalgenome.org/kb/genes/HGNC:5273	Schwartz-Jampel syndrome	https://search.clinicalgenome.org/kb/conditions/MONDO:0009717		30 - Gene Associated with Autosomal Recessive Phenotype (06/02/2016)	0 - No Evidence for Haploinsufficiency (06/02/2016)	https://search.clinicalgenome.org/kb/gene-dosage/HGNC:5273	Dosage Working Group						
MONDO:0009722	STAC3	HGNC:28423	https://search.clinicalgenome.org/kb/genes/HGNC:28423	Bailey-Bloch congenital myopathy	https://search.clinicalgenome.org/kb/conditions/MONDO:0009722	Autosomal recessive inheritance					definitive evidence (04/25/2020)	https://search.clinicalgenome.org/kb/gene-validity/CGGV:assertion_940572b9-6a5a-4de1-8ee1-6394f589515f-2020-04-25T160000.000Z	Congenital Myopathies			
MONDO:0009723	ADAR	HGNC:225	https://search.clinicalgenome.org/kb/genes/HGNC:225	Leigh syndrome	https://search.clinicalgenome.org/kb/conditions/MONDO:0009723	Autosomal recessive inheritance					limited evidence (08/27/2020)	https://search.clinicalgenome.org/kb/gene-validity/CGGV:assertion_03f538b5-43af-4699-9ddb-264077de21c9-2020-08-27T164642.352Z	Mitochondrial Diseases			
MONDO:0009725	NEB	HGNC:7720	https://search.clinicalgenome.org/kb/genes/HGNC:7720	nemaline myopathy 2	https://search.clinicalgenome.org/kb/conditions/MONDO:0009725	Autosomal recessive inheritance					definitive evidence (10/21/2019)	https://search.clinicalgenome.org/kb/gene-validity/CGGV:assertion_796dd762-f35c-425a-be3f-05424324ade0-2019-10-21T160000.000Z	Congenital Myopathies			
MONDO:0009727	SLC26A2	HGNC:10994	https://search.clinicalgenome.org/kb/genes/HGNC:10994	atelosteogenesis type II	https://search.clinicalgenome.org/kb/conditions/MONDO:0009727	Autosomal recessive inheritance					definitive evidence (07/14/2020)	https://search.clinicalgenome.org/kb/gene-validity/CGGV:assertion_da79a651-9fc7-453e-a1c1-145771baa2f9-2020-07-14T160000.000Z	Skeletal Disorders			
MONDO:0009728	NPHP1	HGNC:7905	https://search.clinicalgenome.org/kb/genes/HGNC:7905	nephronophthisis 1	https://search.clinicalgenome.org/kb/conditions/MONDO:0009728	Autosomal recessive inheritance	30 - Gene Associated with Autosomal Recessive Phenotype (10/10/2012)	0 - No Evidence for Haploinsufficiency (10/10/2012)	https://search.clinicalgenome.org/kb/gene-dosage/HGNC:7905	Dosage Working Group	definitive evidence (01/27/2021)	https://search.clinicalgenome.org/kb/gene-validity/CGGV:assertion_abc69434-e9e6-4a2b-96b6-b7186f40021f-2021-01-27T170000.000Z	Kidney Cystic and Ciliopathy Disorders			
MONDO:0009732	NPHS1	HGNC:7908	https://search.clinicalgenome.org/kb/genes/HGNC:7908	congenital nephrotic syndrome, Finnish type	https://search.clinicalgenome.org/kb/conditions/MONDO:0009732		30 - Gene Associated with Autosomal Recessive Phenotype (08/22/2016)	0 - No Evidence for Haploinsufficiency (08/22/2016)	https://search.clinicalgenome.org/kb/gene-dosage/HGNC:7908	Dosage Working Group						
MONDO:0009734	ABCC8	HGNC:59	https://search.clinicalgenome.org/kb/genes/HGNC:59	hyperinsulinemic hypoglycemia, familial, 1	https://search.clinicalgenome.org/kb/conditions/MONDO:0009734		30 - Gene Associated with Autosomal Recessive Phenotype (02/24/2012)	0 - No Evidence for Haploinsufficiency (02/24/2012)	https://search.clinicalgenome.org/kb/gene-dosage/HGNC:59	Dosage Working Group						
MONDO:0009735	SPINK5	HGNC:15464	https://search.clinicalgenome.org/kb/genes/HGNC:15464	Netherton syndrome	https://search.clinicalgenome.org/kb/conditions/MONDO:0009735		30 - Gene Associated with Autosomal Recessive Phenotype (08/22/2016)		https://search.clinicalgenome.org/kb/gene-dosage/HGNC:15464	Dosage Working Group						
MONDO:0009744	PPT1	HGNC:9325	https://search.clinicalgenome.org/kb/genes/HGNC:9325	neuronal ceroid lipofuscinosis 1	https://search.clinicalgenome.org/kb/conditions/MONDO:0009744	Autosomal recessive inheritance	30 - Gene Associated with Autosomal Recessive Phenotype (08/22/2016)	0 - No Evidence for Haploinsufficiency (08/22/2016)	https://search.clinicalgenome.org/kb/gene-dosage/HGNC:9325	Dosage Working Group	definitive evidence (09/02/2021)	https://search.clinicalgenome.org/kb/gene-validity/CGGV:assertion_8f72e2d3-f951-44da-a052-555d4f680114-2021-09-02T160000.000Z	Retina			
MONDO:0009746	NTRK1	HGNC:8031	https://search.clinicalgenome.org/kb/genes/HGNC:8031	hereditary sensory and autonomic neuropathy type 4	https://search.clinicalgenome.org/kb/conditions/MONDO:0009746	Autosomal recessive inheritance					definitive evidence (11/17/2021)	https://search.clinicalgenome.org/kb/gene-validity/CGGV:assertion_e716345f-08da-4a06-b3e1-d07974a4305d-2021-11-17T030955.951Z	Charcot-Marie-Tooth			
MONDO:0009748	CCT5	HGNC:1618	https://search.clinicalgenome.org/kb/genes/HGNC:1618	hereditary sensory and autonomic neuropathy with spastic paraplegia	https://search.clinicalgenome.org/kb/conditions/MONDO:0009748		30 - Gene Associated with Autosomal Recessive Phenotype (08/22/2016)	0 - No Evidence for Haploinsufficiency (08/22/2016)	https://search.clinicalgenome.org/kb/gene-dosage/HGNC:1618	Dosage Working Group						
MONDO:0009749	GAN	HGNC:4137	https://search.clinicalgenome.org/kb/genes/HGNC:4137	giant axonal neuropathy 1	https://search.clinicalgenome.org/kb/conditions/MONDO:0009749	Autosomal recessive inheritance	30 - Gene Associated with Autosomal Recessive Phenotype (08/22/2016)		https://search.clinicalgenome.org/kb/gene-dosage/HGNC:4137	Dosage Working Group	definitive evidence (02/10/2022)	https://search.clinicalgenome.org/kb/gene-validity/CGGV:assertion_b9f65afa-5cb1-457e-abff-ab110145a32d-2022-02-10T021239.651Z	Charcot-Marie-Tooth			
MONDO:0009757	NPC1	HGNC:7897	https://search.clinicalgenome.org/kb/genes/HGNC:7897	Niemann-Pick disease, type C1	https://search.clinicalgenome.org/kb/conditions/MONDO:0009757	Autosomal recessive inheritance	30 - Gene Associated with Autosomal Recessive Phenotype (08/22/2016)		https://search.clinicalgenome.org/kb/gene-dosage/HGNC:7897	Dosage Working Group	definitive evidence (03/01/2022)	https://search.clinicalgenome.org/kb/gene-validity/CGGV:assertion_e8459873-2577-43ff-966c-e5180683d4f4-2022-03-01T170000.000Z	Lysosomal Diseases			
MONDO:0009758	GRM6	HGNC:4598	https://search.clinicalgenome.org/kb/genes/HGNC:4598	congenital stationary night blindness 1B	https://search.clinicalgenome.org/kb/conditions/MONDO:0009758		30 - Gene Associated with Autosomal Recessive Phenotype (08/22/2016)	0 - No Evidence for Haploinsufficiency (08/22/2016)	https://search.clinicalgenome.org/kb/gene-dosage/HGNC:4598	Dosage Working Group						
MONDO:0009759	BUB1B	HGNC:1149	https://search.clinicalgenome.org/kb/genes/HGNC:1149	mosaic variegated aneuploidy syndrome 1	https://search.clinicalgenome.org/kb/conditions/MONDO:0009759	Autosomal recessive inheritance	30 - Gene Associated with Autosomal Recessive Phenotype (02/02/2022)	0 - No Evidence for Haploinsufficiency (02/02/2022)	https://search.clinicalgenome.org/kb/gene-dosage/HGNC:1149	Dosage Working Group	definitive evidence (11/22/2019)	https://search.clinicalgenome.org/kb/gene-validity/CGGV:assertion_59147f27-d5a3-4760-ba8d-0429bae3c906-2019-11-22T145326.352Z	Hereditary Cancer			
MONDO:0009760	RELN	HGNC:9957	https://search.clinicalgenome.org/kb/genes/HGNC:9957	Norman-Roberts syndrome	https://search.clinicalgenome.org/kb/conditions/MONDO:0009760		30 - Gene Associated with Autosomal Recessive Phenotype (08/27/2012)	0 - No Evidence for Haploinsufficiency (08/27/2012)	https://search.clinicalgenome.org/kb/gene-dosage/HGNC:9957	Dosage Working Group						
MONDO:0009779	GPC6	HGNC:4454	https://search.clinicalgenome.org/kb/genes/HGNC:4454	autosomal recessive omodysplasia	https://search.clinicalgenome.org/kb/conditions/MONDO:0009779		30 - Gene Associated with Autosomal Recessive Phenotype (11/17/2011)	0 - No Evidence for Haploinsufficiency (11/17/2011)	https://search.clinicalgenome.org/kb/gene-dosage/HGNC:4454	Dosage Working Group						
MONDO:0009796	OAT	HGNC:8091	https://search.clinicalgenome.org/kb/genes/HGNC:8091	ornithine aminotransferase deficiency	https://search.clinicalgenome.org/kb/conditions/MONDO:0009796	Autosomal recessive inheritance	30 - Gene Associated with Autosomal Recessive Phenotype (08/22/2016)		https://search.clinicalgenome.org/kb/gene-dosage/HGNC:8091	Dosage Working Group	definitive evidence (07/10/2019)	https://search.clinicalgenome.org/kb/gene-validity/CGGV:assertion_edbab666-9ae6-46db-b818-809a4bf8333e-2019-07-10T160000.000Z	Aminoacidopathy	Strong Actionability (06/29/2020) | Moderate Actionability (06/29/2020)	https://search.clinicalgenome.org/kb/gene-validity/https://actionability.clinicalgenome.org/ac/Adult/ui/stg2SummaryRpt?doc=AC1014 | https://search.clinicalgenome.org/kb/gene-validity/https://actionability.clinicalgenome.org/ac/Pediatric/ui/stg2SummaryRpt?doc=AC1014	Adult Actionability Working Group | Pediatric Actionability Working Group
MONDO:0009804	COL1A1	HGNC:2197	https://search.clinicalgenome.org/kb/genes/HGNC:2197	osteogenesis imperfecta type 3	https://search.clinicalgenome.org/kb/conditions/MONDO:0009804	Autosomal dominant inheritance	3 - Sufficient Evidence for Haploinsufficiency (08/23/2012)	0 - No Evidence for Haploinsufficiency (08/23/2012)	https://search.clinicalgenome.org/kb/gene-dosage/HGNC:2197	Dosage Working Group	definitive evidence (06/24/2021)	https://search.clinicalgenome.org/kb/gene-validity/CGGV:assertion_a51b8f9f-0e11-4d82-b454-15d27e974dd7-2021-06-24T204605.941Z	Skeletal Disorders			
MONDO:0009805	PPIB	HGNC:9255	https://search.clinicalgenome.org/kb/genes/HGNC:9255	osteogenesis imperfecta type 9	https://search.clinicalgenome.org/kb/conditions/MONDO:0009805		30 - Gene Associated with Autosomal Recessive Phenotype (08/22/2016)	0 - No Evidence for Haploinsufficiency (08/22/2016)	https://search.clinicalgenome.org/kb/gene-dosage/HGNC:9255	Dosage Working Group						
MONDO:0009815	TCIRG1	HGNC:11647	https://search.clinicalgenome.org/kb/genes/HGNC:11647	autosomal recessive osteopetrosis 1	https://search.clinicalgenome.org/kb/conditions/MONDO:0009815		30 - Gene Associated with Autosomal Recessive Phenotype (08/22/2016)	0 - No Evidence for Haploinsufficiency (08/22/2016)	https://search.clinicalgenome.org/kb/gene-dosage/HGNC:11647	Dosage Working Group						
MONDO:0009817	OSTM1	HGNC:21652	https://search.clinicalgenome.org/kb/genes/HGNC:21652	autosomal recessive osteopetrosis 5	https://search.clinicalgenome.org/kb/conditions/MONDO:0009817		30 - Gene Associated with Autosomal Recessive Phenotype (08/22/2016)	0 - No Evidence for Haploinsufficiency (08/22/2016)	https://search.clinicalgenome.org/kb/gene-dosage/HGNC:21652	Dosage Working Group						
MONDO:0009821	FAM20C	HGNC:22140	https://search.clinicalgenome.org/kb/genes/HGNC:22140	lethal osteosclerotic bone dysplasia	https://search.clinicalgenome.org/kb/conditions/MONDO:0009821		30 - Gene Associated with Autosomal Recessive Phenotype (08/22/2016)		https://search.clinicalgenome.org/kb/gene-dosage/HGNC:22140	Dosage Working Group						
MONDO:0009823	AGXT	HGNC:341	https://search.clinicalgenome.org/kb/genes/HGNC:341	primary hyperoxaluria type 1	https://search.clinicalgenome.org/kb/conditions/MONDO:0009823		30 - Gene Associated with Autosomal Recessive Phenotype (08/22/2016)		https://search.clinicalgenome.org/kb/gene-dosage/HGNC:341	Dosage Working Group						
MONDO:0009824	GRHPR	HGNC:4570	https://search.clinicalgenome.org/kb/genes/HGNC:4570	primary hyperoxaluria type 2	https://search.clinicalgenome.org/kb/conditions/MONDO:0009824		30 - Gene Associated with Autosomal Recessive Phenotype (08/22/2016)	0 - No Evidence for Haploinsufficiency (08/22/2016)	https://search.clinicalgenome.org/kb/gene-dosage/HGNC:4570	Dosage Working Group						
MONDO:0009830	FBXO7	HGNC:13586	https://search.clinicalgenome.org/kb/genes/HGNC:13586	parkinsonian-pyramidal syndrome	https://search.clinicalgenome.org/kb/conditions/MONDO:0009830		30 - Gene Associated with Autosomal Recessive Phenotype (08/22/2016)		https://search.clinicalgenome.org/kb/gene-dosage/HGNC:13586	Dosage Working Group						
MONDO:0009833	EFL1	HGNC:25789	https://search.clinicalgenome.org/kb/genes/HGNC:25789	Shwachman-Diamond syndrome	https://search.clinicalgenome.org/kb/conditions/MONDO:0009833		30 - Gene Associated with Autosomal Recessive Phenotype (04/13/2022)		https://search.clinicalgenome.org/kb/gene-dosage/HGNC:25789	Dosage Working Group						
MONDO:0009843	AIMP1	HGNC:10648	https://search.clinicalgenome.org/kb/genes/HGNC:10648	hypomyelinating leukodystrophy 3	https://search.clinicalgenome.org/kb/conditions/MONDO:0009843		30 - Gene Associated with Autosomal Recessive Phenotype (08/22/2016)	0 - No Evidence for Haploinsufficiency (08/22/2016)	https://search.clinicalgenome.org/kb/gene-dosage/HGNC:10648	Dosage Working Group						
MONDO:0009846	DCXR	HGNC:18985	https://search.clinicalgenome.org/kb/genes/HGNC:18985	pentosuria	https://search.clinicalgenome.org/kb/conditions/MONDO:0009846		30 - Gene Associated with Autosomal Recessive Phenotype (08/22/2016)	0 - No Evidence for Haploinsufficiency (08/22/2016)	https://search.clinicalgenome.org/kb/gene-dosage/HGNC:18985	Dosage Working Group						
MONDO:0009855	HSD17B4	HGNC:5213	https://search.clinicalgenome.org/kb/genes/HGNC:5213	d-bifunctional protein deficiency	https://search.clinicalgenome.org/kb/conditions/MONDO:0009855	Autosomal recessive inheritance	30 - Gene Associated with Autosomal Recessive Phenotype (03/06/2018)	0 - No Evidence for Haploinsufficiency (03/06/2018)	https://search.clinicalgenome.org/kb/gene-dosage/HGNC:5213	Dosage Working Group	definitive evidence (04/17/2020)	https://search.clinicalgenome.org/kb/gene-validity/CGGV:assertion_b992de69-49b3-496d-a83a-5bcc427fdf98-2020-04-17T160000.000Z	Peroxisomal Disorders			
MONDO:0009857	AMH	HGNC:464	https://search.clinicalgenome.org/kb/genes/HGNC:464	persistent Mullerian duct syndrome	https://search.clinicalgenome.org/kb/conditions/MONDO:0009857		30 - Gene Associated with Autosomal Recessive Phenotype (08/22/2016)		https://search.clinicalgenome.org/kb/gene-dosage/HGNC:464	Dosage Working Group						
MONDO:0009861	PAH	HGNC:8582	https://search.clinicalgenome.org/kb/genes/HGNC:8582	phenylketonuria	https://search.clinicalgenome.org/kb/conditions/MONDO:0009861	Autosomal recessive inheritance	30 - Gene Associated with Autosomal Recessive Phenotype (08/28/2014)	0 - No Evidence for Haploinsufficiency (08/28/2014)	https://search.clinicalgenome.org/kb/gene-dosage/HGNC:8582	Dosage Working Group	definitive evidence (04/24/2020)	https://search.clinicalgenome.org/kb/gene-validity/CGGV:assertion_5a617cb4-94ec-4f34-b97e-10d9808a1581-2020-04-24T160000.000Z	Aminoacidopathy	Assertion Pending (07/08/2016)	https://search.clinicalgenome.org/kb/gene-validity/https://actionability.clinicalgenome.org/ac/Adult/ui/stg2SummaryRpt?doc=AC110	Adult Actionability Working Group
MONDO:0009862	QDPR	HGNC:9752	https://search.clinicalgenome.org/kb/genes/HGNC:9752	dihydropteridine reductase deficiency	https://search.clinicalgenome.org/kb/conditions/MONDO:0009862	Autosomal recessive inheritance	30 - Gene Associated with Autosomal Recessive Phenotype (08/22/2016)		https://search.clinicalgenome.org/kb/gene-dosage/HGNC:9752	Dosage Working Group	definitive evidence (06/18/2018)	https://search.clinicalgenome.org/kb/gene-validity/CGGV:assertion_3cd45f13-9412-4439-9b68-cf2e3d02a646-2018-06-18T160000.000Z	Aminoacidopathy			
MONDO:0009863	PTS	HGNC:9689	https://search.clinicalgenome.org/kb/genes/HGNC:9689	BH4-deficient hyperphenylalaninemia A	https://search.clinicalgenome.org/kb/conditions/MONDO:0009863	Autosomal recessive inheritance	30 - Gene Associated with Autosomal Recessive Phenotype (08/22/2016)	0 - No Evidence for Haploinsufficiency (08/22/2016)	https://search.clinicalgenome.org/kb/gene-dosage/HGNC:9689	Dosage Working Group	definitive evidence (12/22/2017)	https://search.clinicalgenome.org/kb/gene-validity/CGGV:assertion_f3f9b683-bd6b-4566-9341-ddd7195b5108-2017-12-22T170000.000Z	Aminoacidopathy			
MONDO:0009868	PHKB	HGNC:8927	https://search.clinicalgenome.org/kb/genes/HGNC:8927	glycogen storage disease IXb	https://search.clinicalgenome.org/kb/conditions/MONDO:0009868		30 - Gene Associated with Autosomal Recessive Phenotype (08/22/2016)	0 - No Evidence for Haploinsufficiency (08/22/2016)	https://search.clinicalgenome.org/kb/gene-dosage/HGNC:8927	Dosage Working Group						
MONDO:0009869	SOX9	HGNC:11204	https://search.clinicalgenome.org/kb/genes/HGNC:11204	isolated Pierre-Robin syndrome	https://search.clinicalgenome.org/kb/conditions/MONDO:0009869	Autosomal dominant inheritance					limited evidence (09/16/2020)	https://search.clinicalgenome.org/kb/gene-validity/CGGV:assertion_951f7fcd-2b6a-46cd-be1d-7993ee5119c1-2020-09-16T170000.000Z	Skeletal Disorders			
MONDO:0009872	BCS1L	HGNC:1020	https://search.clinicalgenome.org/kb/genes/HGNC:1020	Bjornstad syndrome	https://search.clinicalgenome.org/kb/conditions/MONDO:0009872	Autosomal recessive inheritance	30 - Gene Associated with Autosomal Recessive Phenotype (08/22/2016)	0 - No Evidence for Haploinsufficiency (08/22/2016)	https://search.clinicalgenome.org/kb/gene-dosage/HGNC:1020	Dosage Working Group	definitive evidence (07/09/2018)	https://search.clinicalgenome.org/kb/gene-validity/CGGV:assertion_7a26b6b5-e703-43fc-bcd0-eaff67ef8107-2018-07-09T160000.000Z	Hearing Loss			
MONDO:0009875	CNGB3	HGNC:2153	https://search.clinicalgenome.org/kb/genes/HGNC:2153	achromatopsia 3	https://search.clinicalgenome.org/kb/conditions/MONDO:0009875	Autosomal recessive inheritance					definitive evidence (10/07/2021)	https://search.clinicalgenome.org/kb/gene-validity/CGGV:assertion_aa7bad05-3d4d-4a69-b4e9-82f9224a77f4-2021-10-07T160000.000Z	Retina			
MONDO:0009878	PROP1	HGNC:9455	https://search.clinicalgenome.org/kb/genes/HGNC:9455	pituitary hormone deficiency, combined, 2	https://search.clinicalgenome.org/kb/conditions/MONDO:0009878		30 - Gene Associated with Autosomal Recessive Phenotype (08/22/2016)	0 - No Evidence for Haploinsufficiency (08/22/2016)	https://search.clinicalgenome.org/kb/gene-dosage/HGNC:9455	Dosage Working Group						
MONDO:0009880	LHX4	HGNC:21734	https://search.clinicalgenome.org/kb/genes/HGNC:21734	short stature-pituitary and cerebellar defects-small sella turcica syndrome	https://search.clinicalgenome.org/kb/conditions/MONDO:0009880		1 - Little Evidence for Haploinsufficiency (07/06/2012)	0 - No Evidence for Haploinsufficiency (07/06/2012)	https://search.clinicalgenome.org/kb/gene-dosage/HGNC:21734	Dosage Working Group						
MONDO:0009883	SERPINF2	HGNC:9075	https://search.clinicalgenome.org/kb/genes/HGNC:9075	alpha-2-plasmin inhibitor deficiency	https://search.clinicalgenome.org/kb/conditions/MONDO:0009883	Autosomal recessive inheritance					definitive evidence (09/23/2020)	https://search.clinicalgenome.org/kb/gene-validity/CGGV:assertion_a8fa2353-ff89-41f1-b030-bde64517edbb-2020-09-23T160000.000Z	Hemostasis Thrombosis			
MONDO:0009885	ANO6	HGNC:25240	https://search.clinicalgenome.org/kb/genes/HGNC:25240	Scott syndrome	https://search.clinicalgenome.org/kb/conditions/MONDO:0009885	Autosomal recessive inheritance					moderate evidence (05/27/2020)	https://search.clinicalgenome.org/kb/gene-validity/CGGV:assertion_c2d3c125-1938-4295-82bb-b2851a3b2c8d-2020-05-27T160000.000Z	Hemostasis Thrombosis			
MONDO:0009894	NEK1	HGNC:7744	https://search.clinicalgenome.org/kb/genes/HGNC:7744	short-rib thoracic dysplasia 6 with or without polydactyly	https://search.clinicalgenome.org/kb/conditions/MONDO:0009894		30 - Gene Associated with Autosomal Recessive Phenotype (08/01/2013)	0 - No Evidence for Haploinsufficiency (08/01/2013)	https://search.clinicalgenome.org/kb/gene-dosage/HGNC:7744	Dosage Working Group						
MONDO:0009901	RIPK4	HGNC:496	https://search.clinicalgenome.org/kb/genes/HGNC:496	Bartsocas-Papas syndrome	https://search.clinicalgenome.org/kb/conditions/MONDO:0009901		30 - Gene Associated with Autosomal Recessive Phenotype (08/22/2016)	0 - No Evidence for Haploinsufficiency (08/22/2016)	https://search.clinicalgenome.org/kb/gene-dosage/HGNC:496	Dosage Working Group						
MONDO:0009902	UROS	HGNC:12592	https://search.clinicalgenome.org/kb/genes/HGNC:12592	cutaneous porphyria	https://search.clinicalgenome.org/kb/conditions/MONDO:0009902		30 - Gene Associated with Autosomal Recessive Phenotype (08/22/2016)		https://search.clinicalgenome.org/kb/gene-dosage/HGNC:12592	Dosage Working Group						
MONDO:0009903	DHODH	HGNC:2867	https://search.clinicalgenome.org/kb/genes/HGNC:2867	postaxial acrofacial dysostosis	https://search.clinicalgenome.org/kb/conditions/MONDO:0009903		30 - Gene Associated with Autosomal Recessive Phenotype (08/22/2016)	0 - No Evidence for Haploinsufficiency (08/22/2016)	https://search.clinicalgenome.org/kb/gene-dosage/HGNC:2867	Dosage Working Group						
MONDO:0009904	SLC12A3	HGNC:10912	https://search.clinicalgenome.org/kb/genes/HGNC:10912	Gitelman syndrome	https://search.clinicalgenome.org/kb/conditions/MONDO:0009904		30 - Gene Associated with Autosomal Recessive Phenotype (02/23/2012)	0 - No Evidence for Haploinsufficiency (02/23/2012)	https://search.clinicalgenome.org/kb/gene-dosage/HGNC:10912	Dosage Working Group						
MONDO:0009908	PCBD1	HGNC:8646	https://search.clinicalgenome.org/kb/genes/HGNC:8646	pterin-4 alpha-carbinolamine dehydratase 1 deficiency	https://search.clinicalgenome.org/kb/conditions/MONDO:0009908	Autosomal recessive inheritance					definitive evidence (07/27/2021)	https://search.clinicalgenome.org/kb/gene-validity/CGGV:assertion_d305c30f-50c1-491a-846f-4af6a2ad8aff-2021-07-27T160000.000Z	Aminoacidopathy			
MONDO:0009916	HSD17B3	HGNC:5212	https://search.clinicalgenome.org/kb/genes/HGNC:5212	46,XY disorder of sex development due to 17-beta-hydroxysteroid dehydrogenase 3 deficiency	https://search.clinicalgenome.org/kb/conditions/MONDO:0009916		30 - Gene Associated with Autosomal Recessive Phenotype (08/22/2016)		https://search.clinicalgenome.org/kb/gene-dosage/HGNC:5212	Dosage Working Group						
MONDO:0009917	SCNN1A	HGNC:10599	https://search.clinicalgenome.org/kb/genes/HGNC:10599	autosomal recessive pseudohypoaldosteronism type 1	https://search.clinicalgenome.org/kb/conditions/MONDO:0009917	Autosomal recessive inheritance					strong evidence (11/18/2021)	https://search.clinicalgenome.org/kb/gene-validity/CGGV:assertion_38f18fef-1443-4005-a358-31f7d3a96ee0-2021-11-18T013000.000Z	Tubulopathy			
MONDO:0009919	ACOX1	HGNC:119	https://search.clinicalgenome.org/kb/genes/HGNC:119	peroxisomal acyl-CoA oxidase deficiency	https://search.clinicalgenome.org/kb/conditions/MONDO:0009919	Autosomal recessive inheritance	30 - Gene Associated with Autosomal Recessive Phenotype (11/20/2014)	0 - No Evidence for Haploinsufficiency (11/20/2014)	https://search.clinicalgenome.org/kb/gene-dosage/HGNC:119	Dosage Working Group	definitive evidence (12/06/2019)	https://search.clinicalgenome.org/kb/gene-validity/CGGV:assertion_96026ae4-050d-4eb5-849c-178c703a556e-2019-12-06T170000.000Z	Peroxisomal Disorders			
MONDO:0009923	SRD5A2	HGNC:11285	https://search.clinicalgenome.org/kb/genes/HGNC:11285	46,XY disorder of sex development due to 5-alpha-reductase 2 deficiency	https://search.clinicalgenome.org/kb/conditions/MONDO:0009923		30 - Gene Associated with Autosomal Recessive Phenotype (08/22/2012)	0 - No Evidence for Haploinsufficiency (08/22/2012)	https://search.clinicalgenome.org/kb/gene-dosage/HGNC:11285	Dosage Working Group						
MONDO:0009927	COLEC11	HGNC:17213	https://search.clinicalgenome.org/kb/genes/HGNC:17213	3MC syndrome 2	https://search.clinicalgenome.org/kb/conditions/MONDO:0009927		30 - Gene Associated with Autosomal Recessive Phenotype (08/22/2016)	0 - No Evidence for Haploinsufficiency (08/22/2016)	https://search.clinicalgenome.org/kb/gene-dosage/HGNC:17213	Dosage Working Group						
MONDO:0009928	SLC34A2	HGNC:11020	https://search.clinicalgenome.org/kb/genes/HGNC:11020	pulmonary alveolar microlithiasis	https://search.clinicalgenome.org/kb/conditions/MONDO:0009928		30 - Gene Associated with Autosomal Recessive Phenotype (08/22/2016)	0 - No Evidence for Haploinsufficiency (08/22/2016)	https://search.clinicalgenome.org/kb/gene-dosage/HGNC:11020	Dosage Working Group						
MONDO:0009934	FOXF1	HGNC:3809	https://search.clinicalgenome.org/kb/genes/HGNC:3809	alveolar capillary dysplasia with misalignment of pulmonary veins	https://search.clinicalgenome.org/kb/conditions/MONDO:0009934		3 - Sufficient Evidence for Haploinsufficiency (06/20/2013)	0 - No Evidence for Haploinsufficiency (06/20/2013)	https://search.clinicalgenome.org/kb/gene-dosage/HGNC:3809	Dosage Working Group						
MONDO:0009945	ALDH7A1	HGNC:877	https://search.clinicalgenome.org/kb/genes/HGNC:877	pyridoxine-dependent epilepsy	https://search.clinicalgenome.org/kb/conditions/MONDO:0009945	Autosomal recessive inheritance					definitive evidence (07/26/2019)	https://search.clinicalgenome.org/kb/gene-validity/CGGV:assertion_7a982307-d8bd-43d1-b356-ef7ee6f32045-2019-07-26T160000.000Z	Aminoacidopathy			
MONDO:0009949	PC	HGNC:8636	https://search.clinicalgenome.org/kb/genes/HGNC:8636	pyruvate carboxylase deficiency disease	https://search.clinicalgenome.org/kb/conditions/MONDO:0009949		30 - Gene Associated with Autosomal Recessive Phenotype (08/22/2016)		https://search.clinicalgenome.org/kb/gene-dosage/HGNC:8636	Dosage Working Group						
MONDO:0009953	SLC35C1	HGNC:20197	https://search.clinicalgenome.org/kb/genes/HGNC:20197	leukocyte adhesion deficiency type II	https://search.clinicalgenome.org/kb/conditions/MONDO:0009953		30 - Gene Associated with Autosomal Recessive Phenotype (08/22/2016)	0 - No Evidence for Haploinsufficiency (08/22/2016)	https://search.clinicalgenome.org/kb/gene-dosage/HGNC:20197	Dosage Working Group						
MONDO:0009958	PHYH	HGNC:8940	https://search.clinicalgenome.org/kb/genes/HGNC:8940	adult Refsum disease	https://search.clinicalgenome.org/kb/conditions/MONDO:0009958		30 - Gene Associated with Autosomal Recessive Phenotype (08/22/2016)		https://search.clinicalgenome.org/kb/gene-dosage/HGNC:8940	Dosage Working Group				Moderate Actionability (11/02/2020) | Moderate Actionability (11/02/2020)	https://search.clinicalgenome.org/kb/gene-validity/https://actionability.clinicalgenome.org/ac/Adult/ui/stg2SummaryRpt?doc=AC1015 | https://search.clinicalgenome.org/kb/gene-validity/https://actionability.clinicalgenome.org/ac/Pediatric/ui/stg2SummaryRpt?doc=AC1015	Adult Actionability Working Group | Pediatric Actionability Working Group
MONDO:0009964	IFT140	HGNC:29077	https://search.clinicalgenome.org/kb/genes/HGNC:29077	short-rib thoracic dysplasia 9 with or without polydactyly	https://search.clinicalgenome.org/kb/conditions/MONDO:0009964		30 - Gene Associated with Autosomal Recessive Phenotype (08/22/2016)		https://search.clinicalgenome.org/kb/gene-dosage/HGNC:29077	Dosage Working Group						
MONDO:0009965	DIS3L2	HGNC:28648	https://search.clinicalgenome.org/kb/genes/HGNC:28648	Perlman syndrome	https://search.clinicalgenome.org/kb/conditions/MONDO:0009965	Autosomal recessive inheritance	1 - Little Evidence for Haploinsufficiency (10/14/2020)	0 - No Evidence for Haploinsufficiency (10/14/2020)	https://search.clinicalgenome.org/kb/gene-dosage/HGNC:28648	Dosage Working Group	definitive evidence (11/21/2019)	https://search.clinicalgenome.org/kb/gene-validity/CGGV:assertion_e68b93df-e0e7-4d46-8934-8b86064c0b37-2019-11-21T193052.781Z	Hereditary Cancer			
MONDO:0009968	ATP6V1B1	HGNC:853	https://search.clinicalgenome.org/kb/genes/HGNC:853	renal tubular acidosis, distal, 2, with progressive sensorineural hearing loss	https://search.clinicalgenome.org/kb/conditions/MONDO:0009968	Autosomal recessive inheritance					definitive evidence (12/19/2017)	https://search.clinicalgenome.org/kb/gene-validity/CGGV:assertion_c74d3789-9cfc-4be3-b23d-baf610620e6c-2017-12-19T050000.000Z	Hearing Loss			
MONDO:0009970	AGT	HGNC:333	https://search.clinicalgenome.org/kb/genes/HGNC:333	renal tubular dysgenesis of genetic origin	https://search.clinicalgenome.org/kb/conditions/MONDO:0009970		30 - Gene Associated with Autosomal Recessive Phenotype (11/13/2014)	0 - No Evidence for Haploinsufficiency (11/13/2014)	https://search.clinicalgenome.org/kb/gene-dosage/HGNC:333	Dosage Working Group						
MONDO:0009973	AK2	HGNC:362	https://search.clinicalgenome.org/kb/genes/HGNC:362	reticular dysgenesis	https://search.clinicalgenome.org/kb/conditions/MONDO:0009973	Autosomal recessive inheritance					definitive evidence (05/20/2021)	https://search.clinicalgenome.org/kb/gene-validity/CGGV:assertion_aba98528-8032-4dd4-bd1d-5381b102323c-2021-05-20T150257.066Z	SCID-CID			
MONDO:0009992	LPIN1	HGNC:13345	https://search.clinicalgenome.org/kb/genes/HGNC:13345	myoglobinuria, acute recurrent, autosomal recessive	https://search.clinicalgenome.org/kb/conditions/MONDO:0009992	Autosomal recessive inheritance					definitive evidence (09/25/2018)	https://search.clinicalgenome.org/kb/gene-validity/CGGV:assertion_642c8d4a-d498-4739-957d-a4e0d457362a-2018-09-25T160000.000Z	Fatty Acid Oxidation Disorders			
MONDO:0009998	EIF4A3	HGNC:18683	https://search.clinicalgenome.org/kb/genes/HGNC:18683	Richieri Costa-Pereira syndrome	https://search.clinicalgenome.org/kb/conditions/MONDO:0009998		30 - Gene Associated with Autosomal Recessive Phenotype (08/22/2016)	0 - No Evidence for Haploinsufficiency (08/22/2016)	https://search.clinicalgenome.org/kb/gene-dosage/HGNC:18683	Dosage Working Group						
MONDO:0010002	RECQL4	HGNC:9949	https://search.clinicalgenome.org/kb/genes/HGNC:9949	Rothmund-Thomson syndrome	https://search.clinicalgenome.org/kb/conditions/MONDO:0010002	Autosomal recessive inheritance					definitive evidence (10/11/2018)	https://search.clinicalgenome.org/kb/gene-validity/CGGV:assertion_dbf00cfa-ac36-4eb0-94c4-69b05014e0f6-2018-10-11T170000.000Z	Hereditary Cancer			
MONDO:0010006	HEXB	HGNC:4879	https://search.clinicalgenome.org/kb/genes/HGNC:4879	Sandhoff disease	https://search.clinicalgenome.org/kb/conditions/MONDO:0010006		30 - Gene Associated with Autosomal Recessive Phenotype (08/22/2016)		https://search.clinicalgenome.org/kb/gene-dosage/HGNC:4879	Dosage Working Group						
MONDO:0010008	SARDH	HGNC:10536	https://search.clinicalgenome.org/kb/genes/HGNC:10536	sarcosinemia	https://search.clinicalgenome.org/kb/conditions/MONDO:0010008	Autosomal recessive inheritance					limited evidence (06/28/2019)	https://search.clinicalgenome.org/kb/gene-validity/CGGV:assertion_2b994b6f-f296-45af-9d52-c1d0b211ef74-2019-06-28T160000.000Z	Aminoacidopathy			
MONDO:0010010	SETBP1	HGNC:15573	https://search.clinicalgenome.org/kb/genes/HGNC:15573	Schinzel-Giedion syndrome	https://search.clinicalgenome.org/kb/conditions/MONDO:0010010	Autosomal dominant inheritance	3 - Sufficient Evidence for Haploinsufficiency (05/23/2018)	0 - No Evidence for Haploinsufficiency (05/23/2018)	https://search.clinicalgenome.org/kb/gene-dosage/HGNC:15573	Dosage Working Group	definitive evidence (02/16/2021)	https://search.clinicalgenome.org/kb/gene-validity/CGGV:assertion_71885c03-b578-4baf-a17c-4817349eaf36-2021-02-16T170000.000Z	Intellectual Disability and Autism			
MONDO:0010011	EMX2	HGNC:3341	https://search.clinicalgenome.org/kb/genes/HGNC:3341	schizencephaly	https://search.clinicalgenome.org/kb/conditions/MONDO:0010011		1 - Little Evidence for Haploinsufficiency (11/09/2021)	0 - No Evidence for Haploinsufficiency (11/09/2021)	https://search.clinicalgenome.org/kb/gene-dosage/HGNC:3341	Dosage Working Group						
MONDO:0010013	SLC35D1	HGNC:20800	https://search.clinicalgenome.org/kb/genes/HGNC:20800	schneckenbecken dysplasia	https://search.clinicalgenome.org/kb/conditions/MONDO:0010013		30 - Gene Associated with Autosomal Recessive Phenotype (04/11/2016)	0 - No Evidence for Haploinsufficiency (04/11/2016)	https://search.clinicalgenome.org/kb/gene-dosage/HGNC:20800	Dosage Working Group						
MONDO:0010015	PXDN	HGNC:14966	https://search.clinicalgenome.org/kb/genes/HGNC:14966	anterior segment dysgenesis 7	https://search.clinicalgenome.org/kb/conditions/MONDO:0010015		30 - Gene Associated with Autosomal Recessive Phenotype (08/22/2016)	0 - No Evidence for Haploinsufficiency (08/22/2016)	https://search.clinicalgenome.org/kb/gene-dosage/HGNC:14966	Dosage Working Group						
MONDO:0010016	SOST	HGNC:13771	https://search.clinicalgenome.org/kb/genes/HGNC:13771	sclerosteosis 1	https://search.clinicalgenome.org/kb/conditions/MONDO:0010016		30 - Gene Associated with Autosomal Recessive Phenotype (08/22/2012)	0 - No Evidence for Haploinsufficiency (08/22/2012)	https://search.clinicalgenome.org/kb/gene-dosage/HGNC:13771	Dosage Working Group						
MONDO:0010023	ZAP70	HGNC:12858	https://search.clinicalgenome.org/kb/genes/HGNC:12858	combined immunodeficiency due to ZAP70 deficiency	https://search.clinicalgenome.org/kb/conditions/MONDO:0010023	Autosomal recessive inheritance					definitive evidence (02/08/2022)	https://search.clinicalgenome.org/kb/gene-validity/CGGV:assertion_486c47d2-e5a9-4527-a2cc-aaa43cd5c42f-2022-02-08T044813.125Z	SCID-CID			
MONDO:0010026	PIK3R1	HGNC:8979	https://search.clinicalgenome.org/kb/genes/HGNC:8979	SHORT syndrome	https://search.clinicalgenome.org/kb/conditions/MONDO:0010026	Autosomal dominant inheritance					definitive evidence (07/03/2018)	https://search.clinicalgenome.org/kb/gene-validity/CGGV:assertion_194f9130-2529-4016-a689-47ec259f941c-2018-07-03T165117.140Z	UNC Biocuration Core	Moderate Actionability (10/12/2020) | Moderate Actionability (10/12/2020)	https://search.clinicalgenome.org/kb/gene-validity/https://actionability.clinicalgenome.org/ac/Adult/ui/stg2SummaryRpt?doc=AC1020 | https://search.clinicalgenome.org/kb/gene-validity/https://actionability.clinicalgenome.org/ac/Pediatric/ui/stg2SummaryRpt?doc=AC1020	Adult Actionability Working Group | Pediatric Actionability Working Group
MONDO:0010031	ALDH3A2	HGNC:403	https://search.clinicalgenome.org/kb/genes/HGNC:403	Sjogren-Larsson syndrome	https://search.clinicalgenome.org/kb/conditions/MONDO:0010031		30 - Gene Associated with Autosomal Recessive Phenotype (08/22/2016)		https://search.clinicalgenome.org/kb/gene-dosage/HGNC:403	Dosage Working Group						
MONDO:0010035	DHCR7	HGNC:2860	https://search.clinicalgenome.org/kb/genes/HGNC:2860	Smith-Lemli-Opitz syndrome	https://search.clinicalgenome.org/kb/conditions/MONDO:0010035	Autosomal recessive inheritance	30 - Gene Associated with Autosomal Recessive Phenotype (04/04/2012)	0 - No Evidence for Haploinsufficiency (04/04/2012)	https://search.clinicalgenome.org/kb/gene-dosage/HGNC:2860	Dosage Working Group	definitive evidence (09/11/2018)	https://search.clinicalgenome.org/kb/gene-validity/CGGV:assertion_d5ed71c9-a76b-44c0-b5c0-44d604f2e0e9-2018-09-11T163302.452Z	Intellectual Disability and Autism	Has Insufficient Evidence for Actionability Based on Early Rule-out (12/03/2019) | Limited Actionability (06/03/2020)	https://search.clinicalgenome.org/kb/gene-validity/https://actionability.clinicalgenome.org/ac/Adult/ui/stg2SummaryRpt?doc=AC1011 | https://search.clinicalgenome.org/kb/gene-validity/https://actionability.clinicalgenome.org/ac/Pediatric/ui/stg2SummaryRpt?doc=AC1011	Adult Actionability Working Group | Pediatric Actionability Working Group
MONDO:0010038	IGF1R	HGNC:5465	https://search.clinicalgenome.org/kb/genes/HGNC:5465	growth delay due to insulin-like growth factor I resistance	https://search.clinicalgenome.org/kb/conditions/MONDO:0010038		3 - Sufficient Evidence for Haploinsufficiency (08/23/2012)	0 - No Evidence for Haploinsufficiency (08/23/2012)	https://search.clinicalgenome.org/kb/gene-dosage/HGNC:5465	Dosage Working Group						
MONDO:0010041	SACS	HGNC:10519	https://search.clinicalgenome.org/kb/genes/HGNC:10519	Charlevoix-Saguenay spastic ataxia	https://search.clinicalgenome.org/kb/conditions/MONDO:0010041		30 - Gene Associated with Autosomal Recessive Phenotype (08/22/2016)	0 - No Evidence for Haploinsufficiency (08/22/2016)	https://search.clinicalgenome.org/kb/gene-dosage/HGNC:10519	Dosage Working Group						
MONDO:0010044	ZFYVE26	HGNC:20761	https://search.clinicalgenome.org/kb/genes/HGNC:20761	hereditary spastic paraplegia 15	https://search.clinicalgenome.org/kb/conditions/MONDO:0010044		30 - Gene Associated with Autosomal Recessive Phenotype (08/22/2016)		https://search.clinicalgenome.org/kb/gene-dosage/HGNC:20761	Dosage Working Group						
MONDO:0010075	B3GALT6	HGNC:17978	https://search.clinicalgenome.org/kb/genes/HGNC:17978	spondyloepimetaphyseal dysplasia with joint laxity, type 1, with or without fractures	https://search.clinicalgenome.org/kb/conditions/MONDO:0010075		30 - Gene Associated with Autosomal Recessive Phenotype (08/22/2016)	0 - No Evidence for Haploinsufficiency (08/22/2016)	https://search.clinicalgenome.org/kb/gene-dosage/HGNC:17978	Dosage Working Group						
MONDO:0010078	COL2A1	HGNC:2200	https://search.clinicalgenome.org/kb/genes/HGNC:2200	spondyloperipheral dysplasia-short ulna syndrome	https://search.clinicalgenome.org/kb/conditions/MONDO:0010078	Autosomal dominant inheritance	3 - Sufficient Evidence for Haploinsufficiency (07/29/2020)	0 - No Evidence for Haploinsufficiency (07/29/2020)	https://search.clinicalgenome.org/kb/gene-dosage/HGNC:2200	Dosage Working Group	definitive evidence (01/06/2022)	https://search.clinicalgenome.org/kb/gene-validity/CGGV:assertion_d4da6e1f-5aad-4541-a3ae-76ed4782a023-2022-01-06T154807.494Z	Skeletal Disorders			
MONDO:0010079	ASPA	HGNC:756	https://search.clinicalgenome.org/kb/genes/HGNC:756	Canavan disease	https://search.clinicalgenome.org/kb/conditions/MONDO:0010079	Autosomal recessive inheritance	30 - Gene Associated with Autosomal Recessive Phenotype (08/22/2016)	0 - No Evidence for Haploinsufficiency (08/22/2016)	https://search.clinicalgenome.org/kb/gene-dosage/HGNC:756	Dosage Working Group	definitive evidence (10/08/2020)	https://search.clinicalgenome.org/kb/gene-validity/CGGV:assertion_66306eff-659f-4508-a41b-1820e47e0e1d-2020-10-08T161701.633Z	Aminoacidopathy			
MONDO:0010083	ALDH5A1	HGNC:408	https://search.clinicalgenome.org/kb/genes/HGNC:408	succinic semialdehyde dehydrogenase deficiency	https://search.clinicalgenome.org/kb/conditions/MONDO:0010083	Autosomal recessive inheritance	30 - Gene Associated with Autosomal Recessive Phenotype (08/22/2016)	0 - No Evidence for Haploinsufficiency (08/22/2016)	https://search.clinicalgenome.org/kb/gene-dosage/HGNC:408	Dosage Working Group	definitive evidence (04/27/2021)	https://search.clinicalgenome.org/kb/gene-validity/CGGV:assertion_c3e57466-df2f-4045-b374-010dbd334bfc-2021-04-27T160000.000Z	Intellectual Disability and Autism			
MONDO:0010088	SUMF1	HGNC:20376	https://search.clinicalgenome.org/kb/genes/HGNC:20376	mucosulfatidosis	https://search.clinicalgenome.org/kb/conditions/MONDO:0010088		30 - Gene Associated with Autosomal Recessive Phenotype (08/22/2016)	0 - No Evidence for Haploinsufficiency (08/22/2016)	https://search.clinicalgenome.org/kb/gene-dosage/HGNC:20376	Dosage Working Group						
MONDO:0010089	SUOX	HGNC:11460	https://search.clinicalgenome.org/kb/genes/HGNC:11460	isolated sulfite oxidase deficiency	https://search.clinicalgenome.org/kb/conditions/MONDO:0010089	Autosomal recessive inheritance					definitive evidence (03/22/2019)	https://search.clinicalgenome.org/kb/gene-validity/CGGV:assertion_be1ff294-4444-4d39-a507-a2115bcdcd58-2019-03-22T160000.000Z	Aminoacidopathy			
MONDO:0010100	HEXA	HGNC:4878	https://search.clinicalgenome.org/kb/genes/HGNC:4878	Tay-Sachs disease	https://search.clinicalgenome.org/kb/conditions/MONDO:0010100	Autosomal recessive inheritance					definitive evidence (05/27/2020)	https://search.clinicalgenome.org/kb/gene-validity/CGGV:assertion_1f7530b5-af31-40f9-ac18-a1b4d404285a-2020-05-27T160000.000Z	General Gene Curation			
MONDO:0010120	FYB1	HGNC:4036	https://search.clinicalgenome.org/kb/genes/HGNC:4036	thrombocytopenia 3	https://search.clinicalgenome.org/kb/conditions/MONDO:0010120	Autosomal recessive inheritance					moderate evidence (12/15/2021)	https://search.clinicalgenome.org/kb/gene-validity/CGGV:assertion_0e4e83fb-516b-43f8-a0af-687b9d938f74-2021-12-15T183305.227Z	Hemostasis Thrombosis			
MONDO:0010121	RBM8A	HGNC:9905	https://search.clinicalgenome.org/kb/genes/HGNC:9905	thrombocytopenia-absent radius syndrome	https://search.clinicalgenome.org/kb/conditions/MONDO:0010121	Autosomal recessive inheritance					definitive evidence (05/15/2020)	https://search.clinicalgenome.org/kb/gene-validity/CGGV:assertion_56c276a7-3068-48db-9baa-6f178eb9c3a7-2020-05-15T160000.000Z	Hemostasis Thrombosis			
MONDO:0010122	ADAMTS13	HGNC:1366	https://search.clinicalgenome.org/kb/genes/HGNC:1366	congenital thrombotic thrombocytopenic purpura	https://search.clinicalgenome.org/kb/conditions/MONDO:0010122	Autosomal recessive inheritance	30 - Gene Associated with Autosomal Recessive Phenotype (08/22/2016)		https://search.clinicalgenome.org/kb/gene-dosage/HGNC:1366	Dosage Working Group	definitive evidence (03/25/2020)	https://search.clinicalgenome.org/kb/gene-validity/CGGV:assertion_6442c328-21be-482d-9ea9-ce694c1a5dd9-2020-03-25T160000.000Z	Hemostasis Thrombosis			
MONDO:0010130	DPYD	HGNC:3012	https://search.clinicalgenome.org/kb/genes/HGNC:3012	dihydropyrimidine dehydrogenase deficiency	https://search.clinicalgenome.org/kb/conditions/MONDO:0010130		30 - Gene Associated with Autosomal Recessive Phenotype (01/24/2018)	0 - No Evidence for Haploinsufficiency (01/24/2018)	https://search.clinicalgenome.org/kb/gene-dosage/HGNC:3012	Dosage Working Group						
MONDO:0010133	TPO	HGNC:12015	https://search.clinicalgenome.org/kb/genes/HGNC:12015	thyroid dyshormonogenesis 2A	https://search.clinicalgenome.org/kb/conditions/MONDO:0010133		30 - Gene Associated with Autosomal Recessive Phenotype (08/22/2016)		https://search.clinicalgenome.org/kb/gene-dosage/HGNC:12015	Dosage Working Group						
MONDO:0010134	SLC26A4	HGNC:8818	https://search.clinicalgenome.org/kb/genes/HGNC:8818	Pendred syndrome	https://search.clinicalgenome.org/kb/conditions/MONDO:0010134	Autosomal recessive inheritance					definitive evidence (08/02/2018)	https://search.clinicalgenome.org/kb/gene-validity/CGGV:assertion_49e794f4-8725-4499-a0a2-82591b42cab5-2018-08-02T132641.899Z	Hearing Loss	Moderate Actionability (01/12/2021) | Has Insufficient Evidence for Actionability Based on Expert Review (01/12/2021)	https://search.clinicalgenome.org/kb/gene-validity/https://actionability.clinicalgenome.org/ac/Pediatric/ui/stg2SummaryRpt?doc=AC1019 | https://search.clinicalgenome.org/kb/gene-validity/https://actionability.clinicalgenome.org/ac/Adult/ui/stg2SummaryRpt?doc=AC1019	Pediatric Actionability Working Group | Adult Actionability Working Group
MONDO:0010136	IYD	HGNC:21071	https://search.clinicalgenome.org/kb/genes/HGNC:21071	thyroid dyshormonogenesis 4	https://search.clinicalgenome.org/kb/conditions/MONDO:0010136		30 - Gene Associated with Autosomal Recessive Phenotype (08/22/2016)	0 - No Evidence for Haploinsufficiency (08/22/2016)	https://search.clinicalgenome.org/kb/gene-dosage/HGNC:21071	Dosage Working Group						
MONDO:0010149	TCN2	HGNC:11653	https://search.clinicalgenome.org/kb/genes/HGNC:11653	transcobalamin II deficiency	https://search.clinicalgenome.org/kb/conditions/MONDO:0010149		30 - Gene Associated with Autosomal Recessive Phenotype (08/22/2016)		https://search.clinicalgenome.org/kb/gene-dosage/HGNC:11653	Dosage Working Group						
MONDO:0010159	MLH1	HGNC:7127	https://search.clinicalgenome.org/kb/genes/HGNC:7127	mismatch repair cancer syndrome 1	https://search.clinicalgenome.org/kb/conditions/MONDO:0010159	Autosomal recessive inheritance	3 - Sufficient Evidence for Haploinsufficiency (10/13/2021)	0 - No Evidence for Haploinsufficiency (10/13/2021)	https://search.clinicalgenome.org/kb/gene-dosage/HGNC:7127	Dosage Working Group	definitive evidence (10/09/2018)	https://search.clinicalgenome.org/kb/gene-validity/CGGV:assertion_a313ad2e-5c2a-4bb4-bed4-3b4f9b5095df-2018-10-09T150623.105Z	Hereditary Cancer			
MONDO:0010160	TAT	HGNC:11573	https://search.clinicalgenome.org/kb/genes/HGNC:11573	tyrosinemia type II	https://search.clinicalgenome.org/kb/conditions/MONDO:0010160	Autosomal recessive inheritance					definitive evidence (06/29/2020)	https://search.clinicalgenome.org/kb/gene-validity/CGGV:assertion_7a28aa11-78af-4c3b-900e-79c6a1e9339a-2020-06-29T174208.705Z	Aminoacidopathy			
MONDO:0010161	FAH	HGNC:3579	https://search.clinicalgenome.org/kb/genes/HGNC:3579	tyrosinemia type I	https://search.clinicalgenome.org/kb/conditions/MONDO:0010161	Autosomal recessive inheritance	30 - Gene Associated with Autosomal Recessive Phenotype (09/02/2020)	0 - No Evidence for Haploinsufficiency (09/02/2020)	https://search.clinicalgenome.org/kb/gene-dosage/HGNC:3579	Dosage Working Group	definitive evidence (06/29/2020)	https://search.clinicalgenome.org/kb/gene-validity/CGGV:assertion_39c50699-f422-4bae-89ac-af13ef7cb8cc-2020-06-29T174149.440Z	Aminoacidopathy			
MONDO:0010162	HPD	HGNC:5147	https://search.clinicalgenome.org/kb/genes/HGNC:5147	tyrosinemia type III	https://search.clinicalgenome.org/kb/conditions/MONDO:0010162	Autosomal recessive inheritance					definitive evidence (06/29/2020)	https://search.clinicalgenome.org/kb/gene-validity/CGGV:assertion_89eb4236-9243-490b-bc73-fb3b99675eb9-2020-06-29T173606.841Z	Aminoacidopathy			
MONDO:0010167	UROC1	HGNC:26444	https://search.clinicalgenome.org/kb/genes/HGNC:26444	urocanic aciduria	https://search.clinicalgenome.org/kb/conditions/MONDO:0010167	Autosomal recessive inheritance					limited evidence (11/13/2020)	https://search.clinicalgenome.org/kb/gene-validity/CGGV:assertion_af2ff293-39ce-46b7-af58-01e3685f4334-2020-11-13T170000.000Z	Aminoacidopathy			
MONDO:0010168	CDH23	HGNC:13733	https://search.clinicalgenome.org/kb/genes/HGNC:13733	Usher syndrome type 1	https://search.clinicalgenome.org/kb/conditions/MONDO:0010168	Autosomal recessive inheritance	30 - Gene Associated with Autosomal Recessive Phenotype (08/22/2016)		https://search.clinicalgenome.org/kb/gene-dosage/HGNC:13733	Dosage Working Group	definitive evidence (01/30/2017)	https://search.clinicalgenome.org/kb/gene-validity/CGGCIEX:assertion_5610	Hearing Loss			
MONDO:0010169	USH2A	HGNC:12601	https://search.clinicalgenome.org/kb/genes/HGNC:12601	Usher syndrome type 2A	https://search.clinicalgenome.org/kb/conditions/MONDO:0010169		30 - Gene Associated with Autosomal Recessive Phenotype (08/22/2016)		https://search.clinicalgenome.org/kb/gene-dosage/HGNC:12601	Dosage Working Group						
MONDO:0010170	CLRN1	HGNC:12605	https://search.clinicalgenome.org/kb/genes/HGNC:12605	Usher syndrome type 3A	https://search.clinicalgenome.org/kb/conditions/MONDO:0010170		30 - Gene Associated with Autosomal Recessive Phenotype (08/22/2016)	0 - No Evidence for Haploinsufficiency (08/22/2016)	https://search.clinicalgenome.org/kb/gene-dosage/HGNC:12605	Dosage Working Group						
MONDO:0010171	USH1C	HGNC:12597	https://search.clinicalgenome.org/kb/genes/HGNC:12597	Usher syndrome type 1C	https://search.clinicalgenome.org/kb/conditions/MONDO:0010171		30 - Gene Associated with Autosomal Recessive Phenotype (04/07/2012)	0 - No Evidence for Haploinsufficiency (04/07/2012)	https://search.clinicalgenome.org/kb/gene-dosage/HGNC:12597	Dosage Working Group						
MONDO:0010183	LMBRD1	HGNC:23038	https://search.clinicalgenome.org/kb/genes/HGNC:23038	methylmalonic aciduria and homocystinuria type cblF	https://search.clinicalgenome.org/kb/conditions/MONDO:0010183	Autosomal recessive inheritance					definitive evidence (03/26/2021)	https://search.clinicalgenome.org/kb/gene-validity/CGGV:assertion_14c077fe-c0ff-43d5-8436-041db18b20b1-2021-03-26T160000.000Z	Aminoacidopathy			
MONDO:0010184	MMACHC	HGNC:24525	https://search.clinicalgenome.org/kb/genes/HGNC:24525	methylmalonic aciduria and homocystinuria type cblC	https://search.clinicalgenome.org/kb/conditions/MONDO:0010184	Autosomal recessive inheritance	30 - Gene Associated with Autosomal Recessive Phenotype (08/22/2016)		https://search.clinicalgenome.org/kb/gene-dosage/HGNC:24525	Dosage Working Group	definitive evidence (06/29/2020)	https://search.clinicalgenome.org/kb/gene-validity/CGGV:assertion_6feb4bda-539f-4592-acaf-26dc186e953a-2020-06-29T174303.503Z	Aminoacidopathy			
MONDO:0010185	MMADHC	HGNC:25221	https://search.clinicalgenome.org/kb/genes/HGNC:25221	methylmalonic aciduria and homocystinuria type cblD	https://search.clinicalgenome.org/kb/conditions/MONDO:0010185		30 - Gene Associated with Autosomal Recessive Phenotype (07/21/2016)	0 - No Evidence for Haploinsufficiency (07/21/2016)	https://search.clinicalgenome.org/kb/gene-dosage/HGNC:25221	Dosage Working Group				Has Insufficient Evidence for Actionability Based on Early Rule-out (05/13/2014) | Assertion Pending (06/26/2019)	https://search.clinicalgenome.org/kb/gene-validity/https://actionability.clinicalgenome.org/ac/Adult/ui/stg2SummaryRpt?doc=AC122 | https://search.clinicalgenome.org/kb/gene-validity/https://actionability.clinicalgenome.org/ac/Pediatric/ui/stg2SummaryRpt?doc=AC122	Adult Actionability Working Group | Pediatric Actionability Working Group
MONDO:0010187	GGCX	HGNC:4247	https://search.clinicalgenome.org/kb/genes/HGNC:4247	vitamin K-dependent clotting factors, combined deficiency of, type 1	https://search.clinicalgenome.org/kb/conditions/MONDO:0010187	Autosomal recessive inheritance					definitive evidence (02/24/2021)	https://search.clinicalgenome.org/kb/gene-validity/CGGV:assertion_87ceae1d-b329-4c29-b6f2-8a94a127204e-2021-02-24T175200.635Z	Hemostasis Thrombosis			
MONDO:0010191	VWF	HGNC:12726	https://search.clinicalgenome.org/kb/genes/HGNC:12726	von Willebrand disease 3	https://search.clinicalgenome.org/kb/conditions/MONDO:0010191									Assertion Pending (07/10/2017)	https://search.clinicalgenome.org/kb/gene-validity/https://actionability.clinicalgenome.org/ac/Adult/ui/stg2SummaryRpt?doc=AC144	Adult Actionability Working Group
MONDO:0010192	EDNRB	HGNC:3180	https://search.clinicalgenome.org/kb/genes/HGNC:3180	Waardenburg syndrome type 4A	https://search.clinicalgenome.org/kb/conditions/MONDO:0010192	Autosomal dominant inheritance | Autosomal recessive inheritance	1 - Little Evidence for Haploinsufficiency (02/07/2022)	0 - No Evidence for Haploinsufficiency (02/07/2022)	https://search.clinicalgenome.org/kb/gene-dosage/HGNC:3180	Dosage Working Group	limited evidence (05/08/2018) | moderate evidence (05/08/2018)	https://search.clinicalgenome.org/kb/gene-validity/CGGV:assertion_73ee9727-60c1-40fd-830f-08c2b513d2ee-2018-05-08T160000.000Z | https://search.clinicalgenome.org/kb/gene-validity/CGGV:assertion_d7abbd45-7915-437b-849b-dea876bfc2f5-2018-05-08T160000.000Z	Hearing Loss | Hearing Loss			
MONDO:0010196	WRN	HGNC:12791	https://search.clinicalgenome.org/kb/genes/HGNC:12791	Werner syndrome	https://search.clinicalgenome.org/kb/conditions/MONDO:0010196	Autosomal recessive inheritance	30 - Gene Associated with Autosomal Recessive Phenotype (03/25/2015)	0 - No Evidence for Haploinsufficiency (03/25/2015)	https://search.clinicalgenome.org/kb/gene-dosage/HGNC:12791	Dosage Working Group	definitive evidence (10/09/2018)	https://search.clinicalgenome.org/kb/gene-validity/CGGV:assertion_d9c04f29-bc94-40c5-95d7-d25d21cd387f-2018-10-09T170000.000Z	Hereditary Cancer			
MONDO:0010200	ATP7B	HGNC:870	https://search.clinicalgenome.org/kb/genes/HGNC:870	Wilson disease	https://search.clinicalgenome.org/kb/conditions/MONDO:0010200	Autosomal recessive inheritance	30 - Gene Associated with Autosomal Recessive Phenotype (01/12/2017)	0 - No Evidence for Haploinsufficiency (01/12/2017)	https://search.clinicalgenome.org/kb/gene-dosage/HGNC:870	Dosage Working Group	definitive evidence (03/27/2019)	https://search.clinicalgenome.org/kb/gene-validity/CGGV:assertion_f0ac0a41-d7d5-4377-a622-1ee9bc4ed9f3-2019-03-27T160000.000Z	General Gene Curation	Assertion Pending (09/14/2015)	https://search.clinicalgenome.org/kb/gene-validity/https://actionability.clinicalgenome.org/ac/Adult/ui/stg2SummaryRpt?doc=AC028	Adult Actionability Working Group
MONDO:0010204	LIPA	HGNC:6617	https://search.clinicalgenome.org/kb/genes/HGNC:6617	lysosomal acid lipase deficiency	https://search.clinicalgenome.org/kb/conditions/MONDO:0010204		30 - Gene Associated with Autosomal Recessive Phenotype (08/22/2016)		https://search.clinicalgenome.org/kb/gene-dosage/HGNC:6617	Dosage Working Group						
MONDO:0010206	LPAR6	HGNC:15520	https://search.clinicalgenome.org/kb/genes/HGNC:15520	hypotrichosis 8	https://search.clinicalgenome.org/kb/conditions/MONDO:0010206		30 - Gene Associated with Autosomal Recessive Phenotype (08/22/2016)		https://search.clinicalgenome.org/kb/gene-dosage/HGNC:15520	Dosage Working Group						
MONDO:0010209	XDH	HGNC:12805	https://search.clinicalgenome.org/kb/genes/HGNC:12805	xanthinuria type I	https://search.clinicalgenome.org/kb/conditions/MONDO:0010209		30 - Gene Associated with Autosomal Recessive Phenotype (08/22/2016)	0 - No Evidence for Haploinsufficiency (08/22/2016)	https://search.clinicalgenome.org/kb/gene-dosage/HGNC:12805	Dosage Working Group						
MONDO:0010210	XPA	HGNC:12814	https://search.clinicalgenome.org/kb/genes/HGNC:12814	xeroderma pigmentosum group A	https://search.clinicalgenome.org/kb/conditions/MONDO:0010210	Autosomal recessive inheritance	30 - Gene Associated with Autosomal Recessive Phenotype (08/22/2016)	0 - No Evidence for Haploinsufficiency (08/22/2016)	https://search.clinicalgenome.org/kb/gene-dosage/HGNC:12814	Dosage Working Group	definitive evidence (11/02/2018)	https://search.clinicalgenome.org/kb/gene-validity/CGGV:assertion_5cd298eb-1e1a-4283-851e-2dd24059ba22-2018-11-02T213651.734Z	Hereditary Cancer			
MONDO:0010211	XPC	HGNC:12816	https://search.clinicalgenome.org/kb/genes/HGNC:12816	xeroderma pigmentosum group C	https://search.clinicalgenome.org/kb/conditions/MONDO:0010211	Autosomal recessive inheritance	30 - Gene Associated with Autosomal Recessive Phenotype (08/22/2016)		https://search.clinicalgenome.org/kb/gene-dosage/HGNC:12816	Dosage Working Group	definitive evidence (11/02/2018)	https://search.clinicalgenome.org/kb/gene-validity/CGGV:assertion_8352d38c-7fb3-4a82-8f8b-7cd08fded1f4-2018-11-02T214221.860Z	Hereditary Cancer			
MONDO:0010212	ERCC2	HGNC:3434	https://search.clinicalgenome.org/kb/genes/HGNC:3434	xeroderma pigmentosum group D	https://search.clinicalgenome.org/kb/conditions/MONDO:0010212	Autosomal recessive inheritance	30 - Gene Associated with Autosomal Recessive Phenotype (08/22/2016)		https://search.clinicalgenome.org/kb/gene-dosage/HGNC:3434	Dosage Working Group	definitive evidence (11/02/2018)	https://search.clinicalgenome.org/kb/gene-validity/CGGV:assertion_91d0c244-d958-4358-8b92-cefefbce3843-2018-11-02T214605.275Z	Hereditary Cancer			
MONDO:0010213	DDB2	HGNC:2718	https://search.clinicalgenome.org/kb/genes/HGNC:2718	xeroderma pigmentosum group E	https://search.clinicalgenome.org/kb/conditions/MONDO:0010213	Autosomal recessive inheritance	30 - Gene Associated with Autosomal Recessive Phenotype (08/22/2016)		https://search.clinicalgenome.org/kb/gene-dosage/HGNC:2718	Dosage Working Group	definitive evidence (11/02/2018)	https://search.clinicalgenome.org/kb/gene-validity/CGGV:assertion_cf2a4254-51ec-467a-9194-3962d39a6b20-2018-11-02T214938.544Z	Hereditary Cancer			
MONDO:0010214	POLH	HGNC:9181	https://search.clinicalgenome.org/kb/genes/HGNC:9181	xeroderma pigmentosum variant type	https://search.clinicalgenome.org/kb/conditions/MONDO:0010214	Autosomal recessive inheritance	30 - Gene Associated with Autosomal Recessive Phenotype (08/22/2016)	0 - No Evidence for Haploinsufficiency (08/22/2016)	https://search.clinicalgenome.org/kb/gene-dosage/HGNC:9181	Dosage Working Group	definitive evidence (11/02/2018)	https://search.clinicalgenome.org/kb/gene-validity/CGGV:assertion_bdb29404-0c05-4519-b6ee-8591368ad1ff-2018-11-02T215846.146Z	Hereditary Cancer			
MONDO:0010215	ERCC4	HGNC:3436	https://search.clinicalgenome.org/kb/genes/HGNC:3436	xeroderma pigmentosum group F	https://search.clinicalgenome.org/kb/conditions/MONDO:0010215	Autosomal recessive inheritance					definitive evidence (08/14/2019)	https://search.clinicalgenome.org/kb/gene-validity/CGGV:assertion_89544dc5-2d3b-4b7f-b835-3fec714bf7a5-2019-08-14T194406.189Z	Hereditary Cancer			
MONDO:0010216	ERCC5	HGNC:3437	https://search.clinicalgenome.org/kb/genes/HGNC:3437	xeroderma pigmentosum group G	https://search.clinicalgenome.org/kb/conditions/MONDO:0010216	Autosomal recessive inheritance	30 - Gene Associated with Autosomal Recessive Phenotype (08/22/2016)		https://search.clinicalgenome.org/kb/gene-dosage/HGNC:3437	Dosage Working Group	definitive evidence (11/02/2018)	https://search.clinicalgenome.org/kb/gene-validity/CGGV:assertion_fc08c954-8ded-449b-8f67-e4f044b26cda-2018-11-02T215619.763Z	Hereditary Cancer			
MONDO:0010222	MID1	HGNC:7095	https://search.clinicalgenome.org/kb/genes/HGNC:7095	X-linked Opitz G/BBB syndrome	https://search.clinicalgenome.org/kb/conditions/MONDO:0010222	X-linked inheritance	3 - Sufficient Evidence for Haploinsufficiency (08/23/2021)	0 - No Evidence for Haploinsufficiency (08/23/2021)	https://search.clinicalgenome.org/kb/gene-dosage/HGNC:7095	Dosage Working Group	definitive evidence (03/21/2018)	https://search.clinicalgenome.org/kb/gene-validity/CGGV:assertion_b2471967-d6b3-4ffb-a9fd-e3dbd089cb20-2018-03-21T160000.000Z	Intellectual Disability and Autism			
MONDO:0010225	CLCN5	HGNC:2023	https://search.clinicalgenome.org/kb/genes/HGNC:2023	Dent disease type 1	https://search.clinicalgenome.org/kb/conditions/MONDO:0010225		3 - Sufficient Evidence for Haploinsufficiency (10/18/2012)	0 - No Evidence for Haploinsufficiency (10/18/2012)	https://search.clinicalgenome.org/kb/gene-dosage/HGNC:2023	Dosage Working Group						
MONDO:0010233	FLNA	HGNC:3754	https://search.clinicalgenome.org/kb/genes/HGNC:3754	heterotopia, periventricular, X-linked dominant	https://search.clinicalgenome.org/kb/conditions/MONDO:0010233		3 - Sufficient Evidence for Haploinsufficiency (12/02/2020)	0 - No Evidence for Haploinsufficiency (12/02/2020)	https://search.clinicalgenome.org/kb/gene-dosage/HGNC:3754	Dosage Working Group						
MONDO:0010239	DCX	HGNC:2714	https://search.clinicalgenome.org/kb/genes/HGNC:2714	lissencephaly type 1 due to doublecortin gene mutation	https://search.clinicalgenome.org/kb/conditions/MONDO:0010239		3 - Sufficient Evidence for Haploinsufficiency (07/06/2012)	0 - No Evidence for Haploinsufficiency (07/06/2012)	https://search.clinicalgenome.org/kb/gene-dosage/HGNC:2714	Dosage Working Group						
MONDO:0010246	PCDH19	HGNC:14270	https://search.clinicalgenome.org/kb/genes/HGNC:14270	developmental and epileptic encephalopathy, 9	https://search.clinicalgenome.org/kb/conditions/MONDO:0010246		3 - Sufficient Evidence for Haploinsufficiency (06/06/2013)	0 - No Evidence for Haploinsufficiency (06/06/2013)	https://search.clinicalgenome.org/kb/gene-dosage/HGNC:14270	Dosage Working Group						
MONDO:0010247	ABCD1	HGNC:61	https://search.clinicalgenome.org/kb/genes/HGNC:61	X-linked cerebral adrenoleukodystrophy	https://search.clinicalgenome.org/kb/conditions/MONDO:0010247		3 - Sufficient Evidence for Haploinsufficiency (12/02/2020)	0 - No Evidence for Haploinsufficiency (12/02/2020)	https://search.clinicalgenome.org/kb/gene-dosage/HGNC:61	Dosage Working Group				Assertion Pending (11/16/2016)	https://search.clinicalgenome.org/kb/gene-validity/https://actionability.clinicalgenome.org/ac/Adult/ui/stg2SummaryRpt?doc=AC117	Adult Actionability Working Group
MONDO:0010250	CLCN4	HGNC:2022	https://search.clinicalgenome.org/kb/genes/HGNC:2022	intellectual disability, X-linked 49	https://search.clinicalgenome.org/kb/conditions/MONDO:0010250		2 - Emerging Evidence for Haploinsufficiency (09/26/2018)	0 - No Evidence for Haploinsufficiency (09/26/2018)	https://search.clinicalgenome.org/kb/gene-dosage/HGNC:2022	Dosage Working Group						
MONDO:0010256	IL1RAPL1	HGNC:5996	https://search.clinicalgenome.org/kb/genes/HGNC:5996	intellectual disability, X-linked 21	https://search.clinicalgenome.org/kb/conditions/MONDO:0010256		3 - Sufficient Evidence for Haploinsufficiency (08/23/2012)	0 - No Evidence for Haploinsufficiency (08/23/2012)	https://search.clinicalgenome.org/kb/gene-dosage/HGNC:5996	Dosage Working Group						
MONDO:0010261	BCOR	HGNC:20893	https://search.clinicalgenome.org/kb/genes/HGNC:20893	microphthalmia, syndromic 2	https://search.clinicalgenome.org/kb/conditions/MONDO:0010261	X-linked inheritance	3 - Sufficient Evidence for Haploinsufficiency (10/04/2012)	0 - No Evidence for Haploinsufficiency (10/04/2012)	https://search.clinicalgenome.org/kb/gene-dosage/HGNC:20893	Dosage Working Group	definitive evidence (12/17/2020)	https://search.clinicalgenome.org/kb/gene-validity/CGGV:assertion_3da06b77-1ed0-4197-948c-a9bbf80b6ed4-2020-12-17T171347.861Z	Syndromic Disorders			
MONDO:0010264	NR0B1	HGNC:7960	https://search.clinicalgenome.org/kb/genes/HGNC:7960	X-linked adrenal hypoplasia congenita	https://search.clinicalgenome.org/kb/conditions/MONDO:0010264		3 - Sufficient Evidence for Haploinsufficiency (05/06/2020)	0 - No Evidence for Haploinsufficiency (05/06/2020)	https://search.clinicalgenome.org/kb/gene-dosage/HGNC:7960	Dosage Working Group						
MONDO:0010266	TSPAN7	HGNC:11854	https://search.clinicalgenome.org/kb/genes/HGNC:11854	intellectual disability, X-linked 58	https://search.clinicalgenome.org/kb/conditions/MONDO:0010266		2 - Emerging Evidence for Haploinsufficiency (08/22/2018)	0 - No Evidence for Haploinsufficiency (08/22/2018)	https://search.clinicalgenome.org/kb/gene-dosage/HGNC:11854	Dosage Working Group						
MONDO:0010268	ARX	HGNC:18060	https://search.clinicalgenome.org/kb/genes/HGNC:18060	X-linked lissencephaly with abnormal genitalia	https://search.clinicalgenome.org/kb/conditions/MONDO:0010268		3 - Sufficient Evidence for Haploinsufficiency (12/05/2019)	0 - No Evidence for Haploinsufficiency (12/05/2019)	https://search.clinicalgenome.org/kb/gene-dosage/HGNC:18060	Dosage Working Group						
MONDO:0010278	SLC9A6	HGNC:11079	https://search.clinicalgenome.org/kb/genes/HGNC:11079	Christianson syndrome	https://search.clinicalgenome.org/kb/conditions/MONDO:0010278	X-linked inheritance	3 - Sufficient Evidence for Haploinsufficiency (12/08/2020)	0 - No Evidence for Haploinsufficiency (12/08/2020)	https://search.clinicalgenome.org/kb/gene-dosage/HGNC:11079	Dosage Working Group	definitive evidence (05/02/2018)	https://search.clinicalgenome.org/kb/gene-validity/CGGV:assertion_1d97fc8d-e744-449a-939c-386895c121cd-2018-05-02T130416.790Z	Rett and Angelman-like Disorders			
MONDO:0010281	LAMP2	HGNC:6501	https://search.clinicalgenome.org/kb/genes/HGNC:6501	Danon disease	https://search.clinicalgenome.org/kb/conditions/MONDO:0010281	X-linked inheritance	3 - Sufficient Evidence for Haploinsufficiency (02/09/2021)	0 - No Evidence for Haploinsufficiency (02/09/2021)	https://search.clinicalgenome.org/kb/gene-dosage/HGNC:6501	Dosage Working Group	definitive evidence (10/11/2017)	https://search.clinicalgenome.org/kb/gene-validity/CGGV:assertion_1f0d4050-f510-438d-a477-0a12669945d8-2017-10-11T040000.000Z	Hypertrophic Cardiomyopathy			
MONDO:0010283	MECP2	HGNC:6990	https://search.clinicalgenome.org/kb/genes/HGNC:6990	syndromic X-linked intellectual disability Lubs type	https://search.clinicalgenome.org/kb/conditions/MONDO:0010283		3 - Sufficient Evidence for Haploinsufficiency (02/22/2021)	0 - No Evidence for Haploinsufficiency (02/22/2021)	https://search.clinicalgenome.org/kb/gene-dosage/HGNC:6990	Dosage Working Group						
MONDO:0010286	PHF8	HGNC:20672	https://search.clinicalgenome.org/kb/genes/HGNC:20672	syndromic X-linked intellectual disability Siderius type	https://search.clinicalgenome.org/kb/conditions/MONDO:0010286	X-linked inheritance	3 - Sufficient Evidence for Haploinsufficiency (08/26/2020)	0 - No Evidence for Haploinsufficiency (08/26/2020)	https://search.clinicalgenome.org/kb/gene-dosage/HGNC:20672	Dosage Working Group	definitive evidence (11/07/2018)	https://search.clinicalgenome.org/kb/gene-validity/CGGV:assertion_b9e94640-1950-4438-bcda-4859545d83d1-2018-11-07T170000.000Z	Intellectual Disability and Autism			
MONDO:0010289	RAB39B	HGNC:16499	https://search.clinicalgenome.org/kb/genes/HGNC:16499	intellectual disability, X-linked 72	https://search.clinicalgenome.org/kb/conditions/MONDO:0010289		3 - Sufficient Evidence for Haploinsufficiency (05/29/2020)	0 - No Evidence for Haploinsufficiency (05/29/2020)	https://search.clinicalgenome.org/kb/gene-dosage/HGNC:16499	Dosage Working Group						
MONDO:0010294	WAS	HGNC:12731	https://search.clinicalgenome.org/kb/genes/HGNC:12731	X-linked severe congenital neutropenia	https://search.clinicalgenome.org/kb/conditions/MONDO:0010294	X-linked inheritance					definitive evidence (11/18/2021)	https://search.clinicalgenome.org/kb/gene-validity/CGGV:assertion_49c66050-ab36-4359-8d78-b7ba5bef80d2-2021-11-18T171012.085Z	SCID-CID	Moderate Actionability (11/16/2018)	https://search.clinicalgenome.org/kb/gene-validity/https://actionability.clinicalgenome.org/ac/Pediatric/ui/stg2SummaryRpt?doc=AC011	Pediatric Actionability Working Group
MONDO:0010296	SH3KBP1	HGNC:13867	https://search.clinicalgenome.org/kb/genes/HGNC:13867	immunodeficiency 61	https://search.clinicalgenome.org/kb/conditions/MONDO:0010296	X-linked inheritance					limited evidence (11/16/2021)	https://search.clinicalgenome.org/kb/gene-validity/CGGV:assertion_3cc42cdd-5484-467b-9e35-7529716114dd-2021-11-16T170000.000Z	Antibody Deficiencies GCEP			
MONDO:0010298	HPRT1	HGNC:5157	https://search.clinicalgenome.org/kb/genes/HGNC:5157	Lesch-Nyhan syndrome	https://search.clinicalgenome.org/kb/conditions/MONDO:0010298	X-linked inheritance	3 - Sufficient Evidence for Haploinsufficiency (01/13/2021)	0 - No Evidence for Haploinsufficiency (01/13/2021)	https://search.clinicalgenome.org/kb/gene-dosage/HGNC:5157	Dosage Working Group	definitive evidence (03/07/2018)	https://search.clinicalgenome.org/kb/gene-validity/CGGCIEX:assertion_9597	Intellectual Disability and Autism			
MONDO:0010305	SLC6A8	HGNC:11055	https://search.clinicalgenome.org/kb/genes/HGNC:11055	creatine transporter deficiency	https://search.clinicalgenome.org/kb/conditions/MONDO:0010305	X-linked inheritance	3 - Sufficient Evidence for Haploinsufficiency (11/10/2020)	0 - No Evidence for Haploinsufficiency (11/10/2020)	https://search.clinicalgenome.org/kb/gene-dosage/HGNC:11055	Dosage Working Group	definitive evidence (02/10/2020)	https://search.clinicalgenome.org/kb/gene-validity/CGGV:assertion_3795f0ae-7668-47b8-b69e-9c686b82bd0a-2020-02-10T170000.000Z	Aminoacidopathy			
MONDO:0010306	CUL4B	HGNC:2555	https://search.clinicalgenome.org/kb/genes/HGNC:2555	X-linked intellectual disability, Cabezas type	https://search.clinicalgenome.org/kb/conditions/MONDO:0010306	X-linked inheritance	3 - Sufficient Evidence for Haploinsufficiency (02/09/2021)	0 - No Evidence for Haploinsufficiency (02/09/2021)	https://search.clinicalgenome.org/kb/gene-dosage/HGNC:2555	Dosage Working Group	definitive evidence (02/21/2018)	https://search.clinicalgenome.org/kb/gene-validity/CGGV:assertion_cc93f3b2-3124-40f8-a86e-c929b09c6f68-2018-02-21T050000.000Z	Intellectual Disability and Autism			
MONDO:0010313	ACSL4	HGNC:3571	https://search.clinicalgenome.org/kb/genes/HGNC:3571	intellectual disability, X-linked 63	https://search.clinicalgenome.org/kb/conditions/MONDO:0010313		1 - Little Evidence for Haploinsufficiency (04/28/2021)	0 - No Evidence for Haploinsufficiency (04/28/2021)	https://search.clinicalgenome.org/kb/gene-dosage/HGNC:3571	Dosage Working Group						
MONDO:0010315	IL2RG	HGNC:6010	https://search.clinicalgenome.org/kb/genes/HGNC:6010	T-B+ severe combined immunodeficiency due to gamma chain deficiency	https://search.clinicalgenome.org/kb/conditions/MONDO:0010315	X-linked inheritance					definitive evidence (04/22/2021)	https://search.clinicalgenome.org/kb/gene-validity/CGGV:assertion_e4a8be06-e082-47c7-b005-956b51424fd2-2021-04-22T191103.318Z	SCID-CID			
MONDO:0010327	HSD17B10	HGNC:4800	https://search.clinicalgenome.org/kb/genes/HGNC:4800	HSD10 mitochondrial disease	https://search.clinicalgenome.org/kb/conditions/MONDO:0010327	X-linked inheritance	0 - No Evidence for Haploinsufficiency (09/06/2012)	0 - No Evidence for Haploinsufficiency (09/06/2012)	https://search.clinicalgenome.org/kb/gene-dosage/HGNC:4800	Dosage Working Group	definitive evidence (10/09/2018)	https://search.clinicalgenome.org/kb/gene-validity/CGGV:assertion_9232b352-a845-4404-8a98-34cb6ad6ff0e-2018-10-09T160000.000Z	Fatty Acid Oxidation Disorders			
MONDO:0010333	IGBP1	HGNC:5461	https://search.clinicalgenome.org/kb/genes/HGNC:5461	corpus callosum agenesis-intellectual disability-coloboma-micrognathia syndrome	https://search.clinicalgenome.org/kb/conditions/MONDO:0010333	X-linked inheritance					disputing (02/02/2021)	https://search.clinicalgenome.org/kb/gene-validity/CGGV:assertion_dbeb1651-add0-4a44-87ad-a56c7864f076-2021-02-02T170000.000Z	Intellectual Disability and Autism			
MONDO:0010337	OPHN1	HGNC:8148	https://search.clinicalgenome.org/kb/genes/HGNC:8148	X-linked intellectual disability-cerebellar hypoplasia syndrome	https://search.clinicalgenome.org/kb/conditions/MONDO:0010337		3 - Sufficient Evidence for Haploinsufficiency (07/27/2012)	0 - No Evidence for Haploinsufficiency (07/27/2012)	https://search.clinicalgenome.org/kb/gene-dosage/HGNC:8148	Dosage Working Group						
MONDO:0010339	SYN1	HGNC:11494	https://search.clinicalgenome.org/kb/genes/HGNC:11494	X-linked epilepsy-learning disabilities-behavior disorders syndrome	https://search.clinicalgenome.org/kb/conditions/MONDO:0010339		2 - Emerging Evidence for Haploinsufficiency (09/26/2018)	0 - No Evidence for Haploinsufficiency (09/26/2018)	https://search.clinicalgenome.org/kb/gene-dosage/HGNC:11494	Dosage Working Group						
MONDO:0010351	FANCB	HGNC:3583	https://search.clinicalgenome.org/kb/genes/HGNC:3583	Fanconi anemia complementation group B	https://search.clinicalgenome.org/kb/conditions/MONDO:0010351		3 - Sufficient Evidence for Haploinsufficiency (06/23/2021)	0 - No Evidence for Haploinsufficiency (06/23/2021)	https://search.clinicalgenome.org/kb/gene-dosage/HGNC:3583	Dosage Working Group						
MONDO:0010354	SLC16A2	HGNC:10923	https://search.clinicalgenome.org/kb/genes/HGNC:10923	Allan-Herndon-Dudley syndrome	https://search.clinicalgenome.org/kb/conditions/MONDO:0010354	X-linked inheritance	3 - Sufficient Evidence for Haploinsufficiency (06/28/2012)	0 - No Evidence for Haploinsufficiency (06/28/2012)	https://search.clinicalgenome.org/kb/gene-dosage/HGNC:10923	Dosage Working Group	definitive evidence (08/09/2018)	https://search.clinicalgenome.org/kb/gene-validity/CGGV:assertion_b9242e32-a339-4426-8ef5-39df0960d390-2018-08-09T140238.174Z	Intellectual Disability and Autism			
MONDO:0010355	KDM5C	HGNC:11114	https://search.clinicalgenome.org/kb/genes/HGNC:11114	syndromic X-linked intellectual disability Claes-Jensen type	https://search.clinicalgenome.org/kb/conditions/MONDO:0010355		3 - Sufficient Evidence for Haploinsufficiency (08/23/2012)	0 - No Evidence for Haploinsufficiency (08/23/2012)	https://search.clinicalgenome.org/kb/gene-dosage/HGNC:11114	Dosage Working Group						
MONDO:0010361	PAK3	HGNC:8592	https://search.clinicalgenome.org/kb/genes/HGNC:8592	intellectual disability, X-linked 30	https://search.clinicalgenome.org/kb/conditions/MONDO:0010361		2 - Emerging Evidence for Haploinsufficiency (12/09/2019)	0 - No Evidence for Haploinsufficiency (12/09/2019)	https://search.clinicalgenome.org/kb/gene-dosage/HGNC:8592	Dosage Working Group						
MONDO:0010370	SMC1A	HGNC:11111	https://search.clinicalgenome.org/kb/genes/HGNC:11111	Cornelia de Lange syndrome 2	https://search.clinicalgenome.org/kb/conditions/MONDO:0010370		3 - Sufficient Evidence for Haploinsufficiency (07/23/2018)	0 - No Evidence for Haploinsufficiency (07/23/2018)	https://search.clinicalgenome.org/kb/gene-dosage/HGNC:11111	Dosage Working Group						
MONDO:0010378	AIFM1	HGNC:8768	https://search.clinicalgenome.org/kb/genes/HGNC:8768	X-linked hereditary sensory and autonomic neuropathy with hearing loss	https://search.clinicalgenome.org/kb/conditions/MONDO:0010378	X-linked inheritance					definitive evidence (07/09/2018)	https://search.clinicalgenome.org/kb/gene-validity/CGGV:assertion_a7afc3bb-7fce-45fd-a275-87277e22b1eb-2018-07-09T160000.000Z	Hearing Loss			
MONDO:0010379	MAOA	HGNC:6833	https://search.clinicalgenome.org/kb/genes/HGNC:6833	Brunner syndrome	https://search.clinicalgenome.org/kb/conditions/MONDO:0010379	X-linked inheritance	1 - Little Evidence for Haploinsufficiency (09/26/2012)	0 - No Evidence for Haploinsufficiency (09/26/2012)	https://search.clinicalgenome.org/kb/gene-dosage/HGNC:6833	Dosage Working Group	definitive evidence (04/14/2020)	https://search.clinicalgenome.org/kb/gene-validity/CGGV:assertion_20ffc014-ef31-4693-91c4-424bbe1e48dd-2020-04-14T203950.820Z	Intellectual Disability and Autism			
MONDO:0010383	FMR1	HGNC:3775	https://search.clinicalgenome.org/kb/genes/HGNC:3775	fragile X syndrome	https://search.clinicalgenome.org/kb/conditions/MONDO:0010383	X-linked inheritance	3 - Sufficient Evidence for Haploinsufficiency (12/16/2020)	0 - No Evidence for Haploinsufficiency (12/16/2020)	https://search.clinicalgenome.org/kb/gene-dosage/HGNC:3775	Dosage Working Group	definitive evidence (06/03/2019)	https://search.clinicalgenome.org/kb/gene-validity/CGGV:assertion_e491d278-7123-434c-8de3-46e16afb4037-2019-06-03T160000.000Z	Intellectual Disability and Autism			
MONDO:0010385	XIAP	HGNC:592	https://search.clinicalgenome.org/kb/genes/HGNC:592	X-linked lymphoproliferative disease due to XIAP deficiency	https://search.clinicalgenome.org/kb/conditions/MONDO:0010385		3 - Sufficient Evidence for Haploinsufficiency (07/06/2012)	0 - No Evidence for Haploinsufficiency (07/06/2012)	https://search.clinicalgenome.org/kb/gene-dosage/HGNC:592	Dosage Working Group						
MONDO:0010392	PGK1	HGNC:8896	https://search.clinicalgenome.org/kb/genes/HGNC:8896	glycogen storage disease due to phosphoglycerate kinase 1 deficiency	https://search.clinicalgenome.org/kb/conditions/MONDO:0010392		2 - Emerging Evidence for Haploinsufficiency (05/26/2021)	0 - No Evidence for Haploinsufficiency (05/26/2021)	https://search.clinicalgenome.org/kb/gene-dosage/HGNC:8896	Dosage Working Group						
MONDO:0010393	BRWD3	HGNC:17342	https://search.clinicalgenome.org/kb/genes/HGNC:17342	intellectual disability, X-linked 93	https://search.clinicalgenome.org/kb/conditions/MONDO:0010393		2 - Emerging Evidence for Haploinsufficiency (04/25/2012)	0 - No Evidence for Haploinsufficiency (04/25/2012)	https://search.clinicalgenome.org/kb/gene-dosage/HGNC:17342	Dosage Working Group						
MONDO:0010395	PRPS1	HGNC:9462	https://search.clinicalgenome.org/kb/genes/HGNC:9462	phosphoribosylpyrophosphate synthetase superactivity	https://search.clinicalgenome.org/kb/conditions/MONDO:0010395	X-linked inheritance	3 - Sufficient Evidence for Haploinsufficiency (05/17/2012)	0 - No Evidence for Haploinsufficiency (05/17/2012)	https://search.clinicalgenome.org/kb/gene-dosage/HGNC:9462	Dosage Working Group	limited evidence (02/14/2020)	https://search.clinicalgenome.org/kb/gene-validity/CGGV:assertion_76dc3f8d-e1c9-4506-9381-d2b5ab3df300-2020-02-14T170000.000Z	Hearing Loss			
MONDO:0010396	CDKL5	HGNC:11411	https://search.clinicalgenome.org/kb/genes/HGNC:11411	developmental and epileptic encephalopathy, 2	https://search.clinicalgenome.org/kb/conditions/MONDO:0010396		3 - Sufficient Evidence for Haploinsufficiency (07/12/2012)	0 - No Evidence for Haploinsufficiency (07/12/2012)	https://search.clinicalgenome.org/kb/gene-dosage/HGNC:11411	Dosage Working Group						
MONDO:0010398	UPF3B	HGNC:20439	https://search.clinicalgenome.org/kb/genes/HGNC:20439	syndromic X-linked intellectual disability 14	https://search.clinicalgenome.org/kb/conditions/MONDO:0010398		3 - Sufficient Evidence for Haploinsufficiency (02/09/2021)	0 - No Evidence for Haploinsufficiency (02/09/2021)	https://search.clinicalgenome.org/kb/gene-dosage/HGNC:20439	Dosage Working Group						
MONDO:0010401	FHL1	HGNC:3702	https://search.clinicalgenome.org/kb/genes/HGNC:3702	X-linked myopathy with postural muscle atrophy	https://search.clinicalgenome.org/kb/conditions/MONDO:0010401									Assertion Pending (07/13/2017)	https://search.clinicalgenome.org/kb/gene-validity/https://actionability.clinicalgenome.org/ac/Adult/ui/stg2SummaryRpt?doc=AC143	Adult Actionability Working Group
MONDO:0010402	GRIA3	HGNC:4573	https://search.clinicalgenome.org/kb/genes/HGNC:4573	syndromic X-linked intellectual disability 94	https://search.clinicalgenome.org/kb/conditions/MONDO:0010402		2 - Emerging Evidence for Haploinsufficiency (10/23/2019)	0 - No Evidence for Haploinsufficiency (10/23/2019)	https://search.clinicalgenome.org/kb/gene-dosage/HGNC:4573	Dosage Working Group						
MONDO:0010407	HUWE1	HGNC:30892	https://search.clinicalgenome.org/kb/genes/HGNC:30892	intellectual disability, X-linked syndromic, Turner type	https://search.clinicalgenome.org/kb/conditions/MONDO:0010407		0 - No Evidence for Haploinsufficiency (09/26/2018)	0 - No Evidence for Haploinsufficiency (09/26/2018)	https://search.clinicalgenome.org/kb/gene-dosage/HGNC:30892	Dosage Working Group						
MONDO:0010408	CCNQ	HGNC:28434	https://search.clinicalgenome.org/kb/genes/HGNC:28434	syndactyly-telecanthus-anogenital and renal malformations syndrome	https://search.clinicalgenome.org/kb/conditions/MONDO:0010408		2 - Emerging Evidence for Haploinsufficiency (12/01/2021)	0 - No Evidence for Haploinsufficiency (12/01/2021)	https://search.clinicalgenome.org/kb/gene-dosage/HGNC:28434	Dosage Working Group						
MONDO:0010417	CASK	HGNC:1497	https://search.clinicalgenome.org/kb/genes/HGNC:1497	syndromic X-linked intellectual disability Najm type	https://search.clinicalgenome.org/kb/conditions/MONDO:0010417		3 - Sufficient Evidence for Haploinsufficiency (06/28/2012)	0 - No Evidence for Haploinsufficiency (06/28/2012)	https://search.clinicalgenome.org/kb/gene-dosage/HGNC:1497	Dosage Working Group						
MONDO:0010420	ALAS2	HGNC:397	https://search.clinicalgenome.org/kb/genes/HGNC:397	X-linked erythropoietic protoporphyria	https://search.clinicalgenome.org/kb/conditions/MONDO:0010420	X-linked inheritance					definitive evidence (03/27/2022)	https://search.clinicalgenome.org/kb/gene-validity/CGGV:assertion_61e658f9-fdc9-4b3c-8788-80eb1ad83b0b-2022-03-27T181700.091Z	General Inborn Errors of Metabolism			
MONDO:0010421	BTK	HGNC:1133	https://search.clinicalgenome.org/kb/genes/HGNC:1133	Bruton-type agammaglobulinemia	https://search.clinicalgenome.org/kb/conditions/MONDO:0010421	X-linked inheritance	3 - Sufficient Evidence for Haploinsufficiency (03/24/2021)	0 - No Evidence for Haploinsufficiency (03/24/2021)	https://search.clinicalgenome.org/kb/gene-dosage/HGNC:1133	Dosage Working Group	definitive evidence (10/20/2020)	https://search.clinicalgenome.org/kb/gene-validity/CGGV:assertion_8dc4d594-2103-46ad-a786-f4bda9b95995-2020-10-20T160000.000Z	Antibody Deficiencies GCEP			
MONDO:0010427	ZDHHC9	HGNC:18475	https://search.clinicalgenome.org/kb/genes/HGNC:18475	syndromic X-linked intellectual disability Raymond type	https://search.clinicalgenome.org/kb/conditions/MONDO:0010427	X-linked inheritance	3 - Sufficient Evidence for Haploinsufficiency (10/12/2021)	0 - No Evidence for Haploinsufficiency (10/12/2021)	https://search.clinicalgenome.org/kb/gene-dosage/HGNC:18475	Dosage Working Group	definitive evidence (05/19/2020)	https://search.clinicalgenome.org/kb/gene-validity/CGGV:assertion_2156b925-1ee6-4edb-a514-3650aa5b780e-2020-05-19T160000.000Z	Intellectual Disability and Autism			
MONDO:0010429	SYP	HGNC:11506	https://search.clinicalgenome.org/kb/genes/HGNC:11506	intellectual disability, X-linked 96	https://search.clinicalgenome.org/kb/conditions/MONDO:0010429		1 - Little Evidence for Haploinsufficiency (09/26/2018)	0 - No Evidence for Haploinsufficiency (09/26/2018)	https://search.clinicalgenome.org/kb/gene-dosage/HGNC:11506	Dosage Working Group						
MONDO:0010430	ZNF711	HGNC:13128	https://search.clinicalgenome.org/kb/genes/HGNC:13128	intellectual disability, X-linked 97	https://search.clinicalgenome.org/kb/conditions/MONDO:0010430		2 - Emerging Evidence for Haploinsufficiency (08/29/2013)	0 - No Evidence for Haploinsufficiency (08/29/2013)	https://search.clinicalgenome.org/kb/gene-dosage/HGNC:13128	Dosage Working Group						
MONDO:0010432	F9	HGNC:3551	https://search.clinicalgenome.org/kb/genes/HGNC:3551	thrombophilia, X-linked, due to factor 9 defect	https://search.clinicalgenome.org/kb/conditions/MONDO:0010432	X-linked inheritance	3 - Sufficient Evidence for Haploinsufficiency (01/12/2021)	0 - No Evidence for Haploinsufficiency (01/12/2021)	https://search.clinicalgenome.org/kb/gene-dosage/HGNC:3551	Dosage Working Group	limited evidence (06/24/2020)	https://search.clinicalgenome.org/kb/gene-validity/CGGV:assertion_9b3a7f2c-a07a-4a10-b1f7-78642ebdaa5d-2020-06-24T160000.000Z	Hemostasis Thrombosis			
MONDO:0010440	PTCHD1	HGNC:26392	https://search.clinicalgenome.org/kb/genes/HGNC:26392	autism, susceptibility to, X-linked 4	https://search.clinicalgenome.org/kb/conditions/MONDO:0010440		3 - Sufficient Evidence for Haploinsufficiency (02/28/2018)	0 - No Evidence for Haploinsufficiency (02/28/2018)	https://search.clinicalgenome.org/kb/gene-dosage/HGNC:26392	Dosage Working Group						
MONDO:0010441	NSDHL	HGNC:13398	https://search.clinicalgenome.org/kb/genes/HGNC:13398	CK syndrome	https://search.clinicalgenome.org/kb/conditions/MONDO:0010441	X-linked inheritance	3 - Sufficient Evidence for Haploinsufficiency (09/25/2019)	0 - No Evidence for Haploinsufficiency (09/25/2019)	https://search.clinicalgenome.org/kb/gene-dosage/HGNC:13398	Dosage Working Group	moderate evidence (01/20/2021)	https://search.clinicalgenome.org/kb/gene-validity/CGGV:assertion_d94406f0-a459-47ed-aabc-80c7b6be9293-2021-01-20T170000.000Z	Intellectual Disability and Autism			
MONDO:0010451	GDI1	HGNC:4226	https://search.clinicalgenome.org/kb/genes/HGNC:4226	intellectual disability, X-linked 41	https://search.clinicalgenome.org/kb/conditions/MONDO:0010451		2 - Emerging Evidence for Haploinsufficiency (09/26/2018)	0 - No Evidence for Haploinsufficiency (09/26/2018)	https://search.clinicalgenome.org/kb/gene-dosage/HGNC:4226	Dosage Working Group						
MONDO:0010452	DLG3	HGNC:2902	https://search.clinicalgenome.org/kb/genes/HGNC:2902	intellectual disability, X-linked 90	https://search.clinicalgenome.org/kb/conditions/MONDO:0010452		2 - Emerging Evidence for Haploinsufficiency (11/21/2019)	0 - No Evidence for Haploinsufficiency (11/21/2019)	https://search.clinicalgenome.org/kb/gene-dosage/HGNC:2902	Dosage Working Group						
MONDO:0010454	AGTR2	HGNC:338	https://search.clinicalgenome.org/kb/genes/HGNC:338	intellectual disability, XMEN-linked 88	https://search.clinicalgenome.org/kb/conditions/MONDO:0010454		0 - No Evidence for Haploinsufficiency (05/10/2012)	0 - No Evidence for Haploinsufficiency (05/10/2012)	https://search.clinicalgenome.org/kb/gene-dosage/HGNC:338	Dosage Working Group						
MONDO:0010455	MAGT1	HGNC:28880	https://search.clinicalgenome.org/kb/genes/HGNC:28880	X-linked immunodeficiency with magnesium defect, Epstein-Barr virus infection and neoplasia	https://search.clinicalgenome.org/kb/conditions/MONDO:0010455		3 - Sufficient Evidence for Haploinsufficiency (09/22/2021)	0 - No Evidence for Haploinsufficiency (09/22/2021)	https://search.clinicalgenome.org/kb/gene-dosage/HGNC:28880	Dosage Working Group						
MONDO:0010459	UBQLN2	HGNC:12509	https://search.clinicalgenome.org/kb/genes/HGNC:12509	amyotrophic lateral sclerosis type 15	https://search.clinicalgenome.org/kb/conditions/MONDO:0010459	X-linked inheritance					definitive evidence (04/13/2021)	https://search.clinicalgenome.org/kb/gene-validity/CGGV:assertion_17c06f6e-6fe1-4a61-bc35-026416e31dbb-2021-04-13T194634.543Z	Amyotrophic Lateral Sclerosis Spectrum Disorders			
MONDO:0010461	UBE2A	HGNC:12472	https://search.clinicalgenome.org/kb/genes/HGNC:12472	syndromic X-linked intellectual disability Nascimento type	https://search.clinicalgenome.org/kb/conditions/MONDO:0010461	X-linked inheritance	3 - Sufficient Evidence for Haploinsufficiency (05/22/2019)	0 - No Evidence for Haploinsufficiency (05/22/2019)	https://search.clinicalgenome.org/kb/gene-dosage/HGNC:12472	Dosage Working Group	definitive evidence (07/13/2018)	https://search.clinicalgenome.org/kb/gene-validity/CGGV:assertion_94765cdb-fe12-4098-b28e-20cd58744271-2018-07-13T134934.109Z	Intellectual Disability and Autism			
MONDO:0010465	KDM6A	HGNC:12637	https://search.clinicalgenome.org/kb/genes/HGNC:12637	Kabuki syndrome 2	https://search.clinicalgenome.org/kb/conditions/MONDO:0010465	X-linked inheritance	3 - Sufficient Evidence for Haploinsufficiency (07/18/2013)	0 - No Evidence for Haploinsufficiency (07/18/2013)	https://search.clinicalgenome.org/kb/gene-dosage/HGNC:12637	Dosage Working Group	definitive evidence (07/26/2021)	https://search.clinicalgenome.org/kb/gene-validity/CGGV:assertion_fb0b5b0f-d4c9-4c46-b4cc-2e516be7908d-2021-07-26T202903.760Z	SCID-CID			
MONDO:0010471	HDAC8	HGNC:13315	https://search.clinicalgenome.org/kb/genes/HGNC:13315	Cornelia de Lange syndrome 5	https://search.clinicalgenome.org/kb/conditions/MONDO:0010471		3 - Sufficient Evidence for Haploinsufficiency (03/28/2018)	0 - No Evidence for Haploinsufficiency (03/28/2018)	https://search.clinicalgenome.org/kb/gene-dosage/HGNC:13315	Dosage Working Group						
MONDO:0010476	WDR45	HGNC:28912	https://search.clinicalgenome.org/kb/genes/HGNC:28912	neurodegeneration with brain iron accumulation 5	https://search.clinicalgenome.org/kb/conditions/MONDO:0010476		3 - Sufficient Evidence for Haploinsufficiency (04/09/2015)	0 - No Evidence for Haploinsufficiency (04/09/2015)	https://search.clinicalgenome.org/kb/gene-dosage/HGNC:28912	Dosage Working Group						
MONDO:0010478	SLC35A2	HGNC:11022	https://search.clinicalgenome.org/kb/genes/HGNC:11022	SLC35A2-CDG	https://search.clinicalgenome.org/kb/conditions/MONDO:0010478		3 - Sufficient Evidence for Haploinsufficiency (01/24/2018)	0 - No Evidence for Haploinsufficiency (01/24/2018)	https://search.clinicalgenome.org/kb/gene-dosage/HGNC:11022	Dosage Working Group						
MONDO:0010480	G6PD	HGNC:4057	https://search.clinicalgenome.org/kb/genes/HGNC:4057	anemia, nonspherocytic hemolytic, due to G6PD deficiency	https://search.clinicalgenome.org/kb/conditions/MONDO:0010480									Moderate Actionability (08/18/2021) | Moderate Actionability (08/18/2021)	https://search.clinicalgenome.org/kb/gene-validity/https://actionability.clinicalgenome.org/ac/Adult/ui/stg2SummaryRpt?doc=AC1043 | https://search.clinicalgenome.org/kb/gene-validity/https://actionability.clinicalgenome.org/ac/Pediatric/ui/stg2SummaryRpt?doc=AC1043	Adult Actionability Working Group | Pediatric Actionability Working Group
MONDO:0010483	NEXMIF	HGNC:29433	https://search.clinicalgenome.org/kb/genes/HGNC:29433	X-linked intellectual disability, Cantagrel type	https://search.clinicalgenome.org/kb/conditions/MONDO:0010483		3 - Sufficient Evidence for Haploinsufficiency (06/26/2019)	0 - No Evidence for Haploinsufficiency (06/26/2019)	https://search.clinicalgenome.org/kb/gene-dosage/HGNC:29433	Dosage Working Group						
MONDO:0010484	COL4A6	HGNC:2208	https://search.clinicalgenome.org/kb/genes/HGNC:2208	hearing loss, X-linked 6	https://search.clinicalgenome.org/kb/conditions/MONDO:0010484	X-linked inheritance					limited evidence (03/22/2022)	https://search.clinicalgenome.org/kb/gene-validity/CGGV:assertion_d026ef00-c6f3-4aa8-a61a-b354b68fe043-2022-03-22T160000.000Z	Hearing Loss			
MONDO:0010487	USP9X	HGNC:12632	https://search.clinicalgenome.org/kb/genes/HGNC:12632	intellectual disability, X-linked 99	https://search.clinicalgenome.org/kb/conditions/MONDO:0010487		3 - Sufficient Evidence for Haploinsufficiency (03/28/2018)	0 - No Evidence for Haploinsufficiency (03/28/2018)	https://search.clinicalgenome.org/kb/gene-dosage/HGNC:12632	Dosage Working Group						
MONDO:0010497	DDX3X	HGNC:2745	https://search.clinicalgenome.org/kb/genes/HGNC:2745	intellectual disability, X-linked 102	https://search.clinicalgenome.org/kb/conditions/MONDO:0010497		3 - Sufficient Evidence for Haploinsufficiency (11/22/2017)	0 - No Evidence for Haploinsufficiency (11/22/2017)	https://search.clinicalgenome.org/kb/gene-dosage/HGNC:2745	Dosage Working Group						
MONDO:0010518	WAS	HGNC:12731	https://search.clinicalgenome.org/kb/genes/HGNC:12731	Wiskott-Aldrich syndrome	https://search.clinicalgenome.org/kb/conditions/MONDO:0010518	X-linked inheritance					definitive evidence (10/12/2018)	https://search.clinicalgenome.org/kb/gene-validity/CGGV:assertion_a936b3ba-f1d0-4f14-bd56-14f64ad4de3a-2018-10-12T205425.459Z	Hereditary Cancer	Moderate Actionability (11/16/2018)	https://search.clinicalgenome.org/kb/gene-validity/https://actionability.clinicalgenome.org/ac/Pediatric/ui/stg2SummaryRpt?doc=AC011	Pediatric Actionability Working Group
MONDO:0010519	ATRX	HGNC:886	https://search.clinicalgenome.org/kb/genes/HGNC:886	alpha thalassemia-X-linked intellectual disability syndrome	https://search.clinicalgenome.org/kb/conditions/MONDO:0010519		3 - Sufficient Evidence for Haploinsufficiency (07/31/2012)	0 - No Evidence for Haploinsufficiency (07/31/2012)	https://search.clinicalgenome.org/kb/gene-dosage/HGNC:886	Dosage Working Group						
MONDO:0010520	COL4A5	HGNC:2207	https://search.clinicalgenome.org/kb/genes/HGNC:2207	X-linked Alport syndrome	https://search.clinicalgenome.org/kb/conditions/MONDO:0010520		3 - Sufficient Evidence for Haploinsufficiency (09/08/2020)	0 - No Evidence for Haploinsufficiency (09/08/2020)	https://search.clinicalgenome.org/kb/gene-dosage/HGNC:2207	Dosage Working Group						
MONDO:0010526	GLA	HGNC:4296	https://search.clinicalgenome.org/kb/genes/HGNC:4296	Fabry disease	https://search.clinicalgenome.org/kb/conditions/MONDO:0010526	X-linked inheritance	3 - Sufficient Evidence for Haploinsufficiency (03/24/2021)	0 - No Evidence for Haploinsufficiency (03/24/2021)	https://search.clinicalgenome.org/kb/gene-dosage/HGNC:4296	Dosage Working Group	definitive evidence (01/23/2019)	https://search.clinicalgenome.org/kb/gene-validity/CGGV:assertion_eb4bb6f4-89de-4586-af6b-3f218b8cb4dc-2019-01-23T170000.000Z	General Gene Curation	Moderate Actionability (12/11/2019) | Moderate Actionability (12/11/2019)	https://search.clinicalgenome.org/kb/gene-validity/https://actionability.clinicalgenome.org/ac/Adult/ui/stg2SummaryRpt?doc=AC047 | https://search.clinicalgenome.org/kb/gene-validity/https://actionability.clinicalgenome.org/ac/Pediatric/ui/stg2SummaryRpt?doc=AC047	Adult Actionability Working Group | Pediatric Actionability Working Group
MONDO:0010537	PHF6	HGNC:18145	https://search.clinicalgenome.org/kb/genes/HGNC:18145	Borjeson-Forssman-Lehmann syndrome	https://search.clinicalgenome.org/kb/conditions/MONDO:0010537	X-linked inheritance	3 - Sufficient Evidence for Haploinsufficiency (02/24/2021)	0 - No Evidence for Haploinsufficiency (02/24/2021)	https://search.clinicalgenome.org/kb/gene-dosage/HGNC:18145	Dosage Working Group	definitive evidence (02/21/2018)	https://search.clinicalgenome.org/kb/gene-validity/CGGCIEX:assertion_9555	Intellectual Disability and Autism			
MONDO:0010542	DMD	HGNC:2928	https://search.clinicalgenome.org/kb/genes/HGNC:2928	dilated cardiomyopathy 3B	https://search.clinicalgenome.org/kb/conditions/MONDO:0010542		3 - Sufficient Evidence for Haploinsufficiency (11/20/2019)	0 - No Evidence for Haploinsufficiency (11/20/2019)	https://search.clinicalgenome.org/kb/gene-dosage/HGNC:2928	Dosage Working Group				Assertion Pending (08/14/2017)	https://search.clinicalgenome.org/kb/gene-validity/https://actionability.clinicalgenome.org/ac/Adult/ui/stg2SummaryRpt?doc=AC138	Adult Actionability Working Group
MONDO:0010543	TAFAZZIN	HGNC:11577	https://search.clinicalgenome.org/kb/genes/HGNC:11577	Barth syndrome	https://search.clinicalgenome.org/kb/conditions/MONDO:0010543	X-linked inheritance					definitive evidence (02/12/2021)	https://search.clinicalgenome.org/kb/gene-validity/CGGV:assertion_1629e6ab-9749-4949-bf54-fe1addf4dcfd-2021-02-12T170000.000Z	General Inborn Errors of Metabolism			
MONDO:0010545	NHS	HGNC:7820	https://search.clinicalgenome.org/kb/genes/HGNC:7820	Nance-Horan syndrome	https://search.clinicalgenome.org/kb/conditions/MONDO:0010545	X-linked inheritance	3 - Sufficient Evidence for Haploinsufficiency (04/28/2021)	0 - No Evidence for Haploinsufficiency (04/28/2021)	https://search.clinicalgenome.org/kb/gene-dosage/HGNC:7820	Dosage Working Group	definitive evidence (10/20/2017)	https://search.clinicalgenome.org/kb/gene-validity/CGGCIEX:assertion_9520	Intellectual Disability and Autism			
MONDO:0010549	GJB1	HGNC:4283	https://search.clinicalgenome.org/kb/genes/HGNC:4283	Charcot-Marie-Tooth disease X-linked dominant 1	https://search.clinicalgenome.org/kb/conditions/MONDO:0010549	X-linked inheritance					definitive evidence (01/14/2020)	https://search.clinicalgenome.org/kb/gene-validity/CGGV:assertion_fcacd858-2376-4cc0-983a-156145e36595-2020-01-14T170000.000Z	Charcot-Marie-Tooth			
MONDO:0010555	ARSL	HGNC:719	https://search.clinicalgenome.org/kb/genes/HGNC:719	X-linked chondrodysplasia punctata 1	https://search.clinicalgenome.org/kb/conditions/MONDO:0010555	X-linked inheritance	3 - Sufficient Evidence for Haploinsufficiency (07/12/2012)	0 - No Evidence for Haploinsufficiency (07/12/2012)	https://search.clinicalgenome.org/kb/gene-dosage/HGNC:719	Dosage Working Group	definitive evidence (08/25/2020)	https://search.clinicalgenome.org/kb/gene-validity/CGGV:assertion_2c48d88b-d100-4203-8abf-03f3199bf3e0-2020-08-25T132456.576Z	Syndromic Disorders			
MONDO:0010557	CHM	HGNC:1940	https://search.clinicalgenome.org/kb/genes/HGNC:1940	choroideremia	https://search.clinicalgenome.org/kb/conditions/MONDO:0010557	X-linked inheritance	3 - Sufficient Evidence for Haploinsufficiency (03/24/2021)	0 - No Evidence for Haploinsufficiency (03/24/2021)	https://search.clinicalgenome.org/kb/gene-dosage/HGNC:1940	Dosage Working Group	definitive evidence (10/26/2020)	https://search.clinicalgenome.org/kb/gene-validity/CGGV:assertion_d84b01d6-8b3c-4a1e-bd25-68ee6962f374-2020-10-26T124704.094Z	Retina			
MONDO:0010560	TBX22	HGNC:11600	https://search.clinicalgenome.org/kb/genes/HGNC:11600	cleft palate with or without ankyloglossia, X-linked	https://search.clinicalgenome.org/kb/conditions/MONDO:0010560		3 - Sufficient Evidence for Haploinsufficiency (03/24/2016)	0 - No Evidence for Haploinsufficiency (03/24/2016)	https://search.clinicalgenome.org/kb/gene-dosage/HGNC:11600	Dosage Working Group						
MONDO:0010561	RPS6KA3	HGNC:10432	https://search.clinicalgenome.org/kb/genes/HGNC:10432	Coffin-Lowry syndrome	https://search.clinicalgenome.org/kb/conditions/MONDO:0010561	X-linked inheritance	3 - Sufficient Evidence for Haploinsufficiency (08/09/2012)	0 - No Evidence for Haploinsufficiency (08/09/2012)	https://search.clinicalgenome.org/kb/gene-dosage/HGNC:10432	Dosage Working Group	definitive evidence (05/28/2019)	https://search.clinicalgenome.org/kb/gene-validity/CGGV:assertion_af32a931-1d55-432f-82cf-ce87f6c26580-2019-05-28T040000.000Z	Intellectual Disability and Autism			
MONDO:0010570	EFNB1	HGNC:3226	https://search.clinicalgenome.org/kb/genes/HGNC:3226	craniofrontonasal syndrome	https://search.clinicalgenome.org/kb/conditions/MONDO:0010570	X-linked inheritance	3 - Sufficient Evidence for Haploinsufficiency (07/26/2012)	1 - Little Evidence for Haploinsufficiency (07/26/2012)	https://search.clinicalgenome.org/kb/gene-dosage/HGNC:3226	Dosage Working Group	definitive evidence (10/26/2020)	https://search.clinicalgenome.org/kb/gene-validity/CGGV:assertion_31ffbd0b-5c6b-4396-a84c-9330d81e4a08-2020-10-26T154650.453Z	Craniofacial Malformations			
MONDO:0010574	AP1S2	HGNC:560	https://search.clinicalgenome.org/kb/genes/HGNC:560	syndromic X-linked intellectual disability 5	https://search.clinicalgenome.org/kb/conditions/MONDO:0010574		3 - Sufficient Evidence for Haploinsufficiency (04/28/2021)	0 - No Evidence for Haploinsufficiency (04/28/2021)	https://search.clinicalgenome.org/kb/gene-dosage/HGNC:560	Dosage Working Group						
MONDO:0010576	POU3F4	HGNC:9217	https://search.clinicalgenome.org/kb/genes/HGNC:9217	X-linked mixed hearing loss with perilymphatic gusher	https://search.clinicalgenome.org/kb/conditions/MONDO:0010576									Strong Actionability (10/29/2020)	https://search.clinicalgenome.org/kb/gene-validity/https://actionability.clinicalgenome.org/ac/Pediatric/ui/stg2SummaryRpt?doc=AC1018	Pediatric Actionability Working Group
MONDO:0010578	TIMM8A	HGNC:11817	https://search.clinicalgenome.org/kb/genes/HGNC:11817	deafness dystonia syndrome	https://search.clinicalgenome.org/kb/conditions/MONDO:0010578	X-linked inheritance	3 - Sufficient Evidence for Haploinsufficiency (03/24/2021)	0 - No Evidence for Haploinsufficiency (03/24/2021)	https://search.clinicalgenome.org/kb/gene-dosage/HGNC:11817	Dosage Working Group	definitive evidence (12/19/2017)	https://search.clinicalgenome.org/kb/gene-validity/CGGV:assertion_a21d3842-b39e-4f98-860a-61a9aa4e2d2b-2017-12-19T050000.000Z	Hearing Loss			
MONDO:0010581	AVPR2	HGNC:897	https://search.clinicalgenome.org/kb/genes/HGNC:897	diabetes insipidus, nephrogenic, X-linked	https://search.clinicalgenome.org/kb/conditions/MONDO:0010581		3 - Sufficient Evidence for Haploinsufficiency (02/01/2021)	0 - No Evidence for Haploinsufficiency (02/01/2021)	https://search.clinicalgenome.org/kb/gene-dosage/HGNC:897	Dosage Working Group						
MONDO:0010584	DKC1	HGNC:2890	https://search.clinicalgenome.org/kb/genes/HGNC:2890	dyskeratosis congenita, X-linked	https://search.clinicalgenome.org/kb/conditions/MONDO:0010584	X-linked inheritance	1 - Little Evidence for Haploinsufficiency (04/25/2012)	0 - No Evidence for Haploinsufficiency (04/25/2012)	https://search.clinicalgenome.org/kb/gene-dosage/HGNC:2890	Dosage Working Group	definitive evidence (06/15/2021)	https://search.clinicalgenome.org/kb/gene-validity/CGGV:assertion_bb90bea1-16e7-44da-8551-91fb5fd7088a-2021-06-15T234140.163Z	Hereditary Cancer			
MONDO:0010585	EDA	HGNC:3157	https://search.clinicalgenome.org/kb/genes/HGNC:3157	X-linked hypohidrotic ectodermal dysplasia	https://search.clinicalgenome.org/kb/conditions/MONDO:0010585		3 - Sufficient Evidence for Haploinsufficiency (07/26/2012)	0 - No Evidence for Haploinsufficiency (07/26/2012)	https://search.clinicalgenome.org/kb/gene-dosage/HGNC:3157	Dosage Working Group						
MONDO:0010589	FGD1	HGNC:3663	https://search.clinicalgenome.org/kb/genes/HGNC:3663	Aarskog-Scott syndrome, X-linked	https://search.clinicalgenome.org/kb/conditions/MONDO:0010589	X-linked inheritance	3 - Sufficient Evidence for Haploinsufficiency (05/26/2021)	0 - No Evidence for Haploinsufficiency (05/26/2021)	https://search.clinicalgenome.org/kb/gene-dosage/HGNC:3663	Dosage Working Group	definitive evidence (12/06/2017)	https://search.clinicalgenome.org/kb/gene-validity/CGGCIEX:assertion_9513	Intellectual Disability and Autism			
MONDO:0010592	PORCN	HGNC:17652	https://search.clinicalgenome.org/kb/genes/HGNC:17652	focal dermal hypoplasia	https://search.clinicalgenome.org/kb/conditions/MONDO:0010592	X-linked inheritance	3 - Sufficient Evidence for Haploinsufficiency (08/23/2012)	0 - No Evidence for Haploinsufficiency (08/23/2012)	https://search.clinicalgenome.org/kb/gene-dosage/HGNC:17652	Dosage Working Group	definitive evidence (08/05/2020)	https://search.clinicalgenome.org/kb/gene-validity/CGGV:assertion_20fc3afa-d10d-4239-885f-24e91cbb31a8-2020-08-05T124432.168Z	Intellectual Disability and Autism			
MONDO:0010600	CYBB	HGNC:2578	https://search.clinicalgenome.org/kb/genes/HGNC:2578	granulomatous disease, chronic, X-linked	https://search.clinicalgenome.org/kb/conditions/MONDO:0010600		3 - Sufficient Evidence for Haploinsufficiency (05/27/2020)	0 - No Evidence for Haploinsufficiency (05/27/2020)	https://search.clinicalgenome.org/kb/gene-dosage/HGNC:2578	Dosage Working Group						
MONDO:0010602	F8	HGNC:3546	https://search.clinicalgenome.org/kb/genes/HGNC:3546	hemophilia A	https://search.clinicalgenome.org/kb/conditions/MONDO:0010602	X-linked inheritance	3 - Sufficient Evidence for Haploinsufficiency (10/13/2020)	0 - No Evidence for Haploinsufficiency (10/13/2020)	https://search.clinicalgenome.org/kb/gene-dosage/HGNC:3546	Dosage Working Group	definitive evidence (07/24/2019)	https://search.clinicalgenome.org/kb/gene-validity/CGGV:assertion_d4578f11-b635-45f4-8034-310fca5fe960-2019-07-24T160000.000Z	Hemostasis Thrombosis	Assertion Pending (07/27/2016)	https://search.clinicalgenome.org/kb/gene-validity/https://actionability.clinicalgenome.org/ac/Adult/ui/stg2SummaryRpt?doc=AC044	Adult Actionability Working Group
MONDO:0010604	F9	HGNC:3551	https://search.clinicalgenome.org/kb/genes/HGNC:3551	hemophilia B	https://search.clinicalgenome.org/kb/conditions/MONDO:0010604	X-linked inheritance	3 - Sufficient Evidence for Haploinsufficiency (01/12/2021)	0 - No Evidence for Haploinsufficiency (01/12/2021)	https://search.clinicalgenome.org/kb/gene-dosage/HGNC:3551	Dosage Working Group	definitive evidence (05/22/2019)	https://search.clinicalgenome.org/kb/gene-validity/CGGV:assertion_3d56d08d-48d0-4523-b433-dbd44c5b9e45-2019-05-22T190226.728Z	Hemostasis Thrombosis	Assertion Pending (07/27/2016)	https://search.clinicalgenome.org/kb/gene-validity/https://actionability.clinicalgenome.org/ac/Adult/ui/stg2SummaryRpt?doc=AC044	Adult Actionability Working Group
MONDO:0010607	ZIC3	HGNC:12874	https://search.clinicalgenome.org/kb/genes/HGNC:12874	heterotaxy, visceral, 1, X-linked	https://search.clinicalgenome.org/kb/conditions/MONDO:0010607		3 - Sufficient Evidence for Haploinsufficiency (12/02/2020)	0 - No Evidence for Haploinsufficiency (12/02/2020)	https://search.clinicalgenome.org/kb/gene-dosage/HGNC:12874	Dosage Working Group						
MONDO:0010611	L1CAM	HGNC:6470	https://search.clinicalgenome.org/kb/genes/HGNC:6470	X-linked hydrocephalus with stenosis of the aqueduct of Sylvius	https://search.clinicalgenome.org/kb/conditions/MONDO:0010611		3 - Sufficient Evidence for Haploinsufficiency (12/02/2020)	0 - No Evidence for Haploinsufficiency (12/02/2020)	https://search.clinicalgenome.org/kb/gene-dosage/HGNC:6470	Dosage Working Group						
MONDO:0010613	GK	HGNC:4289	https://search.clinicalgenome.org/kb/genes/HGNC:4289	inborn glycerol kinase deficiency	https://search.clinicalgenome.org/kb/conditions/MONDO:0010613	X-linked inheritance	3 - Sufficient Evidence for Haploinsufficiency (09/06/2012)	0 - No Evidence for Haploinsufficiency (09/06/2012)	https://search.clinicalgenome.org/kb/gene-dosage/HGNC:4289	Dosage Working Group	definitive evidence (01/14/2022)	https://search.clinicalgenome.org/kb/gene-validity/CGGV:assertion_b8965e78-8d6a-4b8a-af2d-e05097d791e0-2022-01-14T174134.555Z	General Inborn Errors of Metabolism			
MONDO:0010615	BTK	HGNC:1133	https://search.clinicalgenome.org/kb/genes/HGNC:1133	isolated growth hormone deficiency type III	https://search.clinicalgenome.org/kb/conditions/MONDO:0010615	X-linked inheritance	3 - Sufficient Evidence for Haploinsufficiency (03/24/2021)	0 - No Evidence for Haploinsufficiency (03/24/2021)	https://search.clinicalgenome.org/kb/gene-dosage/HGNC:1133	Dosage Working Group	disputing (11/17/2020)	https://search.clinicalgenome.org/kb/gene-validity/CGGV:assertion_6341781b-9ba9-41b1-889a-8d65a9b3ebb7-2020-11-17T170000.000Z	Antibody Deficiencies GCEP			
MONDO:0010619	PHEX	HGNC:8918	https://search.clinicalgenome.org/kb/genes/HGNC:8918	X-linked dominant hypophosphatemic rickets	https://search.clinicalgenome.org/kb/conditions/MONDO:0010619		3 - Sufficient Evidence for Haploinsufficiency (06/28/2012)	0 - No Evidence for Haploinsufficiency (06/28/2012)	https://search.clinicalgenome.org/kb/gene-dosage/HGNC:8918	Dosage Working Group				Assertion Pending (11/05/2018)	https://search.clinicalgenome.org/kb/gene-validity/https://actionability.clinicalgenome.org/ac/Pediatric/ui/stg2SummaryRpt?doc=AC009	Pediatric Actionability Working Group
MONDO:0010621	NSDHL	HGNC:13398	https://search.clinicalgenome.org/kb/genes/HGNC:13398	CHILD syndrome	https://search.clinicalgenome.org/kb/conditions/MONDO:0010621		3 - Sufficient Evidence for Haploinsufficiency (09/25/2019)	0 - No Evidence for Haploinsufficiency (09/25/2019)	https://search.clinicalgenome.org/kb/gene-dosage/HGNC:13398	Dosage Working Group						
MONDO:0010622	STS	HGNC:11425	https://search.clinicalgenome.org/kb/genes/HGNC:11425	recessive X-linked ichthyosis	https://search.clinicalgenome.org/kb/conditions/MONDO:0010622		3 - Sufficient Evidence for Haploinsufficiency (09/14/2018)	0 - No Evidence for Haploinsufficiency (09/14/2018)	https://search.clinicalgenome.org/kb/gene-dosage/HGNC:11425	Dosage Working Group						
MONDO:0010626	CD40LG	HGNC:11935	https://search.clinicalgenome.org/kb/genes/HGNC:11935	hyper-IgM syndrome type 1	https://search.clinicalgenome.org/kb/conditions/MONDO:0010626	X-linked inheritance	3 - Sufficient Evidence for Haploinsufficiency (04/08/2020)	0 - No Evidence for Haploinsufficiency (04/08/2020)	https://search.clinicalgenome.org/kb/gene-dosage/HGNC:11935	Dosage Working Group	definitive evidence (03/22/2021)	https://search.clinicalgenome.org/kb/gene-validity/CGGV:assertion_4184ad10-d95f-4027-b75d-e4e11127febf-2021-03-22T154242.503Z	SCID-CID			
MONDO:0010631	IKBKG	HGNC:5961	https://search.clinicalgenome.org/kb/genes/HGNC:5961	incontinentia pigmenti	https://search.clinicalgenome.org/kb/conditions/MONDO:0010631		3 - Sufficient Evidence for Haploinsufficiency (11/10/2020)	0 - No Evidence for Haploinsufficiency (11/10/2020)	https://search.clinicalgenome.org/kb/gene-dosage/HGNC:5961	Dosage Working Group						
MONDO:0010635	ANOS1	HGNC:6211	https://search.clinicalgenome.org/kb/genes/HGNC:6211	hypogonadotropic hypogonadism 1 with or without anosmia	https://search.clinicalgenome.org/kb/conditions/MONDO:0010635		3 - Sufficient Evidence for Haploinsufficiency (05/26/2021)	0 - No Evidence for Haploinsufficiency (05/26/2021)	https://search.clinicalgenome.org/kb/gene-dosage/HGNC:6211	Dosage Working Group						
MONDO:0010645	OCRL	HGNC:8108	https://search.clinicalgenome.org/kb/genes/HGNC:8108	oculocerebrorenal syndrome	https://search.clinicalgenome.org/kb/conditions/MONDO:0010645	X-linked inheritance	3 - Sufficient Evidence for Haploinsufficiency (01/12/2021)	0 - No Evidence for Haploinsufficiency (01/12/2021)	https://search.clinicalgenome.org/kb/gene-dosage/HGNC:8108	Dosage Working Group	definitive evidence (07/10/2020)	https://search.clinicalgenome.org/kb/gene-validity/CGGV:assertion_5140c756-fac0-435b-8f59-a5d4a0b0adb3-2020-07-10T160000.000Z	Intellectual Disability and Autism			
MONDO:0010649	CHRDL1	HGNC:29861	https://search.clinicalgenome.org/kb/genes/HGNC:29861	isolated congenital megalocornea	https://search.clinicalgenome.org/kb/conditions/MONDO:0010649		3 - Sufficient Evidence for Haploinsufficiency (12/08/2016)	0 - No Evidence for Haploinsufficiency (12/08/2016)	https://search.clinicalgenome.org/kb/gene-dosage/HGNC:29861	Dosage Working Group						
MONDO:0010651	ATP7A	HGNC:869	https://search.clinicalgenome.org/kb/genes/HGNC:869	Menkes disease	https://search.clinicalgenome.org/kb/conditions/MONDO:0010651	X-linked inheritance	3 - Sufficient Evidence for Haploinsufficiency (03/24/2021)	0 - No Evidence for Haploinsufficiency (03/24/2021)	https://search.clinicalgenome.org/kb/gene-dosage/HGNC:869	Dosage Working Group	definitive evidence (02/07/2018)	https://search.clinicalgenome.org/kb/gene-validity/CGGCIEX:assertion_9510	Intellectual Disability and Autism	Moderate Actionability (01/17/2019)	https://search.clinicalgenome.org/kb/gene-validity/https://actionability.clinicalgenome.org/ac/Pediatric/ui/stg2SummaryRpt?doc=AC013	Pediatric Actionability Working Group
MONDO:0010653	PQBP1	HGNC:9330	https://search.clinicalgenome.org/kb/genes/HGNC:9330	Renpenning syndrome	https://search.clinicalgenome.org/kb/conditions/MONDO:0010653	X-linked inheritance	3 - Sufficient Evidence for Haploinsufficiency (04/09/2020)	0 - No Evidence for Haploinsufficiency (04/09/2020)	https://search.clinicalgenome.org/kb/gene-dosage/HGNC:9330	Dosage Working Group	definitive evidence (11/09/2018)	https://search.clinicalgenome.org/kb/gene-validity/CGGV:assertion_8128f36b-f273-49ee-bfd8-bee64b4df921-2018-11-09T170000.000Z	Intellectual Disability and Autism			
MONDO:0010656	IQSEC2	HGNC:29059	https://search.clinicalgenome.org/kb/genes/HGNC:29059	intellectual disability, X-linked 1	https://search.clinicalgenome.org/kb/conditions/MONDO:0010656		3 - Sufficient Evidence for Haploinsufficiency (04/07/2020)	0 - No Evidence for Haploinsufficiency (04/07/2020)	https://search.clinicalgenome.org/kb/gene-dosage/HGNC:29059	Dosage Working Group						
MONDO:0010659	AFF2	HGNC:3776	https://search.clinicalgenome.org/kb/genes/HGNC:3776	FRAXE intellectual disability	https://search.clinicalgenome.org/kb/conditions/MONDO:0010659	X-linked inheritance	3 - Sufficient Evidence for Haploinsufficiency (12/08/2020)	0 - No Evidence for Haploinsufficiency (12/08/2020)	https://search.clinicalgenome.org/kb/gene-dosage/HGNC:3776	Dosage Working Group	definitive evidence (10/20/2017)	https://search.clinicalgenome.org/kb/gene-validity/CGGCIEX:assertion_9508	Intellectual Disability and Autism			
MONDO:0010660	FTSJ1	HGNC:13254	https://search.clinicalgenome.org/kb/genes/HGNC:13254	intellectual disability, X-linked 9	https://search.clinicalgenome.org/kb/conditions/MONDO:0010660		3 - Sufficient Evidence for Haploinsufficiency (07/12/2012)	0 - No Evidence for Haploinsufficiency (07/12/2012)	https://search.clinicalgenome.org/kb/gene-dosage/HGNC:13254	Dosage Working Group						
MONDO:0010664	SMS	HGNC:11123	https://search.clinicalgenome.org/kb/genes/HGNC:11123	syndromic X-linked intellectual disability Snyder type	https://search.clinicalgenome.org/kb/conditions/MONDO:0010664	X-linked inheritance	3 - Sufficient Evidence for Haploinsufficiency (08/23/2012)	0 - No Evidence for Haploinsufficiency (08/23/2012)	https://search.clinicalgenome.org/kb/gene-dosage/HGNC:11123	Dosage Working Group	definitive evidence (05/16/2018)	https://search.clinicalgenome.org/kb/gene-validity/CGGV:assertion_8f1ca85b-ad57-4c64-9abf-9ae5d915703f-2018-05-16T195543.428Z	Intellectual Disability and Autism			
MONDO:0010674	IDS	HGNC:5389	https://search.clinicalgenome.org/kb/genes/HGNC:5389	mucopolysaccharidosis type 2	https://search.clinicalgenome.org/kb/conditions/MONDO:0010674	X-linked inheritance	3 - Sufficient Evidence for Haploinsufficiency (11/10/2020)	0 - No Evidence for Haploinsufficiency (11/10/2020)	https://search.clinicalgenome.org/kb/gene-dosage/HGNC:5389	Dosage Working Group	definitive evidence (02/21/2018)	https://search.clinicalgenome.org/kb/gene-validity/CGGV:assertion_753ba7a6-cef5-4665-81e9-306e11c618c5-2018-02-21T170000.000Z	Intellectual Disability and Autism	Has Insufficient Evidence for Actionability Based on Early Rule-out (12/17/2018) | Assertion Pending (04/17/2019)	https://search.clinicalgenome.org/kb/gene-validity/https://actionability.clinicalgenome.org/ac/Adult/ui/stg2SummaryRpt?doc=AC1001 | https://search.clinicalgenome.org/kb/gene-validity/https://actionability.clinicalgenome.org/ac/Pediatric/ui/stg2SummaryRpt?doc=AC1001	Adult Actionability Working Group | Pediatric Actionability Working Group
MONDO:0010679	DMD	HGNC:2928	https://search.clinicalgenome.org/kb/genes/HGNC:2928	Duchenne muscular dystrophy	https://search.clinicalgenome.org/kb/conditions/MONDO:0010679		3 - Sufficient Evidence for Haploinsufficiency (11/20/2019)	0 - No Evidence for Haploinsufficiency (11/20/2019)	https://search.clinicalgenome.org/kb/gene-dosage/HGNC:2928	Dosage Working Group						
MONDO:0010680	EMD	HGNC:3331	https://search.clinicalgenome.org/kb/genes/HGNC:3331	X-linked Emery-Dreifuss muscular dystrophy	https://search.clinicalgenome.org/kb/conditions/MONDO:0010680									Assertion Pending (07/13/2017)	https://search.clinicalgenome.org/kb/gene-validity/https://actionability.clinicalgenome.org/ac/Adult/ui/stg2SummaryRpt?doc=AC143	Adult Actionability Working Group
MONDO:0010683	MTM1	HGNC:7448	https://search.clinicalgenome.org/kb/genes/HGNC:7448	X-linked centronuclear myopathy	https://search.clinicalgenome.org/kb/conditions/MONDO:0010683	X-linked inheritance	3 - Sufficient Evidence for Haploinsufficiency (01/11/2021)	0 - No Evidence for Haploinsufficiency (01/11/2021)	https://search.clinicalgenome.org/kb/gene-dosage/HGNC:7448	Dosage Working Group	definitive evidence (11/22/2019)	https://search.clinicalgenome.org/kb/gene-validity/CGGV:assertion_2b60f008-871f-4c5f-aa46-099d09fb66df-2019-11-22T170000.000Z	Congenital Myopathies			
MONDO:0010690	NYX	HGNC:8082	https://search.clinicalgenome.org/kb/genes/HGNC:8082	congenital stationary night blindness 1A	https://search.clinicalgenome.org/kb/conditions/MONDO:0010690	X-linked inheritance	3 - Sufficient Evidence for Haploinsufficiency (01/22/2020)	0 - No Evidence for Haploinsufficiency (01/22/2020)	https://search.clinicalgenome.org/kb/gene-dosage/HGNC:8082	Dosage Working Group	definitive evidence (03/28/2022)	https://search.clinicalgenome.org/kb/gene-validity/CGGV:assertion_c48083c5-2ef8-45ee-a97f-dc973d5d5072-2022-03-28T151233.445Z	Retina			
MONDO:0010691	NDP	HGNC:7678	https://search.clinicalgenome.org/kb/genes/HGNC:7678	Norrie disease	https://search.clinicalgenome.org/kb/conditions/MONDO:0010691	X-linked inheritance	3 - Sufficient Evidence for Haploinsufficiency (06/14/2012)	0 - No Evidence for Haploinsufficiency (06/14/2012)	https://search.clinicalgenome.org/kb/gene-dosage/HGNC:7678	Dosage Working Group	definitive evidence (03/21/2018)	https://search.clinicalgenome.org/kb/gene-validity/CGGV:assertion_335ce5aa-7f87-4b91-a447-928399f40f11-2018-03-21T160000.000Z	Intellectual Disability and Autism			
MONDO:0010693	FRMD7	HGNC:8079	https://search.clinicalgenome.org/kb/genes/HGNC:8079	nystagmus 1, congenital, X-linked	https://search.clinicalgenome.org/kb/conditions/MONDO:0010693		3 - Sufficient Evidence for Haploinsufficiency (04/09/2020)	0 - No Evidence for Haploinsufficiency (04/09/2020)	https://search.clinicalgenome.org/kb/gene-dosage/HGNC:8079	Dosage Working Group						
MONDO:0010702	OFD1	HGNC:2567	https://search.clinicalgenome.org/kb/genes/HGNC:2567	orofaciodigital syndrome I	https://search.clinicalgenome.org/kb/conditions/MONDO:0010702		3 - Sufficient Evidence for Haploinsufficiency (04/13/2021)	0 - No Evidence for Haploinsufficiency (04/13/2021)	https://search.clinicalgenome.org/kb/gene-dosage/HGNC:2567	Dosage Working Group						
MONDO:0010703	OTC	HGNC:8512	https://search.clinicalgenome.org/kb/genes/HGNC:8512	ornithine carbamoyltransferase deficiency	https://search.clinicalgenome.org/kb/conditions/MONDO:0010703	X-linked inheritance	3 - Sufficient Evidence for Haploinsufficiency (06/28/2012)	0 - No Evidence for Haploinsufficiency (06/28/2012)	https://search.clinicalgenome.org/kb/gene-dosage/HGNC:8512	Dosage Working Group	definitive evidence (10/29/2019)	https://search.clinicalgenome.org/kb/gene-validity/CGGV:assertion_132fafbf-bb34-447c-9f6a-65803679eeb8-2019-10-29T181325.783Z	Aminoacidopathy	Strong Actionability (11/16/2021) | Definitive Actionability (11/16/2021)	https://search.clinicalgenome.org/kb/gene-validity/https://actionability.clinicalgenome.org/ac/Adult/ui/stg2SummaryRpt?doc=AC112 | https://search.clinicalgenome.org/kb/gene-validity/https://actionability.clinicalgenome.org/ac/Pediatric/ui/stg2SummaryRpt?doc=AC112	Adult Actionability Working Group | Pediatric Actionability Working Group
MONDO:0010709	RAB39B	HGNC:16499	https://search.clinicalgenome.org/kb/genes/HGNC:16499	early-onset parkinsonism-intellectual disability syndrome	https://search.clinicalgenome.org/kb/conditions/MONDO:0010709	X-linked inheritance	3 - Sufficient Evidence for Haploinsufficiency (05/29/2020)	0 - No Evidence for Haploinsufficiency (05/29/2020)	https://search.clinicalgenome.org/kb/gene-dosage/HGNC:16499	Dosage Working Group	definitive evidence (06/04/2018)	https://search.clinicalgenome.org/kb/gene-validity/CGGV:assertion_01dc73a8-fbd2-4081-95cd-ab7cb59236d7-2018-06-04T121339.240Z	Intellectual Disability and Autism			
MONDO:0010714	PLP1	HGNC:9086	https://search.clinicalgenome.org/kb/genes/HGNC:9086	Pelizaeus-Merzbacher disease	https://search.clinicalgenome.org/kb/conditions/MONDO:0010714	X-linked inheritance	3 - Sufficient Evidence for Haploinsufficiency (04/12/2021)	3 - Sufficient Evidence for Haploinsufficiency (04/12/2021)	https://search.clinicalgenome.org/kb/gene-dosage/HGNC:9086	Dosage Working Group	definitive evidence (03/07/2018)	https://search.clinicalgenome.org/kb/gene-validity/CGGV:assertion_c1a44c5f-744e-4d02-a08f-e7c687531b21-2018-03-07T170000.000Z	Intellectual Disability and Autism			
MONDO:0010717	PDHA1	HGNC:8806	https://search.clinicalgenome.org/kb/genes/HGNC:8806	pyruvate dehydrogenase E1-alpha deficiency	https://search.clinicalgenome.org/kb/conditions/MONDO:0010717		3 - Sufficient Evidence for Haploinsufficiency (09/06/2012)	0 - No Evidence for Haploinsufficiency (09/06/2012)	https://search.clinicalgenome.org/kb/gene-dosage/HGNC:8806	Dosage Working Group						
MONDO:0010723	RP2	HGNC:10274	https://search.clinicalgenome.org/kb/genes/HGNC:10274	retinitis pigmentosa 2	https://search.clinicalgenome.org/kb/conditions/MONDO:0010723		3 - Sufficient Evidence for Haploinsufficiency (10/04/2012)	0 - No Evidence for Haploinsufficiency (10/04/2012)	https://search.clinicalgenome.org/kb/gene-dosage/HGNC:10274	Dosage Working Group						
MONDO:0010725	RS1	HGNC:10457	https://search.clinicalgenome.org/kb/genes/HGNC:10457	X-linked retinoschisis	https://search.clinicalgenome.org/kb/conditions/MONDO:0010725	X-linked inheritance	3 - Sufficient Evidence for Haploinsufficiency (08/02/2021)	0 - No Evidence for Haploinsufficiency (08/02/2021)	https://search.clinicalgenome.org/kb/gene-dosage/HGNC:10457	Dosage Working Group	definitive evidence (12/18/2020)	https://search.clinicalgenome.org/kb/gene-validity/CGGV:assertion_061adaaf-8b09-42e4-ae31-9b9c03d6e944-2020-12-18T165803.135Z	Retina			
MONDO:0010726	MECP2	HGNC:6990	https://search.clinicalgenome.org/kb/genes/HGNC:6990	Rett syndrome	https://search.clinicalgenome.org/kb/conditions/MONDO:0010726	X-linked inheritance	3 - Sufficient Evidence for Haploinsufficiency (02/22/2021)	0 - No Evidence for Haploinsufficiency (02/22/2021)	https://search.clinicalgenome.org/kb/gene-dosage/HGNC:6990	Dosage Working Group	definitive evidence (05/02/2018)	https://search.clinicalgenome.org/kb/gene-validity/CGGV:assertion_2df006ff-5ab4-4926-9b72-48909b09e608-2018-05-02T132629.570Z	Rett and Angelman-like Disorders			
MONDO:0010731	GPC3	HGNC:4451	https://search.clinicalgenome.org/kb/genes/HGNC:4451	Simpson-Golabi-Behmel syndrome	https://search.clinicalgenome.org/kb/conditions/MONDO:0010731	X-linked inheritance	3 - Sufficient Evidence for Haploinsufficiency (01/27/2021)	0 - No Evidence for Haploinsufficiency (01/27/2021)	https://search.clinicalgenome.org/kb/gene-dosage/HGNC:4451	Dosage Working Group	definitive evidence (12/31/2019)	https://search.clinicalgenome.org/kb/gene-validity/CGGV:assertion_5b8b02d6-1d60-4b4c-bb8a-b976907087c7-2019-12-31T175422.159Z	Intellectual Disability and Autism			
MONDO:0010737	TRAPPC2	HGNC:23068	https://search.clinicalgenome.org/kb/genes/HGNC:23068	spondyloepiphyseal dysplasia tarda, X-linked	https://search.clinicalgenome.org/kb/conditions/MONDO:0010737		3 - Sufficient Evidence for Haploinsufficiency (01/16/2014)	0 - No Evidence for Haploinsufficiency (01/16/2014)	https://search.clinicalgenome.org/kb/gene-dosage/HGNC:23068	Dosage Working Group						
MONDO:0010743	WAS	HGNC:12731	https://search.clinicalgenome.org/kb/genes/HGNC:12731	thrombocytopenia 1	https://search.clinicalgenome.org/kb/conditions/MONDO:0010743									Moderate Actionability (11/16/2018)	https://search.clinicalgenome.org/kb/gene-validity/https://actionability.clinicalgenome.org/ac/Pediatric/ui/stg2SummaryRpt?doc=AC011	Pediatric Actionability Working Group
MONDO:0010758	ZC4H2	HGNC:24931	https://search.clinicalgenome.org/kb/genes/HGNC:24931	Wieacker-Wolff syndrome	https://search.clinicalgenome.org/kb/conditions/MONDO:0010758		3 - Sufficient Evidence for Haploinsufficiency (04/22/2020)	0 - No Evidence for Haploinsufficiency (04/22/2020)	https://search.clinicalgenome.org/kb/gene-dosage/HGNC:24931	Dosage Working Group						
MONDO:0010802	GATA6	HGNC:4174	https://search.clinicalgenome.org/kb/genes/HGNC:4174	pancreatic hypoplasia-diabetes-congenital heart disease syndrome	https://search.clinicalgenome.org/kb/conditions/MONDO:0010802		3 - Sufficient Evidence for Haploinsufficiency (06/20/2013)	0 - No Evidence for Haploinsufficiency (06/20/2013)	https://search.clinicalgenome.org/kb/gene-dosage/HGNC:4174	Dosage Working Group						
MONDO:0010820	PRKN	HGNC:8607	https://search.clinicalgenome.org/kb/genes/HGNC:8607	autosomal recessive juvenile Parkinson disease 2	https://search.clinicalgenome.org/kb/conditions/MONDO:0010820		30 - Gene Associated with Autosomal Recessive Phenotype (05/15/2018)	0 - No Evidence for Haploinsufficiency (05/15/2018)	https://search.clinicalgenome.org/kb/gene-dosage/HGNC:8607	Dosage Working Group				Has Insufficient Evidence for Actionability Based on Early Rule-out (06/21/2021) | Has Insufficient Evidence for Actionability Based on Early Rule-out (06/21/2021)	https://search.clinicalgenome.org/kb/gene-validity/https://actionability.clinicalgenome.org/ac/Adult/ui/stg2SummaryRpt?doc=AC1027 | https://search.clinicalgenome.org/kb/gene-validity/https://actionability.clinicalgenome.org/ac/Pediatric/ui/stg2SummaryRpt?doc=AC1027	Adult Actionability Working Group | Pediatric Actionability Working Group
MONDO:0010822	RAB3GAP1	HGNC:17063	https://search.clinicalgenome.org/kb/genes/HGNC:17063	Warburg micro syndrome 1	https://search.clinicalgenome.org/kb/conditions/MONDO:0010822	Autosomal recessive inheritance	30 - Gene Associated with Autosomal Recessive Phenotype (08/22/2016)		https://search.clinicalgenome.org/kb/gene-dosage/HGNC:17063	Dosage Working Group	definitive evidence (05/26/2020)	https://search.clinicalgenome.org/kb/gene-validity/CGGV:assertion_a1e4a47e-757a-442f-b82f-2ddfd69d0854-2020-05-26T135951.050Z	Brain Malformations			
MONDO:0010830	CLN8	HGNC:2079	https://search.clinicalgenome.org/kb/genes/HGNC:2079	neuronal ceroid lipofuscinosis 8	https://search.clinicalgenome.org/kb/conditions/MONDO:0010830		30 - Gene Associated with Autosomal Recessive Phenotype (08/22/2016)		https://search.clinicalgenome.org/kb/gene-dosage/HGNC:2079	Dosage Working Group						
MONDO:0010832	ARL6	HGNC:13210	https://search.clinicalgenome.org/kb/genes/HGNC:13210	Bardet-Biedl syndrome 3	https://search.clinicalgenome.org/kb/conditions/MONDO:0010832		30 - Gene Associated with Autosomal Recessive Phenotype (08/22/2016)	0 - No Evidence for Haploinsufficiency (08/22/2016)	https://search.clinicalgenome.org/kb/gene-dosage/HGNC:13210	Dosage Working Group						
MONDO:0010849	AQP5	HGNC:638	https://search.clinicalgenome.org/kb/genes/HGNC:638	palmoplantar keratoderma, Bothnian type	https://search.clinicalgenome.org/kb/conditions/MONDO:0010849	Autosomal dominant inheritance					moderate evidence (07/03/2018)	https://search.clinicalgenome.org/kb/gene-validity/CGGV:assertion_77aa086c-5551-4e23-9e35-7c4ff072e238-2018-07-03T141124.777Z	UNC Biocuration Core			
MONDO:0010860	MYO15A	HGNC:7594	https://search.clinicalgenome.org/kb/genes/HGNC:7594	autosomal recessive nonsyndromic hearing loss 3	https://search.clinicalgenome.org/kb/conditions/MONDO:0010860		30 - Gene Associated with Autosomal Recessive Phenotype (08/22/2016)		https://search.clinicalgenome.org/kb/gene-dosage/HGNC:7594	Dosage Working Group				Strong Actionability (10/29/2020)	https://search.clinicalgenome.org/kb/gene-validity/https://actionability.clinicalgenome.org/ac/Pediatric/ui/stg2SummaryRpt?doc=AC1018	Pediatric Actionability Working Group
MONDO:0010870	TTN	HGNC:12403	https://search.clinicalgenome.org/kb/genes/HGNC:12403	tibial muscular dystrophy	https://search.clinicalgenome.org/kb/conditions/MONDO:0010870	Autosomal dominant inheritance	3 - Sufficient Evidence for Haploinsufficiency (08/02/2021)	0 - No Evidence for Haploinsufficiency (08/02/2021)	https://search.clinicalgenome.org/kb/gene-dosage/HGNC:12403	Dosage Working Group	moderate evidence (03/14/2022)	https://search.clinicalgenome.org/kb/gene-validity/CGGV:assertion_ec556f45-8dbc-43f0-96df-29e69d7f3411-2022-03-14T205017.462Z	Congenital Myopathies			
MONDO:0010880	ACVRL1	HGNC:175	https://search.clinicalgenome.org/kb/genes/HGNC:175	telangiectasia, hereditary hemorrhagic, type 2	https://search.clinicalgenome.org/kb/conditions/MONDO:0010880	Autosomal dominant inheritance	3 - Sufficient Evidence for Haploinsufficiency (11/10/2016)	0 - No Evidence for Haploinsufficiency (11/10/2016)	https://search.clinicalgenome.org/kb/gene-dosage/HGNC:175	Dosage Working Group	definitive evidence (08/28/2019)	https://search.clinicalgenome.org/kb/gene-validity/CGGV:assertion_fbbb72c5-84a0-4096-8d49-6df506cfee0e-2019-08-28T160000.000Z	Hemostasis Thrombosis	Assertion Pending (12/07/2015)	https://search.clinicalgenome.org/kb/gene-validity/https://actionability.clinicalgenome.org/ac/Adult/ui/stg2SummaryRpt?doc=AC107	Adult Actionability Working Group
MONDO:0010886	HDAC4	HGNC:14063	https://search.clinicalgenome.org/kb/genes/HGNC:14063	2q37 microdeletion syndrome	https://search.clinicalgenome.org/kb/conditions/MONDO:0010886		1 - Little Evidence for Haploinsufficiency (11/07/2011)	0 - No Evidence for Haploinsufficiency (11/07/2011)	https://search.clinicalgenome.org/kb/gene-dosage/HGNC:14063	Dosage Working Group						
MONDO:0010894	HNF1A	HGNC:11621	https://search.clinicalgenome.org/kb/genes/HGNC:11621	maturity-onset diabetes of the young type 3	https://search.clinicalgenome.org/kb/conditions/MONDO:0010894									Assertion Pending (08/26/2015)	https://search.clinicalgenome.org/kb/gene-validity/https://actionability.clinicalgenome.org/ac/Adult/ui/stg2SummaryRpt?doc=AC075	Adult Actionability Working Group
MONDO:0010898	LGI1	HGNC:6572	https://search.clinicalgenome.org/kb/genes/HGNC:6572	Autosomal dominant epilepsy with auditory features	https://search.clinicalgenome.org/kb/conditions/MONDO:0010898	Autosomal dominant inheritance					definitive evidence (07/07/2020)	https://search.clinicalgenome.org/kb/gene-validity/CGGV:assertion_662936d4-11a7-43f3-9daf-4ba1a7c92ffe-2020-07-07T183907.849Z	Epilepsy			
MONDO:0010907	TDO2	HGNC:11708	https://search.clinicalgenome.org/kb/genes/HGNC:11708	familial hypertryptophanemia	https://search.clinicalgenome.org/kb/conditions/MONDO:0010907	Autosomal recessive inheritance					limited evidence (07/10/2020)	https://search.clinicalgenome.org/kb/gene-validity/CGGV:assertion_b20a4b6d-c43c-4397-bbd2-3d4c6ea6f0e0-2020-07-10T165838.141Z	Aminoacidopathy			
MONDO:0010914	CPT2	HGNC:2330	https://search.clinicalgenome.org/kb/genes/HGNC:2330	carnitine palmitoyl transferase II deficiency, severe infantile form	https://search.clinicalgenome.org/kb/conditions/MONDO:0010914									Moderate Actionability (12/26/2020) | Moderate Actionability (12/26/2020)	https://search.clinicalgenome.org/kb/gene-validity/https://actionability.clinicalgenome.org/ac/Adult/ui/stg2SummaryRpt?doc=AC1022 | https://search.clinicalgenome.org/kb/gene-validity/https://actionability.clinicalgenome.org/ac/Pediatric/ui/stg2SummaryRpt?doc=AC1022	Adult Actionability Working Group | Pediatric Actionability Working Group
MONDO:0010916	GANAB	HGNC:4138	https://search.clinicalgenome.org/kb/genes/HGNC:4138	polycystic kidney disease 3 with or without polycystic liver disease	https://search.clinicalgenome.org/kb/conditions/MONDO:0010916	Autosomal dominant inheritance					definitive evidence (09/09/2020)	https://search.clinicalgenome.org/kb/gene-validity/CGGV:assertion_e6392961-a64a-4818-903a-0bf88b32e736-2020-09-09T160000.000Z	Kidney Cystic and Ciliopathy Disorders	Moderate Actionability (11/05/2018)	https://search.clinicalgenome.org/kb/gene-validity/https://actionability.clinicalgenome.org/ac/Adult/ui/stg2SummaryRpt?doc=AC037	Adult Actionability Working Group
MONDO:0010929	ERF	HGNC:3444	https://search.clinicalgenome.org/kb/genes/HGNC:3444	craniosynostosis 4	https://search.clinicalgenome.org/kb/conditions/MONDO:0010929	Autosomal dominant inheritance	3 - Sufficient Evidence for Haploinsufficiency (06/08/2021)	0 - No Evidence for Haploinsufficiency (06/08/2021)	https://search.clinicalgenome.org/kb/gene-dosage/HGNC:3444	Dosage Working Group	definitive evidence (06/12/2021)	https://search.clinicalgenome.org/kb/gene-validity/CGGV:assertion_1954ba97-532a-4ef3-9d62-c4ebfd252084-2021-06-12T062024.684Z	Craniofacial Malformations			
MONDO:0010938	JAK3	HGNC:6193	https://search.clinicalgenome.org/kb/genes/HGNC:6193	T-B+ severe combined immunodeficiency due to JAK3 deficiency	https://search.clinicalgenome.org/kb/conditions/MONDO:0010938	Autosomal recessive inheritance					definitive evidence (12/18/2020)	https://search.clinicalgenome.org/kb/gene-validity/CGGV:assertion_669dcacf-8423-4507-a36c-feab049737b3-2020-12-18T200520.841Z	SCID-CID			
MONDO:0010946	PRKAG2	HGNC:9386	https://search.clinicalgenome.org/kb/genes/HGNC:9386	hypertrophic cardiomyopathy 6	https://search.clinicalgenome.org/kb/conditions/MONDO:0010946		0 - No Evidence for Haploinsufficiency (11/05/2015)	0 - No Evidence for Haploinsufficiency (11/05/2015)	https://search.clinicalgenome.org/kb/gene-dosage/HGNC:9386	Dosage Working Group				Assertion Pending (08/14/2017)	https://search.clinicalgenome.org/kb/gene-validity/https://actionability.clinicalgenome.org/ac/Adult/ui/stg2SummaryRpt?doc=AC056	Adult Actionability Working Group
MONDO:0010953	FANCE	HGNC:3586	https://search.clinicalgenome.org/kb/genes/HGNC:3586	Fanconi anemia complementation group E	https://search.clinicalgenome.org/kb/conditions/MONDO:0010953	Autosomal recessive inheritance	30 - Gene Associated with Autosomal Recessive Phenotype (06/12/2020)	0 - No Evidence for Haploinsufficiency (06/12/2020)	https://search.clinicalgenome.org/kb/gene-dosage/HGNC:3586	Dosage Working Group	definitive evidence (05/14/2020)	https://search.clinicalgenome.org/kb/gene-validity/CGGV:assertion_6da55a6e-2cf8-499c-b842-b5a435dbff3f-2020-05-14T001745.604Z	Hereditary Cancer			
MONDO:0010959	SCARF2	HGNC:19869	https://search.clinicalgenome.org/kb/genes/HGNC:19869	van den Ende-Gupta syndrome	https://search.clinicalgenome.org/kb/conditions/MONDO:0010959		30 - Gene Associated with Autosomal Recessive Phenotype (08/22/2016)	0 - No Evidence for Haploinsufficiency (08/22/2016)	https://search.clinicalgenome.org/kb/gene-dosage/HGNC:19869	Dosage Working Group						
MONDO:0010965	TMIE	HGNC:30800	https://search.clinicalgenome.org/kb/genes/HGNC:30800	autosomal recessive nonsyndromic hearing loss 6	https://search.clinicalgenome.org/kb/conditions/MONDO:0010965									Strong Actionability (10/29/2020)	https://search.clinicalgenome.org/kb/gene-validity/https://actionability.clinicalgenome.org/ac/Pediatric/ui/stg2SummaryRpt?doc=AC1018	Pediatric Actionability Working Group
MONDO:0010966	SLC26A2	HGNC:10994	https://search.clinicalgenome.org/kb/genes/HGNC:10994	achondrogenesis type IB	https://search.clinicalgenome.org/kb/conditions/MONDO:0010966	Autosomal recessive inheritance					definitive evidence (08/03/2020)	https://search.clinicalgenome.org/kb/gene-validity/CGGV:assertion_392a7ac1-7ef5-45c7-97e0-2c1c1bd7884d-2020-08-03T160000.000Z	Skeletal Disorders			
MONDO:0010967	TMC1	HGNC:16513	https://search.clinicalgenome.org/kb/genes/HGNC:16513	autosomal recessive nonsyndromic hearing loss 7	https://search.clinicalgenome.org/kb/conditions/MONDO:0010967	Autosomal recessive inheritance					definitive evidence (02/15/2017)	https://search.clinicalgenome.org/kb/gene-validity/CGGCIEX:assertion_5658	Hearing Loss	Strong Actionability (10/29/2020)	https://search.clinicalgenome.org/kb/gene-validity/https://actionability.clinicalgenome.org/ac/Pediatric/ui/stg2SummaryRpt?doc=AC1018	Pediatric Actionability Working Group
MONDO:0010977	ATP2A1	HGNC:811	https://search.clinicalgenome.org/kb/genes/HGNC:811	Brody myopathy	https://search.clinicalgenome.org/kb/conditions/MONDO:0010977		30 - Gene Associated with Autosomal Recessive Phenotype (08/22/2016)	0 - No Evidence for Haploinsufficiency (08/22/2016)	https://search.clinicalgenome.org/kb/gene-dosage/HGNC:811	Dosage Working Group						
MONDO:0010986	OTOF	HGNC:8515	https://search.clinicalgenome.org/kb/genes/HGNC:8515	autosomal recessive nonsyndromic hearing loss 9	https://search.clinicalgenome.org/kb/conditions/MONDO:0010986	Autosomal recessive inheritance	30 - Gene Associated with Autosomal Recessive Phenotype (08/22/2016)		https://search.clinicalgenome.org/kb/gene-dosage/HGNC:8515	Dosage Working Group	definitive evidence (01/30/2017)	https://search.clinicalgenome.org/kb/gene-validity/CGGCIEX:assertion_5613	Hearing Loss			
MONDO:0010987	TMPRSS3	HGNC:11877	https://search.clinicalgenome.org/kb/genes/HGNC:11877	autosomal recessive nonsyndromic hearing loss 8	https://search.clinicalgenome.org/kb/conditions/MONDO:0010987		30 - Gene Associated with Autosomal Recessive Phenotype (08/22/2016)	0 - No Evidence for Haploinsufficiency (08/22/2016)	https://search.clinicalgenome.org/kb/gene-dosage/HGNC:11877	Dosage Working Group						
MONDO:0010995	LITAF	HGNC:16841	https://search.clinicalgenome.org/kb/genes/HGNC:16841	Charcot-Marie-Tooth disease type 1C	https://search.clinicalgenome.org/kb/conditions/MONDO:0010995		0 - No Evidence for Haploinsufficiency (10/21/2016)	0 - No Evidence for Haploinsufficiency (10/21/2016)	https://search.clinicalgenome.org/kb/gene-dosage/HGNC:16841	Dosage Working Group				Assertion Pending (12/20/2017)	https://search.clinicalgenome.org/kb/gene-validity/https://actionability.clinicalgenome.org/ac/Adult/ui/stg2SummaryRpt?doc=AC129	Adult Actionability Working Group
MONDO:0011001	CACNA2D1	HGNC:1399	https://search.clinicalgenome.org/kb/genes/HGNC:1399	Brugada syndrome 1	https://search.clinicalgenome.org/kb/conditions/MONDO:0011001	Autosomal dominant inheritance					disputing (11/21/2017)	https://search.clinicalgenome.org/kb/gene-validity/CGGCIEX:assertion_10147	Brugada Syndrome			
MONDO:0011014	DICER1	HGNC:17098	https://search.clinicalgenome.org/kb/genes/HGNC:17098	pleuropulmonary blastoma	https://search.clinicalgenome.org/kb/conditions/MONDO:0011014	Autosomal dominant inheritance	3 - Sufficient Evidence for Haploinsufficiency (02/09/2022)	0 - No Evidence for Haploinsufficiency (02/09/2022)	https://search.clinicalgenome.org/kb/gene-dosage/HGNC:17098	Dosage Working Group	definitive evidence (01/08/2017)	https://search.clinicalgenome.org/kb/gene-validity/CGGCIEX:assertion_3212	General Gene Curation	Assertion Pending (05/29/2019) | Moderate Actionability (05/29/2019)	https://search.clinicalgenome.org/kb/gene-validity/https://actionability.clinicalgenome.org/ac/Adult/ui/stg2SummaryRpt?doc=AC002 | https://search.clinicalgenome.org/kb/gene-validity/https://actionability.clinicalgenome.org/ac/Pediatric/ui/stg2SummaryRpt?doc=AC002	Adult Actionability Working Group | Pediatric Actionability Working Group
MONDO:0011023	GREM1	HGNC:2001	https://search.clinicalgenome.org/kb/genes/HGNC:2001	hereditary mixed polyposis syndrome	https://search.clinicalgenome.org/kb/conditions/MONDO:0011023	Autosomal dominant inheritance	0 - No Evidence for Haploinsufficiency (08/20/2020)	0 - No Evidence for Haploinsufficiency (08/20/2020)	https://search.clinicalgenome.org/kb/gene-dosage/HGNC:2001	Dosage Working Group	strong evidence (10/11/2016)	https://search.clinicalgenome.org/kb/gene-validity/CGGCIEX:assertion_8444	Colon Cancer	Limited Actionability (08/03/2018)	https://search.clinicalgenome.org/kb/gene-validity/https://actionability.clinicalgenome.org/ac/Adult/ui/stg2SummaryRpt?doc=AC154	Adult Actionability Working Group
MONDO:0011025	ATCAY	HGNC:779	https://search.clinicalgenome.org/kb/genes/HGNC:779	Cayman type cerebellar ataxia	https://search.clinicalgenome.org/kb/conditions/MONDO:0011025		30 - Gene Associated with Autosomal Recessive Phenotype (08/22/2016)		https://search.clinicalgenome.org/kb/gene-dosage/HGNC:779	Dosage Working Group						
MONDO:0011031	EYA4	HGNC:3522	https://search.clinicalgenome.org/kb/genes/HGNC:3522	autosomal dominant nonsyndromic hearing loss 10	https://search.clinicalgenome.org/kb/conditions/MONDO:0011031		3 - Sufficient Evidence for Haploinsufficiency (01/22/2020)	0 - No Evidence for Haploinsufficiency (01/22/2020)	https://search.clinicalgenome.org/kb/gene-dosage/HGNC:3522	Dosage Working Group						
MONDO:0011053	SMARCA2	HGNC:11098	https://search.clinicalgenome.org/kb/genes/HGNC:11098	intellectual disability-sparse hair-brachydactyly syndrome	https://search.clinicalgenome.org/kb/conditions/MONDO:0011053	Autosomal dominant inheritance	0 - No Evidence for Haploinsufficiency (03/27/2013)	0 - No Evidence for Haploinsufficiency (03/27/2013)	https://search.clinicalgenome.org/kb/gene-dosage/HGNC:11098	Dosage Working Group	definitive evidence (08/18/2020)	https://search.clinicalgenome.org/kb/gene-validity/CGGV:assertion_5cde86bc-f99f-40cf-8c32-eac9f8f8a67d-2020-08-18T160000.000Z	Intellectual Disability and Autism			
MONDO:0011066	MTMR2	HGNC:7450	https://search.clinicalgenome.org/kb/genes/HGNC:7450	Charcot-Marie-Tooth disease type 4B1	https://search.clinicalgenome.org/kb/conditions/MONDO:0011066		30 - Gene Associated with Autosomal Recessive Phenotype (08/22/2016)		https://search.clinicalgenome.org/kb/gene-dosage/HGNC:7450	Dosage Working Group						
MONDO:0011067	CDH23	HGNC:13733	https://search.clinicalgenome.org/kb/genes/HGNC:13733	autosomal recessive nonsyndromic hearing loss 12	https://search.clinicalgenome.org/kb/conditions/MONDO:0011067		30 - Gene Associated with Autosomal Recessive Phenotype (08/22/2016)		https://search.clinicalgenome.org/kb/gene-dosage/HGNC:13733	Dosage Working Group				Strong Actionability (10/29/2020)	https://search.clinicalgenome.org/kb/gene-validity/https://actionability.clinicalgenome.org/ac/Pediatric/ui/stg2SummaryRpt?doc=AC1018	Pediatric Actionability Working Group
MONDO:0011071	RUNX1	HGNC:10471	https://search.clinicalgenome.org/kb/genes/HGNC:10471	hereditary thrombocytopenia and hematologic cancer predisposition syndrome	https://search.clinicalgenome.org/kb/conditions/MONDO:0011071	Autosomal dominant inheritance	3 - Sufficient Evidence for Haploinsufficiency (08/14/2012)	0 - No Evidence for Haploinsufficiency (08/14/2012)	https://search.clinicalgenome.org/kb/gene-dosage/HGNC:10471	Dosage Working Group	definitive evidence (06/04/2018)	https://search.clinicalgenome.org/kb/gene-validity/CGGV:assertion_06aed341-58db-459b-a750-7142e29b420b-2018-06-04T194655.831Z	Hereditary Cancer			
MONDO:0011076	DES	HGNC:2770	https://search.clinicalgenome.org/kb/genes/HGNC:2770	myofibrillar myopathy 1	https://search.clinicalgenome.org/kb/conditions/MONDO:0011076									Moderate Actionability (09/06/2018)	https://search.clinicalgenome.org/kb/gene-validity/https://actionability.clinicalgenome.org/ac/Adult/ui/stg2SummaryRpt?doc=AC155	Adult Actionability Working Group
MONDO:0011077	RUNX1	HGNC:10471	https://search.clinicalgenome.org/kb/genes/HGNC:10471	microcephaly, corpus callosum dysgenesis, and cleft lip/palate	https://search.clinicalgenome.org/kb/conditions/MONDO:0011077		3 - Sufficient Evidence for Haploinsufficiency (08/14/2012)	0 - No Evidence for Haploinsufficiency (08/14/2012)	https://search.clinicalgenome.org/kb/gene-dosage/HGNC:10471	Dosage Working Group				Moderate Actionability (09/02/2021) | Moderate Actionability (09/02/2021)	https://search.clinicalgenome.org/kb/gene-validity/https://actionability.clinicalgenome.org/ac/Adult/ui/stg2SummaryRpt?doc=AC1042 | https://search.clinicalgenome.org/kb/gene-validity/https://actionability.clinicalgenome.org/ac/Pediatric/ui/stg2SummaryRpt?doc=AC1042	Adult Actionability Working Group | Pediatric Actionability Working Group
MONDO:0011085	NDRG1	HGNC:7679	https://search.clinicalgenome.org/kb/genes/HGNC:7679	Charcot-Marie-Tooth disease type 4D	https://search.clinicalgenome.org/kb/conditions/MONDO:0011085		30 - Gene Associated with Autosomal Recessive Phenotype (08/22/2016)		https://search.clinicalgenome.org/kb/gene-dosage/HGNC:7679	Dosage Working Group						
MONDO:0011095	TNNT2	HGNC:11949	https://search.clinicalgenome.org/kb/genes/HGNC:11949	dilated cardiomyopathy 1D	https://search.clinicalgenome.org/kb/conditions/MONDO:0011095		0 - No Evidence for Haploinsufficiency (11/16/2015)	0 - No Evidence for Haploinsufficiency (11/16/2015)	https://search.clinicalgenome.org/kb/gene-dosage/HGNC:11949	Dosage Working Group				Assertion Pending (08/14/2017)	https://search.clinicalgenome.org/kb/gene-validity/https://actionability.clinicalgenome.org/ac/Adult/ui/stg2SummaryRpt?doc=AC138	Adult Actionability Working Group
MONDO:0011102	TECTA	HGNC:11720	https://search.clinicalgenome.org/kb/genes/HGNC:11720	autosomal dominant nonsyndromic hearing loss 12	https://search.clinicalgenome.org/kb/conditions/MONDO:0011102		30 - Gene Associated with Autosomal Recessive Phenotype (02/07/2018)	0 - No Evidence for Haploinsufficiency (02/07/2018)	https://search.clinicalgenome.org/kb/gene-dosage/HGNC:11720	Dosage Working Group				Strong Actionability (10/29/2020)	https://search.clinicalgenome.org/kb/gene-validity/https://actionability.clinicalgenome.org/ac/Pediatric/ui/stg2SummaryRpt?doc=AC1018	Pediatric Actionability Working Group
MONDO:0011106	ASPH	HGNC:757	https://search.clinicalgenome.org/kb/genes/HGNC:757	facial dysmorphism-lens dislocation-anterior segment abnormalities-spontaneous filtering blebs syndrome	https://search.clinicalgenome.org/kb/conditions/MONDO:0011106		30 - Gene Associated with Autosomal Recessive Phenotype (08/22/2016)		https://search.clinicalgenome.org/kb/gene-dosage/HGNC:757	Dosage Working Group						
MONDO:0011108	LIFR	HGNC:6597	https://search.clinicalgenome.org/kb/genes/HGNC:6597	Stve-Wiedemann syndrome	https://search.clinicalgenome.org/kb/conditions/MONDO:0011108	Autosomal recessive inheritance					definitive evidence (07/27/2021)	https://search.clinicalgenome.org/kb/gene-validity/CGGV:assertion_9e336431-a56a-4144-8554-6fe62e4cb298-2021-07-27T145127.876Z	Syndromic Disorders			
MONDO:0011113	SH3TC2	HGNC:29427	https://search.clinicalgenome.org/kb/genes/HGNC:29427	Charcot-Marie-Tooth disease type 4C	https://search.clinicalgenome.org/kb/conditions/MONDO:0011113		30 - Gene Associated with Autosomal Recessive Phenotype (08/22/2016)		https://search.clinicalgenome.org/kb/gene-dosage/HGNC:29427	Dosage Working Group						
MONDO:0011121	SDHAF2	HGNC:26034	https://search.clinicalgenome.org/kb/genes/HGNC:26034	paragangliomas 2	https://search.clinicalgenome.org/kb/conditions/MONDO:0011121		2 - Emerging Evidence for Haploinsufficiency (01/14/2016)	0 - No Evidence for Haploinsufficiency (01/14/2016)	https://search.clinicalgenome.org/kb/gene-dosage/HGNC:26034	Dosage Working Group				Strong Actionability (10/31/2017)	https://search.clinicalgenome.org/kb/gene-validity/https://actionability.clinicalgenome.org/ac/Adult/ui/stg2SummaryRpt?doc=AC150	Adult Actionability Working Group
MONDO:0011132	FOXN1	HGNC:12765	https://search.clinicalgenome.org/kb/genes/HGNC:12765	T-cell immunodeficiency, congenital alopecia, and nail dystrophy	https://search.clinicalgenome.org/kb/conditions/MONDO:0011132	Semidominant inheritance					definitive evidence (11/05/2021)	https://search.clinicalgenome.org/kb/gene-validity/CGGV:assertion_4518c986-fb1d-4f9a-a24a-ab38891a0162-2021-11-05T181626.460Z	SCID-CID			
MONDO:0011136	PLAU	HGNC:9052	https://search.clinicalgenome.org/kb/genes/HGNC:9052	Quebec platelet disorder	https://search.clinicalgenome.org/kb/conditions/MONDO:0011136	Autosomal dominant inheritance					moderate evidence (01/05/2022)	https://search.clinicalgenome.org/kb/gene-validity/CGGV:assertion_6ffd0133-1004-4a53-b38d-940c257e56c1-2022-01-05T160123.087Z	Hemostasis Thrombosis			
MONDO:0011140	CHRNA2	HGNC:1956	https://search.clinicalgenome.org/kb/genes/HGNC:1956	obsolete benign familial neonatal-infantile seizures	https://search.clinicalgenome.org/kb/conditions/MONDO:0011140	Autosomal dominant inheritance					disputing (01/07/2020)	https://search.clinicalgenome.org/kb/gene-validity/CGGV:assertion_7916abab-d963-4e9c-8913-1decc21b680c-2020-01-07T170000.000Z	Epilepsy			
MONDO:0011151	LRP5	HGNC:6697	https://search.clinicalgenome.org/kb/genes/HGNC:6697	exudative vitreoretinopathy 4	https://search.clinicalgenome.org/kb/conditions/MONDO:0011151		2 - Emerging Evidence for Haploinsufficiency (12/20/2021)	0 - No Evidence for Haploinsufficiency (12/20/2021)	https://search.clinicalgenome.org/kb/gene-dosage/HGNC:6697	Dosage Working Group						
MONDO:0011156	ABCB11	HGNC:42	https://search.clinicalgenome.org/kb/genes/HGNC:42	progressive familial intrahepatic cholestasis type 2	https://search.clinicalgenome.org/kb/conditions/MONDO:0011156		30 - Gene Associated with Autosomal Recessive Phenotype (07/08/2020)	0 - No Evidence for Haploinsufficiency (07/08/2020)	https://search.clinicalgenome.org/kb/gene-dosage/HGNC:42	Dosage Working Group						
MONDO:0011158	FASLG	HGNC:11936	https://search.clinicalgenome.org/kb/genes/HGNC:11936	autoimmune lymphoproliferative syndrome type 1	https://search.clinicalgenome.org/kb/conditions/MONDO:0011158		30 - Gene Associated with Autosomal Recessive Phenotype (08/25/2016)	0 - No Evidence for Haploinsufficiency (08/25/2016)	https://search.clinicalgenome.org/kb/gene-dosage/HGNC:11936	Dosage Working Group						
MONDO:0011160	GIPC3	HGNC:18183	https://search.clinicalgenome.org/kb/genes/HGNC:18183	autosomal recessive nonsyndromic hearing loss 15	https://search.clinicalgenome.org/kb/conditions/MONDO:0011160		30 - Gene Associated with Autosomal Recessive Phenotype (08/22/2016)	0 - No Evidence for Haploinsufficiency (08/22/2016)	https://search.clinicalgenome.org/kb/gene-dosage/HGNC:18183	Dosage Working Group				Strong Actionability (10/29/2020)	https://search.clinicalgenome.org/kb/gene-validity/https://actionability.clinicalgenome.org/ac/Pediatric/ui/stg2SummaryRpt?doc=AC1018	Pediatric Actionability Working Group
MONDO:0011163	CACNA1S	HGNC:1397	https://search.clinicalgenome.org/kb/genes/HGNC:1397	malignant hyperthermia, susceptibility to, 5	https://search.clinicalgenome.org/kb/conditions/MONDO:0011163		0 - No Evidence for Haploinsufficiency (01/18/2016)	0 - No Evidence for Haploinsufficiency (01/18/2016)	https://search.clinicalgenome.org/kb/gene-dosage/HGNC:1397	Dosage Working Group				Strong Actionability (01/12/2021) | Strong Actionability (01/12/2021)	https://search.clinicalgenome.org/kb/gene-validity/https://actionability.clinicalgenome.org/ac/Adult/ui/stg2SummaryRpt?doc=AC076 | https://search.clinicalgenome.org/kb/gene-validity/https://actionability.clinicalgenome.org/ac/Pediatric/ui/stg2SummaryRpt?doc=AC076	Adult Actionability Working Group | Pediatric Actionability Working Group
MONDO:0011169	POMP	HGNC:20330	https://search.clinicalgenome.org/kb/genes/HGNC:20330	keratosis linearis-ichthyosis congenita-sclerosing keratoderma syndrome	https://search.clinicalgenome.org/kb/conditions/MONDO:0011169		30 - Gene Associated with Autosomal Recessive Phenotype (08/27/2015)	0 - No Evidence for Haploinsufficiency (08/27/2015)	https://search.clinicalgenome.org/kb/gene-dosage/HGNC:20330	Dosage Working Group						
MONDO:0011170	TCAP	HGNC:11610	https://search.clinicalgenome.org/kb/genes/HGNC:11610	autosomal recessive limb-girdle muscular dystrophy type 2G	https://search.clinicalgenome.org/kb/conditions/MONDO:0011170	Autosomal recessive inheritance					definitive evidence (10/12/2021)	https://search.clinicalgenome.org/kb/gene-validity/CGGV:assertion_f3c6c72e-7c2b-42d4-963b-aeddbbe0e4fc-2021-10-12T160000.000Z	Limb Girdle Muscular Dystrophy			
MONDO:0011173	MPL	HGNC:7217	https://search.clinicalgenome.org/kb/genes/HGNC:7217	thrombocythemia 2	https://search.clinicalgenome.org/kb/conditions/MONDO:0011173	Autosomal dominant inheritance					definitive evidence (07/22/2020)	https://search.clinicalgenome.org/kb/gene-validity/CGGV:assertion_23b39955-2760-46aa-978b-d27d4a212567-2020-07-22T160000.000Z	Hemostasis Thrombosis			
MONDO:0011178	PRRT2	HGNC:30500	https://search.clinicalgenome.org/kb/genes/HGNC:30500	infantile convulsions and choreoathetosis	https://search.clinicalgenome.org/kb/conditions/MONDO:0011178	Autosomal dominant inheritance	3 - Sufficient Evidence for Haploinsufficiency (12/14/2021)	0 - No Evidence for Haploinsufficiency (12/14/2021)	https://search.clinicalgenome.org/kb/gene-dosage/HGNC:30500	Dosage Working Group	definitive evidence (01/21/2020)	https://search.clinicalgenome.org/kb/gene-validity/CGGV:assertion_62af25b8-b9a4-421f-b897-4fc222569618-2020-01-21T213814.191Z	Epilepsy			
MONDO:0011182	FMO3	HGNC:3771	https://search.clinicalgenome.org/kb/genes/HGNC:3771	trimethylaminuria	https://search.clinicalgenome.org/kb/conditions/MONDO:0011182	Autosomal recessive inheritance					definitive evidence (08/14/2020)	https://search.clinicalgenome.org/kb/gene-validity/CGGV:assertion_18ed3960-c745-46f1-aecc-155e713d6ef5-2020-08-14T184718.502Z	Aminoacidopathy			
MONDO:0011186	PCDH15	HGNC:14674	https://search.clinicalgenome.org/kb/genes/HGNC:14674	Usher syndrome type 1F	https://search.clinicalgenome.org/kb/conditions/MONDO:0011186		30 - Gene Associated with Autosomal Recessive Phenotype (08/22/2016)	0 - No Evidence for Haploinsufficiency (08/22/2016)	https://search.clinicalgenome.org/kb/gene-dosage/HGNC:14674	Dosage Working Group						
MONDO:0011190	INVS	HGNC:17870	https://search.clinicalgenome.org/kb/genes/HGNC:17870	nephronophthisis 2	https://search.clinicalgenome.org/kb/conditions/MONDO:0011190	Autosomal recessive inheritance					definitive evidence (02/24/2021)	https://search.clinicalgenome.org/kb/gene-validity/CGGV:assertion_6bdaee2a-144d-4bdf-a5c7-78001b991174-2021-02-24T170000.000Z	Kidney Cystic and Ciliopathy Disorders			
MONDO:0011216	HJV	HGNC:4887	https://search.clinicalgenome.org/kb/genes/HGNC:4887	hemochromatosis type 2A	https://search.clinicalgenome.org/kb/conditions/MONDO:0011216		30 - Gene Associated with Autosomal Recessive Phenotype (08/22/2016)		https://search.clinicalgenome.org/kb/gene-dosage/HGNC:4887	Dosage Working Group						
MONDO:0011218	ST14	HGNC:11344	https://search.clinicalgenome.org/kb/genes/HGNC:11344	autosomal recessive congenital ichthyosis 11	https://search.clinicalgenome.org/kb/conditions/MONDO:0011218		30 - Gene Associated with Autosomal Recessive Phenotype (08/22/2016)	0 - No Evidence for Haploinsufficiency (08/22/2016)	https://search.clinicalgenome.org/kb/gene-dosage/HGNC:11344	Dosage Working Group						
MONDO:0011225	DCLRE1C	HGNC:17642	https://search.clinicalgenome.org/kb/genes/HGNC:17642	severe combined immunodeficiency due to DCLRE1C deficiency	https://search.clinicalgenome.org/kb/conditions/MONDO:0011225	Autosomal recessive inheritance	30 - Gene Associated with Autosomal Recessive Phenotype (08/22/2016)	0 - No Evidence for Haploinsufficiency (08/22/2016)	https://search.clinicalgenome.org/kb/gene-dosage/HGNC:17642	Dosage Working Group	definitive evidence (02/18/2021)	https://search.clinicalgenome.org/kb/gene-validity/CGGV:assertion_603e0855-2b57-4463-a9b7-1c5d70089a4f-2021-02-18T154301.245Z	SCID-CID			
MONDO:0011233	FOXC1	HGNC:3800	https://search.clinicalgenome.org/kb/genes/HGNC:3800	Axenfeld-Rieger syndrome type 3	https://search.clinicalgenome.org/kb/conditions/MONDO:0011233		3 - Sufficient Evidence for Haploinsufficiency (07/29/2020)	0 - No Evidence for Haploinsufficiency (07/29/2020)	https://search.clinicalgenome.org/kb/gene-dosage/HGNC:3800	Dosage Working Group						
MONDO:0011242	BSND	HGNC:16512	https://search.clinicalgenome.org/kb/genes/HGNC:16512	Bartter disease type 4a	https://search.clinicalgenome.org/kb/conditions/MONDO:0011242	Autosomal recessive inheritance	30 - Gene Associated with Autosomal Recessive Phenotype (05/17/2012)	0 - No Evidence for Haploinsufficiency (05/17/2012)	https://search.clinicalgenome.org/kb/gene-dosage/HGNC:16512	Dosage Working Group	definitive evidence (07/12/2018)	https://search.clinicalgenome.org/kb/gene-validity/CGGV:assertion_9b69acb1-93bc-4bc0-8a33-77bf64179c32-2018-07-12T205243.945Z	Hearing Loss			
MONDO:0011246	CHKB	HGNC:1938	https://search.clinicalgenome.org/kb/genes/HGNC:1938	megaconial type congenital muscular dystrophy	https://search.clinicalgenome.org/kb/conditions/MONDO:0011246		30 - Gene Associated with Autosomal Recessive Phenotype (08/22/2016)	0 - No Evidence for Haploinsufficiency (08/22/2016)	https://search.clinicalgenome.org/kb/gene-dosage/HGNC:1938	Dosage Working Group						
MONDO:0011268	ATP6V0A4	HGNC:866	https://search.clinicalgenome.org/kb/genes/HGNC:866	renal tubular acidosis, distal, 3, with or without sensorineural hearing loss	https://search.clinicalgenome.org/kb/conditions/MONDO:0011268		30 - Gene Associated with Autosomal Recessive Phenotype (08/22/2016)		https://search.clinicalgenome.org/kb/gene-dosage/HGNC:866	Dosage Working Group						
MONDO:0011272	EYS	HGNC:21555	https://search.clinicalgenome.org/kb/genes/HGNC:21555	retinitis pigmentosa 25	https://search.clinicalgenome.org/kb/conditions/MONDO:0011272		30 - Gene Associated with Autosomal Recessive Phenotype (08/22/2016)		https://search.clinicalgenome.org/kb/gene-dosage/HGNC:21555	Dosage Working Group						
MONDO:0011274	FGFR3	HGNC:3690	https://search.clinicalgenome.org/kb/genes/HGNC:3690	Muenke syndrome	https://search.clinicalgenome.org/kb/conditions/MONDO:0011274	Autosomal dominant inheritance	0 - No Evidence for Haploinsufficiency (11/09/2011)	0 - No Evidence for Haploinsufficiency (11/09/2011)	https://search.clinicalgenome.org/kb/gene-dosage/HGNC:3690	Dosage Working Group	definitive evidence (03/29/2022)	https://search.clinicalgenome.org/kb/gene-validity/CGGV:assertion_e94c1870-5413-4f75-8925-8bea54199d47-2022-03-29T172023.530Z	Craniofacial Malformations			
MONDO:0011281	COLQ	HGNC:2226	https://search.clinicalgenome.org/kb/genes/HGNC:2226	congenital myasthenic syndrome 5	https://search.clinicalgenome.org/kb/conditions/MONDO:0011281		30 - Gene Associated with Autosomal Recessive Phenotype (08/22/2016)	0 - No Evidence for Haploinsufficiency (08/22/2016)	https://search.clinicalgenome.org/kb/gene-dosage/HGNC:2226	Dosage Working Group						
MONDO:0011283	TYMP	HGNC:3148	https://search.clinicalgenome.org/kb/genes/HGNC:3148	mitochondrial DNA depletion syndrome 1	https://search.clinicalgenome.org/kb/conditions/MONDO:0011283		30 - Gene Associated with Autosomal Recessive Phenotype (08/22/2016)		https://search.clinicalgenome.org/kb/gene-dosage/HGNC:3148	Dosage Working Group						
MONDO:0011291	ALG6	HGNC:23157	https://search.clinicalgenome.org/kb/genes/HGNC:23157	congenital disorder of glycosylation type 1C	https://search.clinicalgenome.org/kb/conditions/MONDO:0011291		30 - Gene Associated with Autosomal Recessive Phenotype (08/22/2016)		https://search.clinicalgenome.org/kb/gene-dosage/HGNC:23157	Dosage Working Group						
MONDO:0011304	CCM2	HGNC:21708	https://search.clinicalgenome.org/kb/genes/HGNC:21708	cerebral cavernous malformation 2	https://search.clinicalgenome.org/kb/conditions/MONDO:0011304									Assertion Pending (04/04/2017)	https://search.clinicalgenome.org/kb/gene-validity/https://actionability.clinicalgenome.org/ac/Adult/ui/stg2SummaryRpt?doc=AC116	Adult Actionability Working Group
MONDO:0011305	PDCD10	HGNC:8761	https://search.clinicalgenome.org/kb/genes/HGNC:8761	cerebral cavernous malformation 3	https://search.clinicalgenome.org/kb/conditions/MONDO:0011305									Assertion Pending (04/04/2017)	https://search.clinicalgenome.org/kb/gene-validity/https://actionability.clinicalgenome.org/ac/Adult/ui/stg2SummaryRpt?doc=AC116	Adult Actionability Working Group
MONDO:0011325	FANCF	HGNC:3587	https://search.clinicalgenome.org/kb/genes/HGNC:3587	Fanconi anemia complementation group F	https://search.clinicalgenome.org/kb/conditions/MONDO:0011325	Autosomal recessive inheritance	30 - Gene Associated with Autosomal Recessive Phenotype (08/22/2016)	0 - No Evidence for Haploinsufficiency (08/22/2016)	https://search.clinicalgenome.org/kb/gene-dosage/HGNC:3587	Dosage Working Group	definitive evidence (02/03/2021)	https://search.clinicalgenome.org/kb/gene-validity/CGGV:assertion_60719ed8-36fa-4d11-93b2-8036133510a6-2021-02-03T225456.822Z	Hereditary Cancer			
MONDO:0011326	SLC25A13	HGNC:10983	https://search.clinicalgenome.org/kb/genes/HGNC:10983	citrullinemia, type II, adult-onset	https://search.clinicalgenome.org/kb/conditions/MONDO:0011326		30 - Gene Associated with Autosomal Recessive Phenotype (08/22/2016)		https://search.clinicalgenome.org/kb/gene-dosage/HGNC:10983	Dosage Working Group				Assertion Pending (12/13/2016)	https://search.clinicalgenome.org/kb/gene-validity/https://actionability.clinicalgenome.org/ac/Adult/ui/stg2SummaryRpt?doc=AC118	Adult Actionability Working Group
MONDO:0011336	STX11	HGNC:11429	https://search.clinicalgenome.org/kb/genes/HGNC:11429	familial hemophagocytic lymphohistiocytosis 4	https://search.clinicalgenome.org/kb/conditions/MONDO:0011336		30 - Gene Associated with Autosomal Recessive Phenotype (08/22/2016)		https://search.clinicalgenome.org/kb/gene-dosage/HGNC:11429	Dosage Working Group						
MONDO:0011338	RAG2	HGNC:9832	https://search.clinicalgenome.org/kb/genes/HGNC:9832	Omenn syndrome	https://search.clinicalgenome.org/kb/conditions/MONDO:0011338		30 - Gene Associated with Autosomal Recessive Phenotype (08/22/2016)		https://search.clinicalgenome.org/kb/gene-dosage/HGNC:9832	Dosage Working Group						
MONDO:0011351	TECTA	HGNC:11720	https://search.clinicalgenome.org/kb/genes/HGNC:11720	autosomal recessive nonsyndromic hearing loss 21	https://search.clinicalgenome.org/kb/conditions/MONDO:0011351		30 - Gene Associated with Autosomal Recessive Phenotype (02/07/2018)	0 - No Evidence for Haploinsufficiency (02/07/2018)	https://search.clinicalgenome.org/kb/gene-dosage/HGNC:11720	Dosage Working Group				Strong Actionability (10/29/2020)	https://search.clinicalgenome.org/kb/gene-validity/https://actionability.clinicalgenome.org/ac/Pediatric/ui/stg2SummaryRpt?doc=AC1018	Pediatric Actionability Working Group
MONDO:0011362	TTN	HGNC:12403	https://search.clinicalgenome.org/kb/genes/HGNC:12403	myopathy, myofibrillar, 9, with early respiratory failure	https://search.clinicalgenome.org/kb/conditions/MONDO:0011362	Autosomal dominant inheritance	3 - Sufficient Evidence for Haploinsufficiency (08/02/2021)	0 - No Evidence for Haploinsufficiency (08/02/2021)	https://search.clinicalgenome.org/kb/gene-dosage/HGNC:12403	Dosage Working Group	moderate evidence (03/14/2022)	https://search.clinicalgenome.org/kb/gene-validity/CGGV:assertion_bade9ef3-17fa-42ee-a2d7-9c9b985b1503-2022-03-14T205117.630Z	Congenital Myopathies			
MONDO:0011364	PPIP5K1	HGNC:29023	https://search.clinicalgenome.org/kb/genes/HGNC:29023	autosomal recessive nonsyndromic hearing loss 16	https://search.clinicalgenome.org/kb/conditions/MONDO:0011364		30 - Gene Associated with Autosomal Recessive Phenotype (08/27/2012)	0 - No Evidence for Haploinsufficiency (08/27/2012)	https://search.clinicalgenome.org/kb/gene-dosage/HGNC:29023	Dosage Working Group						
MONDO:0011365	KAT6B	HGNC:17582	https://search.clinicalgenome.org/kb/genes/HGNC:17582	blepharophimosis - intellectual disability syndrome, SBBYS type	https://search.clinicalgenome.org/kb/conditions/MONDO:0011365		3 - Sufficient Evidence for Haploinsufficiency (04/25/2018)	0 - No Evidence for Haploinsufficiency (04/25/2018)	https://search.clinicalgenome.org/kb/gene-dosage/HGNC:17582	Dosage Working Group						
MONDO:0011369	PCSK9	HGNC:20001	https://search.clinicalgenome.org/kb/genes/HGNC:20001	hypercholesterolemia, autosomal dominant, 3	https://search.clinicalgenome.org/kb/conditions/MONDO:0011369	Autosomal dominant inheritance	40 - Dosage Sensitivity Unlikely (12/17/2015)	0 - No Evidence for Haploinsufficiency (12/17/2015)	https://search.clinicalgenome.org/kb/gene-dosage/HGNC:20001	Dosage Working Group	definitive evidence (11/14/2018)	https://search.clinicalgenome.org/kb/gene-validity/CGGV:assertion_bf710ddc-c189-419f-ab70-25300b067db2-2018-11-14T170000.000Z	General Gene Curation	Definitive Actionability (08/03/2020) | Strong Actionability (08/03/2020) | Strong Actionability (08/03/2020) | Strong Actionability (08/03/2020)	https://search.clinicalgenome.org/kb/gene-validity/https://actionability.clinicalgenome.org/ac/Adult/ui/stg2SummaryRpt?doc=AC057 | https://search.clinicalgenome.org/kb/gene-validity/https://actionability.clinicalgenome.org/ac/Pediatric/ui/stg2SummaryRpt?doc=AC057 | https://search.clinicalgenome.org/kb/gene-validity/https://actionability.clinicalgenome.org/ac/Adult/ui/stg2SummaryRpt?doc=AC065 | https://search.clinicalgenome.org/kb/gene-validity/https://actionability.clinicalgenome.org/ac/Pediatric/ui/stg2SummaryRpt?doc=AC065	Adult Actionability Working Group | Pediatric Actionability Working Group | Adult Actionability Working Group | Pediatric Actionability Working Group
MONDO:0011377	SCN5A	HGNC:10593	https://search.clinicalgenome.org/kb/genes/HGNC:10593	long QT syndrome 3	https://search.clinicalgenome.org/kb/conditions/MONDO:0011377		3 - Sufficient Evidence for Haploinsufficiency (06/08/2021)	0 - No Evidence for Haploinsufficiency (06/08/2021)	https://search.clinicalgenome.org/kb/gene-dosage/HGNC:10593	Dosage Working Group				Strong Actionability (08/28/2019) | Strong Actionability (08/28/2019)	https://search.clinicalgenome.org/kb/gene-validity/https://actionability.clinicalgenome.org/ac/Adult/ui/stg2SummaryRpt?doc=AC131 | https://search.clinicalgenome.org/kb/gene-validity/https://actionability.clinicalgenome.org/ac/Pediatric/ui/stg2SummaryRpt?doc=AC131	Adult Actionability Working Group | Pediatric Actionability Working Group
MONDO:0011380	EIF2B1	HGNC:3257	https://search.clinicalgenome.org/kb/genes/HGNC:3257	leukoencephalopathy with vanishing white matter	https://search.clinicalgenome.org/kb/conditions/MONDO:0011380		30 - Gene Associated with Autosomal Recessive Phenotype (08/22/2016)		https://search.clinicalgenome.org/kb/gene-dosage/HGNC:3257	Dosage Working Group						
MONDO:0011397	DNMT1	HGNC:2976	https://search.clinicalgenome.org/kb/genes/HGNC:2976	autosomal dominant cerebellar ataxia, deafness and narcolepsy	https://search.clinicalgenome.org/kb/conditions/MONDO:0011397	Autosomal dominant inheritance					definitive evidence (02/10/2017)	https://search.clinicalgenome.org/kb/gene-validity/CGGCIEX:assertion_6235	Hearing Loss			
MONDO:0011399	HBA1	HGNC:4823	https://search.clinicalgenome.org/kb/genes/HGNC:4823	alpha thalassemia	https://search.clinicalgenome.org/kb/conditions/MONDO:0011399		30 - Gene Associated with Autosomal Recessive Phenotype (04/19/2012)	0 - No Evidence for Haploinsufficiency (04/19/2012)	https://search.clinicalgenome.org/kb/gene-dosage/HGNC:4823	Dosage Working Group						
MONDO:0011402	CTDP1	HGNC:2498	https://search.clinicalgenome.org/kb/genes/HGNC:2498	congenital cataracts-facial dysmorphism-neuropathy syndrome	https://search.clinicalgenome.org/kb/conditions/MONDO:0011402		30 - Gene Associated with Autosomal Recessive Phenotype (08/22/2016)		https://search.clinicalgenome.org/kb/gene-dosage/HGNC:2498	Dosage Working Group						
MONDO:0011411	GPSM2	HGNC:29501	https://search.clinicalgenome.org/kb/genes/HGNC:29501	Chudley-McCullough syndrome	https://search.clinicalgenome.org/kb/conditions/MONDO:0011411	Autosomal recessive inheritance	30 - Gene Associated with Autosomal Recessive Phenotype (08/22/2016)	0 - No Evidence for Haploinsufficiency (08/22/2016)	https://search.clinicalgenome.org/kb/gene-dosage/HGNC:29501	Dosage Working Group	definitive evidence (05/01/2018)	https://search.clinicalgenome.org/kb/gene-validity/CGGV:assertion_cd40cf49-a25c-450b-be6b-b80eef958f4c-2018-05-01T160000.000Z	Hearing Loss			
MONDO:0011415	SPATA7	HGNC:20423	https://search.clinicalgenome.org/kb/genes/HGNC:20423	Leber congenital amaurosis 3	https://search.clinicalgenome.org/kb/conditions/MONDO:0011415		30 - Gene Associated with Autosomal Recessive Phenotype (08/22/2016)	0 - No Evidence for Haploinsufficiency (08/22/2016)	https://search.clinicalgenome.org/kb/gene-dosage/HGNC:20423	Dosage Working Group						
MONDO:0011417	TFR2	HGNC:11762	https://search.clinicalgenome.org/kb/genes/HGNC:11762	hemochromatosis type 3	https://search.clinicalgenome.org/kb/conditions/MONDO:0011417		30 - Gene Associated with Autosomal Recessive Phenotype (08/22/2016)	0 - No Evidence for Haploinsufficiency (08/22/2016)	https://search.clinicalgenome.org/kb/gene-dosage/HGNC:11762	Dosage Working Group						
MONDO:0011421	ATPAF2	HGNC:18802	https://search.clinicalgenome.org/kb/genes/HGNC:18802	mitochondrial complex V (ATP synthase) deficiency, nuclear type 1	https://search.clinicalgenome.org/kb/conditions/MONDO:0011421		30 - Gene Associated with Autosomal Recessive Phenotype (08/22/2016)	0 - No Evidence for Haploinsufficiency (08/22/2016)	https://search.clinicalgenome.org/kb/gene-dosage/HGNC:18802	Dosage Working Group						
MONDO:0011426	CP	HGNC:2295	https://search.clinicalgenome.org/kb/genes/HGNC:2295	aceruloplasminemia	https://search.clinicalgenome.org/kb/conditions/MONDO:0011426		30 - Gene Associated with Autosomal Recessive Phenotype (08/22/2016)		https://search.clinicalgenome.org/kb/gene-dosage/HGNC:2295	Dosage Working Group				Moderate Actionability (12/10/2018) | Strong Actionability (09/17/2018)	https://search.clinicalgenome.org/kb/gene-validity/https://actionability.clinicalgenome.org/ac/Adult/ui/stg2SummaryRpt?doc=AC157 | https://search.clinicalgenome.org/kb/gene-validity/https://actionability.clinicalgenome.org/ac/Pediatric/ui/stg2SummaryRpt?doc=AC157	Adult Actionability Working Group | Pediatric Actionability Working Group
MONDO:0011435	WDR62	HGNC:24502	https://search.clinicalgenome.org/kb/genes/HGNC:24502	microcephaly 2, primary, autosomal recessive, with or without cortical malformations	https://search.clinicalgenome.org/kb/conditions/MONDO:0011435	Autosomal recessive inheritance	30 - Gene Associated with Autosomal Recessive Phenotype (08/22/2016)		https://search.clinicalgenome.org/kb/gene-dosage/HGNC:24502	Dosage Working Group	definitive evidence (05/26/2020)	https://search.clinicalgenome.org/kb/gene-validity/CGGV:assertion_bdbcb9de-2ded-46a0-a6d0-16b34ea22008-2020-05-26T160000.000Z	Brain Malformations			
MONDO:0011436	IGHMBP2	HGNC:5542	https://search.clinicalgenome.org/kb/genes/HGNC:5542	autosomal recessive distal spinal muscular atrophy 1	https://search.clinicalgenome.org/kb/conditions/MONDO:0011436		30 - Gene Associated with Autosomal Recessive Phenotype (08/22/2016)	0 - No Evidence for Haploinsufficiency (08/22/2016)	https://search.clinicalgenome.org/kb/gene-dosage/HGNC:5542	Dosage Working Group						
MONDO:0011450	BRCA1	HGNC:1100	https://search.clinicalgenome.org/kb/genes/HGNC:1100	breast-ovarian cancer, familial, susceptibility to, 1	https://search.clinicalgenome.org/kb/conditions/MONDO:0011450	Autosomal dominant inheritance	3 - Sufficient Evidence for Haploinsufficiency (09/23/2021)	0 - No Evidence for Haploinsufficiency (09/23/2021)	https://search.clinicalgenome.org/kb/gene-dosage/HGNC:1100	Dosage Working Group	definitive evidence (09/13/2017)	https://search.clinicalgenome.org/kb/gene-validity/CGGCIEX:assertion_9972	Breast/Ovarian Cancer	Has Insufficient Evidence for Actionability Based on Early Rule-out (09/15/2021) | Definitive Actionability (01/28/2014)	https://search.clinicalgenome.org/kb/gene-validity/https://actionability.clinicalgenome.org/ac/Pediatric/ui/stg2SummaryRpt?doc=AC133 | https://search.clinicalgenome.org/kb/gene-validity/https://actionability.clinicalgenome.org/ac/Adult/ui/stg2SummaryRpt?doc=AC133	Pediatric Actionability Working Group | Adult Actionability Working Group
MONDO:0011459	TMEM43	HGNC:28472	https://search.clinicalgenome.org/kb/genes/HGNC:28472	arrhythmogenic right ventricular dysplasia 5	https://search.clinicalgenome.org/kb/conditions/MONDO:0011459	Autosomal dominant inheritance	0 - No Evidence for Haploinsufficiency (11/08/2015)	0 - No Evidence for Haploinsufficiency (11/08/2015)	https://search.clinicalgenome.org/kb/gene-dosage/HGNC:28472	Dosage Working Group	definitive evidence (10/26/2018)	https://search.clinicalgenome.org/kb/gene-validity/CGGV:assertion_675dc788-9749-413f-93ce-8c1fc3adbe84-2018-10-26T160000.000Z	Arrhythmogenic Right Ventricular Cardiomyopathy	Moderate Actionability (03/17/2020) | Strong Actionability (03/17/2020)	https://search.clinicalgenome.org/kb/gene-validity/https://actionability.clinicalgenome.org/ac/Adult/ui/stg2SummaryRpt?doc=AC039 | https://search.clinicalgenome.org/kb/gene-validity/https://actionability.clinicalgenome.org/ac/Pediatric/ui/stg2SummaryRpt?doc=AC039	Adult Actionability Working Group | Pediatric Actionability Working Group
MONDO:0011469	MPL	HGNC:7217	https://search.clinicalgenome.org/kb/genes/HGNC:7217	congenital amegakaryocytic thrombocytopenia	https://search.clinicalgenome.org/kb/conditions/MONDO:0011469	Autosomal recessive inheritance					definitive evidence (07/22/2020)	https://search.clinicalgenome.org/kb/gene-validity/CGGV:assertion_d97f51ea-0148-483b-a18e-e61ee2e30690-2020-07-22T160000.000Z	Hemostasis Thrombosis			
MONDO:0011473	LCA5	HGNC:31923	https://search.clinicalgenome.org/kb/genes/HGNC:31923	Leber congenital amaurosis 5	https://search.clinicalgenome.org/kb/conditions/MONDO:0011473		30 - Gene Associated with Autosomal Recessive Phenotype (08/22/2016)		https://search.clinicalgenome.org/kb/gene-dosage/HGNC:31923	Dosage Working Group						
MONDO:0011475	SBF2	HGNC:2135	https://search.clinicalgenome.org/kb/genes/HGNC:2135	Charcot-Marie-Tooth disease type 4B2	https://search.clinicalgenome.org/kb/conditions/MONDO:0011475	Autosomal recessive inheritance	30 - Gene Associated with Autosomal Recessive Phenotype (08/22/2016)		https://search.clinicalgenome.org/kb/gene-dosage/HGNC:2135	Dosage Working Group	definitive evidence (03/22/2021)	https://search.clinicalgenome.org/kb/gene-validity/CGGV:assertion_01893bf4-e95d-4206-9d2e-e3822f778b7a-2021-03-22T201309.257Z	Charcot-Marie-Tooth			
MONDO:0011477	PAX9	HGNC:8623	https://search.clinicalgenome.org/kb/genes/HGNC:8623	tooth agenesis, selective, 3	https://search.clinicalgenome.org/kb/conditions/MONDO:0011477		3 - Sufficient Evidence for Haploinsufficiency (07/08/2020)	0 - No Evidence for Haploinsufficiency (07/08/2020)	https://search.clinicalgenome.org/kb/gene-dosage/HGNC:8623	Dosage Working Group						
MONDO:0011481	MSX2	HGNC:7392	https://search.clinicalgenome.org/kb/genes/HGNC:7392	craniosynostosis 2	https://search.clinicalgenome.org/kb/conditions/MONDO:0011481	Autosomal dominant inheritance					definitive evidence (09/28/2020)	https://search.clinicalgenome.org/kb/gene-validity/CGGV:assertion_ac8a9313-9ef2-4556-9a25-db7fa2ed99ed-2020-09-28T170000.000Z	Craniofacial Malformations			
MONDO:0011484	RYR2	HGNC:10484	https://search.clinicalgenome.org/kb/genes/HGNC:10484	catecholaminergic polymorphic ventricular tachycardia 1	https://search.clinicalgenome.org/kb/conditions/MONDO:0011484		0 - No Evidence for Haploinsufficiency (11/06/2015)	0 - No Evidence for Haploinsufficiency (11/06/2015)	https://search.clinicalgenome.org/kb/gene-dosage/HGNC:10484	Dosage Working Group				Strong Actionability (03/11/2021) | Strong Actionability (03/11/2021)	https://search.clinicalgenome.org/kb/gene-validity/https://actionability.clinicalgenome.org/ac/Adult/ui/stg2SummaryRpt?doc=AC042 | https://search.clinicalgenome.org/kb/gene-validity/https://actionability.clinicalgenome.org/ac/Pediatric/ui/stg2SummaryRpt?doc=AC042	Adult Actionability Working Group | Pediatric Actionability Working Group
MONDO:0011485	CYP4F22	HGNC:26820	https://search.clinicalgenome.org/kb/genes/HGNC:26820	autosomal recessive congenital ichthyosis 5	https://search.clinicalgenome.org/kb/conditions/MONDO:0011485		30 - Gene Associated with Autosomal Recessive Phenotype (08/22/2016)		https://search.clinicalgenome.org/kb/gene-dosage/HGNC:26820	Dosage Working Group						
MONDO:0011488	CDK5RAP2	HGNC:18672	https://search.clinicalgenome.org/kb/genes/HGNC:18672	microcephaly 3, primary, autosomal recessive	https://search.clinicalgenome.org/kb/conditions/MONDO:0011488		30 - Gene Associated with Autosomal Recessive Phenotype (08/22/2016)		https://search.clinicalgenome.org/kb/gene-dosage/HGNC:18672	Dosage Working Group						
MONDO:0011493	COL11A1	HGNC:2186	https://search.clinicalgenome.org/kb/genes/HGNC:2186	Stickler syndrome type 2	https://search.clinicalgenome.org/kb/conditions/MONDO:0011493		1 - Little Evidence for Haploinsufficiency (10/19/2011)	0 - No Evidence for Haploinsufficiency (10/19/2011)	https://search.clinicalgenome.org/kb/gene-dosage/HGNC:2186	Dosage Working Group						
MONDO:0011503	H6PD	HGNC:4795	https://search.clinicalgenome.org/kb/genes/HGNC:4795	cortisone reductase deficiency 1	https://search.clinicalgenome.org/kb/conditions/MONDO:0011503		30 - Gene Associated with Autosomal Recessive Phenotype (08/22/2016)	0 - No Evidence for Haploinsufficiency (08/22/2016)	https://search.clinicalgenome.org/kb/gene-dosage/HGNC:4795	Dosage Working Group						
MONDO:0011505	ANGPTL3	HGNC:491	https://search.clinicalgenome.org/kb/genes/HGNC:491	familial hypobetalipoproteinemia 2	https://search.clinicalgenome.org/kb/conditions/MONDO:0011505		30 - Gene Associated with Autosomal Recessive Phenotype (08/22/2016)		https://search.clinicalgenome.org/kb/gene-dosage/HGNC:491	Dosage Working Group						
MONDO:0011510	ASXL1	HGNC:18318	https://search.clinicalgenome.org/kb/genes/HGNC:18318	Bohring-Opitz syndrome	https://search.clinicalgenome.org/kb/conditions/MONDO:0011510	Autosomal dominant inheritance	3 - Sufficient Evidence for Haploinsufficiency (03/14/2013)	0 - No Evidence for Haploinsufficiency (03/14/2013)	https://search.clinicalgenome.org/kb/gene-dosage/HGNC:18318	Dosage Working Group	definitive evidence (07/30/2021)	https://search.clinicalgenome.org/kb/gene-validity/CGGV:assertion_31e0ce4d-aeb7-4983-9ec2-85178d7f40f0-2021-07-30T160000.000Z	Intellectual Disability and Autism			
MONDO:0011512	CYLD	HGNC:2584	https://search.clinicalgenome.org/kb/genes/HGNC:2584	Brooke-Spiegler syndrome	https://search.clinicalgenome.org/kb/conditions/MONDO:0011512	Autosomal dominant inheritance	3 - Sufficient Evidence for Haploinsufficiency (02/10/2021)	0 - No Evidence for Haploinsufficiency (02/10/2021)	https://search.clinicalgenome.org/kb/gene-dosage/HGNC:2584	Dosage Working Group	definitive evidence (12/21/2018)	https://search.clinicalgenome.org/kb/gene-validity/CGGV:assertion_434ddb72-ee88-47af-9fa2-8dee9fa0a388-2018-12-21T153626.610Z	Hereditary Cancer			
MONDO:0011517	NR3C2	HGNC:7979	https://search.clinicalgenome.org/kb/genes/HGNC:7979	pseudohyperaldosteronism type 2	https://search.clinicalgenome.org/kb/conditions/MONDO:0011517	Autosomal dominant inheritance	3 - Sufficient Evidence for Haploinsufficiency (04/06/2020)	0 - No Evidence for Haploinsufficiency (04/06/2020)	https://search.clinicalgenome.org/kb/gene-dosage/HGNC:7979	Dosage Working Group	limited evidence (07/15/2021)	https://search.clinicalgenome.org/kb/gene-validity/CGGV:assertion_26410755-d552-4111-9f23-14dbeaa99293-2021-07-15T023000.000Z	Tubulopathy			
MONDO:0011518	KMT2A	HGNC:7132	https://search.clinicalgenome.org/kb/genes/HGNC:7132	Wiedemann-Steiner syndrome	https://search.clinicalgenome.org/kb/conditions/MONDO:0011518		3 - Sufficient Evidence for Haploinsufficiency (05/23/2018)	0 - No Evidence for Haploinsufficiency (05/23/2018)	https://search.clinicalgenome.org/kb/gene-dosage/HGNC:7132	Dosage Working Group						
MONDO:0011528	AICDA	HGNC:13203	https://search.clinicalgenome.org/kb/genes/HGNC:13203	hyper-IgM syndrome type 2	https://search.clinicalgenome.org/kb/conditions/MONDO:0011528	Autosomal recessive inheritance	30 - Gene Associated with Autosomal Recessive Phenotype (08/22/2016)		https://search.clinicalgenome.org/kb/gene-dosage/HGNC:13203	Dosage Working Group	definitive evidence (09/17/2021)	https://search.clinicalgenome.org/kb/gene-validity/CGGV:assertion_b34c451d-03a1-42dd-a439-599428b0eb38-2021-09-17T121716.866Z	Antibody Deficiencies GCEP			
MONDO:0011533	CHSY1	HGNC:17198	https://search.clinicalgenome.org/kb/genes/HGNC:17198	temtamy preaxial brachydactyly syndrome	https://search.clinicalgenome.org/kb/conditions/MONDO:0011533		30 - Gene Associated with Autosomal Recessive Phenotype (08/22/2016)	0 - No Evidence for Haploinsufficiency (08/22/2016)	https://search.clinicalgenome.org/kb/gene-dosage/HGNC:17198	Dosage Working Group						
MONDO:0011539	TNNT1	HGNC:11948	https://search.clinicalgenome.org/kb/genes/HGNC:11948	nemaline myopathy 5	https://search.clinicalgenome.org/kb/conditions/MONDO:0011539	Autosomal recessive inheritance	30 - Gene Associated with Autosomal Recessive Phenotype (08/22/2016)	0 - No Evidence for Haploinsufficiency (08/22/2016)	https://search.clinicalgenome.org/kb/gene-dosage/HGNC:11948	Dosage Working Group	definitive evidence (05/07/2020)	https://search.clinicalgenome.org/kb/gene-validity/CGGV:assertion_8f993d88-c2f6-42c8-8c2e-c1bb63e1416a-2020-05-07T160000.000Z	Congenital Myopathies			
MONDO:0011541	EYA4	HGNC:3522	https://search.clinicalgenome.org/kb/genes/HGNC:3522	dilated cardiomyopathy 1J	https://search.clinicalgenome.org/kb/conditions/MONDO:0011541	Autosomal dominant inheritance	3 - Sufficient Evidence for Haploinsufficiency (01/22/2020)	0 - No Evidence for Haploinsufficiency (01/22/2020)	https://search.clinicalgenome.org/kb/gene-dosage/HGNC:3522	Dosage Working Group	limited evidence (11/30/2020)	https://search.clinicalgenome.org/kb/gene-validity/CGGV:assertion_5e0a0bad-1f7a-402e-af19-a80453653b86-2020-11-30T170000.000Z	Dilated Cardiomyopathy			
MONDO:0011544	SDHC	HGNC:10682	https://search.clinicalgenome.org/kb/genes/HGNC:10682	paragangliomas 3	https://search.clinicalgenome.org/kb/conditions/MONDO:0011544		3 - Sufficient Evidence for Haploinsufficiency (10/13/2021)	0 - No Evidence for Haploinsufficiency (10/13/2021)	https://search.clinicalgenome.org/kb/gene-dosage/HGNC:10682	Dosage Working Group				Strong Actionability (10/31/2017)	https://search.clinicalgenome.org/kb/gene-validity/https://actionability.clinicalgenome.org/ac/Adult/ui/stg2SummaryRpt?doc=AC150	Adult Actionability Working Group
MONDO:0011562	SNCA	HGNC:11138	https://search.clinicalgenome.org/kb/genes/HGNC:11138	autosomal dominant Parkinson disease 4	https://search.clinicalgenome.org/kb/conditions/MONDO:0011562									Has Insufficient Evidence for Actionability Based on Early Rule-out (06/21/2021) | Has Insufficient Evidence for Actionability Based on Early Rule-out (06/21/2021)	https://search.clinicalgenome.org/kb/gene-validity/https://actionability.clinicalgenome.org/ac/Adult/ui/stg2SummaryRpt?doc=AC1027 | https://search.clinicalgenome.org/kb/gene-validity/https://actionability.clinicalgenome.org/ac/Pediatric/ui/stg2SummaryRpt?doc=AC1027	Adult Actionability Working Group | Pediatric Actionability Working Group
MONDO:0011570	MED25	HGNC:28845	https://search.clinicalgenome.org/kb/genes/HGNC:28845	Charcot-Marie-Tooth disease type 2B2	https://search.clinicalgenome.org/kb/conditions/MONDO:0011570	Autosomal recessive inheritance					disputing (03/22/2021)	https://search.clinicalgenome.org/kb/gene-validity/CGGV:assertion_c0e0d66f-c68d-4df3-bab2-71afc448e4b0-2021-03-22T201527.084Z	Charcot-Marie-Tooth			
MONDO:0011577	MYH2	HGNC:7572	https://search.clinicalgenome.org/kb/genes/HGNC:7572	myopathy, proximal, and ophthalmoplegia	https://search.clinicalgenome.org/kb/conditions/MONDO:0011577	Semidominant inheritance					definitive evidence (03/09/2020)	https://search.clinicalgenome.org/kb/gene-validity/CGGV:assertion_72e37c65-570c-4d1c-b749-61d8981a6f21-2020-03-09T160000.000Z	Congenital Myopathies			
MONDO:0011581	DSP	HGNC:3052	https://search.clinicalgenome.org/kb/genes/HGNC:3052	arrhythmogenic cardiomyopathy with woolly hair and keratoderma	https://search.clinicalgenome.org/kb/conditions/MONDO:0011581	Autosomal dominant inheritance	3 - Sufficient Evidence for Haploinsufficiency (10/12/2021)	0 - No Evidence for Haploinsufficiency (10/12/2021)	https://search.clinicalgenome.org/kb/gene-dosage/HGNC:3052	Dosage Working Group	definitive evidence (07/12/2019)	https://search.clinicalgenome.org/kb/gene-validity/CGGV:assertion_b23da580-269c-4e5d-8f13-91dbe7ea6a57-2019-07-12T160000.000Z	Arrhythmogenic Right Ventricular Cardiomyopathy			
MONDO:0011584	BRCA2	HGNC:1101	https://search.clinicalgenome.org/kb/genes/HGNC:1101	Fanconi anemia complementation group D1	https://search.clinicalgenome.org/kb/conditions/MONDO:0011584	Autosomal recessive inheritance	3 - Sufficient Evidence for Haploinsufficiency (07/14/2021)	0 - No Evidence for Haploinsufficiency (07/14/2021)	https://search.clinicalgenome.org/kb/gene-dosage/HGNC:1101	Dosage Working Group	definitive evidence (12/21/2018)	https://search.clinicalgenome.org/kb/gene-validity/CGGV:assertion_48faf04b-ffc4-4163-8570-22f5c29c4064-2018-12-21T151618.437Z	Hereditary Cancer			
MONDO:0011588	PTGS1	HGNC:9604	https://search.clinicalgenome.org/kb/genes/HGNC:9604	platelet-type bleeding disorder 12	https://search.clinicalgenome.org/kb/conditions/MONDO:0011588	Autosomal recessive inheritance					limited evidence (03/24/2022)	https://search.clinicalgenome.org/kb/gene-validity/CGGV:assertion_24dc7cc9-f3f6-421e-ad78-016e89e6220b-2022-03-24T171350.179Z	Hemostasis Thrombosis			
MONDO:0011601	SLC25A13	HGNC:10983	https://search.clinicalgenome.org/kb/genes/HGNC:10983	neonatal intrahepatic cholestasis due to citrin deficiency	https://search.clinicalgenome.org/kb/conditions/MONDO:0011601		30 - Gene Associated with Autosomal Recessive Phenotype (08/22/2016)		https://search.clinicalgenome.org/kb/gene-dosage/HGNC:10983	Dosage Working Group						
MONDO:0011610	DMGDH	HGNC:24475	https://search.clinicalgenome.org/kb/genes/HGNC:24475	dimethylglycine dehydrogenase deficiency	https://search.clinicalgenome.org/kb/conditions/MONDO:0011610	Autosomal recessive inheritance					limited evidence (06/28/2019)	https://search.clinicalgenome.org/kb/gene-validity/CGGV:assertion_b181250b-bc72-43b7-adec-5b85860b1a62-2019-06-28T160000.000Z	Aminoacidopathy			
MONDO:0011612	AMT	HGNC:473	https://search.clinicalgenome.org/kb/genes/HGNC:473	glycine encephalopathy	https://search.clinicalgenome.org/kb/conditions/MONDO:0011612	Autosomal recessive inheritance					definitive evidence (05/24/2019)	https://search.clinicalgenome.org/kb/gene-validity/CGGV:assertion_a85e1b07-b975-4c92-b592-7b3e8d35805a-2019-05-24T160000.000Z	Aminoacidopathy			
MONDO:0011613	PINK1	HGNC:14581	https://search.clinicalgenome.org/kb/genes/HGNC:14581	autosomal recessive early-onset Parkinson disease 6	https://search.clinicalgenome.org/kb/conditions/MONDO:0011613		30 - Gene Associated with Autosomal Recessive Phenotype (08/22/2016)		https://search.clinicalgenome.org/kb/gene-dosage/HGNC:14581	Dosage Working Group				Has Insufficient Evidence for Actionability Based on Early Rule-out (06/21/2021) | Has Insufficient Evidence for Actionability Based on Early Rule-out (06/21/2021)	https://search.clinicalgenome.org/kb/gene-validity/https://actionability.clinicalgenome.org/ac/Adult/ui/stg2SummaryRpt?doc=AC1027 | https://search.clinicalgenome.org/kb/gene-validity/https://actionability.clinicalgenome.org/ac/Pediatric/ui/stg2SummaryRpt?doc=AC1027	Adult Actionability Working Group | Pediatric Actionability Working Group
MONDO:0011614	HMGCS2	HGNC:5008	https://search.clinicalgenome.org/kb/genes/HGNC:5008	3-hydroxy-3-methylglutaryl-CoA synthase deficiency	https://search.clinicalgenome.org/kb/conditions/MONDO:0011614	Autosomal recessive inheritance					definitive evidence (05/22/2018)	https://search.clinicalgenome.org/kb/gene-validity/CGGV:assertion_b3f49254-4635-4961-83b9-31c7ebc7f159-2018-05-22T160000.000Z	Fatty Acid Oxidation Disorders			
MONDO:0011628	PCCA	HGNC:8653	https://search.clinicalgenome.org/kb/genes/HGNC:8653	propionic acidemia	https://search.clinicalgenome.org/kb/conditions/MONDO:0011628	Autosomal recessive inheritance	30 - Gene Associated with Autosomal Recessive Phenotype (08/22/2016)	0 - No Evidence for Haploinsufficiency (08/22/2016)	https://search.clinicalgenome.org/kb/gene-dosage/HGNC:8653	Dosage Working Group	definitive evidence (12/13/2018)	https://search.clinicalgenome.org/kb/gene-validity/CGGV:assertion_32a55e25-8632-4f31-84af-3eaf8098ca18-2018-12-13T170000.000Z	Aminoacidopathy			
MONDO:0011629	MOGS	HGNC:24862	https://search.clinicalgenome.org/kb/genes/HGNC:24862	MOGS-CDG	https://search.clinicalgenome.org/kb/conditions/MONDO:0011629	Autosomal recessive inheritance					definitive evidence (07/20/2021)	https://search.clinicalgenome.org/kb/gene-validity/CGGV:assertion_5a628248-c2f9-4d31-b614-e082e3f83416-2021-07-20T130742.194Z	General Inborn Errors of Metabolism			
MONDO:0011630	FAM161A	HGNC:25808	https://search.clinicalgenome.org/kb/genes/HGNC:25808	retinitis pigmentosa 28	https://search.clinicalgenome.org/kb/conditions/MONDO:0011630		30 - Gene Associated with Autosomal Recessive Phenotype (08/22/2016)	0 - No Evidence for Haploinsufficiency (08/22/2016)	https://search.clinicalgenome.org/kb/gene-dosage/HGNC:25808	Dosage Working Group						
MONDO:0011632	MATR3	HGNC:6912	https://search.clinicalgenome.org/kb/genes/HGNC:6912	amyotrophic lateral sclerosis type 21	https://search.clinicalgenome.org/kb/conditions/MONDO:0011632	Autosomal dominant inheritance					moderate evidence (09/23/2021)	https://search.clinicalgenome.org/kb/gene-validity/CGGV:assertion_97ed1e35-c1b2-40c7-a60e-54b3c24004c4-2021-09-23T160000.000Z	Amyotrophic Lateral Sclerosis Spectrum Disorders			
MONDO:0011652	SHANK3	HGNC:14294	https://search.clinicalgenome.org/kb/genes/HGNC:14294	Phelan-McDermid syndrome	https://search.clinicalgenome.org/kb/conditions/MONDO:0011652	Autosomal dominant inheritance	3 - Sufficient Evidence for Haploinsufficiency (08/14/2018)	0 - No Evidence for Haploinsufficiency (08/14/2018)	https://search.clinicalgenome.org/kb/gene-dosage/HGNC:14294	Dosage Working Group	definitive evidence (12/12/2018)	https://search.clinicalgenome.org/kb/gene-validity/CGGV:assertion_e941703a-0f30-4f4c-a997-bc3b4295f289-2018-12-12T170000.000Z	Intellectual Disability and Autism			
MONDO:0011658	PARK7	HGNC:16369	https://search.clinicalgenome.org/kb/genes/HGNC:16369	autosomal recessive early-onset Parkinson disease 7	https://search.clinicalgenome.org/kb/conditions/MONDO:0011658		30 - Gene Associated with Autosomal Recessive Phenotype (08/22/2016)	0 - No Evidence for Haploinsufficiency (08/22/2016)	https://search.clinicalgenome.org/kb/gene-dosage/HGNC:16369	Dosage Working Group				Has Insufficient Evidence for Actionability Based on Early Rule-out (06/21/2021) | Has Insufficient Evidence for Actionability Based on Early Rule-out (06/21/2021)	https://search.clinicalgenome.org/kb/gene-validity/https://actionability.clinicalgenome.org/ac/Adult/ui/stg2SummaryRpt?doc=AC1027 | https://search.clinicalgenome.org/kb/gene-validity/https://actionability.clinicalgenome.org/ac/Pediatric/ui/stg2SummaryRpt?doc=AC1027	Adult Actionability Working Group | Pediatric Actionability Working Group
MONDO:0011664	IL2RA	HGNC:6008	https://search.clinicalgenome.org/kb/genes/HGNC:6008	immunodeficiency due to CD25 deficiency	https://search.clinicalgenome.org/kb/conditions/MONDO:0011664		30 - Gene Associated with Autosomal Recessive Phenotype (08/22/2016)		https://search.clinicalgenome.org/kb/gene-dosage/HGNC:6008	Dosage Working Group						
MONDO:0011674	DNM2	HGNC:2974	https://search.clinicalgenome.org/kb/genes/HGNC:2974	Charcot-Marie-Tooth disease dominant intermediate B	https://search.clinicalgenome.org/kb/conditions/MONDO:0011674									Assertion Pending (12/20/2017)	https://search.clinicalgenome.org/kb/gene-validity/https://actionability.clinicalgenome.org/ac/Adult/ui/stg2SummaryRpt?doc=AC148	Adult Actionability Working Group
MONDO:0011686	LIG4	HGNC:6601	https://search.clinicalgenome.org/kb/genes/HGNC:6601	DNA ligase IV deficiency	https://search.clinicalgenome.org/kb/conditions/MONDO:0011686	Autosomal recessive inheritance	30 - Gene Associated with Autosomal Recessive Phenotype (08/22/2016)	0 - No Evidence for Haploinsufficiency (08/22/2016)	https://search.clinicalgenome.org/kb/gene-dosage/HGNC:6601	Dosage Working Group	definitive evidence (04/16/2021)	https://search.clinicalgenome.org/kb/gene-validity/CGGV:assertion_3ec863c8-d668-4ebf-806e-e01f5a6407fe-2021-04-16T230148.883Z	SCID-CID			
MONDO:0011698	GNMT	HGNC:4415	https://search.clinicalgenome.org/kb/genes/HGNC:4415	glycine N-methyltransferase deficiency	https://search.clinicalgenome.org/kb/conditions/MONDO:0011698	Autosomal recessive inheritance					limited evidence (05/10/2019)	https://search.clinicalgenome.org/kb/gene-validity/CGGV:assertion_cafb0200-f6cf-482d-9ffb-69ae7bc43669-2019-05-10T160000.000Z	Aminoacidopathy			
MONDO:0011706	ATP13A2	HGNC:30213	https://search.clinicalgenome.org/kb/genes/HGNC:30213	Kufor-Rakeb syndrome	https://search.clinicalgenome.org/kb/conditions/MONDO:0011706		30 - Gene Associated with Autosomal Recessive Phenotype (08/22/2016)		https://search.clinicalgenome.org/kb/gene-dosage/HGNC:30213	Dosage Working Group						
MONDO:0011713	CDKN2A	HGNC:1787	https://search.clinicalgenome.org/kb/genes/HGNC:1787	melanoma-pancreatic cancer syndrome	https://search.clinicalgenome.org/kb/conditions/MONDO:0011713	Autosomal dominant inheritance	3 - Sufficient Evidence for Haploinsufficiency (03/18/2022)	0 - No Evidence for Haploinsufficiency (03/18/2022)	https://search.clinicalgenome.org/kb/gene-dosage/HGNC:1787	Dosage Working Group	definitive evidence (08/14/2019)	https://search.clinicalgenome.org/kb/gene-validity/CGGV:assertion_0c0d2fc0-12b2-4855-b537-60394d0987dd-2019-08-14T194547.089Z	Hereditary Cancer	Assertion Pending (09/22/2016)	https://search.clinicalgenome.org/kb/gene-validity/https://actionability.clinicalgenome.org/ac/Adult/ui/stg2SummaryRpt?doc=AC086	Adult Actionability Working Group
MONDO:0011715	RBBP8	HGNC:9891	https://search.clinicalgenome.org/kb/genes/HGNC:9891	Seckel syndrome 2	https://search.clinicalgenome.org/kb/conditions/MONDO:0011715		30 - Gene Associated with Autosomal Recessive Phenotype (08/22/2016)		https://search.clinicalgenome.org/kb/gene-dosage/HGNC:9891	Dosage Working Group						
MONDO:0011717	GLUD1	HGNC:4335	https://search.clinicalgenome.org/kb/genes/HGNC:4335	hyperinsulinism-hyperammonemia syndrome	https://search.clinicalgenome.org/kb/conditions/MONDO:0011717	Autosomal dominant inheritance					definitive evidence (11/13/2020)	https://search.clinicalgenome.org/kb/gene-validity/CGGV:assertion_924bd593-ba5a-49a5-bb71-8224271a713b-2020-11-13T170000.000Z	Aminoacidopathy			
MONDO:0011719	KIT	HGNC:6342	https://search.clinicalgenome.org/kb/genes/HGNC:6342	gastrointestinal stromal tumor	https://search.clinicalgenome.org/kb/conditions/MONDO:0011719	Autosomal dominant inheritance					definitive evidence (01/14/2020)	https://search.clinicalgenome.org/kb/gene-validity/CGGV:assertion_fa076c63-8ffe-46ff-ba44-255a6fca07e5-2020-01-14T184619.396Z	Hereditary Cancer	Has Insufficient Evidence for Actionability Based on Early Rule-out (06/02/2021)	https://search.clinicalgenome.org/kb/gene-validity/https://actionability.clinicalgenome.org/ac/Pediatric/ui/stg2SummaryRpt?doc=AC1040	Pediatric Actionability Working Group
MONDO:0011731	SLC5A1	HGNC:11036	https://search.clinicalgenome.org/kb/genes/HGNC:11036	glucose-galactose malabsorption	https://search.clinicalgenome.org/kb/conditions/MONDO:0011731		30 - Gene Associated with Autosomal Recessive Phenotype (08/22/2016)		https://search.clinicalgenome.org/kb/gene-dosage/HGNC:11036	Dosage Working Group						
MONDO:0011738	ADGRG1	HGNC:4512	https://search.clinicalgenome.org/kb/genes/HGNC:4512	bilateral frontoparietal polymicrogyria	https://search.clinicalgenome.org/kb/conditions/MONDO:0011738		30 - Gene Associated with Autosomal Recessive Phenotype (05/17/2012)	0 - No Evidence for Haploinsufficiency (05/17/2012)	https://search.clinicalgenome.org/kb/gene-dosage/HGNC:4512	Dosage Working Group						
MONDO:0011748	USH1G	HGNC:16356	https://search.clinicalgenome.org/kb/genes/HGNC:16356	Usher syndrome type 1G	https://search.clinicalgenome.org/kb/conditions/MONDO:0011748		30 - Gene Associated with Autosomal Recessive Phenotype (08/22/2016)	0 - No Evidence for Haploinsufficiency (08/22/2016)	https://search.clinicalgenome.org/kb/gene-dosage/HGNC:16356	Dosage Working Group						
MONDO:0011752	NPHP4	HGNC:19104	https://search.clinicalgenome.org/kb/genes/HGNC:19104	nephronophthisis 4	https://search.clinicalgenome.org/kb/conditions/MONDO:0011752	Autosomal recessive inheritance	30 - Gene Associated with Autosomal Recessive Phenotype (08/22/2016)		https://search.clinicalgenome.org/kb/gene-dosage/HGNC:19104	Dosage Working Group	definitive evidence (02/10/2021)	https://search.clinicalgenome.org/kb/gene-validity/CGGV:assertion_cafd0d51-dd5d-4691-8725-86518345b097-2021-02-10T170000.000Z	Kidney Cystic and Ciliopathy Disorders			
MONDO:0011756	NPHP4	HGNC:19104	https://search.clinicalgenome.org/kb/genes/HGNC:19104	Senior-Loken syndrome 4	https://search.clinicalgenome.org/kb/conditions/MONDO:0011756		30 - Gene Associated with Autosomal Recessive Phenotype (08/22/2016)		https://search.clinicalgenome.org/kb/gene-dosage/HGNC:19104	Dosage Working Group						
MONDO:0011758	IDUA	HGNC:5391	https://search.clinicalgenome.org/kb/genes/HGNC:5391	Hurler syndrome	https://search.clinicalgenome.org/kb/conditions/MONDO:0011758		30 - Gene Associated with Autosomal Recessive Phenotype (08/22/2016)		https://search.clinicalgenome.org/kb/gene-dosage/HGNC:5391	Dosage Working Group				Moderate Actionability (08/08/2018)	https://search.clinicalgenome.org/kb/gene-validity/https://actionability.clinicalgenome.org/ac/Pediatric/ui/stg2SummaryRpt?doc=AC006	Pediatric Actionability Working Group
MONDO:0011759	IDUA	HGNC:5391	https://search.clinicalgenome.org/kb/genes/HGNC:5391	Hurler-Scheie syndrome	https://search.clinicalgenome.org/kb/conditions/MONDO:0011759		30 - Gene Associated with Autosomal Recessive Phenotype (08/22/2016)		https://search.clinicalgenome.org/kb/gene-dosage/HGNC:5391	Dosage Working Group				Moderate Actionability (08/08/2018)	https://search.clinicalgenome.org/kb/gene-validity/https://actionability.clinicalgenome.org/ac/Pediatric/ui/stg2SummaryRpt?doc=AC006	Pediatric Actionability Working Group
MONDO:0011760	IDUA	HGNC:5391	https://search.clinicalgenome.org/kb/genes/HGNC:5391	Scheie syndrome	https://search.clinicalgenome.org/kb/conditions/MONDO:0011760		30 - Gene Associated with Autosomal Recessive Phenotype (08/22/2016)		https://search.clinicalgenome.org/kb/gene-dosage/HGNC:5391	Dosage Working Group				Moderate Actionability (08/08/2018)	https://search.clinicalgenome.org/kb/gene-validity/https://actionability.clinicalgenome.org/ac/Pediatric/ui/stg2SummaryRpt?doc=AC006	Pediatric Actionability Working Group
MONDO:0011762	OTOA	HGNC:16378	https://search.clinicalgenome.org/kb/genes/HGNC:16378	autosomal recessive nonsyndromic hearing loss 22	https://search.clinicalgenome.org/kb/conditions/MONDO:0011762		30 - Gene Associated with Autosomal Recessive Phenotype (08/22/2016)	0 - No Evidence for Haploinsufficiency (08/22/2016)	https://search.clinicalgenome.org/kb/gene-dosage/HGNC:16378	Dosage Working Group				Strong Actionability (10/29/2020)	https://search.clinicalgenome.org/kb/gene-validity/https://actionability.clinicalgenome.org/ac/Pediatric/ui/stg2SummaryRpt?doc=AC1018	Pediatric Actionability Working Group
MONDO:0011764	LRRK2	HGNC:18618	https://search.clinicalgenome.org/kb/genes/HGNC:18618	autosomal dominant Parkinson disease 8	https://search.clinicalgenome.org/kb/conditions/MONDO:0011764									Has Insufficient Evidence for Actionability Based on Early Rule-out (06/21/2021) | Has Insufficient Evidence for Actionability Based on Early Rule-out (06/21/2021)	https://search.clinicalgenome.org/kb/gene-validity/https://actionability.clinicalgenome.org/ac/Adult/ui/stg2SummaryRpt?doc=AC1027 | https://search.clinicalgenome.org/kb/gene-validity/https://actionability.clinicalgenome.org/ac/Pediatric/ui/stg2SummaryRpt?doc=AC1027	Adult Actionability Working Group | Pediatric Actionability Working Group
MONDO:0011767	WHRN	HGNC:16361	https://search.clinicalgenome.org/kb/genes/HGNC:16361	autosomal recessive nonsyndromic hearing loss 31	https://search.clinicalgenome.org/kb/conditions/MONDO:0011767		30 - Gene Associated with Autosomal Recessive Phenotype (08/22/2016)	0 - No Evidence for Haploinsufficiency (08/22/2016)	https://search.clinicalgenome.org/kb/gene-dosage/HGNC:16361	Dosage Working Group						
MONDO:0011772	B4GALT1	HGNC:924	https://search.clinicalgenome.org/kb/genes/HGNC:924	B4GALT1-CDG	https://search.clinicalgenome.org/kb/conditions/MONDO:0011772		30 - Gene Associated with Autosomal Recessive Phenotype (08/22/2016)	0 - No Evidence for Haploinsufficiency (08/22/2016)	https://search.clinicalgenome.org/kb/gene-dosage/HGNC:924	Dosage Working Group						
MONDO:0011774	MYO3A	HGNC:7601	https://search.clinicalgenome.org/kb/genes/HGNC:7601	autosomal recessive nonsyndromic hearing loss 30	https://search.clinicalgenome.org/kb/conditions/MONDO:0011774		30 - Gene Associated with Autosomal Recessive Phenotype (03/06/2018)	0 - No Evidence for Haploinsufficiency (03/06/2018)	https://search.clinicalgenome.org/kb/gene-dosage/HGNC:7601	Dosage Working Group				Strong Actionability (10/29/2020)	https://search.clinicalgenome.org/kb/gene-validity/https://actionability.clinicalgenome.org/ac/Pediatric/ui/stg2SummaryRpt?doc=AC1018	Pediatric Actionability Working Group
MONDO:0011783	ALG12	HGNC:19358	https://search.clinicalgenome.org/kb/genes/HGNC:19358	ALG12-CDG	https://search.clinicalgenome.org/kb/conditions/MONDO:0011783		30 - Gene Associated with Autosomal Recessive Phenotype (08/22/2016)	0 - No Evidence for Haploinsufficiency (08/22/2016)	https://search.clinicalgenome.org/kb/gene-dosage/HGNC:19358	Dosage Working Group						
MONDO:0011789	SMARCE1	HGNC:11109	https://search.clinicalgenome.org/kb/genes/HGNC:11109	familial meningioma	https://search.clinicalgenome.org/kb/conditions/MONDO:0011789	Autosomal dominant inheritance					definitive evidence (07/30/2020)	https://search.clinicalgenome.org/kb/gene-validity/CGGV:assertion_01e68b67-987e-48ec-a167-cb659cc245e9-2020-07-30T211630.144Z	Hereditary Cancer			
MONDO:0011801	TDP1	HGNC:18884	https://search.clinicalgenome.org/kb/genes/HGNC:18884	spinocerebellar ataxia, autosomal recessive, with axonal neuropathy 1	https://search.clinicalgenome.org/kb/conditions/MONDO:0011801		30 - Gene Associated with Autosomal Recessive Phenotype (08/22/2016)	0 - No Evidence for Haploinsufficiency (08/22/2016)	https://search.clinicalgenome.org/kb/gene-dosage/HGNC:18884	Dosage Working Group						
MONDO:0011803	SPG7	HGNC:11237	https://search.clinicalgenome.org/kb/genes/HGNC:11237	hereditary spastic paraplegia 7	https://search.clinicalgenome.org/kb/conditions/MONDO:0011803		30 - Gene Associated with Autosomal Recessive Phenotype (08/22/2016)		https://search.clinicalgenome.org/kb/gene-dosage/HGNC:11237	Dosage Working Group						
MONDO:0011812	SALL4	HGNC:15924	https://search.clinicalgenome.org/kb/genes/HGNC:15924	Duane-radial ray syndrome	https://search.clinicalgenome.org/kb/conditions/MONDO:0011812		3 - Sufficient Evidence for Haploinsufficiency (01/11/2021)	0 - No Evidence for Haploinsufficiency (01/11/2021)	https://search.clinicalgenome.org/kb/gene-dosage/HGNC:15924	Dosage Working Group						
MONDO:0011822	CLCNKB	HGNC:2027	https://search.clinicalgenome.org/kb/genes/HGNC:2027	Bartter disease type 3	https://search.clinicalgenome.org/kb/conditions/MONDO:0011822		30 - Gene Associated with Autosomal Recessive Phenotype (11/17/2011)	0 - No Evidence for Haploinsufficiency (11/17/2011)	https://search.clinicalgenome.org/kb/gene-dosage/HGNC:2027	Dosage Working Group						
MONDO:0011829	COQ2	HGNC:25223	https://search.clinicalgenome.org/kb/genes/HGNC:25223	coenzyme Q10 deficiency, primary, 1	https://search.clinicalgenome.org/kb/conditions/MONDO:0011829		30 - Gene Associated with Autosomal Recessive Phenotype (08/22/2016)	0 - No Evidence for Haploinsufficiency (08/22/2016)	https://search.clinicalgenome.org/kb/gene-dosage/HGNC:25223	Dosage Working Group						
MONDO:0011831	DSP	HGNC:3052	https://search.clinicalgenome.org/kb/genes/HGNC:3052	arrhythmogenic right ventricular dysplasia 8	https://search.clinicalgenome.org/kb/conditions/MONDO:0011831		3 - Sufficient Evidence for Haploinsufficiency (10/12/2021)	0 - No Evidence for Haploinsufficiency (10/12/2021)	https://search.clinicalgenome.org/kb/gene-dosage/HGNC:3052	Dosage Working Group				Moderate Actionability (03/17/2020) | Strong Actionability (03/17/2020)	https://search.clinicalgenome.org/kb/gene-validity/https://actionability.clinicalgenome.org/ac/Adult/ui/stg2SummaryRpt?doc=AC039 | https://search.clinicalgenome.org/kb/gene-validity/https://actionability.clinicalgenome.org/ac/Pediatric/ui/stg2SummaryRpt?doc=AC039	Adult Actionability Working Group | Pediatric Actionability Working Group
MONDO:0011837	VKORC1	HGNC:23663	https://search.clinicalgenome.org/kb/genes/HGNC:23663	vitamin K-dependent clotting factors, combined deficiency of, type 2	https://search.clinicalgenome.org/kb/conditions/MONDO:0011837	Autosomal recessive inheritance					moderate evidence (06/24/2020)	https://search.clinicalgenome.org/kb/gene-validity/CGGV:assertion_84145ffe-9835-4a3a-a2ae-6d0c6bd34007-2020-06-24T160000.000Z	Hemostasis Thrombosis			
MONDO:0011864	INO80	HGNC:26956	https://search.clinicalgenome.org/kb/genes/HGNC:26956	immunodeficiency, common variable, 1	https://search.clinicalgenome.org/kb/conditions/MONDO:0011864	Autosomal recessive inheritance					disputing (01/22/2021)	https://search.clinicalgenome.org/kb/gene-validity/CGGV:assertion_16d9f828-f6fa-4e35-bc23-c9f1b1138b9a-2021-01-22T014826.188Z	Antibody Deficiencies GCEP			
MONDO:0011872	RAB27A	HGNC:9766	https://search.clinicalgenome.org/kb/genes/HGNC:9766	Griscelli syndrome type 2	https://search.clinicalgenome.org/kb/conditions/MONDO:0011872	Autosomal recessive inheritance	30 - Gene Associated with Autosomal Recessive Phenotype (08/22/2016)		https://search.clinicalgenome.org/kb/gene-dosage/HGNC:9766	Dosage Working Group	definitive evidence (12/17/2020)	https://search.clinicalgenome.org/kb/gene-validity/CGGV:assertion_85b7d8d2-1d22-44f3-9b24-580b42d69300-2020-12-17T171600.737Z	Syndromic Disorders			
MONDO:0011873	NPC2	HGNC:14537	https://search.clinicalgenome.org/kb/genes/HGNC:14537	Niemann-Pick disease, type C2	https://search.clinicalgenome.org/kb/conditions/MONDO:0011873	Autosomal recessive inheritance					definitive evidence (04/06/2022)	https://search.clinicalgenome.org/kb/gene-validity/CGGV:assertion_82bb23dd-d3bc-478d-bb3d-d1928e810029-2022-04-06T130135.185Z	Lysosomal Diseases			
MONDO:0011888	IRAK4	HGNC:17967	https://search.clinicalgenome.org/kb/genes/HGNC:17967	immunodeficiency 67	https://search.clinicalgenome.org/kb/conditions/MONDO:0011888		30 - Gene Associated with Autosomal Recessive Phenotype (08/22/2016)	0 - No Evidence for Haploinsufficiency (08/22/2016)	https://search.clinicalgenome.org/kb/gene-dosage/HGNC:17967	Dosage Working Group						
MONDO:0011890	EGR2	HGNC:3239	https://search.clinicalgenome.org/kb/genes/HGNC:3239	Charcot-Marie-Tooth disease type 1D	https://search.clinicalgenome.org/kb/conditions/MONDO:0011890		0 - No Evidence for Haploinsufficiency (11/28/2011)	0 - No Evidence for Haploinsufficiency (11/28/2011)	https://search.clinicalgenome.org/kb/gene-dosage/HGNC:3239	Dosage Working Group				Assertion Pending (12/20/2017)	https://search.clinicalgenome.org/kb/gene-validity/https://actionability.clinicalgenome.org/ac/Adult/ui/stg2SummaryRpt?doc=AC129	Adult Actionability Working Group
MONDO:0011899	HRAS	HGNC:5173	https://search.clinicalgenome.org/kb/genes/HGNC:5173	Noonan syndrome-like disorder with loose anagen hair	https://search.clinicalgenome.org/kb/conditions/MONDO:0011899	Autosomal dominant inheritance	0 - No Evidence for Haploinsufficiency (10/15/2015)	0 - No Evidence for Haploinsufficiency (10/15/2015)	https://search.clinicalgenome.org/kb/gene-dosage/HGNC:5173	Dosage Working Group	disputing (07/25/2018)	https://search.clinicalgenome.org/kb/gene-validity/CGGV:assertion_94630309-c540-48b3-a27f-0ee1891091c1-2018-07-25T160000.000Z	RASopathy			
MONDO:0011902	NEFL	HGNC:7739	https://search.clinicalgenome.org/kb/genes/HGNC:7739	Charcot-Marie-Tooth disease type 1F	https://search.clinicalgenome.org/kb/conditions/MONDO:0011902		0 - No Evidence for Haploinsufficiency (09/17/2018)	0 - No Evidence for Haploinsufficiency (09/17/2018)	https://search.clinicalgenome.org/kb/gene-dosage/HGNC:7739	Dosage Working Group				Assertion Pending (12/20/2017)	https://search.clinicalgenome.org/kb/gene-validity/https://actionability.clinicalgenome.org/ac/Adult/ui/stg2SummaryRpt?doc=AC129	Adult Actionability Working Group
MONDO:0011906	HSD3B7	HGNC:18324	https://search.clinicalgenome.org/kb/genes/HGNC:18324	congenital bile acid synthesis defect 1	https://search.clinicalgenome.org/kb/conditions/MONDO:0011906		30 - Gene Associated with Autosomal Recessive Phenotype (08/22/2016)	0 - No Evidence for Haploinsufficiency (08/22/2016)	https://search.clinicalgenome.org/kb/gene-dosage/HGNC:18324	Dosage Working Group						
MONDO:0011912	MYO6	HGNC:7605	https://search.clinicalgenome.org/kb/genes/HGNC:7605	autosomal recessive nonsyndromic hearing loss 37	https://search.clinicalgenome.org/kb/conditions/MONDO:0011912									Strong Actionability (10/29/2020)	https://search.clinicalgenome.org/kb/gene-validity/https://actionability.clinicalgenome.org/ac/Pediatric/ui/stg2SummaryRpt?doc=AC1018	Pediatric Actionability Working Group
MONDO:0011917	CD2AP	HGNC:14258	https://search.clinicalgenome.org/kb/genes/HGNC:14258	focal segmental glomerulosclerosis 3, susceptibility to	https://search.clinicalgenome.org/kb/conditions/MONDO:0011917	Semidominant inheritance					definitive evidence (12/13/2021)	https://search.clinicalgenome.org/kb/gene-validity/CGGV:assertion_2cae2640-258f-4ba1-8510-2b4db97cf36c-2021-12-13T013000.000Z	Glomerulopathy			
MONDO:0011921	TSHZ1	HGNC:10669	https://search.clinicalgenome.org/kb/genes/HGNC:10669	aural atresia, congenital	https://search.clinicalgenome.org/kb/conditions/MONDO:0011921	Autosomal dominant inheritance					limited evidence (08/25/2020)	https://search.clinicalgenome.org/kb/gene-validity/CGGV:assertion_cfbe0bb6-f9c6-447b-bec9-911af6a67566-2020-08-25T130420.457Z	Syndromic Disorders			
MONDO:0011932	DSG4	HGNC:21307	https://search.clinicalgenome.org/kb/genes/HGNC:21307	hypotrichosis 6	https://search.clinicalgenome.org/kb/conditions/MONDO:0011932		30 - Gene Associated with Autosomal Recessive Phenotype (08/22/2016)	0 - No Evidence for Haploinsufficiency (08/22/2016)	https://search.clinicalgenome.org/kb/gene-dosage/HGNC:21307	Dosage Working Group						
MONDO:0011936	BMP4	HGNC:1071	https://search.clinicalgenome.org/kb/genes/HGNC:1071	microphthalmia with brain and digit anomalies	https://search.clinicalgenome.org/kb/conditions/MONDO:0011936		2 - Emerging Evidence for Haploinsufficiency (11/09/2021)	0 - No Evidence for Haploinsufficiency (11/09/2021)	https://search.clinicalgenome.org/kb/gene-dosage/HGNC:1071	Dosage Working Group						
MONDO:0011938	GATA4	HGNC:4173	https://search.clinicalgenome.org/kb/genes/HGNC:4173	atrial septal defect 2	https://search.clinicalgenome.org/kb/conditions/MONDO:0011938		3 - Sufficient Evidence for Haploinsufficiency (02/08/2017)	0 - No Evidence for Haploinsufficiency (02/08/2017)	https://search.clinicalgenome.org/kb/gene-dosage/HGNC:4173	Dosage Working Group						
MONDO:0011939	ACP5	HGNC:124	https://search.clinicalgenome.org/kb/genes/HGNC:124	Spondyloenchondrodysplasia with immune dysregulation	https://search.clinicalgenome.org/kb/conditions/MONDO:0011939		30 - Gene Associated with Autosomal Recessive Phenotype (08/22/2016)	0 - No Evidence for Haploinsufficiency (08/22/2016)	https://search.clinicalgenome.org/kb/gene-dosage/HGNC:124	Dosage Working Group						
MONDO:0011945	GBA	HGNC:4177	https://search.clinicalgenome.org/kb/genes/HGNC:4177	Gaucher disease perinatal lethal	https://search.clinicalgenome.org/kb/conditions/MONDO:0011945		30 - Gene Associated with Autosomal Recessive Phenotype (08/22/2016)	0 - No Evidence for Haploinsufficiency (08/22/2016)	https://search.clinicalgenome.org/kb/gene-dosage/HGNC:4177	Dosage Working Group				Assertion Pending (04/04/2016)	https://search.clinicalgenome.org/kb/gene-validity/https://actionability.clinicalgenome.org/ac/Adult/ui/stg2SummaryRpt?doc=AC104	Adult Actionability Working Group
MONDO:0011946	BMPER	HGNC:24154	https://search.clinicalgenome.org/kb/genes/HGNC:24154	diaphanospondylodysostosis	https://search.clinicalgenome.org/kb/conditions/MONDO:0011946		30 - Gene Associated with Autosomal Recessive Phenotype (08/22/2016)		https://search.clinicalgenome.org/kb/gene-dosage/HGNC:24154	Dosage Working Group						
MONDO:0011951	FUS	HGNC:4010	https://search.clinicalgenome.org/kb/genes/HGNC:4010	amyotrophic lateral sclerosis type 6	https://search.clinicalgenome.org/kb/conditions/MONDO:0011951	Autosomal dominant inheritance					definitive evidence (10/12/2021)	https://search.clinicalgenome.org/kb/gene-validity/CGGV:assertion_b2e8f55b-371e-438f-8923-73ca9b7ec034-2021-10-12T183601.087Z	Amyotrophic Lateral Sclerosis Spectrum Disorders			
MONDO:0011966	ARFGEF2	HGNC:15853	https://search.clinicalgenome.org/kb/genes/HGNC:15853	periventricular heterotopia with microcephaly, autosomal recessive	https://search.clinicalgenome.org/kb/conditions/MONDO:0011966		30 - Gene Associated with Autosomal Recessive Phenotype (08/22/2016)	0 - No Evidence for Haploinsufficiency (08/22/2016)	https://search.clinicalgenome.org/kb/gene-dosage/HGNC:15853	Dosage Working Group						
MONDO:0011971	UNG	HGNC:12572	https://search.clinicalgenome.org/kb/genes/HGNC:12572	hyper-IgM syndrome type 5	https://search.clinicalgenome.org/kb/conditions/MONDO:0011971	Autosomal recessive inheritance					moderate evidence (08/17/2021)	https://search.clinicalgenome.org/kb/gene-validity/CGGV:assertion_336745e2-39bc-429c-8b0d-fd73216522a5-2021-08-17T160000.000Z	Antibody Deficiencies GCEP			
MONDO:0011975	MEG3	HGNC:14575	https://search.clinicalgenome.org/kb/genes/HGNC:14575	paternal uniparental disomy of chromosome 14	https://search.clinicalgenome.org/kb/conditions/MONDO:0011975		1 - Little Evidence for Haploinsufficiency (04/25/2012)	0 - No Evidence for Haploinsufficiency (04/25/2012)	https://search.clinicalgenome.org/kb/gene-dosage/HGNC:14575	Dosage Working Group						
MONDO:0011988	RAC2	HGNC:9802	https://search.clinicalgenome.org/kb/genes/HGNC:9802	neutrophil immunodeficiency syndrome	https://search.clinicalgenome.org/kb/conditions/MONDO:0011988	Autosomal dominant inheritance					moderate evidence (12/21/2021)	https://search.clinicalgenome.org/kb/gene-validity/CGGV:assertion_f415e195-889f-4812-becd-5b3e7fe6b84f-2021-12-21T135017.284Z	Antibody Deficiencies GCEP			
MONDO:0011997	AP3B1	HGNC:566	https://search.clinicalgenome.org/kb/genes/HGNC:566	Hermansky-Pudlak syndrome 2	https://search.clinicalgenome.org/kb/conditions/MONDO:0011997	Autosomal recessive inheritance					definitive evidence (02/26/2020)	https://search.clinicalgenome.org/kb/gene-validity/CGGV:assertion_00ce813c-9493-48f9-9351-b70defb71d75-2020-02-26T170000.000Z	Hemostasis Thrombosis			
MONDO:0011998	ARHGEF10	HGNC:14103	https://search.clinicalgenome.org/kb/genes/HGNC:14103	autosomal dominant slowed nerve conduction velocity	https://search.clinicalgenome.org/kb/conditions/MONDO:0011998	Autosomal dominant inheritance					limited evidence (10/05/2020)	https://search.clinicalgenome.org/kb/gene-validity/CGGV:assertion_b23121f9-57e1-48ac-a2bc-d5a293829530-2020-10-05T160423.090Z	Charcot-Marie-Tooth			
MONDO:0012003	HGF	HGNC:4893	https://search.clinicalgenome.org/kb/genes/HGNC:4893	autosomal recessive nonsyndromic hearing loss 39	https://search.clinicalgenome.org/kb/conditions/MONDO:0012003		30 - Gene Associated with Autosomal Recessive Phenotype (08/22/2016)		https://search.clinicalgenome.org/kb/gene-dosage/HGNC:4893	Dosage Working Group						
MONDO:0012029	CENPJ	HGNC:17272	https://search.clinicalgenome.org/kb/genes/HGNC:17272	microcephaly 6, primary, autosomal recessive	https://search.clinicalgenome.org/kb/conditions/MONDO:0012029		30 - Gene Associated with Autosomal Recessive Phenotype (08/22/2016)		https://search.clinicalgenome.org/kb/gene-dosage/HGNC:17272	Dosage Working Group						
MONDO:0012031	CD36	HGNC:1663	https://search.clinicalgenome.org/kb/genes/HGNC:1663	platelet-type bleeding disorder 10	https://search.clinicalgenome.org/kb/conditions/MONDO:0012031		30 - Gene Associated with Autosomal Recessive Phenotype (08/22/2016)		https://search.clinicalgenome.org/kb/gene-dosage/HGNC:1663	Dosage Working Group						
MONDO:0012033	RGS9	HGNC:10004	https://search.clinicalgenome.org/kb/genes/HGNC:10004	bradyopsia	https://search.clinicalgenome.org/kb/conditions/MONDO:0012033	Autosomal recessive inheritance					moderate evidence (09/08/2021)	https://search.clinicalgenome.org/kb/gene-validity/CGGV:assertion_f90aa6cd-9e08-4fab-b6c3-570beb8232dd-2021-09-08T160000.000Z	Retina			
MONDO:0012041	MUTYH	HGNC:7527	https://search.clinicalgenome.org/kb/genes/HGNC:7527	MUTYH-related attenuated familial adenomatous polyposis	https://search.clinicalgenome.org/kb/conditions/MONDO:0012041	Autosomal recessive inheritance | Autosomal dominant inheritance	30 - Gene Associated with Autosomal Recessive Phenotype (11/11/2015)	0 - No Evidence for Haploinsufficiency (11/11/2015)	https://search.clinicalgenome.org/kb/gene-dosage/HGNC:7527	Dosage Working Group	definitive evidence (06/12/2017) | moderate evidence (10/09/2017)	https://search.clinicalgenome.org/kb/gene-validity/CGGCIEX:assertion_9855 | https://search.clinicalgenome.org/kb/gene-validity/CGGCIEX:assertion_10072	Colon Cancer | Colon Cancer	Strong Actionability (01/31/2018) | Has Insufficient Evidence for Actionability Based on Early Rule-out (02/10/2020)	https://search.clinicalgenome.org/kb/gene-validity/https://actionability.clinicalgenome.org/ac/Adult/ui/stg2SummaryRpt?doc=AC070 | https://search.clinicalgenome.org/kb/gene-validity/https://actionability.clinicalgenome.org/ac/Pediatric/ui/stg2SummaryRpt?doc=AC070	Adult Actionability Working Group | Pediatric Actionability Working Group
MONDO:0012052	ALG1	HGNC:18294	https://search.clinicalgenome.org/kb/genes/HGNC:18294	ALG1-CDG	https://search.clinicalgenome.org/kb/conditions/MONDO:0012052		30 - Gene Associated with Autosomal Recessive Phenotype (08/22/2016)		https://search.clinicalgenome.org/kb/gene-dosage/HGNC:18294	Dosage Working Group						
MONDO:0012060	ESRRB	HGNC:3473	https://search.clinicalgenome.org/kb/genes/HGNC:3473	autosomal recessive nonsyndromic hearing loss 35	https://search.clinicalgenome.org/kb/conditions/MONDO:0012060									Strong Actionability (10/29/2020)	https://search.clinicalgenome.org/kb/gene-validity/https://actionability.clinicalgenome.org/ac/Pediatric/ui/stg2SummaryRpt?doc=AC1018	Pediatric Actionability Working Group
MONDO:0012071	AGPAT2	HGNC:325	https://search.clinicalgenome.org/kb/genes/HGNC:325	congenital generalized lipodystrophy type 1	https://search.clinicalgenome.org/kb/conditions/MONDO:0012071		30 - Gene Associated with Autosomal Recessive Phenotype (08/22/2016)	0 - No Evidence for Haploinsufficiency (08/22/2016)	https://search.clinicalgenome.org/kb/gene-dosage/HGNC:325	Dosage Working Group						
MONDO:0012075	AXIN2	HGNC:904	https://search.clinicalgenome.org/kb/genes/HGNC:904	oligodontia-cancer predisposition syndrome	https://search.clinicalgenome.org/kb/conditions/MONDO:0012075	Autosomal dominant inheritance	3 - Sufficient Evidence for Haploinsufficiency (12/08/2021)	0 - No Evidence for Haploinsufficiency (12/08/2021)	https://search.clinicalgenome.org/kb/gene-dosage/HGNC:904	Dosage Working Group	moderate evidence (06/08/2017)	https://search.clinicalgenome.org/kb/gene-validity/CGGCIEX:assertion_8439	Colon Cancer			
MONDO:0012077	VAPB	HGNC:12649	https://search.clinicalgenome.org/kb/genes/HGNC:12649	amyotrophic lateral sclerosis type 8	https://search.clinicalgenome.org/kb/conditions/MONDO:0012077	Autosomal dominant inheritance					definitive evidence (12/15/2021)	https://search.clinicalgenome.org/kb/gene-validity/CGGV:assertion_da78d57d-1525-47b3-a649-743186d28eff-2021-12-15T183034.352Z	Amyotrophic Lateral Sclerosis Spectrum Disorders			
MONDO:0012078	AHI1	HGNC:21575	https://search.clinicalgenome.org/kb/genes/HGNC:21575	Joubert syndrome 3	https://search.clinicalgenome.org/kb/conditions/MONDO:0012078	Autosomal recessive inheritance	30 - Gene Associated with Autosomal Recessive Phenotype (09/06/2012)	0 - No Evidence for Haploinsufficiency (09/06/2012)	https://search.clinicalgenome.org/kb/gene-dosage/HGNC:21575	Dosage Working Group	definitive evidence (10/26/2021)	https://search.clinicalgenome.org/kb/gene-validity/CGGV:assertion_d0d8d22f-cea6-4f4f-bc71-e85303dccac1-2021-10-26T143345.589Z	Brain Malformations			
MONDO:0012084	DDC	HGNC:2719	https://search.clinicalgenome.org/kb/genes/HGNC:2719	aromatic L-amino acid decarboxylase deficiency	https://search.clinicalgenome.org/kb/conditions/MONDO:0012084	Autosomal recessive inheritance					definitive evidence (02/25/2022)	https://search.clinicalgenome.org/kb/gene-validity/CGGV:assertion_1dea33e3-7cf6-47f9-aa52-2525b439031a-2022-02-25T170000.000Z	General Inborn Errors of Metabolism			
MONDO:0012085	DNAH5	HGNC:2950	https://search.clinicalgenome.org/kb/genes/HGNC:2950	primary ciliary dyskinesia 3	https://search.clinicalgenome.org/kb/conditions/MONDO:0012085	Autosomal recessive inheritance	30 - Gene Associated with Autosomal Recessive Phenotype (08/22/2016)	0 - No Evidence for Haploinsufficiency (08/22/2016)	https://search.clinicalgenome.org/kb/gene-dosage/HGNC:2950	Dosage Working Group	definitive evidence (01/07/2022)	https://search.clinicalgenome.org/kb/gene-validity/CGGV:assertion_4390dba1-012d-4e08-a841-ffc08ebdc737-2022-01-07T190607.723Z	Motile Ciliopathy			
MONDO:0012088	HYDIN	HGNC:19368	https://search.clinicalgenome.org/kb/genes/HGNC:19368	primary ciliary dyskinesia 5	https://search.clinicalgenome.org/kb/conditions/MONDO:0012088	Autosomal recessive inheritance					definitive evidence (02/22/2022)	https://search.clinicalgenome.org/kb/gene-validity/CGGV:assertion_6c491ab7-496f-43b9-9bca-500901cb686d-2022-02-22T183411.247Z	Motile Ciliopathy			
MONDO:0012106	ASPM	HGNC:19048	https://search.clinicalgenome.org/kb/genes/HGNC:19048	microcephaly 5, primary, autosomal recessive	https://search.clinicalgenome.org/kb/conditions/MONDO:0012106		30 - Gene Associated with Autosomal Recessive Phenotype (08/22/2016)	0 - No Evidence for Haploinsufficiency (08/22/2016)	https://search.clinicalgenome.org/kb/gene-dosage/HGNC:19048	Dosage Working Group						
MONDO:0012111	MYL3	HGNC:7584	https://search.clinicalgenome.org/kb/genes/HGNC:7584	hypertrophic cardiomyopathy 8	https://search.clinicalgenome.org/kb/conditions/MONDO:0012111		0 - No Evidence for Haploinsufficiency (11/18/2015)	0 - No Evidence for Haploinsufficiency (11/18/2015)	https://search.clinicalgenome.org/kb/gene-dosage/HGNC:7584	Dosage Working Group				Assertion Pending (08/14/2017)	https://search.clinicalgenome.org/kb/gene-validity/https://actionability.clinicalgenome.org/ac/Adult/ui/stg2SummaryRpt?doc=AC056	Adult Actionability Working Group
MONDO:0012112	MYL2	HGNC:7583	https://search.clinicalgenome.org/kb/genes/HGNC:7583	hypertrophic cardiomyopathy 10	https://search.clinicalgenome.org/kb/conditions/MONDO:0012112	Autosomal dominant inheritance	30 - Gene Associated with Autosomal Recessive Phenotype (11/20/2015)	0 - No Evidence for Haploinsufficiency (11/20/2015)	https://search.clinicalgenome.org/kb/gene-dosage/HGNC:7583	Dosage Working Group	definitive evidence (02/07/2017)	https://search.clinicalgenome.org/kb/gene-validity/CGGCIEX:assertion_8768	Hypertrophic Cardiomyopathy	Assertion Pending (08/14/2017)	https://search.clinicalgenome.org/kb/gene-validity/https://actionability.clinicalgenome.org/ac/Adult/ui/stg2SummaryRpt?doc=AC056	Adult Actionability Working Group
MONDO:0012118	COG7	HGNC:18622	https://search.clinicalgenome.org/kb/genes/HGNC:18622	COG7-CDG	https://search.clinicalgenome.org/kb/conditions/MONDO:0012118		30 - Gene Associated with Autosomal Recessive Phenotype (04/09/2015)	0 - No Evidence for Haploinsufficiency (04/09/2015)	https://search.clinicalgenome.org/kb/gene-dosage/HGNC:18622	Dosage Working Group						
MONDO:0012120	PDP1	HGNC:9279	https://search.clinicalgenome.org/kb/genes/HGNC:9279	pyruvate dehydrogenase phosphatase deficiency	https://search.clinicalgenome.org/kb/conditions/MONDO:0012120		30 - Gene Associated with Autosomal Recessive Phenotype (08/22/2016)		https://search.clinicalgenome.org/kb/gene-dosage/HGNC:9279	Dosage Working Group						
MONDO:0012123	DPM1	HGNC:3005	https://search.clinicalgenome.org/kb/genes/HGNC:3005	congenital disorder of glycosylation type 1E	https://search.clinicalgenome.org/kb/conditions/MONDO:0012123		30 - Gene Associated with Autosomal Recessive Phenotype (08/22/2016)	0 - No Evidence for Haploinsufficiency (08/22/2016)	https://search.clinicalgenome.org/kb/gene-dosage/HGNC:3005	Dosage Working Group						
MONDO:0012132	GALNT12	HGNC:19877	https://search.clinicalgenome.org/kb/genes/HGNC:19877	colorectal cancer, susceptibility to, 1	https://search.clinicalgenome.org/kb/conditions/MONDO:0012132	Autosomal dominant inheritance	1 - Little Evidence for Haploinsufficiency (09/09/2019)	0 - No Evidence for Haploinsufficiency (09/09/2019)	https://search.clinicalgenome.org/kb/gene-dosage/HGNC:19877	Dosage Working Group	limited evidence (06/08/2017)	https://search.clinicalgenome.org/kb/gene-validity/CGGCIEX:assertion_8435	Colon Cancer			
MONDO:0012136	CPT2	HGNC:2330	https://search.clinicalgenome.org/kb/genes/HGNC:2330	carnitine palmitoyl transferase II deficiency, neonatal form	https://search.clinicalgenome.org/kb/conditions/MONDO:0012136									Moderate Actionability (12/26/2020) | Moderate Actionability (12/26/2020)	https://search.clinicalgenome.org/kb/gene-validity/https://actionability.clinicalgenome.org/ac/Adult/ui/stg2SummaryRpt?doc=AC1022 | https://search.clinicalgenome.org/kb/gene-validity/https://actionability.clinicalgenome.org/ac/Pediatric/ui/stg2SummaryRpt?doc=AC1022	Adult Actionability Working Group | Pediatric Actionability Working Group
MONDO:0012160	PCYT1A	HGNC:8754	https://search.clinicalgenome.org/kb/genes/HGNC:8754	spondylometaphyseal dysplasia-cone-rod dystrophy syndrome	https://search.clinicalgenome.org/kb/conditions/MONDO:0012160	Autosomal recessive inheritance	30 - Gene Associated with Autosomal Recessive Phenotype (08/22/2016)	0 - No Evidence for Haploinsufficiency (08/22/2016)	https://search.clinicalgenome.org/kb/gene-dosage/HGNC:8754	Dosage Working Group	definitive evidence (07/26/2021)	https://search.clinicalgenome.org/kb/gene-validity/CGGV:assertion_eff306ea-95ff-4b4e-8597-f50849b1b4c2-2021-07-26T183711.748Z	Retina			
MONDO:0012161	CD8A	HGNC:1706	https://search.clinicalgenome.org/kb/genes/HGNC:1706	susceptibility to respiratory infections associated with CD8alpha chain mutation	https://search.clinicalgenome.org/kb/conditions/MONDO:0012161		30 - Gene Associated with Autosomal Recessive Phenotype (08/22/2016)	0 - No Evidence for Haploinsufficiency (08/22/2016)	https://search.clinicalgenome.org/kb/gene-dosage/HGNC:1706	Dosage Working Group						
MONDO:0012163	IL7R	HGNC:6024	https://search.clinicalgenome.org/kb/genes/HGNC:6024	severe combined immunodeficiency, autosomal recessive, T cell-negative, B cell-positive, NK cell-positive	https://search.clinicalgenome.org/kb/conditions/MONDO:0012163	Autosomal recessive inheritance					definitive evidence (06/22/2021)	https://search.clinicalgenome.org/kb/gene-validity/CGGV:assertion_6bab0c36-592e-439c-bedf-4ec095fd47e8-2021-06-22T164843.040Z	SCID-CID			
MONDO:0012170	ESPN	HGNC:13281	https://search.clinicalgenome.org/kb/genes/HGNC:13281	autosomal recessive nonsyndromic hearing loss 36	https://search.clinicalgenome.org/kb/conditions/MONDO:0012170		30 - Gene Associated with Autosomal Recessive Phenotype (02/07/2018)	0 - No Evidence for Haploinsufficiency (02/07/2018)	https://search.clinicalgenome.org/kb/gene-dosage/HGNC:13281	Dosage Working Group				Strong Actionability (10/29/2020)	https://search.clinicalgenome.org/kb/gene-validity/https://actionability.clinicalgenome.org/ac/Pediatric/ui/stg2SummaryRpt?doc=AC1018	Pediatric Actionability Working Group
MONDO:0012172	HADHA	HGNC:4801	https://search.clinicalgenome.org/kb/genes/HGNC:4801	mitochondrial trifunctional protein deficiency	https://search.clinicalgenome.org/kb/conditions/MONDO:0012172									Has Insufficient Evidence for Actionability Based on Early Rule-out (05/19/2021) | Moderate Actionability (05/19/2021)	https://search.clinicalgenome.org/kb/gene-validity/https://actionability.clinicalgenome.org/ac/Adult/ui/stg2SummaryRpt?doc=AC1039 | https://search.clinicalgenome.org/kb/gene-validity/https://actionability.clinicalgenome.org/ac/Pediatric/ui/stg2SummaryRpt?doc=AC1039	Adult Actionability Working Group | Pediatric Actionability Working Group
MONDO:0012173	HADHA	HGNC:4801	https://search.clinicalgenome.org/kb/genes/HGNC:4801	long chain 3-hydroxyacyl-CoA dehydrogenase deficiency	https://search.clinicalgenome.org/kb/conditions/MONDO:0012173	Autosomal recessive inheritance					definitive evidence (02/12/2018)	https://search.clinicalgenome.org/kb/gene-validity/CGGV:assertion_c8a5e15b-21f7-49cc-987c-5f3585742bbe-2018-02-12T170000.000Z	Fatty Acid Oxidation Disorders	Has Insufficient Evidence for Actionability Based on Early Rule-out (05/19/2021) | Moderate Actionability (05/19/2021)	https://search.clinicalgenome.org/kb/gene-validity/https://actionability.clinicalgenome.org/ac/Adult/ui/stg2SummaryRpt?doc=AC1039 | https://search.clinicalgenome.org/kb/gene-validity/https://actionability.clinicalgenome.org/ac/Pediatric/ui/stg2SummaryRpt?doc=AC1039	Adult Actionability Working Group | Pediatric Actionability Working Group
MONDO:0012180	PKP2	HGNC:9024	https://search.clinicalgenome.org/kb/genes/HGNC:9024	arrhythmogenic right ventricular dysplasia 9	https://search.clinicalgenome.org/kb/conditions/MONDO:0012180									Moderate Actionability (03/17/2020) | Strong Actionability (03/17/2020)	https://search.clinicalgenome.org/kb/gene-validity/https://actionability.clinicalgenome.org/ac/Adult/ui/stg2SummaryRpt?doc=AC039 | https://search.clinicalgenome.org/kb/gene-validity/https://actionability.clinicalgenome.org/ac/Pediatric/ui/stg2SummaryRpt?doc=AC039	Adult Actionability Working Group | Pediatric Actionability Working Group
MONDO:0012183	CDK4	HGNC:1773	https://search.clinicalgenome.org/kb/genes/HGNC:1773	melanoma, cutaneous malignant, susceptibility to, 3	https://search.clinicalgenome.org/kb/conditions/MONDO:0012183	Autosomal dominant inheritance	0 - No Evidence for Haploinsufficiency (09/02/2020)	0 - No Evidence for Haploinsufficiency (09/02/2020)	https://search.clinicalgenome.org/kb/gene-dosage/HGNC:1773	Dosage Working Group	definitive evidence (01/13/2020)	https://search.clinicalgenome.org/kb/gene-validity/CGGV:assertion_ca76579b-1432-4edc-84e8-b3332dce4ede-2020-01-13T194434.667Z	Hereditary Cancer			
MONDO:0012186	FANCI	HGNC:25568	https://search.clinicalgenome.org/kb/genes/HGNC:25568	Fanconi anemia complementation group I	https://search.clinicalgenome.org/kb/conditions/MONDO:0012186	Autosomal recessive inheritance	30 - Gene Associated with Autosomal Recessive Phenotype (08/22/2016)		https://search.clinicalgenome.org/kb/gene-dosage/HGNC:25568	Dosage Working Group	definitive evidence (06/15/2021)	https://search.clinicalgenome.org/kb/gene-validity/CGGV:assertion_a103db2f-a8b3-403b-993a-ac4215c118df-2021-06-15T233841.081Z	Hereditary Cancer			
MONDO:0012187	BRIP1	HGNC:20473	https://search.clinicalgenome.org/kb/genes/HGNC:20473	Fanconi anemia complementation group J	https://search.clinicalgenome.org/kb/conditions/MONDO:0012187	Autosomal recessive inheritance	3 - Sufficient Evidence for Haploinsufficiency (02/15/2019)	0 - No Evidence for Haploinsufficiency (02/15/2019)	https://search.clinicalgenome.org/kb/gene-dosage/HGNC:20473	Dosage Working Group	definitive evidence (08/18/2019)	https://search.clinicalgenome.org/kb/gene-validity/CGGV:assertion_40aae4ea-8c9b-42a7-9d02-0f52a184712f-2019-08-18T160442.255Z	Hereditary Cancer			
MONDO:0012191	GFM1	HGNC:13780	https://search.clinicalgenome.org/kb/genes/HGNC:13780	hepatoencephalopathy due to combined oxidative phosphorylation defect type 1	https://search.clinicalgenome.org/kb/conditions/MONDO:0012191		30 - Gene Associated with Autosomal Recessive Phenotype (08/22/2016)	0 - No Evidence for Haploinsufficiency (08/22/2016)	https://search.clinicalgenome.org/kb/gene-dosage/HGNC:13780	Dosage Working Group						
MONDO:0012212	TGFBR1	HGNC:11772	https://search.clinicalgenome.org/kb/genes/HGNC:11772	Loeys-Dietz syndrome 1	https://search.clinicalgenome.org/kb/conditions/MONDO:0012212		2 - Emerging Evidence for Haploinsufficiency (04/25/2012)	0 - No Evidence for Haploinsufficiency (04/25/2012)	https://search.clinicalgenome.org/kb/gene-dosage/HGNC:11772	Dosage Working Group				Strong Actionability (03/01/2019) | Strong Actionability (03/01/2019)	https://search.clinicalgenome.org/kb/gene-validity/https://actionability.clinicalgenome.org/ac/Adult/ui/stg2SummaryRpt?doc=AC067 | https://search.clinicalgenome.org/kb/gene-validity/https://actionability.clinicalgenome.org/ac/Pediatric/ui/stg2SummaryRpt?doc=AC067	Adult Actionability Working Group | Pediatric Actionability Working Group
MONDO:0012216	SLC38A8	HGNC:32434	https://search.clinicalgenome.org/kb/genes/HGNC:32434	foveal hypoplasia - optic nerve decussation defect - anterior segment dysgenesis syndrome	https://search.clinicalgenome.org/kb/conditions/MONDO:0012216		30 - Gene Associated with Autosomal Recessive Phenotype (08/22/2016)	0 - No Evidence for Haploinsufficiency (08/22/2016)	https://search.clinicalgenome.org/kb/gene-dosage/HGNC:32434	Dosage Working Group						
MONDO:0012217	PLOD2	HGNC:9082	https://search.clinicalgenome.org/kb/genes/HGNC:9082	Bruck syndrome 2	https://search.clinicalgenome.org/kb/conditions/MONDO:0012217		30 - Gene Associated with Autosomal Recessive Phenotype (08/22/2016)		https://search.clinicalgenome.org/kb/gene-dosage/HGNC:9082	Dosage Working Group						
MONDO:0012220	MLPH	HGNC:29643	https://search.clinicalgenome.org/kb/genes/HGNC:29643	Griscelli syndrome type 3	https://search.clinicalgenome.org/kb/conditions/MONDO:0012220		30 - Gene Associated with Autosomal Recessive Phenotype (08/22/2016)		https://search.clinicalgenome.org/kb/gene-dosage/HGNC:29643	Dosage Working Group						
MONDO:0012237	KBTBD13	HGNC:37227	https://search.clinicalgenome.org/kb/genes/HGNC:37227	nemaline myopathy 6	https://search.clinicalgenome.org/kb/conditions/MONDO:0012237	Autosomal dominant inheritance					moderate evidence (06/22/2020)	https://search.clinicalgenome.org/kb/gene-validity/CGGV:assertion_ff2f157e-741b-447d-a6c5-1d003e2e98e1-2020-06-22T142022.592Z	Congenital Myopathies			
MONDO:0012243	TOP2B	HGNC:11990	https://search.clinicalgenome.org/kb/genes/HGNC:11990	B-cell immunodeficiency, distal limb anomalies, and urogenital malformations	https://search.clinicalgenome.org/kb/conditions/MONDO:0012243	Autosomal dominant inheritance					moderate evidence (10/19/2021)	https://search.clinicalgenome.org/kb/gene-validity/CGGV:assertion_677a64c1-b005-44f6-9846-a7f371222667-2021-10-19T125736.122Z	Antibody Deficiencies GCEP			
MONDO:0012249	MLH1	HGNC:7127	https://search.clinicalgenome.org/kb/genes/HGNC:7127	colorectal cancer, hereditary nonpolyposis, type 2	https://search.clinicalgenome.org/kb/conditions/MONDO:0012249	Autosomal dominant inheritance	3 - Sufficient Evidence for Haploinsufficiency (10/13/2021)	0 - No Evidence for Haploinsufficiency (10/13/2021)	https://search.clinicalgenome.org/kb/gene-dosage/HGNC:7127	Dosage Working Group	definitive evidence (07/10/2017)	https://search.clinicalgenome.org/kb/gene-validity/CGGCIEX:assertion_9848	Colon Cancer	Has Insufficient Evidence for Actionability Based on Early Rule-out (09/15/2021) | Definitive Actionability (02/11/2015)	https://search.clinicalgenome.org/kb/gene-validity/https://actionability.clinicalgenome.org/ac/Pediatric/ui/stg2SummaryRpt?doc=AC069 | https://search.clinicalgenome.org/kb/gene-validity/https://actionability.clinicalgenome.org/ac/Adult/ui/stg2SummaryRpt?doc=AC069	Pediatric Actionability Working Group | Adult Actionability Working Group
MONDO:0012250	FGD4	HGNC:19125	https://search.clinicalgenome.org/kb/genes/HGNC:19125	Charcot-Marie-Tooth disease type 4H	https://search.clinicalgenome.org/kb/conditions/MONDO:0012250		30 - Gene Associated with Autosomal Recessive Phenotype (08/22/2016)	0 - No Evidence for Haploinsufficiency (08/22/2016)	https://search.clinicalgenome.org/kb/gene-dosage/HGNC:19125	Dosage Working Group						
MONDO:0012252	SMARCB1	HGNC:11103	https://search.clinicalgenome.org/kb/genes/HGNC:11103	rhabdoid tumor predisposition syndrome 1	https://search.clinicalgenome.org/kb/conditions/MONDO:0012252	Autosomal dominant inheritance	3 - Sufficient Evidence for Haploinsufficiency (04/22/2020)	0 - No Evidence for Haploinsufficiency (04/22/2020)	https://search.clinicalgenome.org/kb/gene-dosage/HGNC:11103	Dosage Working Group	definitive evidence (10/12/2018)	https://search.clinicalgenome.org/kb/gene-validity/CGGV:assertion_8d7390e7-0bb1-4ba1-b97e-7f666b52c86b-2018-10-12T205953.762Z	Hereditary Cancer	Has Insufficient Evidence for Actionability Based on Expert Review (03/09/2021) | Limited Actionability (03/09/2021)	https://search.clinicalgenome.org/kb/gene-validity/https://actionability.clinicalgenome.org/ac/Adult/ui/stg2SummaryRpt?doc=AC1024 | https://search.clinicalgenome.org/kb/gene-validity/https://actionability.clinicalgenome.org/ac/Pediatric/ui/stg2SummaryRpt?doc=AC1024	Adult Actionability Working Group | Pediatric Actionability Working Group
MONDO:0012256	DDHD1	HGNC:19714	https://search.clinicalgenome.org/kb/genes/HGNC:19714	hereditary spastic paraplegia 28	https://search.clinicalgenome.org/kb/conditions/MONDO:0012256		30 - Gene Associated with Autosomal Recessive Phenotype (09/25/2014)	0 - No Evidence for Haploinsufficiency (09/25/2014)	https://search.clinicalgenome.org/kb/gene-dosage/HGNC:19714	Dosage Working Group						
MONDO:0012273	CIB2	HGNC:24579	https://search.clinicalgenome.org/kb/genes/HGNC:24579	autosomal recessive nonsyndromic hearing loss 48	https://search.clinicalgenome.org/kb/conditions/MONDO:0012273									Strong Actionability (10/29/2020)	https://search.clinicalgenome.org/kb/gene-validity/https://actionability.clinicalgenome.org/ac/Pediatric/ui/stg2SummaryRpt?doc=AC1018	Pediatric Actionability Working Group
MONDO:0012276	KCNMA1	HGNC:6284	https://search.clinicalgenome.org/kb/genes/HGNC:6284	generalized epilepsy-paroxysmal dyskinesia syndrome	https://search.clinicalgenome.org/kb/conditions/MONDO:0012276	Autosomal dominant inheritance | Autosomal recessive inheritance					definitive evidence (03/08/2022) | moderate evidence (03/08/2022)	https://search.clinicalgenome.org/kb/gene-validity/CGGV:assertion_4bd10bb7-67d0-4c30-a944-9a46fd2f361a-2022-03-08T104405.484Z | https://search.clinicalgenome.org/kb/gene-validity/CGGV:assertion_9aabc05e-8452-4b72-bd07-ae1a1fc40dfc-2022-03-08T114915.435Z	Epilepsy | Epilepsy			
MONDO:0012280	KIFBP	HGNC:23419	https://search.clinicalgenome.org/kb/genes/HGNC:23419	Goldberg-Shprintzen megacolon syndrome	https://search.clinicalgenome.org/kb/conditions/MONDO:0012280		30 - Gene Associated with Autosomal Recessive Phenotype (08/22/2016)		https://search.clinicalgenome.org/kb/gene-dosage/HGNC:23419	Dosage Working Group						
MONDO:0012289	FLNC	HGNC:3756	https://search.clinicalgenome.org/kb/genes/HGNC:3756	myofibrillar myopathy 5	https://search.clinicalgenome.org/kb/conditions/MONDO:0012289	Autosomal dominant inheritance	3 - Sufficient Evidence for Haploinsufficiency (07/13/2021)	0 - No Evidence for Haploinsufficiency (07/13/2021)	https://search.clinicalgenome.org/kb/gene-dosage/HGNC:3756	Dosage Working Group	definitive evidence (12/12/2017)	https://search.clinicalgenome.org/kb/gene-validity/CGGCIEX:assertion_10057	Hypertrophic Cardiomyopathy	Moderate Actionability (09/06/2018)	https://search.clinicalgenome.org/kb/gene-validity/https://actionability.clinicalgenome.org/ac/Adult/ui/stg2SummaryRpt?doc=AC155	Adult Actionability Working Group
MONDO:0012290	SNAP29	HGNC:11133	https://search.clinicalgenome.org/kb/genes/HGNC:11133	CEDNIK syndrome	https://search.clinicalgenome.org/kb/conditions/MONDO:0012290		30 - Gene Associated with Autosomal Recessive Phenotype (08/22/2016)		https://search.clinicalgenome.org/kb/gene-dosage/HGNC:11133	Dosage Working Group						
MONDO:0012309	ALX4	HGNC:450	https://search.clinicalgenome.org/kb/genes/HGNC:450	parietal foramina 2	https://search.clinicalgenome.org/kb/conditions/MONDO:0012309		3 - Sufficient Evidence for Haploinsufficiency (07/22/2020)	0 - No Evidence for Haploinsufficiency (07/22/2020)	https://search.clinicalgenome.org/kb/gene-dosage/HGNC:450	Dosage Working Group						
MONDO:0012316	LPIN2	HGNC:14450	https://search.clinicalgenome.org/kb/genes/HGNC:14450	Majeed syndrome	https://search.clinicalgenome.org/kb/conditions/MONDO:0012316		30 - Gene Associated with Autosomal Recessive Phenotype (08/22/2016)	0 - No Evidence for Haploinsufficiency (08/22/2016)	https://search.clinicalgenome.org/kb/gene-dosage/HGNC:14450	Dosage Working Group						
MONDO:0012322	ZIC2	HGNC:12873	https://search.clinicalgenome.org/kb/genes/HGNC:12873	holoprosencephaly 5	https://search.clinicalgenome.org/kb/conditions/MONDO:0012322		3 - Sufficient Evidence for Haploinsufficiency (07/06/2012)	0 - No Evidence for Haploinsufficiency (07/06/2012)	https://search.clinicalgenome.org/kb/gene-dosage/HGNC:12873	Dosage Working Group						
MONDO:0012326	ILDR1	HGNC:28741	https://search.clinicalgenome.org/kb/genes/HGNC:28741	autosomal recessive nonsyndromic hearing loss 42	https://search.clinicalgenome.org/kb/conditions/MONDO:0012326									Strong Actionability (10/29/2020)	https://search.clinicalgenome.org/kb/gene-validity/https://actionability.clinicalgenome.org/ac/Pediatric/ui/stg2SummaryRpt?doc=AC1018	Pediatric Actionability Working Group
MONDO:0012345	TGM5	HGNC:11781	https://search.clinicalgenome.org/kb/genes/HGNC:11781	acral peeling skin syndrome	https://search.clinicalgenome.org/kb/conditions/MONDO:0012345		30 - Gene Associated with Autosomal Recessive Phenotype (08/22/2016)		https://search.clinicalgenome.org/kb/gene-dosage/HGNC:11781	Dosage Working Group						
MONDO:0012349	LFNG	HGNC:6560	https://search.clinicalgenome.org/kb/genes/HGNC:6560	spondylocostal dysostosis 3, autosomal recessive	https://search.clinicalgenome.org/kb/conditions/MONDO:0012349		30 - Gene Associated with Autosomal Recessive Phenotype (08/22/2016)		https://search.clinicalgenome.org/kb/gene-dosage/HGNC:6560	Dosage Working Group						
MONDO:0012354	P2RY12	HGNC:18124	https://search.clinicalgenome.org/kb/genes/HGNC:18124	platelet-type bleeding disorder 8	https://search.clinicalgenome.org/kb/conditions/MONDO:0012354	Autosomal dominant inheritance					moderate evidence (08/26/2020)	https://search.clinicalgenome.org/kb/gene-validity/CGGV:assertion_81c56aba-1414-4365-a8de-847c080251f3-2020-08-26T160000.000Z	Hemostasis Thrombosis			
MONDO:0012355	TRIOBP	HGNC:17009	https://search.clinicalgenome.org/kb/genes/HGNC:17009	autosomal recessive nonsyndromic hearing loss 28	https://search.clinicalgenome.org/kb/conditions/MONDO:0012355		30 - Gene Associated with Autosomal Recessive Phenotype (08/22/2016)	0 - No Evidence for Haploinsufficiency (08/22/2016)	https://search.clinicalgenome.org/kb/gene-dosage/HGNC:17009	Dosage Working Group				Strong Actionability (10/29/2020)	https://search.clinicalgenome.org/kb/gene-validity/https://actionability.clinicalgenome.org/ac/Pediatric/ui/stg2SummaryRpt?doc=AC1018	Pediatric Actionability Working Group
MONDO:0012368	ACY1	HGNC:177	https://search.clinicalgenome.org/kb/genes/HGNC:177	aminoacylase 1 deficiency	https://search.clinicalgenome.org/kb/conditions/MONDO:0012368	Autosomal recessive inheritance					definitive evidence (09/25/2020)	https://search.clinicalgenome.org/kb/gene-validity/CGGV:assertion_67196825-d32f-4070-9c15-debaa2287b73-2020-09-25T160000.000Z	Aminoacidopathy			
MONDO:0012371	KRAS	HGNC:6407	https://search.clinicalgenome.org/kb/genes/HGNC:6407	Noonan syndrome 3	https://search.clinicalgenome.org/kb/conditions/MONDO:0012371		0 - No Evidence for Haploinsufficiency (10/08/2015)	0 - No Evidence for Haploinsufficiency (10/08/2015)	https://search.clinicalgenome.org/kb/gene-dosage/HGNC:6407	Dosage Working Group				Assertion Pending (07/01/2019) | Assertion Pending (07/01/2019)	https://search.clinicalgenome.org/kb/gene-validity/https://actionability.clinicalgenome.org/ac/Adult/ui/stg2SummaryRpt?doc=AC1003 | https://search.clinicalgenome.org/kb/gene-validity/https://actionability.clinicalgenome.org/ac/Pediatric/ui/stg2SummaryRpt?doc=AC1003	Adult Actionability Working Group | Pediatric Actionability Working Group
MONDO:0012392	ACADSB	HGNC:91	https://search.clinicalgenome.org/kb/genes/HGNC:91	2-methylbutyryl-CoA dehydrogenase deficiency	https://search.clinicalgenome.org/kb/conditions/MONDO:0012392	Autosomal recessive inheritance	30 - Gene Associated with Autosomal Recessive Phenotype (08/22/2016)		https://search.clinicalgenome.org/kb/gene-dosage/HGNC:91	Dosage Working Group	definitive evidence (03/22/2019)	https://search.clinicalgenome.org/kb/gene-validity/CGGV:assertion_8bfa3857-c96c-40ac-b4c1-2cf04fd4eb4f-2019-03-22T160000.000Z	Aminoacidopathy			
MONDO:0012393	GLUL	HGNC:4341	https://search.clinicalgenome.org/kb/genes/HGNC:4341	congenital brain dysgenesis due to glutamine synthetase deficiency	https://search.clinicalgenome.org/kb/conditions/MONDO:0012393	Autosomal recessive inheritance	30 - Gene Associated with Autosomal Recessive Phenotype (06/04/2015)	0 - No Evidence for Haploinsufficiency (06/04/2015)	https://search.clinicalgenome.org/kb/gene-dosage/HGNC:4341	Dosage Working Group	moderate evidence (06/29/2020)	https://search.clinicalgenome.org/kb/gene-validity/CGGV:assertion_d71d7866-437d-48bd-8a98-21e67abdd917-2020-06-29T174523.991Z	Aminoacidopathy			
MONDO:0012395	FYCO1	HGNC:14673	https://search.clinicalgenome.org/kb/genes/HGNC:14673	cataract 18	https://search.clinicalgenome.org/kb/conditions/MONDO:0012395		30 - Gene Associated with Autosomal Recessive Phenotype (05/20/2015)	0 - No Evidence for Haploinsufficiency (05/20/2015)	https://search.clinicalgenome.org/kb/gene-dosage/HGNC:14673	Dosage Working Group						
MONDO:0012407	PNPO	HGNC:30260	https://search.clinicalgenome.org/kb/genes/HGNC:30260	pyridoxal phosphate-responsive seizures	https://search.clinicalgenome.org/kb/conditions/MONDO:0012407	Autosomal recessive inheritance					definitive evidence (12/15/2020)	https://search.clinicalgenome.org/kb/gene-validity/CGGV:assertion_f3ff7b38-dd26-458a-afbb-4870785c42ec-2020-12-15T170000.000Z	Epilepsy			
MONDO:0012413	OTX2	HGNC:8522	https://search.clinicalgenome.org/kb/genes/HGNC:8522	syndromic microphthalmia type 5	https://search.clinicalgenome.org/kb/conditions/MONDO:0012413		3 - Sufficient Evidence for Haploinsufficiency (09/08/2020)	0 - No Evidence for Haploinsufficiency (09/08/2020)	https://search.clinicalgenome.org/kb/gene-dosage/HGNC:8522	Dosage Working Group						
MONDO:0012420	MARVELD2	HGNC:26401	https://search.clinicalgenome.org/kb/genes/HGNC:26401	autosomal recessive nonsyndromic hearing loss 49	https://search.clinicalgenome.org/kb/conditions/MONDO:0012420		30 - Gene Associated with Autosomal Recessive Phenotype (08/22/2016)	0 - No Evidence for Haploinsufficiency (08/22/2016)	https://search.clinicalgenome.org/kb/gene-dosage/HGNC:26401	Dosage Working Group				Strong Actionability (10/29/2020)	https://search.clinicalgenome.org/kb/gene-validity/https://actionability.clinicalgenome.org/ac/Pediatric/ui/stg2SummaryRpt?doc=AC1018	Pediatric Actionability Working Group
MONDO:0012426	CD247	HGNC:1677	https://search.clinicalgenome.org/kb/genes/HGNC:1677	immunodeficiency 25	https://search.clinicalgenome.org/kb/conditions/MONDO:0012426	Autosomal recessive inheritance					definitive evidence (03/11/2022)	https://search.clinicalgenome.org/kb/gene-validity/CGGV:assertion_438b6c1f-edc0-4a81-9c82-39627e5a69cd-2022-03-11T140552.812Z	SCID-CID			
MONDO:0012427	TGFBR2	HGNC:11773	https://search.clinicalgenome.org/kb/genes/HGNC:11773	Loeys-Dietz syndrome 2	https://search.clinicalgenome.org/kb/conditions/MONDO:0012427	Autosomal dominant inheritance	2 - Emerging Evidence for Haploinsufficiency (04/11/2012)	0 - No Evidence for Haploinsufficiency (04/11/2012)	https://search.clinicalgenome.org/kb/gene-dosage/HGNC:11773	Dosage Working Group	definitive evidence (11/25/2020)	https://search.clinicalgenome.org/kb/gene-validity/CGGV:assertion_73be8b4f-d823-44e5-ab76-faa3bc8eca84-2020-11-25T180000.000Z	General Gene Curation	Strong Actionability (03/01/2019) | Strong Actionability (03/01/2019)	https://search.clinicalgenome.org/kb/gene-validity/https://actionability.clinicalgenome.org/ac/Adult/ui/stg2SummaryRpt?doc=AC067 | https://search.clinicalgenome.org/kb/gene-validity/https://actionability.clinicalgenome.org/ac/Pediatric/ui/stg2SummaryRpt?doc=AC067	Adult Actionability Working Group | Pediatric Actionability Working Group
MONDO:0012434	DSG2	HGNC:3049	https://search.clinicalgenome.org/kb/genes/HGNC:3049	arrhythmogenic right ventricular dysplasia 10	https://search.clinicalgenome.org/kb/conditions/MONDO:0012434		1 - Little Evidence for Haploinsufficiency (11/16/2015)	0 - No Evidence for Haploinsufficiency (11/16/2015)	https://search.clinicalgenome.org/kb/gene-dosage/HGNC:3049	Dosage Working Group				Moderate Actionability (03/17/2020) | Strong Actionability (03/17/2020)	https://search.clinicalgenome.org/kb/gene-validity/https://actionability.clinicalgenome.org/ac/Adult/ui/stg2SummaryRpt?doc=AC039 | https://search.clinicalgenome.org/kb/gene-validity/https://actionability.clinicalgenome.org/ac/Pediatric/ui/stg2SummaryRpt?doc=AC039	Adult Actionability Working Group | Pediatric Actionability Working Group
MONDO:0012435	DNAJC19	HGNC:30528	https://search.clinicalgenome.org/kb/genes/HGNC:30528	3-methylglutaconic aciduria type 5	https://search.clinicalgenome.org/kb/conditions/MONDO:0012435	Autosomal recessive inheritance					definitive evidence (09/24/2021)	https://search.clinicalgenome.org/kb/gene-validity/CGGV:assertion_fa7f8087-632d-4044-9e20-722085c3b42c-2021-09-24T024347.391Z	General Inborn Errors of Metabolism			
MONDO:0012436	GLIS3	HGNC:28510	https://search.clinicalgenome.org/kb/genes/HGNC:28510	neonatal diabetes mellitus with congenital hypothyroidism	https://search.clinicalgenome.org/kb/conditions/MONDO:0012436		30 - Gene Associated with Autosomal Recessive Phenotype (08/22/2016)	0 - No Evidence for Haploinsufficiency (08/22/2016)	https://search.clinicalgenome.org/kb/gene-dosage/HGNC:28510	Dosage Working Group						
MONDO:0012439	NOTCH2	HGNC:7882	https://search.clinicalgenome.org/kb/genes/HGNC:7882	Alagille syndrome due to a NOTCH2 point mutation	https://search.clinicalgenome.org/kb/conditions/MONDO:0012439		0 - No Evidence for Haploinsufficiency (07/17/2014)	0 - No Evidence for Haploinsufficiency (07/17/2014)	https://search.clinicalgenome.org/kb/gene-dosage/HGNC:7882	Dosage Working Group						
MONDO:0012445	PJVK	HGNC:29502	https://search.clinicalgenome.org/kb/genes/HGNC:29502	autosomal recessive nonsyndromic hearing loss 59	https://search.clinicalgenome.org/kb/conditions/MONDO:0012445									Strong Actionability (10/29/2020)	https://search.clinicalgenome.org/kb/gene-validity/https://actionability.clinicalgenome.org/ac/Pediatric/ui/stg2SummaryRpt?doc=AC1018	Pediatric Actionability Working Group
MONDO:0012455	EHMT1	HGNC:24650	https://search.clinicalgenome.org/kb/genes/HGNC:24650	Kleefstra syndrome	https://search.clinicalgenome.org/kb/conditions/MONDO:0012455	Autosomal dominant inheritance	3 - Sufficient Evidence for Haploinsufficiency (07/06/2012)	1 - Little Evidence for Haploinsufficiency (07/06/2012)	https://search.clinicalgenome.org/kb/gene-dosage/HGNC:24650	Dosage Working Group	definitive evidence (06/07/2018)	https://search.clinicalgenome.org/kb/gene-validity/CGGV:assertion_db91a861-6a88-4848-b6d5-4772bdef52ff-2018-06-07T183128.103Z	Intellectual Disability and Autism			
MONDO:0012460	LHFPL5	HGNC:21253	https://search.clinicalgenome.org/kb/genes/HGNC:21253	autosomal recessive nonsyndromic hearing loss 67	https://search.clinicalgenome.org/kb/conditions/MONDO:0012460									Strong Actionability (10/29/2020)	https://search.clinicalgenome.org/kb/gene-validity/https://actionability.clinicalgenome.org/ac/Pediatric/ui/stg2SummaryRpt?doc=AC1018	Pediatric Actionability Working Group
MONDO:0012467	CLCF1	HGNC:17412	https://search.clinicalgenome.org/kb/genes/HGNC:17412	cold-induced sweating syndrome 2	https://search.clinicalgenome.org/kb/conditions/MONDO:0012467		30 - Gene Associated with Autosomal Recessive Phenotype (08/22/2016)		https://search.clinicalgenome.org/kb/gene-dosage/HGNC:17412	Dosage Working Group						
MONDO:0012472	RNASEH2A	HGNC:18518	https://search.clinicalgenome.org/kb/genes/HGNC:18518	Aicardi-Goutieres syndrome 4	https://search.clinicalgenome.org/kb/conditions/MONDO:0012472		30 - Gene Associated with Autosomal Recessive Phenotype (08/22/2016)		https://search.clinicalgenome.org/kb/gene-dosage/HGNC:18518	Dosage Working Group						
MONDO:0012475	KCNV2	HGNC:19698	https://search.clinicalgenome.org/kb/genes/HGNC:19698	cone dystrophy with supernormal rod response	https://search.clinicalgenome.org/kb/conditions/MONDO:0012475		30 - Gene Associated with Autosomal Recessive Phenotype (08/22/2016)		https://search.clinicalgenome.org/kb/gene-dosage/HGNC:19698	Dosage Working Group						
MONDO:0012485	S1PR2	HGNC:3169	https://search.clinicalgenome.org/kb/genes/HGNC:3169	autosomal recessive nonsyndromic hearing loss 68	https://search.clinicalgenome.org/kb/conditions/MONDO:0012485									Strong Actionability (10/29/2020)	https://search.clinicalgenome.org/kb/gene-validity/https://actionability.clinicalgenome.org/ac/Pediatric/ui/stg2SummaryRpt?doc=AC1018	Pediatric Actionability Working Group
MONDO:0012490	CABP4	HGNC:1386	https://search.clinicalgenome.org/kb/genes/HGNC:1386	cone-rod synaptic disorder, congenital nonprogressive	https://search.clinicalgenome.org/kb/conditions/MONDO:0012490		30 - Gene Associated with Autosomal Recessive Phenotype (08/22/2016)	0 - No Evidence for Haploinsufficiency (08/22/2016)	https://search.clinicalgenome.org/kb/gene-dosage/HGNC:1386	Dosage Working Group						
MONDO:0012496	KANSL1	HGNC:24565	https://search.clinicalgenome.org/kb/genes/HGNC:24565	Koolen-de Vries syndrome	https://search.clinicalgenome.org/kb/conditions/MONDO:0012496	Autosomal dominant inheritance	3 - Sufficient Evidence for Haploinsufficiency (04/11/2013)	0 - No Evidence for Haploinsufficiency (04/11/2013)	https://search.clinicalgenome.org/kb/gene-dosage/HGNC:24565	Dosage Working Group	definitive evidence (02/18/2022)	https://search.clinicalgenome.org/kb/gene-validity/CGGV:assertion_e89a0e87-314a-49b1-bb50-6b26aeaa1037-2022-02-18T120936.714Z	Intellectual Disability and Autism			
MONDO:0012502	SAMD9	HGNC:1348	https://search.clinicalgenome.org/kb/genes/HGNC:1348	normophosphatemic familial tumoral calcinosis	https://search.clinicalgenome.org/kb/conditions/MONDO:0012502		30 - Gene Associated with Autosomal Recessive Phenotype (08/22/2016)		https://search.clinicalgenome.org/kb/gene-dosage/HGNC:1348	Dosage Working Group						
MONDO:0012506	DSC2	HGNC:3036	https://search.clinicalgenome.org/kb/genes/HGNC:3036	arrhythmogenic right ventricular dysplasia 11	https://search.clinicalgenome.org/kb/conditions/MONDO:0012506		2 - Emerging Evidence for Haploinsufficiency (01/14/2016)	0 - No Evidence for Haploinsufficiency (01/14/2016)	https://search.clinicalgenome.org/kb/gene-dosage/HGNC:3036	Dosage Working Group				Moderate Actionability (03/17/2020) | Strong Actionability (03/17/2020)	https://search.clinicalgenome.org/kb/gene-validity/https://actionability.clinicalgenome.org/ac/Adult/ui/stg2SummaryRpt?doc=AC039 | https://search.clinicalgenome.org/kb/gene-validity/https://actionability.clinicalgenome.org/ac/Pediatric/ui/stg2SummaryRpt?doc=AC039	Adult Actionability Working Group | Pediatric Actionability Working Group
MONDO:0012516	EFTUD2	HGNC:30858	https://search.clinicalgenome.org/kb/genes/HGNC:30858	mandibulofacial dysostosis-microcephaly syndrome	https://search.clinicalgenome.org/kb/conditions/MONDO:0012516		3 - Sufficient Evidence for Haploinsufficiency (05/23/2013)	0 - No Evidence for Haploinsufficiency (05/23/2013)	https://search.clinicalgenome.org/kb/gene-dosage/HGNC:30858	Dosage Working Group						
MONDO:0012523	PRCD	HGNC:32528	https://search.clinicalgenome.org/kb/genes/HGNC:32528	retinitis pigmentosa 36	https://search.clinicalgenome.org/kb/conditions/MONDO:0012523		30 - Gene Associated with Autosomal Recessive Phenotype (08/22/2016)	0 - No Evidence for Haploinsufficiency (08/22/2016)	https://search.clinicalgenome.org/kb/gene-dosage/HGNC:32528	Dosage Working Group						
MONDO:0012526	F12	HGNC:3530	https://search.clinicalgenome.org/kb/genes/HGNC:3530	hereditary angioedema type 3	https://search.clinicalgenome.org/kb/conditions/MONDO:0012526	Autosomal dominant inheritance					moderate evidence (01/23/2020)	https://search.clinicalgenome.org/kb/gene-validity/CGGV:assertion_f40992c9-1172-4528-ab53-95108094d4b6-2020-01-23T173048.307Z	Hemostasis Thrombosis			
MONDO:0012528	PROK2	HGNC:18455	https://search.clinicalgenome.org/kb/genes/HGNC:18455	hypogonadotropic hypogonadism 4 with or without anosmia	https://search.clinicalgenome.org/kb/conditions/MONDO:0012528	Semidominant inheritance					definitive evidence (03/22/2022)	https://search.clinicalgenome.org/kb/gene-validity/CGGV:assertion_2305ec95-325d-4ebe-9401-121705e49660-2022-03-22T160000.000Z	Brain Malformations			
MONDO:0012529	RPS24	HGNC:10411	https://search.clinicalgenome.org/kb/genes/HGNC:10411	Diamond-Blackfan anemia 3	https://search.clinicalgenome.org/kb/conditions/MONDO:0012529		3 - Sufficient Evidence for Haploinsufficiency (10/23/2019)	0 - No Evidence for Haploinsufficiency (10/23/2019)	https://search.clinicalgenome.org/kb/gene-dosage/HGNC:10411	Dosage Working Group						
MONDO:0012531	ERCC3	HGNC:3435	https://search.clinicalgenome.org/kb/genes/HGNC:3435	xeroderma pigmentosum group B	https://search.clinicalgenome.org/kb/conditions/MONDO:0012531	Autosomal recessive inheritance	30 - Gene Associated with Autosomal Recessive Phenotype (06/30/2020)	0 - No Evidence for Haploinsufficiency (06/30/2020)	https://search.clinicalgenome.org/kb/gene-dosage/HGNC:3435	Dosage Working Group	definitive evidence (11/02/2018)	https://search.clinicalgenome.org/kb/gene-validity/CGGV:assertion_bf09deab-9612-4b13-8bb7-4c2a25dde868-2018-11-02T213956.524Z	Hereditary Cancer			
MONDO:0012534	TUFM	HGNC:12420	https://search.clinicalgenome.org/kb/genes/HGNC:12420	combined oxidative phosphorylation defect type 4	https://search.clinicalgenome.org/kb/conditions/MONDO:0012534		30 - Gene Associated with Autosomal Recessive Phenotype (08/22/2016)	0 - No Evidence for Haploinsufficiency (08/22/2016)	https://search.clinicalgenome.org/kb/gene-dosage/HGNC:12420	Dosage Working Group						
MONDO:0012536	CRTAP	HGNC:2379	https://search.clinicalgenome.org/kb/genes/HGNC:2379	osteogenesis imperfecta type 7	https://search.clinicalgenome.org/kb/conditions/MONDO:0012536		30 - Gene Associated with Autosomal Recessive Phenotype (08/22/2016)	0 - No Evidence for Haploinsufficiency (08/22/2016)	https://search.clinicalgenome.org/kb/gene-dosage/HGNC:2379	Dosage Working Group						
MONDO:0012538	CFL2	HGNC:1875	https://search.clinicalgenome.org/kb/genes/HGNC:1875	nemaline myopathy 7	https://search.clinicalgenome.org/kb/conditions/MONDO:0012538	Autosomal recessive inheritance	30 - Gene Associated with Autosomal Recessive Phenotype (08/22/2016)		https://search.clinicalgenome.org/kb/gene-dosage/HGNC:1875	Dosage Working Group	definitive evidence (11/25/2019)	https://search.clinicalgenome.org/kb/gene-validity/CGGV:assertion_3c04b972-6797-42e7-87e8-ee97eb0bbad7-2019-11-25T150139.061Z	Congenital Myopathies			
MONDO:0012541	FGF3	HGNC:3681	https://search.clinicalgenome.org/kb/genes/HGNC:3681	deafness with labyrinthine aplasia, microtia, and microdontia	https://search.clinicalgenome.org/kb/conditions/MONDO:0012541	Autosomal recessive inheritance	30 - Gene Associated with Autosomal Recessive Phenotype (08/22/2016)		https://search.clinicalgenome.org/kb/gene-dosage/HGNC:3681	Dosage Working Group	definitive evidence (05/21/2019)	https://search.clinicalgenome.org/kb/gene-validity/CGGV:assertion_5ca11e8c-6703-4be5-a8c2-82e6dcc865e4-2019-05-21T160000.000Z	Hearing Loss			
MONDO:0012547	SOS1	HGNC:11187	https://search.clinicalgenome.org/kb/genes/HGNC:11187	Noonan syndrome 4	https://search.clinicalgenome.org/kb/conditions/MONDO:0012547		0 - No Evidence for Haploinsufficiency (03/30/2012)	0 - No Evidence for Haploinsufficiency (03/30/2012)	https://search.clinicalgenome.org/kb/gene-dosage/HGNC:11187	Dosage Working Group				Assertion Pending (07/01/2019) | Assertion Pending (07/01/2019)	https://search.clinicalgenome.org/kb/gene-validity/https://actionability.clinicalgenome.org/ac/Adult/ui/stg2SummaryRpt?doc=AC1003 | https://search.clinicalgenome.org/kb/gene-validity/https://actionability.clinicalgenome.org/ac/Pediatric/ui/stg2SummaryRpt?doc=AC1003	Adult Actionability Working Group | Pediatric Actionability Working Group
MONDO:0012552	CDKN1B	HGNC:1785	https://search.clinicalgenome.org/kb/genes/HGNC:1785	multiple endocrine neoplasia type 4	https://search.clinicalgenome.org/kb/conditions/MONDO:0012552	Autosomal dominant inheritance	3 - Sufficient Evidence for Haploinsufficiency (07/08/2020)	0 - No Evidence for Haploinsufficiency (07/08/2020)	https://search.clinicalgenome.org/kb/gene-dosage/HGNC:1785	Dosage Working Group	definitive evidence (12/21/2018)	https://search.clinicalgenome.org/kb/gene-validity/CGGV:assertion_b07f8882-dd5e-4831-9926-f8b4c2a8c265-2018-12-21T154854.477Z	Hereditary Cancer			
MONDO:0012554	ERCC1	HGNC:3433	https://search.clinicalgenome.org/kb/genes/HGNC:3433	cerebrooculofacioskeletal syndrome 4	https://search.clinicalgenome.org/kb/conditions/MONDO:0012554		30 - Gene Associated with Autosomal Recessive Phenotype (08/22/2016)		https://search.clinicalgenome.org/kb/gene-dosage/HGNC:3433	Dosage Working Group						
MONDO:0012563	GLI2	HGNC:4318	https://search.clinicalgenome.org/kb/genes/HGNC:4318	holoprosencephaly 9	https://search.clinicalgenome.org/kb/conditions/MONDO:0012563		3 - Sufficient Evidence for Haploinsufficiency (01/11/2021)	0 - No Evidence for Haploinsufficiency (01/11/2021)	https://search.clinicalgenome.org/kb/gene-dosage/HGNC:4318	Dosage Working Group						
MONDO:0012565	PALB2	HGNC:26144	https://search.clinicalgenome.org/kb/genes/HGNC:26144	Fanconi anemia complementation group N	https://search.clinicalgenome.org/kb/conditions/MONDO:0012565	Autosomal recessive inheritance					definitive evidence (08/18/2019)	https://search.clinicalgenome.org/kb/gene-validity/CGGV:assertion_3ebabbf1-1a43-4a57-b0b8-2b29bb57ade1-2019-08-18T160312.829Z	Hereditary Cancer	Moderate Actionability (10/28/2019) | Moderate Actionability (10/28/2019)	https://search.clinicalgenome.org/kb/gene-validity/https://actionability.clinicalgenome.org/ac/Adult/ui/stg2SummaryRpt?doc=AC1008 | https://search.clinicalgenome.org/kb/gene-validity/https://actionability.clinicalgenome.org/ac/Pediatric/ui/stg2SummaryRpt?doc=AC1008	Adult Actionability Working Group | Pediatric Actionability Working Group
MONDO:0012580	CSF2RA	HGNC:2435	https://search.clinicalgenome.org/kb/genes/HGNC:2435	hereditary pulmonary alveolar proteinosis	https://search.clinicalgenome.org/kb/conditions/MONDO:0012580		30 - Gene Associated with Autosomal Recessive Phenotype (08/23/2021)	0 - No Evidence for Haploinsufficiency (08/23/2021)	https://search.clinicalgenome.org/kb/gene-dosage/HGNC:2435	Dosage Working Group						
MONDO:0012581	P3H1	HGNC:19316	https://search.clinicalgenome.org/kb/genes/HGNC:19316	osteogenesis imperfecta type 8	https://search.clinicalgenome.org/kb/conditions/MONDO:0012581		30 - Gene Associated with Autosomal Recessive Phenotype (03/12/2015)	0 - No Evidence for Haploinsufficiency (03/12/2015)	https://search.clinicalgenome.org/kb/gene-dosage/HGNC:19316	Dosage Working Group						
MONDO:0012588	MFSD8	HGNC:28486	https://search.clinicalgenome.org/kb/genes/HGNC:28486	neuronal ceroid lipofuscinosis 7	https://search.clinicalgenome.org/kb/conditions/MONDO:0012588		30 - Gene Associated with Autosomal Recessive Phenotype (08/22/2016)	0 - No Evidence for Haploinsufficiency (08/22/2016)	https://search.clinicalgenome.org/kb/gene-dosage/HGNC:28486	Dosage Working Group						
MONDO:0012589	TCF4	HGNC:11634	https://search.clinicalgenome.org/kb/genes/HGNC:11634	Pitt-Hopkins syndrome	https://search.clinicalgenome.org/kb/conditions/MONDO:0012589	Autosomal dominant inheritance	3 - Sufficient Evidence for Haploinsufficiency (07/08/2020)	0 - No Evidence for Haploinsufficiency (07/08/2020)	https://search.clinicalgenome.org/kb/gene-dosage/HGNC:11634	Dosage Working Group	definitive evidence (05/02/2018)	https://search.clinicalgenome.org/kb/gene-validity/CGGV:assertion_096f830c-0065-456a-9e26-db54fd157981-2018-05-02T170000.000Z	Rett and Angelman-like Disorders			
MONDO:0012602	RDX	HGNC:9944	https://search.clinicalgenome.org/kb/genes/HGNC:9944	autosomal recessive nonsyndromic hearing loss 24	https://search.clinicalgenome.org/kb/conditions/MONDO:0012602		30 - Gene Associated with Autosomal Recessive Phenotype (08/22/2016)	0 - No Evidence for Haploinsufficiency (08/22/2016)	https://search.clinicalgenome.org/kb/gene-dosage/HGNC:9944	Dosage Working Group				Strong Actionability (10/29/2020)	https://search.clinicalgenome.org/kb/gene-validity/https://actionability.clinicalgenome.org/ac/Pediatric/ui/stg2SummaryRpt?doc=AC1018	Pediatric Actionability Working Group
MONDO:0012604	RAX	HGNC:18662	https://search.clinicalgenome.org/kb/genes/HGNC:18662	isolated microphthalmia 3	https://search.clinicalgenome.org/kb/conditions/MONDO:0012604		30 - Gene Associated with Autosomal Recessive Phenotype (08/22/2016)		https://search.clinicalgenome.org/kb/gene-dosage/HGNC:18662	Dosage Working Group						
MONDO:0012605	MFRP	HGNC:18121	https://search.clinicalgenome.org/kb/genes/HGNC:18121	isolated microphthalmia 5	https://search.clinicalgenome.org/kb/conditions/MONDO:0012605		30 - Gene Associated with Autosomal Recessive Phenotype (08/22/2016)	0 - No Evidence for Haploinsufficiency (08/22/2016)	https://search.clinicalgenome.org/kb/gene-dosage/HGNC:18121	Dosage Working Group						
MONDO:0012614	GRIK2	HGNC:4580	https://search.clinicalgenome.org/kb/genes/HGNC:4580	intellectual disability, autosomal recessive 6	https://search.clinicalgenome.org/kb/conditions/MONDO:0012614		30 - Gene Associated with Autosomal Recessive Phenotype (09/05/2012)	0 - No Evidence for Haploinsufficiency (09/05/2012)	https://search.clinicalgenome.org/kb/gene-dosage/HGNC:4580	Dosage Working Group						
MONDO:0012622	DARS2	HGNC:25538	https://search.clinicalgenome.org/kb/genes/HGNC:25538	leukoencephalopathy with brain stem and spinal cord involvement-high lactate syndrome	https://search.clinicalgenome.org/kb/conditions/MONDO:0012622		30 - Gene Associated with Autosomal Recessive Phenotype (08/22/2016)	0 - No Evidence for Haploinsufficiency (08/22/2016)	https://search.clinicalgenome.org/kb/gene-dosage/HGNC:25538	Dosage Working Group						
MONDO:0012624	ACAD9	HGNC:21497	https://search.clinicalgenome.org/kb/genes/HGNC:21497	acyl-CoA dehydrogenase 9 deficiency	https://search.clinicalgenome.org/kb/conditions/MONDO:0012624	Autosomal recessive inheritance					definitive evidence (03/27/2018)	https://search.clinicalgenome.org/kb/gene-validity/CGGV:assertion_5fad1866-75ce-470f-984c-e64bb7e11168-2018-03-27T160000.000Z	Fatty Acid Oxidation Disorders			
MONDO:0012635	COG8	HGNC:18623	https://search.clinicalgenome.org/kb/genes/HGNC:18623	COG8-CDG	https://search.clinicalgenome.org/kb/conditions/MONDO:0012635		30 - Gene Associated with Autosomal Recessive Phenotype (03/25/2015)	0 - No Evidence for Haploinsufficiency (03/25/2015)	https://search.clinicalgenome.org/kb/gene-dosage/HGNC:18623	Dosage Working Group						
MONDO:0012637	COG1	HGNC:6545	https://search.clinicalgenome.org/kb/genes/HGNC:6545	COG1-CDG	https://search.clinicalgenome.org/kb/conditions/MONDO:0012637		30 - Gene Associated with Autosomal Recessive Phenotype (08/22/2016)		https://search.clinicalgenome.org/kb/gene-dosage/HGNC:6545	Dosage Working Group						
MONDO:0012648	ACAD8	HGNC:87	https://search.clinicalgenome.org/kb/genes/HGNC:87	isobutyryl-CoA dehydrogenase deficiency	https://search.clinicalgenome.org/kb/conditions/MONDO:0012648	Autosomal recessive inheritance	30 - Gene Associated with Autosomal Recessive Phenotype (12/11/2014)	0 - No Evidence for Haploinsufficiency (12/11/2014)	https://search.clinicalgenome.org/kb/gene-dosage/HGNC:87	Dosage Working Group	definitive evidence (04/26/2019)	https://search.clinicalgenome.org/kb/gene-validity/CGGV:assertion_0d260f0e-df71-420a-9281-92e4bddcddbb-2019-04-26T160000.000Z	Aminoacidopathy			
MONDO:0012650	NHEJ1	HGNC:25737	https://search.clinicalgenome.org/kb/genes/HGNC:25737	Cernunnos-XLF deficiency	https://search.clinicalgenome.org/kb/conditions/MONDO:0012650	Autosomal recessive inheritance					definitive evidence (05/20/2021)	https://search.clinicalgenome.org/kb/gene-validity/CGGV:assertion_765b118e-c60a-4696-b401-f63b3349d6d2-2021-05-20T151233.276Z	SCID-CID			
MONDO:0012651	KIF1C	HGNC:6317	https://search.clinicalgenome.org/kb/genes/HGNC:6317	spastic ataxia 2	https://search.clinicalgenome.org/kb/conditions/MONDO:0012651		30 - Gene Associated with Autosomal Recessive Phenotype (08/22/2016)	0 - No Evidence for Haploinsufficiency (08/22/2016)	https://search.clinicalgenome.org/kb/gene-dosage/HGNC:6317	Dosage Working Group						
MONDO:0012654	TBX20	HGNC:11598	https://search.clinicalgenome.org/kb/genes/HGNC:11598	atrial septal defect 4	https://search.clinicalgenome.org/kb/conditions/MONDO:0012654		1 - Little Evidence for Haploinsufficiency (04/26/2013)	0 - No Evidence for Haploinsufficiency (04/26/2013)	https://search.clinicalgenome.org/kb/gene-dosage/HGNC:11598	Dosage Working Group						
MONDO:0012656	PIP5K1C	HGNC:8996	https://search.clinicalgenome.org/kb/genes/HGNC:8996	lethal congenital contracture syndrome 3	https://search.clinicalgenome.org/kb/conditions/MONDO:0012656		30 - Gene Associated with Autosomal Recessive Phenotype (08/22/2016)		https://search.clinicalgenome.org/kb/gene-dosage/HGNC:8996	Dosage Working Group						
MONDO:0012662	WHRN	HGNC:16361	https://search.clinicalgenome.org/kb/genes/HGNC:16361	Usher syndrome type 2D	https://search.clinicalgenome.org/kb/conditions/MONDO:0012662	Autosomal recessive inheritance	30 - Gene Associated with Autosomal Recessive Phenotype (08/22/2016)	0 - No Evidence for Haploinsufficiency (08/22/2016)	https://search.clinicalgenome.org/kb/gene-dosage/HGNC:16361	Dosage Working Group	definitive evidence (05/10/2017)	https://search.clinicalgenome.org/kb/gene-validity/CGGCIEX:assertion_8151	Hearing Loss			
MONDO:0012669	SPRED1	HGNC:20249	https://search.clinicalgenome.org/kb/genes/HGNC:20249	Legius syndrome	https://search.clinicalgenome.org/kb/conditions/MONDO:0012669	Autosomal dominant inheritance	3 - Sufficient Evidence for Haploinsufficiency (03/14/2013)	0 - No Evidence for Haploinsufficiency (03/14/2013)	https://search.clinicalgenome.org/kb/gene-dosage/HGNC:20249	Dosage Working Group	definitive evidence (01/24/2019)	https://search.clinicalgenome.org/kb/gene-validity/CGGV:assertion_3ba44430-8f71-4b94-a6f1-7f66d3a27897-2019-01-24T050000.000Z	RASopathy	Has Insufficient Evidence for Actionability Based on Early Rule-out (07/09/2019) | Has Insufficient Evidence for Actionability Based on Early Rule-out (07/09/2019)	https://search.clinicalgenome.org/kb/gene-validity/https://actionability.clinicalgenome.org/ac/Adult/ui/stg2SummaryRpt?doc=AC1012 | https://search.clinicalgenome.org/kb/gene-validity/https://actionability.clinicalgenome.org/ac/Pediatric/ui/stg2SummaryRpt?doc=AC1012	Adult Actionability Working Group | Pediatric Actionability Working Group
MONDO:0012670	LRTOMT	HGNC:25033	https://search.clinicalgenome.org/kb/genes/HGNC:25033	autosomal recessive nonsyndromic hearing loss 63	https://search.clinicalgenome.org/kb/conditions/MONDO:0012670	Autosomal recessive inheritance					definitive evidence (02/15/2017)	https://search.clinicalgenome.org/kb/gene-validity/CGGCIEX:assertion_5662	Hearing Loss	Strong Actionability (10/29/2020)	https://search.clinicalgenome.org/kb/gene-validity/https://actionability.clinicalgenome.org/ac/Pediatric/ui/stg2SummaryRpt?doc=AC1018	Pediatric Actionability Working Group
MONDO:0012680	GLIS2	HGNC:29450	https://search.clinicalgenome.org/kb/genes/HGNC:29450	nephronophthisis 7	https://search.clinicalgenome.org/kb/conditions/MONDO:0012680	Autosomal recessive inheritance					limited evidence (05/26/2021)	https://search.clinicalgenome.org/kb/gene-validity/CGGV:assertion_c51be76f-59d3-4884-9df3-4416686848ab-2021-05-26T160000.000Z	Kidney Cystic and Ciliopathy Disorders			
MONDO:0012683	RARS2	HGNC:21406	https://search.clinicalgenome.org/kb/genes/HGNC:21406	pontocerebellar hypoplasia type 6	https://search.clinicalgenome.org/kb/conditions/MONDO:0012683		30 - Gene Associated with Autosomal Recessive Phenotype (04/09/2015)	0 - No Evidence for Haploinsufficiency (04/09/2015)	https://search.clinicalgenome.org/kb/gene-dosage/HGNC:21406	Dosage Working Group						
MONDO:0012684	JUP	HGNC:6207	https://search.clinicalgenome.org/kb/genes/HGNC:6207	arrhythmogenic right ventricular dysplasia 12	https://search.clinicalgenome.org/kb/conditions/MONDO:0012684									Moderate Actionability (03/17/2020) | Strong Actionability (03/17/2020)	https://search.clinicalgenome.org/kb/gene-validity/https://actionability.clinicalgenome.org/ac/Adult/ui/stg2SummaryRpt?doc=AC039 | https://search.clinicalgenome.org/kb/gene-validity/https://actionability.clinicalgenome.org/ac/Pediatric/ui/stg2SummaryRpt?doc=AC039	Adult Actionability Working Group | Pediatric Actionability Working Group
MONDO:0012690	RAF1	HGNC:9829	https://search.clinicalgenome.org/kb/genes/HGNC:9829	Noonan syndrome 5	https://search.clinicalgenome.org/kb/conditions/MONDO:0012690		0 - No Evidence for Haploinsufficiency (09/13/2018)	0 - No Evidence for Haploinsufficiency (09/13/2018)	https://search.clinicalgenome.org/kb/gene-dosage/HGNC:9829	Dosage Working Group				Assertion Pending (07/01/2019) | Assertion Pending (07/01/2019)	https://search.clinicalgenome.org/kb/gene-validity/https://actionability.clinicalgenome.org/ac/Adult/ui/stg2SummaryRpt?doc=AC1003 | https://search.clinicalgenome.org/kb/gene-validity/https://actionability.clinicalgenome.org/ac/Pediatric/ui/stg2SummaryRpt?doc=AC1003	Adult Actionability Working Group | Pediatric Actionability Working Group
MONDO:0012691	PTPN11	HGNC:9644	https://search.clinicalgenome.org/kb/genes/HGNC:9644	LEOPARD syndrome 2	https://search.clinicalgenome.org/kb/conditions/MONDO:0012691		3 - Sufficient Evidence for Haploinsufficiency (09/08/2020)	0 - No Evidence for Haploinsufficiency (09/08/2020)	https://search.clinicalgenome.org/kb/gene-dosage/HGNC:9644	Dosage Working Group				Limited Actionability (03/02/2021) | Limited Actionability (03/02/2021)	https://search.clinicalgenome.org/kb/gene-validity/https://actionability.clinicalgenome.org/ac/Adult/ui/stg2SummaryRpt?doc=AC1023 | https://search.clinicalgenome.org/kb/gene-validity/https://actionability.clinicalgenome.org/ac/Pediatric/ui/stg2SummaryRpt?doc=AC1023	Adult Actionability Working Group | Pediatric Actionability Working Group
MONDO:0012721	KCTD7	HGNC:21957	https://search.clinicalgenome.org/kb/genes/HGNC:21957	progressive myoclonic epilepsy type 3	https://search.clinicalgenome.org/kb/conditions/MONDO:0012721		30 - Gene Associated with Autosomal Recessive Phenotype (08/22/2016)		https://search.clinicalgenome.org/kb/gene-dosage/HGNC:21957	Dosage Working Group						
MONDO:0012747	ALDOA	HGNC:414	https://search.clinicalgenome.org/kb/genes/HGNC:414	glycogen storage disease due to aldolase A deficiency	https://search.clinicalgenome.org/kb/conditions/MONDO:0012747		30 - Gene Associated with Autosomal Recessive Phenotype (08/22/2016)		https://search.clinicalgenome.org/kb/gene-dosage/HGNC:414	Dosage Working Group						
MONDO:0012748	DNAH11	HGNC:2942	https://search.clinicalgenome.org/kb/genes/HGNC:2942	primary ciliary dyskinesia 7	https://search.clinicalgenome.org/kb/conditions/MONDO:0012748	Autosomal recessive inheritance	30 - Gene Associated with Autosomal Recessive Phenotype (08/22/2016)	0 - No Evidence for Haploinsufficiency (08/22/2016)	https://search.clinicalgenome.org/kb/gene-dosage/HGNC:2942	Dosage Working Group	definitive evidence (10/25/2021)	https://search.clinicalgenome.org/kb/gene-validity/CGGV:assertion_84088c46-0763-4ed6-9352-530d846e8b24-2021-10-25T190427.941Z	Motile Ciliopathy			
