"gene_symbol","hgnc_id","gene_url","disease_label","mondo_id","disease_url","mode_of_inheritance","dosage_haploinsufficiency_assertion","dosage_triplosensitivity_assertion","dosage_report","dosage_group","gene_disease_validity_assertion_classifications","gene_disease_validity_assertion_reports","gene_disease_validity_gceps","actionability_assertion_classifications","actionability_assertion_reports","actionability_groups"
"A2ML1","HGNC:23336","https://search.clinicalgenome.org/kb/genes/HGNC:23336","Noonan syndrome","MONDO:0018997","https://search.clinicalgenome.org/kb/conditions/MONDO:0018997","Autosomal dominant inheritance","","","","","disputing (06/07/2018)","https://search.clinicalgenome.org/kb/gene-validity/CGGV:assertion_d910a9d8-516e-443d-acba-8d61f7574792-2018-06-07T160000.000Z","RASopathy","","",""
"AAGAB","HGNC:25662","https://search.clinicalgenome.org/kb/genes/HGNC:25662","palmoplantar keratoderma, punctate type 1A","MONDO:0007858","https://search.clinicalgenome.org/kb/conditions/MONDO:0007858","N/A","3 - Sufficient Evidence for Haploinsufficiency (02/28/2013)","0 - No Evidence for Haploinsufficiency (02/28/2013)","https://search.clinicalgenome.org/kb/gene-dosage/HGNC:25662","Dosage Working Group","","","","","",""
"AARS1","HGNC:20","https://search.clinicalgenome.org/kb/genes/HGNC:20","undetermined early-onset epileptic encephalopathy","MONDO:0018614","https://search.clinicalgenome.org/kb/conditions/MONDO:0018614","Autosomal recessive inheritance","0 - No Evidence for Haploinsufficiency (01/11/2018)","0 - No Evidence for Haploinsufficiency (01/11/2018)","https://search.clinicalgenome.org/kb/gene-dosage/HGNC:20","Dosage Working Group","limited evidence (11/20/2018)","https://search.clinicalgenome.org/kb/gene-validity/CGGV:assertion_ac62fe65-ee56-4146-9fe4-00dc1db2d958-2018-11-20T170000.000Z","Epilepsy","","",""
"AARS2","HGNC:21022","https://search.clinicalgenome.org/kb/genes/HGNC:21022","leukoencephalopathy, progressive, with ovarian failure","MONDO:0014387","https://search.clinicalgenome.org/kb/conditions/MONDO:0014387","N/A","30 - Gene Associated with Autosomal Recessive Phenotype (08/22/2016)","","https://search.clinicalgenome.org/kb/gene-dosage/HGNC:21022","Dosage Working Group","","","","","",""
"AASS","HGNC:17366","https://search.clinicalgenome.org/kb/genes/HGNC:17366","hyperlysinemia","MONDO:0009388","https://search.clinicalgenome.org/kb/conditions/MONDO:0009388","Autosomal recessive inheritance","30 - Gene Associated with Autosomal Recessive Phenotype (08/22/2016)","","https://search.clinicalgenome.org/kb/gene-dosage/HGNC:17366","Dosage Working Group","moderate evidence (06/29/2020)","https://search.clinicalgenome.org/kb/gene-validity/CGGV:assertion_92e04f9e-f03e-4295-baac-e9fb6b48a258-2020-06-29T174543.477Z","Aminoacidopathy","","",""
"ABAT","HGNC:23","https://search.clinicalgenome.org/kb/genes/HGNC:23","developmental and epileptic encephalopathy","MONDO:0100062","https://search.clinicalgenome.org/kb/conditions/MONDO:0100062","Autosomal recessive inheritance","30 - Gene Associated with Autosomal Recessive Phenotype (08/22/2016)","","https://search.clinicalgenome.org/kb/gene-dosage/HGNC:23","Dosage Working Group","moderate evidence (04/19/2022)","https://search.clinicalgenome.org/kb/gene-validity/CGGV:assertion_3a5138ad-d4b8-4ea1-aa78-b5d1f07b2b82-2022-04-19T160000.000Z","Epilepsy","","",""
"ABAT","HGNC:23","https://search.clinicalgenome.org/kb/genes/HGNC:23","GABA aminotransferase deficiency","MONDO:0013166","https://search.clinicalgenome.org/kb/conditions/MONDO:0013166","N/A","30 - Gene Associated with Autosomal Recessive Phenotype (08/22/2016)","","https://search.clinicalgenome.org/kb/gene-dosage/HGNC:23","Dosage Working Group","","","","","",""
"ABCB11","HGNC:42","https://search.clinicalgenome.org/kb/genes/HGNC:42","progressive familial intrahepatic cholestasis type 2","MONDO:0011156","https://search.clinicalgenome.org/kb/conditions/MONDO:0011156","N/A","30 - Gene Associated with Autosomal Recessive Phenotype (07/08/2020)","0 - No Evidence for Haploinsufficiency (07/08/2020)","https://search.clinicalgenome.org/kb/gene-dosage/HGNC:42","Dosage Working Group","","","","","",""
"ABCC4","HGNC:55","https://search.clinicalgenome.org/kb/genes/HGNC:55","qualitative platelet defect","MONDO:0001197","https://search.clinicalgenome.org/kb/conditions/MONDO:0001197","Autosomal recessive inheritance","","","","","moderate evidence (05/25/2022)","https://search.clinicalgenome.org/kb/gene-validity/CGGV:assertion_2828abac-5b4a-4dad-a703-10c0daf35dbd-2022-05-25T160000.000Z","Hemostasis Thrombosis","","",""
"ABCC8","HGNC:59","https://search.clinicalgenome.org/kb/genes/HGNC:59","monogenic diabetes","MONDO:0015967","https://search.clinicalgenome.org/kb/conditions/MONDO:0015967","Semidominant inheritance","30 - Gene Associated with Autosomal Recessive Phenotype (02/24/2012)","0 - No Evidence for Haploinsufficiency (02/24/2012)","https://search.clinicalgenome.org/kb/gene-dosage/HGNC:59","Dosage Working Group","definitive evidence (07/24/2022)","https://search.clinicalgenome.org/kb/gene-validity/CGGV:assertion_33c0dfa5-c6ea-42fd-8118-be6ff97beb3e-2022-07-24T160000.000Z","Monogenic Diabetes","","",""
"ABCC8","HGNC:59","https://search.clinicalgenome.org/kb/genes/HGNC:59","hyperinsulinemic hypoglycemia, familial, 1","MONDO:0009734","https://search.clinicalgenome.org/kb/conditions/MONDO:0009734","N/A","30 - Gene Associated with Autosomal Recessive Phenotype (02/24/2012)","0 - No Evidence for Haploinsufficiency (02/24/2012)","https://search.clinicalgenome.org/kb/gene-dosage/HGNC:59","Dosage Working Group","","","","","",""
"ABCC9","HGNC:60","https://search.clinicalgenome.org/kb/genes/HGNC:60","dilated cardiomyopathy","MONDO:0005021","https://search.clinicalgenome.org/kb/conditions/MONDO:0005021","Autosomal dominant inheritance","","","","","limited evidence (11/13/2020)","https://search.clinicalgenome.org/kb/gene-validity/CGGV:assertion_8be22ebc-f0f5-4de5-9c2a-382ebd02c533-2020-11-13T170000.000Z","Dilated Cardiomyopathy","","",""
"ABCD1","HGNC:61","https://search.clinicalgenome.org/kb/genes/HGNC:61","adrenoleukodystrophy","MONDO:0018544","https://search.clinicalgenome.org/kb/conditions/MONDO:0018544","X-linked inheritance","3 - Sufficient Evidence for Haploinsufficiency (12/02/2020)","0 - No Evidence for Haploinsufficiency (12/02/2020)","https://search.clinicalgenome.org/kb/gene-dosage/HGNC:61","Dosage Working Group","definitive evidence (12/18/2020)","https://search.clinicalgenome.org/kb/gene-validity/CGGV:assertion_815e0f84-b530-4fd2-81a9-02e02bf352ee-2020-12-18T050000.000Z","Peroxisomal Disorders","Assertion Pending (11/16/2016)","https://search.clinicalgenome.org/kb/gene-validity/https://actionability.clinicalgenome.org/ac/Adult/ui/stg2SummaryRpt?doc=AC117","Adult Actionability Working Group"
"ABCD1","HGNC:61","https://search.clinicalgenome.org/kb/genes/HGNC:61","X-linked cerebral adrenoleukodystrophy","MONDO:0010247","https://search.clinicalgenome.org/kb/conditions/MONDO:0010247","N/A","3 - Sufficient Evidence for Haploinsufficiency (12/02/2020)","0 - No Evidence for Haploinsufficiency (12/02/2020)","https://search.clinicalgenome.org/kb/gene-dosage/HGNC:61","Dosage Working Group","","","","Assertion Pending (11/16/2016)","https://search.clinicalgenome.org/kb/gene-validity/https://actionability.clinicalgenome.org/ac/Adult/ui/stg2SummaryRpt?doc=AC117","Adult Actionability Working Group"
"ABCD3","HGNC:67","https://search.clinicalgenome.org/kb/genes/HGNC:67","congenital bile acid synthesis defect 5","MONDO:0014564","https://search.clinicalgenome.org/kb/conditions/MONDO:0014564","Autosomal recessive inheritance","","","","","limited evidence (04/15/2022)","https://search.clinicalgenome.org/kb/gene-validity/CGGV:assertion_f8d82e6f-8ee8-4944-898b-165916c13cac-2022-04-15T160000.000Z","Peroxisomal Disorders","","",""
"ABCG5","HGNC:13886","https://search.clinicalgenome.org/kb/genes/HGNC:13886","sitosterolemia","MONDO:0008863","https://search.clinicalgenome.org/kb/conditions/MONDO:0008863","Autosomal recessive inheritance","30 - Gene Associated with Autosomal Recessive Phenotype (08/22/2016)","","https://search.clinicalgenome.org/kb/gene-dosage/HGNC:13886","Dosage Working Group","definitive evidence (07/10/2020)","https://search.clinicalgenome.org/kb/gene-validity/CGGV:assertion_c52c7403-8975-4a3f-8796-a966e977f708-2020-07-10T160000.000Z","Hemostasis Thrombosis","","",""
"ABCG5","HGNC:13886","https://search.clinicalgenome.org/kb/genes/HGNC:13886","sitosterolemia 1","MONDO:0020747","https://search.clinicalgenome.org/kb/conditions/MONDO:0020747","N/A","30 - Gene Associated with Autosomal Recessive Phenotype (08/22/2016)","","https://search.clinicalgenome.org/kb/gene-dosage/HGNC:13886","Dosage Working Group","","","","","",""
"ABCG8","HGNC:13887","https://search.clinicalgenome.org/kb/genes/HGNC:13887","sitosterolemia","MONDO:0008863","https://search.clinicalgenome.org/kb/conditions/MONDO:0008863","Autosomal recessive inheritance","30 - Gene Associated with Autosomal Recessive Phenotype (08/22/2016)","0 - No Evidence for Haploinsufficiency (08/22/2016)","https://search.clinicalgenome.org/kb/gene-dosage/HGNC:13887","Dosage Working Group","definitive evidence (07/14/2020)","https://search.clinicalgenome.org/kb/gene-validity/CGGV:assertion_af59edc2-1148-4dca-b804-192639017b65-2020-07-14T202806.911Z","Hemostasis Thrombosis","","",""
"ABCG8","HGNC:13887","https://search.clinicalgenome.org/kb/genes/HGNC:13887","sitosterolemia 1","MONDO:0020747","https://search.clinicalgenome.org/kb/conditions/MONDO:0020747","N/A","30 - Gene Associated with Autosomal Recessive Phenotype (08/22/2016)","0 - No Evidence for Haploinsufficiency (08/22/2016)","https://search.clinicalgenome.org/kb/gene-dosage/HGNC:13887","Dosage Working Group","","","","","",""
"ABHD12","HGNC:15868","https://search.clinicalgenome.org/kb/genes/HGNC:15868","PHARC syndrome","MONDO:0012984","https://search.clinicalgenome.org/kb/conditions/MONDO:0012984","Autosomal recessive inheritance","30 - Gene Associated with Autosomal Recessive Phenotype (12/11/2014)","0 - No Evidence for Haploinsufficiency (12/11/2014)","https://search.clinicalgenome.org/kb/gene-dosage/HGNC:15868","Dosage Working Group","definitive evidence (06/28/2018)","https://search.clinicalgenome.org/kb/gene-validity/CGGV:assertion_ccd68c20-2024-4239-be51-26697e19a6b4-2018-06-28T164515.791Z","Hearing Loss","","",""
"ACAD8","HGNC:87","https://search.clinicalgenome.org/kb/genes/HGNC:87","isobutyryl-CoA dehydrogenase deficiency","MONDO:0012648","https://search.clinicalgenome.org/kb/conditions/MONDO:0012648","Autosomal recessive inheritance","30 - Gene Associated with Autosomal Recessive Phenotype (12/11/2014)","0 - No Evidence for Haploinsufficiency (12/11/2014)","https://search.clinicalgenome.org/kb/gene-dosage/HGNC:87","Dosage Working Group","definitive evidence (04/26/2019)","https://search.clinicalgenome.org/kb/gene-validity/CGGV:assertion_0d260f0e-df71-420a-9281-92e4bddcddbb-2019-04-26T160000.000Z","Aminoacidopathy","","",""
"ACAD9","HGNC:21497","https://search.clinicalgenome.org/kb/genes/HGNC:21497","acyl-CoA dehydrogenase 9 deficiency","MONDO:0012624","https://search.clinicalgenome.org/kb/conditions/MONDO:0012624","Autosomal recessive inheritance","","","","","definitive evidence (03/27/2018)","https://search.clinicalgenome.org/kb/gene-validity/CGGV:assertion_5fad1866-75ce-470f-984c-e64bb7e11168-2018-03-27T160000.000Z","Fatty Acid Oxidation Disorders","","",""
"ACADL","HGNC:88","https://search.clinicalgenome.org/kb/genes/HGNC:88","long chain acyl-CoA dehydrogenase deficiency","MONDO:0020531","https://search.clinicalgenome.org/kb/conditions/MONDO:0020531","Autosomal recessive inheritance","","","","","disputing (01/25/2021)","https://search.clinicalgenome.org/kb/gene-validity/CGGV:assertion_d95637bf-c628-4d23-a0d5-656db55a09a4-2021-01-25T194827.344Z","Fatty Acid Oxidation Disorders","","",""
"ACADM","HGNC:89","https://search.clinicalgenome.org/kb/genes/HGNC:89","medium chain acyl-CoA dehydrogenase deficiency","MONDO:0008721","https://search.clinicalgenome.org/kb/conditions/MONDO:0008721","Autosomal recessive inheritance","30 - Gene Associated with Autosomal Recessive Phenotype (08/22/2016)","0 - No Evidence for Haploinsufficiency (08/22/2016)","https://search.clinicalgenome.org/kb/gene-dosage/HGNC:89","Dosage Working Group","definitive evidence (01/23/2018)","https://search.clinicalgenome.org/kb/gene-validity/CGGV:assertion_fb987774-0e5b-4466-924f-6f19fccc6599-2018-01-23T170000.000Z","Fatty Acid Oxidation Disorders","Strong Actionability (08/03/2020)","https://search.clinicalgenome.org/kb/gene-validity/https://actionability.clinicalgenome.org/ac/Pediatric/ui/stg2SummaryRpt?doc=AC1016","Pediatric Actionability Working Group"
"ACADS","HGNC:90","https://search.clinicalgenome.org/kb/genes/HGNC:90","short chain acyl-CoA dehydrogenase deficiency","MONDO:0008722","https://search.clinicalgenome.org/kb/conditions/MONDO:0008722","Autosomal recessive inheritance","","","","","definitive evidence (01/23/2018)","https://search.clinicalgenome.org/kb/gene-validity/CGGV:assertion_c6bc94e9-cdf2-4efb-b654-004541efc344-2018-01-23T170000.000Z","Fatty Acid Oxidation Disorders","","",""
"ACADSB","HGNC:91","https://search.clinicalgenome.org/kb/genes/HGNC:91","2-methylbutyryl-CoA dehydrogenase deficiency","MONDO:0012392","https://search.clinicalgenome.org/kb/conditions/MONDO:0012392","Autosomal recessive inheritance","30 - Gene Associated with Autosomal Recessive Phenotype (08/22/2016)","","https://search.clinicalgenome.org/kb/gene-dosage/HGNC:91","Dosage Working Group","definitive evidence (03/22/2019)","https://search.clinicalgenome.org/kb/gene-validity/CGGV:assertion_8bfa3857-c96c-40ac-b4c1-2cf04fd4eb4f-2019-03-22T160000.000Z","Aminoacidopathy","","",""
"ACADVL","HGNC:92","https://search.clinicalgenome.org/kb/genes/HGNC:92","very long chain acyl-CoA dehydrogenase deficiency","MONDO:0008723","https://search.clinicalgenome.org/kb/conditions/MONDO:0008723","Autosomal recessive inheritance","30 - Gene Associated with Autosomal Recessive Phenotype (08/22/2016)","0 - No Evidence for Haploinsufficiency (08/22/2016)","https://search.clinicalgenome.org/kb/gene-dosage/HGNC:92","Dosage Working Group","definitive evidence (02/20/2018)","https://search.clinicalgenome.org/kb/gene-validity/CGGV:assertion_130ca053-9f40-4fd5-b89c-b9b374694fda-2018-02-20T170000.000Z","Fatty Acid Oxidation Disorders","Assertion Pending (03/08/2017)","https://search.clinicalgenome.org/kb/gene-validity/https://actionability.clinicalgenome.org/ac/Adult/ui/stg2SummaryRpt?doc=AC126","Adult Actionability Working Group"
"ACAT1","HGNC:93","https://search.clinicalgenome.org/kb/genes/HGNC:93","beta-ketothiolase deficiency","MONDO:0008760","https://search.clinicalgenome.org/kb/conditions/MONDO:0008760","Autosomal recessive inheritance","","","","","definitive evidence (05/22/2018)","https://search.clinicalgenome.org/kb/gene-validity/CGGV:assertion_99bcab0a-de59-479d-8fe6-8b76cbce90ee-2018-05-22T160000.000Z","Fatty Acid Oxidation Disorders","","",""
"ACAT2","HGNC:94","https://search.clinicalgenome.org/kb/genes/HGNC:94","acetyl-CoA acetyltransferase-2 deficiency","MONDO:0013548","https://search.clinicalgenome.org/kb/conditions/MONDO:0013548","Mode of inheritance","","","","","no known disease relationship (01/25/2021)","https://search.clinicalgenome.org/kb/gene-validity/CGGV:assertion_7cb46678-6e33-4d34-86ba-fdf59e59fb80-2021-01-25T194853.212Z","Fatty Acid Oxidation Disorders","","",""
"ACBD5","HGNC:23338","https://search.clinicalgenome.org/kb/genes/HGNC:23338","acyl-CoA binding domain containing protein 5 deficiency","MONDO:0100112","https://search.clinicalgenome.org/kb/conditions/MONDO:0100112","Autosomal recessive inheritance","","","","","moderate evidence (04/15/2022)","https://search.clinicalgenome.org/kb/gene-validity/CGGV:assertion_8ac052f6-de8d-4c14-adf2-bbecb624defd-2022-04-15T160000.000Z","Peroxisomal Disorders","","",""
"ACOX1","HGNC:119","https://search.clinicalgenome.org/kb/genes/HGNC:119","peroxisomal acyl-CoA oxidase deficiency","MONDO:0009919","https://search.clinicalgenome.org/kb/conditions/MONDO:0009919","Autosomal recessive inheritance","30 - Gene Associated with Autosomal Recessive Phenotype (11/20/2014)","0 - No Evidence for Haploinsufficiency (11/20/2014)","https://search.clinicalgenome.org/kb/gene-dosage/HGNC:119","Dosage Working Group","definitive evidence (12/06/2019)","https://search.clinicalgenome.org/kb/gene-validity/CGGV:assertion_96026ae4-050d-4eb5-849c-178c703a556e-2019-12-06T170000.000Z","Peroxisomal Disorders","","",""
"ACOX2","HGNC:120","https://search.clinicalgenome.org/kb/genes/HGNC:120","congenital bile acid synthesis defect 6","MONDO:0015015","https://search.clinicalgenome.org/kb/conditions/MONDO:0015015","Autosomal recessive inheritance","","","","","moderate evidence (05/20/2022)","https://search.clinicalgenome.org/kb/gene-validity/CGGV:assertion_5627eadb-12f9-4768-915c-3da73c425650-2022-05-20T171935.296Z","General Inborn Errors of Metabolism","","",""
"ACP5","HGNC:124","https://search.clinicalgenome.org/kb/genes/HGNC:124","Spondyloenchondrodysplasia with immune dysregulation","MONDO:0011939","https://search.clinicalgenome.org/kb/conditions/MONDO:0011939","N/A","30 - Gene Associated with Autosomal Recessive Phenotype (08/22/2016)","0 - No Evidence for Haploinsufficiency (08/22/2016)","https://search.clinicalgenome.org/kb/gene-dosage/HGNC:124","Dosage Working Group","","","","","",""
"ACSF3","HGNC:27288","https://search.clinicalgenome.org/kb/genes/HGNC:27288","combined malonic and methylmalonic acidemia","MONDO:0013661","https://search.clinicalgenome.org/kb/conditions/MONDO:0013661","Autosomal recessive inheritance","30 - Gene Associated with Autosomal Recessive Phenotype (08/22/2016)","0 - No Evidence for Haploinsufficiency (08/22/2016)","https://search.clinicalgenome.org/kb/gene-dosage/HGNC:27288","Dosage Working Group","definitive evidence (10/09/2020)","https://search.clinicalgenome.org/kb/gene-validity/CGGV:assertion_b215e20c-7781-49a0-b473-9219cb07e0b9-2020-10-09T160000.000Z","Aminoacidopathy","","",""
"ACSL4","HGNC:3571","https://search.clinicalgenome.org/kb/genes/HGNC:3571","non-syndromic X-linked intellectual disability","MONDO:0019181","https://search.clinicalgenome.org/kb/conditions/MONDO:0019181","X-linked inheritance","1 - Little Evidence for Haploinsufficiency (04/28/2021)","0 - No Evidence for Haploinsufficiency (04/28/2021)","https://search.clinicalgenome.org/kb/gene-dosage/HGNC:3571","Dosage Working Group","moderate evidence (10/20/2017)","https://search.clinicalgenome.org/kb/gene-validity/CGGCIEX:assertion_9507","Intellectual Disability and Autism","","",""
"ACSL4","HGNC:3571","https://search.clinicalgenome.org/kb/genes/HGNC:3571","intellectual disability, X-linked 63","MONDO:0010313","https://search.clinicalgenome.org/kb/conditions/MONDO:0010313","N/A","1 - Little Evidence for Haploinsufficiency (04/28/2021)","0 - No Evidence for Haploinsufficiency (04/28/2021)","https://search.clinicalgenome.org/kb/gene-dosage/HGNC:3571","Dosage Working Group","","","","","",""
"ACTA1","HGNC:129","https://search.clinicalgenome.org/kb/genes/HGNC:129","alpha-actinopathy","MONDO:0100084","https://search.clinicalgenome.org/kb/conditions/MONDO:0100084","Semidominant inheritance","","","","","definitive evidence (01/13/2020)","https://search.clinicalgenome.org/kb/gene-validity/CGGV:assertion_9a8d04be-c08f-444b-b9cd-cd7de2e282c2-2020-01-13T170000.000Z","Congenital Myopathies","","",""
"ACTA1","HGNC:129","https://search.clinicalgenome.org/kb/genes/HGNC:129","hypertrophic cardiomyopathy","MONDO:0005045","https://search.clinicalgenome.org/kb/conditions/MONDO:0005045","Autosomal dominant inheritance","","","","","no known disease relationship (05/01/2020)","https://search.clinicalgenome.org/kb/gene-validity/CGGV:assertion_f2459efe-385d-4056-b7e3-3a4a0c0d5edd-2020-05-01T124447.908Z","Hypertrophic Cardiomyopathy","","",""
"ACTA2","HGNC:130","https://search.clinicalgenome.org/kb/genes/HGNC:130","familial thoracic aortic aneurysm and aortic dissection","MONDO:0019625","https://search.clinicalgenome.org/kb/conditions/MONDO:0019625","Autosomal dominant inheritance","0 - No Evidence for Haploinsufficiency (10/15/2015)","0 - No Evidence for Haploinsufficiency (10/15/2015)","https://search.clinicalgenome.org/kb/gene-dosage/HGNC:130","Dosage Working Group","definitive evidence (09/27/2016)","https://search.clinicalgenome.org/kb/gene-validity/CGGCIEX:assertion_8249","Heritable Thoracic Aortic Aneurysm and Dissection","Strong Actionability (03/01/2019) | Strong Actionability (03/01/2019)","https://search.clinicalgenome.org/kb/gene-validity/https://actionability.clinicalgenome.org/ac/Adult/ui/stg2SummaryRpt?doc=AC134 | https://search.clinicalgenome.org/kb/gene-validity/https://actionability.clinicalgenome.org/ac/Pediatric/ui/stg2SummaryRpt?doc=AC134","Adult Actionability Working Group | Pediatric Actionability Working Group"
"ACTB","HGNC:132","https://search.clinicalgenome.org/kb/genes/HGNC:132","Baraitser-Winter cerebrofrontofacial syndrome","MONDO:0017579","https://search.clinicalgenome.org/kb/conditions/MONDO:0017579","Autosomal dominant inheritance","0 - No Evidence for Haploinsufficiency (02/08/2022)","0 - No Evidence for Haploinsufficiency (02/08/2022)","https://search.clinicalgenome.org/kb/gene-dosage/HGNC:132","Dosage Working Group","definitive evidence (10/26/2021)","https://search.clinicalgenome.org/kb/gene-validity/CGGV:assertion_fa13dfad-ab93-4521-874a-5ede8f608fe4-2021-10-26T165835.977Z","Brain Malformations","","",""
"ACTB","HGNC:132","https://search.clinicalgenome.org/kb/genes/HGNC:132","ACTB-associated syndromic thrombocytopenia","MONDO:0100433","https://search.clinicalgenome.org/kb/conditions/MONDO:0100433","Autosomal dominant inheritance","0 - No Evidence for Haploinsufficiency (02/08/2022)","0 - No Evidence for Haploinsufficiency (02/08/2022)","https://search.clinicalgenome.org/kb/gene-dosage/HGNC:132","Dosage Working Group","moderate evidence (05/25/2022)","https://search.clinicalgenome.org/kb/gene-validity/CGGV:assertion_9cee7fd2-09f7-41dc-9742-542917d856b0-2022-05-25T160000.000Z","Hemostasis Thrombosis","","",""
"ACTB","HGNC:132","https://search.clinicalgenome.org/kb/genes/HGNC:132","syndromic intellectual disability","MONDO:0000508","https://search.clinicalgenome.org/kb/conditions/MONDO:0000508","N/A","0 - No Evidence for Haploinsufficiency (02/08/2022)","0 - No Evidence for Haploinsufficiency (02/08/2022)","https://search.clinicalgenome.org/kb/gene-dosage/HGNC:132","Dosage Working Group","","","","","",""
"ACTC1","HGNC:143","https://search.clinicalgenome.org/kb/genes/HGNC:143","arrhythmogenic right ventricular cardiomyopathy","MONDO:0016587","https://search.clinicalgenome.org/kb/conditions/MONDO:0016587","Autosomal dominant inheritance","1 - Little Evidence for Haploinsufficiency (11/17/2015)","0 - No Evidence for Haploinsufficiency (11/17/2015)","https://search.clinicalgenome.org/kb/gene-dosage/HGNC:143","Dosage Working Group","no known disease relationship (03/15/2019)","https://search.clinicalgenome.org/kb/gene-validity/CGGV:assertion_748d4255-ef43-4b42-b9f1-1cdbc50de763-2019-03-15T160000.000Z","Arrhythmogenic Right Ventricular Cardiomyopathy","","",""
"ACTC1","HGNC:143","https://search.clinicalgenome.org/kb/genes/HGNC:143","dilated cardiomyopathy","MONDO:0005021","https://search.clinicalgenome.org/kb/conditions/MONDO:0005021","Autosomal dominant inheritance","1 - Little Evidence for Haploinsufficiency (11/17/2015)","0 - No Evidence for Haploinsufficiency (11/17/2015)","https://search.clinicalgenome.org/kb/gene-dosage/HGNC:143","Dosage Working Group","moderate evidence (08/12/2020)","https://search.clinicalgenome.org/kb/gene-validity/CGGV:assertion_3e9b4048-3003-4180-b891-fcf10d25a814-2020-08-12T160000.000Z","Dilated Cardiomyopathy","","",""
"ACTC1","HGNC:143","https://search.clinicalgenome.org/kb/genes/HGNC:143","hypertrophic cardiomyopathy","MONDO:0005045","https://search.clinicalgenome.org/kb/conditions/MONDO:0005045","Autosomal dominant inheritance","1 - Little Evidence for Haploinsufficiency (11/17/2015)","0 - No Evidence for Haploinsufficiency (11/17/2015)","https://search.clinicalgenome.org/kb/gene-dosage/HGNC:143","Dosage Working Group","definitive evidence (06/23/2021)","https://search.clinicalgenome.org/kb/gene-validity/CGGV:assertion_2f62793b-0015-46eb-bb51-bddbae25ba0d-2021-06-23T201616.296Z","Hypertrophic Cardiomyopathy","Assertion Pending (08/14/2017)","https://search.clinicalgenome.org/kb/gene-validity/https://actionability.clinicalgenome.org/ac/Adult/ui/stg2SummaryRpt?doc=AC056","Adult Actionability Working Group"
"ACTC1","HGNC:143","https://search.clinicalgenome.org/kb/genes/HGNC:143","hypertrophic cardiomyopathy 11","MONDO:0012799","https://search.clinicalgenome.org/kb/conditions/MONDO:0012799","N/A","1 - Little Evidence for Haploinsufficiency (11/17/2015)","0 - No Evidence for Haploinsufficiency (11/17/2015)","https://search.clinicalgenome.org/kb/gene-dosage/HGNC:143","Dosage Working Group","","","","Assertion Pending (08/14/2017)","https://search.clinicalgenome.org/kb/gene-validity/https://actionability.clinicalgenome.org/ac/Adult/ui/stg2SummaryRpt?doc=AC056","Adult Actionability Working Group"
"ACTC1","HGNC:143","https://search.clinicalgenome.org/kb/genes/HGNC:143","familial hypertrophic cardiomyopathy","MONDO:0024573","https://search.clinicalgenome.org/kb/conditions/MONDO:0024573","N/A","1 - Little Evidence for Haploinsufficiency (11/17/2015)","0 - No Evidence for Haploinsufficiency (11/17/2015)","https://search.clinicalgenome.org/kb/gene-dosage/HGNC:143","Dosage Working Group","","","","Assertion Pending (08/14/2017)","https://search.clinicalgenome.org/kb/gene-validity/https://actionability.clinicalgenome.org/ac/Adult/ui/stg2SummaryRpt?doc=AC056","Adult Actionability Working Group"
"ACTG1","HGNC:144","https://search.clinicalgenome.org/kb/genes/HGNC:144","Baraitser-winter syndrome 2","MONDO:0013812","https://search.clinicalgenome.org/kb/conditions/MONDO:0013812","Autosomal dominant inheritance","","","","","definitive evidence (01/07/2019)","https://search.clinicalgenome.org/kb/gene-validity/CGGV:assertion_9969a221-1ce9-44c6-8ab7-2ad5f7ccd5ab-2019-01-07T170000.000Z","Hearing Loss","","",""
"ACTG1","HGNC:144","https://search.clinicalgenome.org/kb/genes/HGNC:144","nonsyndromic genetic hearing loss","MONDO:0019497","https://search.clinicalgenome.org/kb/conditions/MONDO:0019497","Autosomal dominant inheritance","","","","","definitive evidence (01/07/2019)","https://search.clinicalgenome.org/kb/gene-validity/CGGV:assertion_db9f5d19-5ebc-4a1a-a4c3-79ff27f69a0e-2019-01-07T170000.000Z","Hearing Loss","","",""
"ACTN1","HGNC:163","https://search.clinicalgenome.org/kb/genes/HGNC:163","platelet-type bleeding disorder 15","MONDO:0014078","https://search.clinicalgenome.org/kb/conditions/MONDO:0014078","Autosomal dominant inheritance","","","","","definitive evidence (11/25/2020)","https://search.clinicalgenome.org/kb/gene-validity/CGGV:assertion_215f3113-cfb6-44cc-a68b-1eb6539c9fa0-2020-11-25T170000.000Z","Hemostasis Thrombosis","","",""
"ACTN2","HGNC:164","https://search.clinicalgenome.org/kb/genes/HGNC:164","intrinsic cardiomyopathy","MONDO:0000591","https://search.clinicalgenome.org/kb/conditions/MONDO:0000591","Autosomal dominant inheritance","","","","","moderate evidence (08/06/2018)","https://search.clinicalgenome.org/kb/gene-validity/CGGV:assertion_6710e329-d391-4355-85a5-02d03f8791a3-2018-08-06T130831.379Z","Hypertrophic Cardiomyopathy","","",""
"ACVRL1","HGNC:175","https://search.clinicalgenome.org/kb/genes/HGNC:175","telangiectasia, hereditary hemorrhagic, type 2","MONDO:0010880","https://search.clinicalgenome.org/kb/conditions/MONDO:0010880","Autosomal dominant inheritance","3 - Sufficient Evidence for Haploinsufficiency (11/10/2016)","0 - No Evidence for Haploinsufficiency (11/10/2016)","https://search.clinicalgenome.org/kb/gene-dosage/HGNC:175","Dosage Working Group","definitive evidence (08/28/2019)","https://search.clinicalgenome.org/kb/gene-validity/CGGV:assertion_fbbb72c5-84a0-4096-8d49-6df506cfee0e-2019-08-28T160000.000Z","Hemostasis Thrombosis","Assertion Pending (12/07/2015)","https://search.clinicalgenome.org/kb/gene-validity/https://actionability.clinicalgenome.org/ac/Adult/ui/stg2SummaryRpt?doc=AC107","Adult Actionability Working Group"
"ACVRL1","HGNC:175","https://search.clinicalgenome.org/kb/genes/HGNC:175","hereditary hemorrhagic telangiectasia","MONDO:0019180","https://search.clinicalgenome.org/kb/conditions/MONDO:0019180","N/A","3 - Sufficient Evidence for Haploinsufficiency (11/10/2016)","0 - No Evidence for Haploinsufficiency (11/10/2016)","https://search.clinicalgenome.org/kb/gene-dosage/HGNC:175","Dosage Working Group","","","","Assertion Pending (12/07/2015)","https://search.clinicalgenome.org/kb/gene-validity/https://actionability.clinicalgenome.org/ac/Adult/ui/stg2SummaryRpt?doc=AC107","Adult Actionability Working Group"
"ACY1","HGNC:177","https://search.clinicalgenome.org/kb/genes/HGNC:177","aminoacylase 1 deficiency","MONDO:0012368","https://search.clinicalgenome.org/kb/conditions/MONDO:0012368","Autosomal recessive inheritance","","","","","definitive evidence (09/25/2020)","https://search.clinicalgenome.org/kb/gene-validity/CGGV:assertion_67196825-d32f-4070-9c15-debaa2287b73-2020-09-25T160000.000Z","Aminoacidopathy","","",""
"ADA","HGNC:186","https://search.clinicalgenome.org/kb/genes/HGNC:186","severe combined immunodeficiency, autosomal recessive, T cell-negative, B cell-negative, NK cell-negative, due to adenosine deaminase deficiency","MONDO:0007064","https://search.clinicalgenome.org/kb/conditions/MONDO:0007064","Autosomal recessive inheritance","","","","","definitive evidence (11/19/2020)","https://search.clinicalgenome.org/kb/gene-validity/CGGV:assertion_664ba77c-3db6-47da-941e-316ac819432a-2020-11-19T170000.000Z","SCID-CID","","",""
"ADA2","HGNC:1839","https://search.clinicalgenome.org/kb/genes/HGNC:1839","vasculitis due to ADA2 deficiency","MONDO:0014306","https://search.clinicalgenome.org/kb/conditions/MONDO:0014306","N/A","30 - Gene Associated with Autosomal Recessive Phenotype (08/22/2016)","","https://search.clinicalgenome.org/kb/gene-dosage/HGNC:1839","Dosage Working Group","","","","","",""
"ADAM9","HGNC:216","https://search.clinicalgenome.org/kb/genes/HGNC:216","cone-rod dystrophy 9","MONDO:0013002","https://search.clinicalgenome.org/kb/conditions/MONDO:0013002","N/A","30 - Gene Associated with Autosomal Recessive Phenotype (12/11/2014)","0 - No Evidence for Haploinsufficiency (12/11/2014)","https://search.clinicalgenome.org/kb/gene-dosage/HGNC:216","Dosage Working Group","","","","","",""
"ADAMTS13","HGNC:1366","https://search.clinicalgenome.org/kb/genes/HGNC:1366","congenital thrombotic thrombocytopenic purpura","MONDO:0010122","https://search.clinicalgenome.org/kb/conditions/MONDO:0010122","Autosomal recessive inheritance","30 - Gene Associated with Autosomal Recessive Phenotype (08/22/2016)","","https://search.clinicalgenome.org/kb/gene-dosage/HGNC:1366","Dosage Working Group","definitive evidence (03/25/2020)","https://search.clinicalgenome.org/kb/gene-validity/CGGV:assertion_6442c328-21be-482d-9ea9-ce694c1a5dd9-2020-03-25T160000.000Z","Hemostasis Thrombosis","","",""
"ADAMTS17","HGNC:17109","https://search.clinicalgenome.org/kb/genes/HGNC:17109","Weill-Marchesani 4 syndrome, recessive","MONDO:0013176","https://search.clinicalgenome.org/kb/conditions/MONDO:0013176","N/A","30 - Gene Associated with Autosomal Recessive Phenotype (08/22/2016)","0 - No Evidence for Haploinsufficiency (08/22/2016)","https://search.clinicalgenome.org/kb/gene-dosage/HGNC:17109","Dosage Working Group","","","","","",""
"ADAMTS18","HGNC:17110","https://search.clinicalgenome.org/kb/genes/HGNC:17110","microcornea-myopic chorioretinal atrophy","MONDO:0014195","https://search.clinicalgenome.org/kb/conditions/MONDO:0014195","Autosomal recessive inheritance","30 - Gene Associated with Autosomal Recessive Phenotype (08/22/2016)","0 - No Evidence for Haploinsufficiency (08/22/2016)","https://search.clinicalgenome.org/kb/gene-dosage/HGNC:17110","Dosage Working Group","definitive evidence (03/02/2022)","https://search.clinicalgenome.org/kb/gene-validity/CGGV:assertion_95caeabe-f92c-4884-87b4-ed97f15769f3-2022-03-02T212447.170Z","Retina","","",""
"ADAMTS2","HGNC:218","https://search.clinicalgenome.org/kb/genes/HGNC:218","Ehlers-Danlos syndrome, dermatosparaxis type","MONDO:0009161","https://search.clinicalgenome.org/kb/conditions/MONDO:0009161","N/A","30 - Gene Associated with Autosomal Recessive Phenotype (08/22/2016)","0 - No Evidence for Haploinsufficiency (08/22/2016)","https://search.clinicalgenome.org/kb/gene-dosage/HGNC:218","Dosage Working Group","","","","","",""
"ADAMTSL2","HGNC:14631","https://search.clinicalgenome.org/kb/genes/HGNC:14631","geleophysic dysplasia 1","MONDO:0009269","https://search.clinicalgenome.org/kb/conditions/MONDO:0009269","N/A","30 - Gene Associated with Autosomal Recessive Phenotype (08/22/2016)","0 - No Evidence for Haploinsufficiency (08/22/2016)","https://search.clinicalgenome.org/kb/gene-dosage/HGNC:14631","Dosage Working Group","","","","","",""
"ADAR","HGNC:225","https://search.clinicalgenome.org/kb/genes/HGNC:225","Leigh syndrome","MONDO:0009723","https://search.clinicalgenome.org/kb/conditions/MONDO:0009723","Autosomal recessive inheritance","","","","","limited evidence (08/27/2020)","https://search.clinicalgenome.org/kb/gene-validity/CGGV:assertion_03f538b5-43af-4699-9ddb-264077de21c9-2020-08-27T164642.352Z","Mitochondrial Diseases","","",""
"ADCY1","HGNC:232","https://search.clinicalgenome.org/kb/genes/HGNC:232","hearing loss, autosomal recessive","MONDO:0019588","https://search.clinicalgenome.org/kb/conditions/MONDO:0019588","Autosomal recessive inheritance","","","","","limited evidence (05/10/2017)","https://search.clinicalgenome.org/kb/gene-validity/CGGCIEX:assertion_8152","Hearing Loss","","",""
"ADGRG1","HGNC:4512","https://search.clinicalgenome.org/kb/genes/HGNC:4512","bilateral frontoparietal polymicrogyria","MONDO:0011738","https://search.clinicalgenome.org/kb/conditions/MONDO:0011738","N/A","30 - Gene Associated with Autosomal Recessive Phenotype (05/17/2012)","0 - No Evidence for Haploinsufficiency (05/17/2012)","https://search.clinicalgenome.org/kb/gene-dosage/HGNC:4512","Dosage Working Group","","","","","",""
"ADGRV1","HGNC:17416","https://search.clinicalgenome.org/kb/genes/HGNC:17416","nonsyndromic genetic hearing loss","MONDO:0019497","https://search.clinicalgenome.org/kb/conditions/MONDO:0019497","Autosomal recessive inheritance","30 - Gene Associated with Autosomal Recessive Phenotype (08/23/2021)","0 - No Evidence for Haploinsufficiency (08/23/2021)","https://search.clinicalgenome.org/kb/gene-dosage/HGNC:17416","Dosage Working Group","disputing (03/19/2019)","https://search.clinicalgenome.org/kb/gene-validity/CGGV:assertion_1f3dc96a-8fd3-4d30-98fd-1b1cf264e818-2019-03-19T160000.000Z","Hearing Loss","","",""
"ADGRV1","HGNC:17416","https://search.clinicalgenome.org/kb/genes/HGNC:17416","Usher syndrome type 2","MONDO:0016484","https://search.clinicalgenome.org/kb/conditions/MONDO:0016484","Autosomal recessive inheritance","30 - Gene Associated with Autosomal Recessive Phenotype (08/23/2021)","0 - No Evidence for Haploinsufficiency (08/23/2021)","https://search.clinicalgenome.org/kb/gene-dosage/HGNC:17416","Dosage Working Group","definitive evidence (02/15/2017)","https://search.clinicalgenome.org/kb/gene-validity/CGGV:assertion_992d2cd7-5305-4278-9601-3e59ac1a8770-2017-02-15T170000.000Z","Hearing Loss","","",""
"ADK","HGNC:257","https://search.clinicalgenome.org/kb/genes/HGNC:257","adenosine kinase deficiency","MONDO:0100255","https://search.clinicalgenome.org/kb/conditions/MONDO:0100255","Autosomal recessive inheritance","","","","","definitive evidence (04/08/2021)","https://search.clinicalgenome.org/kb/gene-validity/CGGV:assertion_c2319ca2-652d-411e-ab6d-5b7fb7e185ea-2021-04-08T160000.000Z","Aminoacidopathy","","",""
"ADNP","HGNC:15766","https://search.clinicalgenome.org/kb/genes/HGNC:15766","ADNP-related multiple congenital anomalies - intellectual disability - autism spectrum disorder","MONDO:0014379","https://search.clinicalgenome.org/kb/conditions/MONDO:0014379","Autosomal dominant inheritance","3 - Sufficient Evidence for Haploinsufficiency (11/22/2017)","0 - No Evidence for Haploinsufficiency (11/22/2017)","https://search.clinicalgenome.org/kb/gene-dosage/HGNC:15766","Dosage Working Group","definitive evidence (01/15/2020)","https://search.clinicalgenome.org/kb/gene-validity/CGGV:assertion_837200e1-ed55-415b-bd9e-6649e4abab1d-2020-01-15T170000.000Z","Intellectual Disability and Autism","","",""
"ADSL","HGNC:291","https://search.clinicalgenome.org/kb/genes/HGNC:291","adenylosuccinate lyase deficiency","MONDO:0007068","https://search.clinicalgenome.org/kb/conditions/MONDO:0007068","Autosomal recessive inheritance","30 - Gene Associated with Autosomal Recessive Phenotype (11/06/2015)","0 - No Evidence for Haploinsufficiency (11/06/2015)","https://search.clinicalgenome.org/kb/gene-dosage/HGNC:291","Dosage Working Group","definitive evidence (09/07/2020)","https://search.clinicalgenome.org/kb/gene-validity/CGGV:assertion_d282f565-84e4-4a47-9acc-77ee31bbe9f6-2020-09-07T160000.000Z","Intellectual Disability and Autism","","",""
"AFF2","HGNC:3776","https://search.clinicalgenome.org/kb/genes/HGNC:3776","non-syndromic X-linked intellectual disability","MONDO:0019181","https://search.clinicalgenome.org/kb/conditions/MONDO:0019181","X-linked inheritance","3 - Sufficient Evidence for Haploinsufficiency (12/08/2020)","0 - No Evidence for Haploinsufficiency (12/08/2020)","https://search.clinicalgenome.org/kb/gene-dosage/HGNC:3776","Dosage Working Group","definitive evidence (10/20/2017)","https://search.clinicalgenome.org/kb/gene-validity/CGGV:assertion_ab4216e3-61b7-4542-ad3a-8788a7ef8b63-2017-10-20T040000.000Z","Intellectual Disability and Autism","","",""
"AFF2","HGNC:3776","https://search.clinicalgenome.org/kb/genes/HGNC:3776","FRAXE intellectual disability","MONDO:0010659","https://search.clinicalgenome.org/kb/conditions/MONDO:0010659","N/A","3 - Sufficient Evidence for Haploinsufficiency (12/08/2020)","0 - No Evidence for Haploinsufficiency (12/08/2020)","https://search.clinicalgenome.org/kb/gene-dosage/HGNC:3776","Dosage Working Group","","","","","",""
"AGA","HGNC:318","https://search.clinicalgenome.org/kb/genes/HGNC:318","aspartylglucosaminuria","MONDO:0008830","https://search.clinicalgenome.org/kb/conditions/MONDO:0008830","N/A","30 - Gene Associated with Autosomal Recessive Phenotype (08/22/2016)","","https://search.clinicalgenome.org/kb/gene-dosage/HGNC:318","Dosage Working Group","","","","","",""
"AGK","HGNC:21869","https://search.clinicalgenome.org/kb/genes/HGNC:21869","Sengers syndrome","MONDO:0008922","https://search.clinicalgenome.org/kb/conditions/MONDO:0008922","N/A","30 - Gene Associated with Autosomal Recessive Phenotype (11/20/2014)","0 - No Evidence for Haploinsufficiency (11/20/2014)","https://search.clinicalgenome.org/kb/gene-dosage/HGNC:21869","Dosage Working Group","","","","","",""
"AGPAT2","HGNC:325","https://search.clinicalgenome.org/kb/genes/HGNC:325","congenital generalized lipodystrophy type 1","MONDO:0012071","https://search.clinicalgenome.org/kb/conditions/MONDO:0012071","N/A","30 - Gene Associated with Autosomal Recessive Phenotype (08/22/2016)","0 - No Evidence for Haploinsufficiency (08/22/2016)","https://search.clinicalgenome.org/kb/gene-dosage/HGNC:325","Dosage Working Group","","","","","",""
"AGPS","HGNC:327","https://search.clinicalgenome.org/kb/genes/HGNC:327","alkylglycerone-phosphate synthase deficiency","MONDO:0100274","https://search.clinicalgenome.org/kb/conditions/MONDO:0100274","Autosomal recessive inheritance","","","","","definitive evidence (04/22/2022)","https://search.clinicalgenome.org/kb/gene-validity/CGGV:assertion_aba640e2-c95d-414b-8c72-d22769e4366a-2022-04-22T160000.000Z","Peroxisomal Disorders","","",""
"AGRN","HGNC:329","https://search.clinicalgenome.org/kb/genes/HGNC:329","congenital myasthenic syndrome 8","MONDO:0014052","https://search.clinicalgenome.org/kb/conditions/MONDO:0014052","N/A","30 - Gene Associated with Autosomal Recessive Phenotype (08/22/2016)","0 - No Evidence for Haploinsufficiency (08/22/2016)","https://search.clinicalgenome.org/kb/gene-dosage/HGNC:329","Dosage Working Group","","","","","",""
"AGT","HGNC:333","https://search.clinicalgenome.org/kb/genes/HGNC:333","renal tubular dysgenesis of genetic origin","MONDO:0009970","https://search.clinicalgenome.org/kb/conditions/MONDO:0009970","N/A","30 - Gene Associated with Autosomal Recessive Phenotype (11/13/2014)","0 - No Evidence for Haploinsufficiency (11/13/2014)","https://search.clinicalgenome.org/kb/gene-dosage/HGNC:333","Dosage Working Group","","","","","",""
"AGTR2","HGNC:338","https://search.clinicalgenome.org/kb/genes/HGNC:338","X-linked complex neurodevelopmental disorder","MONDO:0100148","https://search.clinicalgenome.org/kb/conditions/MONDO:0100148","X-linked inheritance","0 - No Evidence for Haploinsufficiency (05/10/2012)","0 - No Evidence for Haploinsufficiency (05/10/2012)","https://search.clinicalgenome.org/kb/gene-dosage/HGNC:338","Dosage Working Group","disputing (06/02/2020)","https://search.clinicalgenome.org/kb/gene-validity/CGGV:assertion_d7cfa2a0-e6a7-49b8-a773-b32a1dfbcd57-2020-06-02T160000.000Z","Intellectual Disability and Autism","","",""
"AGTR2","HGNC:338","https://search.clinicalgenome.org/kb/genes/HGNC:338","intellectual disability, X-linked 88","MONDO:0010454","https://search.clinicalgenome.org/kb/conditions/MONDO:0010454","N/A","0 - No Evidence for Haploinsufficiency (05/10/2012)","0 - No Evidence for Haploinsufficiency (05/10/2012)","https://search.clinicalgenome.org/kb/gene-dosage/HGNC:338","Dosage Working Group","","","","","",""
"AGXT","HGNC:341","https://search.clinicalgenome.org/kb/genes/HGNC:341","alanine glyoxylate aminotransferase deficiency","MONDO:0100278","https://search.clinicalgenome.org/kb/conditions/MONDO:0100278","Autosomal recessive inheritance","30 - Gene Associated with Autosomal Recessive Phenotype (08/22/2016)","","https://search.clinicalgenome.org/kb/gene-dosage/HGNC:341","Dosage Working Group","definitive evidence (02/07/2020)","https://search.clinicalgenome.org/kb/gene-validity/CGGV:assertion_8460f17d-4d94-4a0c-ac46-41c86ce32e83-2020-02-07T170000.000Z","Peroxisomal Disorders","","",""
"AGXT","HGNC:341","https://search.clinicalgenome.org/kb/genes/HGNC:341","primary hyperoxaluria type 1","MONDO:0009823","https://search.clinicalgenome.org/kb/conditions/MONDO:0009823","N/A","30 - Gene Associated with Autosomal Recessive Phenotype (08/22/2016)","","https://search.clinicalgenome.org/kb/gene-dosage/HGNC:341","Dosage Working Group","","","","","",""
"AHCY","HGNC:343","https://search.clinicalgenome.org/kb/genes/HGNC:343","hypermethioninemia with deficiency of S-adenosylhomocysteine hydrolase","MONDO:0013404","https://search.clinicalgenome.org/kb/conditions/MONDO:0013404","Autosomal recessive inheritance","30 - Gene Associated with Autosomal Recessive Phenotype (06/08/2016)","0 - No Evidence for Haploinsufficiency (06/08/2016)","https://search.clinicalgenome.org/kb/gene-dosage/HGNC:343","Dosage Working Group","moderate evidence (06/29/2020)","https://search.clinicalgenome.org/kb/gene-validity/CGGV:assertion_d9b3a56b-b188-44d1-9983-a059895c0ba1-2020-06-29T174601.333Z","Aminoacidopathy","","",""
"AHDC1","HGNC:25230","https://search.clinicalgenome.org/kb/genes/HGNC:25230","AHDC1-related intellectual disability - obstructive sleep apnea - mild dysmorphism syndrome","MONDO:0014358","https://search.clinicalgenome.org/kb/conditions/MONDO:0014358","Autosomal dominant inheritance","3 - Sufficient Evidence for Haploinsufficiency (02/28/2018)","0 - No Evidence for Haploinsufficiency (02/28/2018)","https://search.clinicalgenome.org/kb/gene-dosage/HGNC:25230","Dosage Working Group","definitive evidence (11/16/2021)","https://search.clinicalgenome.org/kb/gene-validity/CGGV:assertion_59a6c010-95ac-4813-9cf4-5ff60fa5c7e9-2021-11-16T170000.000Z","Intellectual Disability and Autism","","",""
"AHI1","HGNC:21575","https://search.clinicalgenome.org/kb/genes/HGNC:21575","Joubert syndrome 3","MONDO:0012078","https://search.clinicalgenome.org/kb/conditions/MONDO:0012078","Autosomal recessive inheritance","30 - Gene Associated with Autosomal Recessive Phenotype (09/06/2012)","0 - No Evidence for Haploinsufficiency (09/06/2012)","https://search.clinicalgenome.org/kb/gene-dosage/HGNC:21575","Dosage Working Group","definitive evidence (10/26/2021)","https://search.clinicalgenome.org/kb/gene-validity/CGGV:assertion_d0d8d22f-cea6-4f4f-bc71-e85303dccac1-2021-10-26T143345.589Z","Brain Malformations","","",""
"AICDA","HGNC:13203","https://search.clinicalgenome.org/kb/genes/HGNC:13203","hyper-IgM syndrome type 2","MONDO:0011528","https://search.clinicalgenome.org/kb/conditions/MONDO:0011528","Autosomal recessive inheritance","30 - Gene Associated with Autosomal Recessive Phenotype (08/22/2016)","","https://search.clinicalgenome.org/kb/gene-dosage/HGNC:13203","Dosage Working Group","definitive evidence (09/17/2021)","https://search.clinicalgenome.org/kb/gene-validity/CGGV:assertion_b34c451d-03a1-42dd-a439-599428b0eb38-2021-09-17T121716.866Z","Antibody Deficiencies GCEP","","",""
"AIFM1","HGNC:8768","https://search.clinicalgenome.org/kb/genes/HGNC:8768","X-linked hereditary sensory and autonomic neuropathy with hearing loss","MONDO:0010378","https://search.clinicalgenome.org/kb/conditions/MONDO:0010378","X-linked inheritance","","","","","definitive evidence (07/09/2018)","https://search.clinicalgenome.org/kb/gene-validity/CGGV:assertion_a7afc3bb-7fce-45fd-a275-87277e22b1eb-2018-07-09T160000.000Z","Hearing Loss","","",""
"AIFM1","HGNC:8768","https://search.clinicalgenome.org/kb/genes/HGNC:8768","Leigh syndrome","MONDO:0009723","https://search.clinicalgenome.org/kb/conditions/MONDO:0009723","X-linked inheritance","","","","","moderate evidence (06/14/2021)","https://search.clinicalgenome.org/kb/gene-validity/CGGV:assertion_e917f93b-01ef-42e3-bf8d-b50a91f83f9c-2021-06-14T135732.582Z","Mitochondrial Diseases","","",""
"AIMP1","HGNC:10648","https://search.clinicalgenome.org/kb/genes/HGNC:10648","hypomyelinating leukodystrophy 3","MONDO:0009843","https://search.clinicalgenome.org/kb/conditions/MONDO:0009843","N/A","30 - Gene Associated with Autosomal Recessive Phenotype (08/22/2016)","0 - No Evidence for Haploinsufficiency (08/22/2016)","https://search.clinicalgenome.org/kb/gene-dosage/HGNC:10648","Dosage Working Group","","","","","",""
"AK2","HGNC:362","https://search.clinicalgenome.org/kb/genes/HGNC:362","reticular dysgenesis","MONDO:0009973","https://search.clinicalgenome.org/kb/conditions/MONDO:0009973","Autosomal recessive inheritance","","","","","definitive evidence (05/20/2021)","https://search.clinicalgenome.org/kb/gene-validity/CGGV:assertion_aba98528-8032-4dd4-bd1d-5381b102323c-2021-05-20T150257.066Z","SCID-CID","","",""
"AKAP9","HGNC:379","https://search.clinicalgenome.org/kb/genes/HGNC:379","long QT syndrome","MONDO:0002442","https://search.clinicalgenome.org/kb/conditions/MONDO:0002442","Autosomal dominant inheritance","","","","","disputing (12/15/2020)","https://search.clinicalgenome.org/kb/gene-validity/CGGV:assertion_786eac72-8014-4fdf-b279-10a5faaa09b8-2020-12-15T002607.349Z","Long QT Syndrome","","",""
"AKT3","HGNC:393","https://search.clinicalgenome.org/kb/genes/HGNC:393","overgrowth syndrome and/or cerebral malformations due to abnormalities in MTOR pathway genes","MONDO:0100283","https://search.clinicalgenome.org/kb/conditions/MONDO:0100283","Autosomal dominant inheritance","1 - Little Evidence for Haploinsufficiency (04/15/2016)","0 - No Evidence for Haploinsufficiency (04/15/2016)","https://search.clinicalgenome.org/kb/gene-dosage/HGNC:393","Dosage Working Group","definitive evidence (07/29/2021)","https://search.clinicalgenome.org/kb/gene-validity/CGGV:assertion_52b1df18-387f-4c38-a655-682e4d2eb378-2021-07-29T213439.431Z","Brain Malformations","","",""
"AKT3","HGNC:393","https://search.clinicalgenome.org/kb/genes/HGNC:393","microcephaly","MONDO:0001149","https://search.clinicalgenome.org/kb/conditions/MONDO:0001149","Autosomal dominant inheritance","1 - Little Evidence for Haploinsufficiency (04/15/2016)","0 - No Evidence for Haploinsufficiency (04/15/2016)","https://search.clinicalgenome.org/kb/gene-dosage/HGNC:393","Dosage Working Group","limited evidence (10/26/2021)","https://search.clinicalgenome.org/kb/gene-validity/CGGV:assertion_6e3b524c-5d27-43d6-a0db-4f8f7cf1f872-2021-10-26T150030.155Z","Brain Malformations","","",""
"ALAD","HGNC:395","https://search.clinicalgenome.org/kb/genes/HGNC:395","porphyria due to ALA dehydratase deficiency","MONDO:0013000","https://search.clinicalgenome.org/kb/conditions/MONDO:0013000","Autosomal recessive inheritance","30 - Gene Associated with Autosomal Recessive Phenotype (08/22/2016)","","https://search.clinicalgenome.org/kb/gene-dosage/HGNC:395","Dosage Working Group","moderate evidence (03/11/2022)","https://search.clinicalgenome.org/kb/gene-validity/CGGV:assertion_0ac683af-ca8d-46ab-8641-66ab9b537d16-2022-03-11T170000.000Z","General Inborn Errors of Metabolism","","",""
"ALAS2","HGNC:397","https://search.clinicalgenome.org/kb/genes/HGNC:397","X-linked erythropoietic protoporphyria","MONDO:0010420","https://search.clinicalgenome.org/kb/conditions/MONDO:0010420","X-linked inheritance","","","","","definitive evidence (03/27/2022)","https://search.clinicalgenome.org/kb/gene-validity/CGGV:assertion_61e658f9-fdc9-4b3c-8788-80eb1ad83b0b-2022-03-27T181700.091Z","General Inborn Errors of Metabolism","","",""
"ALDH18A1","HGNC:9722","https://search.clinicalgenome.org/kb/genes/HGNC:9722","P5CS deficiency","MONDO:0100126","https://search.clinicalgenome.org/kb/conditions/MONDO:0100126","Semidominant inheritance","","","","","definitive evidence (05/18/2021)","https://search.clinicalgenome.org/kb/gene-validity/CGGV:assertion_7bfbe962-beb3-4553-9909-a83a3aac2d55-2021-05-18T211134.377Z","Aminoacidopathy","","",""
"ALDH1A3","HGNC:409","https://search.clinicalgenome.org/kb/genes/HGNC:409","isolated microphthalmia 8","MONDO:0014050","https://search.clinicalgenome.org/kb/conditions/MONDO:0014050","N/A","30 - Gene Associated with Autosomal Recessive Phenotype (08/22/2016)","0 - No Evidence for Haploinsufficiency (08/22/2016)","https://search.clinicalgenome.org/kb/gene-dosage/HGNC:409","Dosage Working Group","","","","","",""
"ALDH3A2","HGNC:403","https://search.clinicalgenome.org/kb/genes/HGNC:403","Sjogren-Larsson syndrome","MONDO:0010031","https://search.clinicalgenome.org/kb/conditions/MONDO:0010031","N/A","30 - Gene Associated with Autosomal Recessive Phenotype (08/22/2016)","","https://search.clinicalgenome.org/kb/gene-dosage/HGNC:403","Dosage Working Group","","","","","",""
"ALDH4A1","HGNC:406","https://search.clinicalgenome.org/kb/genes/HGNC:406","hyperprolinemia type 2","MONDO:0009401","https://search.clinicalgenome.org/kb/conditions/MONDO:0009401","Autosomal recessive inheritance","30 - Gene Associated with Autosomal Recessive Phenotype (04/09/2015)","0 - No Evidence for Haploinsufficiency (04/09/2015)","https://search.clinicalgenome.org/kb/gene-dosage/HGNC:406","Dosage Working Group","definitive evidence (10/23/2020)","https://search.clinicalgenome.org/kb/gene-validity/CGGV:assertion_5edc3f72-31e0-47f8-bcec-e3e5b81c97ae-2020-10-23T171643.432Z","Aminoacidopathy","","",""
"ALDH5A1","HGNC:408","https://search.clinicalgenome.org/kb/genes/HGNC:408","succinic semialdehyde dehydrogenase deficiency","MONDO:0010083","https://search.clinicalgenome.org/kb/conditions/MONDO:0010083","Autosomal recessive inheritance","30 - Gene Associated with Autosomal Recessive Phenotype (08/22/2016)","0 - No Evidence for Haploinsufficiency (08/22/2016)","https://search.clinicalgenome.org/kb/gene-dosage/HGNC:408","Dosage Working Group","definitive evidence (04/27/2021)","https://search.clinicalgenome.org/kb/gene-validity/CGGV:assertion_c3e57466-df2f-4045-b374-010dbd334bfc-2021-04-27T160000.000Z","Intellectual Disability and Autism","","",""
"ALDH6A1","HGNC:7179","https://search.clinicalgenome.org/kb/genes/HGNC:7179","methylmalonate semialdehyde dehydrogenase deficiency","MONDO:0013579","https://search.clinicalgenome.org/kb/conditions/MONDO:0013579","Autosomal recessive inheritance","","","","","limited evidence (09/27/2019)","https://search.clinicalgenome.org/kb/gene-validity/CGGV:assertion_57ca1521-9336-4769-bc55-240089dab917-2019-09-27T160000.000Z","Aminoacidopathy","","",""
"ALDH7A1","HGNC:877","https://search.clinicalgenome.org/kb/genes/HGNC:877","pyridoxine-dependent epilepsy","MONDO:0009945","https://search.clinicalgenome.org/kb/conditions/MONDO:0009945","Autosomal recessive inheritance","","","","","definitive evidence (07/26/2019)","https://search.clinicalgenome.org/kb/gene-validity/CGGV:assertion_7a982307-d8bd-43d1-b356-ef7ee6f32045-2019-07-26T160000.000Z","Aminoacidopathy","","",""
"ALDH7A1","HGNC:877","https://search.clinicalgenome.org/kb/genes/HGNC:877","pyridoxine-dependent epilepsy caused by ALDH7A1 mutant","MONDO:0020741","https://search.clinicalgenome.org/kb/conditions/MONDO:0020741","N/A","","","","","","","","Has Insufficient Evidence for Actionability Based on Early Rule-out (12/17/2018) | Strong Actionability (05/29/2019)","https://search.clinicalgenome.org/kb/gene-validity/https://actionability.clinicalgenome.org/ac/Adult/ui/stg2SummaryRpt?doc=AC1002 | https://search.clinicalgenome.org/kb/gene-validity/https://actionability.clinicalgenome.org/ac/Pediatric/ui/stg2SummaryRpt?doc=AC1002","Adult Actionability Working Group | Pediatric Actionability Working Group"
"ALDOA","HGNC:414","https://search.clinicalgenome.org/kb/genes/HGNC:414","glycogen storage disease due to aldolase A deficiency","MONDO:0012747","https://search.clinicalgenome.org/kb/conditions/MONDO:0012747","N/A","30 - Gene Associated with Autosomal Recessive Phenotype (08/22/2016)","","https://search.clinicalgenome.org/kb/gene-dosage/HGNC:414","Dosage Working Group","","","","","",""
"ALDOB","HGNC:417","https://search.clinicalgenome.org/kb/genes/HGNC:417","hereditary fructose intolerance","MONDO:0009249","https://search.clinicalgenome.org/kb/conditions/MONDO:0009249","N/A","","","","","","","","Strong Actionability (11/01/2018)","https://search.clinicalgenome.org/kb/gene-validity/https://actionability.clinicalgenome.org/ac/Pediatric/ui/stg2SummaryRpt?doc=AC008","Pediatric Actionability Working Group"
"ALG1","HGNC:18294","https://search.clinicalgenome.org/kb/genes/HGNC:18294","ALG1-CDG","MONDO:0012052","https://search.clinicalgenome.org/kb/conditions/MONDO:0012052","N/A","30 - Gene Associated with Autosomal Recessive Phenotype (08/22/2016)","","https://search.clinicalgenome.org/kb/gene-dosage/HGNC:18294","Dosage Working Group","","","","","",""
"ALG12","HGNC:19358","https://search.clinicalgenome.org/kb/genes/HGNC:19358","ALG12-CDG","MONDO:0011783","https://search.clinicalgenome.org/kb/conditions/MONDO:0011783","N/A","30 - Gene Associated with Autosomal Recessive Phenotype (08/22/2016)","0 - No Evidence for Haploinsufficiency (08/22/2016)","https://search.clinicalgenome.org/kb/gene-dosage/HGNC:19358","Dosage Working Group","","","","","",""
"ALG13","HGNC:30881","https://search.clinicalgenome.org/kb/genes/HGNC:30881","developmental and epileptic encephalopathy","MONDO:0100062","https://search.clinicalgenome.org/kb/conditions/MONDO:0100062","X-linked inheritance","","","","","definitive evidence (04/19/2018)","https://search.clinicalgenome.org/kb/gene-validity/CGGV:assertion_f14dd634-ec5c-48cc-a375-e3cfd0c6e832-2018-04-19T160000.000Z","Epilepsy","","",""
"ALG2","HGNC:23159","https://search.clinicalgenome.org/kb/genes/HGNC:23159","congenital myasthenic syndrome 14","MONDO:0014543","https://search.clinicalgenome.org/kb/conditions/MONDO:0014543","N/A","30 - Gene Associated with Autosomal Recessive Phenotype (08/22/2016)","","https://search.clinicalgenome.org/kb/gene-dosage/HGNC:23159","Dosage Working Group","","","","","",""
"ALG6","HGNC:23157","https://search.clinicalgenome.org/kb/genes/HGNC:23157","congenital disorder of glycosylation type 1C","MONDO:0011291","https://search.clinicalgenome.org/kb/conditions/MONDO:0011291","N/A","30 - Gene Associated with Autosomal Recessive Phenotype (08/22/2016)","","https://search.clinicalgenome.org/kb/gene-dosage/HGNC:23157","Dosage Working Group","","","","","",""
"ALG8","HGNC:23161","https://search.clinicalgenome.org/kb/genes/HGNC:23161","polycystic liver disease 3 with or without kidney cysts","MONDO:0054743","https://search.clinicalgenome.org/kb/conditions/MONDO:0054743","Autosomal dominant inheritance","","","","","limited evidence (07/29/2020)","https://search.clinicalgenome.org/kb/gene-validity/CGGV:assertion_13259bf6-e954-4159-b247-c9685638e537-2020-07-29T160000.000Z","Kidney Cystic and Ciliopathy Disorders","","",""
"ALG9","HGNC:15672","https://search.clinicalgenome.org/kb/genes/HGNC:15672","ALG9-associated autosomal dominant polycystic kidney disease","MONDO:0700000","https://search.clinicalgenome.org/kb/conditions/MONDO:0700000","Autosomal dominant inheritance","","","","","moderate evidence (08/26/2020)","https://search.clinicalgenome.org/kb/gene-validity/CGGV:assertion_38d817af-0a28-4453-a00f-ffccadbd9936-2020-08-26T160000.000Z","Kidney Cystic and Ciliopathy Disorders","","",""
"ALK","HGNC:427","https://search.clinicalgenome.org/kb/genes/HGNC:427","neuroblastoma, susceptibility to, 3","MONDO:0013083","https://search.clinicalgenome.org/kb/conditions/MONDO:0013083","Autosomal dominant inheritance","0 - No Evidence for Haploinsufficiency (12/20/2019)","0 - No Evidence for Haploinsufficiency (12/20/2019)","https://search.clinicalgenome.org/kb/gene-dosage/HGNC:427","Dosage Working Group","definitive evidence (11/21/2019)","https://search.clinicalgenome.org/kb/gene-validity/CGGV:assertion_ba9f692d-9b6d-4d46-8bfa-009ec20ae538-2019-11-21T193244.183Z","Hereditary Cancer","","",""
"ALMS1","HGNC:428","https://search.clinicalgenome.org/kb/genes/HGNC:428","Alstrom syndrome","MONDO:0008763","https://search.clinicalgenome.org/kb/conditions/MONDO:0008763","Autosomal recessive inheritance","30 - Gene Associated with Autosomal Recessive Phenotype (08/22/2016)","0 - No Evidence for Haploinsufficiency (08/22/2016)","https://search.clinicalgenome.org/kb/gene-dosage/HGNC:428","Dosage Working Group","definitive evidence (02/10/2017)","https://search.clinicalgenome.org/kb/gene-validity/CGGCIEX:assertion_6238","Hearing Loss","","",""
"ALPK3","HGNC:17574","https://search.clinicalgenome.org/kb/genes/HGNC:17574","hypertrophic cardiomyopathy","MONDO:0005045","https://search.clinicalgenome.org/kb/conditions/MONDO:0005045","Autosomal recessive inheritance","","","","","definitive evidence (02/09/2022)","https://search.clinicalgenome.org/kb/gene-validity/CGGV:assertion_6312d79f-df12-4ec6-8ce6-0f38f19e617d-2022-02-09T170000.000Z","Hereditary Cardiovascular Disease","","",""
"ALPL","HGNC:438","https://search.clinicalgenome.org/kb/genes/HGNC:438","obsolete infantile hypophosphatasia","MONDO:0009427","https://search.clinicalgenome.org/kb/conditions/MONDO:0009427","Autosomal recessive inheritance","","","","","definitive evidence (06/02/2021)","https://search.clinicalgenome.org/kb/gene-validity/CGGV:assertion_64fd43a0-1c7d-4f34-906c-570d800492bc-2021-06-02T205406.157Z","Skeletal Disorders","Assertion Pending (07/05/2018)","https://search.clinicalgenome.org/kb/gene-validity/https://actionability.clinicalgenome.org/ac/Pediatric/ui/stg2SummaryRpt?doc=AC004","Pediatric Actionability Working Group"
"ALPL","HGNC:438","https://search.clinicalgenome.org/kb/genes/HGNC:438","obsolete childhood hypophosphatasia","MONDO:0009428","https://search.clinicalgenome.org/kb/conditions/MONDO:0009428","Autosomal recessive inheritance | Autosomal dominant inheritance","","","","","definitive evidence (01/21/2019) | definitive evidence (03/03/2021)","https://search.clinicalgenome.org/kb/gene-validity/CGGV:assertion_354366d0-a7f6-472d-a7b2-4b16f6e328ac-2019-01-21T200000.000Z | https://search.clinicalgenome.org/kb/gene-validity/CGGV:assertion_52e23281-c9c5-42fe-a089-2652c3b849f8-2021-03-03T080000.000Z","Skeletal Disorders | Skeletal Disorders","Assertion Pending (07/05/2018)","https://search.clinicalgenome.org/kb/gene-validity/https://actionability.clinicalgenome.org/ac/Pediatric/ui/stg2SummaryRpt?doc=AC004","Pediatric Actionability Working Group"
"ALPL","HGNC:438","https://search.clinicalgenome.org/kb/genes/HGNC:438","obsolete adult hypophosphatasia","MONDO:0007798","https://search.clinicalgenome.org/kb/conditions/MONDO:0007798","Autosomal dominant inheritance","","","","","definitive evidence (05/19/2021)","https://search.clinicalgenome.org/kb/gene-validity/CGGV:assertion_03912003-38e1-45cc-a005-099e00dd3eec-2021-05-19T070000.000Z","Skeletal Disorders","","",""
"ALS2","HGNC:443","https://search.clinicalgenome.org/kb/genes/HGNC:443","Alstrom syndrome","MONDO:0008763","https://search.clinicalgenome.org/kb/conditions/MONDO:0008763","N/A","30 - Gene Associated with Autosomal Recessive Phenotype (08/22/2016)","0 - No Evidence for Haploinsufficiency (08/22/2016)","https://search.clinicalgenome.org/kb/gene-dosage/HGNC:443","Dosage Working Group","","","","","",""
"ALX4","HGNC:450","https://search.clinicalgenome.org/kb/genes/HGNC:450","parietal foramina 2","MONDO:0012309","https://search.clinicalgenome.org/kb/conditions/MONDO:0012309","N/A","3 - Sufficient Evidence for Haploinsufficiency (07/22/2020)","0 - No Evidence for Haploinsufficiency (07/22/2020)","https://search.clinicalgenome.org/kb/gene-dosage/HGNC:450","Dosage Working Group","","","","","",""
"AMACR","HGNC:451","https://search.clinicalgenome.org/kb/genes/HGNC:451","alpha-methylacyl-CoA racemase deficiency","MONDO:0013681","https://search.clinicalgenome.org/kb/conditions/MONDO:0013681","Autosomal recessive inheritance","","","","","moderate evidence (03/31/2022)","https://search.clinicalgenome.org/kb/gene-validity/CGGV:assertion_3fb8a3ea-cf06-4788-841f-e787f3780a49-2022-03-31T160000.000Z","Peroxisomal Disorders","","",""
"AMH","HGNC:464","https://search.clinicalgenome.org/kb/genes/HGNC:464","persistent Mullerian duct syndrome","MONDO:0009857","https://search.clinicalgenome.org/kb/conditions/MONDO:0009857","N/A","30 - Gene Associated with Autosomal Recessive Phenotype (08/22/2016)","","https://search.clinicalgenome.org/kb/gene-dosage/HGNC:464","Dosage Working Group","","","","","",""
"AMN","HGNC:14604","https://search.clinicalgenome.org/kb/genes/HGNC:14604","Imerslund-Grasbeck syndrome type 1","MONDO:0100156","https://search.clinicalgenome.org/kb/conditions/MONDO:0100156","N/A","30 - Gene Associated with Autosomal Recessive Phenotype (08/22/2016)","0 - No Evidence for Haploinsufficiency (08/22/2016)","https://search.clinicalgenome.org/kb/gene-dosage/HGNC:14604","Dosage Working Group","","","","","",""
"AMT","HGNC:473","https://search.clinicalgenome.org/kb/genes/HGNC:473","glycine encephalopathy","MONDO:0011612","https://search.clinicalgenome.org/kb/conditions/MONDO:0011612","Autosomal recessive inheritance","","","","","definitive evidence (05/24/2019)","https://search.clinicalgenome.org/kb/gene-validity/CGGV:assertion_a85e1b07-b975-4c92-b592-7b3e8d35805a-2019-05-24T160000.000Z","Aminoacidopathy","","",""
"ANG","HGNC:483","https://search.clinicalgenome.org/kb/genes/HGNC:483","amyotrophic lateral sclerosis type 9","MONDO:0012753","https://search.clinicalgenome.org/kb/conditions/MONDO:0012753","Autosomal dominant inheritance","","","","","limited evidence (02/08/2022)","https://search.clinicalgenome.org/kb/gene-validity/CGGV:assertion_4ee17299-56dd-40a7-8cec-9a316f3e46f2-2022-02-08T000000.000Z","Amyotrophic Lateral Sclerosis Spectrum Disorders","","",""
"ANGPTL3","HGNC:491","https://search.clinicalgenome.org/kb/genes/HGNC:491","familial hypobetalipoproteinemia 2","MONDO:0011505","https://search.clinicalgenome.org/kb/conditions/MONDO:0011505","N/A","30 - Gene Associated with Autosomal Recessive Phenotype (08/22/2016)","","https://search.clinicalgenome.org/kb/gene-dosage/HGNC:491","Dosage Working Group","","","","","",""
"ANK1","HGNC:492","https://search.clinicalgenome.org/kb/genes/HGNC:492","hereditary spherocytosis","MONDO:0019350","https://search.clinicalgenome.org/kb/conditions/MONDO:0019350","Autosomal dominant inheritance | Autosomal recessive inheritance","","","","","definitive evidence (03/24/2021) | limited evidence (06/23/2021)","https://search.clinicalgenome.org/kb/gene-validity/CGGV:assertion_82460b48-c4a5-4496-92ce-6fbad632d6d7-2021-03-24T160000.000Z | https://search.clinicalgenome.org/kb/gene-validity/CGGV:assertion_55457b0b-370e-466d-b2da-1cb8d67aecc8-2021-06-23T160000.000Z","General Gene Curation | General Gene Curation","","",""
"ANK2","HGNC:493","https://search.clinicalgenome.org/kb/genes/HGNC:493","Brugada syndrome","MONDO:0015263","https://search.clinicalgenome.org/kb/conditions/MONDO:0015263","Autosomal dominant inheritance","3 - Sufficient Evidence for Haploinsufficiency (05/22/2019)","0 - No Evidence for Haploinsufficiency (05/22/2019)","https://search.clinicalgenome.org/kb/gene-dosage/HGNC:493","Dosage Working Group","disputing (11/21/2017)","https://search.clinicalgenome.org/kb/gene-validity/CGGCIEX:assertion_10145","Brugada Syndrome","","",""
"ANK2","HGNC:493","https://search.clinicalgenome.org/kb/genes/HGNC:493","complex neurodevelopmental disorder","MONDO:0100038","https://search.clinicalgenome.org/kb/conditions/MONDO:0100038","Autosomal dominant inheritance","3 - Sufficient Evidence for Haploinsufficiency (05/22/2019)","0 - No Evidence for Haploinsufficiency (05/22/2019)","https://search.clinicalgenome.org/kb/gene-dosage/HGNC:493","Dosage Working Group","definitive evidence (12/15/2020)","https://search.clinicalgenome.org/kb/gene-validity/CGGV:assertion_097e646b-467f-4c08-95d6-958ed324562b-2020-12-15T175241.108Z","Intellectual Disability and Autism","","",""
"ANK2","HGNC:493","https://search.clinicalgenome.org/kb/genes/HGNC:493","catecholaminergic polymorphic ventricular tachycardia","MONDO:0017990","https://search.clinicalgenome.org/kb/conditions/MONDO:0017990","Autosomal dominant inheritance","3 - Sufficient Evidence for Haploinsufficiency (05/22/2019)","0 - No Evidence for Haploinsufficiency (05/22/2019)","https://search.clinicalgenome.org/kb/gene-dosage/HGNC:493","Dosage Working Group","disputing (01/20/2021)","https://search.clinicalgenome.org/kb/gene-validity/CGGV:assertion_c7e5e43e-1596-4c15-bf14-e9388b204e88-2021-01-20T170000.000Z","Catecholaminergic Polymorphic Ventricular Tachycardia","","",""
"ANK3","HGNC:494","https://search.clinicalgenome.org/kb/genes/HGNC:494","intellectual disability","MONDO:0001071","https://search.clinicalgenome.org/kb/conditions/MONDO:0001071","Autosomal recessive inheritance","","","","","moderate evidence (10/07/2020)","https://search.clinicalgenome.org/kb/gene-validity/CGGV:assertion_668a89e3-477d-434c-8ab4-0bc9ec3504de-2020-10-07T160000.000Z","Intellectual Disability and Autism","","",""
"ANKRD1","HGNC:15819","https://search.clinicalgenome.org/kb/genes/HGNC:15819","hypertrophic cardiomyopathy","MONDO:0005045","https://search.clinicalgenome.org/kb/conditions/MONDO:0005045","Autosomal dominant inheritance","","","","","limited evidence (05/01/2020)","https://search.clinicalgenome.org/kb/gene-validity/CGGV:assertion_8f241e6c-2fc8-4f23-b976-3b79d90fad3e-2020-05-01T125214.646Z","Hypertrophic Cardiomyopathy","","",""
"ANKRD1","HGNC:15819","https://search.clinicalgenome.org/kb/genes/HGNC:15819","dilated cardiomyopathy","MONDO:0005021","https://search.clinicalgenome.org/kb/conditions/MONDO:0005021","Autosomal dominant inheritance","","","","","limited evidence (08/12/2020)","https://search.clinicalgenome.org/kb/gene-validity/CGGV:assertion_3dcc6918-d7e7-4385-b343-bc8b8678b3a4-2020-08-12T160000.000Z","Dilated Cardiomyopathy","","",""
"ANKRD11","HGNC:21316","https://search.clinicalgenome.org/kb/genes/HGNC:21316","KBG syndrome","MONDO:0007846","https://search.clinicalgenome.org/kb/conditions/MONDO:0007846","Autosomal dominant inheritance","3 - Sufficient Evidence for Haploinsufficiency (06/14/2022)","0 - No Evidence for Haploinsufficiency (06/14/2022)","https://search.clinicalgenome.org/kb/gene-dosage/HGNC:21316","Dosage Working Group","definitive evidence (11/26/2019)","https://search.clinicalgenome.org/kb/gene-validity/CGGV:assertion_cf3e887e-8da4-45ea-bec8-9565f8246bc9-2019-11-26T170000.000Z","Intellectual Disability and Autism","","",""
"ANKRD26","HGNC:29186","https://search.clinicalgenome.org/kb/genes/HGNC:29186","thrombocytopenia 2","MONDO:0008555","https://search.clinicalgenome.org/kb/conditions/MONDO:0008555","Autosomal dominant inheritance","0 - No Evidence for Haploinsufficiency (04/14/2021)","0 - No Evidence for Haploinsufficiency (04/14/2021)","https://search.clinicalgenome.org/kb/gene-dosage/HGNC:29186","Dosage Working Group","definitive evidence (09/25/2019)","https://search.clinicalgenome.org/kb/gene-validity/CGGV:assertion_e86bee2b-8353-48c2-8ea3-a6b2b26cdb2f-2019-09-25T160000.000Z","Hemostasis Thrombosis","","",""
"ANKS6","HGNC:26724","https://search.clinicalgenome.org/kb/genes/HGNC:26724","nephronophthisis 16","MONDO:0014158","https://search.clinicalgenome.org/kb/conditions/MONDO:0014158","Autosomal recessive inheritance","30 - Gene Associated with Autosomal Recessive Phenotype (08/22/2016)","","https://search.clinicalgenome.org/kb/gene-dosage/HGNC:26724","Dosage Working Group","definitive evidence (08/25/2021)","https://search.clinicalgenome.org/kb/gene-validity/CGGV:assertion_62df8a40-0b65-46a4-89c8-51f26424c523-2021-08-25T160000.000Z","Kidney Cystic and Ciliopathy Disorders","","",""
"ANO5","HGNC:27337","https://search.clinicalgenome.org/kb/genes/HGNC:27337","autosomal recessive limb-girdle muscular dystrophy","MONDO:0015152","https://search.clinicalgenome.org/kb/conditions/MONDO:0015152","Autosomal recessive inheritance","","","","","definitive evidence (09/09/2020)","https://search.clinicalgenome.org/kb/gene-validity/CGGV:assertion_cecfa828-c192-44ae-9f3f-9dd5a99a5e5a-2020-09-09T120214.822Z","Limb Girdle Muscular Dystrophy","","",""
"ANO6","HGNC:25240","https://search.clinicalgenome.org/kb/genes/HGNC:25240","Scott syndrome","MONDO:0009885","https://search.clinicalgenome.org/kb/conditions/MONDO:0009885","Autosomal recessive inheritance","","","","","moderate evidence (06/22/2022)","https://search.clinicalgenome.org/kb/gene-validity/CGGV:assertion_c2d3c125-1938-4295-82bb-b2851a3b2c8d-2022-06-22T160000.000Z","Hemostasis Thrombosis","","",""
"ANOS1","HGNC:6211","https://search.clinicalgenome.org/kb/genes/HGNC:6211","hypogonadotropic hypogonadism 1 with or without anosmia","MONDO:0010635","https://search.clinicalgenome.org/kb/conditions/MONDO:0010635","X-linked inheritance","3 - Sufficient Evidence for Haploinsufficiency (05/26/2021)","0 - No Evidence for Haploinsufficiency (05/26/2021)","https://search.clinicalgenome.org/kb/gene-dosage/HGNC:6211","Dosage Working Group","definitive evidence (05/17/2022)","https://search.clinicalgenome.org/kb/gene-validity/CGGV:assertion_2b7650b6-f2b6-4ac3-a967-3e631c98d7b1-2022-05-17T223152.758Z","Syndromic Disorders","","",""
"ANTXR2","HGNC:21732","https://search.clinicalgenome.org/kb/genes/HGNC:21732","hyaline fibromatosis syndrome","MONDO:0009229","https://search.clinicalgenome.org/kb/conditions/MONDO:0009229","N/A","30 - Gene Associated with Autosomal Recessive Phenotype (08/22/2016)","0 - No Evidence for Haploinsufficiency (08/22/2016)","https://search.clinicalgenome.org/kb/gene-dosage/HGNC:21732","Dosage Working Group","","","","","",""
"ANXA11","HGNC:535","https://search.clinicalgenome.org/kb/genes/HGNC:535","amyotrophic lateral sclerosis type 23","MONDO:0027694","https://search.clinicalgenome.org/kb/conditions/MONDO:0027694","Autosomal dominant inheritance","","","","","definitive evidence (11/12/2021)","https://search.clinicalgenome.org/kb/gene-validity/CGGV:assertion_4dca2f56-87c6-4ac7-97bf-0889883b8e63-2021-11-12T215939.032Z","Amyotrophic Lateral Sclerosis Spectrum Disorders","","",""
"AP1S1","HGNC:559","https://search.clinicalgenome.org/kb/genes/HGNC:559","MEDNIK syndrome","MONDO:0012251","https://search.clinicalgenome.org/kb/conditions/MONDO:0012251","Autosomal recessive inheritance","","","","","definitive evidence (06/10/2022)","https://search.clinicalgenome.org/kb/gene-validity/CGGV:assertion_b9559de4-1945-47fa-bea5-336d376eec0e-2022-06-10T160000.000Z","General Inborn Errors of Metabolism","","",""
"AP1S2","HGNC:560","https://search.clinicalgenome.org/kb/genes/HGNC:560","X-linked syndromic intellectual disability","MONDO:0020119","https://search.clinicalgenome.org/kb/conditions/MONDO:0020119","X-linked inheritance","3 - Sufficient Evidence for Haploinsufficiency (04/28/2021)","0 - No Evidence for Haploinsufficiency (04/28/2021)","https://search.clinicalgenome.org/kb/gene-dosage/HGNC:560","Dosage Working Group","definitive evidence (10/20/2017)","https://search.clinicalgenome.org/kb/gene-validity/CGGV:assertion_9caaaacd-e262-421c-826b-8433848721ff-2017-10-20T160000.000Z","Intellectual Disability and Autism","","",""
"AP1S2","HGNC:560","https://search.clinicalgenome.org/kb/genes/HGNC:560","syndromic X-linked intellectual disability 5","MONDO:0010574","https://search.clinicalgenome.org/kb/conditions/MONDO:0010574","N/A","3 - Sufficient Evidence for Haploinsufficiency (04/28/2021)","0 - No Evidence for Haploinsufficiency (04/28/2021)","https://search.clinicalgenome.org/kb/gene-dosage/HGNC:560","Dosage Working Group","","","","","",""
"AP3B1","HGNC:566","https://search.clinicalgenome.org/kb/genes/HGNC:566","Hermansky-Pudlak syndrome 2","MONDO:0011997","https://search.clinicalgenome.org/kb/conditions/MONDO:0011997","Autosomal recessive inheritance","","","","","definitive evidence (02/26/2020)","https://search.clinicalgenome.org/kb/gene-validity/CGGV:assertion_00ce813c-9493-48f9-9351-b70defb71d75-2020-02-26T170000.000Z","Hemostasis Thrombosis","","",""
"AP3D1","HGNC:568","https://search.clinicalgenome.org/kb/genes/HGNC:568","Hermansky-Pudlak syndrome 10","MONDO:0014885","https://search.clinicalgenome.org/kb/conditions/MONDO:0014885","Autosomal recessive inheritance","","","","","limited evidence (02/26/2020)","https://search.clinicalgenome.org/kb/gene-validity/CGGV:assertion_3ec9ffa2-efda-446d-a848-e6d4d5b92fb6-2020-02-26T170000.000Z","Hemostasis Thrombosis","","",""
"AP4B1","HGNC:572","https://search.clinicalgenome.org/kb/genes/HGNC:572","AP-4 deficiency syndrome","MONDO:0100176","https://search.clinicalgenome.org/kb/conditions/MONDO:0100176","Autosomal recessive inheritance","30 - Gene Associated with Autosomal Recessive Phenotype (08/22/2016)","0 - No Evidence for Haploinsufficiency (08/22/2016)","https://search.clinicalgenome.org/kb/gene-dosage/HGNC:572","Dosage Working Group","definitive evidence (07/26/2021)","https://search.clinicalgenome.org/kb/gene-validity/CGGV:assertion_4436344a-e0da-4c42-b06a-cdf8a2581ce5-2021-07-26T160000.000Z","Intellectual Disability and Autism","","",""
"AP4B1","HGNC:572","https://search.clinicalgenome.org/kb/genes/HGNC:572","hereditary spastic paraplegia 47","MONDO:0013551","https://search.clinicalgenome.org/kb/conditions/MONDO:0013551","N/A","30 - Gene Associated with Autosomal Recessive Phenotype (08/22/2016)","0 - No Evidence for Haploinsufficiency (08/22/2016)","https://search.clinicalgenome.org/kb/gene-dosage/HGNC:572","Dosage Working Group","","","","","",""
"AP4E1","HGNC:573","https://search.clinicalgenome.org/kb/genes/HGNC:573","AP-4 deficiency syndrome","MONDO:0100176","https://search.clinicalgenome.org/kb/conditions/MONDO:0100176","Autosomal recessive inheritance","","","","","definitive evidence (02/18/2021)","https://search.clinicalgenome.org/kb/gene-validity/CGGV:assertion_be93d2e7-f302-41a7-9675-032510e46ad2-2021-02-18T155050.880Z","Intellectual Disability and Autism","","",""
"AP4M1","HGNC:574","https://search.clinicalgenome.org/kb/genes/HGNC:574","AP-4 deficiency syndrome","MONDO:0100176","https://search.clinicalgenome.org/kb/conditions/MONDO:0100176","Autosomal recessive inheritance","","","","","definitive evidence (04/07/2021)","https://search.clinicalgenome.org/kb/gene-validity/CGGV:assertion_f49be3e4-4e1f-478b-b4e0-f41623e5b548-2021-04-07T160000.000Z","Intellectual Disability and Autism","","",""
"AP4S1","HGNC:575","https://search.clinicalgenome.org/kb/genes/HGNC:575","hereditary spastic paraplegia 52","MONDO:0013552","https://search.clinicalgenome.org/kb/conditions/MONDO:0013552","N/A","30 - Gene Associated with Autosomal Recessive Phenotype (08/22/2016)","0 - No Evidence for Haploinsufficiency (08/22/2016)","https://search.clinicalgenome.org/kb/gene-dosage/HGNC:575","Dosage Working Group","","","","","",""
"APC","HGNC:583","https://search.clinicalgenome.org/kb/genes/HGNC:583","classic or attenuated familial adenomatous polyposis","MONDO:0021057","https://search.clinicalgenome.org/kb/conditions/MONDO:0021057","Autosomal dominant inheritance","3 - Sufficient Evidence for Haploinsufficiency (07/19/2021)","0 - No Evidence for Haploinsufficiency (07/19/2021)","https://search.clinicalgenome.org/kb/gene-dosage/HGNC:583","Dosage Working Group","definitive evidence (06/20/2022)","https://search.clinicalgenome.org/kb/gene-validity/CGGV:assertion_cdf062b6-6abf-49f6-a2dc-43b0e535f1b6-2022-06-20T170000.000Z","Hereditary Cancer","Strong Actionability (10/01/2019) | Definitive Actionability (10/01/2019)","https://search.clinicalgenome.org/kb/gene-validity/https://actionability.clinicalgenome.org/ac/Adult/ui/stg2SummaryRpt?doc=AC048 | https://search.clinicalgenome.org/kb/gene-validity/https://actionability.clinicalgenome.org/ac/Pediatric/ui/stg2SummaryRpt?doc=AC048","Adult Actionability Working Group | Pediatric Actionability Working Group"
"APC","HGNC:583","https://search.clinicalgenome.org/kb/genes/HGNC:583","gastric adenocarcinoma and proximal polyposis of the stomach","MONDO:0017790","https://search.clinicalgenome.org/kb/conditions/MONDO:0017790","Autosomal dominant inheritance","3 - Sufficient Evidence for Haploinsufficiency (07/19/2021)","0 - No Evidence for Haploinsufficiency (07/19/2021)","https://search.clinicalgenome.org/kb/gene-dosage/HGNC:583","Dosage Working Group","definitive evidence (06/20/2022)","https://search.clinicalgenome.org/kb/gene-validity/CGGV:assertion_22036d0d-71a8-4824-894b-0de40c412e15-2022-06-20T170000.000Z","Hereditary Cancer","","",""
"APC","HGNC:583","https://search.clinicalgenome.org/kb/genes/HGNC:583","classic familial adenomatous polyposis","MONDO:0021055","https://search.clinicalgenome.org/kb/conditions/MONDO:0021055","N/A","3 - Sufficient Evidence for Haploinsufficiency (07/19/2021)","0 - No Evidence for Haploinsufficiency (07/19/2021)","https://search.clinicalgenome.org/kb/gene-dosage/HGNC:583","Dosage Working Group","","","","Strong Actionability (10/01/2019) | Definitive Actionability (10/01/2019)","https://search.clinicalgenome.org/kb/gene-validity/https://actionability.clinicalgenome.org/ac/Adult/ui/stg2SummaryRpt?doc=AC048 | https://search.clinicalgenome.org/kb/gene-validity/https://actionability.clinicalgenome.org/ac/Pediatric/ui/stg2SummaryRpt?doc=AC048","Adult Actionability Working Group | Pediatric Actionability Working Group"
"APC","HGNC:583","https://search.clinicalgenome.org/kb/genes/HGNC:583","APC-related attenuated familial adenomatous polyposis","MONDO:0016613","https://search.clinicalgenome.org/kb/conditions/MONDO:0016613","N/A","3 - Sufficient Evidence for Haploinsufficiency (07/19/2021)","0 - No Evidence for Haploinsufficiency (07/19/2021)","https://search.clinicalgenome.org/kb/gene-dosage/HGNC:583","Dosage Working Group","","","","Strong Actionability (10/01/2019) | Definitive Actionability (10/01/2019)","https://search.clinicalgenome.org/kb/gene-validity/https://actionability.clinicalgenome.org/ac/Adult/ui/stg2SummaryRpt?doc=AC048 | https://search.clinicalgenome.org/kb/gene-validity/https://actionability.clinicalgenome.org/ac/Pediatric/ui/stg2SummaryRpt?doc=AC048","Adult Actionability Working Group | Pediatric Actionability Working Group"
"APC","HGNC:583","https://search.clinicalgenome.org/kb/genes/HGNC:583","attenuated familial adenomatous polyposis","MONDO:0016362","https://search.clinicalgenome.org/kb/conditions/MONDO:0016362","N/A","3 - Sufficient Evidence for Haploinsufficiency (07/19/2021)","0 - No Evidence for Haploinsufficiency (07/19/2021)","https://search.clinicalgenome.org/kb/gene-dosage/HGNC:583","Dosage Working Group","","","","Strong Actionability (10/01/2019) | Definitive Actionability (10/01/2019)","https://search.clinicalgenome.org/kb/gene-validity/https://actionability.clinicalgenome.org/ac/Adult/ui/stg2SummaryRpt?doc=AC048 | https://search.clinicalgenome.org/kb/gene-validity/https://actionability.clinicalgenome.org/ac/Pediatric/ui/stg2SummaryRpt?doc=AC048","Adult Actionability Working Group | Pediatric Actionability Working Group"
"APC","HGNC:583","https://search.clinicalgenome.org/kb/genes/HGNC:583","familial adenomatous polyposis 1","MONDO:0021056","https://search.clinicalgenome.org/kb/conditions/MONDO:0021056","N/A","3 - Sufficient Evidence for Haploinsufficiency (07/19/2021)","0 - No Evidence for Haploinsufficiency (07/19/2021)","https://search.clinicalgenome.org/kb/gene-dosage/HGNC:583","Dosage Working Group","","","","","",""
"APOB","HGNC:603","https://search.clinicalgenome.org/kb/genes/HGNC:603","hypercholesterolemia, autosomal dominant, type B","MONDO:0007751","https://search.clinicalgenome.org/kb/conditions/MONDO:0007751","Autosomal dominant inheritance","3 - Sufficient Evidence for Haploinsufficiency (04/09/2020)","0 - No Evidence for Haploinsufficiency (04/09/2020)","https://search.clinicalgenome.org/kb/gene-dosage/HGNC:603","Dosage Working Group","definitive evidence (11/14/2018)","https://search.clinicalgenome.org/kb/gene-validity/CGGV:assertion_1c26b83b-409e-47c7-9c53-6ca79472d6fc-2018-11-14T180000.000Z","General Gene Curation","Definitive Actionability (08/03/2020) | Strong Actionability (08/03/2020) | Strong Actionability (08/03/2020) | Strong Actionability (08/03/2020)","https://search.clinicalgenome.org/kb/gene-validity/https://actionability.clinicalgenome.org/ac/Adult/ui/stg2SummaryRpt?doc=AC057 | https://search.clinicalgenome.org/kb/gene-validity/https://actionability.clinicalgenome.org/ac/Pediatric/ui/stg2SummaryRpt?doc=AC057 | https://search.clinicalgenome.org/kb/gene-validity/https://actionability.clinicalgenome.org/ac/Adult/ui/stg2SummaryRpt?doc=AC065 | https://search.clinicalgenome.org/kb/gene-validity/https://actionability.clinicalgenome.org/ac/Pediatric/ui/stg2SummaryRpt?doc=AC065","Adult Actionability Working Group | Pediatric Actionability Working Group | Adult Actionability Working Group | Pediatric Actionability Working Group"
"APOB","HGNC:603","https://search.clinicalgenome.org/kb/genes/HGNC:603","familial hypobetalipoproteinemia 1","MONDO:0014252","https://search.clinicalgenome.org/kb/conditions/MONDO:0014252","Semidominant inheritance","3 - Sufficient Evidence for Haploinsufficiency (04/09/2020)","0 - No Evidence for Haploinsufficiency (04/09/2020)","https://search.clinicalgenome.org/kb/gene-dosage/HGNC:603","Dosage Working Group","definitive evidence (02/26/2020)","https://search.clinicalgenome.org/kb/gene-validity/CGGV:assertion_e7382aae-83d5-4a23-b1fe-e3d6acea8584-2020-02-26T170000.000Z","General Gene Curation","","",""
"APOB","HGNC:603","https://search.clinicalgenome.org/kb/genes/HGNC:603","homozygous familial hypercholesterolemia","MONDO:0018328","https://search.clinicalgenome.org/kb/conditions/MONDO:0018328","N/A","3 - Sufficient Evidence for Haploinsufficiency (04/09/2020)","0 - No Evidence for Haploinsufficiency (04/09/2020)","https://search.clinicalgenome.org/kb/gene-dosage/HGNC:603","Dosage Working Group","","","","Strong Actionability (08/03/2020) | Strong Actionability (08/03/2020)","https://search.clinicalgenome.org/kb/gene-validity/https://actionability.clinicalgenome.org/ac/Adult/ui/stg2SummaryRpt?doc=AC065 | https://search.clinicalgenome.org/kb/gene-validity/https://actionability.clinicalgenome.org/ac/Pediatric/ui/stg2SummaryRpt?doc=AC065","Adult Actionability Working Group | Pediatric Actionability Working Group"
"APOC2","HGNC:609","https://search.clinicalgenome.org/kb/genes/HGNC:609","familial apolipoprotein C-II deficiency","MONDO:0008810","https://search.clinicalgenome.org/kb/conditions/MONDO:0008810","N/A","30 - Gene Associated with Autosomal Recessive Phenotype (08/22/2016)","","https://search.clinicalgenome.org/kb/gene-dosage/HGNC:609","Dosage Working Group","","","","","",""
"APOL1","HGNC:618","https://search.clinicalgenome.org/kb/genes/HGNC:618","focal segmental glomerulosclerosis 4, susceptibility to","MONDO:0012931","https://search.clinicalgenome.org/kb/conditions/MONDO:0012931","Autosomal recessive inheritance","","","","","definitive evidence (09/28/2021)","https://search.clinicalgenome.org/kb/gene-validity/CGGV:assertion_47d0f13d-5122-4762-82c9-08db3ba104d1-2021-09-28T023000.000Z","Glomerulopathy","","",""
"APPL1","HGNC:24035","https://search.clinicalgenome.org/kb/genes/HGNC:24035","monogenic diabetes","MONDO:0015967","https://search.clinicalgenome.org/kb/conditions/MONDO:0015967","Autosomal dominant inheritance","","","","","limited evidence (12/15/2021)","https://search.clinicalgenome.org/kb/gene-validity/CGGV:assertion_5e2bc680-f1d4-4b65-baaa-22b4ff22b56e-2021-12-15T170000.000Z","Monogenic Diabetes","","",""
"AQP1","HGNC:633","https://search.clinicalgenome.org/kb/genes/HGNC:633","pulmonary arterial hypertension","MONDO:0015924","https://search.clinicalgenome.org/kb/conditions/MONDO:0015924","Autosomal dominant inheritance","","","","","limited evidence (01/11/2021)","https://search.clinicalgenome.org/kb/gene-validity/CGGV:assertion_29eda804-13df-4fe9-bbb3-9494b11edc92-2021-01-11T145519.495Z","Pulmonary Hypertension","","",""
"AQP5","HGNC:638","https://search.clinicalgenome.org/kb/genes/HGNC:638","palmoplantar keratoderma, Bothnian type","MONDO:0010849","https://search.clinicalgenome.org/kb/conditions/MONDO:0010849","Autosomal dominant inheritance","","","","","moderate evidence (07/03/2018)","https://search.clinicalgenome.org/kb/gene-validity/CGGV:assertion_77aa086c-5551-4e23-9e35-7c4ff072e238-2018-07-03T141124.777Z","UNC Biocuration Core","","",""
"AR","HGNC:644","https://search.clinicalgenome.org/kb/genes/HGNC:644","androgen insensitivity syndrome","MONDO:0019154","https://search.clinicalgenome.org/kb/conditions/MONDO:0019154","N/A","3 - Sufficient Evidence for Haploinsufficiency (12/08/2020)","0 - No Evidence for Haploinsufficiency (12/08/2020)","https://search.clinicalgenome.org/kb/gene-dosage/HGNC:644","Dosage Working Group","","","","","",""
"ARCN1","HGNC:649","https://search.clinicalgenome.org/kb/genes/HGNC:649","short stature, rhizomelic, with microcephaly, micrognathia, and developmental delay","MONDO:0014948","https://search.clinicalgenome.org/kb/conditions/MONDO:0014948","N/A","3 - Sufficient Evidence for Haploinsufficiency (05/10/2022)","0 - No Evidence for Haploinsufficiency (05/10/2022)","https://search.clinicalgenome.org/kb/gene-dosage/HGNC:649","Dosage Working Group","","","","","",""
"ARFGEF2","HGNC:15853","https://search.clinicalgenome.org/kb/genes/HGNC:15853","periventricular heterotopia with microcephaly, autosomal recessive","MONDO:0011966","https://search.clinicalgenome.org/kb/conditions/MONDO:0011966","N/A","30 - Gene Associated with Autosomal Recessive Phenotype (08/22/2016)","0 - No Evidence for Haploinsufficiency (08/22/2016)","https://search.clinicalgenome.org/kb/gene-dosage/HGNC:15853","Dosage Working Group","","","","","",""
"ARG1","HGNC:663","https://search.clinicalgenome.org/kb/genes/HGNC:663","hyperargininemia","MONDO:0008814","https://search.clinicalgenome.org/kb/conditions/MONDO:0008814","Autosomal recessive inheritance","30 - Gene Associated with Autosomal Recessive Phenotype (08/22/2016)","0 - No Evidence for Haploinsufficiency (08/22/2016)","https://search.clinicalgenome.org/kb/gene-dosage/HGNC:663","Dosage Working Group","definitive evidence (06/29/2020)","https://search.clinicalgenome.org/kb/gene-validity/CGGV:assertion_0157f793-9232-4700-bbf0-dfb16270f688-2020-06-29T174101.533Z","Aminoacidopathy","","",""
"ARHGEF1","HGNC:681","https://search.clinicalgenome.org/kb/genes/HGNC:681","immunodeficiency 62","MONDO:0032763","https://search.clinicalgenome.org/kb/conditions/MONDO:0032763","Autosomal recessive inheritance","","","","","limited evidence (01/19/2021)","https://search.clinicalgenome.org/kb/gene-validity/CGGV:assertion_9547c192-135d-48b3-a1c0-2eca5e2608c5-2021-01-19T214711.722Z","Antibody Deficiencies GCEP","","",""
"ARHGEF10","HGNC:14103","https://search.clinicalgenome.org/kb/genes/HGNC:14103","autosomal dominant slowed nerve conduction velocity","MONDO:0011998","https://search.clinicalgenome.org/kb/conditions/MONDO:0011998","Autosomal dominant inheritance","","","","","limited evidence (10/05/2020)","https://search.clinicalgenome.org/kb/gene-validity/CGGV:assertion_b23121f9-57e1-48ac-a2bc-d5a293829530-2020-10-05T160423.090Z","Charcot-Marie-Tooth","","",""
"ARHGEF6","HGNC:685","https://search.clinicalgenome.org/kb/genes/HGNC:685","non-syndromic X-linked intellectual disability","MONDO:0019181","https://search.clinicalgenome.org/kb/conditions/MONDO:0019181","X-linked inheritance","0 - No Evidence for Haploinsufficiency (04/25/2012)","0 - No Evidence for Haploinsufficiency (04/25/2012)","https://search.clinicalgenome.org/kb/gene-dosage/HGNC:685","Dosage Working Group","disputing (10/20/2020)","https://search.clinicalgenome.org/kb/gene-validity/CGGV:assertion_d248ef99-6ff8-43d8-a24e-dfce6b2db1c8-2020-10-20T160000.000Z","Intellectual Disability and Autism","","",""
"ARHGEF9","HGNC:14561","https://search.clinicalgenome.org/kb/genes/HGNC:14561","X-linked complex neurodevelopmental disorder","MONDO:0100148","https://search.clinicalgenome.org/kb/conditions/MONDO:0100148","X-linked inheritance","3 - Sufficient Evidence for Haploinsufficiency (11/25/2021)","0 - No Evidence for Haploinsufficiency (11/25/2021)","https://search.clinicalgenome.org/kb/gene-dosage/HGNC:14561","Dosage Working Group","moderate evidence (11/21/2019)","https://search.clinicalgenome.org/kb/gene-validity/CGGV:assertion_9305fb2c-6cdf-492d-9dd0-8b03dd4fab1c-2019-11-21T170000.000Z","Intellectual Disability and Autism","","",""
"ARID1A","HGNC:11110","https://search.clinicalgenome.org/kb/genes/HGNC:11110","Coffin-Siris syndrome","MONDO:0015452","https://search.clinicalgenome.org/kb/conditions/MONDO:0015452","Autosomal dominant inheritance","3 - Sufficient Evidence for Haploinsufficiency (05/27/2020)","0 - No Evidence for Haploinsufficiency (05/27/2020)","https://search.clinicalgenome.org/kb/gene-dosage/HGNC:11110","Dosage Working Group","definitive evidence (07/07/2021)","https://search.clinicalgenome.org/kb/gene-validity/CGGV:assertion_aaf6d47a-656a-49ca-ba9e-169f25bf03e7-2021-07-07T160000.000Z","Intellectual Disability and Autism","","",""
"ARID1A","HGNC:11110","https://search.clinicalgenome.org/kb/genes/HGNC:11110","intellectual disability, autosomal dominant 14","MONDO:0013819","https://search.clinicalgenome.org/kb/conditions/MONDO:0013819","N/A","3 - Sufficient Evidence for Haploinsufficiency (05/27/2020)","0 - No Evidence for Haploinsufficiency (05/27/2020)","https://search.clinicalgenome.org/kb/gene-dosage/HGNC:11110","Dosage Working Group","","","","","",""
"ARID1B","HGNC:18040","https://search.clinicalgenome.org/kb/genes/HGNC:18040","Coffin-Siris syndrome","MONDO:0015452","https://search.clinicalgenome.org/kb/conditions/MONDO:0015452","Autosomal dominant inheritance","3 - Sufficient Evidence for Haploinsufficiency (05/26/2021)","0 - No Evidence for Haploinsufficiency (05/26/2021)","https://search.clinicalgenome.org/kb/gene-dosage/HGNC:18040","Dosage Working Group","definitive evidence (12/04/2019)","https://search.clinicalgenome.org/kb/gene-validity/CGGV:assertion_d487e6c4-9727-4315-90a2-11338128a8e5-2019-12-04T200734.569Z","Intellectual Disability and Autism","","",""
"ARID1B","HGNC:18040","https://search.clinicalgenome.org/kb/genes/HGNC:18040","Coffin-Siris syndrome 1","MONDO:0007617","https://search.clinicalgenome.org/kb/conditions/MONDO:0007617","N/A","3 - Sufficient Evidence for Haploinsufficiency (05/26/2021)","0 - No Evidence for Haploinsufficiency (05/26/2021)","https://search.clinicalgenome.org/kb/gene-dosage/HGNC:18040","Dosage Working Group","","","","","",""
"ARID2","HGNC:18037","https://search.clinicalgenome.org/kb/genes/HGNC:18037","Coffin-Siris syndrome 6","MONDO:0033492","https://search.clinicalgenome.org/kb/conditions/MONDO:0033492","N/A","3 - Sufficient Evidence for Haploinsufficiency (06/26/2019)","0 - No Evidence for Haploinsufficiency (06/26/2019)","https://search.clinicalgenome.org/kb/gene-dosage/HGNC:18037","Dosage Working Group","","","","","",""
"ARL13B","HGNC:25419","https://search.clinicalgenome.org/kb/genes/HGNC:25419","Joubert syndrome","MONDO:0018772","https://search.clinicalgenome.org/kb/conditions/MONDO:0018772","Autosomal recessive inheritance","","","","","definitive evidence (06/03/2020)","https://search.clinicalgenome.org/kb/gene-validity/CGGV:assertion_f6c474c9-4035-498c-a902-03be50d36205-2020-06-03T210114.719Z","Syndromic Disorders","","",""
"ARL2BP","HGNC:17146","https://search.clinicalgenome.org/kb/genes/HGNC:17146","retinitis pigmentosa with or without situs inversus","MONDO:0014186","https://search.clinicalgenome.org/kb/conditions/MONDO:0014186","Autosomal recessive inheritance","","","","","limited evidence (07/03/2018)","https://search.clinicalgenome.org/kb/gene-validity/CGGV:assertion_afe2baae-73d8-4f77-a106-a9163dbde4ce-2018-07-03T175137.305Z","UNC Biocuration Core","","",""
"ARL6","HGNC:13210","https://search.clinicalgenome.org/kb/genes/HGNC:13210","Bardet-Biedl syndrome 3","MONDO:0010832","https://search.clinicalgenome.org/kb/conditions/MONDO:0010832","N/A","30 - Gene Associated with Autosomal Recessive Phenotype (08/22/2016)","0 - No Evidence for Haploinsufficiency (08/22/2016)","https://search.clinicalgenome.org/kb/gene-dosage/HGNC:13210","Dosage Working Group","","","","","",""
"ARL6IP1","HGNC:697","https://search.clinicalgenome.org/kb/genes/HGNC:697","hereditary spastic paraplegia 61","MONDO:0014304","https://search.clinicalgenome.org/kb/conditions/MONDO:0014304","N/A","30 - Gene Associated with Autosomal Recessive Phenotype (08/22/2016)","","https://search.clinicalgenome.org/kb/gene-dosage/HGNC:697","Dosage Working Group","","","","","",""
"ARPC1B","HGNC:704","https://search.clinicalgenome.org/kb/genes/HGNC:704","platelet abnormalities with eosinophilia and immune-mediated inflammatory disease","MONDO:0060583","https://search.clinicalgenome.org/kb/conditions/MONDO:0060583","Autosomal recessive inheritance","","","","","definitive evidence (07/22/2020)","https://search.clinicalgenome.org/kb/gene-validity/CGGV:assertion_13909f11-a592-41cc-ade9-c77a5b49b253-2020-07-22T160000.000Z","Hemostasis Thrombosis","","",""
"ARSA","HGNC:713","https://search.clinicalgenome.org/kb/genes/HGNC:713","metachromatic leukodystrophy, juvenile form","MONDO:0009591","https://search.clinicalgenome.org/kb/conditions/MONDO:0009591","N/A","30 - Gene Associated with Autosomal Recessive Phenotype (09/05/2012)","0 - No Evidence for Haploinsufficiency (09/05/2012)","https://search.clinicalgenome.org/kb/gene-dosage/HGNC:713","Dosage Working Group","","","","","",""
"ARSB","HGNC:714","https://search.clinicalgenome.org/kb/genes/HGNC:714","mucopolysaccharidosis type 6","MONDO:0009661","https://search.clinicalgenome.org/kb/conditions/MONDO:0009661","Autosomal recessive inheritance","","","","","definitive evidence (04/17/2022)","https://search.clinicalgenome.org/kb/gene-validity/CGGV:assertion_2a850717-e21b-495d-8542-de4fdb142647-2022-04-17T160000.000Z","Lysosomal Diseases","","",""
"ARSL","HGNC:719","https://search.clinicalgenome.org/kb/genes/HGNC:719","X-linked chondrodysplasia punctata 1","MONDO:0010555","https://search.clinicalgenome.org/kb/conditions/MONDO:0010555","X-linked inheritance","3 - Sufficient Evidence for Haploinsufficiency (07/12/2012)","0 - No Evidence for Haploinsufficiency (07/12/2012)","https://search.clinicalgenome.org/kb/gene-dosage/HGNC:719","Dosage Working Group","definitive evidence (08/25/2020)","https://search.clinicalgenome.org/kb/gene-validity/CGGV:assertion_2c48d88b-d100-4203-8abf-03f3199bf3e0-2020-08-25T132456.576Z","Syndromic Disorders","","",""
"ARX","HGNC:18060","https://search.clinicalgenome.org/kb/genes/HGNC:18060","developmental and epileptic encephalopathy","MONDO:0100062","https://search.clinicalgenome.org/kb/conditions/MONDO:0100062","X-linked inheritance","3 - Sufficient Evidence for Haploinsufficiency (12/05/2019)","0 - No Evidence for Haploinsufficiency (12/05/2019)","https://search.clinicalgenome.org/kb/gene-dosage/HGNC:18060","Dosage Working Group","definitive evidence (06/04/2019)","https://search.clinicalgenome.org/kb/gene-validity/CGGV:assertion_3a5357ce-2161-4a7f-a8e1-a1dba4550e57-2019-06-04T160000.000Z","Epilepsy","","",""
"ARX","HGNC:18060","https://search.clinicalgenome.org/kb/genes/HGNC:18060","X-linked complex neurodevelopmental disorder","MONDO:0100148","https://search.clinicalgenome.org/kb/conditions/MONDO:0100148","X-linked inheritance","3 - Sufficient Evidence for Haploinsufficiency (12/05/2019)","0 - No Evidence for Haploinsufficiency (12/05/2019)","https://search.clinicalgenome.org/kb/gene-dosage/HGNC:18060","Dosage Working Group","definitive evidence (12/01/2020)","https://search.clinicalgenome.org/kb/gene-validity/CGGV:assertion_ccf3ab49-ee8f-4980-aa04-ca13c21c124a-2020-12-01T170000.000Z","Intellectual Disability and Autism","","",""
"ARX","HGNC:18060","https://search.clinicalgenome.org/kb/genes/HGNC:18060","X-linked lissencephaly with abnormal genitalia","MONDO:0010268","https://search.clinicalgenome.org/kb/conditions/MONDO:0010268","N/A","3 - Sufficient Evidence for Haploinsufficiency (12/05/2019)","0 - No Evidence for Haploinsufficiency (12/05/2019)","https://search.clinicalgenome.org/kb/gene-dosage/HGNC:18060","Dosage Working Group","","","","","",""
"ASAH1","HGNC:735","https://search.clinicalgenome.org/kb/genes/HGNC:735","Farber lipogranulomatosis","MONDO:0009218","https://search.clinicalgenome.org/kb/conditions/MONDO:0009218","N/A","30 - Gene Associated with Autosomal Recessive Phenotype (09/12/2017)","0 - No Evidence for Haploinsufficiency (09/12/2017)","https://search.clinicalgenome.org/kb/gene-dosage/HGNC:735","Dosage Working Group","","","","","",""
"ASH1L","HGNC:19088","https://search.clinicalgenome.org/kb/genes/HGNC:19088","developmental disorder of mental health","MONDO:0005503","https://search.clinicalgenome.org/kb/conditions/MONDO:0005503","N/A","3 - Sufficient Evidence for Haploinsufficiency (12/27/2017)","0 - No Evidence for Haploinsufficiency (12/27/2017)","https://search.clinicalgenome.org/kb/gene-dosage/HGNC:19088","Dosage Working Group","","","","","",""
"ASL","HGNC:746","https://search.clinicalgenome.org/kb/genes/HGNC:746","argininosuccinic aciduria","MONDO:0008815","https://search.clinicalgenome.org/kb/conditions/MONDO:0008815","Autosomal recessive inheritance","30 - Gene Associated with Autosomal Recessive Phenotype (08/22/2016)","","https://search.clinicalgenome.org/kb/gene-dosage/HGNC:746","Dosage Working Group","definitive evidence (09/15/2018)","https://search.clinicalgenome.org/kb/gene-validity/CGGV:assertion_c16021b9-f6db-4e41-90f3-4786d63a1fa3-2018-09-15T160000.000Z","Aminoacidopathy","Has Insufficient Evidence for Actionability Based on Early Rule-out (05/04/2021) | Moderate Actionability (05/04/2021)","https://search.clinicalgenome.org/kb/gene-validity/https://actionability.clinicalgenome.org/ac/Adult/ui/stg2SummaryRpt?doc=AC1028 | https://search.clinicalgenome.org/kb/gene-validity/https://actionability.clinicalgenome.org/ac/Pediatric/ui/stg2SummaryRpt?doc=AC1028","Adult Actionability Working Group | Pediatric Actionability Working Group"
"ASNS","HGNC:753","https://search.clinicalgenome.org/kb/genes/HGNC:753","congenital microcephaly - severe encephalopathy - progressive cerebral atrophy syndrome","MONDO:0014258","https://search.clinicalgenome.org/kb/conditions/MONDO:0014258","Autosomal recessive inheritance","","","","","definitive evidence (06/29/2020)","https://search.clinicalgenome.org/kb/gene-validity/CGGV:assertion_e1cea57d-fe02-469e-8c52-a383c3f5a0c6-2020-06-29T174449.301Z","Aminoacidopathy","","",""
"ASPA","HGNC:756","https://search.clinicalgenome.org/kb/genes/HGNC:756","Canavan disease","MONDO:0010079","https://search.clinicalgenome.org/kb/conditions/MONDO:0010079","Autosomal recessive inheritance","30 - Gene Associated with Autosomal Recessive Phenotype (08/22/2016)","0 - No Evidence for Haploinsufficiency (08/22/2016)","https://search.clinicalgenome.org/kb/gene-dosage/HGNC:756","Dosage Working Group","definitive evidence (10/08/2020)","https://search.clinicalgenome.org/kb/gene-validity/CGGV:assertion_66306eff-659f-4508-a41b-1820e47e0e1d-2020-10-08T161701.633Z","Aminoacidopathy","","",""
"ASPH","HGNC:757","https://search.clinicalgenome.org/kb/genes/HGNC:757","facial dysmorphism-lens dislocation-anterior segment abnormalities-spontaneous filtering blebs syndrome","MONDO:0011106","https://search.clinicalgenome.org/kb/conditions/MONDO:0011106","N/A","30 - Gene Associated with Autosomal Recessive Phenotype (08/22/2016)","","https://search.clinicalgenome.org/kb/gene-dosage/HGNC:757","Dosage Working Group","","","","","",""
"ASPM","HGNC:19048","https://search.clinicalgenome.org/kb/genes/HGNC:19048","microcephaly 5, primary, autosomal recessive","MONDO:0012106","https://search.clinicalgenome.org/kb/conditions/MONDO:0012106","N/A","30 - Gene Associated with Autosomal Recessive Phenotype (08/22/2016)","0 - No Evidence for Haploinsufficiency (08/22/2016)","https://search.clinicalgenome.org/kb/gene-dosage/HGNC:19048","Dosage Working Group","","","","","",""
"ASS1","HGNC:758","https://search.clinicalgenome.org/kb/genes/HGNC:758","citrullinemia type I","MONDO:0008988","https://search.clinicalgenome.org/kb/conditions/MONDO:0008988","Autosomal recessive inheritance","","","","","definitive evidence (12/27/2018)","https://search.clinicalgenome.org/kb/gene-validity/CGGV:assertion_5dc5ef32-81ca-478e-be42-436da3416e4d-2018-12-27T170000.000Z","Aminoacidopathy","Strong Actionability (10/26/2020)","https://search.clinicalgenome.org/kb/gene-validity/https://actionability.clinicalgenome.org/ac/Pediatric/ui/stg2SummaryRpt?doc=AC1017","Pediatric Actionability Working Group"
"ASTN2","HGNC:17021","https://search.clinicalgenome.org/kb/genes/HGNC:17021","complex neurodevelopmental disorder","MONDO:0100038","https://search.clinicalgenome.org/kb/conditions/MONDO:0100038","N/A","1 - Little Evidence for Haploinsufficiency (03/09/2021)","0 - No Evidence for Haploinsufficiency (03/09/2021)","https://search.clinicalgenome.org/kb/gene-dosage/HGNC:17021","Dosage Working Group","","","","","",""
"ASXL1","HGNC:18318","https://search.clinicalgenome.org/kb/genes/HGNC:18318","Bohring-Opitz syndrome","MONDO:0011510","https://search.clinicalgenome.org/kb/conditions/MONDO:0011510","Autosomal dominant inheritance","3 - Sufficient Evidence for Haploinsufficiency (03/14/2013)","0 - No Evidence for Haploinsufficiency (03/14/2013)","https://search.clinicalgenome.org/kb/gene-dosage/HGNC:18318","Dosage Working Group","definitive evidence (07/30/2021)","https://search.clinicalgenome.org/kb/gene-validity/CGGV:assertion_31e0ce4d-aeb7-4983-9ec2-85178d7f40f0-2021-07-30T160000.000Z","Intellectual Disability and Autism","","",""
"ASXL2","HGNC:23805","https://search.clinicalgenome.org/kb/genes/HGNC:23805","syndromic intellectual disability","MONDO:0000508","https://search.clinicalgenome.org/kb/conditions/MONDO:0000508","Autosomal dominant inheritance","0 - No Evidence for Haploinsufficiency (06/28/2018)","0 - No Evidence for Haploinsufficiency (06/28/2018)","https://search.clinicalgenome.org/kb/gene-dosage/HGNC:23805","Dosage Working Group","definitive evidence (09/28/2021)","https://search.clinicalgenome.org/kb/gene-validity/CGGV:assertion_cedd313e-b43b-4212-840b-7d4172258b16-2021-09-28T115443.696Z","Intellectual Disability and Autism","","",""
"ASXL3","HGNC:29357","https://search.clinicalgenome.org/kb/genes/HGNC:29357","severe feeding difficulties-failure to thrive-microcephaly due to ASXL3 deficiency syndrome","MONDO:0014205","https://search.clinicalgenome.org/kb/conditions/MONDO:0014205","N/A","3 - Sufficient Evidence for Haploinsufficiency (11/22/2017)","0 - No Evidence for Haploinsufficiency (11/22/2017)","https://search.clinicalgenome.org/kb/gene-dosage/HGNC:29357","Dosage Working Group","","","","","",""
"ATCAY","HGNC:779","https://search.clinicalgenome.org/kb/genes/HGNC:779","Cayman type cerebellar ataxia","MONDO:0011025","https://search.clinicalgenome.org/kb/conditions/MONDO:0011025","N/A","30 - Gene Associated with Autosomal Recessive Phenotype (08/22/2016)","","https://search.clinicalgenome.org/kb/gene-dosage/HGNC:779","Dosage Working Group","","","","","",""
"ATF6","HGNC:791","https://search.clinicalgenome.org/kb/genes/HGNC:791","achromatopsia","MONDO:0018852","https://search.clinicalgenome.org/kb/conditions/MONDO:0018852","Autosomal recessive inheritance","30 - Gene Associated with Autosomal Recessive Phenotype (01/12/2017)","0 - No Evidence for Haploinsufficiency (01/12/2017)","https://search.clinicalgenome.org/kb/gene-dosage/HGNC:791","Dosage Working Group","strong evidence (11/16/2016)","https://search.clinicalgenome.org/kb/gene-validity/CGGCIEX:assertion_4842","General Gene Curation","","",""
"ATF6","HGNC:791","https://search.clinicalgenome.org/kb/genes/HGNC:791","ATF6-related retinopathy","MONDO:0100447","https://search.clinicalgenome.org/kb/conditions/MONDO:0100447","Autosomal recessive inheritance","30 - Gene Associated with Autosomal Recessive Phenotype (01/12/2017)","0 - No Evidence for Haploinsufficiency (01/12/2017)","https://search.clinicalgenome.org/kb/gene-dosage/HGNC:791","Dosage Working Group","definitive evidence (10/07/2021)","https://search.clinicalgenome.org/kb/gene-validity/CGGV:assertion_649d690a-8457-4c95-8d27-978daf4ac877-2021-10-07T160000.000Z","Retina","","",""
"ATF6","HGNC:791","https://search.clinicalgenome.org/kb/genes/HGNC:791","achromatopsia 7","MONDO:0014677","https://search.clinicalgenome.org/kb/conditions/MONDO:0014677","N/A","30 - Gene Associated with Autosomal Recessive Phenotype (01/12/2017)","0 - No Evidence for Haploinsufficiency (01/12/2017)","https://search.clinicalgenome.org/kb/gene-dosage/HGNC:791","Dosage Working Group","","","","","",""
"ATL1","HGNC:11231","https://search.clinicalgenome.org/kb/genes/HGNC:11231","neuropathy, hereditary sensory, type 1D","MONDO:0013381","https://search.clinicalgenome.org/kb/conditions/MONDO:0013381","Autosomal dominant inheritance","","","","","definitive evidence (02/10/2022)","https://search.clinicalgenome.org/kb/gene-validity/CGGV:assertion_0c0282d1-5ab4-4a86-b1f6-165a3dbd515a-2022-02-10T020857.711Z","Charcot-Marie-Tooth","","",""
"ATL3","HGNC:24526","https://search.clinicalgenome.org/kb/genes/HGNC:24526","neuropathy, hereditary sensory, type 1F","MONDO:0014286","https://search.clinicalgenome.org/kb/conditions/MONDO:0014286","Autosomal dominant inheritance","","","","","moderate evidence (07/13/2021)","https://search.clinicalgenome.org/kb/gene-validity/CGGV:assertion_132d0be7-2003-43ed-a934-1cf60cf45773-2021-07-13T160000.000Z","Charcot-Marie-Tooth","","",""
"ATM","HGNC:795","https://search.clinicalgenome.org/kb/genes/HGNC:795","hereditary nonpolyposis colon cancer","MONDO:0018630","https://search.clinicalgenome.org/kb/conditions/MONDO:0018630","Autosomal dominant inheritance","3 - Sufficient Evidence for Haploinsufficiency (04/08/2020)","0 - No Evidence for Haploinsufficiency (04/08/2020)","https://search.clinicalgenome.org/kb/gene-dosage/HGNC:795","Dosage Working Group","moderate evidence (08/28/2017)","https://search.clinicalgenome.org/kb/gene-validity/CGGCIEX:assertion_9861","Colon Cancer","","",""
"ATM","HGNC:795","https://search.clinicalgenome.org/kb/genes/HGNC:795","hereditary breast carcinoma","MONDO:0016419","https://search.clinicalgenome.org/kb/conditions/MONDO:0016419","Autosomal dominant inheritance","3 - Sufficient Evidence for Haploinsufficiency (04/08/2020)","0 - No Evidence for Haploinsufficiency (04/08/2020)","https://search.clinicalgenome.org/kb/gene-dosage/HGNC:795","Dosage Working Group","definitive evidence (07/12/2017)","https://search.clinicalgenome.org/kb/gene-validity/CGGCIEX:assertion_9908","Breast/Ovarian Cancer","Moderate Actionability (09/19/2017)","https://search.clinicalgenome.org/kb/gene-validity/https://actionability.clinicalgenome.org/ac/Adult/ui/stg2SummaryRpt?doc=AC127","Adult Actionability Working Group"
"ATM","HGNC:795","https://search.clinicalgenome.org/kb/genes/HGNC:795","familial ovarian cancer","MONDO:0016248","https://search.clinicalgenome.org/kb/conditions/MONDO:0016248","Autosomal dominant inheritance","3 - Sufficient Evidence for Haploinsufficiency (04/08/2020)","0 - No Evidence for Haploinsufficiency (04/08/2020)","https://search.clinicalgenome.org/kb/gene-dosage/HGNC:795","Dosage Working Group","limited evidence (07/12/2017)","https://search.clinicalgenome.org/kb/gene-validity/CGGCIEX:assertion_10080","Breast/Ovarian Cancer","","",""
"ATM","HGNC:795","https://search.clinicalgenome.org/kb/genes/HGNC:795","ataxia telangiectasia","MONDO:0008840","https://search.clinicalgenome.org/kb/conditions/MONDO:0008840","Autosomal recessive inheritance","3 - Sufficient Evidence for Haploinsufficiency (04/08/2020)","0 - No Evidence for Haploinsufficiency (04/08/2020)","https://search.clinicalgenome.org/kb/gene-dosage/HGNC:795","Dosage Working Group","definitive evidence (07/27/2021)","https://search.clinicalgenome.org/kb/gene-validity/CGGV:assertion_02a69e27-77dc-41bd-83d2-dda9c224ee43-2021-07-27T205239.729Z","Hereditary Cancer","","",""
"ATP13A2","HGNC:30213","https://search.clinicalgenome.org/kb/genes/HGNC:30213","Kufor-Rakeb syndrome","MONDO:0011706","https://search.clinicalgenome.org/kb/conditions/MONDO:0011706","Autosomal recessive inheritance","30 - Gene Associated with Autosomal Recessive Phenotype (08/22/2016)","","https://search.clinicalgenome.org/kb/gene-dosage/HGNC:30213","Dosage Working Group","definitive evidence (04/14/2022)","https://search.clinicalgenome.org/kb/gene-validity/CGGV:assertion_0ba5cb4f-3f7f-44dc-b2a5-0a2d62e510d4-2022-04-14T160000.000Z","Intellectual Disability and Autism","","",""
"ATP13A3","HGNC:24113","https://search.clinicalgenome.org/kb/genes/HGNC:24113","pulmonary arterial hypertension","MONDO:0015924","https://search.clinicalgenome.org/kb/conditions/MONDO:0015924","Semidominant inheritance","","","","","definitive evidence (11/09/2021)","https://search.clinicalgenome.org/kb/gene-validity/CGGV:assertion_5024e74a-fe6e-4eb2-89df-d07ff18e439c-2021-11-09T173936.225Z","Pulmonary Hypertension","","",""
"ATP1A2","HGNC:800","https://search.clinicalgenome.org/kb/genes/HGNC:800","familial or sporadic hemiplegic migraine","MONDO:0018925","https://search.clinicalgenome.org/kb/conditions/MONDO:0018925","Autosomal dominant inheritance","","","","","definitive evidence (03/02/2021)","https://search.clinicalgenome.org/kb/gene-validity/CGGV:assertion_fe788a45-b8da-4377-acdb-5dd55fcc3130-2021-03-02T183446.232Z","Epilepsy","","",""
"ATP1A3","HGNC:801","https://search.clinicalgenome.org/kb/genes/HGNC:801","ATP1A3-associated neurological disorder","MONDO:0700002","https://search.clinicalgenome.org/kb/conditions/MONDO:0700002","Autosomal dominant inheritance","","","","","definitive evidence (05/22/2022)","https://search.clinicalgenome.org/kb/gene-validity/CGGV:assertion_2a572fef-35c5-46dd-8a69-af436b3ecdcc-2022-05-22T063513.942Z","Syndromic Disorders","","",""
"ATP2A1","HGNC:811","https://search.clinicalgenome.org/kb/genes/HGNC:811","Brody myopathy","MONDO:0010977","https://search.clinicalgenome.org/kb/conditions/MONDO:0010977","N/A","30 - Gene Associated with Autosomal Recessive Phenotype (08/22/2016)","0 - No Evidence for Haploinsufficiency (08/22/2016)","https://search.clinicalgenome.org/kb/gene-dosage/HGNC:811","Dosage Working Group","","","","","",""
"ATP5MK","HGNC:30889","https://search.clinicalgenome.org/kb/genes/HGNC:30889","Leigh syndrome","MONDO:0009723","https://search.clinicalgenome.org/kb/conditions/MONDO:0009723","Autosomal recessive inheritance","","","","","moderate evidence (08/27/2020)","https://search.clinicalgenome.org/kb/gene-validity/CGGV:assertion_ff19a86d-404a-464e-8da6-8824ce45ed20-2020-08-27T164252.070Z","Mitochondrial Diseases","","",""
"ATP6AP1","HGNC:868","https://search.clinicalgenome.org/kb/genes/HGNC:868","congenital disorder of glycosylation type II","MONDO:0005501","https://search.clinicalgenome.org/kb/conditions/MONDO:0005501","X-linked inheritance","","","","","limited evidence (09/17/2021)","https://search.clinicalgenome.org/kb/gene-validity/CGGV:assertion_c6bfce2b-c20c-40f9-b2f5-d81f76a328f7-2021-09-17T122311.885Z","General Inborn Errors of Metabolism","","",""
"ATP6AP2","HGNC:18305","https://search.clinicalgenome.org/kb/genes/HGNC:18305","ATP6AP2-related disorder","MONDO:0100146","https://search.clinicalgenome.org/kb/conditions/MONDO:0100146","X-linked inheritance","0 - No Evidence for Haploinsufficiency (10/31/2012)","0 - No Evidence for Haploinsufficiency (10/31/2012)","https://search.clinicalgenome.org/kb/gene-dosage/HGNC:18305","Dosage Working Group","definitive evidence (09/14/2020)","https://search.clinicalgenome.org/kb/gene-validity/CGGV:assertion_ac33652a-dd98-46f4-ba4e-d3d5a482a22e-2020-09-14T160000.000Z","Intellectual Disability and Autism","","",""
"ATP6V0A2","HGNC:18481","https://search.clinicalgenome.org/kb/genes/HGNC:18481","autosomal recessive cutis laxa type 2A","MONDO:0018163","https://search.clinicalgenome.org/kb/conditions/MONDO:0018163","N/A","30 - Gene Associated with Autosomal Recessive Phenotype (08/22/2016)","0 - No Evidence for Haploinsufficiency (08/22/2016)","https://search.clinicalgenome.org/kb/gene-dosage/HGNC:18481","Dosage Working Group","","","","","",""
"ATP6V0A4","HGNC:866","https://search.clinicalgenome.org/kb/genes/HGNC:866","renal tubular acidosis, distal, 3, with or without sensorineural hearing loss","MONDO:0011268","https://search.clinicalgenome.org/kb/conditions/MONDO:0011268","N/A","30 - Gene Associated with Autosomal Recessive Phenotype (08/22/2016)","","https://search.clinicalgenome.org/kb/gene-dosage/HGNC:866","Dosage Working Group","","","","","",""
"ATP6V1B1","HGNC:853","https://search.clinicalgenome.org/kb/genes/HGNC:853","renal tubular acidosis, distal, 2, with progressive sensorineural hearing loss","MONDO:0009968","https://search.clinicalgenome.org/kb/conditions/MONDO:0009968","Autosomal recessive inheritance","","","","","definitive evidence (12/19/2017)","https://search.clinicalgenome.org/kb/gene-validity/CGGV:assertion_c74d3789-9cfc-4be3-b23d-baf610620e6c-2017-12-19T050000.000Z","Hearing Loss","","",""
"ATP7A","HGNC:869","https://search.clinicalgenome.org/kb/genes/HGNC:869","Menkes disease","MONDO:0010651","https://search.clinicalgenome.org/kb/conditions/MONDO:0010651","X-linked inheritance","3 - Sufficient Evidence for Haploinsufficiency (03/24/2021)","0 - No Evidence for Haploinsufficiency (03/24/2021)","https://search.clinicalgenome.org/kb/gene-dosage/HGNC:869","Dosage Working Group","definitive evidence (02/07/2018)","https://search.clinicalgenome.org/kb/gene-validity/CGGV:assertion_9bc50734-316b-47db-ba10-61f3fde46cca-2018-02-07T170000.000Z","Intellectual Disability and Autism","Moderate Actionability (01/17/2019)","https://search.clinicalgenome.org/kb/gene-validity/https://actionability.clinicalgenome.org/ac/Pediatric/ui/stg2SummaryRpt?doc=AC013","Pediatric Actionability Working Group"
"ATP7B","HGNC:870","https://search.clinicalgenome.org/kb/genes/HGNC:870","Wilson disease","MONDO:0010200","https://search.clinicalgenome.org/kb/conditions/MONDO:0010200","Autosomal recessive inheritance","30 - Gene Associated with Autosomal Recessive Phenotype (01/12/2017)","0 - No Evidence for Haploinsufficiency (01/12/2017)","https://search.clinicalgenome.org/kb/gene-dosage/HGNC:870","Dosage Working Group","definitive evidence (03/27/2019)","https://search.clinicalgenome.org/kb/gene-validity/CGGV:assertion_f0ac0a41-d7d5-4377-a622-1ee9bc4ed9f3-2019-03-27T160000.000Z","General Gene Curation","Definitive Actionability (02/14/2022) | Strong Actionability (02/14/2022)","https://search.clinicalgenome.org/kb/gene-validity/https://actionability.clinicalgenome.org/ac/Pediatric/ui/stg2SummaryRpt?doc=AC028 | https://search.clinicalgenome.org/kb/gene-validity/https://actionability.clinicalgenome.org/ac/Adult/ui/stg2SummaryRpt?doc=AC028","Pediatric Actionability Working Group | Adult Actionability Working Group"
"ATPAF2","HGNC:18802","https://search.clinicalgenome.org/kb/genes/HGNC:18802","mitochondrial complex V (ATP synthase) deficiency, nuclear type 1","MONDO:0011421","https://search.clinicalgenome.org/kb/conditions/MONDO:0011421","N/A","30 - Gene Associated with Autosomal Recessive Phenotype (08/22/2016)","0 - No Evidence for Haploinsufficiency (08/22/2016)","https://search.clinicalgenome.org/kb/gene-dosage/HGNC:18802","Dosage Working Group","","","","","",""
"ATR","HGNC:882","https://search.clinicalgenome.org/kb/genes/HGNC:882","familial cutaneous telangiectasia and oropharyngeal predisposition cancer syndrome","MONDO:0013806","https://search.clinicalgenome.org/kb/conditions/MONDO:0013806","N/A","1 - Little Evidence for Haploinsufficiency (06/05/2020)","0 - No Evidence for Haploinsufficiency (06/05/2020)","https://search.clinicalgenome.org/kb/gene-dosage/HGNC:882","Dosage Working Group","","","","","",""
"ATRX","HGNC:886","https://search.clinicalgenome.org/kb/genes/HGNC:886","ATR-X-related syndrome","MONDO:0016980","https://search.clinicalgenome.org/kb/conditions/MONDO:0016980","X-linked inheritance","3 - Sufficient Evidence for Haploinsufficiency (07/31/2012)","0 - No Evidence for Haploinsufficiency (07/31/2012)","https://search.clinicalgenome.org/kb/gene-dosage/HGNC:886","Dosage Working Group","definitive evidence (09/29/2021)","https://search.clinicalgenome.org/kb/gene-validity/CGGV:assertion_5296ecdf-b709-47bd-9032-daec8b91e300-2021-09-29T160000.000Z","Intellectual Disability and Autism","","",""
"ATRX","HGNC:886","https://search.clinicalgenome.org/kb/genes/HGNC:886","alpha thalassemia-X-linked intellectual disability syndrome","MONDO:0010519","https://search.clinicalgenome.org/kb/conditions/MONDO:0010519","N/A","3 - Sufficient Evidence for Haploinsufficiency (07/31/2012)","0 - No Evidence for Haploinsufficiency (07/31/2012)","https://search.clinicalgenome.org/kb/gene-dosage/HGNC:886","Dosage Working Group","","","","","",""
"AUH","HGNC:890","https://search.clinicalgenome.org/kb/genes/HGNC:890","3-methylglutaconic aciduria type 1","MONDO:0009610","https://search.clinicalgenome.org/kb/conditions/MONDO:0009610","Autosomal recessive inheritance","","","","","definitive evidence (06/29/2020)","https://search.clinicalgenome.org/kb/gene-validity/CGGV:assertion_681f6747-37ce-498e-8bb1-eddd55a90e2c-2020-06-29T174231.569Z","Aminoacidopathy","","",""
"AUTS2","HGNC:14262","https://search.clinicalgenome.org/kb/genes/HGNC:14262","syndromic intellectual disability","MONDO:0000508","https://search.clinicalgenome.org/kb/conditions/MONDO:0000508","Autosomal dominant inheritance","3 - Sufficient Evidence for Haploinsufficiency (06/24/2020)","0 - No Evidence for Haploinsufficiency (06/24/2020)","https://search.clinicalgenome.org/kb/gene-dosage/HGNC:14262","Dosage Working Group","definitive evidence (09/01/2020)","https://search.clinicalgenome.org/kb/gene-validity/CGGV:assertion_582999f6-b3b4-46de-90a0-8f44e22df469-2020-09-01T160000.000Z","Intellectual Disability and Autism","","",""
"AUTS2","HGNC:14262","https://search.clinicalgenome.org/kb/genes/HGNC:14262","autism spectrum disorder due to AUTS2 deficiency","MONDO:0014361","https://search.clinicalgenome.org/kb/conditions/MONDO:0014361","N/A","3 - Sufficient Evidence for Haploinsufficiency (06/24/2020)","0 - No Evidence for Haploinsufficiency (06/24/2020)","https://search.clinicalgenome.org/kb/gene-dosage/HGNC:14262","Dosage Working Group","","","","","",""
"AVPR2","HGNC:897","https://search.clinicalgenome.org/kb/genes/HGNC:897","diabetes insipidus, nephrogenic, X-linked","MONDO:0010581","https://search.clinicalgenome.org/kb/conditions/MONDO:0010581","N/A","3 - Sufficient Evidence for Haploinsufficiency (02/01/2021)","0 - No Evidence for Haploinsufficiency (02/01/2021)","https://search.clinicalgenome.org/kb/gene-dosage/HGNC:897","Dosage Working Group","","","","","",""
"AXIN2","HGNC:904","https://search.clinicalgenome.org/kb/genes/HGNC:904","oligodontia-cancer predisposition syndrome","MONDO:0012075","https://search.clinicalgenome.org/kb/conditions/MONDO:0012075","Autosomal dominant inheritance","3 - Sufficient Evidence for Haploinsufficiency (12/08/2021)","0 - No Evidence for Haploinsufficiency (12/08/2021)","https://search.clinicalgenome.org/kb/gene-dosage/HGNC:904","Dosage Working Group","moderate evidence (06/08/2017)","https://search.clinicalgenome.org/kb/gene-validity/CGGCIEX:assertion_8439","Colon Cancer","","",""
"B3GALNT2","HGNC:28596","https://search.clinicalgenome.org/kb/genes/HGNC:28596","muscular dystrophy-dystroglycanopathy (congenital with brain and eye anomalies), type a, 11","MONDO:0014071","https://search.clinicalgenome.org/kb/conditions/MONDO:0014071","N/A","30 - Gene Associated with Autosomal Recessive Phenotype (08/22/2016)","","https://search.clinicalgenome.org/kb/gene-dosage/HGNC:28596","Dosage Working Group","","","","","",""
"B3GALT6","HGNC:17978","https://search.clinicalgenome.org/kb/genes/HGNC:17978","spondyloepimetaphyseal dysplasia with joint laxity, type 1, with or without fractures","MONDO:0010075","https://search.clinicalgenome.org/kb/conditions/MONDO:0010075","N/A","30 - Gene Associated with Autosomal Recessive Phenotype (08/22/2016)","0 - No Evidence for Haploinsufficiency (08/22/2016)","https://search.clinicalgenome.org/kb/gene-dosage/HGNC:17978","Dosage Working Group","","","","","",""
"B4GALT1","HGNC:924","https://search.clinicalgenome.org/kb/genes/HGNC:924","B4GALT1-CDG","MONDO:0011772","https://search.clinicalgenome.org/kb/conditions/MONDO:0011772","N/A","30 - Gene Associated with Autosomal Recessive Phenotype (08/22/2016)","0 - No Evidence for Haploinsufficiency (08/22/2016)","https://search.clinicalgenome.org/kb/gene-dosage/HGNC:924","Dosage Working Group","","","","","",""
"B4GALT7","HGNC:930","https://search.clinicalgenome.org/kb/genes/HGNC:930","Ehlers-Danlos syndrome, spondylodysplastic type, 1","MONDO:0020682","https://search.clinicalgenome.org/kb/conditions/MONDO:0020682","N/A","30 - Gene Associated with Autosomal Recessive Phenotype (08/22/2016)","0 - No Evidence for Haploinsufficiency (08/22/2016)","https://search.clinicalgenome.org/kb/gene-dosage/HGNC:930","Dosage Working Group","","","","","",""
"B9D1","HGNC:24123","https://search.clinicalgenome.org/kb/genes/HGNC:24123","Joubert syndrome 27","MONDO:0014927","https://search.clinicalgenome.org/kb/conditions/MONDO:0014927","N/A","30 - Gene Associated with Autosomal Recessive Phenotype (08/22/2016)","0 - No Evidence for Haploinsufficiency (08/22/2016)","https://search.clinicalgenome.org/kb/gene-dosage/HGNC:24123","Dosage Working Group","","","","","",""
"BAAT","HGNC:932","https://search.clinicalgenome.org/kb/genes/HGNC:932","bile acid CoA:amino acid N-acyltransferase deficiency","MONDO:0100305","https://search.clinicalgenome.org/kb/conditions/MONDO:0100305","Autosomal recessive inheritance","","","","","moderate evidence (04/15/2022)","https://search.clinicalgenome.org/kb/gene-validity/CGGV:assertion_9b732497-a853-45af-bf8e-b3ad663159f1-2022-04-15T160000.000Z","Peroxisomal Disorders","","",""
"BAG3","HGNC:939","https://search.clinicalgenome.org/kb/genes/HGNC:939","myofibrillar myopathy","MONDO:0018943","https://search.clinicalgenome.org/kb/conditions/MONDO:0018943","Autosomal dominant inheritance","3 - Sufficient Evidence for Haploinsufficiency (02/12/2015)","0 - No Evidence for Haploinsufficiency (02/12/2015)","https://search.clinicalgenome.org/kb/gene-dosage/HGNC:939","Dosage Working Group","definitive evidence (12/18/2016)","https://search.clinicalgenome.org/kb/gene-validity/CGGCIEX:assertion_5466","General Gene Curation","Has Insufficient Evidence for Actionability Based on Expert Review (09/06/2018)","https://search.clinicalgenome.org/kb/gene-validity/https://actionability.clinicalgenome.org/ac/Adult/ui/stg2SummaryRpt?doc=AC155","Adult Actionability Working Group"
"BAG3","HGNC:939","https://search.clinicalgenome.org/kb/genes/HGNC:939","dilated cardiomyopathy","MONDO:0005021","https://search.clinicalgenome.org/kb/conditions/MONDO:0005021","Autosomal dominant inheritance","3 - Sufficient Evidence for Haploinsufficiency (02/12/2015)","0 - No Evidence for Haploinsufficiency (02/12/2015)","https://search.clinicalgenome.org/kb/gene-dosage/HGNC:939","Dosage Working Group","definitive evidence (10/09/2020)","https://search.clinicalgenome.org/kb/gene-validity/CGGV:assertion_1bec07e1-0186-4f45-bd8e-7d8a0f2547a9-2020-10-09T160000.000Z","Dilated Cardiomyopathy","","",""
"BAG3","HGNC:939","https://search.clinicalgenome.org/kb/genes/HGNC:939","myofibrillar myopathy 6","MONDO:0013061","https://search.clinicalgenome.org/kb/conditions/MONDO:0013061","N/A","3 - Sufficient Evidence for Haploinsufficiency (02/12/2015)","0 - No Evidence for Haploinsufficiency (02/12/2015)","https://search.clinicalgenome.org/kb/gene-dosage/HGNC:939","Dosage Working Group","","","","Has Insufficient Evidence for Actionability Based on Expert Review (09/06/2018)","https://search.clinicalgenome.org/kb/gene-validity/https://actionability.clinicalgenome.org/ac/Adult/ui/stg2SummaryRpt?doc=AC155","Adult Actionability Working Group"
"BAG3","HGNC:939","https://search.clinicalgenome.org/kb/genes/HGNC:939","dilated cardiomyopathy 1HH","MONDO:0013479","https://search.clinicalgenome.org/kb/conditions/MONDO:0013479","N/A","3 - Sufficient Evidence for Haploinsufficiency (02/12/2015)","0 - No Evidence for Haploinsufficiency (02/12/2015)","https://search.clinicalgenome.org/kb/gene-dosage/HGNC:939","Dosage Working Group","","","","","",""
"BAP1","HGNC:950","https://search.clinicalgenome.org/kb/genes/HGNC:950","BAP1-related tumor predisposition syndrome","MONDO:0013692","https://search.clinicalgenome.org/kb/conditions/MONDO:0013692","Autosomal dominant inheritance","3 - Sufficient Evidence for Haploinsufficiency (12/27/2019)","0 - No Evidence for Haploinsufficiency (12/27/2019)","https://search.clinicalgenome.org/kb/gene-dosage/HGNC:950","Dosage Working Group","definitive evidence (03/21/2019)","https://search.clinicalgenome.org/kb/gene-validity/CGGV:assertion_d70c33af-2e4f-4489-9c29-797655015b1d-2019-03-21T175713.803Z","Hereditary Cancer","Assertion Pending (07/06/2017)","https://search.clinicalgenome.org/kb/gene-validity/https://actionability.clinicalgenome.org/ac/Adult/ui/stg2SummaryRpt?doc=AC139","Adult Actionability Working Group"
"BARD1","HGNC:952","https://search.clinicalgenome.org/kb/genes/HGNC:952","hereditary breast carcinoma","MONDO:0016419","https://search.clinicalgenome.org/kb/conditions/MONDO:0016419","Autosomal dominant inheritance","3 - Sufficient Evidence for Haploinsufficiency (05/01/2020)","0 - No Evidence for Haploinsufficiency (05/01/2020)","https://search.clinicalgenome.org/kb/gene-dosage/HGNC:952","Dosage Working Group","definitive evidence (08/09/2017)","https://search.clinicalgenome.org/kb/gene-validity/CGGCIEX:assertion_10081","Breast/Ovarian Cancer","","",""
"BARD1","HGNC:952","https://search.clinicalgenome.org/kb/genes/HGNC:952","hereditary nonpolyposis colon cancer","MONDO:0018630","https://search.clinicalgenome.org/kb/conditions/MONDO:0018630","Autosomal dominant inheritance","3 - Sufficient Evidence for Haploinsufficiency (05/01/2020)","0 - No Evidence for Haploinsufficiency (05/01/2020)","https://search.clinicalgenome.org/kb/gene-dosage/HGNC:952","Dosage Working Group","limited evidence (06/08/2017)","https://search.clinicalgenome.org/kb/gene-validity/CGGCIEX:assertion_8430","Colon Cancer","","",""
"BARD1","HGNC:952","https://search.clinicalgenome.org/kb/genes/HGNC:952","familial ovarian cancer","MONDO:0016248","https://search.clinicalgenome.org/kb/conditions/MONDO:0016248","Autosomal dominant inheritance","3 - Sufficient Evidence for Haploinsufficiency (05/01/2020)","0 - No Evidence for Haploinsufficiency (05/01/2020)","https://search.clinicalgenome.org/kb/gene-dosage/HGNC:952","Dosage Working Group","limited evidence (08/09/2017)","https://search.clinicalgenome.org/kb/gene-validity/CGGCIEX:assertion_9909","Breast/Ovarian Cancer","","",""
"BBS12","HGNC:26648","https://search.clinicalgenome.org/kb/genes/HGNC:26648","Bardet-Biedl syndrome 12","MONDO:0014440","https://search.clinicalgenome.org/kb/conditions/MONDO:0014440","N/A","30 - Gene Associated with Autosomal Recessive Phenotype (08/22/2016)","0 - No Evidence for Haploinsufficiency (08/22/2016)","https://search.clinicalgenome.org/kb/gene-dosage/HGNC:26648","Dosage Working Group","","","","","",""
"BBS5","HGNC:970","https://search.clinicalgenome.org/kb/genes/HGNC:970","Bardet-Biedl syndrome 5","MONDO:0014434","https://search.clinicalgenome.org/kb/conditions/MONDO:0014434","N/A","30 - Gene Associated with Autosomal Recessive Phenotype (10/12/2015)","0 - No Evidence for Haploinsufficiency (10/12/2015)","https://search.clinicalgenome.org/kb/gene-dosage/HGNC:970","Dosage Working Group","","","","","",""
"BBS7","HGNC:18758","https://search.clinicalgenome.org/kb/genes/HGNC:18758","Bardet-Biedl syndrome 7","MONDO:0014435","https://search.clinicalgenome.org/kb/conditions/MONDO:0014435","N/A","30 - Gene Associated with Autosomal Recessive Phenotype (08/22/2016)","","https://search.clinicalgenome.org/kb/gene-dosage/HGNC:18758","Dosage Working Group","","","","","",""
"BCAT2","HGNC:977","https://search.clinicalgenome.org/kb/genes/HGNC:977","hypervalinemia and hyperleucine-isoleucinemia","MONDO:0100058","https://search.clinicalgenome.org/kb/conditions/MONDO:0100058","Autosomal recessive inheritance","","","","","definitive evidence (07/24/2020)","https://search.clinicalgenome.org/kb/gene-validity/CGGV:assertion_b5e16ee6-88c9-4872-8681-dd7fd0156b0f-2020-07-24T172325.905Z","Aminoacidopathy","","",""
"BCHE","HGNC:983","https://search.clinicalgenome.org/kb/genes/HGNC:983","butyrylcholinesterase deficiency","MONDO:0015270","https://search.clinicalgenome.org/kb/conditions/MONDO:0015270","N/A","30 - Gene Associated with Autosomal Recessive Phenotype (08/22/2016)","","https://search.clinicalgenome.org/kb/gene-dosage/HGNC:983","Dosage Working Group","","","","","",""
"BCKDHA","HGNC:986","https://search.clinicalgenome.org/kb/genes/HGNC:986","maple syrup urine disease type 1A","MONDO:0023691","https://search.clinicalgenome.org/kb/conditions/MONDO:0023691","Autosomal recessive inheritance","","","","","definitive evidence (09/14/2018)","https://search.clinicalgenome.org/kb/gene-validity/CGGV:assertion_5c89a6c7-751a-4a99-8a32-97cc33c5df7c-2018-09-14T160000.000Z","Aminoacidopathy","Has Insufficient Evidence for Actionability Based on Early Rule-out (06/28/2021) | Strong Actionability (06/28/2021)","https://search.clinicalgenome.org/kb/gene-validity/https://actionability.clinicalgenome.org/ac/Adult/ui/stg2SummaryRpt?doc=AC1041 | https://search.clinicalgenome.org/kb/gene-validity/https://actionability.clinicalgenome.org/ac/Pediatric/ui/stg2SummaryRpt?doc=AC1041","Adult Actionability Working Group | Pediatric Actionability Working Group"
"BCKDHA","HGNC:986","https://search.clinicalgenome.org/kb/genes/HGNC:986","maple syrup urine disease","MONDO:0009563","https://search.clinicalgenome.org/kb/conditions/MONDO:0009563","N/A","","","","","","","","Has Insufficient Evidence for Actionability Based on Early Rule-out (06/28/2021) | Strong Actionability (06/28/2021)","https://search.clinicalgenome.org/kb/gene-validity/https://actionability.clinicalgenome.org/ac/Adult/ui/stg2SummaryRpt?doc=AC1041 | https://search.clinicalgenome.org/kb/gene-validity/https://actionability.clinicalgenome.org/ac/Pediatric/ui/stg2SummaryRpt?doc=AC1041","Adult Actionability Working Group | Pediatric Actionability Working Group"
"BCKDHA","HGNC:986","https://search.clinicalgenome.org/kb/genes/HGNC:986","intermittent maple syrup urine disease","MONDO:0017053","https://search.clinicalgenome.org/kb/conditions/MONDO:0017053","N/A","","","","","","","","Has Insufficient Evidence for Actionability Based on Early Rule-out (06/28/2021) | Strong Actionability (06/28/2021)","https://search.clinicalgenome.org/kb/gene-validity/https://actionability.clinicalgenome.org/ac/Adult/ui/stg2SummaryRpt?doc=AC1041 | https://search.clinicalgenome.org/kb/gene-validity/https://actionability.clinicalgenome.org/ac/Pediatric/ui/stg2SummaryRpt?doc=AC1041","Adult Actionability Working Group | Pediatric Actionability Working Group"
"BCKDHA","HGNC:986","https://search.clinicalgenome.org/kb/genes/HGNC:986","maple syrup urine disease, mild variant","MONDO:0014057","https://search.clinicalgenome.org/kb/conditions/MONDO:0014057","N/A","","","","","","","","Has Insufficient Evidence for Actionability Based on Early Rule-out (06/28/2021) | Strong Actionability (06/28/2021)","https://search.clinicalgenome.org/kb/gene-validity/https://actionability.clinicalgenome.org/ac/Adult/ui/stg2SummaryRpt?doc=AC1041 | https://search.clinicalgenome.org/kb/gene-validity/https://actionability.clinicalgenome.org/ac/Pediatric/ui/stg2SummaryRpt?doc=AC1041","Adult Actionability Working Group | Pediatric Actionability Working Group"
"BCKDHA","HGNC:986","https://search.clinicalgenome.org/kb/genes/HGNC:986","intermediate maple syrup urine disease","MONDO:0017052","https://search.clinicalgenome.org/kb/conditions/MONDO:0017052","N/A","","","","","","","","Has Insufficient Evidence for Actionability Based on Early Rule-out (06/28/2021) | Strong Actionability (06/28/2021)","https://search.clinicalgenome.org/kb/gene-validity/https://actionability.clinicalgenome.org/ac/Adult/ui/stg2SummaryRpt?doc=AC1041 | https://search.clinicalgenome.org/kb/gene-validity/https://actionability.clinicalgenome.org/ac/Pediatric/ui/stg2SummaryRpt?doc=AC1041","Adult Actionability Working Group | Pediatric Actionability Working Group"
"BCKDHA","HGNC:986","https://search.clinicalgenome.org/kb/genes/HGNC:986","thiamine-responsive maple syrup urine disease","MONDO:0017054","https://search.clinicalgenome.org/kb/conditions/MONDO:0017054","N/A","","","","","","","","Has Insufficient Evidence for Actionability Based on Early Rule-out (06/28/2021) | Strong Actionability (06/28/2021)","https://search.clinicalgenome.org/kb/gene-validity/https://actionability.clinicalgenome.org/ac/Adult/ui/stg2SummaryRpt?doc=AC1041 | https://search.clinicalgenome.org/kb/gene-validity/https://actionability.clinicalgenome.org/ac/Pediatric/ui/stg2SummaryRpt?doc=AC1041","Adult Actionability Working Group | Pediatric Actionability Working Group"
"BCKDHA","HGNC:986","https://search.clinicalgenome.org/kb/genes/HGNC:986","classic maple syrup urine disease","MONDO:0017051","https://search.clinicalgenome.org/kb/conditions/MONDO:0017051","N/A","","","","","","","","Has Insufficient Evidence for Actionability Based on Early Rule-out (06/28/2021) | Strong Actionability (06/28/2021)","https://search.clinicalgenome.org/kb/gene-validity/https://actionability.clinicalgenome.org/ac/Adult/ui/stg2SummaryRpt?doc=AC1041 | https://search.clinicalgenome.org/kb/gene-validity/https://actionability.clinicalgenome.org/ac/Pediatric/ui/stg2SummaryRpt?doc=AC1041","Adult Actionability Working Group | Pediatric Actionability Working Group"
"BCKDHB","HGNC:987","https://search.clinicalgenome.org/kb/genes/HGNC:987","maple syrup urine disease type 1B","MONDO:0023692","https://search.clinicalgenome.org/kb/conditions/MONDO:0023692","Autosomal recessive inheritance","30 - Gene Associated with Autosomal Recessive Phenotype (08/22/2016)","","https://search.clinicalgenome.org/kb/gene-dosage/HGNC:987","Dosage Working Group","definitive evidence (02/08/2019)","https://search.clinicalgenome.org/kb/gene-validity/CGGV:assertion_0b0d314c-7355-441c-a357-72ba3e566c57-2019-02-08T170000.000Z","Aminoacidopathy","Has Insufficient Evidence for Actionability Based on Early Rule-out (06/28/2021) | Strong Actionability (06/28/2021)","https://search.clinicalgenome.org/kb/gene-validity/https://actionability.clinicalgenome.org/ac/Adult/ui/stg2SummaryRpt?doc=AC1041 | https://search.clinicalgenome.org/kb/gene-validity/https://actionability.clinicalgenome.org/ac/Pediatric/ui/stg2SummaryRpt?doc=AC1041","Adult Actionability Working Group | Pediatric Actionability Working Group"
"BCKDHB","HGNC:987","https://search.clinicalgenome.org/kb/genes/HGNC:987","maple syrup urine disease","MONDO:0009563","https://search.clinicalgenome.org/kb/conditions/MONDO:0009563","N/A","30 - Gene Associated with Autosomal Recessive Phenotype (08/22/2016)","","https://search.clinicalgenome.org/kb/gene-dosage/HGNC:987","Dosage Working Group","","","","Has Insufficient Evidence for Actionability Based on Early Rule-out (06/28/2021) | Strong Actionability (06/28/2021)","https://search.clinicalgenome.org/kb/gene-validity/https://actionability.clinicalgenome.org/ac/Adult/ui/stg2SummaryRpt?doc=AC1041 | https://search.clinicalgenome.org/kb/gene-validity/https://actionability.clinicalgenome.org/ac/Pediatric/ui/stg2SummaryRpt?doc=AC1041","Adult Actionability Working Group | Pediatric Actionability Working Group"
"BCKDHB","HGNC:987","https://search.clinicalgenome.org/kb/genes/HGNC:987","maple syrup urine disease, mild variant","MONDO:0014057","https://search.clinicalgenome.org/kb/conditions/MONDO:0014057","N/A","30 - Gene Associated with Autosomal Recessive Phenotype (08/22/2016)","","https://search.clinicalgenome.org/kb/gene-dosage/HGNC:987","Dosage Working Group","","","","Has Insufficient Evidence for Actionability Based on Early Rule-out (06/28/2021) | Strong Actionability (06/28/2021)","https://search.clinicalgenome.org/kb/gene-validity/https://actionability.clinicalgenome.org/ac/Adult/ui/stg2SummaryRpt?doc=AC1041 | https://search.clinicalgenome.org/kb/gene-validity/https://actionability.clinicalgenome.org/ac/Pediatric/ui/stg2SummaryRpt?doc=AC1041","Adult Actionability Working Group | Pediatric Actionability Working Group"
"BCKDHB","HGNC:987","https://search.clinicalgenome.org/kb/genes/HGNC:987","thiamine-responsive maple syrup urine disease","MONDO:0017054","https://search.clinicalgenome.org/kb/conditions/MONDO:0017054","N/A","30 - Gene Associated with Autosomal Recessive Phenotype (08/22/2016)","","https://search.clinicalgenome.org/kb/gene-dosage/HGNC:987","Dosage Working Group","","","","Has Insufficient Evidence for Actionability Based on Early Rule-out (06/28/2021) | Strong Actionability (06/28/2021)","https://search.clinicalgenome.org/kb/gene-validity/https://actionability.clinicalgenome.org/ac/Adult/ui/stg2SummaryRpt?doc=AC1041 | https://search.clinicalgenome.org/kb/gene-validity/https://actionability.clinicalgenome.org/ac/Pediatric/ui/stg2SummaryRpt?doc=AC1041","Adult Actionability Working Group | Pediatric Actionability Working Group"
"BCKDHB","HGNC:987","https://search.clinicalgenome.org/kb/genes/HGNC:987","intermittent maple syrup urine disease","MONDO:0017053","https://search.clinicalgenome.org/kb/conditions/MONDO:0017053","N/A","30 - Gene Associated with Autosomal Recessive Phenotype (08/22/2016)","","https://search.clinicalgenome.org/kb/gene-dosage/HGNC:987","Dosage Working Group","","","","Has Insufficient Evidence for Actionability Based on Early Rule-out (06/28/2021) | Strong Actionability (06/28/2021)","https://search.clinicalgenome.org/kb/gene-validity/https://actionability.clinicalgenome.org/ac/Adult/ui/stg2SummaryRpt?doc=AC1041 | https://search.clinicalgenome.org/kb/gene-validity/https://actionability.clinicalgenome.org/ac/Pediatric/ui/stg2SummaryRpt?doc=AC1041","Adult Actionability Working Group | Pediatric Actionability Working Group"
"BCKDHB","HGNC:987","https://search.clinicalgenome.org/kb/genes/HGNC:987","intermediate maple syrup urine disease","MONDO:0017052","https://search.clinicalgenome.org/kb/conditions/MONDO:0017052","N/A","30 - Gene Associated with Autosomal Recessive Phenotype (08/22/2016)","","https://search.clinicalgenome.org/kb/gene-dosage/HGNC:987","Dosage Working Group","","","","Has Insufficient Evidence for Actionability Based on Early Rule-out (06/28/2021) | Strong Actionability (06/28/2021)","https://search.clinicalgenome.org/kb/gene-validity/https://actionability.clinicalgenome.org/ac/Adult/ui/stg2SummaryRpt?doc=AC1041 | https://search.clinicalgenome.org/kb/gene-validity/https://actionability.clinicalgenome.org/ac/Pediatric/ui/stg2SummaryRpt?doc=AC1041","Adult Actionability Working Group | Pediatric Actionability Working Group"
"BCKDHB","HGNC:987","https://search.clinicalgenome.org/kb/genes/HGNC:987","classic maple syrup urine disease","MONDO:0017051","https://search.clinicalgenome.org/kb/conditions/MONDO:0017051","N/A","30 - Gene Associated with Autosomal Recessive Phenotype (08/22/2016)","","https://search.clinicalgenome.org/kb/gene-dosage/HGNC:987","Dosage Working Group","","","","Has Insufficient Evidence for Actionability Based on Early Rule-out (06/28/2021) | Strong Actionability (06/28/2021)","https://search.clinicalgenome.org/kb/gene-validity/https://actionability.clinicalgenome.org/ac/Adult/ui/stg2SummaryRpt?doc=AC1041 | https://search.clinicalgenome.org/kb/gene-validity/https://actionability.clinicalgenome.org/ac/Pediatric/ui/stg2SummaryRpt?doc=AC1041","Adult Actionability Working Group | Pediatric Actionability Working Group"
"BCKDK","HGNC:16902","https://search.clinicalgenome.org/kb/genes/HGNC:16902","branched-chain keto acid dehydrogenase kinase deficiency","MONDO:0013970","https://search.clinicalgenome.org/kb/conditions/MONDO:0013970","Autosomal recessive inheritance","30 - Gene Associated with Autosomal Recessive Phenotype (08/22/2016)","","https://search.clinicalgenome.org/kb/gene-dosage/HGNC:16902","Dosage Working Group","definitive evidence (01/18/2019)","https://search.clinicalgenome.org/kb/gene-validity/CGGV:assertion_f90aaad0-b56a-41dc-8d1f-9d12fc66113f-2019-01-18T170000.000Z","Aminoacidopathy","","",""
"BCL11A","HGNC:13221","https://search.clinicalgenome.org/kb/genes/HGNC:13221","Dias-Logan syndrome","MONDO:0014914","https://search.clinicalgenome.org/kb/conditions/MONDO:0014914","Autosomal dominant inheritance","3 - Sufficient Evidence for Haploinsufficiency (04/13/2017)","0 - No Evidence for Haploinsufficiency (04/13/2017)","https://search.clinicalgenome.org/kb/gene-dosage/HGNC:13221","Dosage Working Group","definitive evidence (09/13/2020)","https://search.clinicalgenome.org/kb/gene-validity/CGGV:assertion_9630f9a3-3f90-49c6-ae8b-6313c950b1b2-2020-09-13T171807.228Z","Intellectual Disability and Autism","","",""
"BCOR","HGNC:20893","https://search.clinicalgenome.org/kb/genes/HGNC:20893","microphthalmia, syndromic 2","MONDO:0010261","https://search.clinicalgenome.org/kb/conditions/MONDO:0010261","X-linked inheritance","3 - Sufficient Evidence for Haploinsufficiency (10/04/2012)","0 - No Evidence for Haploinsufficiency (10/04/2012)","https://search.clinicalgenome.org/kb/gene-dosage/HGNC:20893","Dosage Working Group","definitive evidence (12/17/2020)","https://search.clinicalgenome.org/kb/gene-validity/CGGV:assertion_3da06b77-1ed0-4197-948c-a9bbf80b6ed4-2020-12-17T171347.861Z","Syndromic Disorders","","",""
"BCS1L","HGNC:1020","https://search.clinicalgenome.org/kb/genes/HGNC:1020","Leigh syndrome","MONDO:0009723","https://search.clinicalgenome.org/kb/conditions/MONDO:0009723","Autosomal recessive inheritance","30 - Gene Associated with Autosomal Recessive Phenotype (08/22/2016)","0 - No Evidence for Haploinsufficiency (08/22/2016)","https://search.clinicalgenome.org/kb/gene-dosage/HGNC:1020","Dosage Working Group","limited evidence (09/19/2019)","https://search.clinicalgenome.org/kb/gene-validity/CGGV:assertion_3b50d7db-1144-4187-a60c-72b45adb80bd-2019-09-19T155315.896Z","Mitochondrial Diseases","","",""
"BCS1L","HGNC:1020","https://search.clinicalgenome.org/kb/genes/HGNC:1020","Bjornstad syndrome","MONDO:0009872","https://search.clinicalgenome.org/kb/conditions/MONDO:0009872","Autosomal recessive inheritance","30 - Gene Associated with Autosomal Recessive Phenotype (08/22/2016)","0 - No Evidence for Haploinsufficiency (08/22/2016)","https://search.clinicalgenome.org/kb/gene-dosage/HGNC:1020","Dosage Working Group","definitive evidence (07/09/2018)","https://search.clinicalgenome.org/kb/gene-validity/CGGV:assertion_7a26b6b5-e703-43fc-bcd0-eaff67ef8107-2018-07-09T160000.000Z","Hearing Loss","","",""
"BDP1","HGNC:13652","https://search.clinicalgenome.org/kb/genes/HGNC:13652","nonsyndromic genetic hearing loss","MONDO:0019497","https://search.clinicalgenome.org/kb/conditions/MONDO:0019497","Autosomal recessive inheritance","","","","","limited evidence (03/26/2021)","https://search.clinicalgenome.org/kb/gene-validity/CGGV:assertion_d300a54b-171c-4445-a138-a24409e99aae-2021-03-26T160000.000Z","Hearing Loss","","",""
"BGN","HGNC:1044","https://search.clinicalgenome.org/kb/genes/HGNC:1044","familial thoracic aortic aneurysm and aortic dissection","MONDO:0019625","https://search.clinicalgenome.org/kb/conditions/MONDO:0019625","Autosomal dominant inheritance","","","","","limited evidence (12/22/2016)","https://search.clinicalgenome.org/kb/gene-validity/CGGCIEX:assertion_8260","Heritable Thoracic Aortic Aneurysm and Dissection","","",""
"BIN1","HGNC:1052","https://search.clinicalgenome.org/kb/genes/HGNC:1052","centronuclear myopathy","MONDO:0018947","https://search.clinicalgenome.org/kb/conditions/MONDO:0018947","Semidominant inheritance","30 - Gene Associated with Autosomal Recessive Phenotype (08/22/2016)","","https://search.clinicalgenome.org/kb/gene-dosage/HGNC:1052","Dosage Working Group","definitive evidence (04/27/2020)","https://search.clinicalgenome.org/kb/gene-validity/CGGV:assertion_1a2b9d96-97da-473d-8147-a425a5364fcb-2020-04-27T160000.000Z","Congenital Myopathies","","",""
"BIN1","HGNC:1052","https://search.clinicalgenome.org/kb/genes/HGNC:1052","myopathy, centronuclear, 2","MONDO:0009709","https://search.clinicalgenome.org/kb/conditions/MONDO:0009709","N/A","30 - Gene Associated with Autosomal Recessive Phenotype (08/22/2016)","","https://search.clinicalgenome.org/kb/gene-dosage/HGNC:1052","Dosage Working Group","","","","","",""
"BLK","HGNC:1057","https://search.clinicalgenome.org/kb/genes/HGNC:1057","monogenic diabetes","MONDO:0015967","https://search.clinicalgenome.org/kb/conditions/MONDO:0015967","Autosomal dominant inheritance","","","","","refuting evidence (06/16/2022)","https://search.clinicalgenome.org/kb/gene-validity/CGGV:assertion_072e29f7-db97-40d9-9280-819706203c24-2022-06-16T160000.000Z","Monogenic Diabetes","","",""
"BLM","HGNC:1058","https://search.clinicalgenome.org/kb/genes/HGNC:1058","Bloom syndrome","MONDO:0008876","https://search.clinicalgenome.org/kb/conditions/MONDO:0008876","Autosomal recessive inheritance","30 - Gene Associated with Autosomal Recessive Phenotype (02/09/2022)","0 - No Evidence for Haploinsufficiency (02/09/2022)","https://search.clinicalgenome.org/kb/gene-dosage/HGNC:1058","Dosage Working Group","definitive evidence (10/09/2018)","https://search.clinicalgenome.org/kb/gene-validity/CGGV:assertion_e0a20b67-5a62-462c-894b-76b60a66e979-2018-10-09T170000.000Z","Hereditary Cancer","","",""
"BLNK","HGNC:14211","https://search.clinicalgenome.org/kb/genes/HGNC:14211","agammaglobulinemia 4, autosomal recessive","MONDO:0013289","https://search.clinicalgenome.org/kb/conditions/MONDO:0013289","Autosomal recessive inheritance","30 - Gene Associated with Autosomal Recessive Phenotype (08/22/2016)","0 - No Evidence for Haploinsufficiency (08/22/2016)","https://search.clinicalgenome.org/kb/gene-dosage/HGNC:14211","Dosage Working Group","definitive evidence (03/16/2021)","https://search.clinicalgenome.org/kb/gene-validity/CGGV:assertion_2e1d2e1b-52a6-4371-9055-0e1cc74da39d-2021-03-16T132748.373Z","Antibody Deficiencies GCEP","","",""
"BLOC1S3","HGNC:20914","https://search.clinicalgenome.org/kb/genes/HGNC:20914","Hermansky-Pudlak syndrome 8","MONDO:0013560","https://search.clinicalgenome.org/kb/conditions/MONDO:0013560","Autosomal recessive inheritance","","","","","moderate evidence (09/23/2020)","https://search.clinicalgenome.org/kb/gene-validity/CGGV:assertion_bdeec503-f903-4507-89e7-33c9255b5ad1-2020-09-23T160000.000Z","Hemostasis Thrombosis","","",""
"BLOC1S6","HGNC:8549","https://search.clinicalgenome.org/kb/genes/HGNC:8549","Hermansky-Pudlak syndrome 9","MONDO:0013606","https://search.clinicalgenome.org/kb/conditions/MONDO:0013606","Autosomal recessive inheritance","","","","","definitive evidence (05/25/2022)","https://search.clinicalgenome.org/kb/gene-validity/CGGV:assertion_984682a2-afb9-48b3-afe8-20e0f633022d-2022-05-25T165516.466Z","Hemostasis Thrombosis","","",""
"BMP4","HGNC:1071","https://search.clinicalgenome.org/kb/genes/HGNC:1071","microphthalmia with brain and digit anomalies","MONDO:0011936","https://search.clinicalgenome.org/kb/conditions/MONDO:0011936","N/A","2 - Emerging Evidence for Haploinsufficiency (11/09/2021)","0 - No Evidence for Haploinsufficiency (11/09/2021)","https://search.clinicalgenome.org/kb/gene-dosage/HGNC:1071","Dosage Working Group","","","","","",""
"BMPER","HGNC:24154","https://search.clinicalgenome.org/kb/genes/HGNC:24154","diaphanospondylodysostosis","MONDO:0011946","https://search.clinicalgenome.org/kb/conditions/MONDO:0011946","N/A","30 - Gene Associated with Autosomal Recessive Phenotype (08/22/2016)","","https://search.clinicalgenome.org/kb/gene-dosage/HGNC:24154","Dosage Working Group","","","","","",""
"BMPR1A","HGNC:1076","https://search.clinicalgenome.org/kb/genes/HGNC:1076","generalized juvenile polyposis/juvenile polyposis coli","MONDO:0008276","https://search.clinicalgenome.org/kb/conditions/MONDO:0008276","Autosomal dominant inheritance","3 - Sufficient Evidence for Haploinsufficiency (06/24/2020)","0 - No Evidence for Haploinsufficiency (06/24/2020)","https://search.clinicalgenome.org/kb/gene-dosage/HGNC:1076","Dosage Working Group","definitive evidence (06/12/2017)","https://search.clinicalgenome.org/kb/gene-validity/CGGCIEX:assertion_10029","Colon Cancer","Assertion Pending (12/18/2015)","https://search.clinicalgenome.org/kb/gene-validity/https://actionability.clinicalgenome.org/ac/Adult/ui/stg2SummaryRpt?doc=AC066","Adult Actionability Working Group"
"BMPR1A","HGNC:1076","https://search.clinicalgenome.org/kb/genes/HGNC:1076","juvenile polyposis syndrome","MONDO:0017380","https://search.clinicalgenome.org/kb/conditions/MONDO:0017380","N/A","3 - Sufficient Evidence for Haploinsufficiency (06/24/2020)","0 - No Evidence for Haploinsufficiency (06/24/2020)","https://search.clinicalgenome.org/kb/gene-dosage/HGNC:1076","Dosage Working Group","","","","Assertion Pending (12/18/2015)","https://search.clinicalgenome.org/kb/gene-validity/https://actionability.clinicalgenome.org/ac/Adult/ui/stg2SummaryRpt?doc=AC066","Adult Actionability Working Group"
"BMPR2","HGNC:1078","https://search.clinicalgenome.org/kb/genes/HGNC:1078","pulmonary arterial hypertension","MONDO:0015924","https://search.clinicalgenome.org/kb/conditions/MONDO:0015924","Autosomal dominant inheritance","3 - Sufficient Evidence for Haploinsufficiency (08/26/2020)","0 - No Evidence for Haploinsufficiency (08/26/2020)","https://search.clinicalgenome.org/kb/gene-dosage/HGNC:1078","Dosage Working Group","definitive evidence (12/07/2020)","https://search.clinicalgenome.org/kb/gene-validity/CGGV:assertion_a20ce78b-18ba-436c-877e-a08d092ac7c7-2020-12-07T172318.621Z","Pulmonary Hypertension","","",""
"BMPR2","HGNC:1078","https://search.clinicalgenome.org/kb/genes/HGNC:1078","primary pulmonary hypertension","MONDO:0001999","https://search.clinicalgenome.org/kb/conditions/MONDO:0001999","N/A","3 - Sufficient Evidence for Haploinsufficiency (08/26/2020)","0 - No Evidence for Haploinsufficiency (08/26/2020)","https://search.clinicalgenome.org/kb/gene-dosage/HGNC:1078","Dosage Working Group","","","","Moderate Actionability (09/11/2017)","https://search.clinicalgenome.org/kb/gene-validity/https://actionability.clinicalgenome.org/ac/Adult/ui/stg2SummaryRpt?doc=AC146","Adult Actionability Working Group"
"BMPR2","HGNC:1078","https://search.clinicalgenome.org/kb/genes/HGNC:1078","pulmonary hypertension, primary, 1","MONDO:0024533","https://search.clinicalgenome.org/kb/conditions/MONDO:0024533","N/A","3 - Sufficient Evidence for Haploinsufficiency (08/26/2020)","0 - No Evidence for Haploinsufficiency (08/26/2020)","https://search.clinicalgenome.org/kb/gene-dosage/HGNC:1078","Dosage Working Group","","","","Moderate Actionability (09/11/2017)","https://search.clinicalgenome.org/kb/gene-validity/https://actionability.clinicalgenome.org/ac/Adult/ui/stg2SummaryRpt?doc=AC146","Adult Actionability Working Group"
"BMPR2","HGNC:1078","https://search.clinicalgenome.org/kb/genes/HGNC:1078","idiopathic and/or familial pulmonary arterial hypertension","MONDO:0008347","https://search.clinicalgenome.org/kb/conditions/MONDO:0008347","N/A","3 - Sufficient Evidence for Haploinsufficiency (08/26/2020)","0 - No Evidence for Haploinsufficiency (08/26/2020)","https://search.clinicalgenome.org/kb/gene-dosage/HGNC:1078","Dosage Working Group","","","","Moderate Actionability (09/11/2017)","https://search.clinicalgenome.org/kb/gene-validity/https://actionability.clinicalgenome.org/ac/Adult/ui/stg2SummaryRpt?doc=AC146","Adult Actionability Working Group"
"BPNT2","HGNC:26019","https://search.clinicalgenome.org/kb/genes/HGNC:26019","chondrodysplasia with joint dislocations, gPAPP type","MONDO:0013561","https://search.clinicalgenome.org/kb/conditions/MONDO:0013561","N/A","30 - Gene Associated with Autosomal Recessive Phenotype (08/22/2016)","","https://search.clinicalgenome.org/kb/gene-dosage/HGNC:26019","Dosage Working Group","","","","","",""
"BPTF","HGNC:3581","https://search.clinicalgenome.org/kb/genes/HGNC:3581","syndromic intellectual disability","MONDO:0000508","https://search.clinicalgenome.org/kb/conditions/MONDO:0000508","Autosomal dominant inheritance","3 - Sufficient Evidence for Haploinsufficiency (07/12/2022)","0 - No Evidence for Haploinsufficiency (07/12/2022)","https://search.clinicalgenome.org/kb/gene-dosage/HGNC:3581","Dosage Working Group","definitive evidence (07/06/2022)","https://search.clinicalgenome.org/kb/gene-validity/CGGV:assertion_08521bf8-a5a2-4a44-941b-12d9eae7aa4f-2022-07-06T160000.000Z","Intellectual Disability and Autism","","",""
"BRAF","HGNC:1097","https://search.clinicalgenome.org/kb/genes/HGNC:1097","Costello syndrome","MONDO:0009026","https://search.clinicalgenome.org/kb/conditions/MONDO:0009026","Autosomal dominant inheritance","1 - Little Evidence for Haploinsufficiency (08/04/2014)","0 - No Evidence for Haploinsufficiency (08/04/2014)","https://search.clinicalgenome.org/kb/gene-dosage/HGNC:1097","Dosage Working Group","disputing (07/24/2018)","https://search.clinicalgenome.org/kb/gene-validity/CGGV:assertion_f229eceb-8f5e-4ecb-a484-7863b8dc7d19-2018-07-24T160000.000Z","RASopathy","","",""
"BRAF","HGNC:1097","https://search.clinicalgenome.org/kb/genes/HGNC:1097","Noonan syndrome","MONDO:0018997","https://search.clinicalgenome.org/kb/conditions/MONDO:0018997","Autosomal dominant inheritance","1 - Little Evidence for Haploinsufficiency (08/04/2014)","0 - No Evidence for Haploinsufficiency (08/04/2014)","https://search.clinicalgenome.org/kb/gene-dosage/HGNC:1097","Dosage Working Group","moderate evidence (07/24/2018)","https://search.clinicalgenome.org/kb/gene-validity/CGGV:assertion_47cf08d5-efc6-4d42-b031-a06619873161-2018-07-24T160000.000Z","RASopathy","Assertion Pending (07/01/2019) | Assertion Pending (07/01/2019)","https://search.clinicalgenome.org/kb/gene-validity/https://actionability.clinicalgenome.org/ac/Adult/ui/stg2SummaryRpt?doc=AC1003 | https://search.clinicalgenome.org/kb/gene-validity/https://actionability.clinicalgenome.org/ac/Pediatric/ui/stg2SummaryRpt?doc=AC1003","Adult Actionability Working Group | Pediatric Actionability Working Group"
"BRAF","HGNC:1097","https://search.clinicalgenome.org/kb/genes/HGNC:1097","Noonan syndrome with multiple lentigines","MONDO:0007893","https://search.clinicalgenome.org/kb/conditions/MONDO:0007893","Autosomal dominant inheritance","1 - Little Evidence for Haploinsufficiency (08/04/2014)","0 - No Evidence for Haploinsufficiency (08/04/2014)","https://search.clinicalgenome.org/kb/gene-dosage/HGNC:1097","Dosage Working Group","limited evidence (07/24/2018)","https://search.clinicalgenome.org/kb/gene-validity/CGGV:assertion_888875a8-5654-486b-8e64-e1382ccc6650-2018-07-24T160000.000Z","RASopathy","","",""
"BRAF","HGNC:1097","https://search.clinicalgenome.org/kb/genes/HGNC:1097","cardiofaciocutaneous syndrome","MONDO:0015280","https://search.clinicalgenome.org/kb/conditions/MONDO:0015280","Autosomal dominant inheritance","1 - Little Evidence for Haploinsufficiency (08/04/2014)","0 - No Evidence for Haploinsufficiency (08/04/2014)","https://search.clinicalgenome.org/kb/gene-dosage/HGNC:1097","Dosage Working Group","definitive evidence (07/24/2018)","https://search.clinicalgenome.org/kb/gene-validity/CGGV:assertion_a53e5a92-126f-4b00-a89b-af55d4f342ca-2018-07-24T160000.000Z","RASopathy","","",""
"BRAF","HGNC:1097","https://search.clinicalgenome.org/kb/genes/HGNC:1097","Noonan syndrome 7","MONDO:0013379","https://search.clinicalgenome.org/kb/conditions/MONDO:0013379","N/A","1 - Little Evidence for Haploinsufficiency (08/04/2014)","0 - No Evidence for Haploinsufficiency (08/04/2014)","https://search.clinicalgenome.org/kb/gene-dosage/HGNC:1097","Dosage Working Group","","","","Assertion Pending (07/01/2019) | Assertion Pending (07/01/2019)","https://search.clinicalgenome.org/kb/gene-validity/https://actionability.clinicalgenome.org/ac/Adult/ui/stg2SummaryRpt?doc=AC1003 | https://search.clinicalgenome.org/kb/gene-validity/https://actionability.clinicalgenome.org/ac/Pediatric/ui/stg2SummaryRpt?doc=AC1003","Adult Actionability Working Group | Pediatric Actionability Working Group"
"BRAT1","HGNC:21701","https://search.clinicalgenome.org/kb/genes/HGNC:21701","lethal neonatal spasticity-epileptic encephalopathy syndrome","MONDO:0013784","https://search.clinicalgenome.org/kb/conditions/MONDO:0013784","N/A","30 - Gene Associated with Autosomal Recessive Phenotype (08/22/2016)","0 - No Evidence for Haploinsufficiency (08/22/2016)","https://search.clinicalgenome.org/kb/gene-dosage/HGNC:21701","Dosage Working Group","","","","","",""
"BRCA1","HGNC:1100","https://search.clinicalgenome.org/kb/genes/HGNC:1100","Fanconi anemia, complementation group S","MONDO:0054748","https://search.clinicalgenome.org/kb/conditions/MONDO:0054748","Autosomal recessive inheritance","3 - Sufficient Evidence for Haploinsufficiency (09/23/2021)","0 - No Evidence for Haploinsufficiency (09/23/2021)","https://search.clinicalgenome.org/kb/gene-dosage/HGNC:1100","Dosage Working Group","definitive evidence (05/14/2020)","https://search.clinicalgenome.org/kb/gene-validity/CGGV:assertion_aa39798d-9b6e-430d-8bc1-2a01f81f1f72-2020-05-14T003137.538Z","Hereditary Cancer","","",""
"BRCA1","HGNC:1100","https://search.clinicalgenome.org/kb/genes/HGNC:1100","breast-ovarian cancer, familial, susceptibility to, 1","MONDO:0011450","https://search.clinicalgenome.org/kb/conditions/MONDO:0011450","Autosomal dominant inheritance","3 - Sufficient Evidence for Haploinsufficiency (09/23/2021)","0 - No Evidence for Haploinsufficiency (09/23/2021)","https://search.clinicalgenome.org/kb/gene-dosage/HGNC:1100","Dosage Working Group","definitive evidence (09/13/2017)","https://search.clinicalgenome.org/kb/gene-validity/CGGCIEX:assertion_9972","Breast/Ovarian Cancer","Has Insufficient Evidence for Actionability Based on Early Rule-out (09/15/2021) | Definitive Actionability (01/28/2014)","https://search.clinicalgenome.org/kb/gene-validity/https://actionability.clinicalgenome.org/ac/Pediatric/ui/stg2SummaryRpt?doc=AC133 | https://search.clinicalgenome.org/kb/gene-validity/https://actionability.clinicalgenome.org/ac/Adult/ui/stg2SummaryRpt?doc=AC133","Pediatric Actionability Working Group | Adult Actionability Working Group"
"BRCA1","HGNC:1100","https://search.clinicalgenome.org/kb/genes/HGNC:1100","hereditary breast ovarian cancer syndrome","MONDO:0003582","https://search.clinicalgenome.org/kb/conditions/MONDO:0003582","N/A","3 - Sufficient Evidence for Haploinsufficiency (09/23/2021)","0 - No Evidence for Haploinsufficiency (09/23/2021)","https://search.clinicalgenome.org/kb/gene-dosage/HGNC:1100","Dosage Working Group","","","","Has Insufficient Evidence for Actionability Based on Early Rule-out (09/15/2021) | Definitive Actionability (01/28/2014)","https://search.clinicalgenome.org/kb/gene-validity/https://actionability.clinicalgenome.org/ac/Pediatric/ui/stg2SummaryRpt?doc=AC133 | https://search.clinicalgenome.org/kb/gene-validity/https://actionability.clinicalgenome.org/ac/Adult/ui/stg2SummaryRpt?doc=AC133","Pediatric Actionability Working Group | Adult Actionability Working Group"
"BRCA2","HGNC:1101","https://search.clinicalgenome.org/kb/genes/HGNC:1101","Fanconi anemia complementation group D1","MONDO:0011584","https://search.clinicalgenome.org/kb/conditions/MONDO:0011584","Autosomal recessive inheritance","3 - Sufficient Evidence for Haploinsufficiency (07/14/2021)","0 - No Evidence for Haploinsufficiency (07/14/2021)","https://search.clinicalgenome.org/kb/gene-dosage/HGNC:1101","Dosage Working Group","definitive evidence (12/21/2018)","https://search.clinicalgenome.org/kb/gene-validity/CGGV:assertion_48faf04b-ffc4-4163-8570-22f5c29c4064-2018-12-21T151618.437Z","Hereditary Cancer","","",""
"BRCA2","HGNC:1101","https://search.clinicalgenome.org/kb/genes/HGNC:1101","breast-ovarian cancer, familial, susceptibility to, 2","MONDO:0012933","https://search.clinicalgenome.org/kb/conditions/MONDO:0012933","Autosomal dominant inheritance","3 - Sufficient Evidence for Haploinsufficiency (07/14/2021)","0 - No Evidence for Haploinsufficiency (07/14/2021)","https://search.clinicalgenome.org/kb/gene-dosage/HGNC:1101","Dosage Working Group","definitive evidence (09/13/2017)","https://search.clinicalgenome.org/kb/gene-validity/CGGCIEX:assertion_8397","Breast/Ovarian Cancer","Has Insufficient Evidence for Actionability Based on Early Rule-out (09/15/2021) | Definitive Actionability (01/28/2014)","https://search.clinicalgenome.org/kb/gene-validity/https://actionability.clinicalgenome.org/ac/Pediatric/ui/stg2SummaryRpt?doc=AC133 | https://search.clinicalgenome.org/kb/gene-validity/https://actionability.clinicalgenome.org/ac/Adult/ui/stg2SummaryRpt?doc=AC133","Pediatric Actionability Working Group | Adult Actionability Working Group"
"BRCA2","HGNC:1101","https://search.clinicalgenome.org/kb/genes/HGNC:1101","Fanconi anemia complementation group A","MONDO:0009215","https://search.clinicalgenome.org/kb/conditions/MONDO:0009215","N/A","3 - Sufficient Evidence for Haploinsufficiency (07/14/2021)","0 - No Evidence for Haploinsufficiency (07/14/2021)","https://search.clinicalgenome.org/kb/gene-dosage/HGNC:1101","Dosage Working Group","","","","Moderate Actionability (10/28/2019) | Moderate Actionability (10/28/2019)","https://search.clinicalgenome.org/kb/gene-validity/https://actionability.clinicalgenome.org/ac/Adult/ui/stg2SummaryRpt?doc=AC1008 | https://search.clinicalgenome.org/kb/gene-validity/https://actionability.clinicalgenome.org/ac/Pediatric/ui/stg2SummaryRpt?doc=AC1008","Adult Actionability Working Group | Pediatric Actionability Working Group"
"BRCA2","HGNC:1101","https://search.clinicalgenome.org/kb/genes/HGNC:1101","Fanconi anemia","MONDO:0019391","https://search.clinicalgenome.org/kb/conditions/MONDO:0019391","N/A","3 - Sufficient Evidence for Haploinsufficiency (07/14/2021)","0 - No Evidence for Haploinsufficiency (07/14/2021)","https://search.clinicalgenome.org/kb/gene-dosage/HGNC:1101","Dosage Working Group","","","","Moderate Actionability (10/28/2019) | Moderate Actionability (10/28/2019)","https://search.clinicalgenome.org/kb/gene-validity/https://actionability.clinicalgenome.org/ac/Adult/ui/stg2SummaryRpt?doc=AC1008 | https://search.clinicalgenome.org/kb/gene-validity/https://actionability.clinicalgenome.org/ac/Pediatric/ui/stg2SummaryRpt?doc=AC1008","Adult Actionability Working Group | Pediatric Actionability Working Group"
"BRCA2","HGNC:1101","https://search.clinicalgenome.org/kb/genes/HGNC:1101","hereditary breast ovarian cancer syndrome","MONDO:0003582","https://search.clinicalgenome.org/kb/conditions/MONDO:0003582","N/A","3 - Sufficient Evidence for Haploinsufficiency (07/14/2021)","0 - No Evidence for Haploinsufficiency (07/14/2021)","https://search.clinicalgenome.org/kb/gene-dosage/HGNC:1101","Dosage Working Group","","","","Has Insufficient Evidence for Actionability Based on Early Rule-out (09/15/2021) | Definitive Actionability (01/28/2014)","https://search.clinicalgenome.org/kb/gene-validity/https://actionability.clinicalgenome.org/ac/Pediatric/ui/stg2SummaryRpt?doc=AC133 | https://search.clinicalgenome.org/kb/gene-validity/https://actionability.clinicalgenome.org/ac/Adult/ui/stg2SummaryRpt?doc=AC133","Pediatric Actionability Working Group | Adult Actionability Working Group"
"BRD4","HGNC:13575","https://search.clinicalgenome.org/kb/genes/HGNC:13575","syndromic intellectual disability","MONDO:0000508","https://search.clinicalgenome.org/kb/conditions/MONDO:0000508","Autosomal dominant inheritance","","","","","definitive evidence (04/20/2022)","https://search.clinicalgenome.org/kb/gene-validity/CGGV:assertion_8b28cda3-bce6-4a8f-b359-0ab398a1111d-2022-04-20T160000.000Z","Intellectual Disability and Autism","","",""
"BRIP1","HGNC:20473","https://search.clinicalgenome.org/kb/genes/HGNC:20473","Fanconi anemia complementation group J","MONDO:0012187","https://search.clinicalgenome.org/kb/conditions/MONDO:0012187","Autosomal recessive inheritance","3 - Sufficient Evidence for Haploinsufficiency (02/15/2019)","0 - No Evidence for Haploinsufficiency (02/15/2019)","https://search.clinicalgenome.org/kb/gene-dosage/HGNC:20473","Dosage Working Group","definitive evidence (08/18/2019)","https://search.clinicalgenome.org/kb/gene-validity/CGGV:assertion_40aae4ea-8c9b-42a7-9d02-0f52a184712f-2019-08-18T160442.255Z","Hereditary Cancer","","",""
"BRIP1","HGNC:20473","https://search.clinicalgenome.org/kb/genes/HGNC:20473","hereditary breast carcinoma","MONDO:0016419","https://search.clinicalgenome.org/kb/conditions/MONDO:0016419","Autosomal dominant inheritance","3 - Sufficient Evidence for Haploinsufficiency (02/15/2019)","0 - No Evidence for Haploinsufficiency (02/15/2019)","https://search.clinicalgenome.org/kb/gene-dosage/HGNC:20473","Dosage Working Group","refuting evidence (05/10/2017)","https://search.clinicalgenome.org/kb/gene-validity/CGGCIEX:assertion_9910","Breast/Ovarian Cancer","","",""
"BRIP1","HGNC:20473","https://search.clinicalgenome.org/kb/genes/HGNC:20473","familial ovarian cancer","MONDO:0016248","https://search.clinicalgenome.org/kb/conditions/MONDO:0016248","Autosomal dominant inheritance","3 - Sufficient Evidence for Haploinsufficiency (02/15/2019)","0 - No Evidence for Haploinsufficiency (02/15/2019)","https://search.clinicalgenome.org/kb/gene-dosage/HGNC:20473","Dosage Working Group","definitive evidence (10/12/2016)","https://search.clinicalgenome.org/kb/gene-validity/CGGCIEX:assertion_9911","Breast/Ovarian Cancer","Assertion Pending (03/17/2017)","https://search.clinicalgenome.org/kb/gene-validity/https://actionability.clinicalgenome.org/ac/Adult/ui/stg2SummaryRpt?doc=AC136","Adult Actionability Working Group"
"BRIP1","HGNC:20473","https://search.clinicalgenome.org/kb/genes/HGNC:20473","Fanconi anemia complementation group G","MONDO:0013565","https://search.clinicalgenome.org/kb/conditions/MONDO:0013565","N/A","3 - Sufficient Evidence for Haploinsufficiency (02/15/2019)","0 - No Evidence for Haploinsufficiency (02/15/2019)","https://search.clinicalgenome.org/kb/gene-dosage/HGNC:20473","Dosage Working Group","","","","Moderate Actionability (10/28/2019) | Moderate Actionability (10/28/2019)","https://search.clinicalgenome.org/kb/gene-validity/https://actionability.clinicalgenome.org/ac/Adult/ui/stg2SummaryRpt?doc=AC1008 | https://search.clinicalgenome.org/kb/gene-validity/https://actionability.clinicalgenome.org/ac/Pediatric/ui/stg2SummaryRpt?doc=AC1008","Adult Actionability Working Group | Pediatric Actionability Working Group"
"BRIP1","HGNC:20473","https://search.clinicalgenome.org/kb/genes/HGNC:20473","Fanconi anemia","MONDO:0019391","https://search.clinicalgenome.org/kb/conditions/MONDO:0019391","N/A","3 - Sufficient Evidence for Haploinsufficiency (02/15/2019)","0 - No Evidence for Haploinsufficiency (02/15/2019)","https://search.clinicalgenome.org/kb/gene-dosage/HGNC:20473","Dosage Working Group","","","","Moderate Actionability (10/28/2019) | Moderate Actionability (10/28/2019)","https://search.clinicalgenome.org/kb/gene-validity/https://actionability.clinicalgenome.org/ac/Adult/ui/stg2SummaryRpt?doc=AC1008 | https://search.clinicalgenome.org/kb/gene-validity/https://actionability.clinicalgenome.org/ac/Pediatric/ui/stg2SummaryRpt?doc=AC1008","Adult Actionability Working Group | Pediatric Actionability Working Group"
"BRSK2","HGNC:11405","https://search.clinicalgenome.org/kb/genes/HGNC:11405","complex neurodevelopmental disorder","MONDO:0100038","https://search.clinicalgenome.org/kb/conditions/MONDO:0100038","Autosomal dominant inheritance","","","","","definitive evidence (02/03/2021)","https://search.clinicalgenome.org/kb/gene-validity/CGGV:assertion_327881a5-52fd-42bd-a500-c94514a7aed3-2021-02-03T170000.000Z","Intellectual Disability and Autism","","",""
"BRWD3","HGNC:17342","https://search.clinicalgenome.org/kb/genes/HGNC:17342","X-linked syndromic intellectual disability","MONDO:0020119","https://search.clinicalgenome.org/kb/conditions/MONDO:0020119","X-linked inheritance","3 - Sufficient Evidence for Haploinsufficiency (08/24/2022)","0 - No Evidence for Haploinsufficiency (08/24/2022)","https://search.clinicalgenome.org/kb/gene-dosage/HGNC:17342","Dosage Working Group","definitive evidence (09/20/2018)","https://search.clinicalgenome.org/kb/gene-validity/CGGV:assertion_b8a924e2-e76b-4363-bf38-d95fd53d6141-2018-09-20T192312.767Z","Intellectual Disability and Autism","","",""
"BRWD3","HGNC:17342","https://search.clinicalgenome.org/kb/genes/HGNC:17342","X-linked intellectual disability","MONDO:0100284","https://search.clinicalgenome.org/kb/conditions/MONDO:0100284","N/A","3 - Sufficient Evidence for Haploinsufficiency (08/24/2022)","0 - No Evidence for Haploinsufficiency (08/24/2022)","https://search.clinicalgenome.org/kb/gene-dosage/HGNC:17342","Dosage Working Group","","","","","",""
"BSCL2","HGNC:15832","https://search.clinicalgenome.org/kb/genes/HGNC:15832","distal hereditary motor neuropathy","MONDO:0018894","https://search.clinicalgenome.org/kb/conditions/MONDO:0018894","Autosomal dominant inheritance","","","","","definitive evidence (09/23/2021)","https://search.clinicalgenome.org/kb/gene-validity/CGGV:assertion_02472719-c26d-40ff-8ad4-897ef7a6800a-2021-09-23T001322.660Z","Charcot-Marie-Tooth","","",""
"BSND","HGNC:16512","https://search.clinicalgenome.org/kb/genes/HGNC:16512","Bartter disease type 4a","MONDO:0011242","https://search.clinicalgenome.org/kb/conditions/MONDO:0011242","Autosomal recessive inheritance","30 - Gene Associated with Autosomal Recessive Phenotype (05/17/2012)","0 - No Evidence for Haploinsufficiency (05/17/2012)","https://search.clinicalgenome.org/kb/gene-dosage/HGNC:16512","Dosage Working Group","definitive evidence (07/12/2018)","https://search.clinicalgenome.org/kb/gene-validity/CGGV:assertion_9b69acb1-93bc-4bc0-8a33-77bf64179c32-2018-07-12T205243.945Z","Hearing Loss","","",""
"BTD","HGNC:1122","https://search.clinicalgenome.org/kb/genes/HGNC:1122","biotinidase deficiency","MONDO:0009665","https://search.clinicalgenome.org/kb/conditions/MONDO:0009665","Autosomal recessive inheritance","30 - Gene Associated with Autosomal Recessive Phenotype (05/21/2015)","0 - No Evidence for Haploinsufficiency (05/21/2015)","https://search.clinicalgenome.org/kb/gene-dosage/HGNC:1122","Dosage Working Group","definitive evidence (02/10/2020)","https://search.clinicalgenome.org/kb/gene-validity/CGGV:assertion_847f7f2b-575f-4a90-bf02-179d464e4841-2020-02-10T180000.000Z","Hearing Loss","Assertion Pending (04/04/2016)","https://search.clinicalgenome.org/kb/gene-validity/https://actionability.clinicalgenome.org/ac/Adult/ui/stg2SummaryRpt?doc=AC098","Adult Actionability Working Group"
"BTD","HGNC:1122","https://search.clinicalgenome.org/kb/genes/HGNC:1122","Leigh syndrome","MONDO:0009723","https://search.clinicalgenome.org/kb/conditions/MONDO:0009723","Autosomal recessive inheritance","30 - Gene Associated with Autosomal Recessive Phenotype (05/21/2015)","0 - No Evidence for Haploinsufficiency (05/21/2015)","https://search.clinicalgenome.org/kb/gene-dosage/HGNC:1122","Dosage Working Group","moderate evidence (06/14/2021)","https://search.clinicalgenome.org/kb/gene-validity/CGGV:assertion_74599afe-02f9-4225-9e50-63306f04a552-2021-06-14T140327.018Z","Mitochondrial Diseases","","",""
"BTK","HGNC:1133","https://search.clinicalgenome.org/kb/genes/HGNC:1133","isolated growth hormone deficiency type III","MONDO:0010615","https://search.clinicalgenome.org/kb/conditions/MONDO:0010615","X-linked inheritance","3 - Sufficient Evidence for Haploinsufficiency (03/24/2021)","0 - No Evidence for Haploinsufficiency (03/24/2021)","https://search.clinicalgenome.org/kb/gene-dosage/HGNC:1133","Dosage Working Group","disputing (11/17/2020)","https://search.clinicalgenome.org/kb/gene-validity/CGGV:assertion_6341781b-9ba9-41b1-889a-8d65a9b3ebb7-2020-11-17T170000.000Z","Antibody Deficiencies GCEP","","",""
"BTK","HGNC:1133","https://search.clinicalgenome.org/kb/genes/HGNC:1133","Bruton-type agammaglobulinemia","MONDO:0010421","https://search.clinicalgenome.org/kb/conditions/MONDO:0010421","X-linked inheritance","3 - Sufficient Evidence for Haploinsufficiency (03/24/2021)","0 - No Evidence for Haploinsufficiency (03/24/2021)","https://search.clinicalgenome.org/kb/gene-dosage/HGNC:1133","Dosage Working Group","definitive evidence (10/20/2020)","https://search.clinicalgenome.org/kb/gene-validity/CGGV:assertion_8dc4d594-2103-46ad-a786-f4bda9b95995-2020-10-20T160000.000Z","Antibody Deficiencies GCEP","","",""
"BUB1B","HGNC:1149","https://search.clinicalgenome.org/kb/genes/HGNC:1149","mosaic variegated aneuploidy syndrome 1","MONDO:0009759","https://search.clinicalgenome.org/kb/conditions/MONDO:0009759","Autosomal recessive inheritance","30 - Gene Associated with Autosomal Recessive Phenotype (02/02/2022)","0 - No Evidence for Haploinsufficiency (02/02/2022)","https://search.clinicalgenome.org/kb/gene-dosage/HGNC:1149","Dosage Working Group","definitive evidence (11/22/2019)","https://search.clinicalgenome.org/kb/gene-validity/CGGV:assertion_59147f27-d5a3-4760-ba8d-0429bae3c906-2019-11-22T145326.352Z","Hereditary Cancer","","",""
"C19orf12","HGNC:25443","https://search.clinicalgenome.org/kb/genes/HGNC:25443","neurodegeneration with brain iron accumulation 4","MONDO:0013674","https://search.clinicalgenome.org/kb/conditions/MONDO:0013674","N/A","30 - Gene Associated with Autosomal Recessive Phenotype (08/22/2016)","0 - No Evidence for Haploinsufficiency (08/22/2016)","https://search.clinicalgenome.org/kb/gene-dosage/HGNC:25443","Dosage Working Group","","","","","",""
"C1QB","HGNC:1242","https://search.clinicalgenome.org/kb/genes/HGNC:1242","C1Q deficiency","MONDO:0013343","https://search.clinicalgenome.org/kb/conditions/MONDO:0013343","Autosomal recessive inheritance","30 - Gene Associated with Autosomal Recessive Phenotype (01/17/2017)","0 - No Evidence for Haploinsufficiency (01/17/2017)","https://search.clinicalgenome.org/kb/gene-dosage/HGNC:1242","Dosage Working Group","definitive evidence (01/09/2017)","https://search.clinicalgenome.org/kb/gene-validity/CGGCIEX:assertion_3216","General Gene Curation","","",""
"C9orf72","HGNC:28337","https://search.clinicalgenome.org/kb/genes/HGNC:28337","frontotemporal dementia and/or amyotrophic lateral sclerosis 1","MONDO:0007105","https://search.clinicalgenome.org/kb/conditions/MONDO:0007105","Autosomal dominant inheritance","","","","","definitive evidence (09/21/2021)","https://search.clinicalgenome.org/kb/gene-validity/CGGV:assertion_afd5a267-72c8-4a04-8404-4c819efe61c5-2021-09-21T030209.665Z","Amyotrophic Lateral Sclerosis Spectrum Disorders","","",""
"CA12","HGNC:1371","https://search.clinicalgenome.org/kb/genes/HGNC:1371","isolated hyperchlorhidrosis","MONDO:0007747","https://search.clinicalgenome.org/kb/conditions/MONDO:0007747","N/A","30 - Gene Associated with Autosomal Recessive Phenotype (08/22/2016)","","https://search.clinicalgenome.org/kb/gene-dosage/HGNC:1371","Dosage Working Group","","","","","",""
"CA5A","HGNC:1377","https://search.clinicalgenome.org/kb/genes/HGNC:1377","hyperammonemic encephalopathy due to carbonic anhydrase VA deficiency","MONDO:0014332","https://search.clinicalgenome.org/kb/conditions/MONDO:0014332","Autosomal recessive inheritance","30 - Gene Associated with Autosomal Recessive Phenotype (08/22/2016)","0 - No Evidence for Haploinsufficiency (08/22/2016)","https://search.clinicalgenome.org/kb/gene-dosage/HGNC:1377","Dosage Working Group","definitive evidence (09/10/2018)","https://search.clinicalgenome.org/kb/gene-validity/CGGV:assertion_f7c5731a-866e-4a96-abb0-f0747f89280b-2018-09-10T160000.000Z","Aminoacidopathy","","",""
"CA8","HGNC:1382","https://search.clinicalgenome.org/kb/genes/HGNC:1382","cerebellar ataxia, intellectual disability, and dysequilibrium syndrome 3","MONDO:0013188","https://search.clinicalgenome.org/kb/conditions/MONDO:0013188","N/A","30 - Gene Associated with Autosomal Recessive Phenotype (08/22/2016)","0 - No Evidence for Haploinsufficiency (08/22/2016)","https://search.clinicalgenome.org/kb/gene-dosage/HGNC:1382","Dosage Working Group","","","","","",""
"CABP2","HGNC:1385","https://search.clinicalgenome.org/kb/genes/HGNC:1385","nonsyndromic genetic hearing loss","MONDO:0019497","https://search.clinicalgenome.org/kb/conditions/MONDO:0019497","Autosomal recessive inheritance","30 - Gene Associated with Autosomal Recessive Phenotype (08/20/2021)","0 - No Evidence for Haploinsufficiency (08/20/2021)","https://search.clinicalgenome.org/kb/gene-dosage/HGNC:1385","Dosage Working Group","definitive evidence (02/06/2020)","https://search.clinicalgenome.org/kb/gene-validity/CGGV:assertion_20de88d2-6681-4522-9e11-26cdf66a2c15-2020-02-06T170000.000Z","Hearing Loss","Strong Actionability (10/29/2020)","https://search.clinicalgenome.org/kb/gene-validity/https://actionability.clinicalgenome.org/ac/Pediatric/ui/stg2SummaryRpt?doc=AC1018","Pediatric Actionability Working Group"
"CABP2","HGNC:1385","https://search.clinicalgenome.org/kb/genes/HGNC:1385","autosomal recessive nonsyndromic hearing loss 93","MONDO:0013963","https://search.clinicalgenome.org/kb/conditions/MONDO:0013963","N/A","30 - Gene Associated with Autosomal Recessive Phenotype (08/20/2021)","0 - No Evidence for Haploinsufficiency (08/20/2021)","https://search.clinicalgenome.org/kb/gene-dosage/HGNC:1385","Dosage Working Group","","","","Strong Actionability (10/29/2020)","https://search.clinicalgenome.org/kb/gene-validity/https://actionability.clinicalgenome.org/ac/Pediatric/ui/stg2SummaryRpt?doc=AC1018","Pediatric Actionability Working Group"
"CABP2","HGNC:1385","https://search.clinicalgenome.org/kb/genes/HGNC:1385","hearing loss, autosomal recessive","MONDO:0019588","https://search.clinicalgenome.org/kb/conditions/MONDO:0019588","N/A","30 - Gene Associated with Autosomal Recessive Phenotype (08/20/2021)","0 - No Evidence for Haploinsufficiency (08/20/2021)","https://search.clinicalgenome.org/kb/gene-dosage/HGNC:1385","Dosage Working Group","","","","Strong Actionability (10/29/2020)","https://search.clinicalgenome.org/kb/gene-validity/https://actionability.clinicalgenome.org/ac/Pediatric/ui/stg2SummaryRpt?doc=AC1018","Pediatric Actionability Working Group"
"CABP2","HGNC:1385","https://search.clinicalgenome.org/kb/genes/HGNC:1385","prelingual non-syndromic genetic hearing loss","MONDO:0016297","https://search.clinicalgenome.org/kb/conditions/MONDO:0016297","N/A","30 - Gene Associated with Autosomal Recessive Phenotype (08/20/2021)","0 - No Evidence for Haploinsufficiency (08/20/2021)","https://search.clinicalgenome.org/kb/gene-dosage/HGNC:1385","Dosage Working Group","","","","Strong Actionability (10/29/2020)","https://search.clinicalgenome.org/kb/gene-validity/https://actionability.clinicalgenome.org/ac/Pediatric/ui/stg2SummaryRpt?doc=AC1018","Pediatric Actionability Working Group"
"CABP4","HGNC:1386","https://search.clinicalgenome.org/kb/genes/HGNC:1386","cone-rod synaptic disorder, congenital nonprogressive","MONDO:0012490","https://search.clinicalgenome.org/kb/conditions/MONDO:0012490","N/A","30 - Gene Associated with Autosomal Recessive Phenotype (08/22/2016)","0 - No Evidence for Haploinsufficiency (08/22/2016)","https://search.clinicalgenome.org/kb/gene-dosage/HGNC:1386","Dosage Working Group","","","","","",""
"CACNA1A","HGNC:1388","https://search.clinicalgenome.org/kb/genes/HGNC:1388","episodic ataxia type 2","MONDO:0007163","https://search.clinicalgenome.org/kb/conditions/MONDO:0007163","N/A","3 - Sufficient Evidence for Haploinsufficiency (05/21/2017)","0 - No Evidence for Haploinsufficiency (05/21/2017)","https://search.clinicalgenome.org/kb/gene-dosage/HGNC:1388","Dosage Working Group","","","","","",""
"CACNA1C","HGNC:1390","https://search.clinicalgenome.org/kb/genes/HGNC:1390","long QT syndrome","MONDO:0002442","https://search.clinicalgenome.org/kb/conditions/MONDO:0002442","Autosomal dominant inheritance","1 - Little Evidence for Haploinsufficiency (03/24/2016)","0 - No Evidence for Haploinsufficiency (03/24/2016)","https://search.clinicalgenome.org/kb/gene-dosage/HGNC:1390","Dosage Working Group","moderate evidence (04/24/2020)","https://search.clinicalgenome.org/kb/gene-validity/CGGV:assertion_c496551d-c7a7-4e49-ad41-8cfd49840dc1-2020-04-24T160000.000Z","Long QT Syndrome","","",""
"CACNA1C","HGNC:1390","https://search.clinicalgenome.org/kb/genes/HGNC:1390","Brugada syndrome","MONDO:0015263","https://search.clinicalgenome.org/kb/conditions/MONDO:0015263","Autosomal dominant inheritance","1 - Little Evidence for Haploinsufficiency (03/24/2016)","0 - No Evidence for Haploinsufficiency (03/24/2016)","https://search.clinicalgenome.org/kb/gene-dosage/HGNC:1390","Dosage Working Group","disputing (11/21/2017)","https://search.clinicalgenome.org/kb/gene-validity/CGGCIEX:assertion_10146","Brugada Syndrome","","",""
"CACNA1C","HGNC:1390","https://search.clinicalgenome.org/kb/genes/HGNC:1390","short QT syndrome","MONDO:0000453","https://search.clinicalgenome.org/kb/conditions/MONDO:0000453","Autosomal dominant inheritance","1 - Little Evidence for Haploinsufficiency (03/24/2016)","0 - No Evidence for Haploinsufficiency (03/24/2016)","https://search.clinicalgenome.org/kb/gene-dosage/HGNC:1390","Dosage Working Group","disputing (08/03/2020)","https://search.clinicalgenome.org/kb/gene-validity/CGGV:assertion_51dae85e-8745-48c1-8fb9-cabc2501d3fb-2020-08-03T160000.000Z","Short QT Syndrome","","",""
"CACNA1D","HGNC:1391","https://search.clinicalgenome.org/kb/genes/HGNC:1391","sinoatrial node dysfunction and deafness","MONDO:0013960","https://search.clinicalgenome.org/kb/conditions/MONDO:0013960","Autosomal recessive inheritance","","","","","moderate evidence (05/01/2018)","https://search.clinicalgenome.org/kb/gene-validity/CGGV:assertion_8249f2c1-ff59-4ea2-8e7e-11256c73433e-2018-05-01T160000.000Z","Hearing Loss","","",""
"CACNA1H","HGNC:1395","https://search.clinicalgenome.org/kb/genes/HGNC:1395","epilepsy","MONDO:0005027","https://search.clinicalgenome.org/kb/conditions/MONDO:0005027","Autosomal dominant inheritance","","","","","disputing (07/30/2018)","https://search.clinicalgenome.org/kb/gene-validity/CGGV:assertion_c3208279-a38d-4b38-b4f9-3af2610c4936-2018-07-30T040000.000Z","Epilepsy","","",""
"CACNA1S","HGNC:1397","https://search.clinicalgenome.org/kb/genes/HGNC:1397","malignant hyperthermia of anesthesia","MONDO:0018493","https://search.clinicalgenome.org/kb/conditions/MONDO:0018493","N/A","0 - No Evidence for Haploinsufficiency (01/18/2016)","0 - No Evidence for Haploinsufficiency (01/18/2016)","https://search.clinicalgenome.org/kb/gene-dosage/HGNC:1397","Dosage Working Group","","","","Strong Actionability (01/12/2021) | Strong Actionability (01/12/2021)","https://search.clinicalgenome.org/kb/gene-validity/https://actionability.clinicalgenome.org/ac/Adult/ui/stg2SummaryRpt?doc=AC076 | https://search.clinicalgenome.org/kb/gene-validity/https://actionability.clinicalgenome.org/ac/Pediatric/ui/stg2SummaryRpt?doc=AC076","Adult Actionability Working Group | Pediatric Actionability Working Group"
"CACNA1S","HGNC:1397","https://search.clinicalgenome.org/kb/genes/HGNC:1397","malignant hyperthermia, susceptibility to, 5","MONDO:0011163","https://search.clinicalgenome.org/kb/conditions/MONDO:0011163","N/A","0 - No Evidence for Haploinsufficiency (01/18/2016)","0 - No Evidence for Haploinsufficiency (01/18/2016)","https://search.clinicalgenome.org/kb/gene-dosage/HGNC:1397","Dosage Working Group","","","","Strong Actionability (01/12/2021) | Strong Actionability (01/12/2021)","https://search.clinicalgenome.org/kb/gene-validity/https://actionability.clinicalgenome.org/ac/Adult/ui/stg2SummaryRpt?doc=AC076 | https://search.clinicalgenome.org/kb/gene-validity/https://actionability.clinicalgenome.org/ac/Pediatric/ui/stg2SummaryRpt?doc=AC076","Adult Actionability Working Group | Pediatric Actionability Working Group"
"CACNA2D1","HGNC:1399","https://search.clinicalgenome.org/kb/genes/HGNC:1399","Brugada syndrome 1","MONDO:0011001","https://search.clinicalgenome.org/kb/conditions/MONDO:0011001","Autosomal dominant inheritance","","","","","disputing (11/21/2017)","https://search.clinicalgenome.org/kb/gene-validity/CGGCIEX:assertion_10147","Brugada Syndrome","","",""
"CACNA2D1","HGNC:1399","https://search.clinicalgenome.org/kb/genes/HGNC:1399","short QT syndrome","MONDO:0000453","https://search.clinicalgenome.org/kb/conditions/MONDO:0000453","Autosomal dominant inheritance","","","","","disputing (09/05/2020)","https://search.clinicalgenome.org/kb/gene-validity/CGGV:assertion_896733cc-c686-4279-affb-e1860fd10ca2-2020-09-05T160000.000Z","Short QT Syndrome","","",""
"CACNB2","HGNC:1402","https://search.clinicalgenome.org/kb/genes/HGNC:1402","hypertrophic cardiomyopathy","MONDO:0005045","https://search.clinicalgenome.org/kb/conditions/MONDO:0005045","Autosomal dominant inheritance","","","","","disputing (04/13/2022)","https://search.clinicalgenome.org/kb/gene-validity/CGGV:assertion_e7a08ba4-6024-449c-b824-c762a85277a1-2022-04-13T160000.000Z","Hereditary Cardiovascular Disease","","",""
"CACNB2","HGNC:1402","https://search.clinicalgenome.org/kb/genes/HGNC:1402","Brugada syndrome 1","MONDO:0011001","https://search.clinicalgenome.org/kb/conditions/MONDO:0011001","Autosomal dominant inheritance","","","","","disputing (11/21/2017)","https://search.clinicalgenome.org/kb/gene-validity/CGGCIEX:assertion_10148","Brugada Syndrome","","",""
"CACNB2","HGNC:1402","https://search.clinicalgenome.org/kb/genes/HGNC:1402","short QT syndrome","MONDO:0000453","https://search.clinicalgenome.org/kb/conditions/MONDO:0000453","Autosomal dominant inheritance","","","","","disputing (08/03/2020)","https://search.clinicalgenome.org/kb/gene-validity/CGGV:assertion_eaa3adbb-5e58-4e9a-a142-76c93c65b917-2020-08-03T160000.000Z","Short QT Syndrome","","",""
"CACNB4","HGNC:1404","https://search.clinicalgenome.org/kb/genes/HGNC:1404","epilepsy","MONDO:0005027","https://search.clinicalgenome.org/kb/conditions/MONDO:0005027","Autosomal dominant inheritance","","","","","refuting evidence (07/05/2022)","https://search.clinicalgenome.org/kb/gene-validity/CGGV:assertion_d2fad131-8e91-4874-9394-8b86d6d62abb-2022-07-05T160000.000Z","Epilepsy","","",""
"CACNG2","HGNC:1406","https://search.clinicalgenome.org/kb/genes/HGNC:1406","complex neurodevelopmental disorder","MONDO:0100038","https://search.clinicalgenome.org/kb/conditions/MONDO:0100038","Autosomal dominant inheritance","","","","","limited evidence (07/29/2021)","https://search.clinicalgenome.org/kb/gene-validity/CGGV:assertion_a61ad78f-0f37-4221-82f4-710275033666-2021-07-29T210333.496Z","Intellectual Disability and Autism","","",""
"CALM1","HGNC:1442","https://search.clinicalgenome.org/kb/genes/HGNC:1442","long QT syndrome","MONDO:0002442","https://search.clinicalgenome.org/kb/conditions/MONDO:0002442","Autosomal dominant inheritance","","","","","definitive evidence (09/25/2018)","https://search.clinicalgenome.org/kb/gene-validity/CGGV:assertion_4a150cd9-e16b-4992-8cc7-5ccec44b4d6b-2018-09-25T160000.000Z","Long QT Syndrome","","",""
"CALM1","HGNC:1442","https://search.clinicalgenome.org/kb/genes/HGNC:1442","catecholaminergic polymorphic ventricular tachycardia","MONDO:0017990","https://search.clinicalgenome.org/kb/conditions/MONDO:0017990","Autosomal dominant inheritance","","","","","moderate evidence (06/17/2021)","https://search.clinicalgenome.org/kb/gene-validity/CGGV:assertion_1ca1d8df-10fa-48ef-aea4-fb4dc6564dd0-2021-06-17T160000.000Z","Catecholaminergic Polymorphic Ventricular Tachycardia","Moderate Actionability (03/11/2021) | Strong Actionability (03/11/2021)","https://search.clinicalgenome.org/kb/gene-validity/https://actionability.clinicalgenome.org/ac/Adult/ui/stg2SummaryRpt?doc=AC042 | https://search.clinicalgenome.org/kb/gene-validity/https://actionability.clinicalgenome.org/ac/Pediatric/ui/stg2SummaryRpt?doc=AC042","Adult Actionability Working Group | Pediatric Actionability Working Group"
"CALM1","HGNC:1442","https://search.clinicalgenome.org/kb/genes/HGNC:1442","catecholaminergic polymorphic ventricular tachycardia 4","MONDO:0013966","https://search.clinicalgenome.org/kb/conditions/MONDO:0013966","N/A","","","","","","","","Moderate Actionability (03/11/2021) | Strong Actionability (03/11/2021)","https://search.clinicalgenome.org/kb/gene-validity/https://actionability.clinicalgenome.org/ac/Adult/ui/stg2SummaryRpt?doc=AC042 | https://search.clinicalgenome.org/kb/gene-validity/https://actionability.clinicalgenome.org/ac/Pediatric/ui/stg2SummaryRpt?doc=AC042","Adult Actionability Working Group | Pediatric Actionability Working Group"
"CALM2","HGNC:1445","https://search.clinicalgenome.org/kb/genes/HGNC:1445","long QT syndrome","MONDO:0002442","https://search.clinicalgenome.org/kb/conditions/MONDO:0002442","Autosomal dominant inheritance","","","","","definitive evidence (09/25/2018)","https://search.clinicalgenome.org/kb/gene-validity/CGGV:assertion_86e4b783-3b60-4a1d-ab34-e61d27751ca6-2018-09-25T160000.000Z","Long QT Syndrome","","",""
"CALM2","HGNC:1445","https://search.clinicalgenome.org/kb/genes/HGNC:1445","catecholaminergic polymorphic ventricular tachycardia","MONDO:0017990","https://search.clinicalgenome.org/kb/conditions/MONDO:0017990","Autosomal dominant inheritance","","","","","moderate evidence (06/17/2021)","https://search.clinicalgenome.org/kb/gene-validity/CGGV:assertion_42d280da-accc-46f2-8832-47d5a3eeeba7-2021-06-17T160000.000Z","Catecholaminergic Polymorphic Ventricular Tachycardia","Moderate Actionability (03/11/2021) | Strong Actionability (03/11/2021)","https://search.clinicalgenome.org/kb/gene-validity/https://actionability.clinicalgenome.org/ac/Adult/ui/stg2SummaryRpt?doc=AC042 | https://search.clinicalgenome.org/kb/gene-validity/https://actionability.clinicalgenome.org/ac/Pediatric/ui/stg2SummaryRpt?doc=AC042","Adult Actionability Working Group | Pediatric Actionability Working Group"
"CALM3","HGNC:1449","https://search.clinicalgenome.org/kb/genes/HGNC:1449","long QT syndrome","MONDO:0002442","https://search.clinicalgenome.org/kb/conditions/MONDO:0002442","Autosomal dominant inheritance","","","","","definitive evidence (09/25/2018)","https://search.clinicalgenome.org/kb/gene-validity/CGGV:assertion_3cc2a1ae-5f3d-445c-b124-f3d38fdd070a-2018-09-25T160000.000Z","Long QT Syndrome","","",""
"CALM3","HGNC:1449","https://search.clinicalgenome.org/kb/genes/HGNC:1449","catecholaminergic polymorphic ventricular tachycardia","MONDO:0017990","https://search.clinicalgenome.org/kb/conditions/MONDO:0017990","Autosomal dominant inheritance","","","","","moderate evidence (06/17/2021)","https://search.clinicalgenome.org/kb/gene-validity/CGGV:assertion_1b7fc965-a109-4448-94a0-00a9b078b484-2021-06-17T160000.000Z","Catecholaminergic Polymorphic Ventricular Tachycardia","Moderate Actionability (03/11/2021) | Strong Actionability (03/11/2021)","https://search.clinicalgenome.org/kb/gene-validity/https://actionability.clinicalgenome.org/ac/Adult/ui/stg2SummaryRpt?doc=AC042 | https://search.clinicalgenome.org/kb/gene-validity/https://actionability.clinicalgenome.org/ac/Pediatric/ui/stg2SummaryRpt?doc=AC042","Adult Actionability Working Group | Pediatric Actionability Working Group"
"CALM3","HGNC:1449","https://search.clinicalgenome.org/kb/genes/HGNC:1449","long QT syndrome 16","MONDO:0032915","https://search.clinicalgenome.org/kb/conditions/MONDO:0032915","N/A","","","","","","","","Moderate Actionability (03/11/2021) | Strong Actionability (03/11/2021)","https://search.clinicalgenome.org/kb/gene-validity/https://actionability.clinicalgenome.org/ac/Adult/ui/stg2SummaryRpt?doc=AC042 | https://search.clinicalgenome.org/kb/gene-validity/https://actionability.clinicalgenome.org/ac/Pediatric/ui/stg2SummaryRpt?doc=AC042","Adult Actionability Working Group | Pediatric Actionability Working Group"
"CALR3","HGNC:20407","https://search.clinicalgenome.org/kb/genes/HGNC:20407","hypertrophic cardiomyopathy","MONDO:0005045","https://search.clinicalgenome.org/kb/conditions/MONDO:0005045","Autosomal dominant inheritance","","","","","limited evidence (08/06/2018)","https://search.clinicalgenome.org/kb/gene-validity/CGGV:assertion_fd8036e5-bf01-4b89-b4fc-94080d835d99-2018-08-06T131427.771Z","Hypertrophic Cardiomyopathy","","",""
"CAMK2A","HGNC:1460","https://search.clinicalgenome.org/kb/genes/HGNC:1460","intellectual disability, autosomal dominant 53","MONDO:0030919","https://search.clinicalgenome.org/kb/conditions/MONDO:0030919","N/A","1 - Little Evidence for Haploinsufficiency (09/04/2019)","0 - No Evidence for Haploinsufficiency (09/04/2019)","https://search.clinicalgenome.org/kb/gene-dosage/HGNC:1460","Dosage Working Group","","","","","",""
"CAMK2B","HGNC:1461","https://search.clinicalgenome.org/kb/genes/HGNC:1461","intellectual disability, autosomal dominant 54","MONDO:0030920","https://search.clinicalgenome.org/kb/conditions/MONDO:0030920","N/A","2 - Emerging Evidence for Haploinsufficiency (06/28/2018)","0 - No Evidence for Haploinsufficiency (06/28/2018)","https://search.clinicalgenome.org/kb/gene-dosage/HGNC:1461","Dosage Working Group","","","","","",""
"CAMK2G","HGNC:1463","https://search.clinicalgenome.org/kb/genes/HGNC:1463","intellectual developmental disorder 59","MONDO:0032795","https://search.clinicalgenome.org/kb/conditions/MONDO:0032795","Autosomal dominant inheritance","","","","","limited evidence (07/30/2021)","https://search.clinicalgenome.org/kb/gene-validity/CGGV:assertion_525f1ddb-a662-4baf-b877-45fc26e07b71-2021-07-30T130229.547Z","Syndromic Disorders","","",""
"CAMTA1","HGNC:18806","https://search.clinicalgenome.org/kb/genes/HGNC:18806","nonprogressive cerebellar atxia with intellectual disability","MONDO:0013886","https://search.clinicalgenome.org/kb/conditions/MONDO:0013886","N/A","3 - Sufficient Evidence for Haploinsufficiency (12/14/2017)","0 - No Evidence for Haploinsufficiency (12/14/2017)","https://search.clinicalgenome.org/kb/gene-dosage/HGNC:18806","Dosage Working Group","","","","","",""
"CANT1","HGNC:19721","https://search.clinicalgenome.org/kb/genes/HGNC:19721","Desbuquois dysplasia 1","MONDO:0009629","https://search.clinicalgenome.org/kb/conditions/MONDO:0009629","N/A","30 - Gene Associated with Autosomal Recessive Phenotype (08/22/2016)","","https://search.clinicalgenome.org/kb/gene-dosage/HGNC:19721","Dosage Working Group","","","","","",""
"CAPN3","HGNC:1480","https://search.clinicalgenome.org/kb/genes/HGNC:1480","limb-girdle muscular dystrophy","MONDO:0016971","https://search.clinicalgenome.org/kb/conditions/MONDO:0016971","Semidominant inheritance","30 - Gene Associated with Autosomal Recessive Phenotype (08/22/2016)","0 - No Evidence for Haploinsufficiency (08/22/2016)","https://search.clinicalgenome.org/kb/gene-dosage/HGNC:1480","Dosage Working Group","definitive evidence (06/15/2021)","https://search.clinicalgenome.org/kb/gene-validity/CGGV:assertion_6f7dbd92-77a0-4fe7-9308-98ce7f4cc383-2021-06-15T185919.142Z","Limb Girdle Muscular Dystrophy","","",""
"CAPN3","HGNC:1480","https://search.clinicalgenome.org/kb/genes/HGNC:1480","autosomal recessive limb-girdle muscular dystrophy type 2A","MONDO:0009675","https://search.clinicalgenome.org/kb/conditions/MONDO:0009675","N/A","30 - Gene Associated with Autosomal Recessive Phenotype (08/22/2016)","0 - No Evidence for Haploinsufficiency (08/22/2016)","https://search.clinicalgenome.org/kb/gene-dosage/HGNC:1480","Dosage Working Group","","","","","",""
"CAPN5","HGNC:1482","https://search.clinicalgenome.org/kb/genes/HGNC:1482","CAPN5-related vitreoretinopathy","MONDO:0100450","https://search.clinicalgenome.org/kb/conditions/MONDO:0100450","Autosomal dominant inheritance","","","","","definitive evidence (08/05/2021)","https://search.clinicalgenome.org/kb/gene-validity/CGGV:assertion_7d39e430-b1fc-43f1-957b-1c02eb66a69c-2021-08-05T160000.000Z","Retina","","",""
"CARD11","HGNC:16393","https://search.clinicalgenome.org/kb/genes/HGNC:16393","immunodeficiency 11b with atopic dermatitis","MONDO:0054697","https://search.clinicalgenome.org/kb/conditions/MONDO:0054697","Autosomal dominant inheritance","","","","","definitive evidence (03/15/2022)","https://search.clinicalgenome.org/kb/gene-validity/CGGV:assertion_603e8c98-82b7-41b5-8174-1fdbfc724a7d-2022-03-15T131220.080Z","Antibody Deficiencies GCEP","","",""
"CARD11","HGNC:16393","https://search.clinicalgenome.org/kb/genes/HGNC:16393","BENTA disease","MONDO:0014645","https://search.clinicalgenome.org/kb/conditions/MONDO:0014645","Autosomal dominant inheritance","","","","","definitive evidence (03/15/2022)","https://search.clinicalgenome.org/kb/gene-validity/CGGV:assertion_23dd1a19-585b-46bb-9241-682b200bfd7d-2022-03-15T131318.170Z","Antibody Deficiencies GCEP","","",""
"CARD11","HGNC:16393","https://search.clinicalgenome.org/kb/genes/HGNC:16393","severe combined immunodeficiency due to CARD11 deficiency","MONDO:0014081","https://search.clinicalgenome.org/kb/conditions/MONDO:0014081","Autosomal recessive inheritance","","","","","definitive evidence (03/15/2022)","https://search.clinicalgenome.org/kb/gene-validity/CGGV:assertion_3ce06b6f-cf7f-43f3-bf9c-5d3978f1db61-2022-03-15T131409.712Z","Antibody Deficiencies GCEP","","",""
"CASK","HGNC:1497","https://search.clinicalgenome.org/kb/genes/HGNC:1497","X-linked syndromic intellectual disability","MONDO:0020119","https://search.clinicalgenome.org/kb/conditions/MONDO:0020119","X-linked inheritance","3 - Sufficient Evidence for Haploinsufficiency (06/28/2012)","0 - No Evidence for Haploinsufficiency (06/28/2012)","https://search.clinicalgenome.org/kb/gene-dosage/HGNC:1497","Dosage Working Group","definitive evidence (07/09/2019)","https://search.clinicalgenome.org/kb/gene-validity/CGGV:assertion_ca0e703c-3fe1-44a1-8632-036554b2f158-2019-07-09T160000.000Z","Intellectual Disability and Autism","","",""
"CASK","HGNC:1497","https://search.clinicalgenome.org/kb/genes/HGNC:1497","syndromic X-linked intellectual disability Najm type","MONDO:0010417","https://search.clinicalgenome.org/kb/conditions/MONDO:0010417","N/A","3 - Sufficient Evidence for Haploinsufficiency (06/28/2012)","0 - No Evidence for Haploinsufficiency (06/28/2012)","https://search.clinicalgenome.org/kb/gene-dosage/HGNC:1497","Dosage Working Group","","","","","",""
"CASQ2","HGNC:1513","https://search.clinicalgenome.org/kb/genes/HGNC:1513","hypertrophic cardiomyopathy","MONDO:0005045","https://search.clinicalgenome.org/kb/conditions/MONDO:0005045","Autosomal dominant inheritance","30 - Gene Associated with Autosomal Recessive Phenotype (08/22/2016)","","https://search.clinicalgenome.org/kb/gene-dosage/HGNC:1513","Dosage Working Group","disputing (05/10/2022)","https://search.clinicalgenome.org/kb/gene-validity/CGGV:assertion_07177c89-7845-4df5-ba3e-bdd415b5c8b3-2022-05-10T160518.214Z","Hereditary Cardiovascular Disease","","",""
"CASQ2","HGNC:1513","https://search.clinicalgenome.org/kb/genes/HGNC:1513","catecholaminergic polymorphic ventricular tachycardia","MONDO:0017990","https://search.clinicalgenome.org/kb/conditions/MONDO:0017990","Autosomal recessive inheritance | Autosomal dominant inheritance","30 - Gene Associated with Autosomal Recessive Phenotype (08/22/2016)","","https://search.clinicalgenome.org/kb/gene-dosage/HGNC:1513","Dosage Working Group","definitive evidence (01/20/2021) | moderate evidence (01/20/2021)","https://search.clinicalgenome.org/kb/gene-validity/CGGV:assertion_991ee32e-280d-4bea-a638-aa1b6fa6f781-2021-01-20T170000.000Z | https://search.clinicalgenome.org/kb/gene-validity/CGGV:assertion_c778b145-fcfc-4252-8dd8-33f982b288e8-2021-01-20T170000.000Z","Catecholaminergic Polymorphic Ventricular Tachycardia | Catecholaminergic Polymorphic Ventricular Tachycardia","Strong Actionability (03/11/2021) | Strong Actionability (03/11/2021)","https://search.clinicalgenome.org/kb/gene-validity/https://actionability.clinicalgenome.org/ac/Adult/ui/stg2SummaryRpt?doc=AC042 | https://search.clinicalgenome.org/kb/gene-validity/https://actionability.clinicalgenome.org/ac/Pediatric/ui/stg2SummaryRpt?doc=AC042","Adult Actionability Working Group | Pediatric Actionability Working Group"
"CASQ2","HGNC:1513","https://search.clinicalgenome.org/kb/genes/HGNC:1513","catecholaminergic polymorphic ventricular tachycardia 2","MONDO:0012762","https://search.clinicalgenome.org/kb/conditions/MONDO:0012762","N/A","30 - Gene Associated with Autosomal Recessive Phenotype (08/22/2016)","","https://search.clinicalgenome.org/kb/gene-dosage/HGNC:1513","Dosage Working Group","","","","Strong Actionability (03/11/2021) | Strong Actionability (03/11/2021)","https://search.clinicalgenome.org/kb/gene-validity/https://actionability.clinicalgenome.org/ac/Adult/ui/stg2SummaryRpt?doc=AC042 | https://search.clinicalgenome.org/kb/gene-validity/https://actionability.clinicalgenome.org/ac/Pediatric/ui/stg2SummaryRpt?doc=AC042","Adult Actionability Working Group | Pediatric Actionability Working Group"
"CASR","HGNC:1514","https://search.clinicalgenome.org/kb/genes/HGNC:1514","epilepsy","MONDO:0005027","https://search.clinicalgenome.org/kb/conditions/MONDO:0005027","Autosomal dominant inheritance","0 - No Evidence for Haploinsufficiency (03/02/2012)","0 - No Evidence for Haploinsufficiency (03/02/2012)","https://search.clinicalgenome.org/kb/gene-dosage/HGNC:1514","Dosage Working Group","disputing (03/03/2021)","https://search.clinicalgenome.org/kb/gene-validity/CGGV:assertion_ddebf083-3434-4401-9b6b-9ec24aceec89-2021-03-03T123827.967Z","Epilepsy","","",""
"CAT","HGNC:1516","https://search.clinicalgenome.org/kb/genes/HGNC:1516","acatalasia","MONDO:0013571","https://search.clinicalgenome.org/kb/conditions/MONDO:0013571","Autosomal recessive inheritance","","","","","moderate evidence (04/03/2020)","https://search.clinicalgenome.org/kb/gene-validity/CGGV:assertion_7381d0cc-74d3-4dfc-bc2e-62416afbb0ee-2020-04-03T160000.000Z","Peroxisomal Disorders","","",""
"CBL","HGNC:1541","https://search.clinicalgenome.org/kb/genes/HGNC:1541","CBL-related disorder","MONDO:0013308","https://search.clinicalgenome.org/kb/conditions/MONDO:0013308","Autosomal dominant inheritance","0 - No Evidence for Haploinsufficiency (04/24/2019)","0 - No Evidence for Haploinsufficiency (04/24/2019)","https://search.clinicalgenome.org/kb/gene-dosage/HGNC:1541","Dosage Working Group","definitive evidence (04/29/2019)","https://search.clinicalgenome.org/kb/gene-validity/CGGV:assertion_4a1a76fd-7e23-44a7-b2fc-4495bc5d5ee6-2019-04-29T160000.000Z","RASopathy","","",""
"CBS","HGNC:1550","https://search.clinicalgenome.org/kb/genes/HGNC:1550","classic homocystinuria","MONDO:0009352","https://search.clinicalgenome.org/kb/conditions/MONDO:0009352","Autosomal recessive inheritance","30 - Gene Associated with Autosomal Recessive Phenotype (08/22/2016)","0 - No Evidence for Haploinsufficiency (08/22/2016)","https://search.clinicalgenome.org/kb/gene-dosage/HGNC:1550","Dosage Working Group","definitive evidence (04/12/2019)","https://search.clinicalgenome.org/kb/gene-validity/CGGV:assertion_a9086d29-767b-4ab8-9274-1249b5480834-2019-04-12T160000.000Z","Aminoacidopathy","Assertion Pending (04/20/2016)","https://search.clinicalgenome.org/kb/gene-validity/https://actionability.clinicalgenome.org/ac/Adult/ui/stg2SummaryRpt?doc=AC097","Adult Actionability Working Group"
"CC2D1A","HGNC:30237","https://search.clinicalgenome.org/kb/genes/HGNC:30237","complex neurodevelopmental disorder","MONDO:0100038","https://search.clinicalgenome.org/kb/conditions/MONDO:0100038","Autosomal recessive inheritance","","","","","definitive evidence (01/08/2020)","https://search.clinicalgenome.org/kb/gene-validity/CGGV:assertion_63def86b-765e-4f12-93a3-94ef911c3190-2020-01-08T170000.000Z","Intellectual Disability and Autism","","",""
"CC2D2A","HGNC:29253","https://search.clinicalgenome.org/kb/genes/HGNC:29253","ciliopathy","MONDO:0005308","https://search.clinicalgenome.org/kb/conditions/MONDO:0005308","Autosomal recessive inheritance","30 - Gene Associated with Autosomal Recessive Phenotype (07/17/2013)","0 - No Evidence for Haploinsufficiency (07/17/2013)","https://search.clinicalgenome.org/kb/gene-dosage/HGNC:29253","Dosage Working Group","definitive evidence (08/24/2022)","https://search.clinicalgenome.org/kb/gene-validity/CGGV:assertion_0acbae16-a383-4345-978c-9d28dda80d02-2022-08-24T160000.000Z","Kidney Cystic and Ciliopathy Disorders","","",""
"CCBE1","HGNC:29426","https://search.clinicalgenome.org/kb/genes/HGNC:29426","Hennekam lymphangiectasia-lymphedema syndrome 1","MONDO:0009337","https://search.clinicalgenome.org/kb/conditions/MONDO:0009337","N/A","30 - Gene Associated with Autosomal Recessive Phenotype (08/22/2016)","","https://search.clinicalgenome.org/kb/gene-dosage/HGNC:29426","Dosage Working Group","","","","","",""
"CCDC103","HGNC:32700","https://search.clinicalgenome.org/kb/genes/HGNC:32700","primary ciliary dyskinesia 17","MONDO:0013854","https://search.clinicalgenome.org/kb/conditions/MONDO:0013854","N/A","30 - Gene Associated with Autosomal Recessive Phenotype (08/22/2016)","","https://search.clinicalgenome.org/kb/gene-dosage/HGNC:32700","Dosage Working Group","","","","","",""
"CCDC39","HGNC:25244","https://search.clinicalgenome.org/kb/genes/HGNC:25244","primary ciliary dyskinesia 14","MONDO:0013434","https://search.clinicalgenome.org/kb/conditions/MONDO:0013434","Autosomal recessive inheritance","30 - Gene Associated with Autosomal Recessive Phenotype (08/22/2016)","0 - No Evidence for Haploinsufficiency (08/22/2016)","https://search.clinicalgenome.org/kb/gene-dosage/HGNC:25244","Dosage Working Group","definitive evidence (11/02/2021)","https://search.clinicalgenome.org/kb/gene-validity/CGGV:assertion_79c47f13-dd33-45e4-a170-6ff26aa2732c-2021-11-02T204310.116Z","Motile Ciliopathy","","",""
"CCDC40","HGNC:26090","https://search.clinicalgenome.org/kb/genes/HGNC:26090","primary ciliary dyskinesia 15","MONDO:0013435","https://search.clinicalgenome.org/kb/conditions/MONDO:0013435","Autosomal recessive inheritance","30 - Gene Associated with Autosomal Recessive Phenotype (08/22/2016)","","https://search.clinicalgenome.org/kb/gene-dosage/HGNC:26090","Dosage Working Group","definitive evidence (12/10/2021)","https://search.clinicalgenome.org/kb/gene-validity/CGGV:assertion_e9c192c6-9f74-4beb-85ba-a42199e9794a-2021-12-10T031508.185Z","Motile Ciliopathy","","",""
"CCDC50","HGNC:18111","https://search.clinicalgenome.org/kb/genes/HGNC:18111","nonsyndromic genetic hearing loss","MONDO:0019497","https://search.clinicalgenome.org/kb/conditions/MONDO:0019497","Autosomal dominant inheritance","","","","","limited evidence (11/17/2021)","https://search.clinicalgenome.org/kb/gene-validity/CGGV:assertion_cf656dcb-6644-41bb-a29a-d7bdf54b28f7-2021-11-17T170000.000Z","Hearing Loss","","",""
"CCDC78","HGNC:14153","https://search.clinicalgenome.org/kb/genes/HGNC:14153","centronuclear myopathy","MONDO:0018947","https://search.clinicalgenome.org/kb/conditions/MONDO:0018947","Autosomal dominant inheritance","","","","","limited evidence (12/09/2019)","https://search.clinicalgenome.org/kb/gene-validity/CGGV:assertion_886b45ae-232d-4635-ab94-88a0d15bbcca-2019-12-09T170000.000Z","Congenital Myopathies","","",""
"CCDC8","HGNC:25367","https://search.clinicalgenome.org/kb/genes/HGNC:25367","3M syndrome 3","MONDO:0013627","https://search.clinicalgenome.org/kb/conditions/MONDO:0013627","N/A","30 - Gene Associated with Autosomal Recessive Phenotype (08/22/2016)","0 - No Evidence for Haploinsufficiency (08/22/2016)","https://search.clinicalgenome.org/kb/gene-dosage/HGNC:25367","Dosage Working Group","","","","","",""
"CCM2","HGNC:21708","https://search.clinicalgenome.org/kb/genes/HGNC:21708","famililal cerebral cavernous malformations","MONDO:0031037","https://search.clinicalgenome.org/kb/conditions/MONDO:0031037","N/A","","","","","","","","Assertion Pending (04/04/2017)","https://search.clinicalgenome.org/kb/gene-validity/https://actionability.clinicalgenome.org/ac/Adult/ui/stg2SummaryRpt?doc=AC116","Adult Actionability Working Group"
"CCM2","HGNC:21708","https://search.clinicalgenome.org/kb/genes/HGNC:21708","cerebral cavernous malformation 2","MONDO:0011304","https://search.clinicalgenome.org/kb/conditions/MONDO:0011304","N/A","","","","","","","","Assertion Pending (04/04/2017)","https://search.clinicalgenome.org/kb/gene-validity/https://actionability.clinicalgenome.org/ac/Adult/ui/stg2SummaryRpt?doc=AC116","Adult Actionability Working Group"
"CCM2","HGNC:21708","https://search.clinicalgenome.org/kb/genes/HGNC:21708","cerebral cavernous malformation","MONDO:0000820","https://search.clinicalgenome.org/kb/conditions/MONDO:0000820","N/A","","","","","","","","Assertion Pending (04/04/2017)","https://search.clinicalgenome.org/kb/gene-validity/https://actionability.clinicalgenome.org/ac/Adult/ui/stg2SummaryRpt?doc=AC116","Adult Actionability Working Group"
"CCN6","HGNC:12771","https://search.clinicalgenome.org/kb/genes/HGNC:12771","progressive pseudorheumatoid arthropathy of childhood","MONDO:0008827","https://search.clinicalgenome.org/kb/conditions/MONDO:0008827","N/A","30 - Gene Associated with Autosomal Recessive Phenotype (08/22/2016)","","https://search.clinicalgenome.org/kb/gene-dosage/HGNC:12771","Dosage Working Group","","","","","",""
"CCNF","HGNC:1591","https://search.clinicalgenome.org/kb/genes/HGNC:1591","frontotemporal dementia and/or amyotrophic lateral sclerosis 5","MONDO:0030875","https://search.clinicalgenome.org/kb/conditions/MONDO:0030875","Autosomal dominant inheritance","","","","","limited evidence (04/05/2022)","https://search.clinicalgenome.org/kb/gene-validity/CGGV:assertion_7d6c258c-ce66-459a-a4ae-7376fcefde0d-2022-04-05T230455.308Z","Amyotrophic Lateral Sclerosis Spectrum Disorders","","",""
"CCNQ","HGNC:28434","https://search.clinicalgenome.org/kb/genes/HGNC:28434","syndactyly-telecanthus-anogenital and renal malformations syndrome","MONDO:0010408","https://search.clinicalgenome.org/kb/conditions/MONDO:0010408","N/A","2 - Emerging Evidence for Haploinsufficiency (12/01/2021)","0 - No Evidence for Haploinsufficiency (12/01/2021)","https://search.clinicalgenome.org/kb/gene-dosage/HGNC:28434","Dosage Working Group","","","","","",""
"CCT5","HGNC:1618","https://search.clinicalgenome.org/kb/genes/HGNC:1618","hereditary sensory and autonomic neuropathy with spastic paraplegia","MONDO:0009748","https://search.clinicalgenome.org/kb/conditions/MONDO:0009748","N/A","30 - Gene Associated with Autosomal Recessive Phenotype (08/22/2016)","0 - No Evidence for Haploinsufficiency (08/22/2016)","https://search.clinicalgenome.org/kb/gene-dosage/HGNC:1618","Dosage Working Group","","","","","",""
"CD164","HGNC:1632","https://search.clinicalgenome.org/kb/genes/HGNC:1632","autosomal dominant nonsyndromic hearing loss","MONDO:0019587","https://search.clinicalgenome.org/kb/conditions/MONDO:0019587","Autosomal dominant inheritance","","","","","limited evidence (04/26/2022)","https://search.clinicalgenome.org/kb/gene-validity/CGGV:assertion_e9524ca4-7d17-4691-b650-0d457531c7fd-2022-04-26T153012.127Z","Hearing Loss","","",""
"CD19","HGNC:1633","https://search.clinicalgenome.org/kb/genes/HGNC:1633","immunodeficiency, common variable, 3","MONDO:0013283","https://search.clinicalgenome.org/kb/conditions/MONDO:0013283","Autosomal recessive inheritance","30 - Gene Associated with Autosomal Recessive Phenotype (08/22/2016)","","https://search.clinicalgenome.org/kb/gene-dosage/HGNC:1633","Dosage Working Group","definitive evidence (05/24/2022)","https://search.clinicalgenome.org/kb/gene-validity/CGGV:assertion_a6576337-703e-4d76-9120-5f6800730774-2022-05-24T160000.000Z","Antibody Deficiencies GCEP","","",""
"CD247","HGNC:1677","https://search.clinicalgenome.org/kb/genes/HGNC:1677","immunodeficiency 25","MONDO:0012426","https://search.clinicalgenome.org/kb/conditions/MONDO:0012426","Autosomal recessive inheritance","","","","","definitive evidence (03/11/2022)","https://search.clinicalgenome.org/kb/gene-validity/CGGV:assertion_438b6c1f-edc0-4a81-9c82-39627e5a69cd-2022-03-11T140552.812Z","SCID-CID","","",""
"CD27","HGNC:11922","https://search.clinicalgenome.org/kb/genes/HGNC:11922","lymphoproliferative syndrome 2","MONDO:0014054","https://search.clinicalgenome.org/kb/conditions/MONDO:0014054","N/A","30 - Gene Associated with Autosomal Recessive Phenotype (08/22/2016)","","https://search.clinicalgenome.org/kb/gene-dosage/HGNC:11922","Dosage Working Group","","","","","",""
"CD2AP","HGNC:14258","https://search.clinicalgenome.org/kb/genes/HGNC:14258","focal segmental glomerulosclerosis 3, susceptibility to","MONDO:0011917","https://search.clinicalgenome.org/kb/conditions/MONDO:0011917","Semidominant inheritance","","","","","definitive evidence (12/13/2021)","https://search.clinicalgenome.org/kb/gene-validity/CGGV:assertion_2cae2640-258f-4ba1-8510-2b4db97cf36c-2021-12-13T013000.000Z","Glomerulopathy","","",""
"CD36","HGNC:1663","https://search.clinicalgenome.org/kb/genes/HGNC:1663","platelet-type bleeding disorder 10","MONDO:0012031","https://search.clinicalgenome.org/kb/conditions/MONDO:0012031","N/A","30 - Gene Associated with Autosomal Recessive Phenotype (08/22/2016)","","https://search.clinicalgenome.org/kb/gene-dosage/HGNC:1663","Dosage Working Group","","","","","",""
"CD3D","HGNC:1673","https://search.clinicalgenome.org/kb/genes/HGNC:1673","immunodeficiency 19","MONDO:0014280","https://search.clinicalgenome.org/kb/conditions/MONDO:0014280","Autosomal recessive inheritance","30 - Gene Associated with Autosomal Recessive Phenotype (08/22/2016)","","https://search.clinicalgenome.org/kb/gene-dosage/HGNC:1673","Dosage Working Group","definitive evidence (05/10/2022)","https://search.clinicalgenome.org/kb/gene-validity/CGGV:assertion_3d59cf46-9acb-42f7-92da-d17113d39b38-2022-05-10T185446.511Z","SCID-CID","","",""
"CD3E","HGNC:1674","https://search.clinicalgenome.org/kb/genes/HGNC:1674","immunodeficiency 18","MONDO:0014278","https://search.clinicalgenome.org/kb/conditions/MONDO:0014278","Autosomal recessive inheritance","30 - Gene Associated with Autosomal Recessive Phenotype (05/09/2017)","0 - No Evidence for Haploinsufficiency (05/09/2017)","https://search.clinicalgenome.org/kb/gene-dosage/HGNC:1674","Dosage Working Group","definitive evidence (01/26/2021)","https://search.clinicalgenome.org/kb/gene-validity/CGGV:assertion_29d6bb32-65b3-4c78-9c94-da71cc591565-2021-01-26T172908.775Z","SCID-CID","","",""
"CD3G","HGNC:1675","https://search.clinicalgenome.org/kb/genes/HGNC:1675","combined immunodeficiency due to CD3gamma deficiency","MONDO:0014276","https://search.clinicalgenome.org/kb/conditions/MONDO:0014276","Autosomal recessive inheritance","30 - Gene Associated with Autosomal Recessive Phenotype (08/22/2016)","","https://search.clinicalgenome.org/kb/gene-dosage/HGNC:1675","Dosage Working Group","definitive evidence (07/15/2021)","https://search.clinicalgenome.org/kb/gene-validity/CGGV:assertion_8ea83aa7-473b-4670-88dd-36b1abe277f8-2021-07-15T160000.000Z","SCID-CID","","",""
"CD40LG","HGNC:11935","https://search.clinicalgenome.org/kb/genes/HGNC:11935","hyper-IgM syndrome type 1","MONDO:0010626","https://search.clinicalgenome.org/kb/conditions/MONDO:0010626","X-linked inheritance","3 - Sufficient Evidence for Haploinsufficiency (04/08/2020)","0 - No Evidence for Haploinsufficiency (04/08/2020)","https://search.clinicalgenome.org/kb/gene-dosage/HGNC:11935","Dosage Working Group","definitive evidence (03/22/2021)","https://search.clinicalgenome.org/kb/gene-validity/CGGV:assertion_4184ad10-d95f-4027-b75d-e4e11127febf-2021-03-22T154242.503Z","SCID-CID","","",""
"CD59","HGNC:1689","https://search.clinicalgenome.org/kb/genes/HGNC:1689","primary CD59 deficiency","MONDO:0012858","https://search.clinicalgenome.org/kb/conditions/MONDO:0012858","N/A","30 - Gene Associated with Autosomal Recessive Phenotype (08/22/2016)","","https://search.clinicalgenome.org/kb/gene-dosage/HGNC:1689","Dosage Working Group","","","","","",""
"CD79A","HGNC:1698","https://search.clinicalgenome.org/kb/genes/HGNC:1698","agammaglobulinemia 3, autosomal recessive","MONDO:0013288","https://search.clinicalgenome.org/kb/conditions/MONDO:0013288","Autosomal recessive inheritance","","","","","definitive evidence (12/15/2020)","https://search.clinicalgenome.org/kb/gene-validity/CGGV:assertion_12a6257c-c9ca-432a-ab76-b05985283381-2020-12-15T135909.057Z","Antibody Deficiencies GCEP","","",""
"CD79B","HGNC:1699","https://search.clinicalgenome.org/kb/genes/HGNC:1699","agammaglobulinemia 6, autosomal recessive","MONDO:0012987","https://search.clinicalgenome.org/kb/conditions/MONDO:0012987","Autosomal recessive inheritance","","","","","definitive evidence (01/26/2021)","https://search.clinicalgenome.org/kb/gene-validity/CGGV:assertion_9c252b2c-2183-4e7d-8ceb-69f7a01cc1d9-2021-01-26T171006.440Z","Antibody Deficiencies GCEP","","",""
"CD81","HGNC:1701","https://search.clinicalgenome.org/kb/genes/HGNC:1701","immunodeficiency, common variable, 6","MONDO:0013286","https://search.clinicalgenome.org/kb/conditions/MONDO:0013286","Autosomal recessive inheritance","","","","","limited evidence (04/29/2021)","https://search.clinicalgenome.org/kb/gene-validity/CGGV:assertion_e2092b4c-a8ff-4b40-bc09-17fbe33aa3e7-2021-04-29T210806.386Z","Antibody Deficiencies GCEP","","",""
"CD8A","HGNC:1706","https://search.clinicalgenome.org/kb/genes/HGNC:1706","susceptibility to respiratory infections associated with CD8alpha chain mutation","MONDO:0012161","https://search.clinicalgenome.org/kb/conditions/MONDO:0012161","N/A","30 - Gene Associated with Autosomal Recessive Phenotype (08/22/2016)","0 - No Evidence for Haploinsufficiency (08/22/2016)","https://search.clinicalgenome.org/kb/gene-dosage/HGNC:1706","Dosage Working Group","","","","","",""
"CDAN1","HGNC:1713","https://search.clinicalgenome.org/kb/genes/HGNC:1713","anemia, congenital dyserythropoietic, type 1a","MONDO:0009135","https://search.clinicalgenome.org/kb/conditions/MONDO:0009135","N/A","30 - Gene Associated with Autosomal Recessive Phenotype (08/22/2016)","0 - No Evidence for Haploinsufficiency (08/22/2016)","https://search.clinicalgenome.org/kb/gene-dosage/HGNC:1713","Dosage Working Group","","","","","",""
"CDC14A","HGNC:1718","https://search.clinicalgenome.org/kb/genes/HGNC:1718","nonsyndromic genetic hearing loss","MONDO:0019497","https://search.clinicalgenome.org/kb/conditions/MONDO:0019497","Autosomal recessive inheritance","","","","","limited evidence (02/26/2018)","https://search.clinicalgenome.org/kb/gene-validity/CGGV:assertion_e869e4b1-30e2-4d9b-9b69-124903d7b307-2018-02-26T170000.000Z","Hearing Loss","","",""
"CDC14A","HGNC:1718","https://search.clinicalgenome.org/kb/genes/HGNC:1718","hearing impairment and infertile male syndrome","MONDO:0100069","https://search.clinicalgenome.org/kb/conditions/MONDO:0100069","Autosomal recessive inheritance","","","","","strong evidence (03/11/2020)","https://search.clinicalgenome.org/kb/gene-validity/CGGV:assertion_144089d2-83ec-4c6c-8b43-9a4cae801d51-2020-03-11T132601.755Z","Hearing Loss","","",""
"CDC42","HGNC:1736","https://search.clinicalgenome.org/kb/genes/HGNC:1736","macrothrombocytopenia-lymphedema-developmental delay-facial dysmorphism-camptodactyly syndrome","MONDO:0014757","https://search.clinicalgenome.org/kb/conditions/MONDO:0014757","Autosomal dominant inheritance","","","","","definitive evidence (10/27/2021)","https://search.clinicalgenome.org/kb/gene-validity/CGGV:assertion_95177a3a-0dca-4945-8a44-f63697739cef-2021-10-27T162623.932Z","Hemostasis Thrombosis","","",""
"CDC42BPB","HGNC:1738","https://search.clinicalgenome.org/kb/genes/HGNC:1738","autism spectrum disorder","MONDO:0005258","https://search.clinicalgenome.org/kb/conditions/MONDO:0005258","N/A","1 - Little Evidence for Haploinsufficiency (10/24/2018)","0 - No Evidence for Haploinsufficiency (10/24/2018)","https://search.clinicalgenome.org/kb/gene-dosage/HGNC:1738","Dosage Working Group","","","","","",""
"CDC73","HGNC:16783","https://search.clinicalgenome.org/kb/genes/HGNC:16783","hyperparathyroidism 2 with jaw tumors","MONDO:0007768","https://search.clinicalgenome.org/kb/conditions/MONDO:0007768","Autosomal dominant inheritance","3 - Sufficient Evidence for Haploinsufficiency (04/13/2022)","0 - No Evidence for Haploinsufficiency (04/13/2022)","https://search.clinicalgenome.org/kb/gene-dosage/HGNC:16783","Dosage Working Group","definitive evidence (10/12/2018)","https://search.clinicalgenome.org/kb/gene-validity/CGGV:assertion_a5bd498b-dc86-4f2d-a51b-48baf7017a02-2018-10-12T210249.200Z","Hereditary Cancer","Assertion Pending (12/29/2016)","https://search.clinicalgenome.org/kb/gene-validity/https://actionability.clinicalgenome.org/ac/Adult/ui/stg2SummaryRpt?doc=AC119","Adult Actionability Working Group"
"CDH1","HGNC:1748","https://search.clinicalgenome.org/kb/genes/HGNC:1748","hereditary diffuse gastric adenocarcinoma","MONDO:0007648","https://search.clinicalgenome.org/kb/conditions/MONDO:0007648","Autosomal dominant inheritance","3 - Sufficient Evidence for Haploinsufficiency (04/10/2020)","0 - No Evidence for Haploinsufficiency (04/10/2020)","https://search.clinicalgenome.org/kb/gene-dosage/HGNC:1748","Dosage Working Group","definitive evidence (10/11/2018)","https://search.clinicalgenome.org/kb/gene-validity/CGGV:assertion_14223ff7-e6b0-4c60-bee6-df55301d2017-2018-10-11T185226.994Z","Hereditary Cancer","Limited Actionability (06/04/2019) | Assertion Pending (06/04/2019)","https://search.clinicalgenome.org/kb/gene-validity/https://actionability.clinicalgenome.org/ac/Pediatric/ui/stg2SummaryRpt?doc=AC103 | https://search.clinicalgenome.org/kb/gene-validity/https://actionability.clinicalgenome.org/ac/Adult/ui/stg2SummaryRpt?doc=AC103","Pediatric Actionability Working Group | Adult Actionability Working Group"
"CDH1","HGNC:1748","https://search.clinicalgenome.org/kb/genes/HGNC:1748","hereditary breast carcinoma","MONDO:0016419","https://search.clinicalgenome.org/kb/conditions/MONDO:0016419","Autosomal dominant inheritance","3 - Sufficient Evidence for Haploinsufficiency (04/10/2020)","0 - No Evidence for Haploinsufficiency (04/10/2020)","https://search.clinicalgenome.org/kb/gene-dosage/HGNC:1748","Dosage Working Group","definitive evidence (01/25/2017)","https://search.clinicalgenome.org/kb/gene-validity/CGGCIEX:assertion_8502","Breast/Ovarian Cancer","Assertion Pending (06/04/2019)","https://search.clinicalgenome.org/kb/gene-validity/https://actionability.clinicalgenome.org/ac/Adult/ui/stg2SummaryRpt?doc=AC103","Adult Actionability Working Group"
"CDH1","HGNC:1748","https://search.clinicalgenome.org/kb/genes/HGNC:1748","hereditary nonpolyposis colon cancer","MONDO:0018630","https://search.clinicalgenome.org/kb/conditions/MONDO:0018630","Autosomal dominant inheritance","3 - Sufficient Evidence for Haploinsufficiency (04/10/2020)","0 - No Evidence for Haploinsufficiency (04/10/2020)","https://search.clinicalgenome.org/kb/gene-dosage/HGNC:1748","Dosage Working Group","limited evidence (06/08/2017)","https://search.clinicalgenome.org/kb/gene-validity/CGGCIEX:assertion_8433","Colon Cancer","","",""
"CDH1","HGNC:1748","https://search.clinicalgenome.org/kb/genes/HGNC:1748","familial ovarian cancer","MONDO:0016248","https://search.clinicalgenome.org/kb/conditions/MONDO:0016248","Autosomal dominant inheritance","3 - Sufficient Evidence for Haploinsufficiency (04/10/2020)","0 - No Evidence for Haploinsufficiency (04/10/2020)","https://search.clinicalgenome.org/kb/gene-dosage/HGNC:1748","Dosage Working Group","no known disease relationship (08/03/2017)","https://search.clinicalgenome.org/kb/gene-validity/CGGCIEX:assertion_8503","Breast/Ovarian Cancer","","",""
"CDH15","HGNC:1754","https://search.clinicalgenome.org/kb/genes/HGNC:1754","intellectual disability","MONDO:0001071","https://search.clinicalgenome.org/kb/conditions/MONDO:0001071","Autosomal dominant inheritance","0 - No Evidence for Haploinsufficiency (08/08/2013)","0 - No Evidence for Haploinsufficiency (08/08/2013)","https://search.clinicalgenome.org/kb/gene-dosage/HGNC:1754","Dosage Working Group","disputing (02/17/2021)","https://search.clinicalgenome.org/kb/gene-validity/CGGV:assertion_9295bddb-d61c-47c2-b186-97296b9c4d94-2021-02-17T170000.000Z","Intellectual Disability and Autism","","",""
"CDH15","HGNC:1754","https://search.clinicalgenome.org/kb/genes/HGNC:1754","intellectual disability, autosomal dominant 3","MONDO:0012946","https://search.clinicalgenome.org/kb/conditions/MONDO:0012946","N/A","0 - No Evidence for Haploinsufficiency (08/08/2013)","0 - No Evidence for Haploinsufficiency (08/08/2013)","https://search.clinicalgenome.org/kb/gene-dosage/HGNC:1754","Dosage Working Group","","","","","",""
"CDH2","HGNC:1759","https://search.clinicalgenome.org/kb/genes/HGNC:1759","arrhythmogenic right ventricular cardiomyopathy","MONDO:0016587","https://search.clinicalgenome.org/kb/conditions/MONDO:0016587","Autosomal dominant inheritance","","","","","limited evidence (07/13/2018)","https://search.clinicalgenome.org/kb/gene-validity/CGGV:assertion_c7a03805-bf73-4d2d-9756-c666c67be119-2018-07-13T160000.000Z","Arrhythmogenic Right Ventricular Cardiomyopathy","","",""
"CDH23","HGNC:13733","https://search.clinicalgenome.org/kb/genes/HGNC:13733","nonsyndromic genetic hearing loss","MONDO:0019497","https://search.clinicalgenome.org/kb/conditions/MONDO:0019497","Autosomal recessive inheritance","30 - Gene Associated with Autosomal Recessive Phenotype (08/22/2016)","","https://search.clinicalgenome.org/kb/gene-dosage/HGNC:13733","Dosage Working Group","definitive evidence (05/22/2018)","https://search.clinicalgenome.org/kb/gene-validity/CGGV:assertion_f5799772-f233-4004-99a8-e6a0dddf0e8b-2018-05-22T040000.000Z","Hearing Loss","Strong Actionability (10/29/2020)","https://search.clinicalgenome.org/kb/gene-validity/https://actionability.clinicalgenome.org/ac/Pediatric/ui/stg2SummaryRpt?doc=AC1018","Pediatric Actionability Working Group"
"CDH23","HGNC:13733","https://search.clinicalgenome.org/kb/genes/HGNC:13733","Usher syndrome type 1","MONDO:0010168","https://search.clinicalgenome.org/kb/conditions/MONDO:0010168","Autosomal recessive inheritance","30 - Gene Associated with Autosomal Recessive Phenotype (08/22/2016)","","https://search.clinicalgenome.org/kb/gene-dosage/HGNC:13733","Dosage Working Group","definitive evidence (01/30/2017)","https://search.clinicalgenome.org/kb/gene-validity/CGGCIEX:assertion_5610","Hearing Loss","","",""
"CDH23","HGNC:13733","https://search.clinicalgenome.org/kb/genes/HGNC:13733","autosomal recessive nonsyndromic hearing loss 12","MONDO:0011067","https://search.clinicalgenome.org/kb/conditions/MONDO:0011067","N/A","30 - Gene Associated with Autosomal Recessive Phenotype (08/22/2016)","","https://search.clinicalgenome.org/kb/gene-dosage/HGNC:13733","Dosage Working Group","","","","Strong Actionability (10/29/2020)","https://search.clinicalgenome.org/kb/gene-validity/https://actionability.clinicalgenome.org/ac/Pediatric/ui/stg2SummaryRpt?doc=AC1018","Pediatric Actionability Working Group"
"CDH23","HGNC:13733","https://search.clinicalgenome.org/kb/genes/HGNC:13733","sensorineural hearing loss disorder","MONDO:0020678","https://search.clinicalgenome.org/kb/conditions/MONDO:0020678","N/A","30 - Gene Associated with Autosomal Recessive Phenotype (08/22/2016)","","https://search.clinicalgenome.org/kb/gene-dosage/HGNC:13733","Dosage Working Group","","","","Strong Actionability (10/29/2020)","https://search.clinicalgenome.org/kb/gene-validity/https://actionability.clinicalgenome.org/ac/Pediatric/ui/stg2SummaryRpt?doc=AC1018","Pediatric Actionability Working Group"
"CDH23","HGNC:13733","https://search.clinicalgenome.org/kb/genes/HGNC:13733","prelingual non-syndromic genetic hearing loss","MONDO:0016297","https://search.clinicalgenome.org/kb/conditions/MONDO:0016297","N/A","30 - Gene Associated with Autosomal Recessive Phenotype (08/22/2016)","","https://search.clinicalgenome.org/kb/gene-dosage/HGNC:13733","Dosage Working Group","","","","Strong Actionability (10/29/2020)","https://search.clinicalgenome.org/kb/gene-validity/https://actionability.clinicalgenome.org/ac/Pediatric/ui/stg2SummaryRpt?doc=AC1018","Pediatric Actionability Working Group"
"CDH23","HGNC:13733","https://search.clinicalgenome.org/kb/genes/HGNC:13733","hearing loss, autosomal recessive","MONDO:0019588","https://search.clinicalgenome.org/kb/conditions/MONDO:0019588","N/A","30 - Gene Associated with Autosomal Recessive Phenotype (08/22/2016)","","https://search.clinicalgenome.org/kb/gene-dosage/HGNC:13733","Dosage Working Group","","","","Strong Actionability (10/29/2020)","https://search.clinicalgenome.org/kb/gene-validity/https://actionability.clinicalgenome.org/ac/Pediatric/ui/stg2SummaryRpt?doc=AC1018","Pediatric Actionability Working Group"
"CDH23","HGNC:13733","https://search.clinicalgenome.org/kb/genes/HGNC:13733","inherited auditory system disease","MONDO:0037940","https://search.clinicalgenome.org/kb/conditions/MONDO:0037940","N/A","30 - Gene Associated with Autosomal Recessive Phenotype (08/22/2016)","","https://search.clinicalgenome.org/kb/gene-dosage/HGNC:13733","Dosage Working Group","","","","","",""
"CDH3","HGNC:1762","https://search.clinicalgenome.org/kb/genes/HGNC:1762","EEM syndrome","MONDO:0009155","https://search.clinicalgenome.org/kb/conditions/MONDO:0009155","Autosomal recessive inheritance","","","","","definitive evidence (08/05/2021)","https://search.clinicalgenome.org/kb/gene-validity/CGGV:assertion_5791d618-93bf-4517-9c60-48e6490319a6-2021-08-05T160000.000Z","Retina","","",""
"CDHR1","HGNC:14550","https://search.clinicalgenome.org/kb/genes/HGNC:14550","cone-rod dystrophy 15","MONDO:0013348","https://search.clinicalgenome.org/kb/conditions/MONDO:0013348","N/A","30 - Gene Associated with Autosomal Recessive Phenotype (08/22/2016)","","https://search.clinicalgenome.org/kb/gene-dosage/HGNC:14550","Dosage Working Group","","","","","",""
"CDIN1","HGNC:26929","https://search.clinicalgenome.org/kb/genes/HGNC:26929","congenital dyserythropoietic anemia type type 1B","MONDO:0014285","https://search.clinicalgenome.org/kb/conditions/MONDO:0014285","N/A","30 - Gene Associated with Autosomal Recessive Phenotype (08/22/2016)","","https://search.clinicalgenome.org/kb/gene-dosage/HGNC:26929","Dosage Working Group","","","","","",""
"CDK13","HGNC:1733","https://search.clinicalgenome.org/kb/genes/HGNC:1733","syndromic intellectual disability","MONDO:0000508","https://search.clinicalgenome.org/kb/conditions/MONDO:0000508","Autosomal dominant inheritance","2 - Emerging Evidence for Haploinsufficiency (02/23/2022)","","https://search.clinicalgenome.org/kb/gene-dosage/HGNC:1733","Dosage Working Group","definitive evidence (12/31/2021)","https://search.clinicalgenome.org/kb/gene-validity/CGGV:assertion_c594bcfa-2b2c-425a-8285-74bae8e01da8-2021-12-31T225720.705Z","Intellectual Disability and Autism","","",""
"CDK16","HGNC:8749","https://search.clinicalgenome.org/kb/genes/HGNC:8749","X-linked complex neurodevelopmental disorder","MONDO:0100148","https://search.clinicalgenome.org/kb/conditions/MONDO:0100148","X-linked inheritance","","","","","limited evidence (10/28/2021)","https://search.clinicalgenome.org/kb/gene-validity/CGGV:assertion_93557c1a-c141-4833-bcbb-83fccbd7d761-2021-10-28T160000.000Z","Intellectual Disability and Autism","","",""
"CDK4","HGNC:1773","https://search.clinicalgenome.org/kb/genes/HGNC:1773","melanoma, cutaneous malignant, susceptibility to, 3","MONDO:0012183","https://search.clinicalgenome.org/kb/conditions/MONDO:0012183","Autosomal dominant inheritance","0 - No Evidence for Haploinsufficiency (09/02/2020)","0 - No Evidence for Haploinsufficiency (09/02/2020)","https://search.clinicalgenome.org/kb/gene-dosage/HGNC:1773","Dosage Working Group","definitive evidence (01/13/2020)","https://search.clinicalgenome.org/kb/gene-validity/CGGV:assertion_ca76579b-1432-4edc-84e8-b3332dce4ede-2020-01-13T194434.667Z","Hereditary Cancer","","",""
"CDK5RAP2","HGNC:18672","https://search.clinicalgenome.org/kb/genes/HGNC:18672","autosomal recessive primary microcephaly","MONDO:0016660","https://search.clinicalgenome.org/kb/conditions/MONDO:0016660","Autosomal recessive inheritance","30 - Gene Associated with Autosomal Recessive Phenotype (08/22/2016)","","https://search.clinicalgenome.org/kb/gene-dosage/HGNC:18672","Dosage Working Group","definitive evidence (01/25/2022)","https://search.clinicalgenome.org/kb/gene-validity/CGGV:assertion_70dace84-4d61-44f5-9de5-a81b5c70cad4-2022-01-25T170000.000Z","Brain Malformations","","",""
"CDK5RAP2","HGNC:18672","https://search.clinicalgenome.org/kb/genes/HGNC:18672","microcephaly 3, primary, autosomal recessive","MONDO:0011488","https://search.clinicalgenome.org/kb/conditions/MONDO:0011488","N/A","30 - Gene Associated with Autosomal Recessive Phenotype (08/22/2016)","","https://search.clinicalgenome.org/kb/gene-dosage/HGNC:18672","Dosage Working Group","","","","","",""
"CDK6","HGNC:1777","https://search.clinicalgenome.org/kb/genes/HGNC:1777","microcephaly 12, primary, autosomal recessive","MONDO:0014484","https://search.clinicalgenome.org/kb/conditions/MONDO:0014484","N/A","30 - Gene Associated with Autosomal Recessive Phenotype (08/22/2016)","","https://search.clinicalgenome.org/kb/gene-dosage/HGNC:1777","Dosage Working Group","","","","","",""
"CDKL5","HGNC:11411","https://search.clinicalgenome.org/kb/genes/HGNC:11411","CDKL5 disorder","MONDO:0100039","https://search.clinicalgenome.org/kb/conditions/MONDO:0100039","X-linked inheritance","3 - Sufficient Evidence for Haploinsufficiency (07/12/2012)","0 - No Evidence for Haploinsufficiency (07/12/2012)","https://search.clinicalgenome.org/kb/gene-dosage/HGNC:11411","Dosage Working Group","definitive evidence (07/02/2018)","https://search.clinicalgenome.org/kb/gene-validity/CGGV:assertion_a80cd86d-b085-4f35-9379-12a53ef367e2-2018-07-02T145731.072Z","Rett and Angelman-like Disorders","","",""
"CDKL5","HGNC:11411","https://search.clinicalgenome.org/kb/genes/HGNC:11411","developmental and epileptic encephalopathy, 2","MONDO:0010396","https://search.clinicalgenome.org/kb/conditions/MONDO:0010396","N/A","3 - Sufficient Evidence for Haploinsufficiency (07/12/2012)","0 - No Evidence for Haploinsufficiency (07/12/2012)","https://search.clinicalgenome.org/kb/gene-dosage/HGNC:11411","Dosage Working Group","","","","","",""
"CDKN1B","HGNC:1785","https://search.clinicalgenome.org/kb/genes/HGNC:1785","multiple endocrine neoplasia type 4","MONDO:0012552","https://search.clinicalgenome.org/kb/conditions/MONDO:0012552","Autosomal dominant inheritance","3 - Sufficient Evidence for Haploinsufficiency (07/08/2020)","0 - No Evidence for Haploinsufficiency (07/08/2020)","https://search.clinicalgenome.org/kb/gene-dosage/HGNC:1785","Dosage Working Group","definitive evidence (12/21/2018)","https://search.clinicalgenome.org/kb/gene-validity/CGGV:assertion_b07f8882-dd5e-4831-9926-f8b4c2a8c265-2018-12-21T154854.477Z","Hereditary Cancer","","",""
"CDKN1B","HGNC:1785","https://search.clinicalgenome.org/kb/genes/HGNC:1785","hereditary nonpolyposis colon cancer","MONDO:0018630","https://search.clinicalgenome.org/kb/conditions/MONDO:0018630","Autosomal recessive inheritance","3 - Sufficient Evidence for Haploinsufficiency (07/08/2020)","0 - No Evidence for Haploinsufficiency (07/08/2020)","https://search.clinicalgenome.org/kb/gene-dosage/HGNC:1785","Dosage Working Group","limited evidence (06/08/2017)","https://search.clinicalgenome.org/kb/gene-validity/CGGCIEX:assertion_8434","Colon Cancer","","",""
"CDKN1C","HGNC:1786","https://search.clinicalgenome.org/kb/genes/HGNC:1786","Beckwith-Wiedemann syndrome","MONDO:0007534","https://search.clinicalgenome.org/kb/conditions/MONDO:0007534","N/A","3 - Sufficient Evidence for Haploinsufficiency (09/25/2020)","0 - No Evidence for Haploinsufficiency (09/25/2020)","https://search.clinicalgenome.org/kb/gene-dosage/HGNC:1786","Dosage Working Group","","","","","",""
"CDKN2A","HGNC:1787","https://search.clinicalgenome.org/kb/genes/HGNC:1787","melanoma-pancreatic cancer syndrome","MONDO:0011713","https://search.clinicalgenome.org/kb/conditions/MONDO:0011713","Autosomal dominant inheritance","3 - Sufficient Evidence for Haploinsufficiency (03/18/2022)","0 - No Evidence for Haploinsufficiency (03/18/2022)","https://search.clinicalgenome.org/kb/gene-dosage/HGNC:1787","Dosage Working Group","definitive evidence (08/14/2019)","https://search.clinicalgenome.org/kb/gene-validity/CGGV:assertion_0c0d2fc0-12b2-4855-b537-60394d0987dd-2019-08-14T194547.089Z","Hereditary Cancer","Assertion Pending (09/22/2016)","https://search.clinicalgenome.org/kb/gene-validity/https://actionability.clinicalgenome.org/ac/Adult/ui/stg2SummaryRpt?doc=AC086","Adult Actionability Working Group"
"CDKN2A","HGNC:1787","https://search.clinicalgenome.org/kb/genes/HGNC:1787","melanoma, cutaneous malignant, susceptibility to, 2","MONDO:0007964","https://search.clinicalgenome.org/kb/conditions/MONDO:0007964","N/A","3 - Sufficient Evidence for Haploinsufficiency (03/18/2022)","0 - No Evidence for Haploinsufficiency (03/18/2022)","https://search.clinicalgenome.org/kb/gene-dosage/HGNC:1787","Dosage Working Group","","","","","",""
"CDT1","HGNC:24576","https://search.clinicalgenome.org/kb/genes/HGNC:24576","Meier-Gorlin syndrome 4","MONDO:0013431","https://search.clinicalgenome.org/kb/conditions/MONDO:0013431","N/A","30 - Gene Associated with Autosomal Recessive Phenotype (08/22/2016)","","https://search.clinicalgenome.org/kb/gene-dosage/HGNC:24576","Dosage Working Group","","","","","",""
"CEACAM16","HGNC:31948","https://search.clinicalgenome.org/kb/genes/HGNC:31948","nonsyndromic genetic hearing loss","MONDO:0019497","https://search.clinicalgenome.org/kb/conditions/MONDO:0019497","Autosomal dominant inheritance","","","","","moderate evidence (03/20/2018)","https://search.clinicalgenome.org/kb/gene-validity/CGGV:assertion_e25cadf1-752a-495d-aaf2-30565519518a-2018-03-20T160000.000Z","Hearing Loss","","",""
"CEBPA","HGNC:1833","https://search.clinicalgenome.org/kb/genes/HGNC:1833","acute myeloid leukemia","MONDO:0018874","https://search.clinicalgenome.org/kb/conditions/MONDO:0018874","Autosomal dominant inheritance","0 - No Evidence for Haploinsufficiency (06/09/2022)","0 - No Evidence for Haploinsufficiency (06/09/2022)","https://search.clinicalgenome.org/kb/gene-dosage/HGNC:1833","Dosage Working Group","definitive evidence (08/18/2019)","https://search.clinicalgenome.org/kb/gene-validity/CGGV:assertion_4234367e-149b-4f13-9243-341396fb4ccf-2019-08-18T155916.225Z","Hereditary Cancer","","",""
"CEBPE","HGNC:1836","https://search.clinicalgenome.org/kb/genes/HGNC:1836","specific granule deficiency 1","MONDO:0044207","https://search.clinicalgenome.org/kb/conditions/MONDO:0044207","N/A","30 - Gene Associated with Autosomal Recessive Phenotype (08/22/2016)","","https://search.clinicalgenome.org/kb/gene-dosage/HGNC:1836","Dosage Working Group","","","","","",""
"CEL","HGNC:1848","https://search.clinicalgenome.org/kb/genes/HGNC:1848","maturity-onset diabetes of the young type 8","MONDO:0012348","https://search.clinicalgenome.org/kb/conditions/MONDO:0012348","Autosomal dominant inheritance","","","","","moderate evidence (05/06/2022)","https://search.clinicalgenome.org/kb/gene-validity/CGGV:assertion_06571680-3730-4075-8e65-f6de7ddd3e62-2022-05-06T135524.986Z","Monogenic Diabetes","","",""
"CEMIP","HGNC:29213","https://search.clinicalgenome.org/kb/genes/HGNC:29213","nonsyndromic genetic hearing loss","MONDO:0019497","https://search.clinicalgenome.org/kb/conditions/MONDO:0019497","Autosomal recessive inheritance","","","","","disputing (07/17/2018)","https://search.clinicalgenome.org/kb/gene-validity/CGGV:assertion_27d840d2-1f58-4d1c-9f6e-307db9f41b60-2018-07-17T160000.000Z","Hearing Loss","","",""
"CENPJ","HGNC:17272","https://search.clinicalgenome.org/kb/genes/HGNC:17272","microcephaly 6 with or without short stature","MONDO:0700054","https://search.clinicalgenome.org/kb/conditions/MONDO:0700054","Autosomal recessive inheritance","30 - Gene Associated with Autosomal Recessive Phenotype (08/22/2016)","","https://search.clinicalgenome.org/kb/gene-dosage/HGNC:17272","Dosage Working Group","definitive evidence (05/21/2022)","https://search.clinicalgenome.org/kb/gene-validity/CGGV:assertion_c10510c1-2c0e-466e-928a-77d896159d06-2022-05-21T104414.354Z","Syndromic Disorders","","",""
"CENPJ","HGNC:17272","https://search.clinicalgenome.org/kb/genes/HGNC:17272","microcephaly 6, primary, autosomal recessive","MONDO:0012029","https://search.clinicalgenome.org/kb/conditions/MONDO:0012029","N/A","30 - Gene Associated with Autosomal Recessive Phenotype (08/22/2016)","","https://search.clinicalgenome.org/kb/gene-dosage/HGNC:17272","Dosage Working Group","","","","","",""
"CEP164","HGNC:29182","https://search.clinicalgenome.org/kb/genes/HGNC:29182","ciliopathy","MONDO:0005308","https://search.clinicalgenome.org/kb/conditions/MONDO:0005308","Autosomal recessive inheritance","30 - Gene Associated with Autosomal Recessive Phenotype (08/22/2016)","0 - No Evidence for Haploinsufficiency (08/22/2016)","https://search.clinicalgenome.org/kb/gene-dosage/HGNC:29182","Dosage Working Group","definitive evidence (10/27/2021)","https://search.clinicalgenome.org/kb/gene-validity/CGGV:assertion_961b81f6-7ad1-49e2-b675-c035b4d8d35d-2021-10-27T160000.000Z","Kidney Cystic and Ciliopathy Disorders","","",""
"CEP164","HGNC:29182","https://search.clinicalgenome.org/kb/genes/HGNC:29182","nephronophthisis 15","MONDO:0013917","https://search.clinicalgenome.org/kb/conditions/MONDO:0013917","N/A","30 - Gene Associated with Autosomal Recessive Phenotype (08/22/2016)","0 - No Evidence for Haploinsufficiency (08/22/2016)","https://search.clinicalgenome.org/kb/gene-dosage/HGNC:29182","Dosage Working Group","","","","","",""
"CEP290","HGNC:29021","https://search.clinicalgenome.org/kb/genes/HGNC:29021","CEP290-related ciliopathy","MONDO:0100451","https://search.clinicalgenome.org/kb/conditions/MONDO:0100451","Autosomal recessive inheritance","30 - Gene Associated with Autosomal Recessive Phenotype (08/22/2012)","0 - No Evidence for Haploinsufficiency (08/22/2012)","https://search.clinicalgenome.org/kb/gene-dosage/HGNC:29021","Dosage Working Group","definitive evidence (02/03/2022)","https://search.clinicalgenome.org/kb/gene-validity/CGGV:assertion_ec24317e-70bc-48a0-999b-f960f951e8dd-2022-02-03T170000.000Z","Retina","","",""
"CEP57","HGNC:30794","https://search.clinicalgenome.org/kb/genes/HGNC:30794","mosaic variegated aneuploidy syndrome 2","MONDO:0013582","https://search.clinicalgenome.org/kb/conditions/MONDO:0013582","Autosomal recessive inheritance","","","","","definitive evidence (11/22/2019)","https://search.clinicalgenome.org/kb/gene-validity/CGGV:assertion_c44921de-14cf-4907-8bef-1525329ee89c-2019-11-22T145303.972Z","Hereditary Cancer","","",""
"CEP78","HGNC:25740","https://search.clinicalgenome.org/kb/genes/HGNC:25740","cone-rod dystrophy and hearing loss","MONDO:0014980","https://search.clinicalgenome.org/kb/conditions/MONDO:0014980","Autosomal recessive inheritance","30 - Gene Associated with Autosomal Recessive Phenotype (10/23/2017)","0 - No Evidence for Haploinsufficiency (10/23/2017)","https://search.clinicalgenome.org/kb/gene-dosage/HGNC:25740","Dosage Working Group","strong evidence (04/12/2017)","https://search.clinicalgenome.org/kb/gene-validity/CGGCIEX:assertion_8149","Hearing Loss","","",""
"CERS3","HGNC:23752","https://search.clinicalgenome.org/kb/genes/HGNC:23752","autosomal recessive congenital ichthyosis 9","MONDO:0014010","https://search.clinicalgenome.org/kb/conditions/MONDO:0014010","N/A","30 - Gene Associated with Autosomal Recessive Phenotype (08/22/2016)","","https://search.clinicalgenome.org/kb/gene-dosage/HGNC:23752","Dosage Working Group","","","","","",""
"CFAP418","HGNC:27232","https://search.clinicalgenome.org/kb/genes/HGNC:27232","cone-rod dystrophy 16","MONDO:0013786","https://search.clinicalgenome.org/kb/conditions/MONDO:0013786","N/A","30 - Gene Associated with Autosomal Recessive Phenotype (08/22/2016)","0 - No Evidence for Haploinsufficiency (08/22/2016)","https://search.clinicalgenome.org/kb/gene-dosage/HGNC:27232","Dosage Working Group","","","","","",""
"CFAP53","HGNC:26530","https://search.clinicalgenome.org/kb/genes/HGNC:26530","heterotaxy, visceral, 6, autosomal","MONDO:0013887","https://search.clinicalgenome.org/kb/conditions/MONDO:0013887","N/A","30 - Gene Associated with Autosomal Recessive Phenotype (08/22/2016)","0 - No Evidence for Haploinsufficiency (08/22/2016)","https://search.clinicalgenome.org/kb/gene-dosage/HGNC:26530","Dosage Working Group","","","","","",""
"CFAP57","HGNC:26485","https://search.clinicalgenome.org/kb/genes/HGNC:26485","primary ciliary dyskinesia","MONDO:0016575","https://search.clinicalgenome.org/kb/conditions/MONDO:0016575","Autosomal recessive inheritance","","","","","limited evidence (06/23/2022)","https://search.clinicalgenome.org/kb/gene-validity/CGGV:assertion_50ed292f-0044-4c82-9419-a040cbcaf205-2022-06-23T160000.000Z","Motile Ciliopathy","","",""
"CFD","HGNC:2771","https://search.clinicalgenome.org/kb/genes/HGNC:2771","recurrent Neisseria infections due to factor D deficiency","MONDO:0013487","https://search.clinicalgenome.org/kb/conditions/MONDO:0013487","N/A","30 - Gene Associated with Autosomal Recessive Phenotype (08/22/2016)","0 - No Evidence for Haploinsufficiency (08/22/2016)","https://search.clinicalgenome.org/kb/gene-dosage/HGNC:2771","Dosage Working Group","","","","","",""
"CFL2","HGNC:1875","https://search.clinicalgenome.org/kb/genes/HGNC:1875","nemaline myopathy 7","MONDO:0012538","https://search.clinicalgenome.org/kb/conditions/MONDO:0012538","Autosomal recessive inheritance","30 - Gene Associated with Autosomal Recessive Phenotype (08/22/2016)","","https://search.clinicalgenome.org/kb/gene-dosage/HGNC:1875","Dosage Working Group","definitive evidence (11/25/2019)","https://search.clinicalgenome.org/kb/gene-validity/CGGV:assertion_3c04b972-6797-42e7-87e8-ee97eb0bbad7-2019-11-25T150139.061Z","Congenital Myopathies","","",""
"CFTR","HGNC:1884","https://search.clinicalgenome.org/kb/genes/HGNC:1884","cystic fibrosis","MONDO:0009061","https://search.clinicalgenome.org/kb/conditions/MONDO:0009061","N/A","30 - Gene Associated with Autosomal Recessive Phenotype (08/22/2016)","","https://search.clinicalgenome.org/kb/gene-dosage/HGNC:1884","Dosage Working Group","","","","","",""
"CHAMP1","HGNC:20311","https://search.clinicalgenome.org/kb/genes/HGNC:20311","intellectual disability, autosomal dominant 40","MONDO:0014699","https://search.clinicalgenome.org/kb/conditions/MONDO:0014699","N/A","2 - Emerging Evidence for Haploinsufficiency (03/25/2020)","0 - No Evidence for Haploinsufficiency (03/25/2020)","https://search.clinicalgenome.org/kb/gene-dosage/HGNC:20311","Dosage Working Group","","","","","",""
"CHAT","HGNC:1912","https://search.clinicalgenome.org/kb/genes/HGNC:1912","congenital myasthenic syndrome 6","MONDO:0009689","https://search.clinicalgenome.org/kb/conditions/MONDO:0009689","N/A","30 - Gene Associated with Autosomal Recessive Phenotype (08/22/2016)","","https://search.clinicalgenome.org/kb/gene-dosage/HGNC:1912","Dosage Working Group","","","","","",""
"CHD1L","HGNC:1916","https://search.clinicalgenome.org/kb/genes/HGNC:1916","congenital anomaly of kidney and urinary tract","MONDO:0019719","https://search.clinicalgenome.org/kb/conditions/MONDO:0019719","Autosomal dominant inheritance","0 - No Evidence for Haploinsufficiency (08/30/2018)","0 - No Evidence for Haploinsufficiency (08/30/2018)","https://search.clinicalgenome.org/kb/gene-dosage/HGNC:1916","Dosage Working Group","limited evidence (11/18/2016)","https://search.clinicalgenome.org/kb/gene-validity/CGGCIEX:assertion_3220","General Gene Curation","","",""
"CHD2","HGNC:1917","https://search.clinicalgenome.org/kb/genes/HGNC:1917","complex neurodevelopmental disorder","MONDO:0100038","https://search.clinicalgenome.org/kb/conditions/MONDO:0100038","Autosomal dominant inheritance","3 - Sufficient Evidence for Haploinsufficiency (10/23/2019)","0 - No Evidence for Haploinsufficiency (10/23/2019)","https://search.clinicalgenome.org/kb/gene-dosage/HGNC:1917","Dosage Working Group","definitive evidence (07/18/2018)","https://search.clinicalgenome.org/kb/gene-validity/CGGV:assertion_5af80ea6-31c6-47d2-a5a5-299380f5593c-2018-07-18T160000.000Z","Epilepsy","","",""
"CHD2","HGNC:1917","https://search.clinicalgenome.org/kb/genes/HGNC:1917","developmental and epileptic encephalopathy 94","MONDO:0014150","https://search.clinicalgenome.org/kb/conditions/MONDO:0014150","N/A","3 - Sufficient Evidence for Haploinsufficiency (10/23/2019)","0 - No Evidence for Haploinsufficiency (10/23/2019)","https://search.clinicalgenome.org/kb/gene-dosage/HGNC:1917","Dosage Working Group","","","","","",""
"CHD7","HGNC:20626","https://search.clinicalgenome.org/kb/genes/HGNC:20626","CHARGE syndrome","MONDO:0008965","https://search.clinicalgenome.org/kb/conditions/MONDO:0008965","Autosomal dominant inheritance","3 - Sufficient Evidence for Haploinsufficiency (07/06/2012)","0 - No Evidence for Haploinsufficiency (07/06/2012)","https://search.clinicalgenome.org/kb/gene-dosage/HGNC:20626","Dosage Working Group","definitive evidence (08/23/2018)","https://search.clinicalgenome.org/kb/gene-validity/CGGV:assertion_26ae5799-567b-431b-b981-3bc2f8635802-2018-08-23T160000.000Z","Hearing Loss","","",""
"CHD8","HGNC:20153","https://search.clinicalgenome.org/kb/genes/HGNC:20153","complex neurodevelopmental disorder","MONDO:0100038","https://search.clinicalgenome.org/kb/conditions/MONDO:0100038","Autosomal dominant inheritance","3 - Sufficient Evidence for Haploinsufficiency (04/25/2018)","0 - No Evidence for Haploinsufficiency (04/25/2018)","https://search.clinicalgenome.org/kb/gene-dosage/HGNC:20153","Dosage Working Group","definitive evidence (07/16/2018)","https://search.clinicalgenome.org/kb/gene-validity/CGGV:assertion_3134b4e1-2fee-4025-99af-b2146cc2ccf8-2018-07-16T160000.000Z","Intellectual Disability and Autism","","",""
"CHD8","HGNC:20153","https://search.clinicalgenome.org/kb/genes/HGNC:20153","autism, susceptibility to, 18","MONDO:0014017","https://search.clinicalgenome.org/kb/conditions/MONDO:0014017","N/A","3 - Sufficient Evidence for Haploinsufficiency (04/25/2018)","0 - No Evidence for Haploinsufficiency (04/25/2018)","https://search.clinicalgenome.org/kb/gene-dosage/HGNC:20153","Dosage Working Group","","","","","",""
"CHEK1","HGNC:1925","https://search.clinicalgenome.org/kb/genes/HGNC:1925","familial ovarian cancer","MONDO:0016248","https://search.clinicalgenome.org/kb/conditions/MONDO:0016248","Autosomal dominant inheritance","0 - No Evidence for Haploinsufficiency (11/10/2021)","0 - No Evidence for Haploinsufficiency (11/10/2021)","https://search.clinicalgenome.org/kb/gene-dosage/HGNC:1925","Dosage Working Group","no known disease relationship (10/12/2016)","https://search.clinicalgenome.org/kb/gene-validity/CGGCIEX:assertion_8504","Breast/Ovarian Cancer","","",""
"CHEK1","HGNC:1925","https://search.clinicalgenome.org/kb/genes/HGNC:1925","hereditary breast carcinoma","MONDO:0016419","https://search.clinicalgenome.org/kb/conditions/MONDO:0016419","Autosomal dominant inheritance","0 - No Evidence for Haploinsufficiency (11/10/2021)","0 - No Evidence for Haploinsufficiency (11/10/2021)","https://search.clinicalgenome.org/kb/gene-dosage/HGNC:1925","Dosage Working Group","no known disease relationship (10/12/2016)","https://search.clinicalgenome.org/kb/gene-validity/CGGCIEX:assertion_8505","Breast/Ovarian Cancer","","",""
"CHEK2","HGNC:16627","https://search.clinicalgenome.org/kb/genes/HGNC:16627","hereditary nonpolyposis colon cancer","MONDO:0018630","https://search.clinicalgenome.org/kb/conditions/MONDO:0018630","Autosomal dominant inheritance","3 - Sufficient Evidence for Haploinsufficiency (01/08/2020)","0 - No Evidence for Haploinsufficiency (01/08/2020)","https://search.clinicalgenome.org/kb/gene-dosage/HGNC:16627","Dosage Working Group","limited evidence (03/13/2017)","https://search.clinicalgenome.org/kb/gene-validity/CGGCIEX:assertion_9862","Breast/Ovarian Cancer","","",""
"CHEK2","HGNC:16627","https://search.clinicalgenome.org/kb/genes/HGNC:16627","hereditary breast carcinoma","MONDO:0016419","https://search.clinicalgenome.org/kb/conditions/MONDO:0016419","Autosomal dominant inheritance","3 - Sufficient Evidence for Haploinsufficiency (01/08/2020)","0 - No Evidence for Haploinsufficiency (01/08/2020)","https://search.clinicalgenome.org/kb/gene-dosage/HGNC:16627","Dosage Working Group","definitive evidence (12/14/2016)","https://search.clinicalgenome.org/kb/gene-validity/CGGCIEX:assertion_8522","Breast/Ovarian Cancer","Moderate Actionability (09/19/2017)","https://search.clinicalgenome.org/kb/gene-validity/https://actionability.clinicalgenome.org/ac/Adult/ui/stg2SummaryRpt?doc=AC127","Adult Actionability Working Group"
"CHEK2","HGNC:16627","https://search.clinicalgenome.org/kb/genes/HGNC:16627","familial ovarian cancer","MONDO:0016248","https://search.clinicalgenome.org/kb/conditions/MONDO:0016248","Autosomal dominant inheritance","3 - Sufficient Evidence for Haploinsufficiency (01/08/2020)","0 - No Evidence for Haploinsufficiency (01/08/2020)","https://search.clinicalgenome.org/kb/gene-dosage/HGNC:16627","Dosage Working Group","disputing (12/14/2016)","https://search.clinicalgenome.org/kb/gene-validity/CGGCIEX:assertion_8523","Breast/Ovarian Cancer","","",""
"CHKB","HGNC:1938","https://search.clinicalgenome.org/kb/genes/HGNC:1938","megaconial type congenital muscular dystrophy","MONDO:0011246","https://search.clinicalgenome.org/kb/conditions/MONDO:0011246","N/A","30 - Gene Associated with Autosomal Recessive Phenotype (08/22/2016)","0 - No Evidence for Haploinsufficiency (08/22/2016)","https://search.clinicalgenome.org/kb/gene-dosage/HGNC:1938","Dosage Working Group","","","","","",""
"CHM","HGNC:1940","https://search.clinicalgenome.org/kb/genes/HGNC:1940","choroideremia","MONDO:0010557","https://search.clinicalgenome.org/kb/conditions/MONDO:0010557","X-linked inheritance","3 - Sufficient Evidence for Haploinsufficiency (03/24/2021)","0 - No Evidence for Haploinsufficiency (03/24/2021)","https://search.clinicalgenome.org/kb/gene-dosage/HGNC:1940","Dosage Working Group","definitive evidence (10/26/2020)","https://search.clinicalgenome.org/kb/gene-validity/CGGV:assertion_d84b01d6-8b3c-4a1e-bd25-68ee6962f374-2020-10-26T124704.094Z","Retina","","",""
"CHMP1A","HGNC:8740","https://search.clinicalgenome.org/kb/genes/HGNC:8740","pontocerebellar hypoplasia type 8","MONDO:0013990","https://search.clinicalgenome.org/kb/conditions/MONDO:0013990","N/A","30 - Gene Associated with Autosomal Recessive Phenotype (08/22/2016)","0 - No Evidence for Haploinsufficiency (08/22/2016)","https://search.clinicalgenome.org/kb/gene-dosage/HGNC:8740","Dosage Working Group","","","","","",""
"CHMP2B","HGNC:24537","https://search.clinicalgenome.org/kb/genes/HGNC:24537","frontotemporal dementia and/or amyotrophic lateral sclerosis 7","MONDO:0010936","https://search.clinicalgenome.org/kb/conditions/MONDO:0010936","Autosomal dominant inheritance","","","","","definitive evidence (07/12/2022)","https://search.clinicalgenome.org/kb/gene-validity/CGGV:assertion_287cab44-b8b6-411c-903a-6214ac5e98af-2022-07-12T160000.000Z","Amyotrophic Lateral Sclerosis Spectrum Disorders","","",""
"CHRDL1","HGNC:29861","https://search.clinicalgenome.org/kb/genes/HGNC:29861","isolated congenital megalocornea","MONDO:0010649","https://search.clinicalgenome.org/kb/conditions/MONDO:0010649","N/A","3 - Sufficient Evidence for Haploinsufficiency (12/08/2016)","0 - No Evidence for Haploinsufficiency (12/08/2016)","https://search.clinicalgenome.org/kb/gene-dosage/HGNC:29861","Dosage Working Group","","","","","",""
"CHRNA2","HGNC:1956","https://search.clinicalgenome.org/kb/genes/HGNC:1956","sleep-related hypermotor epilepsy","MONDO:0000030","https://search.clinicalgenome.org/kb/conditions/MONDO:0000030","Autosomal dominant inheritance","","","","","limited evidence (12/25/2020)","https://search.clinicalgenome.org/kb/gene-validity/CGGV:assertion_0f832b8a-af5a-494e-bfdb-70cc619addf1-2020-12-25T015652.186Z","Epilepsy","","",""
"CHRNA2","HGNC:1956","https://search.clinicalgenome.org/kb/genes/HGNC:1956","epilepsy","MONDO:0005027","https://search.clinicalgenome.org/kb/conditions/MONDO:0005027","Autosomal dominant inheritance","","","","","disputing (12/24/2020)","https://search.clinicalgenome.org/kb/gene-validity/CGGV:assertion_ce166e6d-92ad-49fc-a3c3-e473b0cabf0d-2020-12-24T170000.000Z","Epilepsy","","",""
"CHRNA2","HGNC:1956","https://search.clinicalgenome.org/kb/genes/HGNC:1956","obsolete benign familial neonatal-infantile seizures","MONDO:0011140","https://search.clinicalgenome.org/kb/conditions/MONDO:0011140","Autosomal dominant inheritance","","","","","disputing (01/07/2020)","https://search.clinicalgenome.org/kb/gene-validity/CGGV:assertion_7916abab-d963-4e9c-8913-1decc21b680c-2020-01-07T170000.000Z","Epilepsy","","",""
"CHRNA4","HGNC:1958","https://search.clinicalgenome.org/kb/genes/HGNC:1958","sleep-related hypermotor epilepsy","MONDO:0000030","https://search.clinicalgenome.org/kb/conditions/MONDO:0000030","Autosomal dominant inheritance","","","","","definitive evidence (02/18/2020)","https://search.clinicalgenome.org/kb/gene-validity/CGGV:assertion_e3aa0108-5514-48ba-a09c-5506b2030d1f-2020-02-18T170000.000Z","Epilepsy","","",""
"CHST6","HGNC:6938","https://search.clinicalgenome.org/kb/genes/HGNC:6938","macular corneal dystrophy","MONDO:0009020","https://search.clinicalgenome.org/kb/conditions/MONDO:0009020","N/A","30 - Gene Associated with Autosomal Recessive Phenotype (08/22/2016)","0 - No Evidence for Haploinsufficiency (08/22/2016)","https://search.clinicalgenome.org/kb/gene-dosage/HGNC:6938","Dosage Working Group","","","","","",""
"CHSY1","HGNC:17198","https://search.clinicalgenome.org/kb/genes/HGNC:17198","temtamy preaxial brachydactyly syndrome","MONDO:0011533","https://search.clinicalgenome.org/kb/conditions/MONDO:0011533","N/A","30 - Gene Associated with Autosomal Recessive Phenotype (08/22/2016)","0 - No Evidence for Haploinsufficiency (08/22/2016)","https://search.clinicalgenome.org/kb/gene-dosage/HGNC:17198","Dosage Working Group","","","","","",""
"CIB2","HGNC:24579","https://search.clinicalgenome.org/kb/genes/HGNC:24579","Usher syndrome type 1","MONDO:0010168","https://search.clinicalgenome.org/kb/conditions/MONDO:0010168","Autosomal recessive inheritance","","","","","refuting evidence (02/19/2019)","https://search.clinicalgenome.org/kb/gene-validity/CGGV:assertion_95709038-78a4-4043-a054-9cbe245d2588-2019-02-19T170000.000Z","Hearing Loss","","",""
"CIB2","HGNC:24579","https://search.clinicalgenome.org/kb/genes/HGNC:24579","nonsyndromic genetic hearing loss","MONDO:0019497","https://search.clinicalgenome.org/kb/conditions/MONDO:0019497","Autosomal recessive inheritance","","","","","definitive evidence (02/20/2018)","https://search.clinicalgenome.org/kb/gene-validity/CGGV:assertion_d4187cb6-182f-43fc-aeec-d27297c36bdb-2018-02-20T170000.000Z","Hearing Loss","Strong Actionability (10/29/2020)","https://search.clinicalgenome.org/kb/gene-validity/https://actionability.clinicalgenome.org/ac/Pediatric/ui/stg2SummaryRpt?doc=AC1018","Pediatric Actionability Working Group"
"CIB2","HGNC:24579","https://search.clinicalgenome.org/kb/genes/HGNC:24579","autosomal recessive nonsyndromic hearing loss 48","MONDO:0012273","https://search.clinicalgenome.org/kb/conditions/MONDO:0012273","N/A","","","","","","","","Strong Actionability (10/29/2020)","https://search.clinicalgenome.org/kb/gene-validity/https://actionability.clinicalgenome.org/ac/Pediatric/ui/stg2SummaryRpt?doc=AC1018","Pediatric Actionability Working Group"
"CIB2","HGNC:24579","https://search.clinicalgenome.org/kb/genes/HGNC:24579","hearing loss, autosomal recessive","MONDO:0019588","https://search.clinicalgenome.org/kb/conditions/MONDO:0019588","N/A","","","","","","","","Strong Actionability (10/29/2020)","https://search.clinicalgenome.org/kb/gene-validity/https://actionability.clinicalgenome.org/ac/Pediatric/ui/stg2SummaryRpt?doc=AC1018","Pediatric Actionability Working Group"
"CIB2","HGNC:24579","https://search.clinicalgenome.org/kb/genes/HGNC:24579","prelingual non-syndromic genetic hearing loss","MONDO:0016297","https://search.clinicalgenome.org/kb/conditions/MONDO:0016297","N/A","","","","","","","","Strong Actionability (10/29/2020)","https://search.clinicalgenome.org/kb/gene-validity/https://actionability.clinicalgenome.org/ac/Pediatric/ui/stg2SummaryRpt?doc=AC1018","Pediatric Actionability Working Group"
"CIC","HGNC:14214","https://search.clinicalgenome.org/kb/genes/HGNC:14214","intellectual disability, autosomal dominant 45","MONDO:0030910","https://search.clinicalgenome.org/kb/conditions/MONDO:0030910","N/A","2 - Emerging Evidence for Haploinsufficiency (08/17/2019)","0 - No Evidence for Haploinsufficiency (08/17/2019)","https://search.clinicalgenome.org/kb/gene-dosage/HGNC:14214","Dosage Working Group","","","","","",""
"CIDEC","HGNC:24229","https://search.clinicalgenome.org/kb/genes/HGNC:24229","CIDEC-related familial partial lipodystrophy","MONDO:0014098","https://search.clinicalgenome.org/kb/conditions/MONDO:0014098","N/A","30 - Gene Associated with Autosomal Recessive Phenotype (08/22/2016)","0 - No Evidence for Haploinsufficiency (08/22/2016)","https://search.clinicalgenome.org/kb/gene-dosage/HGNC:24229","Dosage Working Group","","","","","",""
"CISD2","HGNC:24212","https://search.clinicalgenome.org/kb/genes/HGNC:24212","Wolfram syndrome","MONDO:0018105","https://search.clinicalgenome.org/kb/conditions/MONDO:0018105","Autosomal recessive inheritance","","","","","strong evidence (03/27/2018)","https://search.clinicalgenome.org/kb/gene-validity/CGGV:assertion_0a18d59c-c00c-4bb3-b6d6-1e59b92d1313-2018-03-27T160000.000Z","Hearing Loss","","",""
"CITED2","HGNC:1987","https://search.clinicalgenome.org/kb/genes/HGNC:1987","congenital heart defects, multiple types","MONDO:0000119","https://search.clinicalgenome.org/kb/conditions/MONDO:0000119","N/A","2 - Emerging Evidence for Haploinsufficiency (06/22/2022)","0 - No Evidence for Haploinsufficiency (06/22/2022)","https://search.clinicalgenome.org/kb/gene-dosage/HGNC:1987","Dosage Working Group","","","","","",""
"CLCF1","HGNC:17412","https://search.clinicalgenome.org/kb/genes/HGNC:17412","cold-induced sweating syndrome 2","MONDO:0012467","https://search.clinicalgenome.org/kb/conditions/MONDO:0012467","N/A","30 - Gene Associated with Autosomal Recessive Phenotype (08/22/2016)","","https://search.clinicalgenome.org/kb/gene-dosage/HGNC:17412","Dosage Working Group","","","","","",""
"CLCN4","HGNC:2022","https://search.clinicalgenome.org/kb/genes/HGNC:2022","non-syndromic X-linked intellectual disability","MONDO:0019181","https://search.clinicalgenome.org/kb/conditions/MONDO:0019181","X-linked inheritance","1 - Little Evidence for Haploinsufficiency (07/27/2022)","0 - No Evidence for Haploinsufficiency (07/27/2022)","https://search.clinicalgenome.org/kb/gene-dosage/HGNC:2022","Dosage Working Group","definitive evidence (10/20/2017)","https://search.clinicalgenome.org/kb/gene-validity/CGGV:assertion_54fbcbc8-77d7-4496-8527-1171cdd7452c-2017-10-20T160000.000Z","Intellectual Disability and Autism","","",""
"CLCN4","HGNC:2022","https://search.clinicalgenome.org/kb/genes/HGNC:2022","intellectual disability, X-linked 49","MONDO:0010250","https://search.clinicalgenome.org/kb/conditions/MONDO:0010250","N/A","1 - Little Evidence for Haploinsufficiency (07/27/2022)","0 - No Evidence for Haploinsufficiency (07/27/2022)","https://search.clinicalgenome.org/kb/gene-dosage/HGNC:2022","Dosage Working Group","","","","","",""
"CLCN5","HGNC:2023","https://search.clinicalgenome.org/kb/genes/HGNC:2023","Dent disease type 1","MONDO:0010225","https://search.clinicalgenome.org/kb/conditions/MONDO:0010225","N/A","3 - Sufficient Evidence for Haploinsufficiency (10/18/2012)","0 - No Evidence for Haploinsufficiency (10/18/2012)","https://search.clinicalgenome.org/kb/gene-dosage/HGNC:2023","Dosage Working Group","","","","","",""
"CLCNKA","HGNC:2026","https://search.clinicalgenome.org/kb/genes/HGNC:2026","Bartter disease type 4B","MONDO:0000909","https://search.clinicalgenome.org/kb/conditions/MONDO:0000909","N/A","30 - Gene Associated with Autosomal Recessive Phenotype (05/17/2012)","0 - No Evidence for Haploinsufficiency (05/17/2012)","https://search.clinicalgenome.org/kb/gene-dosage/HGNC:2026","Dosage Working Group","","","","","",""
"CLCNKB","HGNC:2027","https://search.clinicalgenome.org/kb/genes/HGNC:2027","Bartter disease type 3","MONDO:0011822","https://search.clinicalgenome.org/kb/conditions/MONDO:0011822","N/A","30 - Gene Associated with Autosomal Recessive Phenotype (11/17/2011)","0 - No Evidence for Haploinsufficiency (11/17/2011)","https://search.clinicalgenome.org/kb/gene-dosage/HGNC:2027","Dosage Working Group","","","","","",""
"CLDN14","HGNC:2035","https://search.clinicalgenome.org/kb/genes/HGNC:2035","nonsyndromic genetic hearing loss","MONDO:0019497","https://search.clinicalgenome.org/kb/conditions/MONDO:0019497","Autosomal recessive inheritance","30 - Gene Associated with Autosomal Recessive Phenotype (08/22/2016)","0 - No Evidence for Haploinsufficiency (08/22/2016)","https://search.clinicalgenome.org/kb/gene-dosage/HGNC:2035","Dosage Working Group","definitive evidence (05/01/2018)","https://search.clinicalgenome.org/kb/gene-validity/CGGV:assertion_17528cdb-97e0-4128-92de-9e419902aa62-2018-05-01T160000.000Z","Hearing Loss","Strong Actionability (10/29/2020)","https://search.clinicalgenome.org/kb/gene-validity/https://actionability.clinicalgenome.org/ac/Pediatric/ui/stg2SummaryRpt?doc=AC1018","Pediatric Actionability Working Group"
"CLDN14","HGNC:2035","https://search.clinicalgenome.org/kb/genes/HGNC:2035","hearing loss, autosomal recessive","MONDO:0019588","https://search.clinicalgenome.org/kb/conditions/MONDO:0019588","N/A","30 - Gene Associated with Autosomal Recessive Phenotype (08/22/2016)","0 - No Evidence for Haploinsufficiency (08/22/2016)","https://search.clinicalgenome.org/kb/gene-dosage/HGNC:2035","Dosage Working Group","","","","Strong Actionability (10/29/2020)","https://search.clinicalgenome.org/kb/gene-validity/https://actionability.clinicalgenome.org/ac/Pediatric/ui/stg2SummaryRpt?doc=AC1018","Pediatric Actionability Working Group"
"CLDN14","HGNC:2035","https://search.clinicalgenome.org/kb/genes/HGNC:2035","prelingual non-syndromic genetic hearing loss","MONDO:0016297","https://search.clinicalgenome.org/kb/conditions/MONDO:0016297","N/A","30 - Gene Associated with Autosomal Recessive Phenotype (08/22/2016)","0 - No Evidence for Haploinsufficiency (08/22/2016)","https://search.clinicalgenome.org/kb/gene-dosage/HGNC:2035","Dosage Working Group","","","","Strong Actionability (10/29/2020)","https://search.clinicalgenome.org/kb/gene-validity/https://actionability.clinicalgenome.org/ac/Pediatric/ui/stg2SummaryRpt?doc=AC1018","Pediatric Actionability Working Group"
"CLDN14","HGNC:2035","https://search.clinicalgenome.org/kb/genes/HGNC:2035","autosomal recessive nonsyndromic hearing loss 29","MONDO:0013537","https://search.clinicalgenome.org/kb/conditions/MONDO:0013537","N/A","30 - Gene Associated with Autosomal Recessive Phenotype (08/22/2016)","0 - No Evidence for Haploinsufficiency (08/22/2016)","https://search.clinicalgenome.org/kb/gene-dosage/HGNC:2035","Dosage Working Group","","","","Strong Actionability (10/29/2020)","https://search.clinicalgenome.org/kb/gene-validity/https://actionability.clinicalgenome.org/ac/Pediatric/ui/stg2SummaryRpt?doc=AC1018","Pediatric Actionability Working Group"
"CLIC2","HGNC:2063","https://search.clinicalgenome.org/kb/genes/HGNC:2063","X-linked complex neurodevelopmental disorder","MONDO:0100148","https://search.clinicalgenome.org/kb/conditions/MONDO:0100148","X-linked inheritance","","","","","disputing (02/16/2021)","https://search.clinicalgenome.org/kb/gene-validity/CGGV:assertion_3e8ec6b8-5189-43eb-a741-833c77e7ce91-2021-02-16T170000.000Z","Intellectual Disability and Autism","","",""
"CLMP","HGNC:24039","https://search.clinicalgenome.org/kb/genes/HGNC:24039","congenital short bowel syndrome, autosomal recessive","MONDO:0020718","https://search.clinicalgenome.org/kb/conditions/MONDO:0020718","N/A","30 - Gene Associated with Autosomal Recessive Phenotype (08/22/2016)","0 - No Evidence for Haploinsufficiency (08/22/2016)","https://search.clinicalgenome.org/kb/gene-dosage/HGNC:24039","Dosage Working Group","","","","","",""
"CLN3","HGNC:2074","https://search.clinicalgenome.org/kb/genes/HGNC:2074","neuronal ceroid lipofuscinosis 3","MONDO:0008767","https://search.clinicalgenome.org/kb/conditions/MONDO:0008767","N/A","30 - Gene Associated with Autosomal Recessive Phenotype (08/22/2016)","","https://search.clinicalgenome.org/kb/gene-dosage/HGNC:2074","Dosage Working Group","","","","","",""
"CLN5","HGNC:2076","https://search.clinicalgenome.org/kb/genes/HGNC:2076","neuronal ceroid lipofuscinosis","MONDO:0016295","https://search.clinicalgenome.org/kb/conditions/MONDO:0016295","Autosomal recessive inheritance","","","","","definitive evidence (09/08/2021)","https://search.clinicalgenome.org/kb/gene-validity/CGGV:assertion_a522b1d6-5ade-4749-94b8-d5426bbe5961-2021-09-08T023930.981Z","Epilepsy","","",""
"CLN6","HGNC:2077","https://search.clinicalgenome.org/kb/genes/HGNC:2077","neuronal ceroid lipofuscinosis","MONDO:0016295","https://search.clinicalgenome.org/kb/conditions/MONDO:0016295","Autosomal recessive inheritance","","","","","definitive evidence (12/01/2020)","https://search.clinicalgenome.org/kb/gene-validity/CGGV:assertion_09654b45-6649-4d11-b43e-aeb6d20fb86d-2020-12-01T170000.000Z","Epilepsy","","",""
"CLN8","HGNC:2079","https://search.clinicalgenome.org/kb/genes/HGNC:2079","neuronal ceroid lipofuscinosis","MONDO:0016295","https://search.clinicalgenome.org/kb/conditions/MONDO:0016295","Autosomal recessive inheritance","30 - Gene Associated with Autosomal Recessive Phenotype (08/22/2016)","","https://search.clinicalgenome.org/kb/gene-dosage/HGNC:2079","Dosage Working Group","definitive evidence (09/07/2020)","https://search.clinicalgenome.org/kb/gene-validity/CGGV:assertion_68775ed0-576e-4ee7-90f2-d16329ecd7c1-2020-09-07T220116.243Z","Epilepsy","","",""
"CLN8","HGNC:2079","https://search.clinicalgenome.org/kb/genes/HGNC:2079","neuronal ceroid lipofuscinosis 8","MONDO:0010830","https://search.clinicalgenome.org/kb/conditions/MONDO:0010830","N/A","30 - Gene Associated with Autosomal Recessive Phenotype (08/22/2016)","","https://search.clinicalgenome.org/kb/gene-dosage/HGNC:2079","Dosage Working Group","","","","","",""
"CLPB","HGNC:30664","https://search.clinicalgenome.org/kb/genes/HGNC:30664","Leigh syndrome","MONDO:0009723","https://search.clinicalgenome.org/kb/conditions/MONDO:0009723","Autosomal recessive inheritance","","","","","limited evidence (11/23/2020)","https://search.clinicalgenome.org/kb/gene-validity/CGGV:assertion_789c591d-1de7-4652-a0d1-f895b639233e-2020-11-23T201057.415Z","Mitochondrial Diseases","","",""
"CLPP","HGNC:2084","https://search.clinicalgenome.org/kb/genes/HGNC:2084","Perrault syndrome 3","MONDO:0013588","https://search.clinicalgenome.org/kb/conditions/MONDO:0013588","Autosomal recessive inheritance","30 - Gene Associated with Autosomal Recessive Phenotype (03/06/2018)","0 - No Evidence for Haploinsufficiency (03/06/2018)","https://search.clinicalgenome.org/kb/gene-dosage/HGNC:2084","Dosage Working Group","definitive evidence (03/27/2018)","https://search.clinicalgenome.org/kb/gene-validity/CGGV:assertion_15291cb2-a541-4f88-91c8-0b441e3b64cb-2018-03-27T160000.000Z","Hearing Loss","","",""
"CLRN1","HGNC:12605","https://search.clinicalgenome.org/kb/genes/HGNC:12605","Usher syndrome type 3","MONDO:0016485","https://search.clinicalgenome.org/kb/conditions/MONDO:0016485","Autosomal recessive inheritance","30 - Gene Associated with Autosomal Recessive Phenotype (08/22/2016)","0 - No Evidence for Haploinsufficiency (08/22/2016)","https://search.clinicalgenome.org/kb/gene-dosage/HGNC:12605","Dosage Working Group","definitive evidence (03/02/2017)","https://search.clinicalgenome.org/kb/gene-validity/CGGCIEX:assertion_8400","Hearing Loss","","",""
"CLRN1","HGNC:12605","https://search.clinicalgenome.org/kb/genes/HGNC:12605","Usher syndrome type 3A","MONDO:0010170","https://search.clinicalgenome.org/kb/conditions/MONDO:0010170","N/A","30 - Gene Associated with Autosomal Recessive Phenotype (08/22/2016)","0 - No Evidence for Haploinsufficiency (08/22/2016)","https://search.clinicalgenome.org/kb/gene-dosage/HGNC:12605","Dosage Working Group","","","","","",""
"CNGA3","HGNC:2150","https://search.clinicalgenome.org/kb/genes/HGNC:2150","CNGA3-related retinopathy","MONDO:0800102","https://search.clinicalgenome.org/kb/conditions/MONDO:0800102","Autosomal recessive inheritance","","","","","definitive evidence (02/03/2022)","https://search.clinicalgenome.org/kb/gene-validity/CGGV:assertion_39fe36b7-54c3-486b-a9f9-19bce71f096e-2022-02-03T170000.000Z","Retina","","",""
"CNGB1","HGNC:2151","https://search.clinicalgenome.org/kb/genes/HGNC:2151","retinitis pigmentosa 45","MONDO:0013413","https://search.clinicalgenome.org/kb/conditions/MONDO:0013413","N/A","30 - Gene Associated with Autosomal Recessive Phenotype (08/22/2016)","","https://search.clinicalgenome.org/kb/gene-dosage/HGNC:2151","Dosage Working Group","","","","","",""
"CNGB3","HGNC:2153","https://search.clinicalgenome.org/kb/genes/HGNC:2153","CNGB3-related retinopathy","MONDO:0100446","https://search.clinicalgenome.org/kb/conditions/MONDO:0100446","Autosomal recessive inheritance","","","","","definitive evidence (05/24/2022)","https://search.clinicalgenome.org/kb/gene-validity/CGGV:assertion_aa7bad05-3d4d-4a69-b4e9-82f9224a77f4-2022-05-24T171317.094Z","Retina","","",""
"CNKSR2","HGNC:19701","https://search.clinicalgenome.org/kb/genes/HGNC:19701","X-linked complex neurodevelopmental disorder","MONDO:0100148","https://search.clinicalgenome.org/kb/conditions/MONDO:0100148","X-linked inheritance","3 - Sufficient Evidence for Haploinsufficiency (01/12/2021)","0 - No Evidence for Haploinsufficiency (01/12/2021)","https://search.clinicalgenome.org/kb/gene-dosage/HGNC:19701","Dosage Working Group","definitive evidence (12/16/2020)","https://search.clinicalgenome.org/kb/gene-validity/CGGV:assertion_420ee599-c745-43b9-b9a9-c80dfd7f68a8-2020-12-16T170000.000Z","Intellectual Disability and Autism","","",""
"CNKSR2","HGNC:19701","https://search.clinicalgenome.org/kb/genes/HGNC:19701","intellectual disability, X-linked, syndromic, Houge type","MONDO:0030909","https://search.clinicalgenome.org/kb/conditions/MONDO:0030909","N/A","3 - Sufficient Evidence for Haploinsufficiency (01/12/2021)","0 - No Evidence for Haploinsufficiency (01/12/2021)","https://search.clinicalgenome.org/kb/gene-dosage/HGNC:19701","Dosage Working Group","","","","","",""
"CNNM4","HGNC:105","https://search.clinicalgenome.org/kb/genes/HGNC:105","Jalili syndrome","MONDO:0009007","https://search.clinicalgenome.org/kb/conditions/MONDO:0009007","Autosomal recessive inheritance","30 - Gene Associated with Autosomal Recessive Phenotype (08/22/2016)","","https://search.clinicalgenome.org/kb/gene-dosage/HGNC:105","Dosage Working Group","definitive evidence (08/06/2021)","https://search.clinicalgenome.org/kb/gene-validity/CGGV:assertion_e3cedd07-df9e-4838-8a6b-b24b2802f223-2021-08-06T154836.361Z","Retina","","",""
"CNOT3","HGNC:7879","https://search.clinicalgenome.org/kb/genes/HGNC:7879","complex neurodevelopmental disorder","MONDO:0100038","https://search.clinicalgenome.org/kb/conditions/MONDO:0100038","Autosomal dominant inheritance","0 - No Evidence for Haploinsufficiency (06/27/2018)","0 - No Evidence for Haploinsufficiency (06/27/2018)","https://search.clinicalgenome.org/kb/gene-dosage/HGNC:7879","Dosage Working Group","definitive evidence (08/24/2021)","https://search.clinicalgenome.org/kb/gene-validity/CGGV:assertion_585384c5-8958-4934-af26-4040774a644c-2021-08-24T160000.000Z","Intellectual Disability and Autism","","",""
"CNTN1","HGNC:2171","https://search.clinicalgenome.org/kb/genes/HGNC:2171","Compton-North congenital myopathy","MONDO:0012929","https://search.clinicalgenome.org/kb/conditions/MONDO:0012929","N/A","30 - Gene Associated with Autosomal Recessive Phenotype (08/22/2016)","","https://search.clinicalgenome.org/kb/gene-dosage/HGNC:2171","Dosage Working Group","","","","","",""
"CNTN2","HGNC:2172","https://search.clinicalgenome.org/kb/genes/HGNC:2172","epilepsy, familial adult myoclonic, 5","MONDO:0014167","https://search.clinicalgenome.org/kb/conditions/MONDO:0014167","N/A","30 - Gene Associated with Autosomal Recessive Phenotype (08/22/2016)","0 - No Evidence for Haploinsufficiency (08/22/2016)","https://search.clinicalgenome.org/kb/gene-dosage/HGNC:2172","Dosage Working Group","","","","","",""
"CNTN4","HGNC:2174","https://search.clinicalgenome.org/kb/genes/HGNC:2174","complex neurodevelopmental disorder","MONDO:0100038","https://search.clinicalgenome.org/kb/conditions/MONDO:0100038","N/A","0 - No Evidence for Haploinsufficiency (06/14/2022)","0 - No Evidence for Haploinsufficiency (06/14/2022)","https://search.clinicalgenome.org/kb/gene-dosage/HGNC:2174","Dosage Working Group","","","","","",""
"CNTNAP2","HGNC:13830","https://search.clinicalgenome.org/kb/genes/HGNC:13830","complex neurodevelopmental disorder","MONDO:0100038","https://search.clinicalgenome.org/kb/conditions/MONDO:0100038","Autosomal dominant inheritance | Autosomal recessive inheritance","1 - Little Evidence for Haploinsufficiency (10/23/2019)","0 - No Evidence for Haploinsufficiency (10/23/2019)","https://search.clinicalgenome.org/kb/gene-dosage/HGNC:13830","Dosage Working Group","disputing (03/16/2021) | definitive evidence (06/15/2021)","https://search.clinicalgenome.org/kb/gene-validity/CGGV:assertion_e91dc4be-821d-4f54-acdd-755a25070eec-2021-03-16T160000.000Z | https://search.clinicalgenome.org/kb/gene-validity/CGGV:assertion_3af732e2-062d-4bb3-a3cd-2045e460dc8f-2021-06-15T160000.000Z","Intellectual Disability and Autism | Epilepsy","","",""
"COCH","HGNC:2180","https://search.clinicalgenome.org/kb/genes/HGNC:2180","nonsyndromic genetic hearing loss","MONDO:0019497","https://search.clinicalgenome.org/kb/conditions/MONDO:0019497","Autosomal dominant inheritance","","","","","definitive evidence (01/05/2018)","https://search.clinicalgenome.org/kb/gene-validity/CGGV:assertion_998da390-3e32-4b80-a733-d64d87d5357b-2018-01-05T170000.000Z","Hearing Loss","","",""
"COG1","HGNC:6545","https://search.clinicalgenome.org/kb/genes/HGNC:6545","COG1-CDG","MONDO:0012637","https://search.clinicalgenome.org/kb/conditions/MONDO:0012637","N/A","30 - Gene Associated with Autosomal Recessive Phenotype (08/22/2016)","","https://search.clinicalgenome.org/kb/gene-dosage/HGNC:6545","Dosage Working Group","","","","","",""
"COG4","HGNC:18620","https://search.clinicalgenome.org/kb/genes/HGNC:18620","COG4-CDG","MONDO:0013281","https://search.clinicalgenome.org/kb/conditions/MONDO:0013281","N/A","30 - Gene Associated with Autosomal Recessive Phenotype (08/22/2016)","","https://search.clinicalgenome.org/kb/gene-dosage/HGNC:18620","Dosage Working Group","","","","","",""
"COG7","HGNC:18622","https://search.clinicalgenome.org/kb/genes/HGNC:18622","COG7-CDG","MONDO:0012118","https://search.clinicalgenome.org/kb/conditions/MONDO:0012118","N/A","30 - Gene Associated with Autosomal Recessive Phenotype (04/09/2015)","0 - No Evidence for Haploinsufficiency (04/09/2015)","https://search.clinicalgenome.org/kb/gene-dosage/HGNC:18622","Dosage Working Group","","","","","",""
"COG8","HGNC:18623","https://search.clinicalgenome.org/kb/genes/HGNC:18623","COG8-CDG","MONDO:0012635","https://search.clinicalgenome.org/kb/conditions/MONDO:0012635","N/A","30 - Gene Associated with Autosomal Recessive Phenotype (03/25/2015)","0 - No Evidence for Haploinsufficiency (03/25/2015)","https://search.clinicalgenome.org/kb/gene-dosage/HGNC:18623","Dosage Working Group","","","","","",""
"COL11A1","HGNC:2186","https://search.clinicalgenome.org/kb/genes/HGNC:2186","Stickler syndrome type 2","MONDO:0011493","https://search.clinicalgenome.org/kb/conditions/MONDO:0011493","N/A","1 - Little Evidence for Haploinsufficiency (10/19/2011)","0 - No Evidence for Haploinsufficiency (10/19/2011)","https://search.clinicalgenome.org/kb/gene-dosage/HGNC:2186","Dosage Working Group","","","","","",""
"COL11A2","HGNC:2187","https://search.clinicalgenome.org/kb/genes/HGNC:2187","otospondylomegaepiphyseal dysplasia","MONDO:0008975","https://search.clinicalgenome.org/kb/conditions/MONDO:0008975","Autosomal recessive inheritance | Autosomal dominant inheritance","","","","","definitive evidence (12/20/2018) | definitive evidence (12/20/2018)","https://search.clinicalgenome.org/kb/gene-validity/CGGV:assertion_27b13a91-0a04-4393-bf1c-4f8418154c9b-2018-12-20T170000.000Z | https://search.clinicalgenome.org/kb/gene-validity/CGGV:assertion_177bddd8-0566-4f80-a9f1-679ca96a7c60-2018-12-20T170000.000Z","Hearing Loss | Hearing Loss","","",""
"COL11A2","HGNC:2187","https://search.clinicalgenome.org/kb/genes/HGNC:2187","nonsyndromic genetic hearing loss","MONDO:0019497","https://search.clinicalgenome.org/kb/conditions/MONDO:0019497","Autosomal recessive inheritance | Autosomal dominant inheritance","","","","","moderate evidence (12/20/2018) | moderate evidence (12/20/2018)","https://search.clinicalgenome.org/kb/gene-validity/CGGV:assertion_561327b9-7c55-40c3-b83c-5a3ed9d75606-2018-12-20T170000.000Z | https://search.clinicalgenome.org/kb/gene-validity/CGGV:assertion_0665772a-ba94-4561-b597-364f7db7e4ca-2018-12-20T170000.000Z","Hearing Loss | Hearing Loss","","",""
"COL1A1","HGNC:2197","https://search.clinicalgenome.org/kb/genes/HGNC:2197","osteogenesis imperfecta type 1","MONDO:0008146","https://search.clinicalgenome.org/kb/conditions/MONDO:0008146","Autosomal dominant inheritance","3 - Sufficient Evidence for Haploinsufficiency (08/23/2012)","0 - No Evidence for Haploinsufficiency (08/23/2012)","https://search.clinicalgenome.org/kb/gene-dosage/HGNC:2197","Dosage Working Group","definitive evidence (03/16/2021)","https://search.clinicalgenome.org/kb/gene-validity/CGGV:assertion_74914fec-a5c4-437c-8c83-66c9f1df3e6e-2021-03-16T235154.009Z","Skeletal Disorders","","",""
"COL1A1","HGNC:2197","https://search.clinicalgenome.org/kb/genes/HGNC:2197","osteogenesis imperfecta type 2","MONDO:0008147","https://search.clinicalgenome.org/kb/conditions/MONDO:0008147","Autosomal dominant inheritance","3 - Sufficient Evidence for Haploinsufficiency (08/23/2012)","0 - No Evidence for Haploinsufficiency (08/23/2012)","https://search.clinicalgenome.org/kb/gene-dosage/HGNC:2197","Dosage Working Group","definitive evidence (03/22/2021)","https://search.clinicalgenome.org/kb/gene-validity/CGGV:assertion_0b093295-1c7c-4526-90eb-d6a9fff1cc75-2021-03-22T211103.977Z","Skeletal Disorders","","",""
"COL1A1","HGNC:2197","https://search.clinicalgenome.org/kb/genes/HGNC:2197","osteogenesis imperfecta type 3","MONDO:0009804","https://search.clinicalgenome.org/kb/conditions/MONDO:0009804","Autosomal dominant inheritance","3 - Sufficient Evidence for Haploinsufficiency (08/23/2012)","0 - No Evidence for Haploinsufficiency (08/23/2012)","https://search.clinicalgenome.org/kb/gene-dosage/HGNC:2197","Dosage Working Group","definitive evidence (06/24/2021)","https://search.clinicalgenome.org/kb/gene-validity/CGGV:assertion_a51b8f9f-0e11-4d82-b454-15d27e974dd7-2021-06-24T204605.941Z","Skeletal Disorders","","",""
"COL2A1","HGNC:2200","https://search.clinicalgenome.org/kb/genes/HGNC:2200","spondyloepiphyseal dysplasia, Stanescu type","MONDO:0014701","https://search.clinicalgenome.org/kb/conditions/MONDO:0014701","Autosomal dominant inheritance","3 - Sufficient Evidence for Haploinsufficiency (07/29/2020)","0 - No Evidence for Haploinsufficiency (07/29/2020)","https://search.clinicalgenome.org/kb/gene-dosage/HGNC:2200","Dosage Working Group","moderate evidence (12/01/2016)","https://search.clinicalgenome.org/kb/gene-validity/CGGCIEX:assertion_4843","General Gene Curation","","",""
"COL2A1","HGNC:2200","https://search.clinicalgenome.org/kb/genes/HGNC:2200","achondrogenesis type II","MONDO:0008702","https://search.clinicalgenome.org/kb/conditions/MONDO:0008702","Autosomal dominant inheritance","3 - Sufficient Evidence for Haploinsufficiency (07/29/2020)","0 - No Evidence for Haploinsufficiency (07/29/2020)","https://search.clinicalgenome.org/kb/gene-dosage/HGNC:2200","Dosage Working Group","definitive evidence (10/05/2020)","https://search.clinicalgenome.org/kb/gene-validity/CGGV:assertion_14640c06-c66e-4dc7-86ea-9b0850e51474-2020-10-05T170000.000Z","Skeletal Disorders","","",""
"COL2A1","HGNC:2200","https://search.clinicalgenome.org/kb/genes/HGNC:2200","platyspondylic dysplasia, Torrance type","MONDO:0007895","https://search.clinicalgenome.org/kb/conditions/MONDO:0007895","Autosomal dominant inheritance","3 - Sufficient Evidence for Haploinsufficiency (07/29/2020)","0 - No Evidence for Haploinsufficiency (07/29/2020)","https://search.clinicalgenome.org/kb/gene-dosage/HGNC:2200","Dosage Working Group","definitive evidence (02/01/2021)","https://search.clinicalgenome.org/kb/gene-validity/CGGV:assertion_a4c42c43-7b6a-4456-aeb1-7a00302a468b-2021-02-01T180000.000Z","Skeletal Disorders","","",""
"COL2A1","HGNC:2200","https://search.clinicalgenome.org/kb/genes/HGNC:2200","spondylometaphyseal dysplasia","MONDO:0016763","https://search.clinicalgenome.org/kb/conditions/MONDO:0016763","Autosomal dominant inheritance","3 - Sufficient Evidence for Haploinsufficiency (07/29/2020)","0 - No Evidence for Haploinsufficiency (07/29/2020)","https://search.clinicalgenome.org/kb/gene-dosage/HGNC:2200","Dosage Working Group","definitive evidence (06/07/2021)","https://search.clinicalgenome.org/kb/gene-validity/CGGV:assertion_e5315530-5b3c-42f1-b18c-1884a0b767f6-2021-06-07T160000.000Z","Skeletal Disorders","","",""
"COL2A1","HGNC:2200","https://search.clinicalgenome.org/kb/genes/HGNC:2200","spondyloepiphyseal dysplasia congenita","MONDO:0008471","https://search.clinicalgenome.org/kb/conditions/MONDO:0008471","Autosomal dominant inheritance","3 - Sufficient Evidence for Haploinsufficiency (07/29/2020)","0 - No Evidence for Haploinsufficiency (07/29/2020)","https://search.clinicalgenome.org/kb/gene-dosage/HGNC:2200","Dosage Working Group","definitive evidence (06/07/2021)","https://search.clinicalgenome.org/kb/gene-validity/CGGV:assertion_0f217fba-a78c-4f9f-ad2a-301f0d53f046-2021-06-07T170000.000Z","Skeletal Disorders","","",""
"COL2A1","HGNC:2200","https://search.clinicalgenome.org/kb/genes/HGNC:2200","Kniest dysplasia","MONDO:0007987","https://search.clinicalgenome.org/kb/conditions/MONDO:0007987","Autosomal dominant inheritance","3 - Sufficient Evidence for Haploinsufficiency (07/29/2020)","0 - No Evidence for Haploinsufficiency (07/29/2020)","https://search.clinicalgenome.org/kb/gene-dosage/HGNC:2200","Dosage Working Group","definitive evidence (12/15/2021)","https://search.clinicalgenome.org/kb/gene-validity/CGGV:assertion_25a49ec9-69ab-4e51-a13a-fe1eaa50ae56-2021-12-15T183542.376Z","Skeletal Disorders","","",""
"COL2A1","HGNC:2200","https://search.clinicalgenome.org/kb/genes/HGNC:2200","spondyloperipheral dysplasia-short ulna syndrome","MONDO:0010078","https://search.clinicalgenome.org/kb/conditions/MONDO:0010078","Autosomal dominant inheritance","3 - Sufficient Evidence for Haploinsufficiency (07/29/2020)","0 - No Evidence for Haploinsufficiency (07/29/2020)","https://search.clinicalgenome.org/kb/gene-dosage/HGNC:2200","Dosage Working Group","definitive evidence (01/06/2022)","https://search.clinicalgenome.org/kb/gene-validity/CGGV:assertion_d4da6e1f-5aad-4541-a3ae-76ed4782a023-2022-01-06T154807.494Z","Skeletal Disorders","","",""
"COL2A1","HGNC:2200","https://search.clinicalgenome.org/kb/genes/HGNC:2200","Stickler syndrome type 1","MONDO:0007160","https://search.clinicalgenome.org/kb/conditions/MONDO:0007160","N/A","3 - Sufficient Evidence for Haploinsufficiency (07/29/2020)","0 - No Evidence for Haploinsufficiency (07/29/2020)","https://search.clinicalgenome.org/kb/gene-dosage/HGNC:2200","Dosage Working Group","","","","","",""
"COL3A1","HGNC:2201","https://search.clinicalgenome.org/kb/genes/HGNC:2201","Ehlers-Danlos syndrome, vascular type","MONDO:0017314","https://search.clinicalgenome.org/kb/conditions/MONDO:0017314","Autosomal dominant inheritance","3 - Sufficient Evidence for Haploinsufficiency (01/12/2017)","0 - No Evidence for Haploinsufficiency (01/12/2017)","https://search.clinicalgenome.org/kb/gene-dosage/HGNC:2201","Dosage Working Group","definitive evidence (02/27/2019)","https://search.clinicalgenome.org/kb/gene-validity/CGGV:assertion_ce795591-1c7c-4a52-886a-a294293c67c3-2019-02-27T170000.000Z","General Gene Curation","Moderate Actionability (09/02/2020) | Moderate Actionability (09/02/2020)","https://search.clinicalgenome.org/kb/gene-validity/https://actionability.clinicalgenome.org/ac/Adult/ui/stg2SummaryRpt?doc=AC132 | https://search.clinicalgenome.org/kb/gene-validity/https://actionability.clinicalgenome.org/ac/Pediatric/ui/stg2SummaryRpt?doc=AC132","Adult Actionability Working Group | Pediatric Actionability Working Group"
"COL3A1","HGNC:2201","https://search.clinicalgenome.org/kb/genes/HGNC:2201","autosomal dominant Ehlers-Danlos syndrome, vascular type","MONDO:0007524","https://search.clinicalgenome.org/kb/conditions/MONDO:0007524","N/A","3 - Sufficient Evidence for Haploinsufficiency (01/12/2017)","0 - No Evidence for Haploinsufficiency (01/12/2017)","https://search.clinicalgenome.org/kb/gene-dosage/HGNC:2201","Dosage Working Group","","","","Moderate Actionability (09/02/2020) | Moderate Actionability (09/02/2020)","https://search.clinicalgenome.org/kb/gene-validity/https://actionability.clinicalgenome.org/ac/Adult/ui/stg2SummaryRpt?doc=AC132 | https://search.clinicalgenome.org/kb/gene-validity/https://actionability.clinicalgenome.org/ac/Pediatric/ui/stg2SummaryRpt?doc=AC132","Adult Actionability Working Group | Pediatric Actionability Working Group"
"COL4A3","HGNC:2204","https://search.clinicalgenome.org/kb/genes/HGNC:2204","Alport syndrome","MONDO:0018965","https://search.clinicalgenome.org/kb/conditions/MONDO:0018965","Semidominant inheritance","30 - Gene Associated with Autosomal Recessive Phenotype (05/22/2013)","0 - No Evidence for Haploinsufficiency (05/22/2013)","https://search.clinicalgenome.org/kb/gene-dosage/HGNC:2204","Dosage Working Group","definitive evidence (07/26/2021)","https://search.clinicalgenome.org/kb/gene-validity/CGGV:assertion_e1ed7d3b-4366-4f4a-98f2-80e431e2d8da-2021-07-26T023000.000Z","Glomerulopathy","Strong Actionability (11/04/2021) | Strong Actionability (11/04/2021)","https://search.clinicalgenome.org/kb/gene-validity/https://actionability.clinicalgenome.org/ac/Adult/ui/stg2SummaryRpt?doc=AC1044 | https://search.clinicalgenome.org/kb/gene-validity/https://actionability.clinicalgenome.org/ac/Pediatric/ui/stg2SummaryRpt?doc=AC1044","Adult Actionability Working Group | Pediatric Actionability Working Group"
"COL4A3","HGNC:2204","https://search.clinicalgenome.org/kb/genes/HGNC:2204","autosomal recessive Alport syndrome","MONDO:0008762","https://search.clinicalgenome.org/kb/conditions/MONDO:0008762","N/A","30 - Gene Associated with Autosomal Recessive Phenotype (05/22/2013)","0 - No Evidence for Haploinsufficiency (05/22/2013)","https://search.clinicalgenome.org/kb/gene-dosage/HGNC:2204","Dosage Working Group","","","","","",""
"COL4A4","HGNC:2206","https://search.clinicalgenome.org/kb/genes/HGNC:2206","Alport syndrome","MONDO:0018965","https://search.clinicalgenome.org/kb/conditions/MONDO:0018965","Semidominant inheritance","","","","","definitive evidence (08/24/2021)","https://search.clinicalgenome.org/kb/gene-validity/CGGV:assertion_c235830a-a6f5-4cf6-b015-902da62f1b2e-2021-08-24T023000.000Z","Glomerulopathy","Strong Actionability (11/04/2021) | Strong Actionability (11/04/2021)","https://search.clinicalgenome.org/kb/gene-validity/https://actionability.clinicalgenome.org/ac/Adult/ui/stg2SummaryRpt?doc=AC1044 | https://search.clinicalgenome.org/kb/gene-validity/https://actionability.clinicalgenome.org/ac/Pediatric/ui/stg2SummaryRpt?doc=AC1044","Adult Actionability Working Group | Pediatric Actionability Working Group"
"COL4A5","HGNC:2207","https://search.clinicalgenome.org/kb/genes/HGNC:2207","Alport syndrome","MONDO:0018965","https://search.clinicalgenome.org/kb/conditions/MONDO:0018965","X-linked inheritance","3 - Sufficient Evidence for Haploinsufficiency (09/08/2020)","0 - No Evidence for Haploinsufficiency (09/08/2020)","https://search.clinicalgenome.org/kb/gene-dosage/HGNC:2207","Dosage Working Group","definitive evidence (03/19/2019)","https://search.clinicalgenome.org/kb/gene-validity/CGGV:assertion_0407dc2e-1cab-4043-889d-4695b043d7b3-2019-03-19T160000.000Z","Hearing Loss","Strong Actionability (11/04/2021) | Strong Actionability (11/04/2021)","https://search.clinicalgenome.org/kb/gene-validity/https://actionability.clinicalgenome.org/ac/Adult/ui/stg2SummaryRpt?doc=AC1044 | https://search.clinicalgenome.org/kb/gene-validity/https://actionability.clinicalgenome.org/ac/Pediatric/ui/stg2SummaryRpt?doc=AC1044","Adult Actionability Working Group | Pediatric Actionability Working Group"
"COL4A5","HGNC:2207","https://search.clinicalgenome.org/kb/genes/HGNC:2207","X-linked Alport syndrome","MONDO:0010520","https://search.clinicalgenome.org/kb/conditions/MONDO:0010520","N/A","3 - Sufficient Evidence for Haploinsufficiency (09/08/2020)","0 - No Evidence for Haploinsufficiency (09/08/2020)","https://search.clinicalgenome.org/kb/gene-dosage/HGNC:2207","Dosage Working Group","","","","","",""
"COL4A6","HGNC:2208","https://search.clinicalgenome.org/kb/genes/HGNC:2208","hearing loss, X-linked 6","MONDO:0010484","https://search.clinicalgenome.org/kb/conditions/MONDO:0010484","X-linked inheritance","","","","","limited evidence (03/22/2022)","https://search.clinicalgenome.org/kb/gene-validity/CGGV:assertion_d026ef00-c6f3-4aa8-a61a-b354b68fe043-2022-03-22T160000.000Z","Hearing Loss","","",""
"COL5A1","HGNC:2209","https://search.clinicalgenome.org/kb/genes/HGNC:2209","Ehlers-Danlos syndrome, classic type","MONDO:0007522","https://search.clinicalgenome.org/kb/conditions/MONDO:0007522","Autosomal dominant inheritance","3 - Sufficient Evidence for Haploinsufficiency (12/14/2017)","0 - No Evidence for Haploinsufficiency (12/14/2017)","https://search.clinicalgenome.org/kb/gene-dosage/HGNC:2209","Dosage Working Group","definitive evidence (03/24/2021)","https://search.clinicalgenome.org/kb/gene-validity/CGGV:assertion_3133eacb-2ef9-4463-8031-11d10f0e91b9-2021-03-24T151331.225Z","General Gene Curation","Assertion Pending (10/11/2016)","https://search.clinicalgenome.org/kb/gene-validity/https://actionability.clinicalgenome.org/ac/Adult/ui/stg2SummaryRpt?doc=AC089","Adult Actionability Working Group"
"COL5A1","HGNC:2209","https://search.clinicalgenome.org/kb/genes/HGNC:2209","Ehlers-Danlos syndrome, classic type, 1","MONDO:0019567","https://search.clinicalgenome.org/kb/conditions/MONDO:0019567","N/A","3 - Sufficient Evidence for Haploinsufficiency (12/14/2017)","0 - No Evidence for Haploinsufficiency (12/14/2017)","https://search.clinicalgenome.org/kb/gene-dosage/HGNC:2209","Dosage Working Group","","","","Assertion Pending (10/11/2016)","https://search.clinicalgenome.org/kb/gene-validity/https://actionability.clinicalgenome.org/ac/Adult/ui/stg2SummaryRpt?doc=AC089","Adult Actionability Working Group"
"COL5A2","HGNC:2210","https://search.clinicalgenome.org/kb/genes/HGNC:2210","Ehlers-Danlos syndrome, classic type","MONDO:0007522","https://search.clinicalgenome.org/kb/conditions/MONDO:0007522","Autosomal dominant inheritance","","","","","definitive evidence (03/24/2021)","https://search.clinicalgenome.org/kb/gene-validity/CGGV:assertion_1901d495-d33f-4741-88fd-4b66ac43bbad-2021-03-24T184245.711Z","General Gene Curation","Assertion Pending (10/11/2016)","https://search.clinicalgenome.org/kb/gene-validity/https://actionability.clinicalgenome.org/ac/Adult/ui/stg2SummaryRpt?doc=AC089","Adult Actionability Working Group"
"COL5A2","HGNC:2210","https://search.clinicalgenome.org/kb/genes/HGNC:2210","Ehlers-Danlos syndrome, classic type, 2","MONDO:0019568","https://search.clinicalgenome.org/kb/conditions/MONDO:0019568","N/A","","","","","","","","Assertion Pending (10/11/2016)","https://search.clinicalgenome.org/kb/gene-validity/https://actionability.clinicalgenome.org/ac/Adult/ui/stg2SummaryRpt?doc=AC089","Adult Actionability Working Group"
"COL6A2","HGNC:2212","https://search.clinicalgenome.org/kb/genes/HGNC:2212","collagen 6-related myopathy","MONDO:0100225","https://search.clinicalgenome.org/kb/conditions/MONDO:0100225","Autosomal dominant inheritance | Autosomal recessive inheritance","","","","","definitive evidence (06/27/2022) | definitive evidence (06/27/2022)","https://search.clinicalgenome.org/kb/gene-validity/CGGV:assertion_a7a4dad5-f179-44ac-adcb-c5e15c11a1ec-2022-06-27T160000.000Z | https://search.clinicalgenome.org/kb/gene-validity/CGGV:assertion_c523dbfa-e08e-4bdc-82d4-6bf43480697c-2022-06-27T160000.000Z","Congenital Myopathies | Congenital Myopathies","","",""
"COL6A3","HGNC:2213","https://search.clinicalgenome.org/kb/genes/HGNC:2213","dystonia 27","MONDO:0014627","https://search.clinicalgenome.org/kb/conditions/MONDO:0014627","Autosomal recessive inheritance","","","","","limited evidence (05/24/2021)","https://search.clinicalgenome.org/kb/gene-validity/CGGV:assertion_8a109763-6fff-4da9-b826-7c2544d3f878-2021-05-24T160000.000Z","Congenital Myopathies","","",""
"COL6A3","HGNC:2213","https://search.clinicalgenome.org/kb/genes/HGNC:2213","collagen 6-related myopathy","MONDO:0100225","https://search.clinicalgenome.org/kb/conditions/MONDO:0100225","Autosomal dominant inheritance | Autosomal recessive inheritance","","","","","definitive evidence (06/27/2022) | definitive evidence (06/27/2022)","https://search.clinicalgenome.org/kb/gene-validity/CGGV:assertion_37d30e5c-61f5-4e4a-9ee7-573a2ed704b3-2022-06-27T160000.000Z | https://search.clinicalgenome.org/kb/gene-validity/CGGV:assertion_516ffd6c-c9ea-4d8a-8364-8ec4892ad464-2022-06-27T160000.000Z","Congenital Myopathies | Congenital Myopathies","","",""
"COL7A1","HGNC:2214","https://search.clinicalgenome.org/kb/genes/HGNC:2214","recessive dystrophic epidermolysis bullosa","MONDO:0009179","https://search.clinicalgenome.org/kb/conditions/MONDO:0009179","Autosomal recessive inheritance","","","","","definitive evidence (06/20/2022)","https://search.clinicalgenome.org/kb/gene-validity/CGGV:assertion_940fac3e-2586-4d49-a6f3-db12e865cc65-2022-06-20T170000.000Z","Hereditary Cancer","","",""
"COL9A1","HGNC:2217","https://search.clinicalgenome.org/kb/genes/HGNC:2217","Stickler syndrome","MONDO:0019354","https://search.clinicalgenome.org/kb/conditions/MONDO:0019354","Autosomal recessive inheritance","0 - No Evidence for Haploinsufficiency (11/06/2013)","0 - No Evidence for Haploinsufficiency (11/06/2013)","https://search.clinicalgenome.org/kb/gene-dosage/HGNC:2217","Dosage Working Group","limited evidence (03/26/2018)","https://search.clinicalgenome.org/kb/gene-validity/CGGCIEX:assertion_9807","Heritable Thoracic Aortic Aneurysm and Dissection","","",""
"COL9A1","HGNC:2217","https://search.clinicalgenome.org/kb/genes/HGNC:2217","epiphyseal dysplasia, multiple, 6","MONDO:0013591","https://search.clinicalgenome.org/kb/conditions/MONDO:0013591","N/A","0 - No Evidence for Haploinsufficiency (11/06/2013)","0 - No Evidence for Haploinsufficiency (11/06/2013)","https://search.clinicalgenome.org/kb/gene-dosage/HGNC:2217","Dosage Working Group","","","","","",""
"COL9A2","HGNC:2218","https://search.clinicalgenome.org/kb/genes/HGNC:2218","Stickler syndrome","MONDO:0019354","https://search.clinicalgenome.org/kb/conditions/MONDO:0019354","Autosomal recessive inheritance","0 - No Evidence for Haploinsufficiency (10/09/2013)","0 - No Evidence for Haploinsufficiency (10/09/2013)","https://search.clinicalgenome.org/kb/gene-dosage/HGNC:2218","Dosage Working Group","limited evidence (02/19/2019)","https://search.clinicalgenome.org/kb/gene-validity/CGGV:assertion_697ae26e-2b07-4f87-b42c-121684c89bc0-2019-02-19T170000.000Z","Hearing Loss","","",""
"COL9A3","HGNC:2219","https://search.clinicalgenome.org/kb/genes/HGNC:2219","Stickler syndrome","MONDO:0019354","https://search.clinicalgenome.org/kb/conditions/MONDO:0019354","Autosomal recessive inheritance","","","","","moderate evidence (09/17/2019)","https://search.clinicalgenome.org/kb/gene-validity/CGGV:assertion_a436c41e-0873-4e4c-b2f2-d56f75ca737a-2019-09-17T160000.000Z","Hearing Loss","","",""
"COLEC11","HGNC:17213","https://search.clinicalgenome.org/kb/genes/HGNC:17213","3MC syndrome 2","MONDO:0009927","https://search.clinicalgenome.org/kb/conditions/MONDO:0009927","N/A","30 - Gene Associated with Autosomal Recessive Phenotype (08/22/2016)","0 - No Evidence for Haploinsufficiency (08/22/2016)","https://search.clinicalgenome.org/kb/gene-dosage/HGNC:17213","Dosage Working Group","","","","","",""
"COLQ","HGNC:2226","https://search.clinicalgenome.org/kb/genes/HGNC:2226","congenital myasthenic syndrome 5","MONDO:0011281","https://search.clinicalgenome.org/kb/conditions/MONDO:0011281","N/A","30 - Gene Associated with Autosomal Recessive Phenotype (08/22/2016)","0 - No Evidence for Haploinsufficiency (08/22/2016)","https://search.clinicalgenome.org/kb/gene-dosage/HGNC:2226","Dosage Working Group","","","","","",""
"COMP","HGNC:2227","https://search.clinicalgenome.org/kb/genes/HGNC:2227","multiple epiphyseal dysplasia","MONDO:0016648","https://search.clinicalgenome.org/kb/conditions/MONDO:0016648","Autosomal dominant inheritance","","","","","definitive evidence (03/24/2020)","https://search.clinicalgenome.org/kb/gene-validity/CGGV:assertion_0e93c534-284e-40eb-9076-343a825d3a46-2020-03-24T170000.000Z","Skeletal Disorders","","",""
"COMP","HGNC:2227","https://search.clinicalgenome.org/kb/genes/HGNC:2227","pseudoachondroplasia","MONDO:0008322","https://search.clinicalgenome.org/kb/conditions/MONDO:0008322","Autosomal dominant inheritance","","","","","definitive evidence (02/07/2020)","https://search.clinicalgenome.org/kb/gene-validity/CGGV:assertion_630905e9-0f42-452b-81fa-7fad4eae08f9-2020-02-07T180000.000Z","Skeletal Disorders","","",""
"COQ2","HGNC:25223","https://search.clinicalgenome.org/kb/genes/HGNC:25223","coenzyme Q10 deficiency, primary, 1","MONDO:0011829","https://search.clinicalgenome.org/kb/conditions/MONDO:0011829","N/A","30 - Gene Associated with Autosomal Recessive Phenotype (08/22/2016)","0 - No Evidence for Haploinsufficiency (08/22/2016)","https://search.clinicalgenome.org/kb/gene-dosage/HGNC:25223","Dosage Working Group","","","","","",""
"COQ9","HGNC:25302","https://search.clinicalgenome.org/kb/genes/HGNC:25302","Leigh syndrome","MONDO:0009723","https://search.clinicalgenome.org/kb/conditions/MONDO:0009723","Autosomal recessive inheritance","","","","","limited evidence (04/09/2021)","https://search.clinicalgenome.org/kb/gene-validity/CGGV:assertion_cebc5501-5d36-4767-98bc-edc4ddab3527-2021-04-09T140634.407Z","Mitochondrial Diseases","","",""
"CORO1A","HGNC:2252","https://search.clinicalgenome.org/kb/genes/HGNC:2252","severe combined immunodeficiency due to CORO1A deficiency","MONDO:0014168","https://search.clinicalgenome.org/kb/conditions/MONDO:0014168","Autosomal recessive inheritance","30 - Gene Associated with Autosomal Recessive Phenotype (08/22/2016)","0 - No Evidence for Haploinsufficiency (08/22/2016)","https://search.clinicalgenome.org/kb/gene-dosage/HGNC:2252","Dosage Working Group","definitive evidence (06/03/2022)","https://search.clinicalgenome.org/kb/gene-validity/CGGV:assertion_f55fde93-1b6e-4d03-b737-ecad8aa89ecf-2022-06-03T160000.000Z","SCID-CID","","",""
"COX10","HGNC:2260","https://search.clinicalgenome.org/kb/genes/HGNC:2260","Leigh syndrome","MONDO:0009723","https://search.clinicalgenome.org/kb/conditions/MONDO:0009723","Autosomal recessive inheritance","30 - Gene Associated with Autosomal Recessive Phenotype (08/22/2016)","","https://search.clinicalgenome.org/kb/gene-dosage/HGNC:2260","Dosage Working Group","moderate evidence (05/20/2019)","https://search.clinicalgenome.org/kb/gene-validity/CGGV:assertion_48794019-db9d-47c2-9977-4dc76a7d07b3-2019-05-20T182801.393Z","Mitochondrial Diseases","","",""
"COX14","HGNC:28216","https://search.clinicalgenome.org/kb/genes/HGNC:28216","mitochondrial disease","MONDO:0044970","https://search.clinicalgenome.org/kb/conditions/MONDO:0044970","Autosomal recessive inheritance","30 - Gene Associated with Autosomal Recessive Phenotype (08/22/2016)","0 - No Evidence for Haploinsufficiency (08/22/2016)","https://search.clinicalgenome.org/kb/gene-dosage/HGNC:28216","Dosage Working Group","limited evidence (03/21/2022)","https://search.clinicalgenome.org/kb/gene-validity/CGGV:assertion_8899dbb6-9769-4d93-83fb-e95b6775962c-2022-03-21T160000.000Z","Mitochondrial Diseases","","",""
"COX14","HGNC:28216","https://search.clinicalgenome.org/kb/genes/HGNC:28216","cytochrome-c oxidase deficiency disease","MONDO:0009068","https://search.clinicalgenome.org/kb/conditions/MONDO:0009068","N/A","30 - Gene Associated with Autosomal Recessive Phenotype (08/22/2016)","0 - No Evidence for Haploinsufficiency (08/22/2016)","https://search.clinicalgenome.org/kb/gene-dosage/HGNC:28216","Dosage Working Group","","","","","",""
"COX15","HGNC:2263","https://search.clinicalgenome.org/kb/genes/HGNC:2263","Leigh syndrome","MONDO:0009723","https://search.clinicalgenome.org/kb/conditions/MONDO:0009723","Autosomal recessive inheritance","30 - Gene Associated with Autosomal Recessive Phenotype (08/22/2016)","0 - No Evidence for Haploinsufficiency (08/22/2016)","https://search.clinicalgenome.org/kb/gene-dosage/HGNC:2263","Dosage Working Group","limited evidence (05/20/2019)","https://search.clinicalgenome.org/kb/gene-validity/CGGV:assertion_b5c8d1e1-24d0-4b88-8c04-023197db14f3-2019-05-20T183321.284Z","Mitochondrial Diseases","","",""
"COX15","HGNC:2263","https://search.clinicalgenome.org/kb/genes/HGNC:2263","cardioencephalomyopathy, fatal infantile, due to cytochrome c oxidase deficiency 2","MONDO:0014051","https://search.clinicalgenome.org/kb/conditions/MONDO:0014051","N/A","30 - Gene Associated with Autosomal Recessive Phenotype (08/22/2016)","0 - No Evidence for Haploinsufficiency (08/22/2016)","https://search.clinicalgenome.org/kb/gene-dosage/HGNC:2263","Dosage Working Group","","","","","",""
"COX20","HGNC:26970","https://search.clinicalgenome.org/kb/genes/HGNC:26970","mitochondrial disease","MONDO:0044970","https://search.clinicalgenome.org/kb/conditions/MONDO:0044970","Autosomal recessive inheritance","30 - Gene Associated with Autosomal Recessive Phenotype (08/22/2016)","","https://search.clinicalgenome.org/kb/gene-dosage/HGNC:26970","Dosage Working Group","definitive evidence (02/17/2022)","https://search.clinicalgenome.org/kb/gene-validity/CGGV:assertion_2391b81d-cfd2-4862-b71b-0418794539c3-2022-02-17T170000.000Z","Mitochondrial Diseases","","",""
"COX20","HGNC:26970","https://search.clinicalgenome.org/kb/genes/HGNC:26970","cytochrome-c oxidase deficiency disease","MONDO:0009068","https://search.clinicalgenome.org/kb/conditions/MONDO:0009068","N/A","30 - Gene Associated with Autosomal Recessive Phenotype (08/22/2016)","","https://search.clinicalgenome.org/kb/gene-dosage/HGNC:26970","Dosage Working Group","","","","","",""
"COX4I1","HGNC:2265","https://search.clinicalgenome.org/kb/genes/HGNC:2265","Leigh syndrome","MONDO:0009723","https://search.clinicalgenome.org/kb/conditions/MONDO:0009723","Autosomal recessive inheritance","","","","","limited evidence (04/09/2021)","https://search.clinicalgenome.org/kb/gene-validity/CGGV:assertion_d56c1fe4-7711-45f4-992c-7e9586b9efc6-2021-04-09T135824.042Z","Mitochondrial Diseases","","",""
"COX6B1","HGNC:2280","https://search.clinicalgenome.org/kb/genes/HGNC:2280","mitochondrial disease","MONDO:0044970","https://search.clinicalgenome.org/kb/conditions/MONDO:0044970","Autosomal recessive inheritance","30 - Gene Associated with Autosomal Recessive Phenotype (08/22/2016)","0 - No Evidence for Haploinsufficiency (08/22/2016)","https://search.clinicalgenome.org/kb/gene-dosage/HGNC:2280","Dosage Working Group","definitive evidence (03/21/2022)","https://search.clinicalgenome.org/kb/gene-validity/CGGV:assertion_bc374fc3-050b-4985-9f2f-a2972bb795fe-2022-03-21T160000.000Z","Mitochondrial Diseases","","",""
"COX6B1","HGNC:2280","https://search.clinicalgenome.org/kb/genes/HGNC:2280","cytochrome-c oxidase deficiency disease","MONDO:0009068","https://search.clinicalgenome.org/kb/conditions/MONDO:0009068","N/A","30 - Gene Associated with Autosomal Recessive Phenotype (08/22/2016)","0 - No Evidence for Haploinsufficiency (08/22/2016)","https://search.clinicalgenome.org/kb/gene-dosage/HGNC:2280","Dosage Working Group","","","","","",""
"COX8A","HGNC:2294","https://search.clinicalgenome.org/kb/genes/HGNC:2294","Leigh syndrome","MONDO:0009723","https://search.clinicalgenome.org/kb/conditions/MONDO:0009723","Autosomal recessive inheritance","","","","","limited evidence (04/09/2021)","https://search.clinicalgenome.org/kb/gene-validity/CGGV:assertion_70763eb9-40f7-4f71-a64b-ab0c6ad536b0-2021-04-09T135510.592Z","Mitochondrial Diseases","","",""
"CP","HGNC:2295","https://search.clinicalgenome.org/kb/genes/HGNC:2295","aceruloplasminemia","MONDO:0011426","https://search.clinicalgenome.org/kb/conditions/MONDO:0011426","N/A","30 - Gene Associated with Autosomal Recessive Phenotype (08/22/2016)","","https://search.clinicalgenome.org/kb/gene-dosage/HGNC:2295","Dosage Working Group","","","","Moderate Actionability (12/10/2018) | Strong Actionability (09/17/2018)","https://search.clinicalgenome.org/kb/gene-validity/https://actionability.clinicalgenome.org/ac/Adult/ui/stg2SummaryRpt?doc=AC157 | https://search.clinicalgenome.org/kb/gene-validity/https://actionability.clinicalgenome.org/ac/Pediatric/ui/stg2SummaryRpt?doc=AC157","Adult Actionability Working Group | Pediatric Actionability Working Group"
"CPA6","HGNC:17245","https://search.clinicalgenome.org/kb/genes/HGNC:17245","epilepsy","MONDO:0005027","https://search.clinicalgenome.org/kb/conditions/MONDO:0005027","Autosomal dominant inheritance | Autosomal recessive inheritance","0 - No Evidence for Haploinsufficiency (09/04/2019)","0 - No Evidence for Haploinsufficiency (09/04/2019)","https://search.clinicalgenome.org/kb/gene-dosage/HGNC:17245","Dosage Working Group","refuting evidence (07/29/2021) | disputing (07/29/2021)","https://search.clinicalgenome.org/kb/gene-validity/CGGV:assertion_1cb32379-82a8-425d-ac80-3d740e1cc10b-2021-07-29T132527.108Z | https://search.clinicalgenome.org/kb/gene-validity/CGGV:assertion_7b3ebd58-dccb-4c73-b5e4-1ec55171f2fe-2021-07-29T135909.720Z","Epilepsy | Epilepsy","","",""
"CPLANE1","HGNC:25801","https://search.clinicalgenome.org/kb/genes/HGNC:25801","Joubert syndrome 17","MONDO:0013824","https://search.clinicalgenome.org/kb/conditions/MONDO:0013824","Autosomal recessive inheritance","30 - Gene Associated with Autosomal Recessive Phenotype (08/22/2016)","0 - No Evidence for Haploinsufficiency (08/22/2016)","https://search.clinicalgenome.org/kb/gene-dosage/HGNC:25801","Dosage Working Group","definitive evidence (05/20/2022)","https://search.clinicalgenome.org/kb/gene-validity/CGGV:assertion_954cdc22-7834-4876-a64e-27d56615c1ff-2022-05-20T114241.088Z","Syndromic Disorders","","",""
"CPN1","HGNC:2312","https://search.clinicalgenome.org/kb/genes/HGNC:2312","carboxypeptidase N deficiency","MONDO:0008910","https://search.clinicalgenome.org/kb/conditions/MONDO:0008910","N/A","30 - Gene Associated with Autosomal Recessive Phenotype (08/22/2016)","0 - No Evidence for Haploinsufficiency (08/22/2016)","https://search.clinicalgenome.org/kb/gene-dosage/HGNC:2312","Dosage Working Group","","","","","",""
"CPS1","HGNC:2323","https://search.clinicalgenome.org/kb/genes/HGNC:2323","carbamoyl phosphate synthetase I deficiency disease","MONDO:0009376","https://search.clinicalgenome.org/kb/conditions/MONDO:0009376","Autosomal recessive inheritance","30 - Gene Associated with Autosomal Recessive Phenotype (08/22/2016)","","https://search.clinicalgenome.org/kb/gene-dosage/HGNC:2323","Dosage Working Group","definitive evidence (10/12/2018)","https://search.clinicalgenome.org/kb/gene-validity/CGGV:assertion_dbc4dbbe-8827-4d68-a396-8368f3801e78-2018-10-12T160000.000Z","Aminoacidopathy","Strong Actionability (03/16/2022) | Moderate Actionability (03/16/2022)","https://search.clinicalgenome.org/kb/gene-validity/https://actionability.clinicalgenome.org/ac/Pediatric/ui/stg2SummaryRpt?doc=AC1046 | https://search.clinicalgenome.org/kb/gene-validity/https://actionability.clinicalgenome.org/ac/Adult/ui/stg2SummaryRpt?doc=AC1046","Pediatric Actionability Working Group | Adult Actionability Working Group"
"CPT1A","HGNC:2328","https://search.clinicalgenome.org/kb/genes/HGNC:2328","carnitine palmitoyl transferase 1A deficiency","MONDO:0009705","https://search.clinicalgenome.org/kb/conditions/MONDO:0009705","Autosomal recessive inheritance","30 - Gene Associated with Autosomal Recessive Phenotype (08/22/2016)","0 - No Evidence for Haploinsufficiency (08/22/2016)","https://search.clinicalgenome.org/kb/gene-dosage/HGNC:2328","Dosage Working Group","definitive evidence (01/23/2018)","https://search.clinicalgenome.org/kb/gene-validity/CGGV:assertion_dcea255c-11e4-46fd-b0f7-2de68311a75c-2018-01-23T170000.000Z","Fatty Acid Oxidation Disorders","","",""
"CPT1B","HGNC:2329","https://search.clinicalgenome.org/kb/genes/HGNC:2329","inherited fatty acid metabolism disorder","MONDO:0037858","https://search.clinicalgenome.org/kb/conditions/MONDO:0037858","Mode of inheritance","","","","","no known disease relationship (01/25/2021)","https://search.clinicalgenome.org/kb/gene-validity/CGGV:assertion_cfcd80c7-d806-41cf-8c3a-7ba955919537-2021-01-25T194946.827Z","Fatty Acid Oxidation Disorders","","",""
"CPT2","HGNC:2330","https://search.clinicalgenome.org/kb/genes/HGNC:2330","carnitine palmitoyltransferase II deficiency","MONDO:0015515","https://search.clinicalgenome.org/kb/conditions/MONDO:0015515","Autosomal recessive inheritance","","","","","definitive evidence (03/27/2018)","https://search.clinicalgenome.org/kb/gene-validity/CGGV:assertion_1a57ea10-6ca0-4311-94f1-0ad036a38ca6-2018-03-27T160000.000Z","Fatty Acid Oxidation Disorders","Moderate Actionability (12/26/2020) | Moderate Actionability (12/26/2020)","https://search.clinicalgenome.org/kb/gene-validity/https://actionability.clinicalgenome.org/ac/Adult/ui/stg2SummaryRpt?doc=AC1022 | https://search.clinicalgenome.org/kb/gene-validity/https://actionability.clinicalgenome.org/ac/Pediatric/ui/stg2SummaryRpt?doc=AC1022","Adult Actionability Working Group | Pediatric Actionability Working Group"
"CPT2","HGNC:2330","https://search.clinicalgenome.org/kb/genes/HGNC:2330","carnitine palmitoyl transferase II deficiency, neonatal form","MONDO:0012136","https://search.clinicalgenome.org/kb/conditions/MONDO:0012136","N/A","","","","","","","","Moderate Actionability (12/26/2020) | Moderate Actionability (12/26/2020)","https://search.clinicalgenome.org/kb/gene-validity/https://actionability.clinicalgenome.org/ac/Adult/ui/stg2SummaryRpt?doc=AC1022 | https://search.clinicalgenome.org/kb/gene-validity/https://actionability.clinicalgenome.org/ac/Pediatric/ui/stg2SummaryRpt?doc=AC1022","Adult Actionability Working Group | Pediatric Actionability Working Group"
"CPT2","HGNC:2330","https://search.clinicalgenome.org/kb/genes/HGNC:2330","carnitine palmitoyl transferase II deficiency, severe infantile form","MONDO:0010914","https://search.clinicalgenome.org/kb/conditions/MONDO:0010914","N/A","","","","","","","","Moderate Actionability (12/26/2020) | Moderate Actionability (12/26/2020)","https://search.clinicalgenome.org/kb/gene-validity/https://actionability.clinicalgenome.org/ac/Adult/ui/stg2SummaryRpt?doc=AC1022 | https://search.clinicalgenome.org/kb/gene-validity/https://actionability.clinicalgenome.org/ac/Pediatric/ui/stg2SummaryRpt?doc=AC1022","Adult Actionability Working Group | Pediatric Actionability Working Group"
"CPT2","HGNC:2330","https://search.clinicalgenome.org/kb/genes/HGNC:2330","carnitine palmitoyl transferase II deficiency, myopathic form","MONDO:0009704","https://search.clinicalgenome.org/kb/conditions/MONDO:0009704","N/A","","","","","","","","Moderate Actionability (12/26/2020) | Moderate Actionability (12/26/2020)","https://search.clinicalgenome.org/kb/gene-validity/https://actionability.clinicalgenome.org/ac/Adult/ui/stg2SummaryRpt?doc=AC1022 | https://search.clinicalgenome.org/kb/gene-validity/https://actionability.clinicalgenome.org/ac/Pediatric/ui/stg2SummaryRpt?doc=AC1022","Adult Actionability Working Group | Pediatric Actionability Working Group"
"CR2","HGNC:2336","https://search.clinicalgenome.org/kb/genes/HGNC:2336","immunodeficiency, common variable, 7","MONDO:0013862","https://search.clinicalgenome.org/kb/conditions/MONDO:0013862","Autosomal recessive inheritance","","","","","definitive evidence (08/03/2021)","https://search.clinicalgenome.org/kb/gene-validity/CGGV:assertion_9153b41e-f2ef-453d-883b-187565cf4593-2021-08-03T130056.511Z","Antibody Deficiencies GCEP","","",""
"CRADD","HGNC:2340","https://search.clinicalgenome.org/kb/genes/HGNC:2340","syndromic intellectual disability","MONDO:0000508","https://search.clinicalgenome.org/kb/conditions/MONDO:0000508","Autosomal recessive inheritance","30 - Gene Associated with Autosomal Recessive Phenotype (08/22/2016)","0 - No Evidence for Haploinsufficiency (08/22/2016)","https://search.clinicalgenome.org/kb/gene-dosage/HGNC:2340","Dosage Working Group","definitive evidence (06/16/2021)","https://search.clinicalgenome.org/kb/gene-validity/CGGV:assertion_7f64ee7f-13a7-4a2d-b1a2-ad6c9e63cab3-2021-06-16T180000.000Z","Intellectual Disability and Autism","","",""
"CRADD","HGNC:2340","https://search.clinicalgenome.org/kb/genes/HGNC:2340","intellectual disability, autosomal recessive 34","MONDO:0013785","https://search.clinicalgenome.org/kb/conditions/MONDO:0013785","N/A","30 - Gene Associated with Autosomal Recessive Phenotype (08/22/2016)","0 - No Evidence for Haploinsufficiency (08/22/2016)","https://search.clinicalgenome.org/kb/gene-dosage/HGNC:2340","Dosage Working Group","","","","","",""
"CRB2","HGNC:18688","https://search.clinicalgenome.org/kb/genes/HGNC:18688","focal segmental glomerulosclerosis 9","MONDO:0014539","https://search.clinicalgenome.org/kb/conditions/MONDO:0014539","Autosomal recessive inheritance","","","","","definitive evidence (10/26/2021)","https://search.clinicalgenome.org/kb/gene-validity/CGGV:assertion_98f54e8c-a81c-4b3b-8dbb-05dd24c5dbcc-2021-10-26T013000.000Z","Glomerulopathy","","",""
"CRBN","HGNC:30185","https://search.clinicalgenome.org/kb/genes/HGNC:30185","intellectual disability","MONDO:0001071","https://search.clinicalgenome.org/kb/conditions/MONDO:0001071","Autosomal recessive inheritance","","","","","moderate evidence (05/21/2021)","https://search.clinicalgenome.org/kb/gene-validity/CGGV:assertion_158c9b6b-2ac8-4ee3-bd89-a57d567e675f-2021-05-21T135046.004Z","Intellectual Disability and Autism","","",""
"CREBBP","HGNC:2348","https://search.clinicalgenome.org/kb/genes/HGNC:2348","Rubinstein-Taybi syndrome","MONDO:0019188","https://search.clinicalgenome.org/kb/conditions/MONDO:0019188","Autosomal dominant inheritance","3 - Sufficient Evidence for Haploinsufficiency (10/23/2019)","0 - No Evidence for Haploinsufficiency (10/23/2019)","https://search.clinicalgenome.org/kb/gene-dosage/HGNC:2348","Dosage Working Group","definitive evidence (04/27/2018)","https://search.clinicalgenome.org/kb/gene-validity/CGGV:assertion_d16df64b-26ed-4f1c-b8dc-f27be773b102-2018-04-27T160000.000Z","Intellectual Disability and Autism","","",""
"CREBBP","HGNC:2348","https://search.clinicalgenome.org/kb/genes/HGNC:2348","Rubinstein-Taybi syndrome due to CREBBP mutations","MONDO:0008393","https://search.clinicalgenome.org/kb/conditions/MONDO:0008393","N/A","3 - Sufficient Evidence for Haploinsufficiency (10/23/2019)","0 - No Evidence for Haploinsufficiency (10/23/2019)","https://search.clinicalgenome.org/kb/gene-dosage/HGNC:2348","Dosage Working Group","","","","","",""
"CRH","HGNC:2355","https://search.clinicalgenome.org/kb/genes/HGNC:2355","epilepsy","MONDO:0005027","https://search.clinicalgenome.org/kb/conditions/MONDO:0005027","Autosomal dominant inheritance","","","","","refuting evidence (09/21/2021)","https://search.clinicalgenome.org/kb/gene-validity/CGGV:assertion_e1719f97-0d6c-4ed3-93bc-13cc8e1f1d6e-2021-09-21T160000.000Z","Epilepsy","","",""
"CRIPT","HGNC:14312","https://search.clinicalgenome.org/kb/genes/HGNC:14312","short stature with microcephaly and distinctive facies","MONDO:0014347","https://search.clinicalgenome.org/kb/conditions/MONDO:0014347","N/A","30 - Gene Associated with Autosomal Recessive Phenotype (08/22/2016)","0 - No Evidence for Haploinsufficiency (08/22/2016)","https://search.clinicalgenome.org/kb/gene-dosage/HGNC:14312","Dosage Working Group","","","","","",""
"CRPPA","HGNC:37276","https://search.clinicalgenome.org/kb/genes/HGNC:37276","muscular dystrophy-dystroglycanopathy","MONDO:0018276","https://search.clinicalgenome.org/kb/conditions/MONDO:0018276","N/A","30 - Gene Associated with Autosomal Recessive Phenotype (08/22/2016)","","https://search.clinicalgenome.org/kb/gene-dosage/HGNC:37276","Dosage Working Group","","","","","",""
"CRTAP","HGNC:2379","https://search.clinicalgenome.org/kb/genes/HGNC:2379","osteogenesis imperfecta type 7","MONDO:0012536","https://search.clinicalgenome.org/kb/conditions/MONDO:0012536","N/A","30 - Gene Associated with Autosomal Recessive Phenotype (08/22/2016)","0 - No Evidence for Haploinsufficiency (08/22/2016)","https://search.clinicalgenome.org/kb/gene-dosage/HGNC:2379","Dosage Working Group","","","","","",""
"CRYM","HGNC:2418","https://search.clinicalgenome.org/kb/genes/HGNC:2418","nonsyndromic genetic hearing loss","MONDO:0019497","https://search.clinicalgenome.org/kb/conditions/MONDO:0019497","Autosomal dominant inheritance","","","","","limited evidence (09/21/2021)","https://search.clinicalgenome.org/kb/gene-validity/CGGV:assertion_d15cf48a-3696-467a-b3c8-a45ef5a577bf-2021-09-21T160000.000Z","Hearing Loss","","",""
"CSF2RA","HGNC:2435","https://search.clinicalgenome.org/kb/genes/HGNC:2435","hereditary pulmonary alveolar proteinosis","MONDO:0012580","https://search.clinicalgenome.org/kb/conditions/MONDO:0012580","N/A","30 - Gene Associated with Autosomal Recessive Phenotype (08/23/2021)","0 - No Evidence for Haploinsufficiency (08/23/2021)","https://search.clinicalgenome.org/kb/gene-dosage/HGNC:2435","Dosage Working Group","","","","","",""
"CSF2RB","HGNC:2436","https://search.clinicalgenome.org/kb/genes/HGNC:2436","surfactant metabolism dysfunction, pulmonary, 5","MONDO:0013712","https://search.clinicalgenome.org/kb/conditions/MONDO:0013712","N/A","30 - Gene Associated with Autosomal Recessive Phenotype (08/22/2016)","","https://search.clinicalgenome.org/kb/gene-dosage/HGNC:2436","Dosage Working Group","","","","","",""
"CSMD1","HGNC:14026","https://search.clinicalgenome.org/kb/genes/HGNC:14026","complex neurodevelopmental disorder","MONDO:0100038","https://search.clinicalgenome.org/kb/conditions/MONDO:0100038","N/A","1 - Little Evidence for Haploinsufficiency (10/24/2018)","0 - No Evidence for Haploinsufficiency (10/24/2018)","https://search.clinicalgenome.org/kb/gene-dosage/HGNC:14026","Dosage Working Group","","","","","",""
"CSNK2B","HGNC:2460","https://search.clinicalgenome.org/kb/genes/HGNC:2460","Poirier-Bienvenu neurodevelopmental syndrome","MONDO:0032889","https://search.clinicalgenome.org/kb/conditions/MONDO:0032889","Autosomal dominant inheritance","","","","","definitive evidence (04/08/2022)","https://search.clinicalgenome.org/kb/gene-validity/CGGV:assertion_64552de0-3f81-4110-90f7-97de14b0387b-2022-04-08T050921.681Z","Syndromic Disorders","","",""
"CSPP1","HGNC:26193","https://search.clinicalgenome.org/kb/genes/HGNC:26193","Joubert syndrome 21","MONDO:0014288","https://search.clinicalgenome.org/kb/conditions/MONDO:0014288","Autosomal recessive inheritance","30 - Gene Associated with Autosomal Recessive Phenotype (08/22/2016)","0 - No Evidence for Haploinsufficiency (08/22/2016)","https://search.clinicalgenome.org/kb/gene-dosage/HGNC:26193","Dosage Working Group","definitive evidence (06/23/2021)","https://search.clinicalgenome.org/kb/gene-validity/CGGV:assertion_e24d1591-91b7-4c2f-bd79-d4dc8be0974d-2021-06-23T160000.000Z","Kidney Cystic and Ciliopathy Disorders","","",""
"CSRP3","HGNC:2472","https://search.clinicalgenome.org/kb/genes/HGNC:2472","hypertrophic cardiomyopathy","MONDO:0005045","https://search.clinicalgenome.org/kb/conditions/MONDO:0005045","Autosomal dominant inheritance","","","","","moderate evidence (12/19/2017)","https://search.clinicalgenome.org/kb/gene-validity/CGGV:assertion_130d778f-f756-4f3d-b6b2-909e40836c5a-2017-12-19T170000.000Z","Hypertrophic Cardiomyopathy","Assertion Pending (08/14/2017)","https://search.clinicalgenome.org/kb/gene-validity/https://actionability.clinicalgenome.org/ac/Adult/ui/stg2SummaryRpt?doc=AC056","Adult Actionability Working Group"
"CSRP3","HGNC:2472","https://search.clinicalgenome.org/kb/genes/HGNC:2472","dilated cardiomyopathy","MONDO:0005021","https://search.clinicalgenome.org/kb/conditions/MONDO:0005021","Autosomal dominant inheritance","","","","","limited evidence (11/06/2020)","https://search.clinicalgenome.org/kb/gene-validity/CGGV:assertion_beaafc90-20ef-4c81-ad8f-cfcf69d269ca-2020-11-06T165245.603Z","Dilated Cardiomyopathy","","",""
"CSRP3","HGNC:2472","https://search.clinicalgenome.org/kb/genes/HGNC:2472","familial hypertrophic cardiomyopathy","MONDO:0024573","https://search.clinicalgenome.org/kb/conditions/MONDO:0024573","N/A","","","","","","","","Assertion Pending (08/14/2017)","https://search.clinicalgenome.org/kb/gene-validity/https://actionability.clinicalgenome.org/ac/Adult/ui/stg2SummaryRpt?doc=AC056","Adult Actionability Working Group"
"CSRP3","HGNC:2472","https://search.clinicalgenome.org/kb/genes/HGNC:2472","hypertrophic cardiomyopathy 12","MONDO:0012804","https://search.clinicalgenome.org/kb/conditions/MONDO:0012804","N/A","","","","","","","","Assertion Pending (08/14/2017)","https://search.clinicalgenome.org/kb/gene-validity/https://actionability.clinicalgenome.org/ac/Adult/ui/stg2SummaryRpt?doc=AC056","Adult Actionability Working Group"
"CSTB","HGNC:2482","https://search.clinicalgenome.org/kb/genes/HGNC:2482","Unverricht-Lundborg syndrome","MONDO:0009698","https://search.clinicalgenome.org/kb/conditions/MONDO:0009698","Autosomal recessive inheritance","30 - Gene Associated with Autosomal Recessive Phenotype (08/22/2016)","0 - No Evidence for Haploinsufficiency (08/22/2016)","https://search.clinicalgenome.org/kb/gene-dosage/HGNC:2482","Dosage Working Group","definitive evidence (06/16/2020)","https://search.clinicalgenome.org/kb/gene-validity/CGGV:assertion_2926506c-5b75-4340-b821-e3ac846b6621-2020-06-16T160000.000Z","Epilepsy","","",""
"CSTB","HGNC:2482","https://search.clinicalgenome.org/kb/genes/HGNC:2482","developmental and epileptic encephalopathy","MONDO:0100062","https://search.clinicalgenome.org/kb/conditions/MONDO:0100062","Autosomal recessive inheritance","30 - Gene Associated with Autosomal Recessive Phenotype (08/22/2016)","0 - No Evidence for Haploinsufficiency (08/22/2016)","https://search.clinicalgenome.org/kb/gene-dosage/HGNC:2482","Dosage Working Group","moderate evidence (12/01/2020)","https://search.clinicalgenome.org/kb/gene-validity/CGGV:assertion_accafcd4-ba3c-4049-9285-1de877d256ec-2020-12-01T170000.000Z","Epilepsy","","",""
"CTC1","HGNC:26169","https://search.clinicalgenome.org/kb/genes/HGNC:26169","cerebroretinal microangiopathy with calcifications and cysts 1","MONDO:0024564","https://search.clinicalgenome.org/kb/conditions/MONDO:0024564","N/A","30 - Gene Associated with Autosomal Recessive Phenotype (10/08/2019)","0 - No Evidence for Haploinsufficiency (10/08/2019)","https://search.clinicalgenome.org/kb/gene-dosage/HGNC:26169","Dosage Working Group","","","","","",""
"CTCF","HGNC:13723","https://search.clinicalgenome.org/kb/genes/HGNC:13723","syndromic intellectual disability","MONDO:0000508","https://search.clinicalgenome.org/kb/conditions/MONDO:0000508","Autosomal dominant inheritance","3 - Sufficient Evidence for Haploinsufficiency (09/22/2021)","0 - No Evidence for Haploinsufficiency (09/22/2021)","https://search.clinicalgenome.org/kb/gene-dosage/HGNC:13723","Dosage Working Group","definitive evidence (07/21/2021)","https://search.clinicalgenome.org/kb/gene-validity/CGGV:assertion_f1cbcd7b-83e2-47c1-b708-c9052502e639-2021-07-21T160000.000Z","Intellectual Disability and Autism","","",""
"CTDP1","HGNC:2498","https://search.clinicalgenome.org/kb/genes/HGNC:2498","congenital cataracts-facial dysmorphism-neuropathy syndrome","MONDO:0011402","https://search.clinicalgenome.org/kb/conditions/MONDO:0011402","N/A","30 - Gene Associated with Autosomal Recessive Phenotype (08/22/2016)","","https://search.clinicalgenome.org/kb/gene-dosage/HGNC:2498","Dosage Working Group","","","","","",""
"CTF1","HGNC:2499","https://search.clinicalgenome.org/kb/genes/HGNC:2499","dilated cardiomyopathy","MONDO:0005021","https://search.clinicalgenome.org/kb/conditions/MONDO:0005021","Autosomal dominant inheritance","","","","","limited evidence (08/12/2020)","https://search.clinicalgenome.org/kb/gene-validity/CGGV:assertion_ef19cc13-543b-451e-b278-ec1fc04f694c-2020-08-12T040000.000Z","Dilated Cardiomyopathy","","",""
"CTH","HGNC:2501","https://search.clinicalgenome.org/kb/genes/HGNC:2501","cystathioninuria","MONDO:0009058","https://search.clinicalgenome.org/kb/conditions/MONDO:0009058","Autosomal recessive inheritance","30 - Gene Associated with Autosomal Recessive Phenotype (08/22/2016)","0 - No Evidence for Haploinsufficiency (08/22/2016)","https://search.clinicalgenome.org/kb/gene-dosage/HGNC:2501","Dosage Working Group","definitive evidence (06/14/2019)","https://search.clinicalgenome.org/kb/gene-validity/CGGV:assertion_2f5047f7-80ba-4b8f-8009-59d7130e63be-2019-06-14T160000.000Z","Aminoacidopathy","","",""
"CTLA4","HGNC:2505","https://search.clinicalgenome.org/kb/genes/HGNC:2505","autoimmune lymphoproliferative syndrome due to CTLA4 haploinsuffiency","MONDO:0014493","https://search.clinicalgenome.org/kb/conditions/MONDO:0014493","Autosomal dominant inheritance","","","","","definitive evidence (04/28/2021)","https://search.clinicalgenome.org/kb/gene-validity/CGGV:assertion_e79675bd-3eef-4925-b4ef-3b7c48734f30-2021-04-28T163716.269Z","Antibody Deficiencies GCEP","","",""
"CTNNA1","HGNC:2509","https://search.clinicalgenome.org/kb/genes/HGNC:2509","hereditary nonpolyposis colon cancer","MONDO:0018630","https://search.clinicalgenome.org/kb/conditions/MONDO:0018630","Autosomal dominant inheritance","","","","","no known disease relationship (04/24/2017)","https://search.clinicalgenome.org/kb/gene-validity/CGGCIEX:assertion_9868","Colon Cancer","","",""
"CTNNA3","HGNC:2511","https://search.clinicalgenome.org/kb/genes/HGNC:2511","arrhythmogenic right ventricular cardiomyopathy","MONDO:0016587","https://search.clinicalgenome.org/kb/conditions/MONDO:0016587","Autosomal dominant inheritance","0 - No Evidence for Haploinsufficiency (10/24/2018)","0 - No Evidence for Haploinsufficiency (10/24/2018)","https://search.clinicalgenome.org/kb/gene-dosage/HGNC:2511","Dosage Working Group","limited evidence (08/06/2019)","https://search.clinicalgenome.org/kb/gene-validity/CGGV:assertion_0f1dd946-f2bb-496f-8fea-3dea303e2e76-2019-08-06T160000.000Z","Arrhythmogenic Right Ventricular Cardiomyopathy","","",""
"CTNNA3","HGNC:2511","https://search.clinicalgenome.org/kb/genes/HGNC:2511","complex neurodevelopmental disorder","MONDO:0100038","https://search.clinicalgenome.org/kb/conditions/MONDO:0100038","N/A","0 - No Evidence for Haploinsufficiency (10/24/2018)","0 - No Evidence for Haploinsufficiency (10/24/2018)","https://search.clinicalgenome.org/kb/gene-dosage/HGNC:2511","Dosage Working Group","","","","","",""
"CTNNB1","HGNC:2514","https://search.clinicalgenome.org/kb/genes/HGNC:2514","severe intellectual disability-progressive spastic diplegia syndrome","MONDO:0014035","https://search.clinicalgenome.org/kb/conditions/MONDO:0014035","Autosomal dominant inheritance","3 - Sufficient Evidence for Haploinsufficiency (11/22/2017)","0 - No Evidence for Haploinsufficiency (11/22/2017)","https://search.clinicalgenome.org/kb/gene-dosage/HGNC:2514","Dosage Working Group","definitive evidence (02/03/2021)","https://search.clinicalgenome.org/kb/gene-validity/CGGV:assertion_e119aceb-a011-4811-9abd-6731c5b3d15d-2021-02-03T170000.000Z","Intellectual Disability and Autism","","",""
"CTNNBL1","HGNC:15879","https://search.clinicalgenome.org/kb/genes/HGNC:15879","common variable immunodeficiency","MONDO:0015517","https://search.clinicalgenome.org/kb/conditions/MONDO:0015517","Autosomal recessive inheritance","","","","","limited evidence (05/17/2022)","https://search.clinicalgenome.org/kb/gene-validity/CGGV:assertion_4e151724-c8a5-4f3e-a7ac-bd0b1d180fae-2022-05-17T160000.000Z","Antibody Deficiencies GCEP","","",""
"CTNND2","HGNC:2516","https://search.clinicalgenome.org/kb/genes/HGNC:2516","complex neurodevelopmental disorder","MONDO:0100038","https://search.clinicalgenome.org/kb/conditions/MONDO:0100038","N/A","1 - Little Evidence for Haploinsufficiency (10/12/2021)","0 - No Evidence for Haploinsufficiency (10/12/2021)","https://search.clinicalgenome.org/kb/gene-dosage/HGNC:2516","Dosage Working Group","","","","","",""
"CTNS","HGNC:2518","https://search.clinicalgenome.org/kb/genes/HGNC:2518","cystinosis","MONDO:0016239","https://search.clinicalgenome.org/kb/conditions/MONDO:0016239","N/A","30 - Gene Associated with Autosomal Recessive Phenotype (08/22/2012)","0 - No Evidence for Haploinsufficiency (08/22/2012)","https://search.clinicalgenome.org/kb/gene-dosage/HGNC:2518","Dosage Working Group","","","","Moderate Actionability (11/27/2018)","https://search.clinicalgenome.org/kb/gene-validity/https://actionability.clinicalgenome.org/ac/Pediatric/ui/stg2SummaryRpt?doc=AC007","Pediatric Actionability Working Group"
"CTNS","HGNC:2518","https://search.clinicalgenome.org/kb/genes/HGNC:2518","juvenile nephropathic cystinosis","MONDO:0009066","https://search.clinicalgenome.org/kb/conditions/MONDO:0009066","N/A","30 - Gene Associated with Autosomal Recessive Phenotype (08/22/2012)","0 - No Evidence for Haploinsufficiency (08/22/2012)","https://search.clinicalgenome.org/kb/gene-dosage/HGNC:2518","Dosage Working Group","","","","Moderate Actionability (11/27/2018)","https://search.clinicalgenome.org/kb/gene-validity/https://actionability.clinicalgenome.org/ac/Pediatric/ui/stg2SummaryRpt?doc=AC007","Pediatric Actionability Working Group"
"CTNS","HGNC:2518","https://search.clinicalgenome.org/kb/genes/HGNC:2518","nephropathic infantile cystinosis","MONDO:0018467","https://search.clinicalgenome.org/kb/conditions/MONDO:0018467","N/A","30 - Gene Associated with Autosomal Recessive Phenotype (08/22/2012)","0 - No Evidence for Haploinsufficiency (08/22/2012)","https://search.clinicalgenome.org/kb/gene-dosage/HGNC:2518","Dosage Working Group","","","","Moderate Actionability (11/27/2018)","https://search.clinicalgenome.org/kb/gene-validity/https://actionability.clinicalgenome.org/ac/Pediatric/ui/stg2SummaryRpt?doc=AC007","Pediatric Actionability Working Group"
"CTNS","HGNC:2518","https://search.clinicalgenome.org/kb/genes/HGNC:2518","ocular cystinosis","MONDO:0009064","https://search.clinicalgenome.org/kb/conditions/MONDO:0009064","N/A","30 - Gene Associated with Autosomal Recessive Phenotype (08/22/2012)","0 - No Evidence for Haploinsufficiency (08/22/2012)","https://search.clinicalgenome.org/kb/gene-dosage/HGNC:2518","Dosage Working Group","","","","Moderate Actionability (11/27/2018)","https://search.clinicalgenome.org/kb/gene-validity/https://actionability.clinicalgenome.org/ac/Pediatric/ui/stg2SummaryRpt?doc=AC007","Pediatric Actionability Working Group"
"CTNS","HGNC:2518","https://search.clinicalgenome.org/kb/genes/HGNC:2518","nephropathic cystinosis","MONDO:0100151","https://search.clinicalgenome.org/kb/conditions/MONDO:0100151","N/A","30 - Gene Associated with Autosomal Recessive Phenotype (08/22/2012)","0 - No Evidence for Haploinsufficiency (08/22/2012)","https://search.clinicalgenome.org/kb/gene-dosage/HGNC:2518","Dosage Working Group","","","","","",""
"CTSD","HGNC:2529","https://search.clinicalgenome.org/kb/genes/HGNC:2529","neuronal ceroid lipofuscinosis","MONDO:0016295","https://search.clinicalgenome.org/kb/conditions/MONDO:0016295","Autosomal recessive inheritance","","","","","definitive evidence (11/03/2020)","https://search.clinicalgenome.org/kb/gene-validity/CGGV:assertion_d74b1b2a-52a3-4192-b5b4-e4fd46ffc0ba-2020-11-03T180000.000Z","Epilepsy","","",""
"CTSF","HGNC:2531","https://search.clinicalgenome.org/kb/genes/HGNC:2531","adult neuronal ceroid lipofuscinosis","MONDO:0019260","https://search.clinicalgenome.org/kb/conditions/MONDO:0019260","Autosomal recessive inheritance","","","","","definitive evidence (04/21/2022)","https://search.clinicalgenome.org/kb/gene-validity/CGGV:assertion_a9079835-78f4-4759-a43a-9786270dc02e-2022-04-21T142141.505Z","Epilepsy","","",""
"CUBN","HGNC:2548","https://search.clinicalgenome.org/kb/genes/HGNC:2548","Imerslund-Grasbeck syndrome type 1","MONDO:0100156","https://search.clinicalgenome.org/kb/conditions/MONDO:0100156","N/A","30 - Gene Associated with Autosomal Recessive Phenotype (08/22/2016)","0 - No Evidence for Haploinsufficiency (08/22/2016)","https://search.clinicalgenome.org/kb/gene-dosage/HGNC:2548","Dosage Working Group","","","","","",""
"CUL3","HGNC:2553","https://search.clinicalgenome.org/kb/genes/HGNC:2553","complex neurodevelopmental disorder","MONDO:0100038","https://search.clinicalgenome.org/kb/conditions/MONDO:0100038","Autosomal dominant inheritance","3 - Sufficient Evidence for Haploinsufficiency (01/24/2018)","0 - No Evidence for Haploinsufficiency (01/24/2018)","https://search.clinicalgenome.org/kb/gene-dosage/HGNC:2553","Dosage Working Group","definitive evidence (01/16/2021)","https://search.clinicalgenome.org/kb/gene-validity/CGGV:assertion_fb529ace-86b5-4209-9974-9c07a1c32956-2021-01-16T030942.670Z","Intellectual Disability and Autism","","",""
"CUL3","HGNC:2553","https://search.clinicalgenome.org/kb/genes/HGNC:2553","pseudohypoaldosteronism type 2E","MONDO:0013782","https://search.clinicalgenome.org/kb/conditions/MONDO:0013782","Autosomal dominant inheritance","3 - Sufficient Evidence for Haploinsufficiency (01/24/2018)","0 - No Evidence for Haploinsufficiency (01/24/2018)","https://search.clinicalgenome.org/kb/gene-dosage/HGNC:2553","Dosage Working Group","definitive evidence (12/01/2021)","https://search.clinicalgenome.org/kb/gene-validity/CGGV:assertion_f697fb5e-72de-4116-9cad-706e2d651268-2021-12-01T013000.000Z","Tubulopathy","","",""
"CUL3","HGNC:2553","https://search.clinicalgenome.org/kb/genes/HGNC:2553","neurodevelopmental disorder with or without autism or seizures","MONDO:0030994","https://search.clinicalgenome.org/kb/conditions/MONDO:0030994","N/A","3 - Sufficient Evidence for Haploinsufficiency (01/24/2018)","0 - No Evidence for Haploinsufficiency (01/24/2018)","https://search.clinicalgenome.org/kb/gene-dosage/HGNC:2553","Dosage Working Group","","","","","",""
"CUL4B","HGNC:2555","https://search.clinicalgenome.org/kb/genes/HGNC:2555","X-linked intellectual disability, Cabezas type","MONDO:0010306","https://search.clinicalgenome.org/kb/conditions/MONDO:0010306","X-linked inheritance","3 - Sufficient Evidence for Haploinsufficiency (02/09/2021)","0 - No Evidence for Haploinsufficiency (02/09/2021)","https://search.clinicalgenome.org/kb/gene-dosage/HGNC:2555","Dosage Working Group","definitive evidence (02/21/2018)","https://search.clinicalgenome.org/kb/gene-validity/CGGV:assertion_cc93f3b2-3124-40f8-a86e-c929b09c6f68-2018-02-21T050000.000Z","Intellectual Disability and Autism","","",""
"CYB5A","HGNC:2570","https://search.clinicalgenome.org/kb/genes/HGNC:2570","methemoglobinemia type 4","MONDO:0009605","https://search.clinicalgenome.org/kb/conditions/MONDO:0009605","N/A","30 - Gene Associated with Autosomal Recessive Phenotype (08/22/2016)","0 - No Evidence for Haploinsufficiency (08/22/2016)","https://search.clinicalgenome.org/kb/gene-dosage/HGNC:2570","Dosage Working Group","","","","","",""
"CYBB","HGNC:2578","https://search.clinicalgenome.org/kb/genes/HGNC:2578","granulomatous disease, chronic, X-linked","MONDO:0010600","https://search.clinicalgenome.org/kb/conditions/MONDO:0010600","N/A","3 - Sufficient Evidence for Haploinsufficiency (05/27/2020)","0 - No Evidence for Haploinsufficiency (05/27/2020)","https://search.clinicalgenome.org/kb/gene-dosage/HGNC:2578","Dosage Working Group","","","","","",""
"CYCS","HGNC:19986","https://search.clinicalgenome.org/kb/genes/HGNC:19986","thrombocytopenia 4","MONDO:0012775","https://search.clinicalgenome.org/kb/conditions/MONDO:0012775","Autosomal dominant inheritance","","","","","limited evidence (06/23/2021)","https://search.clinicalgenome.org/kb/gene-validity/CGGV:assertion_772f2ad2-5d8c-41f6-95c4-39063daf77be-2021-06-23T170356.081Z","Hemostasis Thrombosis","","",""
"CYLD","HGNC:2584","https://search.clinicalgenome.org/kb/genes/HGNC:2584","Brooke-Spiegler syndrome","MONDO:0011512","https://search.clinicalgenome.org/kb/conditions/MONDO:0011512","Autosomal dominant inheritance","3 - Sufficient Evidence for Haploinsufficiency (02/10/2021)","0 - No Evidence for Haploinsufficiency (02/10/2021)","https://search.clinicalgenome.org/kb/gene-dosage/HGNC:2584","Dosage Working Group","definitive evidence (12/21/2018)","https://search.clinicalgenome.org/kb/gene-validity/CGGV:assertion_434ddb72-ee88-47af-9fa2-8dee9fa0a388-2018-12-21T153626.610Z","Hereditary Cancer","","",""
"CYP21A2","HGNC:2600","https://search.clinicalgenome.org/kb/genes/HGNC:2600","non-classic congenital adrenal hyperplasia","MONDO:0023601","https://search.clinicalgenome.org/kb/conditions/MONDO:0023601","N/A","30 - Gene Associated with Autosomal Recessive Phenotype (07/06/2012)","0 - No Evidence for Haploinsufficiency (07/06/2012)","https://search.clinicalgenome.org/kb/gene-dosage/HGNC:2600","Dosage Working Group","","","","Limited Actionability (05/09/2018)","https://search.clinicalgenome.org/kb/gene-validity/https://actionability.clinicalgenome.org/ac/Adult/ui/stg2SummaryRpt?doc=AC151","Adult Actionability Working Group"
"CYP21A2","HGNC:2600","https://search.clinicalgenome.org/kb/genes/HGNC:2600","classic congenital adrenal hyperplasia due to 21-hydroxylase deficiency","MONDO:0008728","https://search.clinicalgenome.org/kb/conditions/MONDO:0008728","N/A","30 - Gene Associated with Autosomal Recessive Phenotype (07/06/2012)","0 - No Evidence for Haploinsufficiency (07/06/2012)","https://search.clinicalgenome.org/kb/gene-dosage/HGNC:2600","Dosage Working Group","","","","","",""
"CYP24A1","HGNC:2602","https://search.clinicalgenome.org/kb/genes/HGNC:2602","hypercalcemia, infantile, 1","MONDO:0020739","https://search.clinicalgenome.org/kb/conditions/MONDO:0020739","N/A","30 - Gene Associated with Autosomal Recessive Phenotype (08/22/2016)","","https://search.clinicalgenome.org/kb/gene-dosage/HGNC:2602","Dosage Working Group","","","","","",""
"CYP27A1","HGNC:2605","https://search.clinicalgenome.org/kb/genes/HGNC:2605","cerebrotendinous xanthomatosis","MONDO:0008948","https://search.clinicalgenome.org/kb/conditions/MONDO:0008948","N/A","30 - Gene Associated with Autosomal Recessive Phenotype (08/22/2016)","","https://search.clinicalgenome.org/kb/gene-dosage/HGNC:2605","Dosage Working Group","","","","","",""
"CYP4F22","HGNC:26820","https://search.clinicalgenome.org/kb/genes/HGNC:26820","autosomal recessive congenital ichthyosis 5","MONDO:0011485","https://search.clinicalgenome.org/kb/conditions/MONDO:0011485","N/A","30 - Gene Associated with Autosomal Recessive Phenotype (08/22/2016)","","https://search.clinicalgenome.org/kb/gene-dosage/HGNC:26820","Dosage Working Group","","","","","",""
"CYP4V2","HGNC:23198","https://search.clinicalgenome.org/kb/genes/HGNC:23198","Bietti crystalline corneoretinal dystrophy","MONDO:0008865","https://search.clinicalgenome.org/kb/conditions/MONDO:0008865","Autosomal recessive inheritance","30 - Gene Associated with Autosomal Recessive Phenotype (08/22/2016)","","https://search.clinicalgenome.org/kb/gene-dosage/HGNC:23198","Dosage Working Group","definitive evidence (04/01/2021)","https://search.clinicalgenome.org/kb/gene-validity/CGGV:assertion_da577a4b-5c65-43fa-9a03-b275eaacb6eb-2021-04-01T160000.000Z","Retina","","",""
"D2HGDH","HGNC:28358","https://search.clinicalgenome.org/kb/genes/HGNC:28358","D-2-hydroxyglutaric aciduria 1","MONDO:0024554","https://search.clinicalgenome.org/kb/conditions/MONDO:0024554","N/A","30 - Gene Associated with Autosomal Recessive Phenotype (08/22/2016)","","https://search.clinicalgenome.org/kb/gene-dosage/HGNC:28358","Dosage Working Group","","","","","",""
"DAG1","HGNC:2666","https://search.clinicalgenome.org/kb/genes/HGNC:2666","qualitative or quantitative defects of alpha-dystroglycan","MONDO:0018282","https://search.clinicalgenome.org/kb/conditions/MONDO:0018282","Autosomal recessive inheritance","","","","","moderate evidence (07/27/2021)","https://search.clinicalgenome.org/kb/gene-validity/CGGV:assertion_61b73fd7-5578-447b-9482-ea64d62dae1d-2021-07-27T163613.141Z","Limb Girdle Muscular Dystrophy","","",""
"DAO","HGNC:2671","https://search.clinicalgenome.org/kb/genes/HGNC:2671","amyotrophic lateral sclerosis","MONDO:0004976","https://search.clinicalgenome.org/kb/conditions/MONDO:0004976","Autosomal dominant inheritance","","","","","refuting evidence (04/12/2022)","https://search.clinicalgenome.org/kb/gene-validity/CGGV:assertion_35ac00ac-3279-4c7e-89b6-8a75e3cae414-2022-04-12T103808.867Z","Amyotrophic Lateral Sclerosis Spectrum Disorders","","",""
"DARS2","HGNC:25538","https://search.clinicalgenome.org/kb/genes/HGNC:25538","leukoencephalopathy with brain stem and spinal cord involvement-high lactate syndrome","MONDO:0012622","https://search.clinicalgenome.org/kb/conditions/MONDO:0012622","N/A","30 - Gene Associated with Autosomal Recessive Phenotype (08/22/2016)","0 - No Evidence for Haploinsufficiency (08/22/2016)","https://search.clinicalgenome.org/kb/gene-dosage/HGNC:25538","Dosage Working Group","","","","","",""
"DBH","HGNC:2689","https://search.clinicalgenome.org/kb/genes/HGNC:2689","dopamine beta-hydroxylase deficiency","MONDO:0009123","https://search.clinicalgenome.org/kb/conditions/MONDO:0009123","N/A","30 - Gene Associated with Autosomal Recessive Phenotype (08/22/2016)","0 - No Evidence for Haploinsufficiency (08/22/2016)","https://search.clinicalgenome.org/kb/gene-dosage/HGNC:2689","Dosage Working Group","","","","","",""
"DBT","HGNC:2698","https://search.clinicalgenome.org/kb/genes/HGNC:2698","maple syrup urine disease","MONDO:0009563","https://search.clinicalgenome.org/kb/conditions/MONDO:0009563","Autosomal recessive inheritance","30 - Gene Associated with Autosomal Recessive Phenotype (08/22/2016)","","https://search.clinicalgenome.org/kb/gene-dosage/HGNC:2698","Dosage Working Group","definitive evidence (10/30/2018)","https://search.clinicalgenome.org/kb/gene-validity/CGGV:assertion_cfd1ebde-e447-4877-977e-f5b9fe434adc-2018-10-30T160000.000Z","Aminoacidopathy","Has Insufficient Evidence for Actionability Based on Early Rule-out (06/28/2021) | Strong Actionability (06/28/2021)","https://search.clinicalgenome.org/kb/gene-validity/https://actionability.clinicalgenome.org/ac/Adult/ui/stg2SummaryRpt?doc=AC1041 | https://search.clinicalgenome.org/kb/gene-validity/https://actionability.clinicalgenome.org/ac/Pediatric/ui/stg2SummaryRpt?doc=AC1041","Adult Actionability Working Group | Pediatric Actionability Working Group"
"DBT","HGNC:2698","https://search.clinicalgenome.org/kb/genes/HGNC:2698","maple syrup urine disease, mild variant","MONDO:0014057","https://search.clinicalgenome.org/kb/conditions/MONDO:0014057","N/A","30 - Gene Associated with Autosomal Recessive Phenotype (08/22/2016)","","https://search.clinicalgenome.org/kb/gene-dosage/HGNC:2698","Dosage Working Group","","","","Has Insufficient Evidence for Actionability Based on Early Rule-out (06/28/2021) | Strong Actionability (06/28/2021)","https://search.clinicalgenome.org/kb/gene-validity/https://actionability.clinicalgenome.org/ac/Adult/ui/stg2SummaryRpt?doc=AC1041 | https://search.clinicalgenome.org/kb/gene-validity/https://actionability.clinicalgenome.org/ac/Pediatric/ui/stg2SummaryRpt?doc=AC1041","Adult Actionability Working Group | Pediatric Actionability Working Group"
"DBT","HGNC:2698","https://search.clinicalgenome.org/kb/genes/HGNC:2698","intermittent maple syrup urine disease","MONDO:0017053","https://search.clinicalgenome.org/kb/conditions/MONDO:0017053","N/A","30 - Gene Associated with Autosomal Recessive Phenotype (08/22/2016)","","https://search.clinicalgenome.org/kb/gene-dosage/HGNC:2698","Dosage Working Group","","","","Has Insufficient Evidence for Actionability Based on Early Rule-out (06/28/2021) | Strong Actionability (06/28/2021)","https://search.clinicalgenome.org/kb/gene-validity/https://actionability.clinicalgenome.org/ac/Adult/ui/stg2SummaryRpt?doc=AC1041 | https://search.clinicalgenome.org/kb/gene-validity/https://actionability.clinicalgenome.org/ac/Pediatric/ui/stg2SummaryRpt?doc=AC1041","Adult Actionability Working Group | Pediatric Actionability Working Group"
"DBT","HGNC:2698","https://search.clinicalgenome.org/kb/genes/HGNC:2698","intermediate maple syrup urine disease","MONDO:0017052","https://search.clinicalgenome.org/kb/conditions/MONDO:0017052","N/A","30 - Gene Associated with Autosomal Recessive Phenotype (08/22/2016)","","https://search.clinicalgenome.org/kb/gene-dosage/HGNC:2698","Dosage Working Group","","","","Has Insufficient Evidence for Actionability Based on Early Rule-out (06/28/2021) | Strong Actionability (06/28/2021)","https://search.clinicalgenome.org/kb/gene-validity/https://actionability.clinicalgenome.org/ac/Adult/ui/stg2SummaryRpt?doc=AC1041 | https://search.clinicalgenome.org/kb/gene-validity/https://actionability.clinicalgenome.org/ac/Pediatric/ui/stg2SummaryRpt?doc=AC1041","Adult Actionability Working Group | Pediatric Actionability Working Group"
"DBT","HGNC:2698","https://search.clinicalgenome.org/kb/genes/HGNC:2698","classic maple syrup urine disease","MONDO:0017051","https://search.clinicalgenome.org/kb/conditions/MONDO:0017051","N/A","30 - Gene Associated with Autosomal Recessive Phenotype (08/22/2016)","","https://search.clinicalgenome.org/kb/gene-dosage/HGNC:2698","Dosage Working Group","","","","Has Insufficient Evidence for Actionability Based on Early Rule-out (06/28/2021) | Strong Actionability (06/28/2021)","https://search.clinicalgenome.org/kb/gene-validity/https://actionability.clinicalgenome.org/ac/Adult/ui/stg2SummaryRpt?doc=AC1041 | https://search.clinicalgenome.org/kb/gene-validity/https://actionability.clinicalgenome.org/ac/Pediatric/ui/stg2SummaryRpt?doc=AC1041","Adult Actionability Working Group | Pediatric Actionability Working Group"
"DBT","HGNC:2698","https://search.clinicalgenome.org/kb/genes/HGNC:2698","thiamine-responsive maple syrup urine disease","MONDO:0017054","https://search.clinicalgenome.org/kb/conditions/MONDO:0017054","N/A","30 - Gene Associated with Autosomal Recessive Phenotype (08/22/2016)","","https://search.clinicalgenome.org/kb/gene-dosage/HGNC:2698","Dosage Working Group","","","","Has Insufficient Evidence for Actionability Based on Early Rule-out (06/28/2021) | Strong Actionability (06/28/2021)","https://search.clinicalgenome.org/kb/gene-validity/https://actionability.clinicalgenome.org/ac/Adult/ui/stg2SummaryRpt?doc=AC1041 | https://search.clinicalgenome.org/kb/gene-validity/https://actionability.clinicalgenome.org/ac/Pediatric/ui/stg2SummaryRpt?doc=AC1041","Adult Actionability Working Group | Pediatric Actionability Working Group"
"DBT","HGNC:2698","https://search.clinicalgenome.org/kb/genes/HGNC:2698","maple syrup urine disease type 2","MONDO:0023693","https://search.clinicalgenome.org/kb/conditions/MONDO:0023693","N/A","30 - Gene Associated with Autosomal Recessive Phenotype (08/22/2016)","","https://search.clinicalgenome.org/kb/gene-dosage/HGNC:2698","Dosage Working Group","","","","Has Insufficient Evidence for Actionability Based on Early Rule-out (06/28/2021) | Strong Actionability (06/28/2021)","https://search.clinicalgenome.org/kb/gene-validity/https://actionability.clinicalgenome.org/ac/Adult/ui/stg2SummaryRpt?doc=AC1041 | https://search.clinicalgenome.org/kb/gene-validity/https://actionability.clinicalgenome.org/ac/Pediatric/ui/stg2SummaryRpt?doc=AC1041","Adult Actionability Working Group | Pediatric Actionability Working Group"
"DCAF17","HGNC:25784","https://search.clinicalgenome.org/kb/genes/HGNC:25784","Woodhouse-Sakati syndrome","MONDO:0009419","https://search.clinicalgenome.org/kb/conditions/MONDO:0009419","Autosomal recessive inheritance","","","","","definitive evidence (07/27/2021)","https://search.clinicalgenome.org/kb/gene-validity/CGGV:assertion_6a1d7719-4261-494d-87aa-745518580673-2021-07-27T153526.827Z","Syndromic Disorders","","",""
"DCDC2","HGNC:18141","https://search.clinicalgenome.org/kb/genes/HGNC:18141","nonsyndromic genetic hearing loss","MONDO:0019497","https://search.clinicalgenome.org/kb/conditions/MONDO:0019497","Autosomal recessive inheritance","","","","","limited evidence (08/31/2020)","https://search.clinicalgenome.org/kb/gene-validity/CGGV:assertion_86802e37-e2a5-43b9-8538-e104859b4c55-2020-08-31T170000.000Z","Hearing Loss","","",""
"DCDC2","HGNC:18141","https://search.clinicalgenome.org/kb/genes/HGNC:18141","ciliopathy","MONDO:0005308","https://search.clinicalgenome.org/kb/conditions/MONDO:0005308","Autosomal recessive inheritance","","","","","definitive evidence (10/13/2021)","https://search.clinicalgenome.org/kb/gene-validity/CGGV:assertion_477c8aba-eeba-43dc-a5e2-f6f84b127b8f-2021-10-13T160000.000Z","Kidney Cystic and Ciliopathy Disorders","","",""
"DCLRE1C","HGNC:17642","https://search.clinicalgenome.org/kb/genes/HGNC:17642","severe combined immunodeficiency due to DCLRE1C deficiency","MONDO:0011225","https://search.clinicalgenome.org/kb/conditions/MONDO:0011225","Autosomal recessive inheritance","30 - Gene Associated with Autosomal Recessive Phenotype (08/22/2016)","0 - No Evidence for Haploinsufficiency (08/22/2016)","https://search.clinicalgenome.org/kb/gene-dosage/HGNC:17642","Dosage Working Group","definitive evidence (02/18/2021)","https://search.clinicalgenome.org/kb/gene-validity/CGGV:assertion_603e0855-2b57-4463-a9b7-1c5d70089a4f-2021-02-18T154301.245Z","SCID-CID","","",""
"DCX","HGNC:2714","https://search.clinicalgenome.org/kb/genes/HGNC:2714","lissencephaly spectrum disorders","MONDO:0018838","https://search.clinicalgenome.org/kb/conditions/MONDO:0018838","X-linked inheritance","3 - Sufficient Evidence for Haploinsufficiency (07/06/2012)","0 - No Evidence for Haploinsufficiency (07/06/2012)","https://search.clinicalgenome.org/kb/gene-dosage/HGNC:2714","Dosage Working Group","definitive evidence (02/23/2021)","https://search.clinicalgenome.org/kb/gene-validity/CGGV:assertion_3b0d23d1-5ca6-4584-9d74-cf78ca21b0e1-2021-02-23T150911.296Z","Brain Malformations","","",""
"DCX","HGNC:2714","https://search.clinicalgenome.org/kb/genes/HGNC:2714","lissencephaly type 1 due to doublecortin gene mutation","MONDO:0010239","https://search.clinicalgenome.org/kb/conditions/MONDO:0010239","N/A","3 - Sufficient Evidence for Haploinsufficiency (07/06/2012)","0 - No Evidence for Haploinsufficiency (07/06/2012)","https://search.clinicalgenome.org/kb/gene-dosage/HGNC:2714","Dosage Working Group","","","","","",""
"DCXR","HGNC:18985","https://search.clinicalgenome.org/kb/genes/HGNC:18985","pentosuria","MONDO:0009846","https://search.clinicalgenome.org/kb/conditions/MONDO:0009846","N/A","30 - Gene Associated with Autosomal Recessive Phenotype (08/22/2016)","0 - No Evidence for Haploinsufficiency (08/22/2016)","https://search.clinicalgenome.org/kb/gene-dosage/HGNC:18985","Dosage Working Group","","","","","",""
"DDB2","HGNC:2718","https://search.clinicalgenome.org/kb/genes/HGNC:2718","xeroderma pigmentosum group E","MONDO:0010213","https://search.clinicalgenome.org/kb/conditions/MONDO:0010213","Autosomal recessive inheritance","30 - Gene Associated with Autosomal Recessive Phenotype (08/22/2016)","","https://search.clinicalgenome.org/kb/gene-dosage/HGNC:2718","Dosage Working Group","definitive evidence (11/02/2018)","https://search.clinicalgenome.org/kb/gene-validity/CGGV:assertion_cf2a4254-51ec-467a-9194-3962d39a6b20-2018-11-02T214938.544Z","Hereditary Cancer","","",""
"DDC","HGNC:2719","https://search.clinicalgenome.org/kb/genes/HGNC:2719","aromatic L-amino acid decarboxylase deficiency","MONDO:0012084","https://search.clinicalgenome.org/kb/conditions/MONDO:0012084","Autosomal recessive inheritance","","","","","definitive evidence (02/25/2022)","https://search.clinicalgenome.org/kb/gene-validity/CGGV:assertion_1dea33e3-7cf6-47f9-aa52-2525b439031a-2022-02-25T170000.000Z","General Inborn Errors of Metabolism","","",""
"DDHD1","HGNC:19714","https://search.clinicalgenome.org/kb/genes/HGNC:19714","hereditary spastic paraplegia 28","MONDO:0012256","https://search.clinicalgenome.org/kb/conditions/MONDO:0012256","N/A","30 - Gene Associated with Autosomal Recessive Phenotype (09/25/2014)","0 - No Evidence for Haploinsufficiency (09/25/2014)","https://search.clinicalgenome.org/kb/gene-dosage/HGNC:19714","Dosage Working Group","","","","","",""
"DDOST","HGNC:2728","https://search.clinicalgenome.org/kb/genes/HGNC:2728","DDOST-CDG","MONDO:0013789","https://search.clinicalgenome.org/kb/conditions/MONDO:0013789","N/A","30 - Gene Associated with Autosomal Recessive Phenotype (08/22/2016)","0 - No Evidence for Haploinsufficiency (08/22/2016)","https://search.clinicalgenome.org/kb/gene-dosage/HGNC:2728","Dosage Working Group","","","","","",""
"DDX3X","HGNC:2745","https://search.clinicalgenome.org/kb/genes/HGNC:2745","X-linked syndromic intellectual disability","MONDO:0020119","https://search.clinicalgenome.org/kb/conditions/MONDO:0020119","X-linked inheritance","3 - Sufficient Evidence for Haploinsufficiency (11/22/2017)","0 - No Evidence for Haploinsufficiency (11/22/2017)","https://search.clinicalgenome.org/kb/gene-dosage/HGNC:2745","Dosage Working Group","definitive evidence (05/05/2020)","https://search.clinicalgenome.org/kb/gene-validity/CGGV:assertion_3b7c89d4-ccb2-4d4e-ad11-9d6051a40b6d-2020-05-05T160000.000Z","Intellectual Disability and Autism","","",""
"DDX3X","HGNC:2745","https://search.clinicalgenome.org/kb/genes/HGNC:2745","intellectual disability, X-linked 102","MONDO:0010497","https://search.clinicalgenome.org/kb/conditions/MONDO:0010497","N/A","3 - Sufficient Evidence for Haploinsufficiency (11/22/2017)","0 - No Evidence for Haploinsufficiency (11/22/2017)","https://search.clinicalgenome.org/kb/gene-dosage/HGNC:2745","Dosage Working Group","","","","","",""
"DDX41","HGNC:18674","https://search.clinicalgenome.org/kb/genes/HGNC:18674","DDX41-related hematologic malignancy predisposition syndrome","MONDO:0014809","https://search.clinicalgenome.org/kb/conditions/MONDO:0014809","Autosomal dominant inheritance","3 - Sufficient Evidence for Haploinsufficiency (02/09/2022)","0 - No Evidence for Haploinsufficiency (02/09/2022)","https://search.clinicalgenome.org/kb/gene-dosage/HGNC:18674","Dosage Working Group","definitive evidence (07/30/2020)","https://search.clinicalgenome.org/kb/gene-validity/CGGV:assertion_e3db8214-a39d-408d-a3c2-7b4e817b1cc1-2020-07-30T202935.621Z","Hereditary Cancer","","",""
"DECR1","HGNC:2753","https://search.clinicalgenome.org/kb/genes/HGNC:2753","progressive encephalopathy with leukodystrophy due to DECR deficiency","MONDO:0014464","https://search.clinicalgenome.org/kb/conditions/MONDO:0014464","Mode of inheritance","","","","","no known disease relationship (01/25/2021)","https://search.clinicalgenome.org/kb/gene-validity/CGGV:assertion_1d25dfe8-8d0b-4b45-b04c-b315ebdceaaa-2021-01-25T194921.121Z","Fatty Acid Oxidation Disorders","","",""
"DEPDC5","HGNC:18423","https://search.clinicalgenome.org/kb/genes/HGNC:18423","familial focal epilepsy with variable foci","MONDO:0020310","https://search.clinicalgenome.org/kb/conditions/MONDO:0020310","Autosomal dominant inheritance","","","","","definitive evidence (08/24/2018)","https://search.clinicalgenome.org/kb/gene-validity/CGGV:assertion_82a82c75-f9a5-4f51-a15c-6513c13df57c-2018-08-24T135901.645Z","Epilepsy","","",""
"DES","HGNC:2770","https://search.clinicalgenome.org/kb/genes/HGNC:2770","arrhythmogenic right ventricular cardiomyopathy","MONDO:0016587","https://search.clinicalgenome.org/kb/conditions/MONDO:0016587","Autosomal dominant inheritance","","","","","moderate evidence (09/11/2018)","https://search.clinicalgenome.org/kb/gene-validity/CGGV:assertion_aef9a60b-a94f-4318-824e-e748c5c20ecb-2018-09-11T160000.000Z","Arrhythmogenic Right Ventricular Cardiomyopathy","","",""
"DES","HGNC:2770","https://search.clinicalgenome.org/kb/genes/HGNC:2770","dilated cardiomyopathy","MONDO:0005021","https://search.clinicalgenome.org/kb/conditions/MONDO:0005021","Autosomal dominant inheritance","","","","","definitive evidence (10/09/2020)","https://search.clinicalgenome.org/kb/gene-validity/CGGV:assertion_91b2595a-5eb9-4ac3-aa3d-d5f99cacad84-2020-10-09T160000.000Z","Dilated Cardiomyopathy","","",""
"DES","HGNC:2770","https://search.clinicalgenome.org/kb/genes/HGNC:2770","myofibrillar myopathy","MONDO:0018943","https://search.clinicalgenome.org/kb/conditions/MONDO:0018943","N/A","","","","","","","","Moderate Actionability (09/06/2018)","https://search.clinicalgenome.org/kb/gene-validity/https://actionability.clinicalgenome.org/ac/Adult/ui/stg2SummaryRpt?doc=AC155","Adult Actionability Working Group"
"DES","HGNC:2770","https://search.clinicalgenome.org/kb/genes/HGNC:2770","myofibrillar myopathy 1","MONDO:0011076","https://search.clinicalgenome.org/kb/conditions/MONDO:0011076","N/A","","","","","","","","Moderate Actionability (09/06/2018)","https://search.clinicalgenome.org/kb/gene-validity/https://actionability.clinicalgenome.org/ac/Adult/ui/stg2SummaryRpt?doc=AC155","Adult Actionability Working Group"
"DGKE","HGNC:2852","https://search.clinicalgenome.org/kb/genes/HGNC:2852","immunoglobulin-mediated membranoproliferative glomerulonephritis","MONDO:0014005","https://search.clinicalgenome.org/kb/conditions/MONDO:0014005","N/A","30 - Gene Associated with Autosomal Recessive Phenotype (08/22/2016)","0 - No Evidence for Haploinsufficiency (08/22/2016)","https://search.clinicalgenome.org/kb/gene-dosage/HGNC:2852","Dosage Working Group","","","","","",""
"DGUOK","HGNC:2858","https://search.clinicalgenome.org/kb/genes/HGNC:2858","mitochondrial DNA depletion syndrome 3","MONDO:0009636","https://search.clinicalgenome.org/kb/conditions/MONDO:0009636","N/A","30 - Gene Associated with Autosomal Recessive Phenotype (08/22/2016)","","https://search.clinicalgenome.org/kb/gene-dosage/HGNC:2858","Dosage Working Group","","","","","",""
"DHCR7","HGNC:2860","https://search.clinicalgenome.org/kb/genes/HGNC:2860","Smith-Lemli-Opitz syndrome","MONDO:0010035","https://search.clinicalgenome.org/kb/conditions/MONDO:0010035","Autosomal recessive inheritance","30 - Gene Associated with Autosomal Recessive Phenotype (04/04/2012)","0 - No Evidence for Haploinsufficiency (04/04/2012)","https://search.clinicalgenome.org/kb/gene-dosage/HGNC:2860","Dosage Working Group","definitive evidence (09/11/2018)","https://search.clinicalgenome.org/kb/gene-validity/CGGV:assertion_d5ed71c9-a76b-44c0-b5c0-44d604f2e0e9-2018-09-11T163302.452Z","Intellectual Disability and Autism","Has Insufficient Evidence for Actionability Based on Early Rule-out (12/03/2019) | Limited Actionability (06/03/2020)","https://search.clinicalgenome.org/kb/gene-validity/https://actionability.clinicalgenome.org/ac/Adult/ui/stg2SummaryRpt?doc=AC1011 | https://search.clinicalgenome.org/kb/gene-validity/https://actionability.clinicalgenome.org/ac/Pediatric/ui/stg2SummaryRpt?doc=AC1011","Adult Actionability Working Group | Pediatric Actionability Working Group"
"DHODH","HGNC:2867","https://search.clinicalgenome.org/kb/genes/HGNC:2867","postaxial acrofacial dysostosis","MONDO:0009903","https://search.clinicalgenome.org/kb/conditions/MONDO:0009903","N/A","30 - Gene Associated with Autosomal Recessive Phenotype (08/22/2016)","0 - No Evidence for Haploinsufficiency (08/22/2016)","https://search.clinicalgenome.org/kb/gene-dosage/HGNC:2867","Dosage Working Group","","","","","",""
"DHTKD1","HGNC:23537","https://search.clinicalgenome.org/kb/genes/HGNC:23537","2-aminoadipic 2-oxoadipic aciduria","MONDO:0008774","https://search.clinicalgenome.org/kb/conditions/MONDO:0008774","Autosomal recessive inheritance","","","","","definitive evidence (11/03/2020)","https://search.clinicalgenome.org/kb/gene-validity/CGGV:assertion_d6dd5de3-9819-432d-996c-12a66dff277f-2020-11-03T193815.515Z","Aminoacidopathy","","",""
"DIABLO","HGNC:21528","https://search.clinicalgenome.org/kb/genes/HGNC:21528","nonsyndromic genetic hearing loss","MONDO:0019497","https://search.clinicalgenome.org/kb/conditions/MONDO:0019497","Autosomal dominant inheritance","","","","","limited evidence (09/21/2021)","https://search.clinicalgenome.org/kb/gene-validity/CGGV:assertion_f5903c3b-b2d7-4c14-b196-37533187d807-2021-09-21T160000.000Z","Hearing Loss","","",""
"DIAPH1","HGNC:2876","https://search.clinicalgenome.org/kb/genes/HGNC:2876","diaph1-related sensorineural hearing loss-thrombocytopenia syndrome","MONDO:0044635","https://search.clinicalgenome.org/kb/conditions/MONDO:0044635","Autosomal dominant inheritance","","","","","definitive evidence (01/05/2018)","https://search.clinicalgenome.org/kb/gene-validity/CGGV:assertion_43c017fd-ce70-4fbe-ad30-90f216adaa7d-2018-01-05T170000.000Z","Hearing Loss","","",""
"DIAPH3","HGNC:15480","https://search.clinicalgenome.org/kb/genes/HGNC:15480","auditory neuropathy","MONDO:0021944","https://search.clinicalgenome.org/kb/conditions/MONDO:0021944","Autosomal dominant inheritance","","","","","limited evidence (02/06/2020)","https://search.clinicalgenome.org/kb/gene-validity/CGGV:assertion_fc54aaf6-8e1b-4c98-bcbe-e1f337f6eadc-2020-02-06T170000.000Z","Hearing Loss","","",""
"DICER1","HGNC:17098","https://search.clinicalgenome.org/kb/genes/HGNC:17098","pleuropulmonary blastoma","MONDO:0011014","https://search.clinicalgenome.org/kb/conditions/MONDO:0011014","Autosomal dominant inheritance","3 - Sufficient Evidence for Haploinsufficiency (02/09/2022)","0 - No Evidence for Haploinsufficiency (02/09/2022)","https://search.clinicalgenome.org/kb/gene-dosage/HGNC:17098","Dosage Working Group","definitive evidence (01/08/2017)","https://search.clinicalgenome.org/kb/gene-validity/CGGCIEX:assertion_3212","General Gene Curation","Assertion Pending (05/29/2019) | Moderate Actionability (05/29/2019)","https://search.clinicalgenome.org/kb/gene-validity/https://actionability.clinicalgenome.org/ac/Adult/ui/stg2SummaryRpt?doc=AC002 | https://search.clinicalgenome.org/kb/gene-validity/https://actionability.clinicalgenome.org/ac/Pediatric/ui/stg2SummaryRpt?doc=AC002","Adult Actionability Working Group | Pediatric Actionability Working Group"
"DICER1","HGNC:17098","https://search.clinicalgenome.org/kb/genes/HGNC:17098","DICER1 syndrome","MONDO:0017288","https://search.clinicalgenome.org/kb/conditions/MONDO:0017288","N/A","3 - Sufficient Evidence for Haploinsufficiency (02/09/2022)","0 - No Evidence for Haploinsufficiency (02/09/2022)","https://search.clinicalgenome.org/kb/gene-dosage/HGNC:17098","Dosage Working Group","","","","Assertion Pending (05/29/2019) | Moderate Actionability (05/29/2019)","https://search.clinicalgenome.org/kb/gene-validity/https://actionability.clinicalgenome.org/ac/Adult/ui/stg2SummaryRpt?doc=AC002 | https://search.clinicalgenome.org/kb/gene-validity/https://actionability.clinicalgenome.org/ac/Pediatric/ui/stg2SummaryRpt?doc=AC002","Adult Actionability Working Group | Pediatric Actionability Working Group"
"DICER1","HGNC:17098","https://search.clinicalgenome.org/kb/genes/HGNC:17098","rhabdomyosarcoma","MONDO:0005212","https://search.clinicalgenome.org/kb/conditions/MONDO:0005212","N/A","3 - Sufficient Evidence for Haploinsufficiency (02/09/2022)","0 - No Evidence for Haploinsufficiency (02/09/2022)","https://search.clinicalgenome.org/kb/gene-dosage/HGNC:17098","Dosage Working Group","","","","Assertion Pending (05/29/2019) | Moderate Actionability (05/29/2019)","https://search.clinicalgenome.org/kb/gene-validity/https://actionability.clinicalgenome.org/ac/Adult/ui/stg2SummaryRpt?doc=AC002 | https://search.clinicalgenome.org/kb/gene-validity/https://actionability.clinicalgenome.org/ac/Pediatric/ui/stg2SummaryRpt?doc=AC002","Adult Actionability Working Group | Pediatric Actionability Working Group"
"DICER1","HGNC:17098","https://search.clinicalgenome.org/kb/genes/HGNC:17098","goiter, multinodular 1, with or without Sertoli-Leydig cell tumors","MONDO:0007681","https://search.clinicalgenome.org/kb/conditions/MONDO:0007681","N/A","3 - Sufficient Evidence for Haploinsufficiency (02/09/2022)","0 - No Evidence for Haploinsufficiency (02/09/2022)","https://search.clinicalgenome.org/kb/gene-dosage/HGNC:17098","Dosage Working Group","","","","Assertion Pending (05/29/2019) | Moderate Actionability (05/29/2019)","https://search.clinicalgenome.org/kb/gene-validity/https://actionability.clinicalgenome.org/ac/Adult/ui/stg2SummaryRpt?doc=AC002 | https://search.clinicalgenome.org/kb/gene-validity/https://actionability.clinicalgenome.org/ac/Pediatric/ui/stg2SummaryRpt?doc=AC002","Adult Actionability Working Group | Pediatric Actionability Working Group"
"DIP2A","HGNC:17217","https://search.clinicalgenome.org/kb/genes/HGNC:17217","complex neurodevelopmental disorder","MONDO:0100038","https://search.clinicalgenome.org/kb/conditions/MONDO:0100038","N/A","1 - Little Evidence for Haploinsufficiency (01/23/2019)","0 - No Evidence for Haploinsufficiency (01/23/2019)","https://search.clinicalgenome.org/kb/gene-dosage/HGNC:17217","Dosage Working Group","","","","","",""
"DIS3L2","HGNC:28648","https://search.clinicalgenome.org/kb/genes/HGNC:28648","Perlman syndrome","MONDO:0009965","https://search.clinicalgenome.org/kb/conditions/MONDO:0009965","Autosomal recessive inheritance","1 - Little Evidence for Haploinsufficiency (10/14/2020)","0 - No Evidence for Haploinsufficiency (10/14/2020)","https://search.clinicalgenome.org/kb/gene-dosage/HGNC:28648","Dosage Working Group","definitive evidence (11/21/2019)","https://search.clinicalgenome.org/kb/gene-validity/CGGV:assertion_e68b93df-e0e7-4d46-8934-8b86064c0b37-2019-11-21T193052.781Z","Hereditary Cancer","","",""
"DKC1","HGNC:2890","https://search.clinicalgenome.org/kb/genes/HGNC:2890","DKC1-related disorder","MONDO:0100152","https://search.clinicalgenome.org/kb/conditions/MONDO:0100152","X-linked inheritance","1 - Little Evidence for Haploinsufficiency (04/25/2012)","0 - No Evidence for Haploinsufficiency (04/25/2012)","https://search.clinicalgenome.org/kb/gene-dosage/HGNC:2890","Dosage Working Group","definitive evidence (09/13/2020)","https://search.clinicalgenome.org/kb/gene-validity/CGGV:assertion_afd6a4ca-7a1c-42ef-a9cf-bef557128f12-2020-09-13T153338.000Z","Intellectual Disability and Autism","","",""
"DKC1","HGNC:2890","https://search.clinicalgenome.org/kb/genes/HGNC:2890","dyskeratosis congenita, X-linked","MONDO:0010584","https://search.clinicalgenome.org/kb/conditions/MONDO:0010584","X-linked inheritance","1 - Little Evidence for Haploinsufficiency (04/25/2012)","0 - No Evidence for Haploinsufficiency (04/25/2012)","https://search.clinicalgenome.org/kb/gene-dosage/HGNC:2890","Dosage Working Group","definitive evidence (06/15/2021)","https://search.clinicalgenome.org/kb/gene-validity/CGGV:assertion_bb90bea1-16e7-44da-8551-91fb5fd7088a-2021-06-15T234140.163Z","Hereditary Cancer","","",""
"DLAT","HGNC:2896","https://search.clinicalgenome.org/kb/genes/HGNC:2896","Leigh syndrome","MONDO:0009723","https://search.clinicalgenome.org/kb/conditions/MONDO:0009723","Autosomal recessive inheritance","","","","","moderate evidence (01/14/2021)","https://search.clinicalgenome.org/kb/gene-validity/CGGV:assertion_78e45dbe-ea30-434d-9522-aa1731b9a764-2021-01-14T212056.234Z","Mitochondrial Diseases","","",""
"DLD","HGNC:2898","https://search.clinicalgenome.org/kb/genes/HGNC:2898","pyruvate dehydrogenase E3 deficiency","MONDO:0009529","https://search.clinicalgenome.org/kb/conditions/MONDO:0009529","Autosomal recessive inheritance","","","","","definitive evidence (03/08/2019)","https://search.clinicalgenome.org/kb/gene-validity/CGGV:assertion_a9dfbbc2-cede-491e-9db0-fc5719fbc729-2019-03-08T170000.000Z","Aminoacidopathy","","",""
"DLD","HGNC:2898","https://search.clinicalgenome.org/kb/genes/HGNC:2898","Leigh syndrome","MONDO:0009723","https://search.clinicalgenome.org/kb/conditions/MONDO:0009723","Autosomal recessive inheritance","","","","","definitive evidence (03/11/2021)","https://search.clinicalgenome.org/kb/gene-validity/CGGV:assertion_990dd96f-16ec-4c0f-a46b-ce4a647b7a50-2021-03-11T171246.198Z","Mitochondrial Diseases","","",""
"DLG2","HGNC:2901","https://search.clinicalgenome.org/kb/genes/HGNC:2901","complex neurodevelopmental disorder","MONDO:0100038","https://search.clinicalgenome.org/kb/conditions/MONDO:0100038","N/A","1 - Little Evidence for Haploinsufficiency (11/28/2018)","0 - No Evidence for Haploinsufficiency (11/28/2018)","https://search.clinicalgenome.org/kb/gene-dosage/HGNC:2901","Dosage Working Group","","","","","",""
"DLG3","HGNC:2902","https://search.clinicalgenome.org/kb/genes/HGNC:2902","non-syndromic X-linked intellectual disability","MONDO:0019181","https://search.clinicalgenome.org/kb/conditions/MONDO:0019181","X-linked inheritance","2 - Emerging Evidence for Haploinsufficiency (11/21/2019)","0 - No Evidence for Haploinsufficiency (11/21/2019)","https://search.clinicalgenome.org/kb/gene-dosage/HGNC:2902","Dosage Working Group","definitive evidence (08/24/2018)","https://search.clinicalgenome.org/kb/gene-validity/CGGV:assertion_e73a08f0-ff3a-4328-9020-89102296e405-2018-08-24T164248.949Z","Intellectual Disability and Autism","","",""
"DLG3","HGNC:2902","https://search.clinicalgenome.org/kb/genes/HGNC:2902","intellectual disability, X-linked 90","MONDO:0010452","https://search.clinicalgenome.org/kb/conditions/MONDO:0010452","N/A","2 - Emerging Evidence for Haploinsufficiency (11/21/2019)","0 - No Evidence for Haploinsufficiency (11/21/2019)","https://search.clinicalgenome.org/kb/gene-dosage/HGNC:2902","Dosage Working Group","","","","","",""
"DLGAP2","HGNC:2906","https://search.clinicalgenome.org/kb/genes/HGNC:2906","complex neurodevelopmental disorder","MONDO:0100038","https://search.clinicalgenome.org/kb/conditions/MONDO:0100038","Autosomal dominant inheritance","0 - No Evidence for Haploinsufficiency (03/22/2012)","0 - No Evidence for Haploinsufficiency (03/22/2012)","https://search.clinicalgenome.org/kb/gene-dosage/HGNC:2906","Dosage Working Group","limited evidence (10/14/2021)","https://search.clinicalgenome.org/kb/gene-validity/CGGV:assertion_efeafdd5-9105-470f-b332-8c7a3dd65078-2021-10-14T160000.000Z","Intellectual Disability and Autism","","",""
"DLL1","HGNC:2908","https://search.clinicalgenome.org/kb/genes/HGNC:2908","neurodevelopmental disorder with nonspecific brain abnormalities and with or without seizures","MONDO:0032877","https://search.clinicalgenome.org/kb/conditions/MONDO:0032877","N/A","3 - Sufficient Evidence for Haploinsufficiency (03/09/2021)","0 - No Evidence for Haploinsufficiency (03/09/2021)","https://search.clinicalgenome.org/kb/gene-dosage/HGNC:2908","Dosage Working Group","","","","","",""
"DLX5","HGNC:2918","https://search.clinicalgenome.org/kb/genes/HGNC:2918","split hand-foot malformation 1 with sensorineural hearing loss","MONDO:0009080","https://search.clinicalgenome.org/kb/conditions/MONDO:0009080","N/A","0 - No Evidence for Haploinsufficiency (05/14/2012)","0 - No Evidence for Haploinsufficiency (05/14/2012)","https://search.clinicalgenome.org/kb/gene-dosage/HGNC:2918","Dosage Working Group","","","","","",""
"DLX6","HGNC:2919","https://search.clinicalgenome.org/kb/genes/HGNC:2919","split hand-foot malformation 1 with sensorineural hearing loss","MONDO:0009080","https://search.clinicalgenome.org/kb/conditions/MONDO:0009080","N/A","0 - No Evidence for Haploinsufficiency (05/14/2012)","0 - No Evidence for Haploinsufficiency (05/14/2012)","https://search.clinicalgenome.org/kb/gene-dosage/HGNC:2919","Dosage Working Group","","","","","",""
"DMD","HGNC:2928","https://search.clinicalgenome.org/kb/genes/HGNC:2928","progressive muscular dystrophy","MONDO:0016106","https://search.clinicalgenome.org/kb/conditions/MONDO:0016106","X-linked inheritance","3 - Sufficient Evidence for Haploinsufficiency (11/20/2019)","0 - No Evidence for Haploinsufficiency (11/20/2019)","https://search.clinicalgenome.org/kb/gene-dosage/HGNC:2928","Dosage Working Group","definitive evidence (04/09/2021)","https://search.clinicalgenome.org/kb/gene-validity/CGGV:assertion_b528435f-dc16-45e0-9f0f-2da3f293ab4c-2021-04-09T185212.943Z","Limb Girdle Muscular Dystrophy","","",""
"DMD","HGNC:2928","https://search.clinicalgenome.org/kb/genes/HGNC:2928","dilated cardiomyopathy 3B","MONDO:0010542","https://search.clinicalgenome.org/kb/conditions/MONDO:0010542","N/A","3 - Sufficient Evidence for Haploinsufficiency (11/20/2019)","0 - No Evidence for Haploinsufficiency (11/20/2019)","https://search.clinicalgenome.org/kb/gene-dosage/HGNC:2928","Dosage Working Group","","","","Assertion Pending (08/14/2017)","https://search.clinicalgenome.org/kb/gene-validity/https://actionability.clinicalgenome.org/ac/Adult/ui/stg2SummaryRpt?doc=AC138","Adult Actionability Working Group"
"DMD","HGNC:2928","https://search.clinicalgenome.org/kb/genes/HGNC:2928","Duchenne muscular dystrophy","MONDO:0010679","https://search.clinicalgenome.org/kb/conditions/MONDO:0010679","N/A","3 - Sufficient Evidence for Haploinsufficiency (11/20/2019)","0 - No Evidence for Haploinsufficiency (11/20/2019)","https://search.clinicalgenome.org/kb/gene-dosage/HGNC:2928","Dosage Working Group","","","","","",""
"DMGDH","HGNC:24475","https://search.clinicalgenome.org/kb/genes/HGNC:24475","dimethylglycine dehydrogenase deficiency","MONDO:0011610","https://search.clinicalgenome.org/kb/conditions/MONDO:0011610","Autosomal recessive inheritance","","","","","limited evidence (06/28/2019)","https://search.clinicalgenome.org/kb/gene-validity/CGGV:assertion_b181250b-bc72-43b7-adec-5b85860b1a62-2019-06-28T160000.000Z","Aminoacidopathy","","",""
"DMP1","HGNC:2932","https://search.clinicalgenome.org/kb/genes/HGNC:2932","hypophosphatemic rickets, autosomal recessive, 1","MONDO:0009430","https://search.clinicalgenome.org/kb/conditions/MONDO:0009430","N/A","30 - Gene Associated with Autosomal Recessive Phenotype (08/22/2016)","","https://search.clinicalgenome.org/kb/gene-dosage/HGNC:2932","Dosage Working Group","","","","","",""
"DMXL2","HGNC:2938","https://search.clinicalgenome.org/kb/genes/HGNC:2938","nonsyndromic genetic hearing loss","MONDO:0019497","https://search.clinicalgenome.org/kb/conditions/MONDO:0019497","Autosomal dominant inheritance","0 - No Evidence for Haploinsufficiency (04/04/2012)","0 - No Evidence for Haploinsufficiency (04/04/2012)","https://search.clinicalgenome.org/kb/gene-dosage/HGNC:2938","Dosage Working Group","limited evidence (02/06/2020)","https://search.clinicalgenome.org/kb/gene-validity/CGGV:assertion_746b46e8-0621-4879-80a1-4fb1679975be-2020-02-06T170000.000Z","Hearing Loss","","",""
"DNAAF1","HGNC:30539","https://search.clinicalgenome.org/kb/genes/HGNC:30539","primary ciliary dyskinesia 13","MONDO:0013174","https://search.clinicalgenome.org/kb/conditions/MONDO:0013174","N/A","30 - Gene Associated with Autosomal Recessive Phenotype (08/22/2016)","0 - No Evidence for Haploinsufficiency (08/22/2016)","https://search.clinicalgenome.org/kb/gene-dosage/HGNC:30539","Dosage Working Group","","","","","",""
"DNAAF11","HGNC:16725","https://search.clinicalgenome.org/kb/genes/HGNC:16725","primary ciliary dyskinesia 19","MONDO:0013979","https://search.clinicalgenome.org/kb/conditions/MONDO:0013979","N/A","30 - Gene Associated with Autosomal Recessive Phenotype (08/22/2016)","","https://search.clinicalgenome.org/kb/gene-dosage/HGNC:16725","Dosage Working Group","","","","","",""
"DNAAF3","HGNC:30492","https://search.clinicalgenome.org/kb/genes/HGNC:30492","primary ciliary dyskinesia 2","MONDO:0011718","https://search.clinicalgenome.org/kb/conditions/MONDO:0011718","Autosomal recessive inheritance","","","","","definitive evidence (05/09/2022)","https://search.clinicalgenome.org/kb/gene-validity/CGGV:assertion_40329b6f-2d65-49dd-863b-f79dcd1b5a23-2022-05-09T155600.823Z","Motile Ciliopathy","","",""
"DNAH1","HGNC:2940","https://search.clinicalgenome.org/kb/genes/HGNC:2940","ciliary dyskinesia, primary, 37","MONDO:0033204","https://search.clinicalgenome.org/kb/conditions/MONDO:0033204","Autosomal recessive inheritance","","","","","limited evidence (04/14/2022)","https://search.clinicalgenome.org/kb/gene-validity/CGGV:assertion_a07c8b6e-a558-498b-975c-b12e96878a44-2022-04-14T013721.941Z","Motile Ciliopathy","","",""
"DNAH1","HGNC:2940","https://search.clinicalgenome.org/kb/genes/HGNC:2940","spermatogenic failure 18","MONDO:0054615","https://search.clinicalgenome.org/kb/conditions/MONDO:0054615","Autosomal recessive inheritance","","","","","definitive evidence (05/26/2022)","https://search.clinicalgenome.org/kb/gene-validity/CGGV:assertion_4a5dff5a-ff66-4e80-9eca-cb5f924edb73-2022-05-26T160000.000Z","Motile Ciliopathy","","",""
"DNAH11","HGNC:2942","https://search.clinicalgenome.org/kb/genes/HGNC:2942","primary ciliary dyskinesia 7","MONDO:0012748","https://search.clinicalgenome.org/kb/conditions/MONDO:0012748","Autosomal recessive inheritance","30 - Gene Associated with Autosomal Recessive Phenotype (08/22/2016)","0 - No Evidence for Haploinsufficiency (08/22/2016)","https://search.clinicalgenome.org/kb/gene-dosage/HGNC:2942","Dosage Working Group","definitive evidence (10/25/2021)","https://search.clinicalgenome.org/kb/gene-validity/CGGV:assertion_84088c46-0763-4ed6-9352-530d846e8b24-2021-10-25T190427.941Z","Motile Ciliopathy","","",""
"DNAH5","HGNC:2950","https://search.clinicalgenome.org/kb/genes/HGNC:2950","primary ciliary dyskinesia 3","MONDO:0012085","https://search.clinicalgenome.org/kb/conditions/MONDO:0012085","Autosomal recessive inheritance","30 - Gene Associated with Autosomal Recessive Phenotype (08/22/2016)","0 - No Evidence for Haploinsufficiency (08/22/2016)","https://search.clinicalgenome.org/kb/gene-dosage/HGNC:2950","Dosage Working Group","definitive evidence (01/07/2022)","https://search.clinicalgenome.org/kb/gene-validity/CGGV:assertion_4390dba1-012d-4e08-a841-ffc08ebdc737-2022-01-07T190607.723Z","Motile Ciliopathy","","",""
"DNAH8","HGNC:2952","https://search.clinicalgenome.org/kb/genes/HGNC:2952","primary ciliary dyskinesia","MONDO:0016575","https://search.clinicalgenome.org/kb/conditions/MONDO:0016575","Autosomal recessive inheritance","","","","","disputing (06/23/2022)","https://search.clinicalgenome.org/kb/gene-validity/CGGV:assertion_0c98a44d-6d43-48fc-8286-9e499bf04a1b-2022-06-23T160000.000Z","Motile Ciliopathy","","",""
"DNAH8","HGNC:2952","https://search.clinicalgenome.org/kb/genes/HGNC:2952","spermatogenic failure 46","MONDO:0033673","https://search.clinicalgenome.org/kb/conditions/MONDO:0033673","Autosomal recessive inheritance","","","","","strong evidence (06/23/2022)","https://search.clinicalgenome.org/kb/gene-validity/CGGV:assertion_e740f4af-53fe-4c51-99f6-6111fe343d7f-2022-06-23T160000.000Z","Motile Ciliopathy","","",""
"DNAI1","HGNC:2954","https://search.clinicalgenome.org/kb/genes/HGNC:2954","primary ciliary dyskinesia 1","MONDO:0009484","https://search.clinicalgenome.org/kb/conditions/MONDO:0009484","Autosomal recessive inheritance","30 - Gene Associated with Autosomal Recessive Phenotype (08/22/2016)","0 - No Evidence for Haploinsufficiency (08/22/2016)","https://search.clinicalgenome.org/kb/gene-dosage/HGNC:2954","Dosage Working Group","definitive evidence (06/30/2022)","https://search.clinicalgenome.org/kb/gene-validity/CGGV:assertion_396be572-5b2c-4859-90dd-434a91c1ce96-2022-06-30T160000.000Z","Motile Ciliopathy","","",""
"DNAI2","HGNC:18744","https://search.clinicalgenome.org/kb/genes/HGNC:18744","primary ciliary dyskinesia 9","MONDO:0012906","https://search.clinicalgenome.org/kb/conditions/MONDO:0012906","N/A","30 - Gene Associated with Autosomal Recessive Phenotype (08/22/2016)","0 - No Evidence for Haploinsufficiency (08/22/2016)","https://search.clinicalgenome.org/kb/gene-dosage/HGNC:18744","Dosage Working Group","","","","","",""
"DNAJB11","HGNC:14889","https://search.clinicalgenome.org/kb/genes/HGNC:14889","polycystic kidney disease 6 with or without polycystic liver disease","MONDO:0054842","https://search.clinicalgenome.org/kb/conditions/MONDO:0054842","Autosomal dominant inheritance","","","","","strong evidence (02/26/2021)","https://search.clinicalgenome.org/kb/gene-validity/CGGV:assertion_dbbe08a1-2f13-445d-9492-d1f070e66c0c-2021-02-26T152748.643Z","Kidney Cystic and Ciliopathy Disorders","Moderate Actionability (11/05/2018)","https://search.clinicalgenome.org/kb/gene-validity/https://actionability.clinicalgenome.org/ac/Adult/ui/stg2SummaryRpt?doc=AC037","Adult Actionability Working Group"
"DNAJB11","HGNC:14889","https://search.clinicalgenome.org/kb/genes/HGNC:14889","autosomal dominant polycystic kidney disease","MONDO:0004691","https://search.clinicalgenome.org/kb/conditions/MONDO:0004691","N/A","","","","","","","","Moderate Actionability (11/05/2018)","https://search.clinicalgenome.org/kb/gene-validity/https://actionability.clinicalgenome.org/ac/Adult/ui/stg2SummaryRpt?doc=AC037","Adult Actionability Working Group"
"DNAJB2","HGNC:5228","https://search.clinicalgenome.org/kb/genes/HGNC:5228","Charcot-Marie-Tooth disease axonal type 2T","MONDO:0014866","https://search.clinicalgenome.org/kb/conditions/MONDO:0014866","Autosomal recessive inheritance","","","","","definitive evidence (02/10/2022)","https://search.clinicalgenome.org/kb/gene-validity/CGGV:assertion_6d726e4f-6edb-4d04-b2ae-2cd05ecdd8db-2022-02-10T022350.942Z","Charcot-Marie-Tooth","","",""
"DNAJC12","HGNC:28908","https://search.clinicalgenome.org/kb/genes/HGNC:28908","hyperphenylalaninemia due to DNAJC12 deficiency","MONDO:0044304","https://search.clinicalgenome.org/kb/conditions/MONDO:0044304","Autosomal recessive inheritance","","","","","definitive evidence (01/11/2021)","https://search.clinicalgenome.org/kb/gene-validity/CGGV:assertion_500ad0d5-2871-4b25-a96f-0c0816524a4b-2021-01-11T184823.935Z","Aminoacidopathy","","",""
"DNAJC19","HGNC:30528","https://search.clinicalgenome.org/kb/genes/HGNC:30528","3-methylglutaconic aciduria type 5","MONDO:0012435","https://search.clinicalgenome.org/kb/conditions/MONDO:0012435","Autosomal recessive inheritance","","","","","definitive evidence (09/24/2021)","https://search.clinicalgenome.org/kb/gene-validity/CGGV:assertion_fa7f8087-632d-4044-9e20-722085c3b42c-2021-09-24T024347.391Z","General Inborn Errors of Metabolism","","",""
"DNAJC21","HGNC:27030","https://search.clinicalgenome.org/kb/genes/HGNC:27030","bone marrow failure syndrome 3","MONDO:0014887","https://search.clinicalgenome.org/kb/conditions/MONDO:0014887","N/A","1 - Little Evidence for Haploinsufficiency (10/14/2020)","0 - No Evidence for Haploinsufficiency (10/14/2020)","https://search.clinicalgenome.org/kb/gene-dosage/HGNC:27030","Dosage Working Group","","","","","",""
"DNAJC5","HGNC:16235","https://search.clinicalgenome.org/kb/genes/HGNC:16235","adult neuronal ceroid lipofuscinosis","MONDO:0019260","https://search.clinicalgenome.org/kb/conditions/MONDO:0019260","Autosomal dominant inheritance","","","","","moderate evidence (07/30/2021)","https://search.clinicalgenome.org/kb/gene-validity/CGGV:assertion_67f55ef1-b312-4aac-bc04-67beb2405b4f-2021-07-30T052005.845Z","Epilepsy","","",""
"DNAJC6","HGNC:15469","https://search.clinicalgenome.org/kb/genes/HGNC:15469","juvenile onset Parkinson disease 19A","MONDO:0014231","https://search.clinicalgenome.org/kb/conditions/MONDO:0014231","N/A","30 - Gene Associated with Autosomal Recessive Phenotype (08/22/2016)","0 - No Evidence for Haploinsufficiency (08/22/2016)","https://search.clinicalgenome.org/kb/gene-dosage/HGNC:15469","Dosage Working Group","","","","","",""
"DNM1","HGNC:2972","https://search.clinicalgenome.org/kb/genes/HGNC:2972","developmental and epileptic encephalopathy","MONDO:0100062","https://search.clinicalgenome.org/kb/conditions/MONDO:0100062","Autosomal dominant inheritance","","","","","definitive evidence (12/13/2016)","https://search.clinicalgenome.org/kb/gene-validity/CGGV:assertion_31f598a3-7efd-4e43-83f3-587e98924260-2016-12-13T170000.000Z","Epilepsy","","",""
"DNM1L","HGNC:2973","https://search.clinicalgenome.org/kb/genes/HGNC:2973","Leigh syndrome","MONDO:0009723","https://search.clinicalgenome.org/kb/conditions/MONDO:0009723","Autosomal dominant inheritance | Autosomal recessive inheritance","","","","","limited evidence (06/30/2021) | limited evidence (06/30/2021)","https://search.clinicalgenome.org/kb/gene-validity/CGGV:assertion_c22e9c6b-f04d-4d56-acb3-baa308c596b7-2021-06-30T144120.695Z | https://search.clinicalgenome.org/kb/gene-validity/CGGV:assertion_0a922695-f136-44f8-ab1a-6581e0efafec-2021-06-30T144517.300Z","Mitochondrial Diseases | Mitochondrial Diseases","","",""
"DNM1L","HGNC:2973","https://search.clinicalgenome.org/kb/genes/HGNC:2973","encephalopathy due to mitochondrial and peroxisomal fission defect","MONDO:0054865","https://search.clinicalgenome.org/kb/conditions/MONDO:0054865","Autosomal dominant inheritance","","","","","definitive evidence (04/15/2022)","https://search.clinicalgenome.org/kb/gene-validity/CGGV:assertion_320f4ab3-19c3-458e-9e81-0f380cbfebbd-2022-04-15T160000.000Z","Peroxisomal Disorders","","",""
"DNM2","HGNC:2974","https://search.clinicalgenome.org/kb/genes/HGNC:2974","autosomal dominant centronuclear myopathy","MONDO:0008048","https://search.clinicalgenome.org/kb/conditions/MONDO:0008048","Autosomal dominant inheritance","","","","","definitive evidence (12/20/2019)","https://search.clinicalgenome.org/kb/gene-validity/CGGV:assertion_e4156721-f6b9-482c-b610-97753f3f722d-2019-12-20T170000.000Z","Congenital Myopathies","","",""
"DNM2","HGNC:2974","https://search.clinicalgenome.org/kb/genes/HGNC:2974","Charcot-Marie-Tooth disease","MONDO:0015626","https://search.clinicalgenome.org/kb/conditions/MONDO:0015626","Autosomal dominant inheritance","","","","","definitive evidence (10/27/2020)","https://search.clinicalgenome.org/kb/gene-validity/CGGV:assertion_7bc54e5d-eed5-4d40-9e0d-143bfeb88cac-2020-10-27T131827.010Z","Charcot-Marie-Tooth","","",""
"DNM2","HGNC:2974","https://search.clinicalgenome.org/kb/genes/HGNC:2974","autosomal dominant Charcot-Marie-Tooth disease type 2M","MONDO:0016431","https://search.clinicalgenome.org/kb/conditions/MONDO:0016431","N/A","","","","","","","","Assertion Pending (12/20/2017)","https://search.clinicalgenome.org/kb/gene-validity/https://actionability.clinicalgenome.org/ac/Adult/ui/stg2SummaryRpt?doc=AC148","Adult Actionability Working Group"
"DNM2","HGNC:2974","https://search.clinicalgenome.org/kb/genes/HGNC:2974","autosomal dominant intermediate Charcot-Marie-Tooth disease","MONDO:0019548","https://search.clinicalgenome.org/kb/conditions/MONDO:0019548","N/A","","","","","","","","Assertion Pending (12/20/2017)","https://search.clinicalgenome.org/kb/gene-validity/https://actionability.clinicalgenome.org/ac/Adult/ui/stg2SummaryRpt?doc=AC148","Adult Actionability Working Group"
"DNM2","HGNC:2974","https://search.clinicalgenome.org/kb/genes/HGNC:2974","Charcot-Marie-Tooth disease dominant intermediate B","MONDO:0011674","https://search.clinicalgenome.org/kb/conditions/MONDO:0011674","N/A","","","","","","","","Assertion Pending (12/20/2017)","https://search.clinicalgenome.org/kb/gene-validity/https://actionability.clinicalgenome.org/ac/Adult/ui/stg2SummaryRpt?doc=AC148","Adult Actionability Working Group"
"DNMT1","HGNC:2976","https://search.clinicalgenome.org/kb/genes/HGNC:2976","autosomal dominant cerebellar ataxia, deafness and narcolepsy","MONDO:0011397","https://search.clinicalgenome.org/kb/conditions/MONDO:0011397","Autosomal dominant inheritance","","","","","definitive evidence (02/10/2017)","https://search.clinicalgenome.org/kb/gene-validity/CGGCIEX:assertion_6235","Hearing Loss","","",""
"DNMT3A","HGNC:2978","https://search.clinicalgenome.org/kb/genes/HGNC:2978","tall stature-intellectual disability-facial dysmorphism syndrome","MONDO:0014382","https://search.clinicalgenome.org/kb/conditions/MONDO:0014382","N/A","1 - Little Evidence for Haploinsufficiency (04/29/2018)","0 - No Evidence for Haploinsufficiency (04/29/2018)","https://search.clinicalgenome.org/kb/gene-dosage/HGNC:2978","Dosage Working Group","","","","","",""
"DOCK6","HGNC:19189","https://search.clinicalgenome.org/kb/genes/HGNC:19189","Adams-Oliver syndrome","MONDO:0007034","https://search.clinicalgenome.org/kb/conditions/MONDO:0007034","Autosomal recessive inheritance","","","","","definitive evidence (06/28/2022)","https://search.clinicalgenome.org/kb/gene-validity/CGGV:assertion_ea64d74c-583d-4ed1-af91-6a7c6f80a1d3-2022-06-28T160000.000Z","Brain Malformations","","",""
"DOCK7","HGNC:19190","https://search.clinicalgenome.org/kb/genes/HGNC:19190","developmental and epileptic encephalopathy","MONDO:0100062","https://search.clinicalgenome.org/kb/conditions/MONDO:0100062","Autosomal recessive inheritance","30 - Gene Associated with Autosomal Recessive Phenotype (08/22/2016)","0 - No Evidence for Haploinsufficiency (08/22/2016)","https://search.clinicalgenome.org/kb/gene-dosage/HGNC:19190","Dosage Working Group","definitive evidence (07/28/2021)","https://search.clinicalgenome.org/kb/gene-validity/CGGV:assertion_0b6ed421-950b-4862-bade-dc545555ac29-2021-07-28T192512.688Z","Epilepsy","","",""
"DOCK7","HGNC:19190","https://search.clinicalgenome.org/kb/genes/HGNC:19190","developmental and epileptic encephalopathy, 23","MONDO:0014371","https://search.clinicalgenome.org/kb/conditions/MONDO:0014371","N/A","30 - Gene Associated with Autosomal Recessive Phenotype (08/22/2016)","0 - No Evidence for Haploinsufficiency (08/22/2016)","https://search.clinicalgenome.org/kb/gene-dosage/HGNC:19190","Dosage Working Group","","","","","",""
"DOCK8","HGNC:19191","https://search.clinicalgenome.org/kb/genes/HGNC:19191","combined immunodeficiency due to DOCK8 deficiency","MONDO:0009478","https://search.clinicalgenome.org/kb/conditions/MONDO:0009478","N/A","30 - Gene Associated with Autosomal Recessive Phenotype (08/22/2016)","","https://search.clinicalgenome.org/kb/gene-dosage/HGNC:19191","Dosage Working Group","","","","","",""
"DOK7","HGNC:26594","https://search.clinicalgenome.org/kb/genes/HGNC:26594","congenital myasthenic syndrome 10","MONDO:0009690","https://search.clinicalgenome.org/kb/conditions/MONDO:0009690","N/A","30 - Gene Associated with Autosomal Recessive Phenotype (08/22/2016)","","https://search.clinicalgenome.org/kb/gene-dosage/HGNC:26594","Dosage Working Group","","","","","",""
"DPAGT1","HGNC:2995","https://search.clinicalgenome.org/kb/genes/HGNC:2995","congenital disorder of glycosylation","MONDO:0015286","https://search.clinicalgenome.org/kb/conditions/MONDO:0015286","N/A","30 - Gene Associated with Autosomal Recessive Phenotype (08/22/2016)","0 - No Evidence for Haploinsufficiency (08/22/2016)","https://search.clinicalgenome.org/kb/gene-dosage/HGNC:2995","Dosage Working Group","","","","","",""
"DPM1","HGNC:3005","https://search.clinicalgenome.org/kb/genes/HGNC:3005","congenital disorder of glycosylation type 1E","MONDO:0012123","https://search.clinicalgenome.org/kb/conditions/MONDO:0012123","N/A","30 - Gene Associated with Autosomal Recessive Phenotype (08/22/2016)","0 - No Evidence for Haploinsufficiency (08/22/2016)","https://search.clinicalgenome.org/kb/gene-dosage/HGNC:3005","Dosage Working Group","","","","","",""
"DPM3","HGNC:3007","https://search.clinicalgenome.org/kb/genes/HGNC:3007","DPM3-CDG","MONDO:0013049","https://search.clinicalgenome.org/kb/conditions/MONDO:0013049","N/A","30 - Gene Associated with Autosomal Recessive Phenotype (04/09/2015)","0 - No Evidence for Haploinsufficiency (04/09/2015)","https://search.clinicalgenome.org/kb/gene-dosage/HGNC:3007","Dosage Working Group","","","","","",""
"DPP6","HGNC:3010","https://search.clinicalgenome.org/kb/genes/HGNC:3010","complex neurodevelopmental disorder","MONDO:0100038","https://search.clinicalgenome.org/kb/conditions/MONDO:0100038","Autosomal dominant inheritance","1 - Little Evidence for Haploinsufficiency (06/26/2019)","0 - No Evidence for Haploinsufficiency (06/26/2019)","https://search.clinicalgenome.org/kb/gene-dosage/HGNC:3010","Dosage Working Group","disputing (05/05/2021)","https://search.clinicalgenome.org/kb/gene-validity/CGGV:assertion_3d41cebe-5490-419d-882d-4f3c6856be07-2021-05-05T160000.000Z","Intellectual Disability and Autism","","",""
"DPP6","HGNC:3010","https://search.clinicalgenome.org/kb/genes/HGNC:3010","intellectual disability, autosomal dominant 33","MONDO:0014580","https://search.clinicalgenome.org/kb/conditions/MONDO:0014580","N/A","1 - Little Evidence for Haploinsufficiency (06/26/2019)","0 - No Evidence for Haploinsufficiency (06/26/2019)","https://search.clinicalgenome.org/kb/gene-dosage/HGNC:3010","Dosage Working Group","","","","","",""
"DPYD","HGNC:3012","https://search.clinicalgenome.org/kb/genes/HGNC:3012","dihydropyrimidine dehydrogenase deficiency","MONDO:0010130","https://search.clinicalgenome.org/kb/conditions/MONDO:0010130","N/A","30 - Gene Associated with Autosomal Recessive Phenotype (01/24/2018)","0 - No Evidence for Haploinsufficiency (01/24/2018)","https://search.clinicalgenome.org/kb/gene-dosage/HGNC:3012","Dosage Working Group","","","","","",""
"DPYS","HGNC:3013","https://search.clinicalgenome.org/kb/genes/HGNC:3013","dihydropyrimidinuria","MONDO:0009111","https://search.clinicalgenome.org/kb/conditions/MONDO:0009111","N/A","30 - Gene Associated with Autosomal Recessive Phenotype (08/22/2016)","","https://search.clinicalgenome.org/kb/gene-dosage/HGNC:3013","Dosage Working Group","","","","","",""
"DSC2","HGNC:3036","https://search.clinicalgenome.org/kb/genes/HGNC:3036","familial isolated arrhythmogenic right ventricular dysplasia","MONDO:0016342","https://search.clinicalgenome.org/kb/conditions/MONDO:0016342","Autosomal dominant inheritance","2 - Emerging Evidence for Haploinsufficiency (01/14/2016)","0 - No Evidence for Haploinsufficiency (01/14/2016)","https://search.clinicalgenome.org/kb/gene-dosage/HGNC:3036","Dosage Working Group","definitive evidence (09/14/2018)","https://search.clinicalgenome.org/kb/gene-validity/CGGV:assertion_74238dee-a847-4f27-9d30-3050c7bf9bf2-2018-09-14T160000.000Z","Arrhythmogenic Right Ventricular Cardiomyopathy","Moderate Actionability (03/17/2020) | Strong Actionability (03/17/2020)","https://search.clinicalgenome.org/kb/gene-validity/https://actionability.clinicalgenome.org/ac/Adult/ui/stg2SummaryRpt?doc=AC039 | https://search.clinicalgenome.org/kb/gene-validity/https://actionability.clinicalgenome.org/ac/Pediatric/ui/stg2SummaryRpt?doc=AC039","Adult Actionability Working Group | Pediatric Actionability Working Group"
"DSC2","HGNC:3036","https://search.clinicalgenome.org/kb/genes/HGNC:3036","arrhythmogenic right ventricular cardiomyopathy","MONDO:0016587","https://search.clinicalgenome.org/kb/conditions/MONDO:0016587","N/A","2 - Emerging Evidence for Haploinsufficiency (01/14/2016)","0 - No Evidence for Haploinsufficiency (01/14/2016)","https://search.clinicalgenome.org/kb/gene-dosage/HGNC:3036","Dosage Working Group","","","","Moderate Actionability (03/17/2020) | Strong Actionability (03/17/2020)","https://search.clinicalgenome.org/kb/gene-validity/https://actionability.clinicalgenome.org/ac/Adult/ui/stg2SummaryRpt?doc=AC039 | https://search.clinicalgenome.org/kb/gene-validity/https://actionability.clinicalgenome.org/ac/Pediatric/ui/stg2SummaryRpt?doc=AC039","Adult Actionability Working Group | Pediatric Actionability Working Group"
"DSC2","HGNC:3036","https://search.clinicalgenome.org/kb/genes/HGNC:3036","arrhythmogenic right ventricular dysplasia 11","MONDO:0012506","https://search.clinicalgenome.org/kb/conditions/MONDO:0012506","N/A","2 - Emerging Evidence for Haploinsufficiency (01/14/2016)","0 - No Evidence for Haploinsufficiency (01/14/2016)","https://search.clinicalgenome.org/kb/gene-dosage/HGNC:3036","Dosage Working Group","","","","Moderate Actionability (03/17/2020) | Strong Actionability (03/17/2020)","https://search.clinicalgenome.org/kb/gene-validity/https://actionability.clinicalgenome.org/ac/Adult/ui/stg2SummaryRpt?doc=AC039 | https://search.clinicalgenome.org/kb/gene-validity/https://actionability.clinicalgenome.org/ac/Pediatric/ui/stg2SummaryRpt?doc=AC039","Adult Actionability Working Group | Pediatric Actionability Working Group"
"DSC3","HGNC:3037","https://search.clinicalgenome.org/kb/genes/HGNC:3037","hereditary hypotrichosis with recurrent skin vesicles","MONDO:0013136","https://search.clinicalgenome.org/kb/conditions/MONDO:0013136","N/A","30 - Gene Associated with Autosomal Recessive Phenotype (08/22/2016)","","https://search.clinicalgenome.org/kb/gene-dosage/HGNC:3037","Dosage Working Group","","","","","",""
"DSCAM","HGNC:3039","https://search.clinicalgenome.org/kb/genes/HGNC:3039","autism susceptibility 1","MONDO:0020643","https://search.clinicalgenome.org/kb/conditions/MONDO:0020643","N/A","3 - Sufficient Evidence for Haploinsufficiency (01/24/2018)","0 - No Evidence for Haploinsufficiency (01/24/2018)","https://search.clinicalgenome.org/kb/gene-dosage/HGNC:3039","Dosage Working Group","","","","","",""
"DSE","HGNC:21144","https://search.clinicalgenome.org/kb/genes/HGNC:21144","Ehlers-Danlos syndrome, musculocontractural type 2","MONDO:0014236","https://search.clinicalgenome.org/kb/conditions/MONDO:0014236","N/A","30 - Gene Associated with Autosomal Recessive Phenotype (08/22/2016)","","https://search.clinicalgenome.org/kb/gene-dosage/HGNC:21144","Dosage Working Group","","","","","",""
"DSG2","HGNC:3049","https://search.clinicalgenome.org/kb/genes/HGNC:3049","arrhythmogenic right ventricular cardiomyopathy","MONDO:0016587","https://search.clinicalgenome.org/kb/conditions/MONDO:0016587","Autosomal dominant inheritance","1 - Little Evidence for Haploinsufficiency (11/16/2015)","0 - No Evidence for Haploinsufficiency (11/16/2015)","https://search.clinicalgenome.org/kb/gene-dosage/HGNC:3049","Dosage Working Group","definitive evidence (09/14/2018)","https://search.clinicalgenome.org/kb/gene-validity/CGGV:assertion_f679611d-6e25-45f9-aac3-4a8ad37b1592-2018-09-14T160000.000Z","Arrhythmogenic Right Ventricular Cardiomyopathy","Moderate Actionability (03/17/2020) | Strong Actionability (03/17/2020)","https://search.clinicalgenome.org/kb/gene-validity/https://actionability.clinicalgenome.org/ac/Adult/ui/stg2SummaryRpt?doc=AC039 | https://search.clinicalgenome.org/kb/gene-validity/https://actionability.clinicalgenome.org/ac/Pediatric/ui/stg2SummaryRpt?doc=AC039","Adult Actionability Working Group | Pediatric Actionability Working Group"
"DSG2","HGNC:3049","https://search.clinicalgenome.org/kb/genes/HGNC:3049","dilated cardiomyopathy","MONDO:0005021","https://search.clinicalgenome.org/kb/conditions/MONDO:0005021","Autosomal dominant inheritance","1 - Little Evidence for Haploinsufficiency (11/16/2015)","0 - No Evidence for Haploinsufficiency (11/16/2015)","https://search.clinicalgenome.org/kb/gene-dosage/HGNC:3049","Dosage Working Group","limited evidence (08/07/2020)","https://search.clinicalgenome.org/kb/gene-validity/CGGV:assertion_a7df1018-593f-481f-9dd0-77ce3ea829a6-2020-08-07T160000.000Z","Dilated Cardiomyopathy","","",""
"DSG2","HGNC:3049","https://search.clinicalgenome.org/kb/genes/HGNC:3049","familial isolated arrhythmogenic right ventricular dysplasia","MONDO:0016342","https://search.clinicalgenome.org/kb/conditions/MONDO:0016342","N/A","1 - Little Evidence for Haploinsufficiency (11/16/2015)","0 - No Evidence for Haploinsufficiency (11/16/2015)","https://search.clinicalgenome.org/kb/gene-dosage/HGNC:3049","Dosage Working Group","","","","Moderate Actionability (03/17/2020) | Strong Actionability (03/17/2020)","https://search.clinicalgenome.org/kb/gene-validity/https://actionability.clinicalgenome.org/ac/Adult/ui/stg2SummaryRpt?doc=AC039 | https://search.clinicalgenome.org/kb/gene-validity/https://actionability.clinicalgenome.org/ac/Pediatric/ui/stg2SummaryRpt?doc=AC039","Adult Actionability Working Group | Pediatric Actionability Working Group"
"DSG2","HGNC:3049","https://search.clinicalgenome.org/kb/genes/HGNC:3049","arrhythmogenic right ventricular dysplasia 10","MONDO:0012434","https://search.clinicalgenome.org/kb/conditions/MONDO:0012434","N/A","1 - Little Evidence for Haploinsufficiency (11/16/2015)","0 - No Evidence for Haploinsufficiency (11/16/2015)","https://search.clinicalgenome.org/kb/gene-dosage/HGNC:3049","Dosage Working Group","","","","Moderate Actionability (03/17/2020) | Strong Actionability (03/17/2020)","https://search.clinicalgenome.org/kb/gene-validity/https://actionability.clinicalgenome.org/ac/Adult/ui/stg2SummaryRpt?doc=AC039 | https://search.clinicalgenome.org/kb/gene-validity/https://actionability.clinicalgenome.org/ac/Pediatric/ui/stg2SummaryRpt?doc=AC039","Adult Actionability Working Group | Pediatric Actionability Working Group"
"DSG4","HGNC:21307","https://search.clinicalgenome.org/kb/genes/HGNC:21307","hypotrichosis 6","MONDO:0011932","https://search.clinicalgenome.org/kb/conditions/MONDO:0011932","N/A","30 - Gene Associated with Autosomal Recessive Phenotype (08/22/2016)","0 - No Evidence for Haploinsufficiency (08/22/2016)","https://search.clinicalgenome.org/kb/gene-dosage/HGNC:21307","Dosage Working Group","","","","","",""
"DSP","HGNC:3052","https://search.clinicalgenome.org/kb/genes/HGNC:3052","arrhythmogenic cardiomyopathy with woolly hair and keratoderma","MONDO:0011581","https://search.clinicalgenome.org/kb/conditions/MONDO:0011581","Autosomal dominant inheritance","3 - Sufficient Evidence for Haploinsufficiency (10/12/2021)","0 - No Evidence for Haploinsufficiency (10/12/2021)","https://search.clinicalgenome.org/kb/gene-dosage/HGNC:3052","Dosage Working Group","definitive evidence (07/12/2019)","https://search.clinicalgenome.org/kb/gene-validity/CGGV:assertion_b23da580-269c-4e5d-8f13-91dbe7ea6a57-2019-07-12T160000.000Z","Arrhythmogenic Right Ventricular Cardiomyopathy","","",""
"DSP","HGNC:3052","https://search.clinicalgenome.org/kb/genes/HGNC:3052","hypertrophic cardiomyopathy","MONDO:0005045","https://search.clinicalgenome.org/kb/conditions/MONDO:0005045","Autosomal dominant inheritance","3 - Sufficient Evidence for Haploinsufficiency (10/12/2021)","0 - No Evidence for Haploinsufficiency (10/12/2021)","https://search.clinicalgenome.org/kb/gene-dosage/HGNC:3052","Dosage Working Group","disputing (06/22/2022)","https://search.clinicalgenome.org/kb/gene-validity/CGGV:assertion_83a9ea83-5dec-4496-a5d8-9b5fdf9373d7-2022-06-22T160000.000Z","Hereditary Cardiovascular Disease","","",""
"DSP","HGNC:3052","https://search.clinicalgenome.org/kb/genes/HGNC:3052","arrhythmogenic right ventricular cardiomyopathy","MONDO:0016587","https://search.clinicalgenome.org/kb/conditions/MONDO:0016587","N/A","3 - Sufficient Evidence for Haploinsufficiency (10/12/2021)","0 - No Evidence for Haploinsufficiency (10/12/2021)","https://search.clinicalgenome.org/kb/gene-dosage/HGNC:3052","Dosage Working Group","","","","Moderate Actionability (03/17/2020) | Strong Actionability (03/17/2020)","https://search.clinicalgenome.org/kb/gene-validity/https://actionability.clinicalgenome.org/ac/Adult/ui/stg2SummaryRpt?doc=AC039 | https://search.clinicalgenome.org/kb/gene-validity/https://actionability.clinicalgenome.org/ac/Pediatric/ui/stg2SummaryRpt?doc=AC039","Adult Actionability Working Group | Pediatric Actionability Working Group"
"DSP","HGNC:3052","https://search.clinicalgenome.org/kb/genes/HGNC:3052","arrhythmogenic right ventricular dysplasia 8","MONDO:0011831","https://search.clinicalgenome.org/kb/conditions/MONDO:0011831","N/A","3 - Sufficient Evidence for Haploinsufficiency (10/12/2021)","0 - No Evidence for Haploinsufficiency (10/12/2021)","https://search.clinicalgenome.org/kb/gene-dosage/HGNC:3052","Dosage Working Group","","","","Moderate Actionability (03/17/2020) | Strong Actionability (03/17/2020)","https://search.clinicalgenome.org/kb/gene-validity/https://actionability.clinicalgenome.org/ac/Adult/ui/stg2SummaryRpt?doc=AC039 | https://search.clinicalgenome.org/kb/gene-validity/https://actionability.clinicalgenome.org/ac/Pediatric/ui/stg2SummaryRpt?doc=AC039","Adult Actionability Working Group | Pediatric Actionability Working Group"
"DSP","HGNC:3052","https://search.clinicalgenome.org/kb/genes/HGNC:3052","familial isolated arrhythmogenic right ventricular dysplasia","MONDO:0016342","https://search.clinicalgenome.org/kb/conditions/MONDO:0016342","N/A","3 - Sufficient Evidence for Haploinsufficiency (10/12/2021)","0 - No Evidence for Haploinsufficiency (10/12/2021)","https://search.clinicalgenome.org/kb/gene-dosage/HGNC:3052","Dosage Working Group","","","","Moderate Actionability (03/17/2020) | Strong Actionability (03/17/2020)","https://search.clinicalgenome.org/kb/gene-validity/https://actionability.clinicalgenome.org/ac/Adult/ui/stg2SummaryRpt?doc=AC039 | https://search.clinicalgenome.org/kb/gene-validity/https://actionability.clinicalgenome.org/ac/Pediatric/ui/stg2SummaryRpt?doc=AC039","Adult Actionability Working Group | Pediatric Actionability Working Group"
"DSP","HGNC:3052","https://search.clinicalgenome.org/kb/genes/HGNC:3052","dilated cardiomyopathy","MONDO:0005021","https://search.clinicalgenome.org/kb/conditions/MONDO:0005021","N/A","3 - Sufficient Evidence for Haploinsufficiency (10/12/2021)","0 - No Evidence for Haploinsufficiency (10/12/2021)","https://search.clinicalgenome.org/kb/gene-dosage/HGNC:3052","Dosage Working Group","","","","","",""
"DSPP","HGNC:3054","https://search.clinicalgenome.org/kb/genes/HGNC:3054","dentinogenesis imperfecta","MONDO:0018849","https://search.clinicalgenome.org/kb/conditions/MONDO:0018849","Autosomal dominant inheritance","0 - No Evidence for Haploinsufficiency (03/27/2013)","0 - No Evidence for Haploinsufficiency (03/27/2013)","https://search.clinicalgenome.org/kb/gene-dosage/HGNC:3054","Dosage Working Group","definitive evidence (04/17/2018)","https://search.clinicalgenome.org/kb/gene-validity/CGGV:assertion_39f5492a-97a3-49a6-929d-f24f23b51217-2018-04-17T160000.000Z","Hearing Loss","","",""
"DST","HGNC:1090","https://search.clinicalgenome.org/kb/genes/HGNC:1090","hereditary sensory and autonomic neuropathy type 6","MONDO:0013839","https://search.clinicalgenome.org/kb/conditions/MONDO:0013839","Autosomal recessive inheritance","","","","","definitive evidence (12/14/2021)","https://search.clinicalgenome.org/kb/gene-validity/CGGV:assertion_d90c7de8-a72a-4c54-bab8-fe9d4aef0409-2021-12-14T170000.000Z","Charcot-Marie-Tooth","","",""
"DTNA","HGNC:3057","https://search.clinicalgenome.org/kb/genes/HGNC:3057","dilated cardiomyopathy","MONDO:0005021","https://search.clinicalgenome.org/kb/conditions/MONDO:0005021","Autosomal dominant inheritance","","","","","limited evidence (08/12/2020)","https://search.clinicalgenome.org/kb/gene-validity/CGGV:assertion_cdac9dca-0cc7-4cca-9af7-d2767d917fd4-2020-08-12T160000.000Z","Dilated Cardiomyopathy","","",""
"DTNBP1","HGNC:17328","https://search.clinicalgenome.org/kb/genes/HGNC:17328","Hermansky-Pudlak syndrome 7","MONDO:0013559","https://search.clinicalgenome.org/kb/conditions/MONDO:0013559","Autosomal recessive inheritance","","","","","definitive evidence (02/24/2021)","https://search.clinicalgenome.org/kb/gene-validity/CGGV:assertion_785a39b1-9c7b-4745-94b6-be6a9376ac97-2021-02-24T170000.000Z","Hemostasis Thrombosis","","",""
"DYM","HGNC:21317","https://search.clinicalgenome.org/kb/genes/HGNC:21317","spondyloepiphyseal dysplasia","MONDO:0016761","https://search.clinicalgenome.org/kb/conditions/MONDO:0016761","N/A","30 - Gene Associated with Autosomal Recessive Phenotype (02/23/2012)","0 - No Evidence for Haploinsufficiency (02/23/2012)","https://search.clinicalgenome.org/kb/gene-dosage/HGNC:21317","Dosage Working Group","","","","","",""
"DYNC2H1","HGNC:2962","https://search.clinicalgenome.org/kb/genes/HGNC:2962","asphyxiating thoracic dystrophy 3","MONDO:0013127","https://search.clinicalgenome.org/kb/conditions/MONDO:0013127","N/A","30 - Gene Associated with Autosomal Recessive Phenotype (08/22/2016)","","https://search.clinicalgenome.org/kb/gene-dosage/HGNC:2962","Dosage Working Group","","","","","",""
"DYNC2I1","HGNC:21862","https://search.clinicalgenome.org/kb/genes/HGNC:21862","short-rib thoracic dysplasia 8 with or without polydactyly","MONDO:0014214","https://search.clinicalgenome.org/kb/conditions/MONDO:0014214","N/A","30 - Gene Associated with Autosomal Recessive Phenotype (08/22/2016)","","https://search.clinicalgenome.org/kb/gene-dosage/HGNC:21862","Dosage Working Group","","","","","",""
"DYRK1A","HGNC:3091","https://search.clinicalgenome.org/kb/genes/HGNC:3091","complex neurodevelopmental disorder","MONDO:0100038","https://search.clinicalgenome.org/kb/conditions/MONDO:0100038","Autosomal dominant inheritance","3 - Sufficient Evidence for Haploinsufficiency (12/16/2020)","0 - No Evidence for Haploinsufficiency (12/16/2020)","https://search.clinicalgenome.org/kb/gene-dosage/HGNC:3091","Dosage Working Group","definitive evidence (07/15/2020)","https://search.clinicalgenome.org/kb/gene-validity/CGGV:assertion_b336707e-f3a5-4554-9b37-0d29621b3562-2020-07-15T195802.528Z","Intellectual Disability and Autism","","",""
"DYSF","HGNC:3097","https://search.clinicalgenome.org/kb/genes/HGNC:3097","autosomal recessive limb-girdle muscular dystrophy","MONDO:0015152","https://search.clinicalgenome.org/kb/conditions/MONDO:0015152","Autosomal recessive inheritance","","","","","definitive evidence (05/01/2020)","https://search.clinicalgenome.org/kb/gene-validity/CGGV:assertion_94042756-2e7a-4cfa-812c-1b88b703eeea-2020-05-01T193204.280Z","Limb Girdle Muscular Dystrophy","","",""
"DZIP1L","HGNC:26551","https://search.clinicalgenome.org/kb/genes/HGNC:26551","autosomal recessive polycystic kidney disease","MONDO:0009889","https://search.clinicalgenome.org/kb/conditions/MONDO:0009889","Autosomal recessive inheritance","","","","","strong evidence (03/09/2022)","https://search.clinicalgenome.org/kb/gene-validity/CGGV:assertion_f1e2d1d2-b77c-4f1a-b185-31e3a95aae9b-2022-03-09T170000.000Z","Kidney Cystic and Ciliopathy Disorders","","",""
"EARS2","HGNC:29419","https://search.clinicalgenome.org/kb/genes/HGNC:29419","Leigh syndrome","MONDO:0009723","https://search.clinicalgenome.org/kb/conditions/MONDO:0009723","Autosomal recessive inheritance","30 - Gene Associated with Autosomal Recessive Phenotype (08/22/2016)","0 - No Evidence for Haploinsufficiency (08/22/2016)","https://search.clinicalgenome.org/kb/gene-dosage/HGNC:29419","Dosage Working Group","definitive evidence (03/19/2020)","https://search.clinicalgenome.org/kb/gene-validity/CGGV:assertion_774e378c-2636-41ad-be48-a2c00328ab9c-2020-03-19T190729.531Z","Mitochondrial Diseases","","",""
"EARS2","HGNC:29419","https://search.clinicalgenome.org/kb/genes/HGNC:29419","leukoencephalopathy-thalamus and brainstem anomalies-high lactate syndrome","MONDO:0013971","https://search.clinicalgenome.org/kb/conditions/MONDO:0013971","N/A","30 - Gene Associated with Autosomal Recessive Phenotype (08/22/2016)","0 - No Evidence for Haploinsufficiency (08/22/2016)","https://search.clinicalgenome.org/kb/gene-dosage/HGNC:29419","Dosage Working Group","","","","","",""
"EBP","HGNC:3133","https://search.clinicalgenome.org/kb/genes/HGNC:3133","X-linked chondrodysplasia punctata 2","MONDO:0020603","https://search.clinicalgenome.org/kb/conditions/MONDO:0020603","N/A","3 - Sufficient Evidence for Haploinsufficiency (01/22/2020)","0 - No Evidence for Haploinsufficiency (01/22/2020)","https://search.clinicalgenome.org/kb/gene-dosage/HGNC:3133","Dosage Working Group","","","","","",""
"ECHS1","HGNC:3151","https://search.clinicalgenome.org/kb/genes/HGNC:3151","mitochondrial short-chain Enoyl-Coa hydratase 1 deficiency","MONDO:0014563","https://search.clinicalgenome.org/kb/conditions/MONDO:0014563","Autosomal recessive inheritance","","","","","definitive evidence (10/09/2018)","https://search.clinicalgenome.org/kb/gene-validity/CGGV:assertion_dad38816-be17-4d59-bbfd-3e79221911a4-2018-10-09T160000.000Z","Fatty Acid Oxidation Disorders","","",""
"ECHS1","HGNC:3151","https://search.clinicalgenome.org/kb/genes/HGNC:3151","Leigh syndrome","MONDO:0009723","https://search.clinicalgenome.org/kb/conditions/MONDO:0009723","Autosomal recessive inheritance","","","","","definitive evidence (04/09/2021)","https://search.clinicalgenome.org/kb/gene-validity/CGGV:assertion_1d443f3c-fe02-4104-9e92-ca1c73b85a81-2021-04-09T142601.823Z","Mitochondrial Diseases","","",""
"EDA","HGNC:3157","https://search.clinicalgenome.org/kb/genes/HGNC:3157","X-linked hypohidrotic ectodermal dysplasia","MONDO:0010585","https://search.clinicalgenome.org/kb/conditions/MONDO:0010585","N/A","3 - Sufficient Evidence for Haploinsufficiency (07/26/2012)","0 - No Evidence for Haploinsufficiency (07/26/2012)","https://search.clinicalgenome.org/kb/gene-dosage/HGNC:3157","Dosage Working Group","","","","","",""
"EDN3","HGNC:3178","https://search.clinicalgenome.org/kb/genes/HGNC:3178","Waardenburg syndrome type 4B","MONDO:0013201","https://search.clinicalgenome.org/kb/conditions/MONDO:0013201","Autosomal recessive inheritance | Autosomal dominant inheritance","","","","","moderate evidence (05/08/2018) | limited evidence (05/30/2018)","https://search.clinicalgenome.org/kb/gene-validity/CGGV:assertion_7f88c34c-a093-4fc8-b84a-49c7d2dd327f-2018-05-08T160000.000Z | https://search.clinicalgenome.org/kb/gene-validity/CGGV:assertion_04e39ada-cd77-43f0-98f3-7b4a37668a96-2018-05-30T142540.938Z","Hearing Loss | Hearing Loss","","",""
"EDNRB","HGNC:3180","https://search.clinicalgenome.org/kb/genes/HGNC:3180","Waardenburg syndrome type 4A","MONDO:0010192","https://search.clinicalgenome.org/kb/conditions/MONDO:0010192","Autosomal recessive inheritance | Autosomal dominant inheritance","1 - Little Evidence for Haploinsufficiency (02/07/2022)","0 - No Evidence for Haploinsufficiency (02/07/2022)","https://search.clinicalgenome.org/kb/gene-dosage/HGNC:3180","Dosage Working Group","moderate evidence (05/08/2018) | limited evidence (05/08/2018)","https://search.clinicalgenome.org/kb/gene-validity/CGGV:assertion_d7abbd45-7915-437b-849b-dea876bfc2f5-2018-05-08T160000.000Z | https://search.clinicalgenome.org/kb/gene-validity/CGGV:assertion_73ee9727-60c1-40fd-830f-08c2b513d2ee-2018-05-08T160000.000Z","Hearing Loss | Hearing Loss","","",""
"EEF1A2","HGNC:3192","https://search.clinicalgenome.org/kb/genes/HGNC:3192","complex neurodevelopmental disorder","MONDO:0100038","https://search.clinicalgenome.org/kb/conditions/MONDO:0100038","Autosomal dominant inheritance","","","","","definitive evidence (03/19/2019)","https://search.clinicalgenome.org/kb/gene-validity/CGGV:assertion_17551147-b62c-47a9-a12a-f425c23d90ff-2019-03-19T160000.000Z","Epilepsy","","",""
"EFEMP1","HGNC:3218","https://search.clinicalgenome.org/kb/genes/HGNC:3218","Doyne honeycomb retinal dystrophy","MONDO:0007471","https://search.clinicalgenome.org/kb/conditions/MONDO:0007471","Autosomal dominant inheritance","","","","","definitive evidence (08/05/2021)","https://search.clinicalgenome.org/kb/gene-validity/CGGV:assertion_2859008e-eeb1-4af4-8a6e-1bf5372bb3ab-2021-08-05T160000.000Z","Retina","","",""
"EFEMP2","HGNC:3219","https://search.clinicalgenome.org/kb/genes/HGNC:3219","familial thoracic aortic aneurysm and aortic dissection","MONDO:0019625","https://search.clinicalgenome.org/kb/conditions/MONDO:0019625","Autosomal recessive inheritance","","","","","moderate evidence (12/22/2016)","https://search.clinicalgenome.org/kb/gene-validity/CGGCIEX:assertion_8267","Heritable Thoracic Aortic Aneurysm and Dissection","","",""
"EFHC1","HGNC:16406","https://search.clinicalgenome.org/kb/genes/HGNC:16406","epilepsy","MONDO:0005027","https://search.clinicalgenome.org/kb/conditions/MONDO:0005027","Autosomal dominant inheritance","","","","","disputing (07/27/2018)","https://search.clinicalgenome.org/kb/gene-validity/CGGV:assertion_a2338bd8-c9ea-464b-8281-84472771a657-2018-07-27T160000.000Z","Epilepsy","","",""
"EFL1","HGNC:25789","https://search.clinicalgenome.org/kb/genes/HGNC:25789","Shwachman-Diamond syndrome","MONDO:0009833","https://search.clinicalgenome.org/kb/conditions/MONDO:0009833","N/A","30 - Gene Associated with Autosomal Recessive Phenotype (04/13/2022)","","https://search.clinicalgenome.org/kb/gene-dosage/HGNC:25789","Dosage Working Group","","","","","",""
"EFNB1","HGNC:3226","https://search.clinicalgenome.org/kb/genes/HGNC:3226","craniofrontonasal syndrome","MONDO:0010570","https://search.clinicalgenome.org/kb/conditions/MONDO:0010570","X-linked inheritance","3 - Sufficient Evidence for Haploinsufficiency (07/26/2012)","1 - Little Evidence for Haploinsufficiency (07/26/2012)","https://search.clinicalgenome.org/kb/gene-dosage/HGNC:3226","Dosage Working Group","definitive evidence (10/26/2020)","https://search.clinicalgenome.org/kb/gene-validity/CGGV:assertion_31ffbd0b-5c6b-4396-a84c-9330d81e4a08-2020-10-26T154650.453Z","Craniofacial Malformations","","",""
"EFTUD2","HGNC:30858","https://search.clinicalgenome.org/kb/genes/HGNC:30858","mandibulofacial dysostosis-microcephaly syndrome","MONDO:0012516","https://search.clinicalgenome.org/kb/conditions/MONDO:0012516","Autosomal dominant inheritance","3 - Sufficient Evidence for Haploinsufficiency (05/23/2013)","0 - No Evidence for Haploinsufficiency (05/23/2013)","https://search.clinicalgenome.org/kb/gene-dosage/HGNC:30858","Dosage Working Group","definitive evidence (07/20/2022)","https://search.clinicalgenome.org/kb/gene-validity/CGGV:assertion_66012775-240c-4640-ac66-12647021eee5-2022-07-20T160000.000Z","Intellectual Disability and Autism","","",""
"EGFR","HGNC:3236","https://search.clinicalgenome.org/kb/genes/HGNC:3236","non-small cell lung carcinoma","MONDO:0005233","https://search.clinicalgenome.org/kb/conditions/MONDO:0005233","Autosomal dominant inheritance","0 - No Evidence for Haploinsufficiency (05/11/2022)","0 - No Evidence for Haploinsufficiency (05/11/2022)","https://search.clinicalgenome.org/kb/gene-dosage/HGNC:3236","Dosage Working Group","definitive evidence (07/30/2020)","https://search.clinicalgenome.org/kb/gene-validity/CGGV:assertion_49342c73-96d7-45ba-9c90-d2d5e5710636-2020-07-30T202207.418Z","Hereditary Cancer","","",""
"EGR2","HGNC:3239","https://search.clinicalgenome.org/kb/genes/HGNC:3239","Charcot-Marie-Tooth disease","MONDO:0015626","https://search.clinicalgenome.org/kb/conditions/MONDO:0015626","Semidominant inheritance","0 - No Evidence for Haploinsufficiency (11/28/2011)","0 - No Evidence for Haploinsufficiency (11/28/2011)","https://search.clinicalgenome.org/kb/gene-dosage/HGNC:3239","Dosage Working Group","definitive evidence (11/17/2021)","https://search.clinicalgenome.org/kb/gene-validity/CGGV:assertion_a6e83e27-0c9a-4475-92f5-745303931858-2021-11-17T033516.468Z","Charcot-Marie-Tooth","","",""
"EGR2","HGNC:3239","https://search.clinicalgenome.org/kb/genes/HGNC:3239","Charcot-Marie-Tooth disease type 1D","MONDO:0011890","https://search.clinicalgenome.org/kb/conditions/MONDO:0011890","N/A","0 - No Evidence for Haploinsufficiency (11/28/2011)","0 - No Evidence for Haploinsufficiency (11/28/2011)","https://search.clinicalgenome.org/kb/gene-dosage/HGNC:3239","Dosage Working Group","","","","Assertion Pending (12/20/2017)","https://search.clinicalgenome.org/kb/gene-validity/https://actionability.clinicalgenome.org/ac/Adult/ui/stg2SummaryRpt?doc=AC129","Adult Actionability Working Group"
"EGR2","HGNC:3239","https://search.clinicalgenome.org/kb/genes/HGNC:3239","Charcot-Marie-Tooth disease type 1","MONDO:0019011","https://search.clinicalgenome.org/kb/conditions/MONDO:0019011","N/A","0 - No Evidence for Haploinsufficiency (11/28/2011)","0 - No Evidence for Haploinsufficiency (11/28/2011)","https://search.clinicalgenome.org/kb/gene-dosage/HGNC:3239","Dosage Working Group","","","","Assertion Pending (12/20/2017)","https://search.clinicalgenome.org/kb/gene-validity/https://actionability.clinicalgenome.org/ac/Adult/ui/stg2SummaryRpt?doc=AC129","Adult Actionability Working Group"
"EHMT1","HGNC:24650","https://search.clinicalgenome.org/kb/genes/HGNC:24650","Kleefstra syndrome","MONDO:0012455","https://search.clinicalgenome.org/kb/conditions/MONDO:0012455","Autosomal dominant inheritance","3 - Sufficient Evidence for Haploinsufficiency (07/06/2012)","1 - Little Evidence for Haploinsufficiency (07/06/2012)","https://search.clinicalgenome.org/kb/gene-dosage/HGNC:24650","Dosage Working Group","definitive evidence (06/07/2018)","https://search.clinicalgenome.org/kb/gene-validity/CGGV:assertion_db91a861-6a88-4848-b6d5-4772bdef52ff-2018-06-07T183128.103Z","Intellectual Disability and Autism","","",""
"EHMT1","HGNC:24650","https://search.clinicalgenome.org/kb/genes/HGNC:24650","Kleefstra syndrome 1","MONDO:0027407","https://search.clinicalgenome.org/kb/conditions/MONDO:0027407","N/A","3 - Sufficient Evidence for Haploinsufficiency (07/06/2012)","1 - Little Evidence for Haploinsufficiency (07/06/2012)","https://search.clinicalgenome.org/kb/gene-dosage/HGNC:24650","Dosage Working Group","","","","","",""
"EIF2AK3","HGNC:3255","https://search.clinicalgenome.org/kb/genes/HGNC:3255","Wolcott-Rallison syndrome","MONDO:0009192","https://search.clinicalgenome.org/kb/conditions/MONDO:0009192","N/A","30 - Gene Associated with Autosomal Recessive Phenotype (08/22/2016)","","https://search.clinicalgenome.org/kb/gene-dosage/HGNC:3255","Dosage Working Group","","","","","",""
"EIF2B1","HGNC:3257","https://search.clinicalgenome.org/kb/genes/HGNC:3257","leukoencephalopathy with vanishing white matter","MONDO:0011380","https://search.clinicalgenome.org/kb/conditions/MONDO:0011380","N/A","30 - Gene Associated with Autosomal Recessive Phenotype (08/22/2016)","","https://search.clinicalgenome.org/kb/gene-dosage/HGNC:3257","Dosage Working Group","","","","","",""
"EIF2B3","HGNC:3259","https://search.clinicalgenome.org/kb/genes/HGNC:3259","leukoencephalopathy with vanishing white matter","MONDO:0011380","https://search.clinicalgenome.org/kb/conditions/MONDO:0011380","N/A","30 - Gene Associated with Autosomal Recessive Phenotype (08/22/2016)","0 - No Evidence for Haploinsufficiency (08/22/2016)","https://search.clinicalgenome.org/kb/gene-dosage/HGNC:3259","Dosage Working Group","","","","","",""
"EIF2S3","HGNC:3267","https://search.clinicalgenome.org/kb/genes/HGNC:3267","MEHMO syndrome","MONDO:0010258","https://search.clinicalgenome.org/kb/conditions/MONDO:0010258","Autosomal dominant inheritance","","","","","definitive evidence (11/11/2021)","https://search.clinicalgenome.org/kb/gene-validity/CGGV:assertion_bb96fe11-dd31-47b2-820d-9071035ec7b0-2021-11-11T170000.000Z","Intellectual Disability and Autism","","",""
"EIF4A3","HGNC:18683","https://search.clinicalgenome.org/kb/genes/HGNC:18683","Richieri Costa-Pereira syndrome","MONDO:0009998","https://search.clinicalgenome.org/kb/conditions/MONDO:0009998","N/A","30 - Gene Associated with Autosomal Recessive Phenotype (08/22/2016)","0 - No Evidence for Haploinsufficiency (08/22/2016)","https://search.clinicalgenome.org/kb/gene-dosage/HGNC:18683","Dosage Working Group","","","","","",""
"ELANE","HGNC:3309","https://search.clinicalgenome.org/kb/genes/HGNC:3309","neutropenia","MONDO:0001475","https://search.clinicalgenome.org/kb/conditions/MONDO:0001475","Autosomal dominant inheritance","1 - Little Evidence for Haploinsufficiency (07/13/2022)","0 - No Evidence for Haploinsufficiency (07/13/2022)","https://search.clinicalgenome.org/kb/gene-dosage/HGNC:3309","Dosage Working Group","definitive evidence (05/14/2020)","https://search.clinicalgenome.org/kb/gene-validity/CGGV:assertion_259c43d2-b114-43bd-9e4e-a7beeb644323-2020-05-14T000924.456Z","Hereditary Cancer","","",""
"ELANE","HGNC:3309","https://search.clinicalgenome.org/kb/genes/HGNC:3309","severe congenital neutropenia","MONDO:0018542","https://search.clinicalgenome.org/kb/conditions/MONDO:0018542","N/A","1 - Little Evidence for Haploinsufficiency (07/13/2022)","0 - No Evidence for Haploinsufficiency (07/13/2022)","https://search.clinicalgenome.org/kb/gene-dosage/HGNC:3309","Dosage Working Group","","","","","",""
"ELAVL2","HGNC:3313","https://search.clinicalgenome.org/kb/genes/HGNC:3313","complex neurodevelopmental disorder","MONDO:0100038","https://search.clinicalgenome.org/kb/conditions/MONDO:0100038","N/A","1 - Little Evidence for Haploinsufficiency (11/28/2018)","0 - No Evidence for Haploinsufficiency (11/28/2018)","https://search.clinicalgenome.org/kb/gene-dosage/HGNC:3313","Dosage Working Group","","","","","",""
"ELMOD3","HGNC:26158","https://search.clinicalgenome.org/kb/genes/HGNC:26158","nonsyndromic genetic hearing loss","MONDO:0019497","https://search.clinicalgenome.org/kb/conditions/MONDO:0019497","Autosomal recessive inheritance | Autosomal dominant inheritance","","","","","limited evidence (11/17/2021) | limited evidence (11/17/2021)","https://search.clinicalgenome.org/kb/gene-validity/CGGV:assertion_95f5efe3-e0d1-4cef-b475-7ff1cd3c417c-2021-11-17T170000.000Z | https://search.clinicalgenome.org/kb/gene-validity/CGGV:assertion_86999665-43b6-4824-b5e5-81b2a6dd8034-2021-11-17T170000.000Z","Hearing Loss | Hearing Loss","","",""
"ELN","HGNC:3327","https://search.clinicalgenome.org/kb/genes/HGNC:3327","supravalvular aortic stenosis","MONDO:0008504","https://search.clinicalgenome.org/kb/conditions/MONDO:0008504","N/A","3 - Sufficient Evidence for Haploinsufficiency (07/10/2012)","0 - No Evidence for Haploinsufficiency (07/10/2012)","https://search.clinicalgenome.org/kb/gene-dosage/HGNC:3327","Dosage Working Group","","","","","",""
"EMD","HGNC:3331","https://search.clinicalgenome.org/kb/genes/HGNC:3331","Emery-Dreifuss muscular dystrophy","MONDO:0016830","https://search.clinicalgenome.org/kb/conditions/MONDO:0016830","N/A","","","","","","","","Limited Actionability (07/13/2017)","https://search.clinicalgenome.org/kb/gene-validity/https://actionability.clinicalgenome.org/ac/Adult/ui/stg2SummaryRpt?doc=AC143","Adult Actionability Working Group"
"EMD","HGNC:3331","https://search.clinicalgenome.org/kb/genes/HGNC:3331","X-linked Emery-Dreifuss muscular dystrophy","MONDO:0010680","https://search.clinicalgenome.org/kb/conditions/MONDO:0010680","N/A","","","","","","","","Limited Actionability (07/13/2017)","https://search.clinicalgenome.org/kb/gene-validity/https://actionability.clinicalgenome.org/ac/Adult/ui/stg2SummaryRpt?doc=AC143","Adult Actionability Working Group"
"EMX2","HGNC:3341","https://search.clinicalgenome.org/kb/genes/HGNC:3341","schizencephaly","MONDO:0010011","https://search.clinicalgenome.org/kb/conditions/MONDO:0010011","N/A","1 - Little Evidence for Haploinsufficiency (11/09/2021)","0 - No Evidence for Haploinsufficiency (11/09/2021)","https://search.clinicalgenome.org/kb/gene-dosage/HGNC:3341","Dosage Working Group","","","","","",""
"EN2","HGNC:3343","https://search.clinicalgenome.org/kb/genes/HGNC:3343","complex neurodevelopmental disorder","MONDO:0100038","https://search.clinicalgenome.org/kb/conditions/MONDO:0100038","Autosomal dominant inheritance","0 - No Evidence for Haploinsufficiency (08/26/2012)","0 - No Evidence for Haploinsufficiency (08/26/2012)","https://search.clinicalgenome.org/kb/gene-dosage/HGNC:3343","Dosage Working Group","disputing (02/16/2021)","https://search.clinicalgenome.org/kb/gene-validity/CGGV:assertion_91eb2fc6-864c-4a4a-9b2d-0b2bdd695999-2021-02-16T170000.000Z","Intellectual Disability and Autism","","",""
"ENG","HGNC:3349","https://search.clinicalgenome.org/kb/genes/HGNC:3349","hereditary hemorrhagic telangiectasia","MONDO:0019180","https://search.clinicalgenome.org/kb/conditions/MONDO:0019180","Autosomal dominant inheritance","3 - Sufficient Evidence for Haploinsufficiency (12/08/2016)","0 - No Evidence for Haploinsufficiency (12/08/2016)","https://search.clinicalgenome.org/kb/gene-dosage/HGNC:3349","Dosage Working Group","definitive evidence (08/28/2019)","https://search.clinicalgenome.org/kb/gene-validity/CGGV:assertion_d4d13b4a-f97b-45d0-9b82-07bcb6685a0a-2019-08-28T160000.000Z","Hemostasis Thrombosis","Assertion Pending (12/07/2015)","https://search.clinicalgenome.org/kb/gene-validity/https://actionability.clinicalgenome.org/ac/Adult/ui/stg2SummaryRpt?doc=AC107","Adult Actionability Working Group"
"ENG","HGNC:3349","https://search.clinicalgenome.org/kb/genes/HGNC:3349","generalized juvenile polyposis/juvenile polyposis coli","MONDO:0008276","https://search.clinicalgenome.org/kb/conditions/MONDO:0008276","Autosomal dominant inheritance","3 - Sufficient Evidence for Haploinsufficiency (12/08/2016)","0 - No Evidence for Haploinsufficiency (12/08/2016)","https://search.clinicalgenome.org/kb/gene-dosage/HGNC:3349","Dosage Working Group","limited evidence (12/11/2017)","https://search.clinicalgenome.org/kb/gene-validity/CGGCIEX:assertion_9859","Colon Cancer","","",""
"ENG","HGNC:3349","https://search.clinicalgenome.org/kb/genes/HGNC:3349","telangiectasia, hereditary hemorrhagic, type 1","MONDO:0008535","https://search.clinicalgenome.org/kb/conditions/MONDO:0008535","N/A","3 - Sufficient Evidence for Haploinsufficiency (12/08/2016)","0 - No Evidence for Haploinsufficiency (12/08/2016)","https://search.clinicalgenome.org/kb/gene-dosage/HGNC:3349","Dosage Working Group","","","","Assertion Pending (12/07/2015)","https://search.clinicalgenome.org/kb/gene-validity/https://actionability.clinicalgenome.org/ac/Adult/ui/stg2SummaryRpt?doc=AC107","Adult Actionability Working Group"
"ENO3","HGNC:3354","https://search.clinicalgenome.org/kb/genes/HGNC:3354","glycogen storage disease due to muscle beta-enolase deficiency","MONDO:0013046","https://search.clinicalgenome.org/kb/conditions/MONDO:0013046","N/A","30 - Gene Associated with Autosomal Recessive Phenotype (08/22/2016)","","https://search.clinicalgenome.org/kb/gene-dosage/HGNC:3354","Dosage Working Group","","","","","",""
"ENPP1","HGNC:3356","https://search.clinicalgenome.org/kb/genes/HGNC:3356","hypophosphatemic rickets, autosomal recessive, 2","MONDO:0013219","https://search.clinicalgenome.org/kb/conditions/MONDO:0013219","N/A","30 - Gene Associated with Autosomal Recessive Phenotype (08/22/2016)","0 - No Evidence for Haploinsufficiency (08/22/2016)","https://search.clinicalgenome.org/kb/gene-dosage/HGNC:3356","Dosage Working Group","","","","","",""
"EP300","HGNC:3373","https://search.clinicalgenome.org/kb/genes/HGNC:3373","Rubinstein-Taybi syndrome due to EP300 haploinsufficiency","MONDO:0013364","https://search.clinicalgenome.org/kb/conditions/MONDO:0013364","Autosomal dominant inheritance","3 - Sufficient Evidence for Haploinsufficiency (03/14/2013)","0 - No Evidence for Haploinsufficiency (03/14/2013)","https://search.clinicalgenome.org/kb/gene-dosage/HGNC:3373","Dosage Working Group","definitive evidence (05/20/2022)","https://search.clinicalgenome.org/kb/gene-validity/CGGV:assertion_5559f540-f08e-4446-bc8b-a241bb3a4a8e-2022-05-20T044017.803Z","Syndromic Disorders","","",""
"EPB42","HGNC:3381","https://search.clinicalgenome.org/kb/genes/HGNC:3381","hereditary spherocytosis type 5","MONDO:0012985","https://search.clinicalgenome.org/kb/conditions/MONDO:0012985","N/A","30 - Gene Associated with Autosomal Recessive Phenotype (08/22/2016)","0 - No Evidence for Haploinsufficiency (08/22/2016)","https://search.clinicalgenome.org/kb/gene-dosage/HGNC:3381","Dosage Working Group","","","","","",""
"EPCAM","HGNC:11529","https://search.clinicalgenome.org/kb/genes/HGNC:11529","hereditary breast carcinoma","MONDO:0016419","https://search.clinicalgenome.org/kb/conditions/MONDO:0016419","Autosomal dominant inheritance","30 - Gene Associated with Autosomal Recessive Phenotype (10/08/2019)","0 - No Evidence for Haploinsufficiency (10/08/2019)","https://search.clinicalgenome.org/kb/gene-dosage/HGNC:11529","Dosage Working Group","no known disease relationship (04/12/2017)","https://search.clinicalgenome.org/kb/gene-validity/CGGCIEX:assertion_8527","Breast/Ovarian Cancer","","",""
"EPCAM","HGNC:11529","https://search.clinicalgenome.org/kb/genes/HGNC:11529","Lynch syndrome","MONDO:0005835","https://search.clinicalgenome.org/kb/conditions/MONDO:0005835","Autosomal dominant inheritance","30 - Gene Associated with Autosomal Recessive Phenotype (10/08/2019)","0 - No Evidence for Haploinsufficiency (10/08/2019)","https://search.clinicalgenome.org/kb/gene-dosage/HGNC:11529","Dosage Working Group","definitive evidence (06/20/2022)","https://search.clinicalgenome.org/kb/gene-validity/CGGV:assertion_3c071c7e-ba5c-46c7-b46b-fee6acf3a43f-2022-06-20T170000.000Z","Hereditary Cancer","Has Insufficient Evidence for Actionability Based on Early Rule-out (09/15/2021) | Definitive Actionability (02/11/2015)","https://search.clinicalgenome.org/kb/gene-validity/https://actionability.clinicalgenome.org/ac/Pediatric/ui/stg2SummaryRpt?doc=AC069 | https://search.clinicalgenome.org/kb/gene-validity/https://actionability.clinicalgenome.org/ac/Adult/ui/stg2SummaryRpt?doc=AC069","Pediatric Actionability Working Group | Adult Actionability Working Group"
"EPCAM","HGNC:11529","https://search.clinicalgenome.org/kb/genes/HGNC:11529","colorectal cancer, hereditary nonpolyposis, type 8","MONDO:0013196","https://search.clinicalgenome.org/kb/conditions/MONDO:0013196","N/A","30 - Gene Associated with Autosomal Recessive Phenotype (10/08/2019)","0 - No Evidence for Haploinsufficiency (10/08/2019)","https://search.clinicalgenome.org/kb/gene-dosage/HGNC:11529","Dosage Working Group","","","","Has Insufficient Evidence for Actionability Based on Early Rule-out (09/15/2021) | Definitive Actionability (02/11/2015)","https://search.clinicalgenome.org/kb/gene-validity/https://actionability.clinicalgenome.org/ac/Pediatric/ui/stg2SummaryRpt?doc=AC069 | https://search.clinicalgenome.org/kb/gene-validity/https://actionability.clinicalgenome.org/ac/Adult/ui/stg2SummaryRpt?doc=AC069","Pediatric Actionability Working Group | Adult Actionability Working Group"
"EPCAM","HGNC:11529","https://search.clinicalgenome.org/kb/genes/HGNC:11529","congenital diarrhea 5 with tufting enteropathy","MONDO:0013184","https://search.clinicalgenome.org/kb/conditions/MONDO:0013184","N/A","30 - Gene Associated with Autosomal Recessive Phenotype (10/08/2019)","0 - No Evidence for Haploinsufficiency (10/08/2019)","https://search.clinicalgenome.org/kb/gene-dosage/HGNC:11529","Dosage Working Group","","","","","",""
"EPHX1","HGNC:3401","https://search.clinicalgenome.org/kb/genes/HGNC:3401","hereditary nonpolyposis colon cancer","MONDO:0018630","https://search.clinicalgenome.org/kb/conditions/MONDO:0018630","Autosomal dominant inheritance","","","","","limited evidence (11/08/2016)","https://search.clinicalgenome.org/kb/gene-validity/CGGCIEX:assertion_8431","Colon Cancer","","",""
"EPM2A","HGNC:3413","https://search.clinicalgenome.org/kb/genes/HGNC:3413","Lafora disease","MONDO:0009697","https://search.clinicalgenome.org/kb/conditions/MONDO:0009697","Autosomal recessive inheritance","30 - Gene Associated with Autosomal Recessive Phenotype (08/22/2016)","0 - No Evidence for Haploinsufficiency (08/22/2016)","https://search.clinicalgenome.org/kb/gene-dosage/HGNC:3413","Dosage Working Group","definitive evidence (05/23/2020)","https://search.clinicalgenome.org/kb/gene-validity/CGGV:assertion_f970ced6-0164-41ed-9e1f-1fb9f892bca6-2020-05-23T190000.000Z","Epilepsy","","",""
"EPS8","HGNC:3420","https://search.clinicalgenome.org/kb/genes/HGNC:3420","autosomal recessive nonsyndromic hearing loss 102","MONDO:0014428","https://search.clinicalgenome.org/kb/conditions/MONDO:0014428","Autosomal recessive inheritance","30 - Gene Associated with Autosomal Recessive Phenotype (02/07/2018)","0 - No Evidence for Haploinsufficiency (02/07/2018)","https://search.clinicalgenome.org/kb/gene-dosage/HGNC:3420","Dosage Working Group","moderate evidence (02/06/2020)","https://search.clinicalgenome.org/kb/gene-validity/CGGV:assertion_7a6bd2bf-8ede-45cb-a1c1-65ee5221b440-2020-02-06T171614.553Z","Hearing Loss","","",""
"EPS8L2","HGNC:21296","https://search.clinicalgenome.org/kb/genes/HGNC:21296","nonsyndromic genetic hearing loss","MONDO:0019497","https://search.clinicalgenome.org/kb/conditions/MONDO:0019497","Autosomal recessive inheritance","","","","","moderate evidence (02/05/2020)","https://search.clinicalgenome.org/kb/gene-validity/CGGV:assertion_e0022ad7-8497-4139-94a7-2546ba482c88-2020-02-05T170000.000Z","Hearing Loss","","",""
"ERBB4","HGNC:3432","https://search.clinicalgenome.org/kb/genes/HGNC:3432","amyotrophic lateral sclerosis type 19","MONDO:0014223","https://search.clinicalgenome.org/kb/conditions/MONDO:0014223","Autosomal dominant inheritance","","","","","limited evidence (09/30/2021)","https://search.clinicalgenome.org/kb/gene-validity/CGGV:assertion_fdd26ab6-0c1f-4322-9f70-cad651bb789f-2021-09-30T143144.993Z","Amyotrophic Lateral Sclerosis Spectrum Disorders","","",""
"ERCC1","HGNC:3433","https://search.clinicalgenome.org/kb/genes/HGNC:3433","cerebrooculofacioskeletal syndrome 4","MONDO:0012554","https://search.clinicalgenome.org/kb/conditions/MONDO:0012554","N/A","30 - Gene Associated with Autosomal Recessive Phenotype (08/22/2016)","","https://search.clinicalgenome.org/kb/gene-dosage/HGNC:3433","Dosage Working Group","","","","","",""
"ERCC2","HGNC:3434","https://search.clinicalgenome.org/kb/genes/HGNC:3434","xeroderma pigmentosum group D","MONDO:0010212","https://search.clinicalgenome.org/kb/conditions/MONDO:0010212","Autosomal recessive inheritance","30 - Gene Associated with Autosomal Recessive Phenotype (08/22/2016)","","https://search.clinicalgenome.org/kb/gene-dosage/HGNC:3434","Dosage Working Group","definitive evidence (11/02/2018)","https://search.clinicalgenome.org/kb/gene-validity/CGGV:assertion_91d0c244-d958-4358-8b92-cefefbce3843-2018-11-02T214605.275Z","Hereditary Cancer","","",""
"ERCC3","HGNC:3435","https://search.clinicalgenome.org/kb/genes/HGNC:3435","xeroderma pigmentosum group B","MONDO:0012531","https://search.clinicalgenome.org/kb/conditions/MONDO:0012531","Autosomal recessive inheritance","30 - Gene Associated with Autosomal Recessive Phenotype (06/30/2020)","0 - No Evidence for Haploinsufficiency (06/30/2020)","https://search.clinicalgenome.org/kb/gene-dosage/HGNC:3435","Dosage Working Group","definitive evidence (11/02/2018)","https://search.clinicalgenome.org/kb/gene-validity/CGGV:assertion_bf09deab-9612-4b13-8bb7-4c2a25dde868-2018-11-02T213956.524Z","Hereditary Cancer","","",""
"ERCC4","HGNC:3436","https://search.clinicalgenome.org/kb/genes/HGNC:3436","xeroderma pigmentosum group F","MONDO:0010215","https://search.clinicalgenome.org/kb/conditions/MONDO:0010215","Autosomal recessive inheritance","","","","","definitive evidence (08/14/2019)","https://search.clinicalgenome.org/kb/gene-validity/CGGV:assertion_89544dc5-2d3b-4b7f-b835-3fec714bf7a5-2019-08-14T194406.189Z","Hereditary Cancer","","",""
"ERCC5","HGNC:3437","https://search.clinicalgenome.org/kb/genes/HGNC:3437","xeroderma pigmentosum group G","MONDO:0010216","https://search.clinicalgenome.org/kb/conditions/MONDO:0010216","Autosomal recessive inheritance","30 - Gene Associated with Autosomal Recessive Phenotype (08/22/2016)","","https://search.clinicalgenome.org/kb/gene-dosage/HGNC:3437","Dosage Working Group","definitive evidence (11/02/2018)","https://search.clinicalgenome.org/kb/gene-validity/CGGV:assertion_fc08c954-8ded-449b-8f67-e4f044b26cda-2018-11-02T215619.763Z","Hereditary Cancer","","",""
"ERCC6L2","HGNC:26922","https://search.clinicalgenome.org/kb/genes/HGNC:26922","pancytopenia-developmental delay syndrome","MONDO:0014317","https://search.clinicalgenome.org/kb/conditions/MONDO:0014317","N/A","30 - Gene Associated with Autosomal Recessive Phenotype (08/22/2016)","0 - No Evidence for Haploinsufficiency (08/22/2016)","https://search.clinicalgenome.org/kb/gene-dosage/HGNC:26922","Dosage Working Group","","","","","",""
"ERCC8","HGNC:3439","https://search.clinicalgenome.org/kb/genes/HGNC:3439","Cockayne syndrome type 1","MONDO:0019569","https://search.clinicalgenome.org/kb/conditions/MONDO:0019569","N/A","30 - Gene Associated with Autosomal Recessive Phenotype (08/22/2016)","0 - No Evidence for Haploinsufficiency (08/22/2016)","https://search.clinicalgenome.org/kb/gene-dosage/HGNC:3439","Dosage Working Group","","","","","",""
"ERF","HGNC:3444","https://search.clinicalgenome.org/kb/genes/HGNC:3444","craniosynostosis 4","MONDO:0010929","https://search.clinicalgenome.org/kb/conditions/MONDO:0010929","Autosomal dominant inheritance","3 - Sufficient Evidence for Haploinsufficiency (06/08/2021)","0 - No Evidence for Haploinsufficiency (06/08/2021)","https://search.clinicalgenome.org/kb/gene-dosage/HGNC:3444","Dosage Working Group","definitive evidence (06/12/2021)","https://search.clinicalgenome.org/kb/gene-validity/CGGV:assertion_1954ba97-532a-4ef3-9d62-c4ebfd252084-2021-06-12T062024.684Z","Craniofacial Malformations","","",""
"ERLIN1","HGNC:16947","https://search.clinicalgenome.org/kb/genes/HGNC:16947","amyotrophic lateral sclerosis","MONDO:0004976","https://search.clinicalgenome.org/kb/conditions/MONDO:0004976","Autosomal recessive inheritance","","","","","limited evidence (07/27/2021)","https://search.clinicalgenome.org/kb/gene-validity/CGGV:assertion_d668c62f-b002-4015-a629-ecbebed40e59-2021-07-27T160919.089Z","Amyotrophic Lateral Sclerosis Spectrum Disorders","","",""
"ESCO2","HGNC:27230","https://search.clinicalgenome.org/kb/genes/HGNC:27230","Roberts-SC phocomelia syndrome","MONDO:0100253","https://search.clinicalgenome.org/kb/conditions/MONDO:0100253","Autosomal recessive inheritance","30 - Gene Associated with Autosomal Recessive Phenotype (08/22/2016)","","https://search.clinicalgenome.org/kb/gene-dosage/HGNC:27230","Dosage Working Group","definitive evidence (07/30/2021)","https://search.clinicalgenome.org/kb/gene-validity/CGGV:assertion_4020105e-bc43-4365-9540-9a8f77b37fae-2021-07-30T142327.055Z","Syndromic Disorders","","",""
"ESPN","HGNC:13281","https://search.clinicalgenome.org/kb/genes/HGNC:13281","nonsyndromic genetic hearing loss","MONDO:0019497","https://search.clinicalgenome.org/kb/conditions/MONDO:0019497","Autosomal dominant inheritance | Autosomal recessive inheritance","30 - Gene Associated with Autosomal Recessive Phenotype (02/07/2018)","0 - No Evidence for Haploinsufficiency (02/07/2018)","https://search.clinicalgenome.org/kb/gene-dosage/HGNC:13281","Dosage Working Group","limited evidence (09/20/2018) | definitive evidence (02/27/2018)","https://search.clinicalgenome.org/kb/gene-validity/CGGV:assertion_9bdbd958-1ad2-447a-9ccd-ed86f308577a-2018-09-20T200322.775Z | https://search.clinicalgenome.org/kb/gene-validity/CGGV:assertion_7c63a581-ad69-4f18-b68b-d1b2cef5e699-2018-02-27T170000.000Z","Hearing Loss | Hearing Loss","Strong Actionability (10/29/2020)","https://search.clinicalgenome.org/kb/gene-validity/https://actionability.clinicalgenome.org/ac/Pediatric/ui/stg2SummaryRpt?doc=AC1018","Pediatric Actionability Working Group"
"ESPN","HGNC:13281","https://search.clinicalgenome.org/kb/genes/HGNC:13281","prelingual non-syndromic genetic hearing loss","MONDO:0016297","https://search.clinicalgenome.org/kb/conditions/MONDO:0016297","N/A","30 - Gene Associated with Autosomal Recessive Phenotype (02/07/2018)","0 - No Evidence for Haploinsufficiency (02/07/2018)","https://search.clinicalgenome.org/kb/gene-dosage/HGNC:13281","Dosage Working Group","","","","Strong Actionability (10/29/2020)","https://search.clinicalgenome.org/kb/gene-validity/https://actionability.clinicalgenome.org/ac/Pediatric/ui/stg2SummaryRpt?doc=AC1018","Pediatric Actionability Working Group"
"ESPN","HGNC:13281","https://search.clinicalgenome.org/kb/genes/HGNC:13281","hearing loss, autosomal recessive","MONDO:0019588","https://search.clinicalgenome.org/kb/conditions/MONDO:0019588","N/A","30 - Gene Associated with Autosomal Recessive Phenotype (02/07/2018)","0 - No Evidence for Haploinsufficiency (02/07/2018)","https://search.clinicalgenome.org/kb/gene-dosage/HGNC:13281","Dosage Working Group","","","","Strong Actionability (10/29/2020)","https://search.clinicalgenome.org/kb/gene-validity/https://actionability.clinicalgenome.org/ac/Pediatric/ui/stg2SummaryRpt?doc=AC1018","Pediatric Actionability Working Group"
"ESPN","HGNC:13281","https://search.clinicalgenome.org/kb/genes/HGNC:13281","autosomal recessive nonsyndromic hearing loss 36","MONDO:0012170","https://search.clinicalgenome.org/kb/conditions/MONDO:0012170","N/A","30 - Gene Associated with Autosomal Recessive Phenotype (02/07/2018)","0 - No Evidence for Haploinsufficiency (02/07/2018)","https://search.clinicalgenome.org/kb/gene-dosage/HGNC:13281","Dosage Working Group","","","","Strong Actionability (10/29/2020)","https://search.clinicalgenome.org/kb/gene-validity/https://actionability.clinicalgenome.org/ac/Pediatric/ui/stg2SummaryRpt?doc=AC1018","Pediatric Actionability Working Group"
"ESRRB","HGNC:3473","https://search.clinicalgenome.org/kb/genes/HGNC:3473","nonsyndromic genetic hearing loss","MONDO:0019497","https://search.clinicalgenome.org/kb/conditions/MONDO:0019497","Autosomal recessive inheritance","","","","","definitive evidence (04/24/2018)","https://search.clinicalgenome.org/kb/gene-validity/CGGV:assertion_03c875bb-70aa-4652-a7f2-35df1065165b-2018-04-24T160000.000Z","Hearing Loss","Strong Actionability (10/29/2020)","https://search.clinicalgenome.org/kb/gene-validity/https://actionability.clinicalgenome.org/ac/Pediatric/ui/stg2SummaryRpt?doc=AC1018","Pediatric Actionability Working Group"
"ESRRB","HGNC:3473","https://search.clinicalgenome.org/kb/genes/HGNC:3473","autosomal recessive nonsyndromic hearing loss 35","MONDO:0012060","https://search.clinicalgenome.org/kb/conditions/MONDO:0012060","N/A","","","","","","","","Strong Actionability (10/29/2020)","https://search.clinicalgenome.org/kb/gene-validity/https://actionability.clinicalgenome.org/ac/Pediatric/ui/stg2SummaryRpt?doc=AC1018","Pediatric Actionability Working Group"
"ESRRB","HGNC:3473","https://search.clinicalgenome.org/kb/genes/HGNC:3473","prelingual non-syndromic genetic hearing loss","MONDO:0016297","https://search.clinicalgenome.org/kb/conditions/MONDO:0016297","N/A","","","","","","","","Strong Actionability (10/29/2020)","https://search.clinicalgenome.org/kb/gene-validity/https://actionability.clinicalgenome.org/ac/Pediatric/ui/stg2SummaryRpt?doc=AC1018","Pediatric Actionability Working Group"
"ESRRB","HGNC:3473","https://search.clinicalgenome.org/kb/genes/HGNC:3473","hearing loss, autosomal recessive","MONDO:0019588","https://search.clinicalgenome.org/kb/conditions/MONDO:0019588","N/A","","","","","","","","Strong Actionability (10/29/2020)","https://search.clinicalgenome.org/kb/gene-validity/https://actionability.clinicalgenome.org/ac/Pediatric/ui/stg2SummaryRpt?doc=AC1018","Pediatric Actionability Working Group"
"ETFA","HGNC:3481","https://search.clinicalgenome.org/kb/genes/HGNC:3481","multiple acyl-CoA dehydrogenase deficiency","MONDO:0009282","https://search.clinicalgenome.org/kb/conditions/MONDO:0009282","Autosomal recessive inheritance","","","","","definitive evidence (05/22/2018)","https://search.clinicalgenome.org/kb/gene-validity/CGGV:assertion_3d6848e7-6e9e-4545-9f97-69480face058-2018-05-22T160000.000Z","Fatty Acid Oxidation Disorders","","",""
"ETFB","HGNC:3482","https://search.clinicalgenome.org/kb/genes/HGNC:3482","multiple acyl-CoA dehydrogenase deficiency","MONDO:0009282","https://search.clinicalgenome.org/kb/conditions/MONDO:0009282","Autosomal recessive inheritance","30 - Gene Associated with Autosomal Recessive Phenotype (08/22/2016)","0 - No Evidence for Haploinsufficiency (08/22/2016)","https://search.clinicalgenome.org/kb/gene-dosage/HGNC:3482","Dosage Working Group","moderate evidence (12/16/2020)","https://search.clinicalgenome.org/kb/gene-validity/CGGV:assertion_d9a8d844-c82a-4258-bd48-10e2d977273e-2020-12-16T181720.992Z","Fatty Acid Oxidation Disorders","","",""
"ETFDH","HGNC:3483","https://search.clinicalgenome.org/kb/genes/HGNC:3483","multiple acyl-CoA dehydrogenase deficiency","MONDO:0009282","https://search.clinicalgenome.org/kb/conditions/MONDO:0009282","Autosomal recessive inheritance","30 - Gene Associated with Autosomal Recessive Phenotype (08/22/2016)","","https://search.clinicalgenome.org/kb/gene-dosage/HGNC:3483","Dosage Working Group","definitive evidence (05/22/2018)","https://search.clinicalgenome.org/kb/gene-validity/CGGV:assertion_062e336e-cfda-45f7-b509-cd44a5079034-2018-05-22T160000.000Z","Fatty Acid Oxidation Disorders","","",""
"ETHE1","HGNC:23287","https://search.clinicalgenome.org/kb/genes/HGNC:23287","Leigh syndrome","MONDO:0009723","https://search.clinicalgenome.org/kb/conditions/MONDO:0009723","Autosomal recessive inheritance","","","","","definitive evidence (04/08/2019)","https://search.clinicalgenome.org/kb/gene-validity/CGGV:assertion_d29d908d-ea85-4eb4-a6a5-400c95511c9a-2019-04-08T161759.443Z","Mitochondrial Diseases","","",""
"ETV6","HGNC:3495","https://search.clinicalgenome.org/kb/genes/HGNC:3495","thrombocytopenia 5","MONDO:0014536","https://search.clinicalgenome.org/kb/conditions/MONDO:0014536","Autosomal dominant inheritance","","","","","definitive evidence (01/22/2020)","https://search.clinicalgenome.org/kb/gene-validity/CGGV:assertion_92a8c1cb-91c1-45cd-adbe-4180b1f6da7d-2020-01-22T170000.000Z","Hemostasis Thrombosis","","",""
"EVC2","HGNC:19747","https://search.clinicalgenome.org/kb/genes/HGNC:19747","Ellis-van Creveld syndrome","MONDO:0009162","https://search.clinicalgenome.org/kb/conditions/MONDO:0009162","N/A","30 - Gene Associated with Autosomal Recessive Phenotype (07/18/2013)","0 - No Evidence for Haploinsufficiency (07/18/2013)","https://search.clinicalgenome.org/kb/gene-dosage/HGNC:19747","Dosage Working Group","","","","","",""
"EXO1","HGNC:3511","https://search.clinicalgenome.org/kb/genes/HGNC:3511","hereditary nonpolyposis colon cancer","MONDO:0018630","https://search.clinicalgenome.org/kb/conditions/MONDO:0018630","Autosomal dominant inheritance","","","","","disputing (06/08/2017)","https://search.clinicalgenome.org/kb/gene-validity/CGGCIEX:assertion_8432","Colon Cancer","","",""
"EXOSC3","HGNC:17944","https://search.clinicalgenome.org/kb/genes/HGNC:17944","pontocerebellar hypoplasia type 1B","MONDO:0013853","https://search.clinicalgenome.org/kb/conditions/MONDO:0013853","N/A","30 - Gene Associated with Autosomal Recessive Phenotype (08/22/2016)","0 - No Evidence for Haploinsufficiency (08/22/2016)","https://search.clinicalgenome.org/kb/gene-dosage/HGNC:17944","Dosage Working Group","","","","","",""
"EXPH5","HGNC:30578","https://search.clinicalgenome.org/kb/genes/HGNC:30578","epidermolysis bullosa simplex 4, localized or generalized intermediate, autosomal recessive","MONDO:0014014","https://search.clinicalgenome.org/kb/conditions/MONDO:0014014","N/A","30 - Gene Associated with Autosomal Recessive Phenotype (08/22/2016)","0 - No Evidence for Haploinsufficiency (08/22/2016)","https://search.clinicalgenome.org/kb/gene-dosage/HGNC:30578","Dosage Working Group","","","","","",""
"EXT1","HGNC:3512","https://search.clinicalgenome.org/kb/genes/HGNC:3512","exostoses, multiple, type 1","MONDO:0007585","https://search.clinicalgenome.org/kb/conditions/MONDO:0007585","Autosomal dominant inheritance","3 - Sufficient Evidence for Haploinsufficiency (06/17/2020)","0 - No Evidence for Haploinsufficiency (06/17/2020)","https://search.clinicalgenome.org/kb/gene-dosage/HGNC:3512","Dosage Working Group","definitive evidence (06/04/2018)","https://search.clinicalgenome.org/kb/gene-validity/CGGV:assertion_0ced1387-c0a8-4f03-bd70-1595cb7683fd-2018-06-04T192029.946Z","Hereditary Cancer","","",""
"EXT2","HGNC:3513","https://search.clinicalgenome.org/kb/genes/HGNC:3513","exostoses, multiple, type 2","MONDO:0007586","https://search.clinicalgenome.org/kb/conditions/MONDO:0007586","Autosomal dominant inheritance","3 - Sufficient Evidence for Haploinsufficiency (06/23/2020)","0 - No Evidence for Haploinsufficiency (06/23/2020)","https://search.clinicalgenome.org/kb/gene-dosage/HGNC:3513","Dosage Working Group","definitive evidence (12/21/2018)","https://search.clinicalgenome.org/kb/gene-validity/CGGV:assertion_9e6829ce-3e0b-44c5-a214-756f33b1e948-2018-12-21T153126.680Z","Hereditary Cancer","","",""
"EYA1","HGNC:3519","https://search.clinicalgenome.org/kb/genes/HGNC:3519","branchio-oto-renal syndrome","MONDO:0007029","https://search.clinicalgenome.org/kb/conditions/MONDO:0007029","Autosomal dominant inheritance","3 - Sufficient Evidence for Haploinsufficiency (08/26/2020)","0 - No Evidence for Haploinsufficiency (08/26/2020)","https://search.clinicalgenome.org/kb/gene-dosage/HGNC:3519","Dosage Working Group","definitive evidence (08/30/2018)","https://search.clinicalgenome.org/kb/gene-validity/CGGV:assertion_dca41ef6-ee63-4b1f-93d3-8b114dafcc58-2018-08-30T144802.507Z","Hearing Loss","","",""
"EYA1","HGNC:3519","https://search.clinicalgenome.org/kb/genes/HGNC:3519","branchiootorenal syndrome 1","MONDO:0007236","https://search.clinicalgenome.org/kb/conditions/MONDO:0007236","N/A","3 - Sufficient Evidence for Haploinsufficiency (08/26/2020)","0 - No Evidence for Haploinsufficiency (08/26/2020)","https://search.clinicalgenome.org/kb/gene-dosage/HGNC:3519","Dosage Working Group","","","","","",""
"EYA4","HGNC:3522","https://search.clinicalgenome.org/kb/genes/HGNC:3522","nonsyndromic genetic hearing loss","MONDO:0019497","https://search.clinicalgenome.org/kb/conditions/MONDO:0019497","Autosomal dominant inheritance","3 - Sufficient Evidence for Haploinsufficiency (01/22/2020)","0 - No Evidence for Haploinsufficiency (01/22/2020)","https://search.clinicalgenome.org/kb/gene-dosage/HGNC:3522","Dosage Working Group","definitive evidence (01/05/2018)","https://search.clinicalgenome.org/kb/gene-validity/CGGV:assertion_21c75059-bd7b-48ef-a828-28ffebe52ca0-2018-01-05T170000.000Z","Hearing Loss","","",""
"EYA4","HGNC:3522","https://search.clinicalgenome.org/kb/genes/HGNC:3522","dilated cardiomyopathy 1J","MONDO:0011541","https://search.clinicalgenome.org/kb/conditions/MONDO:0011541","Autosomal dominant inheritance","3 - Sufficient Evidence for Haploinsufficiency (01/22/2020)","0 - No Evidence for Haploinsufficiency (01/22/2020)","https://search.clinicalgenome.org/kb/gene-dosage/HGNC:3522","Dosage Working Group","limited evidence (11/30/2020)","https://search.clinicalgenome.org/kb/gene-validity/CGGV:assertion_5e0a0bad-1f7a-402e-af19-a80453653b86-2020-11-30T170000.000Z","Dilated Cardiomyopathy","","",""
"EYA4","HGNC:3522","https://search.clinicalgenome.org/kb/genes/HGNC:3522","autosomal dominant nonsyndromic hearing loss 10","MONDO:0011031","https://search.clinicalgenome.org/kb/conditions/MONDO:0011031","N/A","3 - Sufficient Evidence for Haploinsufficiency (01/22/2020)","0 - No Evidence for Haploinsufficiency (01/22/2020)","https://search.clinicalgenome.org/kb/gene-dosage/HGNC:3522","Dosage Working Group","","","","","",""
"EYS","HGNC:21555","https://search.clinicalgenome.org/kb/genes/HGNC:21555","retinitis pigmentosa 25","MONDO:0011272","https://search.clinicalgenome.org/kb/conditions/MONDO:0011272","N/A","30 - Gene Associated with Autosomal Recessive Phenotype (08/22/2016)","","https://search.clinicalgenome.org/kb/gene-dosage/HGNC:21555","Dosage Working Group","","","","","",""
"F10","HGNC:3528","https://search.clinicalgenome.org/kb/genes/HGNC:3528","congenital factor X deficiency","MONDO:0009212","https://search.clinicalgenome.org/kb/conditions/MONDO:0009212","Autosomal recessive inheritance","30 - Gene Associated with Autosomal Recessive Phenotype (08/22/2016)","","https://search.clinicalgenome.org/kb/gene-dosage/HGNC:3528","Dosage Working Group","definitive evidence (11/27/2019)","https://search.clinicalgenome.org/kb/gene-validity/CGGV:assertion_4adcc848-b354-4975-801f-4b55bbca64ad-2019-11-27T170000.000Z","Hemostasis Thrombosis","","",""
"F11","HGNC:3529","https://search.clinicalgenome.org/kb/genes/HGNC:3529","congenital factor XI deficiency","MONDO:0012897","https://search.clinicalgenome.org/kb/conditions/MONDO:0012897","Semidominant inheritance","","","","","definitive evidence (10/23/2019)","https://search.clinicalgenome.org/kb/gene-validity/CGGV:assertion_a57ba9d9-45c5-48bc-b939-7593f67a86ed-2019-10-23T160000.000Z","Hemostasis Thrombosis","Strong Actionability (07/19/2018)","https://search.clinicalgenome.org/kb/gene-validity/https://actionability.clinicalgenome.org/ac/Adult/ui/stg2SummaryRpt?doc=AC153","Adult Actionability Working Group"
"F12","HGNC:3530","https://search.clinicalgenome.org/kb/genes/HGNC:3530","hereditary angioedema type 3","MONDO:0012526","https://search.clinicalgenome.org/kb/conditions/MONDO:0012526","Autosomal dominant inheritance","","","","","moderate evidence (05/25/2022)","https://search.clinicalgenome.org/kb/gene-validity/CGGV:assertion_f40992c9-1172-4528-ab53-95108094d4b6-2022-05-25T160000.000Z","Hemostasis Thrombosis","","",""
"F12","HGNC:3530","https://search.clinicalgenome.org/kb/genes/HGNC:3530","congenital factor XII deficiency","MONDO:0009315","https://search.clinicalgenome.org/kb/conditions/MONDO:0009315","Autosomal recessive inheritance","","","","","definitive evidence (01/22/2020)","https://search.clinicalgenome.org/kb/gene-validity/CGGV:assertion_50bbe8d0-4feb-43c7-8573-9d7f85c82e54-2020-01-22T170000.000Z","Hemostasis Thrombosis","","",""
"F13A1","HGNC:3531","https://search.clinicalgenome.org/kb/genes/HGNC:3531","factor XIII, A subunit, deficiency of","MONDO:0013187","https://search.clinicalgenome.org/kb/conditions/MONDO:0013187","Autosomal recessive inheritance","30 - Gene Associated with Autosomal Recessive Phenotype (08/22/2016)","0 - No Evidence for Haploinsufficiency (08/22/2016)","https://search.clinicalgenome.org/kb/gene-dosage/HGNC:3531","Dosage Working Group","definitive evidence (07/22/2020)","https://search.clinicalgenome.org/kb/gene-validity/CGGV:assertion_dd9321a7-f45d-419e-94ce-101ab545a847-2020-07-22T160000.000Z","Hemostasis Thrombosis","","",""
"F13B","HGNC:3534","https://search.clinicalgenome.org/kb/genes/HGNC:3534","factor XIII, b subunit, deficiency of","MONDO:0013190","https://search.clinicalgenome.org/kb/conditions/MONDO:0013190","Autosomal recessive inheritance","30 - Gene Associated with Autosomal Recessive Phenotype (08/22/2016)","0 - No Evidence for Haploinsufficiency (08/22/2016)","https://search.clinicalgenome.org/kb/gene-dosage/HGNC:3534","Dosage Working Group","definitive evidence (07/22/2020)","https://search.clinicalgenome.org/kb/gene-validity/CGGV:assertion_403b3588-323c-4103-9207-cc9c8be12281-2020-07-22T160000.000Z","Hemostasis Thrombosis","","",""
"F2","HGNC:3535","https://search.clinicalgenome.org/kb/genes/HGNC:3535","congenital prothrombin deficiency","MONDO:0013361","https://search.clinicalgenome.org/kb/conditions/MONDO:0013361","Autosomal recessive inheritance","","","","","definitive evidence (06/24/2020)","https://search.clinicalgenome.org/kb/gene-validity/CGGV:assertion_6ba9c4b9-9984-4d31-a9ae-bf638838f201-2020-06-24T160000.000Z","Hemostasis Thrombosis","","",""
"F2","HGNC:3535","https://search.clinicalgenome.org/kb/genes/HGNC:3535","thrombophilia due to thrombin defect","MONDO:0008559","https://search.clinicalgenome.org/kb/conditions/MONDO:0008559","Autosomal dominant inheritance","","","","","definitive evidence (06/24/2020)","https://search.clinicalgenome.org/kb/gene-validity/CGGV:assertion_6389b3a3-ef86-4588-9be8-eb79dcb8d3cd-2020-06-24T160000.000Z","Hemostasis Thrombosis","","",""
"F5","HGNC:3542","https://search.clinicalgenome.org/kb/genes/HGNC:3542","congenital factor V deficiency","MONDO:0009210","https://search.clinicalgenome.org/kb/conditions/MONDO:0009210","Autosomal recessive inheritance","30 - Gene Associated with Autosomal Recessive Phenotype (01/11/2018)","0 - No Evidence for Haploinsufficiency (01/11/2018)","https://search.clinicalgenome.org/kb/gene-dosage/HGNC:3542","Dosage Working Group","definitive evidence (03/25/2020)","https://search.clinicalgenome.org/kb/gene-validity/CGGV:assertion_beaa3af3-7d91-4d53-b081-de0e660c16c6-2020-03-25T160000.000Z","Hemostasis Thrombosis","Assertion Pending (11/10/2017)","https://search.clinicalgenome.org/kb/gene-validity/https://actionability.clinicalgenome.org/ac/Adult/ui/stg2SummaryRpt?doc=AC149","Adult Actionability Working Group"
"F5","HGNC:3542","https://search.clinicalgenome.org/kb/genes/HGNC:3542","thrombophilia due to activated protein C resistance","MONDO:0008560","https://search.clinicalgenome.org/kb/conditions/MONDO:0008560","Autosomal dominant inheritance","30 - Gene Associated with Autosomal Recessive Phenotype (01/11/2018)","0 - No Evidence for Haploinsufficiency (01/11/2018)","https://search.clinicalgenome.org/kb/gene-dosage/HGNC:3542","Dosage Working Group","definitive evidence (09/30/2019)","https://search.clinicalgenome.org/kb/gene-validity/CGGV:assertion_ab28e09c-08ff-4149-a536-3cdb9cc4099f-2019-09-30T160000.000Z","Hemostasis Thrombosis","Assertion Pending (11/02/2015) | Assertion Pending (04/04/2016)","https://search.clinicalgenome.org/kb/gene-validity/https://actionability.clinicalgenome.org/ac/Adult/ui/stg2SummaryRpt?doc=AC106 | https://search.clinicalgenome.org/kb/gene-validity/https://actionability.clinicalgenome.org/ac/Adult/ui/stg2SummaryRpt?doc=AC105","Adult Actionability Working Group | Adult Actionability Working Group"
"F7","HGNC:3544","https://search.clinicalgenome.org/kb/genes/HGNC:3544","factor VII deficiency","MONDO:0002244","https://search.clinicalgenome.org/kb/conditions/MONDO:0002244","Autosomal recessive inheritance","30 - Gene Associated with Autosomal Recessive Phenotype (08/22/2016)","","https://search.clinicalgenome.org/kb/gene-dosage/HGNC:3544","Dosage Working Group","definitive evidence (07/24/2019)","https://search.clinicalgenome.org/kb/gene-validity/CGGV:assertion_43fb4e99-e97a-4d9c-af11-79c2b09ecd2e-2019-07-24T160000.000Z","Hemostasis Thrombosis","Strong Actionability (05/29/2021) | Strong Actionability (05/29/2021)","https://search.clinicalgenome.org/kb/gene-validity/https://actionability.clinicalgenome.org/ac/Adult/ui/stg2SummaryRpt?doc=AC1038 | https://search.clinicalgenome.org/kb/gene-validity/https://actionability.clinicalgenome.org/ac/Pediatric/ui/stg2SummaryRpt?doc=AC1038","Adult Actionability Working Group | Pediatric Actionability Working Group"
"F7","HGNC:3544","https://search.clinicalgenome.org/kb/genes/HGNC:3544","congenital factor VII deficiency","MONDO:0009211","https://search.clinicalgenome.org/kb/conditions/MONDO:0009211","N/A","30 - Gene Associated with Autosomal Recessive Phenotype (08/22/2016)","","https://search.clinicalgenome.org/kb/gene-dosage/HGNC:3544","Dosage Working Group","","","","Strong Actionability (05/29/2021) | Strong Actionability (05/29/2021)","https://search.clinicalgenome.org/kb/gene-validity/https://actionability.clinicalgenome.org/ac/Adult/ui/stg2SummaryRpt?doc=AC1038 | https://search.clinicalgenome.org/kb/gene-validity/https://actionability.clinicalgenome.org/ac/Pediatric/ui/stg2SummaryRpt?doc=AC1038","Adult Actionability Working Group | Pediatric Actionability Working Group"
"F8","HGNC:3546","https://search.clinicalgenome.org/kb/genes/HGNC:3546","hemophilia A","MONDO:0010602","https://search.clinicalgenome.org/kb/conditions/MONDO:0010602","X-linked inheritance","3 - Sufficient Evidence for Haploinsufficiency (10/13/2020)","0 - No Evidence for Haploinsufficiency (10/13/2020)","https://search.clinicalgenome.org/kb/gene-dosage/HGNC:3546","Dosage Working Group","definitive evidence (07/24/2019)","https://search.clinicalgenome.org/kb/gene-validity/CGGV:assertion_d4578f11-b635-45f4-8034-310fca5fe960-2019-07-24T160000.000Z","Hemostasis Thrombosis","Assertion Pending (07/27/2016)","https://search.clinicalgenome.org/kb/gene-validity/https://actionability.clinicalgenome.org/ac/Adult/ui/stg2SummaryRpt?doc=AC044","Adult Actionability Working Group"
"F8","HGNC:3546","https://search.clinicalgenome.org/kb/genes/HGNC:3546","hemophilia","MONDO:0018660","https://search.clinicalgenome.org/kb/conditions/MONDO:0018660","N/A","3 - Sufficient Evidence for Haploinsufficiency (10/13/2020)","0 - No Evidence for Haploinsufficiency (10/13/2020)","https://search.clinicalgenome.org/kb/gene-dosage/HGNC:3546","Dosage Working Group","","","","Assertion Pending (07/27/2016)","https://search.clinicalgenome.org/kb/gene-validity/https://actionability.clinicalgenome.org/ac/Adult/ui/stg2SummaryRpt?doc=AC044","Adult Actionability Working Group"
"F9","HGNC:3551","https://search.clinicalgenome.org/kb/genes/HGNC:3551","thrombophilia, X-linked, due to factor 9 defect","MONDO:0010432","https://search.clinicalgenome.org/kb/conditions/MONDO:0010432","X-linked inheritance","3 - Sufficient Evidence for Haploinsufficiency (01/12/2021)","0 - No Evidence for Haploinsufficiency (01/12/2021)","https://search.clinicalgenome.org/kb/gene-dosage/HGNC:3551","Dosage Working Group","limited evidence (06/24/2020)","https://search.clinicalgenome.org/kb/gene-validity/CGGV:assertion_9b3a7f2c-a07a-4a10-b1f7-78642ebdaa5d-2020-06-24T160000.000Z","Hemostasis Thrombosis","","",""
"F9","HGNC:3551","https://search.clinicalgenome.org/kb/genes/HGNC:3551","hemophilia B","MONDO:0010604","https://search.clinicalgenome.org/kb/conditions/MONDO:0010604","X-linked inheritance","3 - Sufficient Evidence for Haploinsufficiency (01/12/2021)","0 - No Evidence for Haploinsufficiency (01/12/2021)","https://search.clinicalgenome.org/kb/gene-dosage/HGNC:3551","Dosage Working Group","definitive evidence (05/22/2019)","https://search.clinicalgenome.org/kb/gene-validity/CGGV:assertion_3d56d08d-48d0-4523-b433-dbd44c5b9e45-2019-05-22T190226.728Z","Hemostasis Thrombosis","Assertion Pending (07/27/2016)","https://search.clinicalgenome.org/kb/gene-validity/https://actionability.clinicalgenome.org/ac/Adult/ui/stg2SummaryRpt?doc=AC044","Adult Actionability Working Group"
"F9","HGNC:3551","https://search.clinicalgenome.org/kb/genes/HGNC:3551","hemophilia","MONDO:0018660","https://search.clinicalgenome.org/kb/conditions/MONDO:0018660","N/A","3 - Sufficient Evidence for Haploinsufficiency (01/12/2021)","0 - No Evidence for Haploinsufficiency (01/12/2021)","https://search.clinicalgenome.org/kb/gene-dosage/HGNC:3551","Dosage Working Group","","","","Assertion Pending (07/27/2016)","https://search.clinicalgenome.org/kb/gene-validity/https://actionability.clinicalgenome.org/ac/Adult/ui/stg2SummaryRpt?doc=AC044","Adult Actionability Working Group"
"FA2H","HGNC:21197","https://search.clinicalgenome.org/kb/genes/HGNC:21197","hereditary spastic paraplegia 35","MONDO:0012866","https://search.clinicalgenome.org/kb/conditions/MONDO:0012866","N/A","30 - Gene Associated with Autosomal Recessive Phenotype (08/22/2016)","","https://search.clinicalgenome.org/kb/gene-dosage/HGNC:21197","Dosage Working Group","","","","","",""
"FADD","HGNC:3573","https://search.clinicalgenome.org/kb/genes/HGNC:3573","FADD-related immunodeficiency","MONDO:0013408","https://search.clinicalgenome.org/kb/conditions/MONDO:0013408","N/A","30 - Gene Associated with Autosomal Recessive Phenotype (08/22/2016)","0 - No Evidence for Haploinsufficiency (08/22/2016)","https://search.clinicalgenome.org/kb/gene-dosage/HGNC:3573","Dosage Working Group","","","","","",""
"FAH","HGNC:3579","https://search.clinicalgenome.org/kb/genes/HGNC:3579","tyrosinemia type I","MONDO:0010161","https://search.clinicalgenome.org/kb/conditions/MONDO:0010161","Autosomal recessive inheritance","30 - Gene Associated with Autosomal Recessive Phenotype (09/02/2020)","0 - No Evidence for Haploinsufficiency (09/02/2020)","https://search.clinicalgenome.org/kb/gene-dosage/HGNC:3579","Dosage Working Group","definitive evidence (06/29/2020)","https://search.clinicalgenome.org/kb/gene-validity/CGGV:assertion_39c50699-f422-4bae-89ac-af13ef7cb8cc-2020-06-29T174149.440Z","Aminoacidopathy","","",""
"FAM161A","HGNC:25808","https://search.clinicalgenome.org/kb/genes/HGNC:25808","retinitis pigmentosa 28","MONDO:0011630","https://search.clinicalgenome.org/kb/conditions/MONDO:0011630","N/A","30 - Gene Associated with Autosomal Recessive Phenotype (08/22/2016)","0 - No Evidence for Haploinsufficiency (08/22/2016)","https://search.clinicalgenome.org/kb/gene-dosage/HGNC:25808","Dosage Working Group","","","","","",""
"FAM20C","HGNC:22140","https://search.clinicalgenome.org/kb/genes/HGNC:22140","lethal osteosclerotic bone dysplasia","MONDO:0009821","https://search.clinicalgenome.org/kb/conditions/MONDO:0009821","N/A","30 - Gene Associated with Autosomal Recessive Phenotype (08/22/2016)","","https://search.clinicalgenome.org/kb/gene-dosage/HGNC:22140","Dosage Working Group","","","","","",""
"FAN1","HGNC:29170","https://search.clinicalgenome.org/kb/genes/HGNC:29170","hereditary nonpolyposis colon cancer","MONDO:0018630","https://search.clinicalgenome.org/kb/conditions/MONDO:0018630","Autosomal dominant inheritance","30 - Gene Associated with Autosomal Recessive Phenotype (08/22/2016)","0 - No Evidence for Haploinsufficiency (08/22/2016)","https://search.clinicalgenome.org/kb/gene-dosage/HGNC:29170","Dosage Working Group","limited evidence (10/23/2017)","https://search.clinicalgenome.org/kb/gene-validity/CGGCIEX:assertion_9863","Colon Cancer","","",""
"FAN1","HGNC:29170","https://search.clinicalgenome.org/kb/genes/HGNC:29170","karyomegalic interstitial nephritis","MONDO:0013898","https://search.clinicalgenome.org/kb/conditions/MONDO:0013898","N/A","30 - Gene Associated with Autosomal Recessive Phenotype (08/22/2016)","0 - No Evidence for Haploinsufficiency (08/22/2016)","https://search.clinicalgenome.org/kb/gene-dosage/HGNC:29170","Dosage Working Group","","","","","",""
"FANCA","HGNC:3582","https://search.clinicalgenome.org/kb/genes/HGNC:3582","Fanconi anemia complementation group A","MONDO:0009215","https://search.clinicalgenome.org/kb/conditions/MONDO:0009215","Autosomal recessive inheritance","30 - Gene Associated with Autosomal Recessive Phenotype (02/23/2012)","0 - No Evidence for Haploinsufficiency (02/23/2012)","https://search.clinicalgenome.org/kb/gene-dosage/HGNC:3582","Dosage Working Group","definitive evidence (12/21/2018)","https://search.clinicalgenome.org/kb/gene-validity/CGGV:assertion_ceecf6ee-6700-40e5-a0d3-f7891805daac-2018-12-21T152348.098Z","Hereditary Cancer","","",""
"FANCA","HGNC:3582","https://search.clinicalgenome.org/kb/genes/HGNC:3582","Fanconi anemia complementation group D1","MONDO:0011584","https://search.clinicalgenome.org/kb/conditions/MONDO:0011584","N/A","30 - Gene Associated with Autosomal Recessive Phenotype (02/23/2012)","0 - No Evidence for Haploinsufficiency (02/23/2012)","https://search.clinicalgenome.org/kb/gene-dosage/HGNC:3582","Dosage Working Group","","","","Moderate Actionability (10/28/2019) | Moderate Actionability (10/28/2019)","https://search.clinicalgenome.org/kb/gene-validity/https://actionability.clinicalgenome.org/ac/Adult/ui/stg2SummaryRpt?doc=AC1008 | https://search.clinicalgenome.org/kb/gene-validity/https://actionability.clinicalgenome.org/ac/Pediatric/ui/stg2SummaryRpt?doc=AC1008","Adult Actionability Working Group | Pediatric Actionability Working Group"
"FANCA","HGNC:3582","https://search.clinicalgenome.org/kb/genes/HGNC:3582","Fanconi anemia","MONDO:0019391","https://search.clinicalgenome.org/kb/conditions/MONDO:0019391","N/A","30 - Gene Associated with Autosomal Recessive Phenotype (02/23/2012)","0 - No Evidence for Haploinsufficiency (02/23/2012)","https://search.clinicalgenome.org/kb/gene-dosage/HGNC:3582","Dosage Working Group","","","","Moderate Actionability (10/28/2019) | Moderate Actionability (10/28/2019)","https://search.clinicalgenome.org/kb/gene-validity/https://actionability.clinicalgenome.org/ac/Adult/ui/stg2SummaryRpt?doc=AC1008 | https://search.clinicalgenome.org/kb/gene-validity/https://actionability.clinicalgenome.org/ac/Pediatric/ui/stg2SummaryRpt?doc=AC1008","Adult Actionability Working Group | Pediatric Actionability Working Group"
"FANCB","HGNC:3583","https://search.clinicalgenome.org/kb/genes/HGNC:3583","Fanconi anemia complementation group B","MONDO:0010351","https://search.clinicalgenome.org/kb/conditions/MONDO:0010351","N/A","3 - Sufficient Evidence for Haploinsufficiency (06/23/2021)","0 - No Evidence for Haploinsufficiency (06/23/2021)","https://search.clinicalgenome.org/kb/gene-dosage/HGNC:3583","Dosage Working Group","","","","","",""
"FANCC","HGNC:3584","https://search.clinicalgenome.org/kb/genes/HGNC:3584","Fanconi anemia complementation group C","MONDO:0009213","https://search.clinicalgenome.org/kb/conditions/MONDO:0009213","Autosomal recessive inheritance","30 - Gene Associated with Autosomal Recessive Phenotype (08/22/2016)","0 - No Evidence for Haploinsufficiency (08/22/2016)","https://search.clinicalgenome.org/kb/gene-dosage/HGNC:3584","Dosage Working Group","definitive evidence (12/21/2018)","https://search.clinicalgenome.org/kb/gene-validity/CGGV:assertion_cf4881c3-15b3-4e10-bd24-2da80433863b-2018-12-21T152145.877Z","Hereditary Cancer","Moderate Actionability (10/28/2019) | Moderate Actionability (10/28/2019)","https://search.clinicalgenome.org/kb/gene-validity/https://actionability.clinicalgenome.org/ac/Adult/ui/stg2SummaryRpt?doc=AC1008 | https://search.clinicalgenome.org/kb/gene-validity/https://actionability.clinicalgenome.org/ac/Pediatric/ui/stg2SummaryRpt?doc=AC1008","Adult Actionability Working Group | Pediatric Actionability Working Group"
"FANCC","HGNC:3584","https://search.clinicalgenome.org/kb/genes/HGNC:3584","Fanconi anemia","MONDO:0019391","https://search.clinicalgenome.org/kb/conditions/MONDO:0019391","N/A","30 - Gene Associated with Autosomal Recessive Phenotype (08/22/2016)","0 - No Evidence for Haploinsufficiency (08/22/2016)","https://search.clinicalgenome.org/kb/gene-dosage/HGNC:3584","Dosage Working Group","","","","Moderate Actionability (10/28/2019) | Moderate Actionability (10/28/2019)","https://search.clinicalgenome.org/kb/gene-validity/https://actionability.clinicalgenome.org/ac/Adult/ui/stg2SummaryRpt?doc=AC1008 | https://search.clinicalgenome.org/kb/gene-validity/https://actionability.clinicalgenome.org/ac/Pediatric/ui/stg2SummaryRpt?doc=AC1008","Adult Actionability Working Group | Pediatric Actionability Working Group"
"FANCD2","HGNC:3585","https://search.clinicalgenome.org/kb/genes/HGNC:3585","Fanconi anemia complementation group D2","MONDO:0009214","https://search.clinicalgenome.org/kb/conditions/MONDO:0009214","Autosomal recessive inheritance","30 - Gene Associated with Autosomal Recessive Phenotype (08/22/2016)","","https://search.clinicalgenome.org/kb/gene-dosage/HGNC:3585","Dosage Working Group","definitive evidence (06/15/2021)","https://search.clinicalgenome.org/kb/gene-validity/CGGV:assertion_5f0c260f-52d2-4225-9044-608f066ccfb2-2021-06-15T231506.767Z","Hereditary Cancer","","",""
"FANCE","HGNC:3586","https://search.clinicalgenome.org/kb/genes/HGNC:3586","Fanconi anemia complementation group E","MONDO:0010953","https://search.clinicalgenome.org/kb/conditions/MONDO:0010953","Autosomal recessive inheritance","30 - Gene Associated with Autosomal Recessive Phenotype (06/12/2020)","0 - No Evidence for Haploinsufficiency (06/12/2020)","https://search.clinicalgenome.org/kb/gene-dosage/HGNC:3586","Dosage Working Group","definitive evidence (05/14/2020)","https://search.clinicalgenome.org/kb/gene-validity/CGGV:assertion_6da55a6e-2cf8-499c-b842-b5a435dbff3f-2020-05-14T001745.604Z","Hereditary Cancer","","",""
"FANCF","HGNC:3587","https://search.clinicalgenome.org/kb/genes/HGNC:3587","Fanconi anemia complementation group F","MONDO:0011325","https://search.clinicalgenome.org/kb/conditions/MONDO:0011325","Autosomal recessive inheritance","30 - Gene Associated with Autosomal Recessive Phenotype (08/22/2016)","0 - No Evidence for Haploinsufficiency (08/22/2016)","https://search.clinicalgenome.org/kb/gene-dosage/HGNC:3587","Dosage Working Group","definitive evidence (02/03/2021)","https://search.clinicalgenome.org/kb/gene-validity/CGGV:assertion_60719ed8-36fa-4d11-93b2-8036133510a6-2021-02-03T225456.822Z","Hereditary Cancer","","",""
"FANCG","HGNC:3588","https://search.clinicalgenome.org/kb/genes/HGNC:3588","Fanconi anemia complementation group G","MONDO:0013565","https://search.clinicalgenome.org/kb/conditions/MONDO:0013565","Autosomal recessive inheritance","30 - Gene Associated with Autosomal Recessive Phenotype (11/15/2020)","0 - No Evidence for Haploinsufficiency (11/15/2020)","https://search.clinicalgenome.org/kb/gene-dosage/HGNC:3588","Dosage Working Group","definitive evidence (12/21/2018)","https://search.clinicalgenome.org/kb/gene-validity/CGGV:assertion_1913bd10-1355-4067-93b6-9068924d77df-2018-12-21T151935.075Z","Hereditary Cancer","","",""
"FANCG","HGNC:3588","https://search.clinicalgenome.org/kb/genes/HGNC:3588","Fanconi anemia complementation group C","MONDO:0009213","https://search.clinicalgenome.org/kb/conditions/MONDO:0009213","N/A","30 - Gene Associated with Autosomal Recessive Phenotype (11/15/2020)","0 - No Evidence for Haploinsufficiency (11/15/2020)","https://search.clinicalgenome.org/kb/gene-dosage/HGNC:3588","Dosage Working Group","","","","Moderate Actionability (10/28/2019) | Moderate Actionability (10/28/2019)","https://search.clinicalgenome.org/kb/gene-validity/https://actionability.clinicalgenome.org/ac/Adult/ui/stg2SummaryRpt?doc=AC1008 | https://search.clinicalgenome.org/kb/gene-validity/https://actionability.clinicalgenome.org/ac/Pediatric/ui/stg2SummaryRpt?doc=AC1008","Adult Actionability Working Group | Pediatric Actionability Working Group"
"FANCG","HGNC:3588","https://search.clinicalgenome.org/kb/genes/HGNC:3588","Fanconi anemia","MONDO:0019391","https://search.clinicalgenome.org/kb/conditions/MONDO:0019391","N/A","30 - Gene Associated with Autosomal Recessive Phenotype (11/15/2020)","0 - No Evidence for Haploinsufficiency (11/15/2020)","https://search.clinicalgenome.org/kb/gene-dosage/HGNC:3588","Dosage Working Group","","","","Moderate Actionability (10/28/2019) | Moderate Actionability (10/28/2019)","https://search.clinicalgenome.org/kb/gene-validity/https://actionability.clinicalgenome.org/ac/Adult/ui/stg2SummaryRpt?doc=AC1008 | https://search.clinicalgenome.org/kb/gene-validity/https://actionability.clinicalgenome.org/ac/Pediatric/ui/stg2SummaryRpt?doc=AC1008","Adult Actionability Working Group | Pediatric Actionability Working Group"
"FANCI","HGNC:25568","https://search.clinicalgenome.org/kb/genes/HGNC:25568","Fanconi anemia complementation group I","MONDO:0012186","https://search.clinicalgenome.org/kb/conditions/MONDO:0012186","Autosomal recessive inheritance","30 - Gene Associated with Autosomal Recessive Phenotype (08/22/2016)","","https://search.clinicalgenome.org/kb/gene-dosage/HGNC:25568","Dosage Working Group","definitive evidence (06/15/2021)","https://search.clinicalgenome.org/kb/gene-validity/CGGV:assertion_a103db2f-a8b3-403b-993a-ac4215c118df-2021-06-15T233841.081Z","Hereditary Cancer","","",""
"FANCL","HGNC:20748","https://search.clinicalgenome.org/kb/genes/HGNC:20748","Fanconi anemia complementation group L","MONDO:0013566","https://search.clinicalgenome.org/kb/conditions/MONDO:0013566","Autosomal recessive inheritance","","","","","definitive evidence (07/30/2020)","https://search.clinicalgenome.org/kb/gene-validity/CGGV:assertion_93d0cb5f-4859-4b28-b647-3f8226fe5921-2020-07-30T203845.671Z","Hereditary Cancer","","",""
"FAR1","HGNC:26222","https://search.clinicalgenome.org/kb/genes/HGNC:26222","fatty acyl-CoA reductase 1 deficiency","MONDO:0014510","https://search.clinicalgenome.org/kb/conditions/MONDO:0014510","Autosomal recessive inheritance","","","","","moderate evidence (04/15/2022)","https://search.clinicalgenome.org/kb/gene-validity/CGGV:assertion_91f6f864-5d07-4891-94b5-7f73bd71752c-2022-04-15T160000.000Z","Peroxisomal Disorders","","",""
"FAR1","HGNC:26222","https://search.clinicalgenome.org/kb/genes/HGNC:26222","fatty acyl-CoA reductase 1 dysregulation","MONDO:0100230","https://search.clinicalgenome.org/kb/conditions/MONDO:0100230","Autosomal dominant inheritance","","","","","moderate evidence (08/20/2021)","https://search.clinicalgenome.org/kb/gene-validity/CGGV:assertion_1068b8e8-36a1-4110-9ab4-45f9d4ece894-2021-08-20T160000.000Z","Peroxisomal Disorders","","",""
"FARS2","HGNC:21062","https://search.clinicalgenome.org/kb/genes/HGNC:21062","Leigh syndrome","MONDO:0009723","https://search.clinicalgenome.org/kb/conditions/MONDO:0009723","Autosomal recessive inheritance","30 - Gene Associated with Autosomal Recessive Phenotype (08/22/2016)","0 - No Evidence for Haploinsufficiency (08/22/2016)","https://search.clinicalgenome.org/kb/gene-dosage/HGNC:21062","Dosage Working Group","moderate evidence (11/25/2019)","https://search.clinicalgenome.org/kb/gene-validity/CGGV:assertion_2cf7594a-d934-4b6c-8052-94066d608c5a-2019-11-25T144756.827Z","Mitochondrial Diseases","","",""
"FAS","HGNC:11920","https://search.clinicalgenome.org/kb/genes/HGNC:11920","autoimmune lymphoproliferative syndrome","MONDO:0017979","https://search.clinicalgenome.org/kb/conditions/MONDO:0017979","N/A","1 - Little Evidence for Haploinsufficiency (02/08/2022)","0 - No Evidence for Haploinsufficiency (02/08/2022)","https://search.clinicalgenome.org/kb/gene-dosage/HGNC:11920","Dosage Working Group","","","","","",""
"FASLG","HGNC:11936","https://search.clinicalgenome.org/kb/genes/HGNC:11936","autoimmune lymphoproliferative syndrome type 1","MONDO:0011158","https://search.clinicalgenome.org/kb/conditions/MONDO:0011158","N/A","30 - Gene Associated with Autosomal Recessive Phenotype (08/25/2016)","0 - No Evidence for Haploinsufficiency (08/25/2016)","https://search.clinicalgenome.org/kb/gene-dosage/HGNC:11936","Dosage Working Group","","","","","",""
"FBN1","HGNC:3603","https://search.clinicalgenome.org/kb/genes/HGNC:3603","Marfan syndrome","MONDO:0007947","https://search.clinicalgenome.org/kb/conditions/MONDO:0007947","Autosomal dominant inheritance","3 - Sufficient Evidence for Haploinsufficiency (12/04/2019)","0 - No Evidence for Haploinsufficiency (12/04/2019)","https://search.clinicalgenome.org/kb/gene-dosage/HGNC:3603","Dosage Working Group","definitive evidence (03/04/2019)","https://search.clinicalgenome.org/kb/gene-validity/CGGV:assertion_d3fc0bea-4d6e-449e-885c-b204e6a0b2bf-2019-03-04T170000.000Z","General Gene Curation","Definitive Actionability (03/01/2019) | Definitive Actionability (03/01/2019)","https://search.clinicalgenome.org/kb/gene-validity/https://actionability.clinicalgenome.org/ac/Adult/ui/stg2SummaryRpt?doc=AC100 | https://search.clinicalgenome.org/kb/gene-validity/https://actionability.clinicalgenome.org/ac/Pediatric/ui/stg2SummaryRpt?doc=AC100","Adult Actionability Working Group | Pediatric Actionability Working Group"
"FBN1","HGNC:3603","https://search.clinicalgenome.org/kb/genes/HGNC:3603","familial thoracic aortic aneurysm and aortic dissection","MONDO:0019625","https://search.clinicalgenome.org/kb/conditions/MONDO:0019625","Autosomal dominant inheritance","3 - Sufficient Evidence for Haploinsufficiency (12/04/2019)","0 - No Evidence for Haploinsufficiency (12/04/2019)","https://search.clinicalgenome.org/kb/gene-dosage/HGNC:3603","Dosage Working Group","definitive evidence (01/23/2017)","https://search.clinicalgenome.org/kb/gene-validity/CGGCIEX:assertion_8251","Heritable Thoracic Aortic Aneurysm and Dissection","Strong Actionability (03/01/2019) | Strong Actionability (03/01/2019)","https://search.clinicalgenome.org/kb/gene-validity/https://actionability.clinicalgenome.org/ac/Adult/ui/stg2SummaryRpt?doc=AC134 | https://search.clinicalgenome.org/kb/gene-validity/https://actionability.clinicalgenome.org/ac/Pediatric/ui/stg2SummaryRpt?doc=AC134","Adult Actionability Working Group | Pediatric Actionability Working Group"
"FBN2","HGNC:3604","https://search.clinicalgenome.org/kb/genes/HGNC:3604","familial thoracic aortic aneurysm and aortic dissection","MONDO:0019625","https://search.clinicalgenome.org/kb/conditions/MONDO:0019625","Autosomal dominant inheritance","","","","","limited evidence (12/22/2016)","https://search.clinicalgenome.org/kb/gene-validity/CGGCIEX:assertion_8268","Heritable Thoracic Aortic Aneurysm and Dissection","","",""
"FBP1","HGNC:3606","https://search.clinicalgenome.org/kb/genes/HGNC:3606","fructose-1,6-bisphosphatase deficiency","MONDO:0009251","https://search.clinicalgenome.org/kb/conditions/MONDO:0009251","N/A","30 - Gene Associated with Autosomal Recessive Phenotype (08/22/2016)","0 - No Evidence for Haploinsufficiency (08/22/2016)","https://search.clinicalgenome.org/kb/gene-dosage/HGNC:3606","Dosage Working Group","","","","","",""
"FBXL4","HGNC:13601","https://search.clinicalgenome.org/kb/genes/HGNC:13601","Leigh syndrome","MONDO:0009723","https://search.clinicalgenome.org/kb/conditions/MONDO:0009723","Autosomal recessive inheritance","","","","","definitive evidence (11/23/2020)","https://search.clinicalgenome.org/kb/gene-validity/CGGV:assertion_fed67104-182c-48f2-85c0-ecb05cd6dd72-2020-11-23T193117.246Z","Mitochondrial Diseases","","",""
"FBXO7","HGNC:13586","https://search.clinicalgenome.org/kb/genes/HGNC:13586","parkinsonian-pyramidal syndrome","MONDO:0009830","https://search.clinicalgenome.org/kb/conditions/MONDO:0009830","N/A","30 - Gene Associated with Autosomal Recessive Phenotype (08/22/2016)","","https://search.clinicalgenome.org/kb/gene-dosage/HGNC:13586","Dosage Working Group","","","","","",""
"FBXW4","HGNC:10847","https://search.clinicalgenome.org/kb/genes/HGNC:10847","split hand-foot malformation 3","MONDO:0009525","https://search.clinicalgenome.org/kb/conditions/MONDO:0009525","N/A","0 - No Evidence for Haploinsufficiency (10/08/2014)","0 - No Evidence for Haploinsufficiency (10/08/2014)","https://search.clinicalgenome.org/kb/gene-dosage/HGNC:10847","Dosage Working Group","","","","","",""
"FERMT3","HGNC:23151","https://search.clinicalgenome.org/kb/genes/HGNC:23151","leukocyte adhesion deficiency 3","MONDO:0013016","https://search.clinicalgenome.org/kb/conditions/MONDO:0013016","Autosomal recessive inheritance","","","","","definitive evidence (08/28/2019)","https://search.clinicalgenome.org/kb/gene-validity/CGGV:assertion_df792161-5efb-45f7-91ed-5fe76045fa06-2019-08-28T160000.000Z","Hemostasis Thrombosis","","",""
"FGA","HGNC:3661","https://search.clinicalgenome.org/kb/genes/HGNC:3661","congenital fibrinogen deficiency","MONDO:0018060","https://search.clinicalgenome.org/kb/conditions/MONDO:0018060","Semidominant inheritance","","","","","definitive evidence (01/22/2020)","https://search.clinicalgenome.org/kb/gene-validity/CGGV:assertion_d34ded98-dbf7-4dc7-bea4-803db1857bf8-2020-01-22T170000.000Z","Hemostasis Thrombosis","","",""
"FGB","HGNC:3662","https://search.clinicalgenome.org/kb/genes/HGNC:3662","congenital fibrinogen deficiency","MONDO:0018060","https://search.clinicalgenome.org/kb/conditions/MONDO:0018060","Semidominant inheritance","","","","","definitive evidence (01/22/2020)","https://search.clinicalgenome.org/kb/gene-validity/CGGV:assertion_638c1588-9674-4bc3-a39c-2fc8f8b0ef09-2020-01-22T170000.000Z","Hemostasis Thrombosis","","",""
"FGD1","HGNC:3663","https://search.clinicalgenome.org/kb/genes/HGNC:3663","Aarskog-Scott syndrome, X-linked","MONDO:0010589","https://search.clinicalgenome.org/kb/conditions/MONDO:0010589","X-linked inheritance","3 - Sufficient Evidence for Haploinsufficiency (05/26/2021)","0 - No Evidence for Haploinsufficiency (05/26/2021)","https://search.clinicalgenome.org/kb/gene-dosage/HGNC:3663","Dosage Working Group","definitive evidence (12/06/2017)","https://search.clinicalgenome.org/kb/gene-validity/CGGV:assertion_4b652280-1291-4166-ac59-62caabd977bb-2017-12-06T170000.000Z","Intellectual Disability and Autism","","",""
"FGD4","HGNC:19125","https://search.clinicalgenome.org/kb/genes/HGNC:19125","Charcot-Marie-Tooth disease","MONDO:0015626","https://search.clinicalgenome.org/kb/conditions/MONDO:0015626","Autosomal recessive inheritance","30 - Gene Associated with Autosomal Recessive Phenotype (08/22/2016)","0 - No Evidence for Haploinsufficiency (08/22/2016)","https://search.clinicalgenome.org/kb/gene-dosage/HGNC:19125","Dosage Working Group","definitive evidence (04/14/2020)","https://search.clinicalgenome.org/kb/gene-validity/CGGV:assertion_e0aae8cd-9d57-4d8c-83ae-ed968cf186bc-2020-04-14T131822.010Z","Charcot-Marie-Tooth","","",""
"FGD4","HGNC:19125","https://search.clinicalgenome.org/kb/genes/HGNC:19125","Charcot-Marie-Tooth disease type 4H","MONDO:0012250","https://search.clinicalgenome.org/kb/conditions/MONDO:0012250","N/A","30 - Gene Associated with Autosomal Recessive Phenotype (08/22/2016)","0 - No Evidence for Haploinsufficiency (08/22/2016)","https://search.clinicalgenome.org/kb/gene-dosage/HGNC:19125","Dosage Working Group","","","","","",""
"FGF10","HGNC:3666","https://search.clinicalgenome.org/kb/genes/HGNC:3666","LADD syndrome","MONDO:0007872","https://search.clinicalgenome.org/kb/conditions/MONDO:0007872","N/A","3 - Sufficient Evidence for Haploinsufficiency (02/23/2022)","0 - No Evidence for Haploinsufficiency (02/23/2022)","https://search.clinicalgenome.org/kb/gene-dosage/HGNC:3666","Dosage Working Group","","","","","",""
"FGF12","HGNC:3668","https://search.clinicalgenome.org/kb/genes/HGNC:3668","developmental and epileptic encephalopathy","MONDO:0100062","https://search.clinicalgenome.org/kb/conditions/MONDO:0100062","N/A","0 - No Evidence for Haploinsufficiency (12/01/2021)","1 - Little Evidence for Haploinsufficiency (12/01/2021)","https://search.clinicalgenome.org/kb/gene-dosage/HGNC:3668","Dosage Working Group","","","","","",""
"FGF23","HGNC:3680","https://search.clinicalgenome.org/kb/genes/HGNC:3680","autosomal dominant hypophosphatemic rickets","MONDO:0008660","https://search.clinicalgenome.org/kb/conditions/MONDO:0008660","N/A","","","","","","","","Has Insufficient Evidence for Actionability Based on Early Rule-out (11/18/2021) | Limited Actionability (07/11/2018)","https://search.clinicalgenome.org/kb/gene-validity/https://actionability.clinicalgenome.org/ac/Adult/ui/stg2SummaryRpt?doc=AC010 | https://search.clinicalgenome.org/kb/gene-validity/https://actionability.clinicalgenome.org/ac/Pediatric/ui/stg2SummaryRpt?doc=AC010","Adult Actionability Working Group | Pediatric Actionability Working Group"
"FGF3","HGNC:3681","https://search.clinicalgenome.org/kb/genes/HGNC:3681","deafness with labyrinthine aplasia, microtia, and microdontia","MONDO:0012541","https://search.clinicalgenome.org/kb/conditions/MONDO:0012541","Autosomal recessive inheritance","30 - Gene Associated with Autosomal Recessive Phenotype (08/22/2016)","","https://search.clinicalgenome.org/kb/gene-dosage/HGNC:3681","Dosage Working Group","definitive evidence (05/21/2019)","https://search.clinicalgenome.org/kb/gene-validity/CGGV:assertion_5ca11e8c-6703-4be5-a8c2-82e6dcc865e4-2019-05-21T160000.000Z","Hearing Loss","","",""
"FGFR1","HGNC:3688","https://search.clinicalgenome.org/kb/genes/HGNC:3688","Hartsfield-Bixler-Demyer syndrome","MONDO:0014196","https://search.clinicalgenome.org/kb/conditions/MONDO:0014196","Autosomal dominant inheritance","3 - Sufficient Evidence for Haploinsufficiency (04/05/2021)","0 - No Evidence for Haploinsufficiency (04/05/2021)","https://search.clinicalgenome.org/kb/gene-dosage/HGNC:3688","Dosage Working Group","moderate evidence (03/16/2021)","https://search.clinicalgenome.org/kb/gene-validity/CGGV:assertion_ec5034c6-70cb-4ba3-bbb9-f65f6cad393d-2021-03-16T235509.401Z","Craniofacial Malformations","","",""
"FGFR1","HGNC:3688","https://search.clinicalgenome.org/kb/genes/HGNC:3688","osteoglophonic dwarfism","MONDO:0008150","https://search.clinicalgenome.org/kb/conditions/MONDO:0008150","Autosomal dominant inheritance","3 - Sufficient Evidence for Haploinsufficiency (04/05/2021)","0 - No Evidence for Haploinsufficiency (04/05/2021)","https://search.clinicalgenome.org/kb/gene-dosage/HGNC:3688","Dosage Working Group","limited evidence (03/22/2021)","https://search.clinicalgenome.org/kb/gene-validity/CGGV:assertion_d958e743-2ca0-4bb9-a198-364dd58005c3-2021-03-22T203501.315Z","Craniofacial Malformations","","",""
